"No.","Time","Source","Destination","Protocol","Length","Info","src_port","dst_port"
"268","19.684227462","127.0.0.1","127.0.0.1","TCP","74","59310  >  8080 [SYN] Seq=0 Win=65495 Len=0 MSS=65495 SACK_PERM TSval=515145271 TSecr=0 WS=128","59310","8080"
"269","19.684255539","127.0.0.1","127.0.0.1","TCP","74","8080  >  59310 [SYN, ACK] Seq=0 Ack=1 Win=65483 Len=0 MSS=65495 SACK_PERM TSval=515145271 TSecr=515145271 WS=128","8080","59310"
"270","19.684279494","127.0.0.1","127.0.0.1","TCP","66","59310  >  8080 [ACK] Seq=1 Ack=1 Win=65536 Len=0 TSval=515145271 TSecr=515145271","59310","8080"
"271","19.687975076","127.0.0.1","127.0.0.1","TCP","415","59310  >  8080 [PSH, ACK] Seq=1 Ack=1 Win=65536 Len=349 TSval=515145275 TSecr=515145271","59310","8080"
"272","19.688010346","127.0.0.1","127.0.0.1","TCP","66","8080  >  59310 [ACK] Seq=1 Ack=350 Win=65152 Len=0 TSval=515145275 TSecr=515145275","8080","59310"
"273","19.690123324","127.0.0.1","127.0.0.1","TCP","1411","8080  >  59310 [PSH, ACK] Seq=1 Ack=350 Win=65536 Len=1345 TSval=515145277 TSecr=515145275","8080","59310"
"274","19.690224314","127.0.0.1","127.0.0.1","TCP","66","59310  >  8080 [ACK] Seq=350 Ack=1346 Win=73088 Len=0 TSval=515145277 TSecr=515145277","59310","8080"
"275","19.697196220","127.0.0.1","127.0.0.1","TCP","361","59310  >  8080 [PSH, ACK] Seq=350 Ack=1346 Win=73088 Len=295 TSval=515145284 TSecr=515145277","59310","8080"
"276","19.699097369","127.0.0.1","127.0.0.1","TCP","831","8080  >  59310 [PSH, ACK] Seq=1346 Ack=645 Win=65536 Len=765 TSval=515145286 TSecr=515145284","8080","59310"
"277","19.701095738","127.0.0.1","127.0.0.1","TCP","119","59310  >  8080 [PSH, ACK] Seq=645 Ack=2111 Win=74368 Len=53 TSval=515145288 TSecr=515145286","59310","8080"
"278","19.704360608","127.0.0.1","127.0.0.1","TCP","74","59318  >  8080 [SYN] Seq=0 Win=65495 Len=0 MSS=65495 SACK_PERM TSval=515145291 TSecr=0 WS=128","59318","8080"
"279","19.704389103","127.0.0.1","127.0.0.1","TCP","74","8080  >  59318 [SYN, ACK] Seq=0 Ack=1 Win=65483 Len=0 MSS=65495 SACK_PERM TSval=515145291 TSecr=515145291 WS=128","8080","59318"
"280","19.704417459","127.0.0.1","127.0.0.1","TCP","66","59318  >  8080 [ACK] Seq=1 Ack=1 Win=65536 Len=0 TSval=515145291 TSecr=515145291","59318","8080"
"281","19.706083872","127.0.0.1","127.0.0.1","TCP","415","59318  >  8080 [PSH, ACK] Seq=1 Ack=1 Win=65536 Len=349 TSval=515145293 TSecr=515145291","59318","8080"
"282","19.706134995","127.0.0.1","127.0.0.1","TCP","66","8080  >  59318 [ACK] Seq=1 Ack=350 Win=65152 Len=0 TSval=515145293 TSecr=515145293","8080","59318"
"283","19.708086850","127.0.0.1","127.0.0.1","TCP","74","59334  >  8080 [SYN] Seq=0 Win=65495 Len=0 MSS=65495 SACK_PERM TSval=515145295 TSecr=0 WS=128","59334","8080"
"284","19.708123446","127.0.0.1","127.0.0.1","TCP","74","8080  >  59334 [SYN, ACK] Seq=0 Ack=1 Win=65483 Len=0 MSS=65495 SACK_PERM TSval=515145295 TSecr=515145295 WS=128","8080","59334"
"285","19.708153967","127.0.0.1","127.0.0.1","TCP","66","59334  >  8080 [ACK] Seq=1 Ack=1 Win=65536 Len=0 TSval=515145295 TSecr=515145295","59334","8080"
"286","19.708225904","127.0.0.1","127.0.0.1","TCP","1411","8080  >  59318 [PSH, ACK] Seq=1 Ack=350 Win=65536 Len=1345 TSval=515145295 TSecr=515145293","8080","59318"
"287","19.708770247","127.0.0.1","127.0.0.1","TCP","415","59334  >  8080 [PSH, ACK] Seq=1 Ack=1 Win=65536 Len=349 TSval=515145296 TSecr=515145295","59334","8080"
"288","19.708797415","127.0.0.1","127.0.0.1","TCP","66","8080  >  59334 [ACK] Seq=1 Ack=350 Win=65152 Len=0 TSval=515145296 TSecr=515145296","8080","59334"
"289","19.709709821","127.0.0.1","127.0.0.1","TCP","66","59318  >  8080 [ACK] Seq=350 Ack=1346 Win=73088 Len=0 TSval=515145297 TSecr=515145295","59318","8080"
"290","19.712266431","127.0.0.1","127.0.0.1","TCP","1411","8080  >  59334 [PSH, ACK] Seq=1 Ack=350 Win=65536 Len=1345 TSval=515145299 TSecr=515145296","8080","59334"
"291","19.712356457","127.0.0.1","127.0.0.1","TCP","66","59334  >  8080 [ACK] Seq=350 Ack=1346 Win=75008 Len=0 TSval=515145299 TSecr=515145299","59334","8080"
"292","19.713964831","127.0.0.1","127.0.0.1","TCP","361","59318  >  8080 [PSH, ACK] Seq=350 Ack=1346 Win=73088 Len=295 TSval=515145301 TSecr=515145295","59318","8080"
"295","19.715505390","127.0.0.1","127.0.0.1","TCP","1903","59310  >  8080 [PSH, ACK] Seq=698 Ack=2111 Win=74368 Len=1837 TSval=515145302 TSecr=515145286","59310","8080"
"296","19.715538286","127.0.0.1","127.0.0.1","TCP","66","8080  >  59310 [ACK] Seq=2111 Ack=2535 Win=84224 Len=0 TSval=515145302 TSecr=515145288","8080","59310"
"297","19.715681739","127.0.0.1","127.0.0.1","TCP","831","8080  >  59318 [PSH, ACK] Seq=1346 Ack=645 Win=65536 Len=765 TSval=515145303 TSecr=515145301","8080","59318"
"298","19.717409124","127.0.0.1","127.0.0.1","TCP","74","59350  >  8080 [SYN] Seq=0 Win=65495 Len=0 MSS=65495 SACK_PERM TSval=515145304 TSecr=0 WS=128","59350","8080"
"299","19.717436781","127.0.0.1","127.0.0.1","TCP","74","8080  >  59350 [SYN, ACK] Seq=0 Ack=1 Win=65483 Len=0 MSS=65495 SACK_PERM TSval=515145304 TSecr=515145304 WS=128","8080","59350"
"300","19.717461644","127.0.0.1","127.0.0.1","TCP","66","59350  >  8080 [ACK] Seq=1 Ack=1 Win=65536 Len=0 TSval=515145304 TSecr=515145304","59350","8080"
"301","19.718038603","127.0.0.1","127.0.0.1","TCP","415","59350  >  8080 [PSH, ACK] Seq=1 Ack=1 Win=65536 Len=349 TSval=515145305 TSecr=515145304","59350","8080"
"302","19.718059486","127.0.0.1","127.0.0.1","TCP","66","8080  >  59350 [ACK] Seq=1 Ack=350 Win=65152 Len=0 TSval=515145305 TSecr=515145305","8080","59350"
"303","19.719470559","127.0.0.1","127.0.0.1","TCP","74","59352  >  8080 [SYN] Seq=0 Win=65495 Len=0 MSS=65495 SACK_PERM TSval=515145306 TSecr=0 WS=128","59352","8080"
"304","19.719500521","127.0.0.1","127.0.0.1","TCP","74","8080  >  59352 [SYN, ACK] Seq=0 Ack=1 Win=65483 Len=0 MSS=65495 SACK_PERM TSval=515145306 TSecr=515145306 WS=128","8080","59352"
"305","19.719526781","127.0.0.1","127.0.0.1","TCP","66","59352  >  8080 [ACK] Seq=1 Ack=1 Win=65536 Len=0 TSval=515145306 TSecr=515145306","59352","8080"
"306","19.719689442","127.0.0.1","127.0.0.1","TCP","74","59358  >  8080 [SYN] Seq=0 Win=65495 Len=0 MSS=65495 SACK_PERM TSval=515145307 TSecr=0 WS=128","59358","8080"
"307","19.719713607","127.0.0.1","127.0.0.1","TCP","74","8080  >  59358 [SYN, ACK] Seq=0 Ack=1 Win=65483 Len=0 MSS=65495 SACK_PERM TSval=515145307 TSecr=515145307 WS=128","8080","59358"
"308","19.719734629","127.0.0.1","127.0.0.1","TCP","66","59358  >  8080 [ACK] Seq=1 Ack=1 Win=65536 Len=0 TSval=515145307 TSecr=515145307","59358","8080"
"309","19.720210737","127.0.0.1","127.0.0.1","TCP","415","59352  >  8080 [PSH, ACK] Seq=1 Ack=1 Win=65536 Len=349 TSval=515145307 TSecr=515145306","59352","8080"
"310","19.720235251","127.0.0.1","127.0.0.1","TCP","66","8080  >  59352 [ACK] Seq=1 Ack=350 Win=65152 Len=0 TSval=515145307 TSecr=515145307","8080","59352"
"311","19.720350978","127.0.0.1","127.0.0.1","TCP","415","59358  >  8080 [PSH, ACK] Seq=1 Ack=1 Win=65536 Len=349 TSval=515145307 TSecr=515145307","59358","8080"
"312","19.720371581","127.0.0.1","127.0.0.1","TCP","66","8080  >  59358 [ACK] Seq=1 Ack=350 Win=65152 Len=0 TSval=515145307 TSecr=515145307","8080","59358"
"313","19.721357321","127.0.0.1","127.0.0.1","TCP","119","59318  >  8080 [PSH, ACK] Seq=645 Ack=2111 Win=74368 Len=53 TSval=515145308 TSecr=515145303","59318","8080"
"314","19.722060274","127.0.0.1","127.0.0.1","TCP","361","59334  >  8080 [PSH, ACK] Seq=350 Ack=1346 Win=75008 Len=295 TSval=515145309 TSecr=515145299","59334","8080"
"317","19.731083627","127.0.0.1","127.0.0.1","TCP","74","59366  >  8080 [SYN] Seq=0 Win=65495 Len=0 MSS=65495 SACK_PERM TSval=515145318 TSecr=0 WS=128","59366","8080"
"318","19.731115126","127.0.0.1","127.0.0.1","TCP","74","8080  >  59366 [SYN, ACK] Seq=0 Ack=1 Win=65483 Len=0 MSS=65495 SACK_PERM TSval=515145318 TSecr=515145318 WS=128","8080","59366"
"319","19.731142783","127.0.0.1","127.0.0.1","TCP","66","59366  >  8080 [ACK] Seq=1 Ack=1 Win=65536 Len=0 TSval=515145318 TSecr=515145318","59366","8080"
"320","19.731695507","127.0.0.1","127.0.0.1","TCP","1903","59318  >  8080 [PSH, ACK] Seq=698 Ack=2111 Win=74368 Len=1837 TSval=515145319 TSecr=515145303","59318","8080"
"321","19.731730846","127.0.0.1","127.0.0.1","TCP","66","8080  >  59318 [ACK] Seq=2111 Ack=2535 Win=83584 Len=0 TSval=515145319 TSecr=515145308","8080","59318"
"322","19.733404523","127.0.0.1","127.0.0.1","TCP","415","59366  >  8080 [PSH, ACK] Seq=1 Ack=1 Win=65536 Len=349 TSval=515145320 TSecr=515145318","59366","8080"
"323","19.733435602","127.0.0.1","127.0.0.1","TCP","66","8080  >  59366 [ACK] Seq=1 Ack=350 Win=65152 Len=0 TSval=515145320 TSecr=515145320","8080","59366"
"324","19.743048556","127.0.0.1","127.0.0.1","TCP","74","59372  >  8080 [SYN] Seq=0 Win=65495 Len=0 MSS=65495 SACK_PERM TSval=515145330 TSecr=0 WS=128","59372","8080"
"325","19.743091159","127.0.0.1","127.0.0.1","TCP","74","8080  >  59372 [SYN, ACK] Seq=0 Ack=1 Win=65483 Len=0 MSS=65495 SACK_PERM TSval=515145330 TSecr=515145330 WS=128","8080","59372"
"326","19.743121679","127.0.0.1","127.0.0.1","TCP","66","59372  >  8080 [ACK] Seq=1 Ack=1 Win=65536 Len=0 TSval=515145330 TSecr=515145330","59372","8080"
"327","19.744533800","127.0.0.1","127.0.0.1","TCP","415","59372  >  8080 [PSH, ACK] Seq=1 Ack=1 Win=65536 Len=349 TSval=515145331 TSecr=515145330","59372","8080"
"328","19.744566486","127.0.0.1","127.0.0.1","TCP","66","8080  >  59372 [ACK] Seq=1 Ack=350 Win=65152 Len=0 TSval=515145331 TSecr=515145331","8080","59372"
"329","19.751318461","127.0.0.1","127.0.0.1","TCP","74","59386  >  8080 [SYN] Seq=0 Win=65495 Len=0 MSS=65495 SACK_PERM TSval=515145338 TSecr=0 WS=128","59386","8080"
"330","19.751347585","127.0.0.1","127.0.0.1","TCP","74","8080  >  59386 [SYN, ACK] Seq=0 Ack=1 Win=65483 Len=0 MSS=65495 SACK_PERM TSval=515145338 TSecr=515145338 WS=128","8080","59386"
"331","19.751378106","127.0.0.1","127.0.0.1","TCP","66","59386  >  8080 [ACK] Seq=1 Ack=1 Win=65536 Len=0 TSval=515145338 TSecr=515145338","59386","8080"
"332","19.752020506","127.0.0.1","127.0.0.1","TCP","415","59386  >  8080 [PSH, ACK] Seq=1 Ack=1 Win=65536 Len=349 TSval=515145339 TSecr=515145338","59386","8080"
"333","19.752046208","127.0.0.1","127.0.0.1","TCP","66","8080  >  59386 [ACK] Seq=1 Ack=350 Win=65152 Len=0 TSval=515145339 TSecr=515145339","8080","59386"
"334","19.755435046","127.0.0.1","127.0.0.1","TCP","831","8080  >  59334 [PSH, ACK] Seq=1346 Ack=645 Win=65536 Len=765 TSval=515145342 TSecr=515145309","8080","59334"
"335","19.758114577","127.0.0.1","127.0.0.1","TCP","74","59394  >  8080 [SYN] Seq=0 Win=65495 Len=0 MSS=65495 SACK_PERM TSval=515145345 TSecr=0 WS=128","59394","8080"
"336","19.758148869","127.0.0.1","127.0.0.1","TCP","74","8080  >  59394 [SYN, ACK] Seq=0 Ack=1 Win=65483 Len=0 MSS=65495 SACK_PERM TSval=515145345 TSecr=515145345 WS=128","8080","59394"
"337","19.758176037","127.0.0.1","127.0.0.1","TCP","66","59394  >  8080 [ACK] Seq=1 Ack=1 Win=65536 Len=0 TSval=515145345 TSecr=515145345","59394","8080"
"338","19.758757116","127.0.0.1","127.0.0.1","TCP","74","59402  >  8080 [SYN] Seq=0 Win=65495 Len=0 MSS=65495 SACK_PERM TSval=515145346 TSecr=0 WS=128","59402","8080"
"339","19.758790361","127.0.0.1","127.0.0.1","TCP","74","8080  >  59402 [SYN, ACK] Seq=0 Ack=1 Win=65483 Len=0 MSS=65495 SACK_PERM TSval=515145346 TSecr=515145346 WS=128","8080","59402"
"340","19.758914818","127.0.0.1","127.0.0.1","TCP","415","59394  >  8080 [PSH, ACK] Seq=1 Ack=1 Win=65536 Len=349 TSval=515145346 TSecr=515145345","59394","8080"
"341","19.758934513","127.0.0.1","127.0.0.1","TCP","66","8080  >  59394 [ACK] Seq=1 Ack=350 Win=65152 Len=0 TSval=515145346 TSecr=515145346","8080","59394"
"342","19.759714431","127.0.0.1","127.0.0.1","TCP","66","59402  >  8080 [ACK] Seq=1 Ack=1 Win=65536 Len=0 TSval=515145347 TSecr=515145346","59402","8080"
"343","19.760513764","127.0.0.1","127.0.0.1","TCP","1411","8080  >  59350 [PSH, ACK] Seq=1 Ack=350 Win=65536 Len=1345 TSval=515145347 TSecr=515145305","8080","59350"
"344","19.760573339","127.0.0.1","127.0.0.1","TCP","66","59350  >  8080 [ACK] Seq=350 Ack=1346 Win=75008 Len=0 TSval=515145347 TSecr=515145347","59350","8080"
"345","19.760602463","127.0.0.1","127.0.0.1","TCP","415","59402  >  8080 [PSH, ACK] Seq=1 Ack=1 Win=65536 Len=349 TSval=515145347 TSecr=515145346","59402","8080"
"346","19.760650653","127.0.0.1","127.0.0.1","TCP","66","8080  >  59402 [ACK] Seq=1 Ack=350 Win=65152 Len=0 TSval=515145348 TSecr=515145347","8080","59402"
"347","19.761758266","127.0.0.1","127.0.0.1","TCP","119","59334  >  8080 [PSH, ACK] Seq=645 Ack=2111 Win=75392 Len=53 TSval=515145349 TSecr=515145342","59334","8080"
"348","19.761994609","127.0.0.1","127.0.0.1","TCP","74","59406  >  8080 [SYN] Seq=0 Win=65495 Len=0 MSS=65495 SACK_PERM TSval=515145349 TSecr=0 WS=128","59406","8080"
"349","19.762020799","127.0.0.1","127.0.0.1","TCP","74","8080  >  59406 [SYN, ACK] Seq=0 Ack=1 Win=65483 Len=0 MSS=65495 SACK_PERM TSval=515145349 TSecr=515145349 WS=128","8080","59406"
"350","19.762044755","127.0.0.1","127.0.0.1","TCP","66","59406  >  8080 [ACK] Seq=1 Ack=1 Win=65536 Len=0 TSval=515145349 TSecr=515145349","59406","8080"
"351","19.762683523","127.0.0.1","127.0.0.1","TCP","415","59406  >  8080 [PSH, ACK] Seq=1 Ack=1 Win=65536 Len=349 TSval=515145350 TSecr=515145349","59406","8080"
"352","19.762708876","127.0.0.1","127.0.0.1","TCP","66","8080  >  59406 [ACK] Seq=1 Ack=350 Win=65152 Len=0 TSval=515145350 TSecr=515145350","8080","59406"
"353","19.763334933","127.0.0.1","127.0.0.1","TCP","1411","8080  >  59352 [PSH, ACK] Seq=1 Ack=350 Win=65536 Len=1345 TSval=515145350 TSecr=515145307","8080","59352"
"354","19.763397860","127.0.0.1","127.0.0.1","TCP","66","59352  >  8080 [ACK] Seq=350 Ack=1346 Win=75008 Len=0 TSval=515145350 TSecr=515145350","59352","8080"
"355","19.763909308","127.0.0.1","127.0.0.1","TCP","74","59410  >  8080 [SYN] Seq=0 Win=65495 Len=0 MSS=65495 SACK_PERM TSval=515145351 TSecr=0 WS=128","59410","8080"
"356","19.763923276","127.0.0.1","127.0.0.1","TCP","74","59412  >  8080 [SYN] Seq=0 Win=65495 Len=0 MSS=65495 SACK_PERM TSval=515145351 TSecr=0 WS=128","59412","8080"
"357","19.763946952","127.0.0.1","127.0.0.1","TCP","74","8080  >  59412 [SYN, ACK] Seq=0 Ack=1 Win=65483 Len=0 MSS=65495 SACK_PERM TSval=515145351 TSecr=515145351 WS=128","8080","59412"
"358","19.763946952","127.0.0.1","127.0.0.1","TCP","74","8080  >  59410 [SYN, ACK] Seq=0 Ack=1 Win=65483 Len=0 MSS=65495 SACK_PERM TSval=515145351 TSecr=515145351 WS=128","8080","59410"
"359","19.763971815","127.0.0.1","127.0.0.1","TCP","66","59412  >  8080 [ACK] Seq=1 Ack=1 Win=65536 Len=0 TSval=515145351 TSecr=515145351","59412","8080"
"360","19.763971815","127.0.0.1","127.0.0.1","TCP","66","59410  >  8080 [ACK] Seq=1 Ack=1 Win=65536 Len=0 TSval=515145351 TSecr=515145351","59410","8080"
"361","19.764660101","127.0.0.1","127.0.0.1","TCP","415","59410  >  8080 [PSH, ACK] Seq=1 Ack=1 Win=65536 Len=349 TSval=515145351 TSecr=515145351","59410","8080"
"362","19.764660101","127.0.0.1","127.0.0.1","TCP","415","59412  >  8080 [PSH, ACK] Seq=1 Ack=1 Win=65536 Len=349 TSval=515145351 TSecr=515145351","59412","8080"
"363","19.764686222","127.0.0.1","127.0.0.1","TCP","66","8080  >  59412 [ACK] Seq=1 Ack=350 Win=65152 Len=0 TSval=515145352 TSecr=515145351","8080","59412"
"364","19.764686222","127.0.0.1","127.0.0.1","TCP","66","8080  >  59410 [ACK] Seq=1 Ack=350 Win=65152 Len=0 TSval=515145352 TSecr=515145351","8080","59410"
"365","19.765116514","127.0.0.1","127.0.0.1","TCP","361","59350  >  8080 [PSH, ACK] Seq=350 Ack=1346 Win=75008 Len=295 TSval=515145352 TSecr=515145347","59350","8080"
"366","19.765154089","127.0.0.1","127.0.0.1","TCP","66","8080  >  59350 [ACK] Seq=1346 Ack=645 Win=65280 Len=0 TSval=515145352 TSecr=515145352","8080","59350"
"367","19.766185225","127.0.0.1","127.0.0.1","TCP","361","59352  >  8080 [PSH, ACK] Seq=350 Ack=1346 Win=75008 Len=295 TSval=515145353 TSecr=515145350","59352","8080"
"368","19.766213371","127.0.0.1","127.0.0.1","TCP","66","8080  >  59352 [ACK] Seq=1346 Ack=645 Win=65280 Len=0 TSval=515145353 TSecr=515145353","8080","59352"
"369","19.767326152","127.0.0.1","127.0.0.1","TCP","74","59422  >  8080 [SYN] Seq=0 Win=65495 Len=0 MSS=65495 SACK_PERM TSval=515145354 TSecr=0 WS=128","59422","8080"
"370","19.767356184","127.0.0.1","127.0.0.1","TCP","1411","8080  >  59358 [PSH, ACK] Seq=1 Ack=350 Win=65536 Len=1345 TSval=515145354 TSecr=515145307","8080","59358"
"371","19.767356184","127.0.0.1","127.0.0.1","TCP","74","8080  >  59422 [SYN, ACK] Seq=0 Ack=1 Win=65483 Len=0 MSS=65495 SACK_PERM TSval=515145354 TSecr=515145354 WS=128","8080","59422"
"372","19.767380629","127.0.0.1","127.0.0.1","TCP","66","59422  >  8080 [ACK] Seq=1 Ack=1 Win=65536 Len=0 TSval=515145354 TSecr=515145354","59422","8080"
"373","19.767407727","127.0.0.1","127.0.0.1","TCP","66","59358  >  8080 [ACK] Seq=350 Ack=1346 Win=75008 Len=0 TSval=515145354 TSecr=515145354","59358","8080"
"374","19.767993067","127.0.0.1","127.0.0.1","TCP","74","59436  >  8080 [SYN] Seq=0 Win=65495 Len=0 MSS=65495 SACK_PERM TSval=515145355 TSecr=0 WS=128","59436","8080"
"375","19.768022959","127.0.0.1","127.0.0.1","TCP","74","8080  >  59436 [SYN, ACK] Seq=0 Ack=1 Win=65483 Len=0 MSS=65495 SACK_PERM TSval=515145355 TSecr=515145355 WS=128","8080","59436"
"376","19.768041746","127.0.0.1","127.0.0.1","TCP","415","59422  >  8080 [PSH, ACK] Seq=1 Ack=1 Win=65536 Len=349 TSval=515145355 TSecr=515145354","59422","8080"
"377","19.768049429","127.0.0.1","127.0.0.1","TCP","66","59436  >  8080 [ACK] Seq=1 Ack=1 Win=65536 Len=0 TSval=515145355 TSecr=515145355","59436","8080"
"378","19.768063746","127.0.0.1","127.0.0.1","TCP","66","8080  >  59422 [ACK] Seq=1 Ack=350 Win=65152 Len=0 TSval=515145355 TSecr=515145355","8080","59422"
"379","19.768721861","127.0.0.1","127.0.0.1","TCP","415","59436  >  8080 [PSH, ACK] Seq=1 Ack=1 Win=65536 Len=349 TSval=515145356 TSecr=515145355","59436","8080"
"380","19.768747003","127.0.0.1","127.0.0.1","TCP","66","8080  >  59436 [ACK] Seq=1 Ack=350 Win=65152 Len=0 TSval=515145356 TSecr=515145356","8080","59436"
"381","19.769595086","127.0.0.1","127.0.0.1","TCP","831","8080  >  59350 [PSH, ACK] Seq=1346 Ack=645 Win=65536 Len=765 TSval=515145356 TSecr=515145352","8080","59350"
"382","19.769595086","127.0.0.1","127.0.0.1","TCP","361","59358  >  8080 [PSH, ACK] Seq=350 Ack=1346 Win=75008 Len=295 TSval=515145356 TSecr=515145354","59358","8080"
"383","19.769647118","127.0.0.1","127.0.0.1","TCP","66","8080  >  59358 [ACK] Seq=1346 Ack=645 Win=65280 Len=0 TSval=515145356 TSecr=515145356","8080","59358"
"386","19.771136134","127.0.0.1","127.0.0.1","TCP","831","8080  >  59352 [PSH, ACK] Seq=1346 Ack=645 Win=65536 Len=765 TSval=515145358 TSecr=515145353","8080","59352"
"387","19.771183766","127.0.0.1","127.0.0.1","TCP","119","59350  >  8080 [PSH, ACK] Seq=645 Ack=2111 Win=75392 Len=53 TSval=515145358 TSecr=515145356","59350","8080"
"388","19.771338953","127.0.0.1","127.0.0.1","TCP","1904","59334  >  8080 [PSH, ACK] Seq=698 Ack=2111 Win=75392 Len=1838 TSval=515145358 TSecr=515145342","59334","8080"
"389","19.771359975","127.0.0.1","127.0.0.1","TCP","66","8080  >  59334 [ACK] Seq=2111 Ack=2536 Win=84224 Len=0 TSval=515145358 TSecr=515145349","8080","59334"
"390","19.772759804","127.0.0.1","127.0.0.1","TCP","120","59352  >  8080 [PSH, ACK] Seq=645 Ack=2111 Win=75392 Len=54 TSval=515145360 TSecr=515145358","59352","8080"
"391","19.773945080","127.0.0.1","127.0.0.1","TCP","1411","8080  >  59366 [PSH, ACK] Seq=1 Ack=350 Win=65536 Len=1345 TSval=515145361 TSecr=515145320","8080","59366"
"392","19.773986566","127.0.0.1","127.0.0.1","TCP","66","59366  >  8080 [ACK] Seq=350 Ack=1346 Win=75008 Len=0 TSval=515145361 TSecr=515145361","59366","8080"
"393","19.776060363","127.0.0.1","127.0.0.1","TCP","74","59450  >  8080 [SYN] Seq=0 Win=65495 Len=0 MSS=65495 SACK_PERM TSval=515145363 TSecr=0 WS=128","59450","8080"
"394","19.776112395","127.0.0.1","127.0.0.1","TCP","74","8080  >  59450 [SYN, ACK] Seq=0 Ack=1 Win=65483 Len=0 MSS=65495 SACK_PERM TSval=515145363 TSecr=515145363 WS=128","8080","59450"
"395","19.776147734","127.0.0.1","127.0.0.1","TCP","66","59450  >  8080 [ACK] Seq=1 Ack=1 Win=65536 Len=0 TSval=515145363 TSecr=515145363","59450","8080"
"396","19.777034300","127.0.0.1","127.0.0.1","TCP","415","59450  >  8080 [PSH, ACK] Seq=1 Ack=1 Win=65536 Len=349 TSval=515145364 TSecr=515145363","59450","8080"
"397","19.777063423","127.0.0.1","127.0.0.1","TCP","66","8080  >  59450 [ACK] Seq=1 Ack=350 Win=65152 Len=0 TSval=515145364 TSecr=515145364","8080","59450"
"398","19.777494763","127.0.0.1","127.0.0.1","TCP","361","59366  >  8080 [PSH, ACK] Seq=350 Ack=1346 Win=75008 Len=295 TSval=515145364 TSecr=515145361","59366","8080"
"399","19.777523119","127.0.0.1","127.0.0.1","TCP","66","8080  >  59366 [ACK] Seq=1346 Ack=645 Win=65280 Len=0 TSval=515145364 TSecr=515145364","8080","59366"
"400","19.777533944","127.0.0.1","127.0.0.1","TCP","74","59464  >  8080 [SYN] Seq=0 Win=65495 Len=0 MSS=65495 SACK_PERM TSval=515145364 TSecr=0 WS=128","59464","8080"
"401","19.777561112","127.0.0.1","127.0.0.1","TCP","74","8080  >  59464 [SYN, ACK] Seq=0 Ack=1 Win=65483 Len=0 MSS=65495 SACK_PERM TSval=515145364 TSecr=515145364 WS=128","8080","59464"
"402","19.777583462","127.0.0.1","127.0.0.1","TCP","66","59464  >  8080 [ACK] Seq=1 Ack=1 Win=65536 Len=0 TSval=515145364 TSecr=515145364","59464","8080"
"403","19.778189544","127.0.0.1","127.0.0.1","TCP","415","59464  >  8080 [PSH, ACK] Seq=1 Ack=1 Win=65536 Len=349 TSval=515145365 TSecr=515145364","59464","8080"
"404","19.778189544","127.0.0.1","127.0.0.1","TCP","831","8080  >  59358 [PSH, ACK] Seq=1346 Ack=645 Win=65536 Len=765 TSval=515145365 TSecr=515145356","8080","59358"
"405","19.778215735","127.0.0.1","127.0.0.1","TCP","66","8080  >  59464 [ACK] Seq=1 Ack=350 Win=65152 Len=0 TSval=515145365 TSecr=515145365","8080","59464"
"410","19.778654268","127.0.0.1","127.0.0.1","TCP","1901","59352  >  8080 [PSH, ACK] Seq=699 Ack=2111 Win=75392 Len=1835 TSval=515145366 TSecr=515145358","59352","8080"
"411","19.778678154","127.0.0.1","127.0.0.1","TCP","66","8080  >  59352 [ACK] Seq=2111 Ack=2534 Win=84224 Len=0 TSval=515145366 TSecr=515145360","8080","59352"
"412","19.778693798","127.0.0.1","127.0.0.1","TCP","1903","59350  >  8080 [PSH, ACK] Seq=698 Ack=2111 Win=75392 Len=1837 TSval=515145366 TSecr=515145356","59350","8080"
"413","19.778716706","127.0.0.1","127.0.0.1","TCP","66","8080  >  59350 [ACK] Seq=2111 Ack=2535 Win=84224 Len=0 TSval=515145366 TSecr=515145358","8080","59350"
"414","19.778848217","127.0.0.1","127.0.0.1","TCP","74","59470  >  8080 [SYN] Seq=0 Win=65495 Len=0 MSS=65495 SACK_PERM TSval=515145366 TSecr=0 WS=128","59470","8080"
"415","19.778875944","127.0.0.1","127.0.0.1","TCP","74","8080  >  59470 [SYN, ACK] Seq=0 Ack=1 Win=65483 Len=0 MSS=65495 SACK_PERM TSval=515145366 TSecr=515145366 WS=128","8080","59470"
"416","19.778898782","127.0.0.1","127.0.0.1","TCP","66","59470  >  8080 [ACK] Seq=1 Ack=1 Win=65536 Len=0 TSval=515145366 TSecr=515145366","59470","8080"
"417","19.779556548","127.0.0.1","127.0.0.1","TCP","415","59470  >  8080 [PSH, ACK] Seq=1 Ack=1 Win=65536 Len=349 TSval=515145366 TSecr=515145366","59470","8080"
"418","19.779581830","127.0.0.1","127.0.0.1","TCP","66","8080  >  59470 [ACK] Seq=1 Ack=350 Win=65152 Len=0 TSval=515145366 TSecr=515145366","8080","59470"
"419","19.779927614","127.0.0.1","127.0.0.1","TCP","74","59484  >  8080 [SYN] Seq=0 Win=65495 Len=0 MSS=65495 SACK_PERM TSval=515145367 TSecr=0 WS=128","59484","8080"
"420","19.779955691","127.0.0.1","127.0.0.1","TCP","74","8080  >  59484 [SYN, ACK] Seq=0 Ack=1 Win=65483 Len=0 MSS=65495 SACK_PERM TSval=515145367 TSecr=515145367 WS=128","8080","59484"
"421","19.779980484","127.0.0.1","127.0.0.1","TCP","119","59358  >  8080 [PSH, ACK] Seq=645 Ack=2111 Win=75392 Len=53 TSval=515145367 TSecr=515145365","59358","8080"
"422","19.779980484","127.0.0.1","127.0.0.1","TCP","66","59484  >  8080 [ACK] Seq=1 Ack=1 Win=65536 Len=0 TSval=515145367 TSecr=515145367","59484","8080"
"423","19.780501081","127.0.0.1","127.0.0.1","TCP","415","59484  >  8080 [PSH, ACK] Seq=1 Ack=1 Win=65536 Len=349 TSval=515145367 TSecr=515145367","59484","8080"
"424","19.780521894","127.0.0.1","127.0.0.1","TCP","66","8080  >  59484 [ACK] Seq=1 Ack=350 Win=65152 Len=0 TSval=515145367 TSecr=515145367","8080","59484"
"425","19.783089888","127.0.0.1","127.0.0.1","TCP","1411","8080  >  59372 [PSH, ACK] Seq=1 Ack=350 Win=65536 Len=1345 TSval=515145370 TSecr=515145331","8080","59372"
"426","19.783116008","127.0.0.1","127.0.0.1","TCP","66","59372  >  8080 [ACK] Seq=350 Ack=1346 Win=75008 Len=0 TSval=515145370 TSecr=515145370","59372","8080"
"427","19.784154967","127.0.0.1","127.0.0.1","TCP","361","59372  >  8080 [PSH, ACK] Seq=350 Ack=1346 Win=75008 Len=295 TSval=515145371 TSecr=515145370","59372","8080"
"430","19.784652656","127.0.0.1","127.0.0.1","TCP","1901","59358  >  8080 [PSH, ACK] Seq=698 Ack=2111 Win=75392 Len=1835 TSval=515145372 TSecr=515145365","59358","8080"
"431","19.784666485","127.0.0.1","127.0.0.1","TCP","66","8080  >  59358 [ACK] Seq=2111 Ack=2533 Win=83584 Len=0 TSval=515145372 TSecr=515145367","8080","59358"
"432","19.794254226","127.0.0.1","127.0.0.1","TCP","831","8080  >  59366 [PSH, ACK] Seq=1346 Ack=645 Win=65536 Len=765 TSval=515145381 TSecr=515145364","8080","59366"
"433","19.796030010","127.0.0.1","127.0.0.1","TCP","120","59366  >  8080 [PSH, ACK] Seq=645 Ack=2111 Win=75392 Len=54 TSval=515145383 TSecr=515145381","59366","8080"
"434","19.796200213","127.0.0.1","127.0.0.1","TCP","1411","8080  >  59386 [PSH, ACK] Seq=1 Ack=350 Win=65536 Len=1345 TSval=515145383 TSecr=515145339","8080","59386"
"435","19.796218861","127.0.0.1","127.0.0.1","TCP","66","59386  >  8080 [ACK] Seq=350 Ack=1346 Win=75008 Len=0 TSval=515145383 TSecr=515145383","59386","8080"
"436","19.797351617","127.0.0.1","127.0.0.1","TCP","361","59386  >  8080 [PSH, ACK] Seq=350 Ack=1346 Win=75008 Len=295 TSval=515145384 TSecr=515145383","59386","8080"
"437","19.797377947","127.0.0.1","127.0.0.1","TCP","66","8080  >  59386 [ACK] Seq=1346 Ack=645 Win=65280 Len=0 TSval=515145384 TSecr=515145384","8080","59386"
"438","19.798106112","127.0.0.1","127.0.0.1","TCP","831","8080  >  59372 [PSH, ACK] Seq=1346 Ack=645 Win=65536 Len=765 TSval=515145385 TSecr=515145371","8080","59372"
"439","19.799715115","127.0.0.1","127.0.0.1","TCP","1411","8080  >  59394 [PSH, ACK] Seq=1 Ack=350 Win=65536 Len=1345 TSval=515145387 TSecr=515145346","8080","59394"
"440","19.799734671","127.0.0.1","127.0.0.1","TCP","120","59372  >  8080 [PSH, ACK] Seq=645 Ack=2111 Win=75392 Len=54 TSval=515145387 TSecr=515145385","59372","8080"
"441","19.799738093","127.0.0.1","127.0.0.1","TCP","66","59394  >  8080 [ACK] Seq=350 Ack=1346 Win=75008 Len=0 TSval=515145387 TSecr=515145387","59394","8080"
"442","19.800981058","127.0.0.1","127.0.0.1","TCP","361","59394  >  8080 [PSH, ACK] Seq=350 Ack=1346 Win=75008 Len=295 TSval=515145388 TSecr=515145387","59394","8080"
"443","19.801009693","127.0.0.1","127.0.0.1","TCP","66","8080  >  59394 [ACK] Seq=1346 Ack=645 Win=65280 Len=0 TSval=515145388 TSecr=515145388","8080","59394"
"444","19.801388582","127.0.0.1","127.0.0.1","TCP","831","8080  >  59386 [PSH, ACK] Seq=1346 Ack=645 Win=65536 Len=765 TSval=515145388 TSecr=515145384","8080","59386"
"445","19.802812436","127.0.0.1","127.0.0.1","TCP","1411","8080  >  59402 [PSH, ACK] Seq=1 Ack=350 Win=65536 Len=1345 TSval=515145390 TSecr=515145347","8080","59402"
"446","19.802812436","127.0.0.1","127.0.0.1","TCP","119","59386  >  8080 [PSH, ACK] Seq=645 Ack=2111 Win=75392 Len=53 TSval=515145390 TSecr=515145388","59386","8080"
"447","19.802838278","127.0.0.1","127.0.0.1","TCP","66","59402  >  8080 [ACK] Seq=350 Ack=1346 Win=75008 Len=0 TSval=515145390 TSecr=515145390","59402","8080"
"449","19.804201719","127.0.0.1","127.0.0.1","TCP","361","59402  >  8080 [PSH, ACK] Seq=350 Ack=1346 Win=75008 Len=295 TSval=515145391 TSecr=515145390","59402","8080"
"450","19.804201719","127.0.0.1","127.0.0.1","TCP","831","8080  >  59394 [PSH, ACK] Seq=1346 Ack=645 Win=65536 Len=765 TSval=515145391 TSecr=515145388","8080","59394"
"451","19.804232659","127.0.0.1","127.0.0.1","TCP","66","8080  >  59402 [ACK] Seq=1346 Ack=645 Win=65280 Len=0 TSval=515145391 TSecr=515145391","8080","59402"
"452","19.804545198","127.0.0.1","127.0.0.1","TCP","1904","59366  >  8080 [PSH, ACK] Seq=699 Ack=2111 Win=75392 Len=1838 TSval=515145391 TSecr=515145381","59366","8080"
"453","19.804572367","127.0.0.1","127.0.0.1","TCP","66","8080  >  59366 [ACK] Seq=2111 Ack=2537 Win=84224 Len=0 TSval=515145391 TSecr=515145383","8080","59366"
"454","19.805720976","127.0.0.1","127.0.0.1","TCP","1411","8080  >  59406 [PSH, ACK] Seq=1 Ack=350 Win=65536 Len=1345 TSval=515145393 TSecr=515145350","8080","59406"
"455","19.805744862","127.0.0.1","127.0.0.1","TCP","66","59406  >  8080 [ACK] Seq=350 Ack=1346 Win=75008 Len=0 TSval=515145393 TSecr=515145393","59406","8080"
"456","19.805779433","127.0.0.1","127.0.0.1","TCP","119","59394  >  8080 [PSH, ACK] Seq=645 Ack=2111 Win=75392 Len=53 TSval=515145393 TSecr=515145391","59394","8080"
"459","19.806353808","127.0.0.1","127.0.0.1","TCP","1902","59372  >  8080 [PSH, ACK] Seq=699 Ack=2111 Win=75392 Len=1836 TSval=515145393 TSecr=515145385","59372","8080"
"460","19.806375668","127.0.0.1","127.0.0.1","TCP","66","8080  >  59372 [ACK] Seq=2111 Ack=2535 Win=84224 Len=0 TSval=515145393 TSecr=515145387","8080","59372"
"461","19.807132469","127.0.0.1","127.0.0.1","TCP","361","59406  >  8080 [PSH, ACK] Seq=350 Ack=1346 Win=75008 Len=295 TSval=515145394 TSecr=515145393","59406","8080"
"462","19.807161523","127.0.0.1","127.0.0.1","TCP","66","8080  >  59406 [ACK] Seq=1346 Ack=645 Win=65280 Len=0 TSval=515145394 TSecr=515145394","8080","59406"
"463","19.807570653","127.0.0.1","127.0.0.1","TCP","831","8080  >  59402 [PSH, ACK] Seq=1346 Ack=645 Win=65536 Len=765 TSval=515145394 TSecr=515145391","8080","59402"
"464","19.809406989","127.0.0.1","127.0.0.1","TCP","120","59402  >  8080 [PSH, ACK] Seq=645 Ack=2111 Win=75392 Len=54 TSval=515145396 TSecr=515145394","59402","8080"
"467","19.810277002","127.0.0.1","127.0.0.1","TCP","1902","59386  >  8080 [PSH, ACK] Seq=698 Ack=2111 Win=75392 Len=1836 TSval=515145397 TSecr=515145388","59386","8080"
"468","19.810299980","127.0.0.1","127.0.0.1","TCP","66","8080  >  59386 [ACK] Seq=2111 Ack=2534 Win=84224 Len=0 TSval=515145397 TSecr=515145390","8080","59386"
"469","19.812015422","127.0.0.1","127.0.0.1","TCP","1411","8080  >  59410 [PSH, ACK] Seq=1 Ack=350 Win=65536 Len=1345 TSval=515145399 TSecr=515145351","8080","59410"
"471","19.812039656","127.0.0.1","127.0.0.1","TCP","66","59410  >  8080 [ACK] Seq=350 Ack=1346 Win=75008 Len=0 TSval=515145399 TSecr=515145399","59410","8080"
"473","19.812195263","127.0.0.1","127.0.0.1","TCP","1902","59394  >  8080 [PSH, ACK] Seq=698 Ack=2111 Win=75392 Len=1836 TSval=515145399 TSecr=515145391","59394","8080"
"474","19.812211606","127.0.0.1","127.0.0.1","TCP","66","8080  >  59394 [ACK] Seq=2111 Ack=2534 Win=84224 Len=0 TSval=515145399 TSecr=515145393","8080","59394"
"475","19.813103409","127.0.0.1","127.0.0.1","TCP","361","59410  >  8080 [PSH, ACK] Seq=350 Ack=1346 Win=75008 Len=295 TSval=515145400 TSecr=515145399","59410","8080"
"476","19.813130019","127.0.0.1","127.0.0.1","TCP","66","8080  >  59410 [ACK] Seq=1346 Ack=645 Win=65280 Len=0 TSval=515145400 TSecr=515145400","8080","59410"
"479","19.815843981","127.0.0.1","127.0.0.1","TCP","1904","59402  >  8080 [PSH, ACK] Seq=699 Ack=2111 Win=75392 Len=1838 TSval=515145403 TSecr=515145394","59402","8080"
"480","19.815859276","127.0.0.1","127.0.0.1","TCP","66","8080  >  59402 [ACK] Seq=2111 Ack=2537 Win=83584 Len=0 TSval=515145403 TSecr=515145396","8080","59402"
"481","19.822760991","127.0.0.1","127.0.0.1","TCP","831","8080  >  59406 [PSH, ACK] Seq=1346 Ack=645 Win=65536 Len=765 TSval=515145410 TSecr=515145394","8080","59406"
"482","19.824169480","127.0.0.1","127.0.0.1","TCP","119","59406  >  8080 [PSH, ACK] Seq=645 Ack=2111 Win=75392 Len=53 TSval=515145411 TSecr=515145410","59406","8080"
"483","19.827572636","127.0.0.1","127.0.0.1","TCP","1411","8080  >  59412 [PSH, ACK] Seq=1 Ack=350 Win=65536 Len=1345 TSval=515145414 TSecr=515145351","8080","59412"
"484","19.827598757","127.0.0.1","127.0.0.1","TCP","66","59412  >  8080 [ACK] Seq=350 Ack=1346 Win=75008 Len=0 TSval=515145414 TSecr=515145414","59412","8080"
"485","19.828904719","127.0.0.1","127.0.0.1","TCP","831","8080  >  59410 [PSH, ACK] Seq=1346 Ack=645 Win=65536 Len=765 TSval=515145416 TSecr=515145400","8080","59410"
"486","19.829331798","127.0.0.1","127.0.0.1","TCP","361","59412  >  8080 [PSH, ACK] Seq=350 Ack=1346 Win=75008 Len=295 TSval=515145416 TSecr=515145414","59412","8080"
"487","19.829358967","127.0.0.1","127.0.0.1","TCP","66","8080  >  59412 [ACK] Seq=1346 Ack=645 Win=65280 Len=0 TSval=515145416 TSecr=515145416","8080","59412"
"490","19.829877817","127.0.0.1","127.0.0.1","TCP","1904","59406  >  8080 [PSH, ACK] Seq=698 Ack=2111 Win=75392 Len=1838 TSval=515145417 TSecr=515145410","59406","8080"
"491","19.829891995","127.0.0.1","127.0.0.1","TCP","66","8080  >  59406 [ACK] Seq=2111 Ack=2536 Win=84224 Len=0 TSval=515145417 TSecr=515145411","8080","59406"
"492","19.830524129","127.0.0.1","127.0.0.1","TCP","120","59410  >  8080 [PSH, ACK] Seq=645 Ack=2111 Win=75392 Len=54 TSval=515145417 TSecr=515145416","59410","8080"
"493","19.830644675","127.0.0.1","127.0.0.1","TCP","1411","8080  >  59422 [PSH, ACK] Seq=1 Ack=350 Win=65536 Len=1345 TSval=515145417 TSecr=515145355","8080","59422"
"494","19.830665557","127.0.0.1","127.0.0.1","TCP","66","59422  >  8080 [ACK] Seq=350 Ack=1346 Win=75008 Len=0 TSval=515145418 TSecr=515145417","59422","8080"
"495","19.831711710","127.0.0.1","127.0.0.1","TCP","361","59422  >  8080 [PSH, ACK] Seq=350 Ack=1346 Win=75008 Len=295 TSval=515145419 TSecr=515145417","59422","8080"
"496","19.831737411","127.0.0.1","127.0.0.1","TCP","66","8080  >  59422 [ACK] Seq=1346 Ack=645 Win=65280 Len=0 TSval=515145419 TSecr=515145419","8080","59422"
"497","19.835445494","127.0.0.1","127.0.0.1","TCP","831","8080  >  59412 [PSH, ACK] Seq=1346 Ack=645 Win=65536 Len=765 TSval=515145422 TSecr=515145416","8080","59412"
"498","19.836882199","127.0.0.1","127.0.0.1","TCP","1411","8080  >  59436 [PSH, ACK] Seq=1 Ack=350 Win=65536 Len=1345 TSval=515145424 TSecr=515145356","8080","59436"
"499","19.836907831","127.0.0.1","127.0.0.1","TCP","66","59436  >  8080 [ACK] Seq=350 Ack=1346 Win=75008 Len=0 TSval=515145424 TSecr=515145424","59436","8080"
"500","19.837111418","127.0.0.1","127.0.0.1","TCP","120","59412  >  8080 [PSH, ACK] Seq=645 Ack=2111 Win=75392 Len=54 TSval=515145424 TSecr=515145422","59412","8080"
"503","19.837590390","127.0.0.1","127.0.0.1","TCP","1903","59410  >  8080 [PSH, ACK] Seq=699 Ack=2111 Win=75392 Len=1837 TSval=515145424 TSecr=515145416","59410","8080"
"504","19.837640326","127.0.0.1","127.0.0.1","TCP","66","8080  >  59410 [ACK] Seq=2111 Ack=2536 Win=84224 Len=0 TSval=515145424 TSecr=515145417","8080","59410"
"505","19.837885120","127.0.0.1","127.0.0.1","TCP","831","8080  >  59422 [PSH, ACK] Seq=1346 Ack=645 Win=65536 Len=765 TSval=515145425 TSecr=515145419","8080","59422"
"506","19.838499723","127.0.0.1","127.0.0.1","TCP","361","59436  >  8080 [PSH, ACK] Seq=350 Ack=1346 Win=75008 Len=295 TSval=515145425 TSecr=515145424","59436","8080"
"507","19.838528568","127.0.0.1","127.0.0.1","TCP","66","8080  >  59436 [ACK] Seq=1346 Ack=645 Win=65280 Len=0 TSval=515145425 TSecr=515145425","8080","59436"
"508","19.839097495","127.0.0.1","127.0.0.1","TCP","120","59422  >  8080 [PSH, ACK] Seq=645 Ack=2111 Win=75392 Len=54 TSval=515145426 TSecr=515145425","59422","8080"
"509","19.839490911","127.0.0.1","127.0.0.1","TCP","1411","8080  >  59450 [PSH, ACK] Seq=1 Ack=350 Win=65536 Len=1345 TSval=515145426 TSecr=515145364","8080","59450"
"510","19.839518568","127.0.0.1","127.0.0.1","TCP","66","59450  >  8080 [ACK] Seq=350 Ack=1346 Win=75008 Len=0 TSval=515145426 TSecr=515145426","59450","8080"
"511","19.840642454","127.0.0.1","127.0.0.1","TCP","361","59450  >  8080 [PSH, ACK] Seq=350 Ack=1346 Win=75008 Len=295 TSval=515145427 TSecr=515145426","59450","8080"
"512","19.840671578","127.0.0.1","127.0.0.1","TCP","66","8080  >  59450 [ACK] Seq=1346 Ack=645 Win=65280 Len=0 TSval=515145428 TSecr=515145427","8080","59450"
"515","19.844533940","127.0.0.1","127.0.0.1","TCP","1906","59422  >  8080 [PSH, ACK] Seq=699 Ack=2111 Win=75392 Len=1840 TSval=515145431 TSecr=515145425","59422","8080"
"516","19.844540505","127.0.0.1","127.0.0.1","TCP","831","8080  >  59436 [PSH, ACK] Seq=1346 Ack=645 Win=65536 Len=765 TSval=515145431 TSecr=515145425","8080","59436"
"517","19.844550073","127.0.0.1","127.0.0.1","TCP","66","8080  >  59422 [ACK] Seq=2111 Ack=2539 Win=84224 Len=0 TSval=515145431 TSecr=515145426","8080","59422"
"520","19.844859889","127.0.0.1","127.0.0.1","TCP","1901","59412  >  8080 [PSH, ACK] Seq=699 Ack=2111 Win=75392 Len=1835 TSval=515145432 TSecr=515145422","59412","8080"
"521","19.844887965","127.0.0.1","127.0.0.1","TCP","66","8080  >  59412 [ACK] Seq=2111 Ack=2534 Win=84224 Len=0 TSval=515145432 TSecr=515145424","8080","59412"
"523","19.845765870","127.0.0.1","127.0.0.1","TCP","119","59436  >  8080 [PSH, ACK] Seq=645 Ack=2111 Win=75392 Len=53 TSval=515145433 TSecr=515145431","59436","8080"
"524","19.846183870","127.0.0.1","127.0.0.1","TCP","1411","8080  >  59464 [PSH, ACK] Seq=1 Ack=350 Win=65536 Len=1345 TSval=515145433 TSecr=515145365","8080","59464"
"525","19.846203496","127.0.0.1","127.0.0.1","TCP","66","59464  >  8080 [ACK] Seq=350 Ack=1346 Win=75008 Len=0 TSval=515145433 TSecr=515145433","59464","8080"
"526","19.847134829","127.0.0.1","127.0.0.1","TCP","361","59464  >  8080 [PSH, ACK] Seq=350 Ack=1346 Win=75008 Len=295 TSval=515145434 TSecr=515145433","59464","8080"
"527","19.847160670","127.0.0.1","127.0.0.1","TCP","66","8080  >  59464 [ACK] Seq=1346 Ack=645 Win=65280 Len=0 TSval=515145434 TSecr=515145434","8080","59464"
"530","19.851060328","127.0.0.1","127.0.0.1","TCP","1901","59436  >  8080 [PSH, ACK] Seq=698 Ack=2111 Win=75392 Len=1835 TSval=515145438 TSecr=515145431","59436","8080"
"531","19.851077369","127.0.0.1","127.0.0.1","TCP","66","8080  >  59436 [ACK] Seq=2111 Ack=2533 Win=83584 Len=0 TSval=515145438 TSecr=515145433","8080","59436"
"532","19.856311205","127.0.0.1","127.0.0.1","TCP","831","8080  >  59450 [PSH, ACK] Seq=1346 Ack=645 Win=65536 Len=765 TSval=515145443 TSecr=515145427","8080","59450"
"533","19.857776754","127.0.0.1","127.0.0.1","TCP","120","59450  >  8080 [PSH, ACK] Seq=645 Ack=2111 Win=75392 Len=54 TSval=515145445 TSecr=515145443","59450","8080"
"534","19.857814189","127.0.0.1","127.0.0.1","TCP","1411","8080  >  59470 [PSH, ACK] Seq=1 Ack=350 Win=65536 Len=1345 TSval=515145445 TSecr=515145366","8080","59470"
"535","19.857832278","127.0.0.1","127.0.0.1","TCP","66","59470  >  8080 [ACK] Seq=350 Ack=1346 Win=75008 Len=0 TSval=515145445 TSecr=515145445","59470","8080"
"536","19.859106113","127.0.0.1","127.0.0.1","TCP","831","8080  >  59464 [PSH, ACK] Seq=1346 Ack=645 Win=65536 Len=765 TSval=515145446 TSecr=515145434","8080","59464"
"537","19.859110374","127.0.0.1","127.0.0.1","TCP","361","59470  >  8080 [PSH, ACK] Seq=350 Ack=1346 Win=75008 Len=295 TSval=515145446 TSecr=515145445","59470","8080"
"538","19.859143269","127.0.0.1","127.0.0.1","TCP","66","8080  >  59470 [ACK] Seq=1346 Ack=645 Win=65280 Len=0 TSval=515145446 TSecr=515145446","8080","59470"
"539","19.860592894","127.0.0.1","127.0.0.1","TCP","1411","8080  >  59484 [PSH, ACK] Seq=1 Ack=350 Win=65536 Len=1345 TSval=515145447 TSecr=515145367","8080","59484"
"540","19.860647650","127.0.0.1","127.0.0.1","TCP","66","59484  >  8080 [ACK] Seq=350 Ack=1346 Win=75008 Len=0 TSval=515145447 TSecr=515145447","59484","8080"
"541","19.860895726","127.0.0.1","127.0.0.1","TCP","119","59464  >  8080 [PSH, ACK] Seq=645 Ack=2111 Win=75392 Len=53 TSval=515145448 TSecr=515145446","59464","8080"
