"No.","Time","Source","Destination","Protocol","Length","Info","src_port","dst_port"
"50","0.831039699","127.0.0.1","127.0.0.1","TCP","66","34946  >  4444 [ACK] Seq=1 Ack=1 Win=614 Len=0 TSval=2999680014 TSecr=2999669972","34946","4444"
"51","0.831065471","127.0.0.1","127.0.0.1","TCP","66","34940  >  4444 [ACK] Seq=1 Ack=1 Win=614 Len=0 TSval=2999680014 TSecr=2999669968","34940","4444"
"52","0.831082232","127.0.0.1","127.0.0.1","TCP","66","[TCP ACKed unseen segment] 4444  >  34946 [ACK] Seq=1 Ack=2 Win=512 Len=0 TSval=2999680014 TSecr=2999669972","4444","34946"
"53","0.831093058","127.0.0.1","127.0.0.1","TCP","66","[TCP ACKed unseen segment] 4444  >  34940 [ACK] Seq=1 Ack=2 Win=512 Len=0 TSval=2999680014 TSecr=2999669968","4444","34940"
"60","0.955744585","127.0.0.1","127.0.0.1","TLSv1.2","271","Application Data","52312","4444"
"61","0.956085480","127.0.0.1","127.0.0.1","TLSv1.2","271","Application Data","52422","4444"
"62","0.956444674","127.0.0.1","127.0.0.1","TLSv1.2","271","Application Data","52440","4444"
"64","0.956728090","127.0.0.1","127.0.0.1","TLSv1.2","271","Application Data","52720","4444"
"67","0.957033226","127.0.0.1","127.0.0.1","TLSv1.2","271","Application Data","52502","4444"
"70","0.957356871","127.0.0.1","127.0.0.1","TLSv1.2","271","Application Data","35210","4444"
"71","0.957387252","127.0.0.1","127.0.0.1","TCP","66","4444  >  35210 [ACK] Seq=1 Ack=206 Win=511 Len=0 TSval=2999680140 TSecr=2999680140","4444","35210"
"77","0.957781226","127.0.0.1","127.0.0.1","TLSv1.2","271","Application Data","52760","4444"
"85","0.958206490","127.0.0.1","127.0.0.1","TLSv1.2","271","Application Data","52486","4444"
"89","0.958607728","127.0.0.1","127.0.0.1","TLSv1.2","271","Application Data","35116","4444"
"93","0.959060719","127.0.0.1","127.0.0.1","TLSv1.2","271","Application Data","52594","4444"
"99","0.959451271","127.0.0.1","127.0.0.1","TLSv1.2","271","Application Data","52304","4444"
"106","0.959833093","127.0.0.1","127.0.0.1","TLSv1.2","271","Application Data","34984","4444"
"107","0.959859773","127.0.0.1","127.0.0.1","TCP","66","4444  >  34984 [ACK] Seq=1 Ack=206 Win=511 Len=0 TSval=2999680142 TSecr=2999680142","4444","34984"
"113","0.960267576","127.0.0.1","127.0.0.1","TLSv1.2","271","Application Data","52324","4444"
"124","0.960728249","127.0.0.1","127.0.0.1","TLSv1.2","271","Application Data","52466","4444"
"129","0.961268960","127.0.0.1","127.0.0.1","TLSv1.2","271","Application Data","52302","4444"
"141","0.961757570","127.0.0.1","127.0.0.1","TLSv1.2","271","Application Data","35124","4444"
"142","0.961786205","127.0.0.1","127.0.0.1","TCP","66","4444  >  35124 [ACK] Seq=1 Ack=206 Win=511 Len=0 TSval=2999680144 TSecr=2999680144","4444","35124"
"156","0.962315601","127.0.0.1","127.0.0.1","TLSv1.2","271","Application Data","52590","4444"
"166","0.962787379","127.0.0.1","127.0.0.1","TLSv1.2","271","Application Data","35014","4444"
"167","0.962815456","127.0.0.1","127.0.0.1","TCP","66","4444  >  35014 [ACK] Seq=1 Ack=206 Win=511 Len=0 TSval=2999680145 TSecr=2999680145","4444","35014"
"175","0.963425449","127.0.0.1","127.0.0.1","TLSv1.2","271","Application Data","35180","4444"
"188","0.964012395","127.0.0.1","127.0.0.1","TLSv1.2","271","Application Data","35270","4444"
"189","0.964041449","127.0.0.1","127.0.0.1","TCP","66","4444  >  35270 [ACK] Seq=1 Ack=206 Win=511 Len=0 TSval=2999680147 TSecr=2999680147","4444","35270"
"193","0.964624065","127.0.0.1","127.0.0.1","TLSv1.2","271","Application Data","34952","4444"
"195","0.964653748","127.0.0.1","127.0.0.1","TCP","66","4444  >  34952 [ACK] Seq=1 Ack=206 Win=511 Len=0 TSval=2999680147 TSecr=2999680147","4444","34952"
"206","0.965178395","127.0.0.1","127.0.0.1","TLSv1.2","271","Application Data","52700","4444"
"229","0.965711145","127.0.0.1","127.0.0.1","TLSv1.2","271","Application Data","52730","4444"
"242","0.966117621","127.0.0.1","127.0.0.1","TLSv1.2","271","Application Data","52408","4444"
"266","0.967105107","127.0.0.1","127.0.0.1","TLSv1.2","271","Application Data","52348","4444"
"279","0.967589386","127.0.0.1","127.0.0.1","TLSv1.2","271","Application Data","52520","4444"
"289","0.968173120","127.0.0.1","127.0.0.1","TLSv1.2","271","Application Data","52628","4444"
"290","0.968190440","127.0.0.1","127.0.0.1","TLSv1.2","207","Application Data","4444","35210"
"291","0.968224802","127.0.0.1","127.0.0.1","TCP","66","35210  >  4444 [ACK] Seq=206 Ack=142 Win=615 Len=0 TSval=2999680151 TSecr=2999680151","35210","4444"
"299","0.968664732","127.0.0.1","127.0.0.1","TLSv1.2","271","Application Data","52540","4444"
"309","0.969129666","127.0.0.1","127.0.0.1","TLSv1.2","271","Application Data","35172","4444"
"310","0.969154879","127.0.0.1","127.0.0.1","TCP","66","4444  >  35172 [ACK] Seq=1 Ack=206 Win=511 Len=0 TSval=2999680152 TSecr=2999680152","4444","35172"
"334","0.970194606","::1","::1","TCP","94","40622  >  4444 [SYN] Seq=0 Win=65476 Len=0 MSS=65476 SACK_PERM TSval=3599751176 TSecr=0 WS=128","40622","4444"
"335","0.970217164","::1","::1","TCP","74","4444  >  40622 [RST, ACK] Seq=1 Ack=1 Win=0 Len=0","4444","40622"
"338","0.970469501","127.0.0.1","127.0.0.1","TLSv1.2","207","Application Data","4444","52312"
"339","0.970512803","127.0.0.1","127.0.0.1","TCP","66","52312  >  4444 [ACK] Seq=206 Ack=142 Win=615 Len=0 TSval=2999680153 TSecr=2999680153","52312","4444"
"353","0.971026345","127.0.0.1","127.0.0.1","TLSv1.2","401","Application Data","51038","4444"
"355","0.971044155","127.0.0.1","127.0.0.1","TCP","66","4444  >  51038 [ACK] Seq=1 Ack=336 Win=907 Len=0 TSval=2999680154 TSecr=2999680154","4444","51038"
"419","0.973575482","::1","::1","TCP","94","40636  >  4444 [SYN] Seq=0 Win=65476 Len=0 MSS=65476 SACK_PERM TSval=3599751179 TSecr=0 WS=128","40636","4444"
"421","0.973593501","::1","::1","TCP","74","4444  >  40636 [RST, ACK] Seq=1 Ack=1 Win=0 Len=0","4444","40636"
"453","0.974141406","127.0.0.1","127.0.0.1","TLSv1.2","207","Application Data","4444","52422"
"456","0.974171438","127.0.0.1","127.0.0.1","TCP","66","52422  >  4444 [ACK] Seq=206 Ack=142 Win=615 Len=0 TSval=2999680157 TSecr=2999680157","52422","4444"
"474","0.974735895","127.0.0.1","127.0.0.1","TLSv1.2","207","Application Data","4444","34984"
"475","0.974735895","127.0.0.1","127.0.0.1","TLSv1.2","207","Application Data","4444","52760"
"476","0.974757406","127.0.0.1","127.0.0.1","TCP","66","34984  >  4444 [ACK] Seq=206 Ack=142 Win=615 Len=0 TSval=2999680157 TSecr=2999680157","34984","4444"
"477","0.974757406","127.0.0.1","127.0.0.1","TCP","66","52760  >  4444 [ACK] Seq=206 Ack=142 Win=615 Len=0 TSval=2999680157 TSecr=2999680157","52760","4444"
"502","0.975625044","127.0.0.1","127.0.0.1","TLSv1.2","401","Application Data","51184","4444"
"504","0.975643971","127.0.0.1","127.0.0.1","TCP","66","4444  >  51184 [ACK] Seq=1 Ack=336 Win=995 Len=0 TSval=2999680158 TSecr=2999680158","4444","51184"
"517","0.976418581","127.0.0.1","127.0.0.1","TLSv1.2","207","Application Data","4444","52720"
"519","0.976448124","127.0.0.1","127.0.0.1","TCP","66","52720  >  4444 [ACK] Seq=206 Ack=142 Win=615 Len=0 TSval=2999680159 TSecr=2999680159","52720","4444"
"520","0.976461533","127.0.0.1","127.0.0.1","TLSv1.2","207","Application Data","4444","52502"
"522","0.976484930","127.0.0.1","127.0.0.1","TCP","66","52502  >  4444 [ACK] Seq=206 Ack=142 Win=615 Len=0 TSval=2999680159 TSecr=2999680159","52502","4444"
"543","0.977312270","::1","::1","TCP","94","40650  >  4444 [SYN] Seq=0 Win=65476 Len=0 MSS=65476 SACK_PERM TSval=3599751183 TSecr=0 WS=128","40650","4444"
"544","0.977335178","::1","::1","TCP","74","4444  >  40650 [RST, ACK] Seq=1 Ack=1 Win=0 Len=0","4444","40650"
"545","0.977518441","127.0.0.1","127.0.0.1","TLSv1.2","207","Application Data","4444","35116"
"546","0.977543794","127.0.0.1","127.0.0.1","TCP","66","35116  >  4444 [ACK] Seq=206 Ack=142 Win=615 Len=0 TSval=2999680160 TSecr=2999680160","35116","4444"
"561","0.977998670","127.0.0.1","127.0.0.1","TLSv1.2","207","Application Data","4444","52440"
"562","0.978019134","127.0.0.1","127.0.0.1","TCP","66","52440  >  4444 [ACK] Seq=206 Ack=142 Win=615 Len=0 TSval=2999680161 TSecr=2999680161","52440","4444"
"583","0.978564943","::1","::1","TCP","94","40666  >  4444 [SYN] Seq=0 Win=65476 Len=0 MSS=65476 SACK_PERM TSval=3599751184 TSecr=0 WS=128","40666","4444"
"584","0.978585337","::1","::1","TCP","74","4444  >  40666 [RST, ACK] Seq=1 Ack=1 Win=0 Len=0","4444","40666"
"632","0.980555769","::1","::1","TCP","94","40668  >  4444 [SYN] Seq=0 Win=65476 Len=0 MSS=65476 SACK_PERM TSval=3599751186 TSecr=0 WS=128","40668","4444"
"633","0.980576023","::1","::1","TCP","74","4444  >  40668 [RST, ACK] Seq=1 Ack=1 Win=0 Len=0","4444","40668"
"638","0.980634410","127.0.0.1","127.0.0.1","TLSv1.2","207","Application Data","4444","52486"
"639","0.980651242","127.0.0.1","127.0.0.1","TCP","66","52486  >  4444 [ACK] Seq=206 Ack=142 Win=615 Len=0 TSval=2999680163 TSecr=2999680163","52486","4444"
"676","0.981780575","::1","::1","TCP","94","40682  >  4444 [SYN] Seq=0 Win=65476 Len=0 MSS=65476 SACK_PERM TSval=3599751187 TSecr=0 WS=128","40682","4444"
"677","0.981803064","::1","::1","TCP","74","4444  >  40682 [RST, ACK] Seq=1 Ack=1 Win=0 Len=0","4444","40682"
"683","0.982019153","127.0.0.1","127.0.0.1","TLSv1.2","207","Application Data","4444","52304"
"684","0.982049674","127.0.0.1","127.0.0.1","TCP","66","52304  >  4444 [ACK] Seq=206 Ack=142 Win=615 Len=0 TSval=2999680165 TSecr=2999680165","52304","4444"
"703","0.982862836","::1","::1","TCP","94","40684  >  4444 [SYN] Seq=0 Win=65476 Len=0 MSS=65476 SACK_PERM TSval=3599751188 TSecr=0 WS=128","40684","4444"
"704","0.982884347","::1","::1","TCP","74","4444  >  40684 [RST, ACK] Seq=1 Ack=1 Win=0 Len=0","4444","40684"
"706","0.982913401","127.0.0.1","127.0.0.1","TLSv1.2","207","Application Data","4444","35124"
"708","0.982935191","127.0.0.1","127.0.0.1","TCP","66","35124  >  4444 [ACK] Seq=206 Ack=142 Win=615 Len=0 TSval=2999680165 TSecr=2999680165","35124","4444"
"715","0.983304931","127.0.0.1","127.0.0.1","TLSv1.2","207","Application Data","4444","52324"
"716","0.983333985","127.0.0.1","127.0.0.1","TCP","66","52324  >  4444 [ACK] Seq=206 Ack=142 Win=615 Len=0 TSval=2999680166 TSecr=2999680166","52324","4444"
"719","0.983492874","127.0.0.1","127.0.0.1","TLSv1.2","207","Application Data","4444","35270"
"720","0.983492874","127.0.0.1","127.0.0.1","TLSv1.2","207","Application Data","4444","52348"
"722","0.983511452","127.0.0.1","127.0.0.1","TCP","66","52348  >  4444 [ACK] Seq=206 Ack=142 Win=615 Len=0 TSval=2999680166 TSecr=2999680166","52348","4444"
"723","0.983512918","127.0.0.1","127.0.0.1","TCP","66","35270  >  4444 [ACK] Seq=206 Ack=142 Win=615 Len=0 TSval=2999680166 TSecr=2999680166","35270","4444"
"733","0.983894531","127.0.0.1","127.0.0.1","TLSv1.2","207","Application Data","4444","52594"
"734","0.983894531","127.0.0.1","127.0.0.1","TLSv1.2","207","Application Data","4444","52302"
"736","0.983914645","127.0.0.1","127.0.0.1","TCP","66","52594  >  4444 [ACK] Seq=206 Ack=142 Win=615 Len=0 TSval=2999680166 TSecr=2999680166","52594","4444"
"737","0.983918417","127.0.0.1","127.0.0.1","TCP","66","52302  >  4444 [ACK] Seq=206 Ack=142 Win=615 Len=0 TSval=2999680166 TSecr=2999680166","52302","4444"
"742","0.984106919","::1","::1","TCP","94","40686  >  4444 [SYN] Seq=0 Win=65476 Len=0 MSS=65476 SACK_PERM TSval=3599751190 TSecr=0 WS=128","40686","4444"
"743","0.984125357","::1","::1","TCP","74","4444  >  40686 [RST, ACK] Seq=1 Ack=1 Win=0 Len=0","4444","40686"
"745","0.984252258","127.0.0.1","127.0.0.1","TLSv1.2","207","Application Data","4444","35014"
"747","0.984253655","127.0.0.1","127.0.0.1","TLSv1.2","207","Application Data","4444","52408"
"749","0.984271395","127.0.0.1","127.0.0.1","TCP","66","52408  >  4444 [ACK] Seq=206 Ack=142 Win=615 Len=0 TSval=2999680167 TSecr=2999680167","52408","4444"
"750","0.984279357","127.0.0.1","127.0.0.1","TCP","66","35014  >  4444 [ACK] Seq=206 Ack=142 Win=615 Len=0 TSval=2999680167 TSecr=2999680167","35014","4444"
"758","0.984588055","127.0.0.1","127.0.0.1","TLSv1.2","207","Application Data","4444","52730"
"759","0.984588055","127.0.0.1","127.0.0.1","TLSv1.2","207","Application Data","4444","35180"
"760","0.984589452","127.0.0.1","127.0.0.1","TLSv1.2","207","Application Data","4444","52590"
"761","0.984600347","127.0.0.1","127.0.0.1","TCP","66","52730  >  4444 [ACK] Seq=206 Ack=142 Win=615 Len=0 TSval=2999680167 TSecr=2999680167","52730","4444"
"762","0.984608449","127.0.0.1","127.0.0.1","TCP","66","52590  >  4444 [ACK] Seq=206 Ack=142 Win=615 Len=0 TSval=2999680167 TSecr=2999680167","52590","4444"
"763","0.984608449","127.0.0.1","127.0.0.1","TCP","66","35180  >  4444 [ACK] Seq=206 Ack=142 Win=615 Len=0 TSval=2999680167 TSecr=2999680167","35180","4444"
"777","0.985192462","::1","::1","TCP","94","40702  >  4444 [SYN] Seq=0 Win=65476 Len=0 MSS=65476 SACK_PERM TSval=3599751191 TSecr=0 WS=128","40702","4444"
"778","0.985212366","::1","::1","TCP","74","4444  >  40702 [RST, ACK] Seq=1 Ack=1 Win=0 Len=0","4444","40702"
"781","0.985267192","127.0.0.1","127.0.0.1","TLSv1.2","207","Application Data","4444","52700"
"782","0.985284512","127.0.0.1","127.0.0.1","TLSv1.2","207","Application Data","4444","34952"
"783","0.985284512","127.0.0.1","127.0.0.1","TCP","66","52700  >  4444 [ACK] Seq=206 Ack=142 Win=615 Len=0 TSval=2999680168 TSecr=2999680168","52700","4444"
"784","0.985284512","127.0.0.1","127.0.0.1","TLSv1.2","207","Application Data","4444","35172"
"786","0.985304417","127.0.0.1","127.0.0.1","TCP","66","34952  >  4444 [ACK] Seq=206 Ack=142 Win=615 Len=0 TSval=2999680168 TSecr=2999680168","34952","4444"
"787","0.985304417","127.0.0.1","127.0.0.1","TCP","66","35172  >  4444 [ACK] Seq=206 Ack=142 Win=615 Len=0 TSval=2999680168 TSecr=2999680168","35172","4444"
"796","0.985948284","127.0.0.1","127.0.0.1","TLSv1.2","401","Application Data","52748","4444"
"797","0.985986487","127.0.0.1","127.0.0.1","TCP","66","4444  >  52748 [ACK] Seq=1 Ack=336 Win=995 Len=0 TSval=2999680169 TSecr=2999680168","4444","52748"
"804","0.986635801","127.0.0.1","127.0.0.1","TLSv1.2","207","Application Data","4444","52520"
"805","0.986670932","127.0.0.1","127.0.0.1","TLSv1.2","207","Application Data","4444","52628"
"806","0.986675751","127.0.0.1","127.0.0.1","TCP","66","52520  >  4444 [ACK] Seq=206 Ack=142 Win=615 Len=0 TSval=2999680169 TSecr=2999680169","52520","4444"
"808","0.986691395","127.0.0.1","127.0.0.1","TCP","66","52628  >  4444 [ACK] Seq=206 Ack=142 Win=615 Len=0 TSval=2999680169 TSecr=2999680169","52628","4444"
"811","0.986830659","127.0.0.1","127.0.0.1","TLSv1.2","207","Application Data","4444","52466"
"813","0.986851681","127.0.0.1","127.0.0.1","TCP","66","52466  >  4444 [ACK] Seq=206 Ack=142 Win=615 Len=0 TSval=2999680169 TSecr=2999680169","52466","4444"
"819","0.987191389","::1","::1","TCP","94","40714  >  4444 [SYN] Seq=0 Win=65476 Len=0 MSS=65476 SACK_PERM TSval=3599751193 TSecr=0 WS=128","40714","4444"
"820","0.987211922","::1","::1","TCP","74","4444  >  40714 [RST, ACK] Seq=1 Ack=1 Win=0 Len=0","4444","40714"
"827","0.987354398","127.0.0.1","127.0.0.1","TLSv1.2","207","Application Data","4444","52540"
"828","0.987371230","127.0.0.1","127.0.0.1","TCP","66","52540  >  4444 [ACK] Seq=206 Ack=142 Win=615 Len=0 TSval=2999680170 TSecr=2999680170","52540","4444"
"837","0.987904259","127.0.0.1","127.0.0.1","TLSv1.2","401","Application Data","50762","4444"
"839","0.987920951","127.0.0.1","127.0.0.1","TCP","66","4444  >  50762 [ACK] Seq=1 Ack=336 Win=995 Len=0 TSval=2999680170 TSecr=2999680170","4444","50762"
"844","0.988448113","127.0.0.1","127.0.0.1","TLSv1.2","401","Application Data","51322","4444"
"845","0.988466691","127.0.0.1","127.0.0.1","TCP","66","4444  >  51322 [ACK] Seq=1 Ack=336 Win=995 Len=0 TSval=2999680171 TSecr=2999680171","4444","51322"
"864","0.989406335","::1","::1","TCP","94","40718  >  4444 [SYN] Seq=0 Win=65476 Len=0 MSS=65476 SACK_PERM TSval=3599751195 TSecr=0 WS=128","40718","4444"
"865","0.989422608","::1","::1","TCP","74","4444  >  40718 [RST, ACK] Seq=1 Ack=1 Win=0 Len=0","4444","40718"
"874","0.990125630","::1","::1","TCP","94","40730  >  4444 [SYN] Seq=0 Win=65476 Len=0 MSS=65476 SACK_PERM TSval=3599751196 TSecr=0 WS=128","40730","4444"
"875","0.990140786","::1","::1","TCP","74","4444  >  40730 [RST, ACK] Seq=1 Ack=1 Win=0 Len=0","4444","40730"
"895","0.990942983","::1","::1","TCP","94","40740  >  4444 [SYN] Seq=0 Win=65476 Len=0 MSS=65476 SACK_PERM TSval=3599751196 TSecr=0 WS=128","40740","4444"
"897","0.990984119","::1","::1","TCP","74","4444  >  40740 [RST, ACK] Seq=1 Ack=1 Win=0 Len=0","4444","40740"
"908","0.991853085","::1","::1","TCP","94","40746  >  4444 [SYN] Seq=0 Win=65476 Len=0 MSS=65476 SACK_PERM TSval=3599751197 TSecr=0 WS=128","40746","4444"
"909","0.991868240","::1","::1","TCP","74","4444  >  40746 [RST, ACK] Seq=1 Ack=1 Win=0 Len=0","4444","40746"
"927","0.992692577","::1","::1","TCP","94","40758  >  4444 [SYN] Seq=0 Win=65476 Len=0 MSS=65476 SACK_PERM TSval=3599751198 TSecr=0 WS=128","40758","4444"
"928","0.992704101","::1","::1","TCP","74","4444  >  40758 [RST, ACK] Seq=1 Ack=1 Win=0 Len=0","4444","40758"
"939","0.993460412","::1","::1","TCP","94","40764  >  4444 [SYN] Seq=0 Win=65476 Len=0 MSS=65476 SACK_PERM TSval=3599751199 TSecr=0 WS=128","40764","4444"
"940","0.993476824","::1","::1","TCP","74","4444  >  40764 [RST, ACK] Seq=1 Ack=1 Win=0 Len=0","4444","40764"
"954","0.994303536","::1","::1","TCP","94","40776  >  4444 [SYN] Seq=0 Win=65476 Len=0 MSS=65476 SACK_PERM TSval=3599751200 TSecr=0 WS=128","40776","4444"
"956","0.994324348","::1","::1","TCP","74","4444  >  40776 [RST, ACK] Seq=1 Ack=1 Win=0 Len=0","4444","40776"
"971","0.995210983","::1","::1","TCP","94","40786  >  4444 [SYN] Seq=0 Win=65476 Len=0 MSS=65476 SACK_PERM TSval=3599751201 TSecr=0 WS=128","40786","4444"
"972","0.995230399","::1","::1","TCP","74","4444  >  40786 [RST, ACK] Seq=1 Ack=1 Win=0 Len=0","4444","40786"
"980","0.995885999","::1","::1","TCP","94","40788  >  4444 [SYN] Seq=0 Win=65476 Len=0 MSS=65476 SACK_PERM TSval=3599751201 TSecr=0 WS=128","40788","4444"
"981","0.995899618","::1","::1","TCP","74","4444  >  40788 [RST, ACK] Seq=1 Ack=1 Win=0 Len=0","4444","40788"
"992","0.996594120","::1","::1","TCP","94","40790  >  4444 [SYN] Seq=0 Win=65476 Len=0 MSS=65476 SACK_PERM TSval=3599751202 TSecr=0 WS=128","40790","4444"
"993","0.996611371","::1","::1","TCP","74","4444  >  40790 [RST, ACK] Seq=1 Ack=1 Win=0 Len=0","4444","40790"
"1006","0.997438781","::1","::1","TCP","94","40806  >  4444 [SYN] Seq=0 Win=65476 Len=0 MSS=65476 SACK_PERM TSval=3599751203 TSecr=0 WS=128","40806","4444"
"1007","0.997458336","::1","::1","TCP","74","4444  >  40806 [RST, ACK] Seq=1 Ack=1 Win=0 Len=0","4444","40806"
"1019","0.998284558","::1","::1","TCP","94","40812  >  4444 [SYN] Seq=0 Win=65476 Len=0 MSS=65476 SACK_PERM TSval=3599751204 TSecr=0 WS=128","40812","4444"
"1020","0.998301111","::1","::1","TCP","74","4444  >  40812 [RST, ACK] Seq=1 Ack=1 Win=0 Len=0","4444","40812"
"1035","0.999118254","::1","::1","TCP","94","40828  >  4444 [SYN] Seq=0 Win=65476 Len=0 MSS=65476 SACK_PERM TSval=3599751205 TSecr=0 WS=128","40828","4444"
"1036","0.999137181","::1","::1","TCP","74","4444  >  40828 [RST, ACK] Seq=1 Ack=1 Win=0 Len=0","4444","40828"
"1055","1.000076616","::1","::1","TCP","94","40836  >  4444 [SYN] Seq=0 Win=65476 Len=0 MSS=65476 SACK_PERM TSval=3599751206 TSecr=0 WS=128","40836","4444"
"1056","1.000097079","::1","::1","TCP","74","4444  >  40836 [RST, ACK] Seq=1 Ack=1 Win=0 Len=0","4444","40836"
"1070","1.000880629","::1","::1","TCP","94","40842  >  4444 [SYN] Seq=0 Win=65476 Len=0 MSS=65476 SACK_PERM TSval=3599751206 TSecr=0 WS=128","40842","4444"
"1075","1.000898578","::1","::1","TCP","74","4444  >  40842 [RST, ACK] Seq=1 Ack=1 Win=0 Len=0","4444","40842"
"1079","1.001377968","127.0.0.1","127.0.0.1","TLSv1.2","401","Application Data","51224","4444"
"1080","1.001400737","127.0.0.1","127.0.0.1","TCP","66","4444  >  51224 [ACK] Seq=1 Ack=336 Win=995 Len=0 TSval=2999680184 TSecr=2999680184","4444","51224"
"1087","1.002078337","::1","::1","TCP","94","40852  >  4444 [SYN] Seq=0 Win=65476 Len=0 MSS=65476 SACK_PERM TSval=3599751208 TSecr=0 WS=128","40852","4444"
"1088","1.002092235","::1","::1","TCP","74","4444  >  40852 [RST, ACK] Seq=1 Ack=1 Win=0 Len=0","4444","40852"
"1091","1.002515264","::1","::1","TCP","94","40858  >  4444 [SYN] Seq=0 Win=65476 Len=0 MSS=65476 SACK_PERM TSval=3599751208 TSecr=0 WS=128","40858","4444"
"1092","1.002533772","::1","::1","TCP","74","4444  >  40858 [RST, ACK] Seq=1 Ack=1 Win=0 Len=0","4444","40858"
"1112","1.003348889","::1","::1","TCP","94","40866  >  4444 [SYN] Seq=0 Win=65476 Len=0 MSS=65476 SACK_PERM TSval=3599751209 TSecr=0 WS=128","40866","4444"
"1113","1.003363137","::1","::1","TCP","74","4444  >  40866 [RST, ACK] Seq=1 Ack=1 Win=0 Len=0","4444","40866"
"1124","1.004305296","::1","::1","TCP","94","40876  >  4444 [SYN] Seq=0 Win=65476 Len=0 MSS=65476 SACK_PERM TSval=3599751210 TSecr=0 WS=128","40876","4444"
"1125","1.004321080","::1","::1","TCP","74","4444  >  40876 [RST, ACK] Seq=1 Ack=1 Win=0 Len=0","4444","40876"
"1136","1.004825543","127.0.0.1","127.0.0.1","TLSv1.2","401","Application Data","51212","4444"
"1137","1.004850337","127.0.0.1","127.0.0.1","TCP","66","4444  >  51212 [ACK] Seq=1 Ack=336 Win=995 Len=0 TSval=2999680187 TSecr=2999680187","4444","51212"
"1148","1.005564255","127.0.0.1","127.0.0.1","TLSv1.2","401","Application Data","50870","4444"
"1151","1.005592890","127.0.0.1","127.0.0.1","TCP","66","4444  >  50870 [ACK] Seq=1 Ack=336 Win=995 Len=0 TSval=2999680188 TSecr=2999680188","4444","50870"
"1163","1.006393480","127.0.0.1","127.0.0.1","TLSv1.2","401","Application Data","51048","4444"
"1164","1.006416807","127.0.0.1","127.0.0.1","TCP","66","4444  >  51048 [ACK] Seq=1 Ack=336 Win=907 Len=0 TSval=2999680189 TSecr=2999680189","4444","51048"
"1185","1.007655442","127.0.0.1","127.0.0.1","TLSv1.2","401","Application Data","50656","4444"
"1186","1.007672483","127.0.0.1","127.0.0.1","TCP","66","4444  >  50656 [ACK] Seq=1 Ack=336 Win=907 Len=0 TSval=2999680190 TSecr=2999680190","4444","50656"
"1195","1.008023506","127.0.0.1","127.0.0.1","TLSv1.2","401","Application Data","51018","4444"
"1196","1.008049556","127.0.0.1","127.0.0.1","TCP","66","4444  >  51018 [ACK] Seq=1 Ack=336 Win=907 Len=0 TSval=2999680191 TSecr=2999680191","4444","51018"
"1203","1.008666953","127.0.0.1","127.0.0.1","TLSv1.2","401","Application Data","50830","4444"
"1205","1.008696566","127.0.0.1","127.0.0.1","TCP","66","4444  >  50830 [ACK] Seq=1 Ack=336 Win=995 Len=0 TSval=2999680191 TSecr=2999680191","4444","50830"
"1212","1.009309074","127.0.0.1","127.0.0.1","TLSv1.2","401","Application Data","51348","4444"
"1213","1.009336173","127.0.0.1","127.0.0.1","TCP","66","4444  >  51348 [ACK] Seq=1 Ack=336 Win=995 Len=0 TSval=2999680192 TSecr=2999680192","4444","51348"
"1224","1.010069227","127.0.0.1","127.0.0.1","TLSv1.2","401","Application Data","51444","4444"
"1225","1.010089481","127.0.0.1","127.0.0.1","TCP","66","4444  >  51444 [ACK] Seq=1 Ack=336 Win=995 Len=0 TSval=2999680193 TSecr=2999680193","4444","51444"
"1238","1.010779443","127.0.0.1","127.0.0.1","TLSv1.2","401","Application Data","51016","4444"
"1239","1.010815201","127.0.0.1","127.0.0.1","TCP","66","4444  >  51016 [ACK] Seq=1 Ack=336 Win=907 Len=0 TSval=2999680193 TSecr=2999680193","4444","51016"
"1254","1.011684027","127.0.0.1","127.0.0.1","TLSv1.2","401","Application Data","51052","4444"
"1256","1.011706376","127.0.0.1","127.0.0.1","TCP","66","4444  >  51052 [ACK] Seq=1 Ack=336 Win=907 Len=0 TSval=2999680194 TSecr=2999680194","4444","51052"
"1284","1.013561570","127.0.0.1","127.0.0.1","TLSv1.2","401","Application Data","51110","4444"
"1286","1.013584338","127.0.0.1","127.0.0.1","TCP","66","4444  >  51110 [ACK] Seq=1 Ack=336 Win=907 Len=0 TSval=2999680196 TSecr=2999680196","4444","51110"
"1299","1.014193633","127.0.0.1","127.0.0.1","TLSv1.2","401","Application Data","50888","4444"
"1300","1.014214237","127.0.0.1","127.0.0.1","TCP","66","4444  >  50888 [ACK] Seq=1 Ack=336 Win=995 Len=0 TSval=2999680197 TSecr=2999680197","4444","50888"
"1305","1.014744192","127.0.0.1","127.0.0.1","TLSv1.2","401","Application Data","51300","4444"
"1307","1.014769405","127.0.0.1","127.0.0.1","TCP","66","4444  >  51300 [ACK] Seq=1 Ack=336 Win=995 Len=0 TSval=2999680197 TSecr=2999680197","4444","51300"
"1324","1.015336516","127.0.0.1","127.0.0.1","TLSv1.2","401","Application Data","51254","4444"
"1326","1.015364662","127.0.0.1","127.0.0.1","TCP","66","4444  >  51254 [ACK] Seq=1 Ack=336 Win=995 Len=0 TSval=2999680198 TSecr=2999680198","4444","51254"
"1343","1.016180967","127.0.0.1","127.0.0.1","TLSv1.2","401","Application Data","51144","4444"
"1345","1.016204992","127.0.0.1","127.0.0.1","TCP","66","4444  >  51144 [ACK] Seq=1 Ack=336 Win=995 Len=0 TSval=2999680199 TSecr=2999680199","4444","51144"
"1351","1.016793196","127.0.0.1","127.0.0.1","TLSv1.2","401","Application Data","50818","4444"
"1352","1.016816593","127.0.0.1","127.0.0.1","TCP","66","4444  >  50818 [ACK] Seq=1 Ack=336 Win=995 Len=0 TSval=2999680199 TSecr=2999680199","4444","50818"
"1364","1.017364986","127.0.0.1","127.0.0.1","TLSv1.2","401","Application Data","34906","4444"
"1365","1.017383634","127.0.0.1","127.0.0.1","TCP","66","4444  >  34906 [ACK] Seq=1 Ack=336 Win=995 Len=0 TSval=2999680200 TSecr=2999680200","4444","34906"
"1376","1.017872174","127.0.0.1","127.0.0.1","TLSv1.2","401","Application Data","50642","4444"
"1377","1.017894104","127.0.0.1","127.0.0.1","TCP","66","4444  >  50642 [ACK] Seq=1 Ack=336 Win=907 Len=0 TSval=2999680200 TSecr=2999680200","4444","50642"
"1385","1.018441590","127.0.0.1","127.0.0.1","TLSv1.2","401","Application Data","51208","4444"
"1386","1.018462891","127.0.0.1","127.0.0.1","TCP","66","4444  >  51208 [ACK] Seq=1 Ack=336 Win=995 Len=0 TSval=2999680201 TSecr=2999680201","4444","51208"
"1409","1.019600955","127.0.0.1","127.0.0.1","TLSv1.2","401","Application Data","51198","4444"
"1410","1.019622536","127.0.0.1","127.0.0.1","TCP","66","4444  >  51198 [ACK] Seq=1 Ack=336 Win=995 Len=0 TSval=2999680202 TSecr=2999680202","4444","51198"
"1420","1.020228129","127.0.0.1","127.0.0.1","TLSv1.2","401","Application Data","50694","4444"
"1421","1.020244402","127.0.0.1","127.0.0.1","TCP","66","4444  >  50694 [ACK] Seq=1 Ack=336 Win=907 Len=0 TSval=2999680203 TSecr=2999680203","4444","50694"
"1434","1.020766257","127.0.0.1","127.0.0.1","TLSv1.2","401","Application Data","50940","4444"
"1435","1.020784415","127.0.0.1","127.0.0.1","TCP","66","4444  >  50940 [ACK] Seq=1 Ack=336 Win=995 Len=0 TSval=2999680203 TSecr=2999680203","4444","50940"
"1452","1.021826028","127.0.0.1","127.0.0.1","TLSv1.2","401","Application Data","50984","4444"
"1453","1.021850403","127.0.0.1","127.0.0.1","TCP","66","4444  >  50984 [ACK] Seq=1 Ack=336 Win=907 Len=0 TSval=2999680204 TSecr=2999680204","4444","50984"
"1862","1.039351091","127.0.0.1","127.0.0.1","TLSv1.2","2397","Application Data","4444","51038"
"1863","1.039380075","127.0.0.1","127.0.0.1","TCP","66","51038  >  4444 [ACK] Seq=336 Ack=2332 Win=706 Len=0 TSval=2999680222 TSecr=2999680222","51038","4444"
"1920","1.041717383","127.0.0.1","127.0.0.1","TLSv1.2","2396","Application Data","4444","51184"
"1923","1.041751675","127.0.0.1","127.0.0.1","TCP","66","51184  >  4444 [ACK] Seq=336 Ack=2331 Win=706 Len=0 TSval=2999680224 TSecr=2999680224","51184","4444"
"2019","1.046062279","127.0.0.1","127.0.0.1","TLSv1.2","2395","Application Data","4444","50762"
"2020","1.046094615","127.0.0.1","127.0.0.1","TCP","66","50762  >  4444 [ACK] Seq=336 Ack=2330 Win=706 Len=0 TSval=2999680229 TSecr=2999680229","50762","4444"
"2073","1.048546673","127.0.0.1","127.0.0.1","TLSv1.2","2391","Application Data","4444","52748"
"2074","1.048581035","127.0.0.1","127.0.0.1","TCP","66","52748  >  4444 [ACK] Seq=336 Ack=2326 Win=706 Len=0 TSval=2999680231 TSecr=2999680231","52748","4444"
"2270","1.056210356","127.0.0.1","127.0.0.1","TLSv1.2","2396","Application Data","4444","51322"
"2272","1.056244159","127.0.0.1","127.0.0.1","TCP","66","51322  >  4444 [ACK] Seq=336 Ack=2331 Win=706 Len=0 TSval=2999680239 TSecr=2999680239","51322","4444"
"2969","1.088629910","127.0.0.1","127.0.0.1","TLSv1.2","2399","Application Data","4444","51224"
"2970","1.088668392","127.0.0.1","127.0.0.1","TCP","66","51224  >  4444 [ACK] Seq=336 Ack=2334 Win=706 Len=0 TSval=2999680271 TSecr=2999680271","51224","4444"
"3086","1.097328571","127.0.0.1","127.0.0.1","TLSv1.2","2396","Application Data","4444","50870"
"3087","1.097363911","127.0.0.1","127.0.0.1","TCP","66","50870  >  4444 [ACK] Seq=336 Ack=2331 Win=706 Len=0 TSval=2999680280 TSecr=2999680280","50870","4444"
"3160","1.103669810","127.0.0.1","127.0.0.1","TLSv1.2","2397","Application Data","4444","50656"
"3161","1.103705988","127.0.0.1","127.0.0.1","TCP","66","50656  >  4444 [ACK] Seq=336 Ack=2332 Win=706 Len=0 TSval=2999680286 TSecr=2999680286","50656","4444"
"3184","1.106473588","127.0.0.1","127.0.0.1","TLSv1.2","2396","Application Data","4444","51212"
"3185","1.106510534","127.0.0.1","127.0.0.1","TCP","66","51212  >  4444 [ACK] Seq=336 Ack=2331 Win=706 Len=0 TSval=2999680289 TSecr=2999680289","51212","4444"
"3189","1.107180871","127.0.0.1","127.0.0.1","TLSv1.2","2395","Application Data","4444","50642"
"3190","1.107204198","127.0.0.1","127.0.0.1","TCP","66","50642  >  4444 [ACK] Seq=336 Ack=2330 Win=706 Len=0 TSval=2999680290 TSecr=2999680290","50642","4444"
"3196","1.107988655","127.0.0.1","127.0.0.1","TLSv1.2","2392","Application Data","4444","51048"
"3197","1.108019176","127.0.0.1","127.0.0.1","TCP","66","51048  >  4444 [ACK] Seq=336 Ack=2327 Win=706 Len=0 TSval=2999680291 TSecr=2999680290","51048","4444"
"3206","1.109223239","127.0.0.1","127.0.0.1","TLSv1.2","2400","Application Data","4444","51052"
"3207","1.109249849","127.0.0.1","127.0.0.1","TCP","66","51052  >  4444 [ACK] Seq=336 Ack=2335 Win=706 Len=0 TSval=2999680292 TSecr=2999680292","51052","4444"
"3221","1.111252478","127.0.0.1","127.0.0.1","TLSv1.2","2395","Application Data","4444","51444"
"3222","1.111277201","127.0.0.1","127.0.0.1","TCP","66","51444  >  4444 [ACK] Seq=336 Ack=2330 Win=706 Len=0 TSval=2999680294 TSecr=2999680294","51444","4444"
"3230","1.112010255","127.0.0.1","127.0.0.1","TLSv1.2","2394","Application Data","4444","51018"
"3231","1.112038401","127.0.0.1","127.0.0.1","TCP","66","51018  >  4444 [ACK] Seq=336 Ack=2329 Win=706 Len=0 TSval=2999680295 TSecr=2999680295","51018","4444"
"3233","1.112390262","127.0.0.1","127.0.0.1","TLSv1.2","2395","Application Data","4444","51348"
"3234","1.112430281","127.0.0.1","127.0.0.1","TCP","66","51348  >  4444 [ACK] Seq=336 Ack=2330 Win=706 Len=0 TSval=2999680295 TSecr=2999680295","51348","4444"
"3306","1.117442161","127.0.0.1","127.0.0.1","TLSv1.2","2396","Application Data","4444","51016"
"3307","1.117479456","127.0.0.1","127.0.0.1","TCP","66","51016  >  4444 [ACK] Seq=336 Ack=2331 Win=706 Len=0 TSval=2999680300 TSecr=2999680300","51016","4444"
"3318","1.118259374","127.0.0.1","127.0.0.1","TLSv1.2","2395","Application Data","4444","50818"
"3319","1.118284726","127.0.0.1","127.0.0.1","TCP","66","50818  >  4444 [ACK] Seq=336 Ack=2330 Win=706 Len=0 TSval=2999680301 TSecr=2999680301","50818","4444"
"3323","1.118600828","127.0.0.1","127.0.0.1","TLSv1.2","2396","Application Data","4444","51254"
"3324","1.118622618","127.0.0.1","127.0.0.1","TCP","66","51254  >  4444 [ACK] Seq=336 Ack=2331 Win=706 Len=0 TSval=2999680301 TSecr=2999680301","51254","4444"
"3334","1.119349247","127.0.0.1","127.0.0.1","TLSv1.2","2395","Application Data","4444","50830"
"3336","1.119371247","127.0.0.1","127.0.0.1","TCP","66","50830  >  4444 [ACK] Seq=336 Ack=2330 Win=706 Len=0 TSval=2999680302 TSecr=2999680302","50830","4444"
"3360","1.121857946","127.0.0.1","127.0.0.1","TLSv1.2","2393","Application Data","4444","51208"
"3361","1.121899501","127.0.0.1","127.0.0.1","TCP","66","51208  >  4444 [ACK] Seq=336 Ack=2328 Win=706 Len=0 TSval=2999680304 TSecr=2999680304","51208","4444"
"3366","1.123173057","127.0.0.1","127.0.0.1","TLSv1.2","2395","Application Data","4444","50940"
"3367","1.123207419","127.0.0.1","127.0.0.1","TCP","66","50940  >  4444 [ACK] Seq=336 Ack=2330 Win=706 Len=0 TSval=2999680306 TSecr=2999680306","50940","4444"
"3370","1.123595247","127.0.0.1","127.0.0.1","TLSv1.2","2394","Application Data","4444","51110"
"3371","1.123621508","127.0.0.1","127.0.0.1","TCP","66","51110  >  4444 [ACK] Seq=336 Ack=2329 Win=706 Len=0 TSval=2999680306 TSecr=2999680306","51110","4444"
"3378","1.124268657","127.0.0.1","127.0.0.1","TLSv1.2","2394","Application Data","4444","34906"
"3379","1.124298689","127.0.0.1","127.0.0.1","TCP","66","34906  >  4444 [ACK] Seq=336 Ack=2329 Win=706 Len=0 TSval=2999680307 TSecr=2999680307","34906","4444"
"3381","1.124487609","127.0.0.1","127.0.0.1","TLSv1.2","2391","Application Data","4444","50888"
"3383","1.124506187","127.0.0.1","127.0.0.1","TCP","66","50888  >  4444 [ACK] Seq=336 Ack=2326 Win=706 Len=0 TSval=2999680307 TSecr=2999680307","50888","4444"
"3388","1.124865101","127.0.0.1","127.0.0.1","TLSv1.2","2397","Application Data","4444","50694"
"3389","1.124889476","127.0.0.1","127.0.0.1","TCP","66","50694  >  4444 [ACK] Seq=336 Ack=2332 Win=706 Len=0 TSval=2999680307 TSecr=2999680307","50694","4444"
"3391","1.125069876","127.0.0.1","127.0.0.1","TLSv1.2","2395","Application Data","4444","51300"
"3392","1.125092295","127.0.0.1","127.0.0.1","TCP","66","51300  >  4444 [ACK] Seq=336 Ack=2330 Win=706 Len=0 TSval=2999680308 TSecr=2999680308","51300","4444"
"3396","1.126058410","127.0.0.1","127.0.0.1","TLSv1.2","2395","Application Data","4444","51198"
"3398","1.126083832","127.0.0.1","127.0.0.1","TCP","66","51198  >  4444 [ACK] Seq=336 Ack=2330 Win=706 Len=0 TSval=2999680309 TSecr=2999680309","51198","4444"
"3405","1.127198499","127.0.0.1","127.0.0.1","TLSv1.2","2394","Application Data","4444","51144"
"3406","1.127214772","127.0.0.1","127.0.0.1","TCP","66","51144  >  4444 [ACK] Seq=336 Ack=2329 Win=706 Len=0 TSval=2999680310 TSecr=2999680310","51144","4444"
"3423","1.132505248","127.0.0.1","127.0.0.1","TLSv1.2","2395","Application Data","4444","50984"
"3424","1.132524874","127.0.0.1","127.0.0.1","TCP","66","50984  >  4444 [ACK] Seq=336 Ack=2330 Win=706 Len=0 TSval=2999680315 TSecr=2999680315","50984","4444"
"3523","1.739943973","127.0.0.1","127.0.0.1","TLSv1.2","2840","Application Data","35210","4444"
"3586","1.761260020","127.0.0.1","127.0.0.1","TLSv1.2","2194","Application Data","4444","35324"
"3587","1.761302903","127.0.0.1","127.0.0.1","TCP","66","35324  >  4444 [ACK] Seq=1 Ack=2129 Win=688 Len=0 TSval=2999680944 TSecr=2999680944","35324","4444"
"3598","1.765423329","127.0.0.1","127.0.0.1","TLSv1.2","2841","Application Data","35116","4444"
"3605","1.767110345","127.0.0.1","127.0.0.1","TLSv1.2","2840","Application Data","52720","4444"
"3608","1.767554675","127.0.0.1","127.0.0.1","TLSv1.2","2841","Application Data","52422","4444"
"3612","1.768126675","127.0.0.1","127.0.0.1","TLSv1.2","2841","Application Data","52466","4444"
"3633","1.769920199","127.0.0.1","127.0.0.1","TLSv1.2","2839","Application Data","35014","4444"
"3639","1.770511196","127.0.0.1","127.0.0.1","TLSv1.2","2841","Application Data","35180","4444"
"3646","1.771123355","127.0.0.1","127.0.0.1","TLSv1.2","2840","Application Data","52594","4444"
"3656","1.771944549","127.0.0.1","127.0.0.1","TLSv1.2","2840","Application Data","35124","4444"
"3670","1.772559152","127.0.0.1","127.0.0.1","TLSv1.2","2840","Application Data","35270","4444"
"3677","1.773086733","127.0.0.1","127.0.0.1","TLSv1.2","2839","Application Data","52760","4444"
"3685","1.773614244","127.0.0.1","127.0.0.1","TLSv1.2","2840","Application Data","52502","4444"
"3691","1.774182193","127.0.0.1","127.0.0.1","TLSv1.2","2840","Application Data","52312","4444"
"3699","1.774619120","127.0.0.1","127.0.0.1","TLSv1.2","165","Application Data","4444","35324"
"3700","1.774651038","127.0.0.1","127.0.0.1","TCP","66","35324  >  4444 [ACK] Seq=1 Ack=2228 Win=688 Len=0 TSval=2999680957 TSecr=2999680957","35324","4444"
"3704","1.774757546","127.0.0.1","127.0.0.1","TLSv1.2","2840","Application Data","34984","4444"
"3713","1.775245876","127.0.0.1","127.0.0.1","TLSv1.2","144","Application Data","4444","35210"
"3714","1.775271159","127.0.0.1","127.0.0.1","TCP","66","35210  >  4444 [ACK] Seq=2980 Ack=220 Win=615 Len=0 TSval=2999680958 TSecr=2999680958","35210","4444"
"3717","1.775368028","127.0.0.1","127.0.0.1","TLSv1.2","2841","Application Data","52628","4444"
"3731","1.775873121","127.0.0.1","127.0.0.1","TLSv1.2","2840","Application Data","52302","4444"
"3751","1.776997914","127.0.0.1","127.0.0.1","TLSv1.2","2839","Application Data","34952","4444"
"3760","1.777588353","127.0.0.1","127.0.0.1","TLSv1.2","2840","Application Data","52440","4444"
"3769","1.778269445","127.0.0.1","127.0.0.1","TLSv1.2","2841","Application Data","52348","4444"
"3779","1.779052645","127.0.0.1","127.0.0.1","TLSv1.2","2839","Application Data","52700","4444"
"3794","1.779641965","127.0.0.1","127.0.0.1","TLSv1.2","2840","Application Data","52540","4444"
"3810","1.780466791","127.0.0.1","127.0.0.1","TLSv1.2","2840","Application Data","52520","4444"
"3819","1.781280302","127.0.0.1","127.0.0.1","TLSv1.2","2840","Application Data","52730","4444"
"3832","1.782017826","127.0.0.1","127.0.0.1","TLSv1.2","2841","Application Data","52304","4444"
"3861","1.783269033","127.0.0.1","127.0.0.1","TLSv1.2","2840","Application Data","35172","4444"
"3872","1.783929033","127.0.0.1","127.0.0.1","TLSv1.2","2841","Application Data","52408","4444"
"3890","1.784677592","127.0.0.1","127.0.0.1","TLSv1.2","2840","Application Data","52324","4444"
"3909","1.785317058","127.0.0.1","127.0.0.1","TLSv1.2","2840","Application Data","52486","4444"
"3925","1.786093065","127.0.0.1","127.0.0.1","TLSv1.2","2841","Application Data","52590","4444"
"4449","1.805998178","127.0.0.1","127.0.0.1","TCP","66","4444  >  35116 [ACK] Seq=142 Ack=2981 Win=739 Len=0 TSval=2999680989 TSecr=2999680948","4444","35116"
"4525","1.807994661","127.0.0.1","127.0.0.1","TCP","66","4444  >  52422 [ACK] Seq=142 Ack=2981 Win=739 Len=0 TSval=2999680991 TSecr=2999680950","4444","52422"
"4527","1.808008560","127.0.0.1","127.0.0.1","TCP","66","4444  >  52720 [ACK] Seq=142 Ack=2980 Win=739 Len=0 TSval=2999680991 TSecr=2999680950","4444","52720"
"4561","1.809002331","127.0.0.1","127.0.0.1","TCP","66","4444  >  52466 [ACK] Seq=142 Ack=2981 Win=739 Len=0 TSval=2999680992 TSecr=2999680951","4444","52466"
"4599","1.810000503","127.0.0.1","127.0.0.1","TCP","66","4444  >  35014 [ACK] Seq=142 Ack=2979 Win=739 Len=0 TSval=2999680993 TSecr=2999680952","4444","35014"
"4637","1.811008312","127.0.0.1","127.0.0.1","TCP","66","4444  >  35180 [ACK] Seq=142 Ack=2981 Win=739 Len=0 TSval=2999680994 TSecr=2999680953","4444","35180"
"4671","1.811978128","127.0.0.1","127.0.0.1","TCP","66","4444  >  52594 [ACK] Seq=142 Ack=2980 Win=739 Len=0 TSval=2999680995 TSecr=2999680954","4444","52594"
"4710","1.812989151","127.0.0.1","127.0.0.1","TCP","66","4444  >  35270 [ACK] Seq=142 Ack=2980 Win=739 Len=0 TSval=2999680996 TSecr=2999680955","4444","35270"
"4711","1.813002071","127.0.0.1","127.0.0.1","TCP","66","4444  >  35124 [ACK] Seq=142 Ack=2980 Win=739 Len=0 TSval=2999680996 TSecr=2999680954","4444","35124"
"4745","1.813996052","127.0.0.1","127.0.0.1","TCP","66","4444  >  52502 [ACK] Seq=142 Ack=2980 Win=739 Len=0 TSval=2999680997 TSecr=2999680956","4444","52502"
"4746","1.814010160","127.0.0.1","127.0.0.1","TCP","66","4444  >  52760 [ACK] Seq=142 Ack=2979 Win=739 Len=0 TSval=2999680997 TSecr=2999680956","4444","52760"
"4782","1.814994713","127.0.0.1","127.0.0.1","TCP","66","4444  >  34984 [ACK] Seq=142 Ack=2980 Win=739 Len=0 TSval=2999680998 TSecr=2999680957","4444","34984"
"4784","1.815006167","127.0.0.1","127.0.0.1","TCP","66","4444  >  52312 [ACK] Seq=142 Ack=2980 Win=739 Len=0 TSval=2999680998 TSecr=2999680957","4444","52312"
"4861","1.816992732","127.0.0.1","127.0.0.1","TCP","66","4444  >  52302 [ACK] Seq=142 Ack=2980 Win=739 Len=0 TSval=2999681000 TSecr=2999680958","4444","52302"
