"No.","Time","Source","Destination","Protocol","Length","Info"
"564","9.458770458","127.0.0.1","127.0.0.1","TCP","66","45870  >  4444 [ACK] Seq=1 Ack=1 Win=65536 Len=0 TSval=2061811853 TSecr=2061811853"
"566","9.459831766","127.0.0.1","127.0.0.1","TCP","66","4444  >  45870 [ACK] Seq=1 Ack=237 Win=65280 Len=0 TSval=2061811855 TSecr=2061811854"
"568","9.463452128","127.0.0.1","127.0.0.1","TCP","66","45870  >  4444 [ACK] Seq=237 Ack=1490 Win=80000 Len=0 TSval=2061811858 TSecr=2061811858"
"593","9.505822806","127.0.0.1","127.0.0.1","TCP","66","4444  >  45870 [ACK] Seq=1836 Ack=763 Win=65536 Len=0 TSval=2061811901 TSecr=2061811860"
"650","9.564814661","127.0.0.1","127.0.0.1","TCP","66","45882  >  4444 [ACK] Seq=1 Ack=1 Win=65536 Len=0 TSval=2061811959 TSecr=2061811959"
"652","9.566621455","127.0.0.1","127.0.0.1","TCP","66","4444  >  45882 [ACK] Seq=1 Ack=237 Win=65280 Len=0 TSval=2061811961 TSecr=2061811961"
"654","9.568948008","127.0.0.1","127.0.0.1","TCP","66","45882  >  4444 [ACK] Seq=237 Ack=1490 Win=80000 Len=0 TSval=2061811964 TSecr=2061811964"
"699","9.585474410","127.0.0.1","127.0.0.1","TCP","66","45896  >  4444 [ACK] Seq=1 Ack=1 Win=65536 Len=0 TSval=2061811980 TSecr=2061811980"
"701","9.586473979","127.0.0.1","127.0.0.1","TCP","66","4444  >  45896 [ACK] Seq=1 Ack=237 Win=65280 Len=0 TSval=2061811981 TSecr=2061811981"
"703","9.590335293","127.0.0.1","127.0.0.1","TCP","66","45896  >  4444 [ACK] Seq=237 Ack=1490 Win=80000 Len=0 TSval=2061811985 TSecr=2061811985"
"707","9.592852443","127.0.0.1","127.0.0.1","TCP","66","45870  >  4444 [ACK] Seq=763 Ack=2195 Win=80640 Len=0 TSval=2061811988 TSecr=2061811947"
"749","9.607833048","127.0.0.1","127.0.0.1","TCP","66","45904  >  4444 [ACK] Seq=1 Ack=1 Win=65536 Len=0 TSval=2061812003 TSecr=2061812002"
"751","9.608946248","127.0.0.1","127.0.0.1","TCP","66","4444  >  45904 [ACK] Seq=1 Ack=237 Win=65280 Len=0 TSval=2061812004 TSecr=2061812004"
"753","9.612178502","127.0.0.1","127.0.0.1","TCP","66","45904  >  4444 [ACK] Seq=237 Ack=1490 Win=80000 Len=0 TSval=2061812007 TSecr=2061812007"
"760","9.616833144","127.0.0.1","127.0.0.1","TCP","66","45882  >  4444 [ACK] Seq=763 Ack=2195 Win=80640 Len=0 TSval=2061812012 TSecr=2061811971"
"799","9.631351749","127.0.0.1","127.0.0.1","TCP","66","45920  >  4444 [ACK] Seq=1 Ack=1 Win=65536 Len=0 TSval=2061812026 TSecr=2061812026"
"801","9.632260175","127.0.0.1","127.0.0.1","TCP","66","4444  >  45920 [ACK] Seq=1 Ack=237 Win=65280 Len=0 TSval=2061812027 TSecr=2061812027"
"803","9.635620169","127.0.0.1","127.0.0.1","TCP","66","45920  >  4444 [ACK] Seq=237 Ack=1490 Win=80000 Len=0 TSval=2061812030 TSecr=2061812030"
"805","9.637858163","127.0.0.1","127.0.0.1","TCP","66","45896  >  4444 [ACK] Seq=763 Ack=2195 Win=80640 Len=0 TSval=2061812033 TSecr=2061811992"
"849","9.653193841","127.0.0.1","127.0.0.1","TCP","66","45936  >  4444 [ACK] Seq=1 Ack=1 Win=65536 Len=0 TSval=2061812048 TSecr=2061812048"
"851","9.654152901","127.0.0.1","127.0.0.1","TCP","66","4444  >  45936 [ACK] Seq=1 Ack=237 Win=65280 Len=0 TSval=2061812049 TSecr=2061812049"
"853","9.657419797","127.0.0.1","127.0.0.1","TCP","66","45936  >  4444 [ACK] Seq=237 Ack=1490 Win=80000 Len=0 TSval=2061812052 TSecr=2061812052"
"870","9.662845766","127.0.0.1","127.0.0.1","TCP","66","45904  >  4444 [ACK] Seq=763 Ack=2195 Win=80640 Len=0 TSval=2061812058 TSecr=2061812016"
"903","9.676362498","127.0.0.1","127.0.0.1","TCP","66","45944  >  4444 [ACK] Seq=1 Ack=1 Win=65536 Len=0 TSval=2061812071 TSecr=2061812071"
"905","9.677189000","127.0.0.1","127.0.0.1","TCP","66","4444  >  45944 [ACK] Seq=1 Ack=237 Win=65280 Len=0 TSval=2061812072 TSecr=2061812072"
"907","9.680265019","127.0.0.1","127.0.0.1","TCP","66","45944  >  4444 [ACK] Seq=237 Ack=1490 Win=80000 Len=0 TSval=2061812075 TSecr=2061812075"
"911","9.682840975","127.0.0.1","127.0.0.1","TCP","66","45920  >  4444 [ACK] Seq=763 Ack=2195 Win=80640 Len=0 TSval=2061812078 TSecr=2061812037"
"953","9.695707694","127.0.0.1","127.0.0.1","TCP","66","45948  >  4444 [ACK] Seq=1 Ack=1 Win=65536 Len=0 TSval=2061812090 TSecr=2061812090"
"955","9.696591466","127.0.0.1","127.0.0.1","TCP","66","4444  >  45948 [ACK] Seq=1 Ack=237 Win=65280 Len=0 TSval=2061812091 TSecr=2061812091"
"957","9.699291250","127.0.0.1","127.0.0.1","TCP","66","45948  >  4444 [ACK] Seq=237 Ack=1490 Win=80000 Len=0 TSval=2061812094 TSecr=2061812094"
"977","9.705837264","127.0.0.1","127.0.0.1","TCP","66","45936  >  4444 [ACK] Seq=763 Ack=2195 Win=80640 Len=0 TSval=2061812101 TSecr=2061812060"
"1003","9.715678458","127.0.0.1","127.0.0.1","TCP","66","45958  >  4444 [ACK] Seq=1 Ack=1 Win=65536 Len=0 TSval=2061812110 TSecr=2061812110"
"1005","9.716662592","127.0.0.1","127.0.0.1","TCP","66","4444  >  45958 [ACK] Seq=1 Ack=237 Win=65280 Len=0 TSval=2061812111 TSecr=2061812111"
"1007","9.722788720","127.0.0.1","127.0.0.1","TCP","66","45958  >  4444 [ACK] Seq=237 Ack=1490 Win=80000 Len=0 TSval=2061812117 TSecr=2061812117"
"1019","9.727828746","127.0.0.1","127.0.0.1","TCP","66","45944  >  4444 [ACK] Seq=763 Ack=2195 Win=80640 Len=0 TSval=2061812123 TSecr=2061812082"
"1053","9.740449065","127.0.0.1","127.0.0.1","TCP","66","45960  >  4444 [ACK] Seq=1 Ack=1 Win=65536 Len=0 TSval=2061812135 TSecr=2061812135"
"1055","9.741314747","127.0.0.1","127.0.0.1","TCP","66","4444  >  45960 [ACK] Seq=1 Ack=237 Win=65280 Len=0 TSval=2061812136 TSecr=2061812136"
"1057","9.745010049","127.0.0.1","127.0.0.1","TCP","66","45960  >  4444 [ACK] Seq=237 Ack=1490 Win=80000 Len=0 TSval=2061812140 TSecr=2061812140"
"1059","9.746842475","127.0.0.1","127.0.0.1","TCP","66","45948  >  4444 [ACK] Seq=763 Ack=2195 Win=80640 Len=0 TSval=2061812142 TSecr=2061812101"
"1103","9.760880572","127.0.0.1","127.0.0.1","TCP","66","45962  >  4444 [ACK] Seq=1 Ack=1 Win=65536 Len=0 TSval=2061812156 TSecr=2061812156"
"1105","9.762007601","127.0.0.1","127.0.0.1","TCP","66","4444  >  45962 [ACK] Seq=1 Ack=237 Win=65280 Len=0 TSval=2061812157 TSecr=2061812157"
"1107","9.764606325","127.0.0.1","127.0.0.1","TCP","66","45962  >  4444 [ACK] Seq=237 Ack=1490 Win=80000 Len=0 TSval=2061812159 TSecr=2061812159"
"1134","9.771833151","127.0.0.1","127.0.0.1","TCP","66","45958  >  4444 [ACK] Seq=763 Ack=2195 Win=80640 Len=0 TSval=2061812167 TSecr=2061812125"
"1157","9.781309146","127.0.0.1","127.0.0.1","TCP","66","45968  >  4444 [ACK] Seq=1 Ack=1 Win=65536 Len=0 TSval=2061812176 TSecr=2061812176"
"1159","9.782483876","127.0.0.1","127.0.0.1","TCP","66","4444  >  45968 [ACK] Seq=1 Ack=237 Win=65280 Len=0 TSval=2061812177 TSecr=2061812177"
"1161","9.785171369","127.0.0.1","127.0.0.1","TCP","66","45968  >  4444 [ACK] Seq=237 Ack=1490 Win=80000 Len=0 TSval=2061812180 TSecr=2061812180"
"1184","9.792824856","127.0.0.1","127.0.0.1","TCP","66","45960  >  4444 [ACK] Seq=763 Ack=2195 Win=80640 Len=0 TSval=2061812188 TSecr=2061812146"
"1207","9.802424260","127.0.0.1","127.0.0.1","TCP","66","45978  >  4444 [ACK] Seq=1 Ack=1 Win=65536 Len=0 TSval=2061812197 TSecr=2061812197"
"1209","9.803762209","127.0.0.1","127.0.0.1","TCP","66","4444  >  45978 [ACK] Seq=1 Ack=237 Win=65280 Len=0 TSval=2061812198 TSecr=2061812198"
"1211","9.806642464","127.0.0.1","127.0.0.1","TCP","66","45978  >  4444 [ACK] Seq=237 Ack=1490 Win=80000 Len=0 TSval=2061812201 TSecr=2061812201"
"1225","9.811820985","127.0.0.1","127.0.0.1","TCP","66","45962  >  4444 [ACK] Seq=763 Ack=2195 Win=80640 Len=0 TSval=2061812207 TSecr=2061812166"
"1257","9.825192028","127.0.0.1","127.0.0.1","TCP","66","45982  >  4444 [ACK] Seq=1 Ack=1 Win=65536 Len=0 TSval=2061812220 TSecr=2061812220"
"1259","9.827177196","127.0.0.1","127.0.0.1","TCP","66","4444  >  45982 [ACK] Seq=1 Ack=237 Win=65280 Len=0 TSval=2061812222 TSecr=2061812222"
"1261","9.829523863","127.0.0.1","127.0.0.1","TCP","66","45982  >  4444 [ACK] Seq=237 Ack=1490 Win=80000 Len=0 TSval=2061812224 TSecr=2061812224"
"1265","9.832901597","127.0.0.1","127.0.0.1","TCP","66","45968  >  4444 [ACK] Seq=763 Ack=2195 Win=80640 Len=0 TSval=2061812228 TSecr=2061812187"
"1307","9.846106977","127.0.0.1","127.0.0.1","TCP","66","45988  >  4444 [ACK] Seq=1 Ack=1 Win=65536 Len=0 TSval=2061812241 TSecr=2061812241"
"1309","9.847135599","127.0.0.1","127.0.0.1","TCP","66","4444  >  45988 [ACK] Seq=1 Ack=237 Win=65280 Len=0 TSval=2061812242 TSecr=2061812242"
"1311","9.851302749","127.0.0.1","127.0.0.1","TCP","66","45988  >  4444 [ACK] Seq=237 Ack=1490 Win=80000 Len=0 TSval=2061812246 TSecr=2061812246"
"1317","9.854834063","127.0.0.1","127.0.0.1","TCP","66","45978  >  4444 [ACK] Seq=763 Ack=2195 Win=80640 Len=0 TSval=2061812250 TSecr=2061812208"
"1357","9.867084992","127.0.0.1","127.0.0.1","TCP","66","45992  >  4444 [ACK] Seq=1 Ack=1 Win=65536 Len=0 TSval=2061812262 TSecr=2061812262"
"1363","9.868532732","127.0.0.1","127.0.0.1","TCP","66","4444  >  45992 [ACK] Seq=1 Ack=237 Win=65280 Len=0 TSval=2061812263 TSecr=2061812263"
"1365","9.871433450","127.0.0.1","127.0.0.1","TCP","66","45992  >  4444 [ACK] Seq=237 Ack=1490 Win=80000 Len=0 TSval=2061812266 TSecr=2061812266"
"1379","9.876841120","127.0.0.1","127.0.0.1","TCP","66","45982  >  4444 [ACK] Seq=763 Ack=2195 Win=80640 Len=0 TSval=2061812272 TSecr=2061812231"
"1411","9.888828398","127.0.0.1","127.0.0.1","TCP","66","46000  >  4444 [ACK] Seq=1 Ack=1 Win=65536 Len=0 TSval=2061812284 TSecr=2061812283"
"1413","9.889730747","127.0.0.1","127.0.0.1","TCP","66","4444  >  46000 [ACK] Seq=1 Ack=237 Win=65280 Len=0 TSval=2061812284 TSecr=2061812284"
"1415","9.892862500","127.0.0.1","127.0.0.1","TCP","66","46000  >  4444 [ACK] Seq=237 Ack=1490 Win=80000 Len=0 TSval=2061812288 TSecr=2061812288"
"1430","9.898847129","127.0.0.1","127.0.0.1","TCP","66","45988  >  4444 [ACK] Seq=763 Ack=2195 Win=80640 Len=0 TSval=2061812294 TSecr=2061812252"
"1461","9.910311924","127.0.0.1","127.0.0.1","TCP","66","51122  >  4444 [ACK] Seq=1 Ack=1 Win=65536 Len=0 TSval=2061812305 TSecr=2061812305"
"1463","9.911740248","127.0.0.1","127.0.0.1","TCP","66","4444  >  51122 [ACK] Seq=1 Ack=237 Win=65280 Len=0 TSval=2061812306 TSecr=2061812306"
"1465","9.915341893","127.0.0.1","127.0.0.1","TCP","66","51122  >  4444 [ACK] Seq=237 Ack=1490 Win=80000 Len=0 TSval=2061812310 TSecr=2061812310"
"1478","9.919839322","127.0.0.1","127.0.0.1","TCP","66","45992  >  4444 [ACK] Seq=763 Ack=2195 Win=80640 Len=0 TSval=2061812315 TSecr=2061812273"
"1511","9.931020562","127.0.0.1","127.0.0.1","TCP","66","51124  >  4444 [ACK] Seq=1 Ack=1 Win=65536 Len=0 TSval=2061812326 TSecr=2061812326"
"1513","9.932066226","127.0.0.1","127.0.0.1","TCP","66","4444  >  51124 [ACK] Seq=1 Ack=237 Win=65280 Len=0 TSval=2061812327 TSecr=2061812327"
"1515","9.935730728","127.0.0.1","127.0.0.1","TCP","66","51124  >  4444 [ACK] Seq=237 Ack=1490 Win=80000 Len=0 TSval=2061812330 TSecr=2061812330"
"1535","9.941832481","127.0.0.1","127.0.0.1","TCP","66","46000  >  4444 [ACK] Seq=763 Ack=2195 Win=80640 Len=0 TSval=2061812337 TSecr=2061812295"
"1561","9.955575708","127.0.0.1","127.0.0.1","TCP","66","51138  >  4444 [ACK] Seq=1 Ack=1 Win=65536 Len=0 TSval=2061812350 TSecr=2061812350"
"1563","9.956457314","127.0.0.1","127.0.0.1","TCP","66","4444  >  51138 [ACK] Seq=1 Ack=237 Win=65280 Len=0 TSval=2061812351 TSecr=2061812351"
"1565","9.959900001","127.0.0.1","127.0.0.1","TCP","66","51138  >  4444 [ACK] Seq=237 Ack=1490 Win=80000 Len=0 TSval=2061812355 TSecr=2061812355"
"1567","9.961835512","127.0.0.1","127.0.0.1","TCP","66","51122  >  4444 [ACK] Seq=763 Ack=2195 Win=80640 Len=0 TSval=2061812357 TSecr=2061812316"
"1615","9.976863819","127.0.0.1","127.0.0.1","TCP","66","51142  >  4444 [ACK] Seq=1 Ack=1 Win=65536 Len=0 TSval=2061812372 TSecr=2061812372"
"1617","9.977969266","127.0.0.1","127.0.0.1","TCP","66","4444  >  51142 [ACK] Seq=1 Ack=237 Win=65280 Len=0 TSval=2061812373 TSecr=2061812373"
"1619","9.980603540","127.0.0.1","127.0.0.1","TCP","66","51142  >  4444 [ACK] Seq=237 Ack=1490 Win=80000 Len=0 TSval=2061812375 TSecr=2061812375"
"1621","9.982840207","127.0.0.1","127.0.0.1","TCP","66","51124  >  4444 [ACK] Seq=763 Ack=2195 Win=80640 Len=0 TSval=2061812378 TSecr=2061812337"
"1665","9.997351548","127.0.0.1","127.0.0.1","TCP","66","51144  >  4444 [ACK] Seq=1 Ack=1 Win=65536 Len=0 TSval=2061812392 TSecr=2061812392"
"1667","9.998614139","127.0.0.1","127.0.0.1","TCP","66","4444  >  51144 [ACK] Seq=1 Ack=237 Win=65280 Len=0 TSval=2061812393 TSecr=2061812393"
"1669","10.002138539","127.0.0.1","127.0.0.1","TCP","66","51144  >  4444 [ACK] Seq=237 Ack=1490 Win=80000 Len=0 TSval=2061812397 TSecr=2061812397"
"1684","10.007842476","127.0.0.1","127.0.0.1","TCP","66","51138  >  4444 [ACK] Seq=763 Ack=2195 Win=80640 Len=0 TSval=2061812403 TSecr=2061812362"
"1715","10.023561863","127.0.0.1","127.0.0.1","TCP","66","51146  >  4444 [ACK] Seq=1 Ack=1 Win=65536 Len=0 TSval=2061812418 TSecr=2061812418"
"1717","10.024624428","127.0.0.1","127.0.0.1","TCP","66","4444  >  51146 [ACK] Seq=1 Ack=237 Win=65280 Len=0 TSval=2061812419 TSecr=2061812419"
"1719","10.028081431","127.0.0.1","127.0.0.1","TCP","66","51146  >  4444 [ACK] Seq=237 Ack=1490 Win=80000 Len=0 TSval=2061812423 TSecr=2061812423"
"1720","10.028832295","127.0.0.1","127.0.0.1","TCP","66","51142  >  4444 [ACK] Seq=763 Ack=2195 Win=80640 Len=0 TSval=2061812424 TSecr=2061812382"
"1765","10.044691713","127.0.0.1","127.0.0.1","TCP","66","51160  >  4444 [ACK] Seq=1 Ack=1 Win=65536 Len=0 TSval=2061812439 TSecr=2061812439"
"1767","10.045917637","127.0.0.1","127.0.0.1","TCP","66","4444  >  51160 [ACK] Seq=1 Ack=237 Win=65280 Len=0 TSval=2061812441 TSecr=2061812441"
"1769","10.049437218","127.0.0.1","127.0.0.1","TCP","66","51160  >  4444 [ACK] Seq=237 Ack=1490 Win=80000 Len=0 TSval=2061812444 TSecr=2061812444"
"1770","10.049847885","127.0.0.1","127.0.0.1","TCP","66","51144  >  4444 [ACK] Seq=763 Ack=2195 Win=80640 Len=0 TSval=2061812445 TSecr=2061812404"
"1815","10.068905056","127.0.0.1","127.0.0.1","TCP","66","51162  >  4444 [ACK] Seq=1 Ack=1 Win=65536 Len=0 TSval=2061812464 TSecr=2061812464"
"1817","10.071147589","127.0.0.1","127.0.0.1","TCP","66","4444  >  51162 [ACK] Seq=1 Ack=237 Win=65280 Len=0 TSval=2061812466 TSecr=2061812466"
"1823","10.073661596","127.0.0.1","127.0.0.1","TCP","66","51162  >  4444 [ACK] Seq=237 Ack=1490 Win=80000 Len=0 TSval=2061812468 TSecr=2061812468"
"1824","10.074820333","127.0.0.1","127.0.0.1","TCP","66","51146  >  4444 [ACK] Seq=763 Ack=2195 Win=80640 Len=0 TSval=2061812470 TSecr=2061812429"
"1869","10.094541833","127.0.0.1","127.0.0.1","TCP","66","51170  >  4444 [ACK] Seq=1 Ack=1 Win=65536 Len=0 TSval=2061812489 TSecr=2061812489"
"1871","10.095727529","127.0.0.1","127.0.0.1","TCP","66","4444  >  51170 [ACK] Seq=1 Ack=237 Win=65280 Len=0 TSval=2061812490 TSecr=2061812490"
"1872","10.097828564","127.0.0.1","127.0.0.1","TCP","66","51160  >  4444 [ACK] Seq=763 Ack=2195 Win=80640 Len=0 TSval=2061812493 TSecr=2061812452"
"1874","10.098720018","127.0.0.1","127.0.0.1","TCP","66","51170  >  4444 [ACK] Seq=237 Ack=1490 Win=80000 Len=0 TSval=2061812493 TSecr=2061812493"
"1919","10.121735443","127.0.0.1","127.0.0.1","TCP","66","51186  >  4444 [ACK] Seq=1 Ack=1 Win=65536 Len=0 TSval=2061812516 TSecr=2061812516"
"1921","10.122854859","127.0.0.1","127.0.0.1","TCP","66","4444  >  51186 [ACK] Seq=1 Ack=237 Win=65280 Len=0 TSval=2061812518 TSecr=2061812518"
"1922","10.123846047","127.0.0.1","127.0.0.1","TCP","66","51162  >  4444 [ACK] Seq=763 Ack=2195 Win=80640 Len=0 TSval=2061812519 TSecr=2061812478"
"1924","10.126487514","127.0.0.1","127.0.0.1","TCP","66","51186  >  4444 [ACK] Seq=237 Ack=1490 Win=80000 Len=0 TSval=2061812521 TSecr=2061812521"
"1969","10.142222544","127.0.0.1","127.0.0.1","TCP","66","51188  >  4444 [ACK] Seq=1 Ack=1 Win=65536 Len=0 TSval=2061812537 TSecr=2061812537"
"1971","10.143211287","127.0.0.1","127.0.0.1","TCP","66","4444  >  51188 [ACK] Seq=1 Ack=237 Win=65280 Len=0 TSval=2061812538 TSecr=2061812538"
"1972","10.145826215","127.0.0.1","127.0.0.1","TCP","66","51170  >  4444 [ACK] Seq=763 Ack=2195 Win=80640 Len=0 TSval=2061812541 TSecr=2061812500"
"1974","10.146095383","127.0.0.1","127.0.0.1","TCP","66","51188  >  4444 [ACK] Seq=237 Ack=1490 Win=80000 Len=0 TSval=2061812541 TSecr=2061812541"
"2019","10.167539309","127.0.0.1","127.0.0.1","TCP","66","51194  >  4444 [ACK] Seq=1 Ack=1 Win=65536 Len=0 TSval=2061812562 TSecr=2061812562"
"2021","10.168887316","127.0.0.1","127.0.0.1","TCP","66","4444  >  51194 [ACK] Seq=1 Ack=237 Win=65280 Len=0 TSval=2061812564 TSecr=2061812564"
"2023","10.171481431","127.0.0.1","127.0.0.1","TCP","66","51194  >  4444 [ACK] Seq=237 Ack=1490 Win=80000 Len=0 TSval=2061812566 TSecr=2061812566"
"2026","10.173837666","127.0.0.1","127.0.0.1","TCP","66","51186  >  4444 [ACK] Seq=763 Ack=2195 Win=80640 Len=0 TSval=2061812569 TSecr=2061812528"
"2069","10.193855503","127.0.0.1","127.0.0.1","TCP","66","51188  >  4444 [ACK] Seq=763 Ack=2195 Win=80640 Len=0 TSval=2061812589 TSecr=2061812548"
"2074","10.194182640","127.0.0.1","127.0.0.1","TCP","66","51206  >  4444 [ACK] Seq=1 Ack=1 Win=65536 Len=0 TSval=2061812589 TSecr=2061812589"
"2076","10.195422392","127.0.0.1","127.0.0.1","TCP","66","4444  >  51206 [ACK] Seq=1 Ack=237 Win=65280 Len=0 TSval=2061812590 TSecr=2061812590"
"2078","10.198504907","127.0.0.1","127.0.0.1","TCP","66","51206  >  4444 [ACK] Seq=237 Ack=1490 Win=80000 Len=0 TSval=2061812593 TSecr=2061812593"
"2119","10.220866129","127.0.0.1","127.0.0.1","TCP","66","51194  >  4444 [ACK] Seq=763 Ack=2195 Win=80640 Len=0 TSval=2061812616 TSecr=2061812574"
"2124","10.221882459","127.0.0.1","127.0.0.1","TCP","66","51222  >  4444 [ACK] Seq=1 Ack=1 Win=65536 Len=0 TSval=2061812617 TSecr=2061812617"
"2126","10.223767336","127.0.0.1","127.0.0.1","TCP","66","4444  >  51222 [ACK] Seq=1 Ack=237 Win=65280 Len=0 TSval=2061812618 TSecr=2061812618"
"2128","10.226306695","127.0.0.1","127.0.0.1","TCP","66","51222  >  4444 [ACK] Seq=237 Ack=1490 Win=80000 Len=0 TSval=2061812621 TSecr=2061812621"
"2169","10.244852487","127.0.0.1","127.0.0.1","TCP","66","51206  >  4444 [ACK] Seq=763 Ack=2195 Win=80640 Len=0 TSval=2061812640 TSecr=2061812599"
"2174","10.251180037","127.0.0.1","127.0.0.1","TCP","66","51228  >  4444 [ACK] Seq=1 Ack=1 Win=65536 Len=0 TSval=2061812646 TSecr=2061812646"
"2176","10.253240914","127.0.0.1","127.0.0.1","TCP","66","4444  >  51228 [ACK] Seq=1 Ack=237 Win=65280 Len=0 TSval=2061812648 TSecr=2061812648"
"2178","10.258122470","127.0.0.1","127.0.0.1","TCP","66","51228  >  4444 [ACK] Seq=237 Ack=1490 Win=80000 Len=0 TSval=2061812653 TSecr=2061812653"
"2219","10.274836815","127.0.0.1","127.0.0.1","TCP","66","51222  >  4444 [ACK] Seq=763 Ack=2195 Win=80640 Len=0 TSval=2061812670 TSecr=2061812629"
"2228","10.284736816","127.0.0.1","127.0.0.1","TCP","66","51242  >  4444 [ACK] Seq=1 Ack=1 Win=65536 Len=0 TSval=2061812679 TSecr=2061812679"
"2230","10.286849305","127.0.0.1","127.0.0.1","TCP","66","4444  >  51242 [ACK] Seq=1 Ack=237 Win=65280 Len=0 TSval=2061812682 TSecr=2061812681"
"2232","10.290440544","127.0.0.1","127.0.0.1","TCP","66","51242  >  4444 [ACK] Seq=237 Ack=1490 Win=80000 Len=0 TSval=2061812685 TSecr=2061812685"
"2273","10.307844083","127.0.0.1","127.0.0.1","TCP","66","51228  >  4444 [ACK] Seq=763 Ack=2195 Win=80640 Len=0 TSval=2061812703 TSecr=2061812662"
"2278","10.315008820","127.0.0.1","127.0.0.1","TCP","66","51248  >  4444 [ACK] Seq=1 Ack=1 Win=65536 Len=0 TSval=2061812710 TSecr=2061812710"
"2280","10.317034916","127.0.0.1","127.0.0.1","TCP","66","4444  >  51248 [ACK] Seq=1 Ack=237 Win=65280 Len=0 TSval=2061812712 TSecr=2061812712"
"2282","10.319634827","127.0.0.1","127.0.0.1","TCP","66","51248  >  4444 [ACK] Seq=237 Ack=1490 Win=80000 Len=0 TSval=2061812714 TSecr=2061812714"
"2327","10.338532760","127.0.0.1","127.0.0.1","TCP","66","51260  >  4444 [ACK] Seq=1 Ack=1 Win=65536 Len=0 TSval=2061812733 TSecr=2061812733"
"2328","10.338844252","127.0.0.1","127.0.0.1","TCP","66","51242  >  4444 [ACK] Seq=763 Ack=2195 Win=80640 Len=0 TSval=2061812734 TSecr=2061812693"
"2330","10.339345782","127.0.0.1","127.0.0.1","TCP","66","4444  >  51260 [ACK] Seq=1 Ack=237 Win=65280 Len=0 TSval=2061812734 TSecr=2061812734"
"2332","10.344586322","127.0.0.1","127.0.0.1","TCP","66","51260  >  4444 [ACK] Seq=237 Ack=1490 Win=80000 Len=0 TSval=2061812739 TSecr=2061812739"
"2373","10.368849951","127.0.0.1","127.0.0.1","TCP","66","51248  >  4444 [ACK] Seq=763 Ack=2195 Win=80640 Len=0 TSval=2061812764 TSecr=2061812723"
"2378","10.369768224","127.0.0.1","127.0.0.1","TCP","66","51270  >  4444 [ACK] Seq=1 Ack=1 Win=65536 Len=0 TSval=2061812764 TSecr=2061812764"
"2380","10.371071253","127.0.0.1","127.0.0.1","TCP","66","4444  >  51270 [ACK] Seq=1 Ack=237 Win=65280 Len=0 TSval=2061812766 TSecr=2061812766"
"2382","10.374530282","127.0.0.1","127.0.0.1","TCP","66","51270  >  4444 [ACK] Seq=237 Ack=1490 Win=80000 Len=0 TSval=2061812769 TSecr=2061812769"
"2427","10.395875872","127.0.0.1","127.0.0.1","TCP","66","51260  >  4444 [ACK] Seq=763 Ack=2195 Win=80640 Len=0 TSval=2061812791 TSecr=2061812749"
"2432","10.401531828","127.0.0.1","127.0.0.1","TCP","66","51280  >  4444 [ACK] Seq=1 Ack=1 Win=65536 Len=0 TSval=2061812796 TSecr=2061812796"
"2434","10.402923974","127.0.0.1","127.0.0.1","TCP","66","4444  >  51280 [ACK] Seq=1 Ack=237 Win=65280 Len=0 TSval=2061812798 TSecr=2061812798"
"2436","10.407845340","127.0.0.1","127.0.0.1","TCP","66","51280  >  4444 [ACK] Seq=237 Ack=1490 Win=80000 Len=0 TSval=2061812803 TSecr=2061812802"
"2477","10.422852904","127.0.0.1","127.0.0.1","TCP","66","51270  >  4444 [ACK] Seq=763 Ack=2195 Win=80640 Len=0 TSval=2061812818 TSecr=2061812777"
"2482","10.429423571","127.0.0.1","127.0.0.1","TCP","66","51286  >  4444 [ACK] Seq=1 Ack=1 Win=65536 Len=0 TSval=2061812824 TSecr=2061812824"
"2484","10.430440460","127.0.0.1","127.0.0.1","TCP","66","4444  >  51286 [ACK] Seq=1 Ack=237 Win=65280 Len=0 TSval=2061812825 TSecr=2061812825"
"2486","10.436020988","127.0.0.1","127.0.0.1","TCP","66","51286  >  4444 [ACK] Seq=237 Ack=1490 Win=80000 Len=0 TSval=2061812831 TSecr=2061812831"
"2531","10.453352939","127.0.0.1","127.0.0.1","TCP","66","51300  >  4444 [ACK] Seq=1 Ack=1 Win=65536 Len=0 TSval=2061812848 TSecr=2061812848"
"2533","10.454536190","127.0.0.1","127.0.0.1","TCP","66","4444  >  51300 [ACK] Seq=1 Ack=237 Win=65280 Len=0 TSval=2061812849 TSecr=2061812849"
"2534","10.455835029","127.0.0.1","127.0.0.1","TCP","66","51280  >  4444 [ACK] Seq=763 Ack=2195 Win=80640 Len=0 TSval=2061812851 TSecr=2061812810"
"2536","10.460199829","127.0.0.1","127.0.0.1","TCP","66","51300  >  4444 [ACK] Seq=237 Ack=1490 Win=80000 Len=0 TSval=2061812855 TSecr=2061812855"
"2581","10.478257152","127.0.0.1","127.0.0.1","TCP","66","51302  >  4444 [ACK] Seq=1 Ack=1 Win=65536 Len=0 TSval=2061812873 TSecr=2061812873"
"2583","10.479677724","127.0.0.1","127.0.0.1","TCP","66","4444  >  51302 [ACK] Seq=1 Ack=237 Win=65280 Len=0 TSval=2061812874 TSecr=2061812874"
"2585","10.482669235","127.0.0.1","127.0.0.1","TCP","66","51302  >  4444 [ACK] Seq=237 Ack=1490 Win=80000 Len=0 TSval=2061812877 TSecr=2061812877"
"2590","10.483833000","127.0.0.1","127.0.0.1","TCP","66","51286  >  4444 [ACK] Seq=763 Ack=2195 Win=80640 Len=0 TSval=2061812879 TSecr=2061812838"
"2635","10.497922640","127.0.0.1","127.0.0.1","TCP","66","51318  >  4444 [ACK] Seq=1 Ack=1 Win=65536 Len=0 TSval=2061812893 TSecr=2061812893"
"2637","10.499256469","127.0.0.1","127.0.0.1","TCP","66","4444  >  51318 [ACK] Seq=1 Ack=237 Win=65280 Len=0 TSval=2061812894 TSecr=2061812894"
"2639","10.502500876","127.0.0.1","127.0.0.1","TCP","66","51318  >  4444 [ACK] Seq=237 Ack=1490 Win=80000 Len=0 TSval=2061812897 TSecr=2061812897"
"2665","10.509852788","127.0.0.1","127.0.0.1","TCP","66","51300  >  4444 [ACK] Seq=763 Ack=2195 Win=80640 Len=0 TSval=2061812905 TSecr=2061812863"
"2685","10.524524974","127.0.0.1","127.0.0.1","TCP","66","51326  >  4444 [ACK] Seq=1 Ack=1 Win=65536 Len=0 TSval=2061812919 TSecr=2061812919"
"2687","10.525445202","127.0.0.1","127.0.0.1","TCP","66","4444  >  51326 [ACK] Seq=1 Ack=237 Win=65280 Len=0 TSval=2061812920 TSecr=2061812920"
"2688","10.528854993","127.0.0.1","127.0.0.1","TCP","66","51302  >  4444 [ACK] Seq=763 Ack=2195 Win=80640 Len=0 TSval=2061812924 TSecr=2061812883"
"2690","10.530862930","127.0.0.1","127.0.0.1","TCP","66","51326  >  4444 [ACK] Seq=237 Ack=1490 Win=80000 Len=0 TSval=2061812926 TSecr=2061812925"
"2735","10.547661224","127.0.0.1","127.0.0.1","TCP","66","51340  >  4444 [ACK] Seq=1 Ack=1 Win=65536 Len=0 TSval=2061812942 TSecr=2061812942"
"2737","10.548672945","127.0.0.1","127.0.0.1","TCP","66","4444  >  51340 [ACK] Seq=1 Ack=237 Win=65280 Len=0 TSval=2061812943 TSecr=2061812943"
"2738","10.549849561","127.0.0.1","127.0.0.1","TCP","66","51318  >  4444 [ACK] Seq=763 Ack=2195 Win=80640 Len=0 TSval=2061812945 TSecr=2061812904"
"2740","10.551055371","127.0.0.1","127.0.0.1","TCP","66","51340  >  4444 [ACK] Seq=237 Ack=1490 Win=80000 Len=0 TSval=2061812946 TSecr=2061812946"
"2785","10.567255055","127.0.0.1","127.0.0.1","TCP","66","51354  >  4444 [ACK] Seq=1 Ack=1 Win=65536 Len=0 TSval=2061812962 TSecr=2061812962"
"2787","10.569088110","127.0.0.1","127.0.0.1","TCP","66","4444  >  51354 [ACK] Seq=1 Ack=237 Win=65280 Len=0 TSval=2061812964 TSecr=2061812964"
"2789","10.574299317","127.0.0.1","127.0.0.1","TCP","66","51354  >  4444 [ACK] Seq=237 Ack=1490 Win=80000 Len=0 TSval=2061812969 TSecr=2061812969"
"2793","10.578839070","127.0.0.1","127.0.0.1","TCP","66","51326  >  4444 [ACK] Seq=763 Ack=2195 Win=80640 Len=0 TSval=2061812974 TSecr=2061812933"
"2844","10.595059846","127.0.0.1","127.0.0.1","TCP","66","51362  >  4444 [ACK] Seq=1 Ack=1 Win=65536 Len=0 TSval=2061812990 TSecr=2061812990"
"2846","10.595987688","127.0.0.1","127.0.0.1","TCP","66","4444  >  51362 [ACK] Seq=1 Ack=237 Win=65280 Len=0 TSval=2061812991 TSecr=2061812991"
"2847","10.596828437","127.0.0.1","127.0.0.1","TCP","66","51340  >  4444 [ACK] Seq=763 Ack=2195 Win=80640 Len=0 TSval=2061812992 TSecr=2061812951"
"2849","10.600278456","127.0.0.1","127.0.0.1","TCP","66","51362  >  4444 [ACK] Seq=237 Ack=1490 Win=80000 Len=0 TSval=2061812995 TSecr=2061812995"
"2894","10.617941106","127.0.0.1","127.0.0.1","TCP","66","51370  >  4444 [ACK] Seq=1 Ack=1 Win=65536 Len=0 TSval=2061813013 TSecr=2061813013"
"2896","10.619163468","127.0.0.1","127.0.0.1","TCP","66","4444  >  51370 [ACK] Seq=1 Ack=237 Win=65280 Len=0 TSval=2061813014 TSecr=2061813014"
"2898","10.621968015","127.0.0.1","127.0.0.1","TCP","66","51370  >  4444 [ACK] Seq=237 Ack=1490 Win=80000 Len=0 TSval=2061813017 TSecr=2061813017"
"2902","10.623824256","127.0.0.1","127.0.0.1","TCP","66","51354  >  4444 [ACK] Seq=763 Ack=2195 Win=80640 Len=0 TSval=2061813019 TSecr=2061812978"
"2946","10.638668112","127.0.0.1","127.0.0.1","TCP","66","51380  >  4444 [ACK] Seq=1 Ack=1 Win=65536 Len=0 TSval=2061813033 TSecr=2061813033"
"2948","10.639741782","127.0.0.1","127.0.0.1","TCP","66","4444  >  51380 [ACK] Seq=1 Ack=237 Win=65280 Len=0 TSval=2061813034 TSecr=2061813034"
"2950","10.642605414","127.0.0.1","127.0.0.1","TCP","66","51380  >  4444 [ACK] Seq=237 Ack=1490 Win=80000 Len=0 TSval=2061813037 TSecr=2061813037"
"2962","10.646842754","127.0.0.1","127.0.0.1","TCP","66","51362  >  4444 [ACK] Seq=763 Ack=2195 Win=80640 Len=0 TSval=2061813042 TSecr=2061813001"
"2998","10.658445905","127.0.0.1","127.0.0.1","TCP","66","51390  >  4444 [ACK] Seq=1 Ack=1 Win=65536 Len=0 TSval=2061813053 TSecr=2061813053"
"3000","10.659577683","127.0.0.1","127.0.0.1","TCP","66","4444  >  51390 [ACK] Seq=1 Ack=237 Win=65280 Len=0 TSval=2061813054 TSecr=2061813054"
"3002","10.662252115","127.0.0.1","127.0.0.1","TCP","66","51390  >  4444 [ACK] Seq=237 Ack=1490 Win=80000 Len=0 TSval=2061813057 TSecr=2061813057"
"3021","10.668836052","127.0.0.1","127.0.0.1","TCP","66","51370  >  4444 [ACK] Seq=763 Ack=2195 Win=80640 Len=0 TSval=2061813064 TSecr=2061813022"
"3050","10.679064168","127.0.0.1","127.0.0.1","TCP","66","51406  >  4444 [ACK] Seq=1 Ack=1 Win=65536 Len=0 TSval=2061813074 TSecr=2061813074"
"3052","10.680023298","127.0.0.1","127.0.0.1","TCP","66","4444  >  51406 [ACK] Seq=1 Ack=237 Win=65280 Len=0 TSval=2061813075 TSecr=2061813075"
"3054","10.682813597","127.0.0.1","127.0.0.1","TCP","66","51406  >  4444 [ACK] Seq=237 Ack=1490 Win=80000 Len=0 TSval=2061813077 TSecr=2061813077"
"3079","10.689842493","127.0.0.1","127.0.0.1","TCP","66","51380  >  4444 [ACK] Seq=763 Ack=2195 Win=80640 Len=0 TSval=2061813085 TSecr=2061813044"
"3104","10.699313180","127.0.0.1","127.0.0.1","TCP","66","51414  >  4444 [ACK] Seq=1 Ack=1 Win=65536 Len=0 TSval=2061813094 TSecr=2061813094"
"3106","10.700371625","127.0.0.1","127.0.0.1","TCP","66","4444  >  51414 [ACK] Seq=1 Ack=237 Win=65280 Len=0 TSval=2061813095 TSecr=2061813095"
"3108","10.703846438","127.0.0.1","127.0.0.1","TCP","66","51414  >  4444 [ACK] Seq=237 Ack=1490 Win=80000 Len=0 TSval=2061813099 TSecr=2061813099"
"3128","10.709832743","127.0.0.1","127.0.0.1","TCP","66","51390  >  4444 [ACK] Seq=763 Ack=2195 Win=80640 Len=0 TSval=2061813105 TSecr=2061813064"
"3154","10.725821437","127.0.0.1","127.0.0.1","TCP","66","51424  >  4444 [ACK] Seq=1 Ack=1 Win=65536 Len=0 TSval=2061813120 TSecr=2061813120"
"3156","10.726964180","127.0.0.1","127.0.0.1","TCP","66","4444  >  51424 [ACK] Seq=1 Ack=237 Win=65280 Len=0 TSval=2061813122 TSecr=2061813122"
"3158","10.729633514","127.0.0.1","127.0.0.1","TCP","66","51424  >  4444 [ACK] Seq=237 Ack=1490 Win=80000 Len=0 TSval=2061813124 TSecr=2061813124"
"3159","10.730832968","127.0.0.1","127.0.0.1","TCP","66","51406  >  4444 [ACK] Seq=763 Ack=2195 Win=80640 Len=0 TSval=2061813126 TSecr=2061813085"
"3206","10.744365414","127.0.0.1","127.0.0.1","TCP","66","51426  >  4444 [ACK] Seq=1 Ack=1 Win=65536 Len=0 TSval=2061813139 TSecr=2061813139"
"3208","10.745465275","127.0.0.1","127.0.0.1","TCP","66","4444  >  51426 [ACK] Seq=1 Ack=237 Win=65280 Len=0 TSval=2061813140 TSecr=2061813140"
"3210","10.748345110","127.0.0.1","127.0.0.1","TCP","66","51426  >  4444 [ACK] Seq=237 Ack=1490 Win=80000 Len=0 TSval=2061813143 TSecr=2061813143"
"3211","10.750833136","127.0.0.1","127.0.0.1","TCP","66","51414  >  4444 [ACK] Seq=763 Ack=2195 Win=80640 Len=0 TSval=2061813146 TSecr=2061813105"
"3258","10.766497138","127.0.0.1","127.0.0.1","TCP","66","51432  >  4444 [ACK] Seq=1 Ack=1 Win=65536 Len=0 TSval=2061813161 TSecr=2061813161"
"3260","10.767500128","127.0.0.1","127.0.0.1","TCP","66","4444  >  51432 [ACK] Seq=1 Ack=237 Win=65280 Len=0 TSval=2061813162 TSecr=2061813162"
"3262","10.770312637","127.0.0.1","127.0.0.1","TCP","66","51432  >  4444 [ACK] Seq=237 Ack=1490 Win=80000 Len=0 TSval=2061813165 TSecr=2061813165"
"3281","10.775846441","127.0.0.1","127.0.0.1","TCP","66","51424  >  4444 [ACK] Seq=763 Ack=2195 Win=80640 Len=0 TSval=2061813171 TSecr=2061813130"
"3308","10.785426359","127.0.0.1","127.0.0.1","TCP","66","51446  >  4444 [ACK] Seq=1 Ack=1 Win=65536 Len=0 TSval=2061813180 TSecr=2061813180"
"3310","10.786342118","127.0.0.1","127.0.0.1","TCP","66","4444  >  51446 [ACK] Seq=1 Ack=237 Win=65280 Len=0 TSval=2061813181 TSecr=2061813181"
"3312","10.789074658","127.0.0.1","127.0.0.1","TCP","66","51446  >  4444 [ACK] Seq=237 Ack=1490 Win=80000 Len=0 TSval=2061813184 TSecr=2061813184"
"3342","10.795841859","127.0.0.1","127.0.0.1","TCP","66","51426  >  4444 [ACK] Seq=763 Ack=2195 Win=80640 Len=0 TSval=2061813191 TSecr=2061813150"
"3362","10.809692711","127.0.0.1","127.0.0.1","TCP","66","51454  >  4444 [ACK] Seq=1 Ack=1 Win=65536 Len=0 TSval=2061813204 TSecr=2061813204"
"3364","10.810904388","127.0.0.1","127.0.0.1","TCP","66","4444  >  51454 [ACK] Seq=1 Ack=237 Win=65280 Len=0 TSval=2061813206 TSecr=2061813206"
"3366","10.813965531","127.0.0.1","127.0.0.1","TCP","66","51454  >  4444 [ACK] Seq=237 Ack=1490 Win=80000 Len=0 TSval=2061813209 TSecr=2061813209"
"3370","10.816851093","127.0.0.1","127.0.0.1","TCP","66","51432  >  4444 [ACK] Seq=763 Ack=2195 Win=80640 Len=0 TSval=2061813212 TSecr=2061813171"
"3412","10.830771787","127.0.0.1","127.0.0.1","TCP","66","51468  >  4444 [ACK] Seq=1 Ack=1 Win=65536 Len=0 TSval=2061813225 TSecr=2061813225"
"3414","10.831703330","127.0.0.1","127.0.0.1","TCP","66","4444  >  51468 [ACK] Seq=1 Ack=237 Win=65280 Len=0 TSval=2061813226 TSecr=2061813226"
"3415","10.835836956","127.0.0.1","127.0.0.1","TCP","66","51446  >  4444 [ACK] Seq=763 Ack=2195 Win=80640 Len=0 TSval=2061813231 TSecr=2061813190"
"3418","10.837735033","127.0.0.1","127.0.0.1","TCP","66","51468  >  4444 [ACK] Seq=237 Ack=1490 Win=80000 Len=0 TSval=2061813232 TSecr=2061813232"
"3464","10.858773530","127.0.0.1","127.0.0.1","TCP","66","51476  >  4444 [ACK] Seq=1 Ack=1 Win=65536 Len=0 TSval=2061813253 TSecr=2061813253"
"3466","10.859901956","127.0.0.1","127.0.0.1","TCP","66","4444  >  51476 [ACK] Seq=1 Ack=237 Win=65280 Len=0 TSval=2061813255 TSecr=2061813255"
"3467","10.861825315","127.0.0.1","127.0.0.1","TCP","66","51454  >  4444 [ACK] Seq=763 Ack=2195 Win=80640 Len=0 TSval=2061813257 TSecr=2061813216"
"3470","10.865335957","127.0.0.1","127.0.0.1","TCP","66","51476  >  4444 [ACK] Seq=237 Ack=1490 Win=80000 Len=0 TSval=2061813260 TSecr=2061813260"
"3516","10.886851121","127.0.0.1","127.0.0.1","TCP","66","51468  >  4444 [ACK] Seq=763 Ack=2195 Win=80640 Len=0 TSval=2061813282 TSecr=2061813240"
"3517","10.886869559","127.0.0.1","127.0.0.1","TCP","66","51478  >  4444 [ACK] Seq=1 Ack=1 Win=65536 Len=0 TSval=2061813282 TSecr=2061813281"
"3519","10.888682639","127.0.0.1","127.0.0.1","TCP","66","4444  >  51478 [ACK] Seq=1 Ack=237 Win=65280 Len=0 TSval=2061813283 TSecr=2061813283"
"3522","10.894553078","127.0.0.1","127.0.0.1","TCP","66","51478  >  4444 [ACK] Seq=237 Ack=1490 Win=80000 Len=0 TSval=2061813289 TSecr=2061813289"
"3568","10.914021823","127.0.0.1","127.0.0.1","TCP","66","51476  >  4444 [ACK] Seq=763 Ack=2195 Win=80640 Len=0 TSval=2061813309 TSecr=2061813267"
"3573","10.916826439","127.0.0.1","127.0.0.1","TCP","66","51492  >  4444 [ACK] Seq=1 Ack=1 Win=65536 Len=0 TSval=2061813312 TSecr=2061813311"
"3575","10.917828592","127.0.0.1","127.0.0.1","TCP","66","4444  >  51492 [ACK] Seq=1 Ack=237 Win=65280 Len=0 TSval=2061813313 TSecr=2061813312"
"3577","10.920059113","127.0.0.1","127.0.0.1","TCP","66","51492  >  4444 [ACK] Seq=237 Ack=1490 Win=80000 Len=0 TSval=2061813315 TSecr=2061813315"
"3622","10.941118773","127.0.0.1","127.0.0.1","TCP","66","51494  >  4444 [ACK] Seq=1 Ack=1 Win=65536 Len=0 TSval=2061813336 TSecr=2061813336"
"3624","10.942265147","127.0.0.1","127.0.0.1","TCP","66","4444  >  51494 [ACK] Seq=1 Ack=237 Win=65280 Len=0 TSval=2061813337 TSecr=2061813337"
"3625","10.945831034","127.0.0.1","127.0.0.1","TCP","66","51478  >  4444 [ACK] Seq=763 Ack=2195 Win=80640 Len=0 TSval=2061813341 TSecr=2061813300"
"3627","10.946012830","127.0.0.1","127.0.0.1","TCP","66","51494  >  4444 [ACK] Seq=237 Ack=1490 Win=80000 Len=0 TSval=2061813341 TSecr=2061813341"
"3670","10.966880985","127.0.0.1","127.0.0.1","TCP","66","51492  >  4444 [ACK] Seq=763 Ack=2195 Win=80640 Len=0 TSval=2061813362 TSecr=2061813321"
"3675","10.968572890","127.0.0.1","127.0.0.1","TCP","66","51496  >  4444 [ACK] Seq=1 Ack=1 Win=65536 Len=0 TSval=2061813363 TSecr=2061813363"
"3678","10.969862859","127.0.0.1","127.0.0.1","TCP","66","4444  >  51496 [ACK] Seq=1 Ack=237 Win=65280 Len=0 TSval=2061813365 TSecr=2061813365"
"3680","10.973733602","127.0.0.1","127.0.0.1","TCP","66","51496  >  4444 [ACK] Seq=237 Ack=1490 Win=80000 Len=0 TSval=2061813368 TSecr=2061813368"
"3722","10.992847833","127.0.0.1","127.0.0.1","TCP","66","51494  >  4444 [ACK] Seq=763 Ack=2195 Win=80640 Len=0 TSval=2061813388 TSecr=2061813347"
"3728","10.996157472","127.0.0.1","127.0.0.1","TCP","66","51498  >  4444 [ACK] Seq=1 Ack=1 Win=65536 Len=0 TSval=2061813391 TSecr=2061813391"
"3730","10.997304964","127.0.0.1","127.0.0.1","TCP","66","4444  >  51498 [ACK] Seq=1 Ack=237 Win=65280 Len=0 TSval=2061813392 TSecr=2061813392"
"3737","10.999983656","127.0.0.1","127.0.0.1","TCP","66","51498  >  4444 [ACK] Seq=237 Ack=1490 Win=80000 Len=0 TSval=2061813395 TSecr=2061813395"
"3778","11.020852789","127.0.0.1","127.0.0.1","TCP","66","51496  >  4444 [ACK] Seq=763 Ack=2195 Win=80640 Len=0 TSval=2061813416 TSecr=2061813375"
"3783","11.021848237","127.0.0.1","127.0.0.1","TCP","66","51508  >  4444 [ACK] Seq=1 Ack=1 Win=65536 Len=0 TSval=2061813417 TSecr=2061813416"
"3785","11.023873494","127.0.0.1","127.0.0.1","TCP","66","4444  >  51508 [ACK] Seq=1 Ack=237 Win=65280 Len=0 TSval=2061813419 TSecr=2061813418"
"3787","11.027254650","127.0.0.1","127.0.0.1","TCP","66","51508  >  4444 [ACK] Seq=237 Ack=1490 Win=80000 Len=0 TSval=2061813422 TSecr=2061813422"
"3828","11.046849319","127.0.0.1","127.0.0.1","TCP","66","51498  >  4444 [ACK] Seq=763 Ack=2195 Win=80640 Len=0 TSval=2061813442 TSecr=2061813401"
"3834","11.052407358","127.0.0.1","127.0.0.1","TCP","66","51518  >  4444 [ACK] Seq=1 Ack=1 Win=65536 Len=0 TSval=2061813447 TSecr=2061813447"
"3836","11.054530882","127.0.0.1","127.0.0.1","TCP","66","4444  >  51518 [ACK] Seq=1 Ack=237 Win=65280 Len=0 TSval=2061813449 TSecr=2061813449"
"3838","11.057229060","127.0.0.1","127.0.0.1","TCP","66","51518  >  4444 [ACK] Seq=237 Ack=1490 Win=80000 Len=0 TSval=2061813452 TSecr=2061813452"
"3884","11.074896320","127.0.0.1","127.0.0.1","TCP","66","51524  >  4444 [ACK] Seq=1 Ack=1 Win=65536 Len=0 TSval=2061813470 TSecr=2061813470"
"3886","11.075684269","127.0.0.1","127.0.0.1","TCP","66","4444  >  51524 [ACK] Seq=1 Ack=237 Win=65280 Len=0 TSval=2061813470 TSecr=2061813470"
"3887","11.075855520","127.0.0.1","127.0.0.1","TCP","66","51508  >  4444 [ACK] Seq=763 Ack=2195 Win=80640 Len=0 TSval=2061813471 TSecr=2061813429"
"3890","11.079282073","127.0.0.1","127.0.0.1","TCP","66","51524  >  4444 [ACK] Seq=237 Ack=1490 Win=80000 Len=0 TSval=2061813474 TSecr=2061813474"
"3936","11.096118710","127.0.0.1","127.0.0.1","TCP","66","51532  >  4444 [ACK] Seq=1 Ack=1 Win=65536 Len=0 TSval=2061813491 TSecr=2061813491"
"3938","11.097073719","127.0.0.1","127.0.0.1","TCP","66","4444  >  51532 [ACK] Seq=1 Ack=237 Win=65280 Len=0 TSval=2061813492 TSecr=2061813492"
"3940","11.100120545","127.0.0.1","127.0.0.1","TCP","66","51532  >  4444 [ACK] Seq=237 Ack=1490 Win=80000 Len=0 TSval=2061813495 TSecr=2061813495"
"3951","11.104854317","127.0.0.1","127.0.0.1","TCP","66","51518  >  4444 [ACK] Seq=763 Ack=2195 Win=80640 Len=0 TSval=2061813500 TSecr=2061813459"
"3990","11.117028630","127.0.0.1","127.0.0.1","TCP","66","51538  >  4444 [ACK] Seq=1 Ack=1 Win=65536 Len=0 TSval=2061813512 TSecr=2061813512"
"3992","11.118251411","127.0.0.1","127.0.0.1","TCP","66","4444  >  51538 [ACK] Seq=1 Ack=237 Win=65280 Len=0 TSval=2061813513 TSecr=2061813513"
"3994","11.121499170","127.0.0.1","127.0.0.1","TCP","66","51538  >  4444 [ACK] Seq=237 Ack=1490 Win=80000 Len=0 TSval=2061813516 TSecr=2061813516"
"4013","11.126846987","127.0.0.1","127.0.0.1","TCP","66","51524  >  4444 [ACK] Seq=763 Ack=2195 Win=80640 Len=0 TSval=2061813522 TSecr=2061813481"
"4040","11.137744391","127.0.0.1","127.0.0.1","TCP","66","51552  >  4444 [ACK] Seq=1 Ack=1 Win=65536 Len=0 TSval=2061813532 TSecr=2061813532"
"4042","11.138744588","127.0.0.1","127.0.0.1","TCP","66","4444  >  51552 [ACK] Seq=1 Ack=237 Win=65280 Len=0 TSval=2061813533 TSecr=2061813533"
"4044","11.144334754","127.0.0.1","127.0.0.1","TCP","66","51552  >  4444 [ACK] Seq=237 Ack=1490 Win=80000 Len=0 TSval=2061813539 TSecr=2061813539"
"4048","11.147828494","127.0.0.1","127.0.0.1","TCP","66","51532  >  4444 [ACK] Seq=763 Ack=2195 Win=80640 Len=0 TSval=2061813543 TSecr=2061813502"
"4092","11.166209741","127.0.0.1","127.0.0.1","TCP","66","51560  >  4444 [ACK] Seq=1 Ack=1 Win=65536 Len=0 TSval=2061813561 TSecr=2061813561"
"4093","11.167836833","127.0.0.1","127.0.0.1","TCP","66","51538  >  4444 [ACK] Seq=763 Ack=2195 Win=80640 Len=0 TSval=2061813563 TSecr=2061813522"
"4095","11.168225430","127.0.0.1","127.0.0.1","TCP","66","4444  >  51560 [ACK] Seq=1 Ack=237 Win=65280 Len=0 TSval=2061813563 TSecr=2061813563"
"4098","11.171875196","127.0.0.1","127.0.0.1","TCP","66","51560  >  4444 [ACK] Seq=237 Ack=1490 Win=80000 Len=0 TSval=2061813567 TSecr=2061813567"
"4144","11.194879865","127.0.0.1","127.0.0.1","TCP","66","51568  >  4444 [ACK] Seq=1 Ack=1 Win=65536 Len=0 TSval=2061813590 TSecr=2061813590"
