"No.","Time","Source","Destination","Protocol","Length","Info","src_port","dst_port"
"38","0.656060198","127.0.0.1","127.0.0.1","TCP","66","44414  >  4444 [ACK] Seq=1 Ack=1 Win=630 Len=0 TSval=449297055 TSecr=449286815","44414","4444"
"39","0.656090648","127.0.0.1","127.0.0.1","TCP","66","[TCP ACKed unseen segment] 4444  >  44414 [ACK] Seq=1 Ack=2 Win=512 Len=0 TSval=449297055 TSecr=449256143","4444","44414"
"343","2.448378044","127.0.0.1","127.0.0.1","TCP","66","44438  >  4444 [ACK] Seq=1 Ack=1 Win=630 Len=0 TSval=449298847 TSecr=449288607","44438","4444"
"349","2.448468208","127.0.0.1","127.0.0.1","TCP","66","[TCP ACKed unseen segment] 4444  >  44438 [ACK] Seq=1 Ack=2 Win=512 Len=0 TSval=449298847 TSecr=449257975","4444","44438"
"397","3.172560782","127.0.0.1","127.0.0.1","TLSv1.2","271","Application Data","42162","4444"
"398","3.172756127","127.0.0.1","127.0.0.1","TLSv1.2","271","Application Data","42632","4444"
"399","3.172913409","127.0.0.1","127.0.0.1","TLSv1.2","271","Application Data","42674","4444"
"456","3.178692528","127.0.0.1","127.0.0.1","TLSv1.2","141","Application Data","4444","42162"
"457","3.178727867","127.0.0.1","127.0.0.1","TCP","66","42162  >  4444 [ACK] Seq=206 Ack=76 Win=630 Len=0 TSval=449299577 TSecr=449299577","42162","4444"
"462","3.179437939","127.0.0.1","127.0.0.1","TLSv1.2","141","Application Data","4444","42632"
"463","3.179463221","127.0.0.1","127.0.0.1","TCP","66","42632  >  4444 [ACK] Seq=206 Ack=76 Win=630 Len=0 TSval=449299578 TSecr=449299578","42632","4444"
"467","3.180088506","127.0.0.1","127.0.0.1","TLSv1.2","141","Application Data","4444","42674"
"468","3.180115674","127.0.0.1","127.0.0.1","TCP","66","42674  >  4444 [ACK] Seq=206 Ack=76 Win=630 Len=0 TSval=449299579 TSecr=449299579","42674","4444"
"486","3.272725448","127.0.0.1","127.0.0.1","TLSv1.2","271","Application Data","42716","4444"
"491","3.274642648","127.0.0.1","127.0.0.1","TLSv1.2","271","Application Data","42428","4444"
"492","3.274813060","127.0.0.1","127.0.0.1","TLSv1.2","271","Application Data","42440","4444"
"494","3.274975789","127.0.0.1","127.0.0.1","TLSv1.2","271","Application Data","42606","4444"
"495","3.275126506","127.0.0.1","127.0.0.1","TLSv1.2","271","Application Data","42048","4444"
"497","3.275280924","127.0.0.1","127.0.0.1","TLSv1.2","271","Application Data","42510","4444"
"498","3.275437786","127.0.0.1","127.0.0.1","TLSv1.2","271","Application Data","42544","4444"
"501","3.275609036","127.0.0.1","127.0.0.1","TLSv1.2","271","Application Data","42314","4444"
"529","3.276460884","127.0.0.1","127.0.0.1","TLSv1.2","271","Application Data","42770","4444"
"535","3.276775098","127.0.0.1","127.0.0.1","TLSv1.2","271","Application Data","42472","4444"
"638","3.279693537","127.0.0.1","127.0.0.1","TLSv1.2","141","Application Data","4444","42428"
"640","3.279710019","127.0.0.1","127.0.0.1","TCP","66","42428  >  4444 [ACK] Seq=206 Ack=76 Win=630 Len=0 TSval=449299678 TSecr=449299678","42428","4444"
"649","3.279830215","127.0.0.1","127.0.0.1","TLSv1.2","141","Application Data","4444","42716"
"650","3.279846558","127.0.0.1","127.0.0.1","TCP","66","42716  >  4444 [ACK] Seq=206 Ack=76 Win=630 Len=0 TSval=449299678 TSecr=449299678","42716","4444"
"686","3.280697708","127.0.0.1","127.0.0.1","TLSv1.2","141","Application Data","4444","42314"
"687","3.280710699","127.0.0.1","127.0.0.1","TCP","66","42314  >  4444 [ACK] Seq=206 Ack=76 Win=630 Len=0 TSval=449299679 TSecr=449299679","42314","4444"
"690","3.280732838","127.0.0.1","127.0.0.1","TLSv1.2","141","Application Data","4444","42606"
"691","3.280733816","127.0.0.1","127.0.0.1","TLSv1.2","141","Application Data","4444","42544"
"693","3.280751346","127.0.0.1","127.0.0.1","TCP","66","42544  >  4444 [ACK] Seq=206 Ack=76 Win=630 Len=0 TSval=449299679 TSecr=449299679","42544","4444"
"694","3.280751346","127.0.0.1","127.0.0.1","TCP","66","42606  >  4444 [ACK] Seq=206 Ack=76 Win=630 Len=0 TSval=449299679 TSecr=449299679","42606","4444"
"706","3.281037065","127.0.0.1","127.0.0.1","TLSv1.2","141","Application Data","4444","42048"
"707","3.281048868","127.0.0.1","127.0.0.1","TCP","66","42048  >  4444 [ACK] Seq=206 Ack=76 Win=630 Len=0 TSval=449299680 TSecr=449299680","42048","4444"
"716","3.281436205","127.0.0.1","127.0.0.1","TLSv1.2","141","Application Data","4444","42472"
"717","3.281448777","127.0.0.1","127.0.0.1","TCP","66","42472  >  4444 [ACK] Seq=206 Ack=76 Win=630 Len=0 TSval=449299680 TSecr=449299680","42472","4444"
"718","3.281455761","127.0.0.1","127.0.0.1","TLSv1.2","141","Application Data","4444","42440"
"719","3.281473989","127.0.0.1","127.0.0.1","TCP","66","42440  >  4444 [ACK] Seq=206 Ack=76 Win=630 Len=0 TSval=449299680 TSecr=449299680","42440","4444"
"722","3.281603055","127.0.0.1","127.0.0.1","TLSv1.2","141","Application Data","4444","42770"
"723","3.281621144","127.0.0.1","127.0.0.1","TCP","66","42770  >  4444 [ACK] Seq=206 Ack=76 Win=630 Len=0 TSval=449299680 TSecr=449299680","42770","4444"
"726","3.281711238","127.0.0.1","127.0.0.1","TLSv1.2","141","Application Data","4444","42510"
"728","3.281732819","127.0.0.1","127.0.0.1","TCP","66","42510  >  4444 [ACK] Seq=206 Ack=76 Win=630 Len=0 TSval=449299680 TSecr=449299680","42510","4444"
"768","3.375850806","127.0.0.1","127.0.0.1","TLSv1.2","271","Application Data","42194","4444"
"769","3.376085471","127.0.0.1","127.0.0.1","TLSv1.2","271","Application Data","42236","4444"
"770","3.376261539","127.0.0.1","127.0.0.1","TLSv1.2","271","Application Data","42250","4444"
"772","3.376478046","127.0.0.1","127.0.0.1","TLSv1.2","271","Application Data","41998","4444"
"773","3.376636166","127.0.0.1","127.0.0.1","TLSv1.2","271","Application Data","42646","4444"
"796","3.378434078","127.0.0.1","127.0.0.1","TLSv1.2","271","Application Data","42530","4444"
"880","3.381653531","127.0.0.1","127.0.0.1","TLSv1.2","141","Application Data","4444","42236"
"881","3.381658280","127.0.0.1","127.0.0.1","TLSv1.2","141","Application Data","4444","42250"
"883","3.381675042","127.0.0.1","127.0.0.1","TCP","66","42236  >  4444 [ACK] Seq=206 Ack=76 Win=630 Len=0 TSval=449299780 TSecr=449299780","42236","4444"
"884","3.381683143","127.0.0.1","127.0.0.1","TCP","66","42250  >  4444 [ACK] Seq=206 Ack=76 Win=630 Len=0 TSval=449299780 TSecr=449299780","42250","4444"
"885","3.381758501","127.0.0.1","127.0.0.1","TLSv1.2","141","Application Data","4444","42194"
"886","3.381765276","127.0.0.1","127.0.0.1","TLSv1.2","141","Application Data","4444","41998"
"888","3.381774635","127.0.0.1","127.0.0.1","TCP","66","42194  >  4444 [ACK] Seq=206 Ack=76 Win=630 Len=0 TSval=449299780 TSecr=449299780","42194","4444"
"889","3.381786089","127.0.0.1","127.0.0.1","TCP","66","41998  >  4444 [ACK] Seq=206 Ack=76 Win=630 Len=0 TSval=449299780 TSecr=449299780","41998","4444"
"893","3.381927726","127.0.0.1","127.0.0.1","TLSv1.2","141","Application Data","4444","42646"
"894","3.381947141","127.0.0.1","127.0.0.1","TCP","66","42646  >  4444 [ACK] Seq=206 Ack=76 Win=630 Len=0 TSval=449299781 TSecr=449299780","42646","4444"
"910","3.383527989","127.0.0.1","127.0.0.1","TLSv1.2","141","Application Data","4444","42530"
"911","3.383546985","127.0.0.1","127.0.0.1","TCP","66","42530  >  4444 [ACK] Seq=206 Ack=76 Win=630 Len=0 TSval=449299782 TSecr=449299782","42530","4444"
"912","3.383620109","127.0.0.1","127.0.0.1","TLSv1.2","271","Application Data","42414","4444"
"934","3.387026525","127.0.0.1","127.0.0.1","TLSv1.2","141","Application Data","4444","42414"
"935","3.387044754","127.0.0.1","127.0.0.1","TCP","66","42414  >  4444 [ACK] Seq=206 Ack=76 Win=630 Len=0 TSval=449299786 TSecr=449299786","42414","4444"
"965","3.477077191","127.0.0.1","127.0.0.1","TLSv1.2","271","Application Data","42396","4444"
"966","3.477322472","127.0.0.1","127.0.0.1","TLSv1.2","271","Application Data","42586","4444"
"967","3.477557556","127.0.0.1","127.0.0.1","TLSv1.2","271","Application Data","42180","4444"
"969","3.477789009","127.0.0.1","127.0.0.1","TLSv1.2","271","Application Data","42162","4444"
"970","3.478030169","127.0.0.1","127.0.0.1","TLSv1.2","271","Application Data","42246","4444"
"983","3.478630381","127.0.0.1","127.0.0.1","TLSv1.2","271","Application Data","42204","4444"
"1007","3.479445843","127.0.0.1","127.0.0.1","TLSv1.2","271","Application Data","42490","4444"
"1013","3.479670032","127.0.0.1","127.0.0.1","TLSv1.2","271","Application Data","42552","4444"
"1022","3.480047801","127.0.0.1","127.0.0.1","TLSv1.2","271","Application Data","42300","4444"
"1030","3.480228130","127.0.0.1","127.0.0.1","TLSv1.2","271","Application Data","42388","4444"
"1036","3.480386948","127.0.0.1","127.0.0.1","TLSv1.2","271","Application Data","42062","4444"
"1111","3.481873999","127.0.0.1","127.0.0.1","TLSv1.2","141","Application Data","4444","42586"
"1113","3.481909478","127.0.0.1","127.0.0.1","TCP","66","42586  >  4444 [ACK] Seq=206 Ack=76 Win=630 Len=0 TSval=449299880 TSecr=449299880","42586","4444"
"1120","3.481970100","127.0.0.1","127.0.0.1","TLSv1.2","141","Application Data","4444","42162"
"1125","3.481988258","127.0.0.1","127.0.0.1","TCP","66","42162  >  4444 [ACK] Seq=411 Ack=151 Win=630 Len=0 TSval=449299881 TSecr=449299881","42162","4444"
"1139","3.482166841","127.0.0.1","127.0.0.1","TLSv1.2","141","Application Data","4444","42396"
"1141","3.482184651","127.0.0.1","127.0.0.1","TCP","66","42396  >  4444 [ACK] Seq=206 Ack=76 Win=630 Len=0 TSval=449299881 TSecr=449299881","42396","4444"
"1155","3.482612356","127.0.0.1","127.0.0.1","TLSv1.2","141","Application Data","4444","42180"
"1159","3.482634356","127.0.0.1","127.0.0.1","TCP","66","42180  >  4444 [ACK] Seq=206 Ack=76 Win=630 Len=0 TSval=449299881 TSecr=449299881","42180","4444"
"1172","3.483174016","127.0.0.1","127.0.0.1","TLSv1.2","141","Application Data","4444","42246"
"1175","3.483207400","127.0.0.1","127.0.0.1","TCP","66","42246  >  4444 [ACK] Seq=206 Ack=76 Win=630 Len=0 TSval=449299882 TSecr=449299882","42246","4444"
"1178","3.483291488","127.0.0.1","127.0.0.1","TLSv1.2","141","Application Data","4444","42204"
"1180","3.483314466","127.0.0.1","127.0.0.1","TCP","66","42204  >  4444 [ACK] Seq=206 Ack=76 Win=630 Len=0 TSval=449299882 TSecr=449299882","42204","4444"
"1184","3.483352040","127.0.0.1","127.0.0.1","TLSv1.2","271","Application Data","41930","4444"
"1196","3.483573017","127.0.0.1","127.0.0.1","TLSv1.2","141","Application Data","4444","42552"
"1197","3.483590756","127.0.0.1","127.0.0.1","TCP","66","42552  >  4444 [ACK] Seq=206 Ack=76 Win=630 Len=0 TSval=449299882 TSecr=449299882","42552","4444"
"1202","3.483674565","127.0.0.1","127.0.0.1","TLSv1.2","271","Application Data","42322","4444"
"1220","3.484336167","127.0.0.1","127.0.0.1","TLSv1.2","141","Application Data","4444","42490"
"1221","3.484347970","127.0.0.1","127.0.0.1","TCP","66","42490  >  4444 [ACK] Seq=206 Ack=76 Win=630 Len=0 TSval=449299883 TSecr=449299883","42490","4444"
"1222","3.484387710","127.0.0.1","127.0.0.1","TLSv1.2","141","Application Data","4444","42300"
"1224","3.484404751","127.0.0.1","127.0.0.1","TCP","66","42300  >  4444 [ACK] Seq=206 Ack=76 Win=630 Len=0 TSval=449299883 TSecr=449299883","42300","4444"
"1225","3.484466281","127.0.0.1","127.0.0.1","TLSv1.2","141","Application Data","4444","42388"
"1226","3.484482135","127.0.0.1","127.0.0.1","TCP","66","42388  >  4444 [ACK] Seq=206 Ack=76 Win=630 Len=0 TSval=449299883 TSecr=449299883","42388","4444"
"1238","3.484904811","127.0.0.1","127.0.0.1","TLSv1.2","271","Application Data","42276","4444"
"1243","3.485117547","127.0.0.1","127.0.0.1","TLSv1.2","271","Application Data","42222","4444"
"1245","3.485245355","127.0.0.1","127.0.0.1","TLSv1.2","141","Application Data","4444","42062"
"1246","3.485266308","127.0.0.1","127.0.0.1","TCP","66","42062  >  4444 [ACK] Seq=206 Ack=76 Win=630 Len=0 TSval=449299884 TSecr=449299884","42062","4444"
"1303","3.488162467","127.0.0.1","127.0.0.1","TLSv1.2","141","Application Data","4444","41930"
"1304","3.488180905","127.0.0.1","127.0.0.1","TCP","66","41930  >  4444 [ACK] Seq=206 Ack=76 Win=630 Len=0 TSval=449299887 TSecr=449299887","41930","4444"
"1305","3.488248790","127.0.0.1","127.0.0.1","TLSv1.2","141","Application Data","4444","42322"
"1307","3.488263666","127.0.0.1","127.0.0.1","TCP","66","42322  >  4444 [ACK] Seq=206 Ack=76 Win=630 Len=0 TSval=449299887 TSecr=449299887","42322","4444"
"1328","3.489790177","127.0.0.1","127.0.0.1","TLSv1.2","141","Application Data","4444","42276"
"1330","3.489806729","127.0.0.1","127.0.0.1","TCP","66","42276  >  4444 [ACK] Seq=206 Ack=76 Win=630 Len=0 TSval=449299888 TSecr=449299888","42276","4444"
"1333","3.490139870","127.0.0.1","127.0.0.1","TLSv1.2","141","Application Data","4444","42222"
"1334","3.490155654","127.0.0.1","127.0.0.1","TCP","66","42222  >  4444 [ACK] Seq=206 Ack=76 Win=630 Len=0 TSval=449299889 TSecr=449299889","42222","4444"
"1388","3.578616185","127.0.0.1","127.0.0.1","TLSv1.2","271","Application Data","42140","4444"
"1408","3.583179375","127.0.0.1","127.0.0.1","TLSv1.2","141","Application Data","4444","42140"
"1409","3.583205216","127.0.0.1","127.0.0.1","TCP","66","42140  >  4444 [ACK] Seq=206 Ack=76 Win=630 Len=0 TSval=449299982 TSecr=449299982","42140","4444"
"1412","3.585336618","127.0.0.1","127.0.0.1","TLSv1.2","271","Application Data","42416","4444"
"1417","3.586629861","127.0.0.1","127.0.0.1","TLSv1.2","271","Application Data","42736","4444"
"1445","3.591503144","127.0.0.1","127.0.0.1","TLSv1.2","141","Application Data","4444","42416"
"1446","3.591527449","127.0.0.1","127.0.0.1","TCP","66","42416  >  4444 [ACK] Seq=206 Ack=76 Win=630 Len=0 TSval=449299990 TSecr=449299990","42416","4444"
"1456","3.593078124","127.0.0.1","127.0.0.1","TLSv1.2","141","Application Data","4444","42736"
"1457","3.593097261","127.0.0.1","127.0.0.1","TCP","66","42736  >  4444 [ACK] Seq=206 Ack=76 Win=630 Len=0 TSval=449299992 TSecr=449299992","42736","4444"
"1475","3.678491150","127.0.0.1","127.0.0.1","TLSv1.2","271","Application Data","42036","4444"
"1476","3.678681746","127.0.0.1","127.0.0.1","TLSv1.2","271","Application Data","42040","4444"
"1481","3.679748355","127.0.0.1","127.0.0.1","TLSv1.2","271","Application Data","42568","4444"
"1488","3.680777599","127.0.0.1","127.0.0.1","TLSv1.2","271","Application Data","42720","4444"
"1538","3.684078975","127.0.0.1","127.0.0.1","TLSv1.2","141","Application Data","4444","42036"
"1539","3.684103489","127.0.0.1","127.0.0.1","TCP","66","42036  >  4444 [ACK] Seq=206 Ack=76 Win=630 Len=0 TSval=449300083 TSecr=449300083","42036","4444"
"1557","3.685718069","127.0.0.1","127.0.0.1","TLSv1.2","141","Application Data","4444","42040"
"1558","3.685741117","127.0.0.1","127.0.0.1","TCP","66","42040  >  4444 [ACK] Seq=206 Ack=76 Win=630 Len=0 TSval=449300084 TSecr=449300084","42040","4444"
"1563","3.686277564","127.0.0.1","127.0.0.1","TLSv1.2","141","Application Data","4444","42568"
"1564","3.686294117","127.0.0.1","127.0.0.1","TCP","66","42568  >  4444 [ACK] Seq=206 Ack=76 Win=630 Len=0 TSval=449300085 TSecr=449300085","42568","4444"
"1565","3.686339583","127.0.0.1","127.0.0.1","TLSv1.2","141","Application Data","4444","42720"
"1566","3.686360884","127.0.0.1","127.0.0.1","TCP","66","42720  >  4444 [ACK] Seq=206 Ack=76 Win=630 Len=0 TSval=449300085 TSecr=449300085","42720","4444"
"1589","3.781635155","127.0.0.1","127.0.0.1","TLSv1.2","271","Application Data","42078","4444"
"1590","3.781827427","127.0.0.1","127.0.0.1","TLSv1.2","271","Application Data","42578","4444"
"1594","3.782587784","127.0.0.1","127.0.0.1","TLSv1.2","271","Application Data","42632","4444"
"1607","3.784308732","127.0.0.1","127.0.0.1","TLSv1.2","271","[TCP Previous segment not captured] , Application Data","44414","4444"
"1613","3.784619314","127.0.0.1","127.0.0.1","TLSv1.2","271","Application Data","42640","4444"
"1617","3.784913065","127.0.0.1","127.0.0.1","TLSv1.2","271","Application Data","42674","4444"
"1656","3.786321545","127.0.0.1","127.0.0.1","TLSv1.2","271","Application Data","42204","4444"
"1666","3.786701758","127.0.0.1","127.0.0.1","TLSv1.2","271","Application Data","42714","4444"
"1668","3.787113540","127.0.0.1","127.0.0.1","TLSv1.2","271","Application Data","42430","4444"
"1678","3.787699504","127.0.0.1","127.0.0.1","TLSv1.2","141","Application Data","4444","42578"
"1679","3.787730514","127.0.0.1","127.0.0.1","TCP","66","42578  >  4444 [ACK] Seq=206 Ack=76 Win=630 Len=0 TSval=449300186 TSecr=449300186","42578","4444"
"1680","3.787763897","127.0.0.1","127.0.0.1","TLSv1.2","141","Application Data","4444","42078"
"1681","3.787788202","127.0.0.1","127.0.0.1","TCP","66","42078  >  4444 [ACK] Seq=206 Ack=76 Win=630 Len=0 TSval=449300186 TSecr=449300186","42078","4444"
"1702","3.788368719","127.0.0.1","127.0.0.1","TLSv1.2","141","Application Data","4444","42632"
"1703","3.788384713","127.0.0.1","127.0.0.1","TCP","66","42632  >  4444 [ACK] Seq=411 Ack=151 Win=630 Len=0 TSval=449300187 TSecr=449300187","42632","4444"
"1707","3.788468312","127.0.0.1","127.0.0.1","TLSv1.2","271","Application Data","42716","4444"
"1713","3.788795097","127.0.0.1","127.0.0.1","TLSv1.2","271","Application Data","41998","4444"
"1774","3.790678565","127.0.0.1","127.0.0.1","TLSv1.2","141","Application Data","4444","42640"
"1776","3.790722564","127.0.0.1","127.0.0.1","TCP","66","42640  >  4444 [ACK] Seq=206 Ack=76 Win=630 Len=0 TSval=449300189 TSecr=449300189","42640","4444"
"1799","3.791330878","127.0.0.1","127.0.0.1","TLSv1.2","141","Application Data","4444","44414"
"1800","3.791356021","127.0.0.1","127.0.0.1","TCP","66","44414  >  4444 [ACK] Seq=207 Ack=76 Win=630 Len=0 TSval=449300190 TSecr=449300190","44414","4444"
"1812","3.791708857","127.0.0.1","127.0.0.1","TLSv1.2","141","Application Data","4444","42674"
"1813","3.791731695","127.0.0.1","127.0.0.1","TCP","66","42674  >  4444 [ACK] Seq=411 Ack=151 Win=630 Len=0 TSval=449300190 TSecr=449300190","42674","4444"
"1814","3.791738399","127.0.0.1","127.0.0.1","TLSv1.2","141","Application Data","4444","42714"
"1815","3.791749015","127.0.0.1","127.0.0.1","TCP","66","42714  >  4444 [ACK] Seq=206 Ack=76 Win=630 Len=0 TSval=449300190 TSecr=449300190","42714","4444"
"1833","3.792918919","127.0.0.1","127.0.0.1","TLSv1.2","141","Application Data","4444","42204"
"1836","3.792947553","127.0.0.1","127.0.0.1","TCP","66","42204  >  4444 [ACK] Seq=411 Ack=151 Win=630 Len=0 TSval=449300192 TSecr=449300191","42204","4444"
"1838","3.793175584","127.0.0.1","127.0.0.1","TLSv1.2","141","Application Data","4444","42430"
"1839","3.793195768","127.0.0.1","127.0.0.1","TCP","66","42430  >  4444 [ACK] Seq=206 Ack=76 Win=630 Len=0 TSval=449300192 TSecr=449300192","42430","4444"
"1851","3.794027432","127.0.0.1","127.0.0.1","TLSv1.2","141","Application Data","4444","42716"
"1852","3.794039794","127.0.0.1","127.0.0.1","TCP","66","42716  >  4444 [ACK] Seq=411 Ack=151 Win=630 Len=0 TSval=449300193 TSecr=449300193","42716","4444"
"1857","3.794749936","127.0.0.1","127.0.0.1","TLSv1.2","141","Application Data","4444","41998"
"1858","3.794760551","127.0.0.1","127.0.0.1","TCP","66","41998  >  4444 [ACK] Seq=411 Ack=151 Win=630 Len=0 TSval=449300193 TSecr=449300193","41998","4444"
"1900","3.883172403","127.0.0.1","127.0.0.1","TLSv1.2","271","Application Data","42162","4444"
"1901","3.883337646","127.0.0.1","127.0.0.1","TLSv1.2","271","Application Data","42462","4444"
"1923","3.885569200","127.0.0.1","127.0.0.1","TLSv1.2","271","Application Data","41940","4444"
"1924","3.885705320","127.0.0.1","127.0.0.1","TLSv1.2","271","Application Data","42174","4444"
"1950","3.887126372","127.0.0.1","127.0.0.1","TLSv1.2","141","Application Data","4444","42462"
"1951","3.887145368","127.0.0.1","127.0.0.1","TCP","66","42462  >  4444 [ACK] Seq=206 Ack=76 Win=630 Len=0 TSval=449300286 TSecr=449300286","42462","4444"
"1968","3.887994563","127.0.0.1","127.0.0.1","TLSv1.2","141","Application Data","4444","42162"
"1969","3.888006575","127.0.0.1","127.0.0.1","TCP","66","42162  >  4444 [ACK] Seq=616 Ack=226 Win=630 Len=0 TSval=449300287 TSecr=449300287","42162","4444"
"1988","3.889011934","127.0.0.1","127.0.0.1","TLSv1.2","141","Application Data","4444","41940"
"1989","3.889030651","127.0.0.1","127.0.0.1","TCP","66","41940  >  4444 [ACK] Seq=206 Ack=76 Win=630 Len=0 TSval=449300288 TSecr=449300288","41940","4444"
"1992","3.889220898","127.0.0.1","127.0.0.1","TLSv1.2","141","Application Data","4444","42174"
"1993","3.889236891","127.0.0.1","127.0.0.1","TCP","66","42174  >  4444 [ACK] Seq=206 Ack=76 Win=630 Len=0 TSval=449300288 TSecr=449300288","42174","4444"
"1996","3.895017477","127.0.0.1","127.0.0.1","TLSv1.2","271","Application Data","42314","4444"
"2001","3.896357653","127.0.0.1","127.0.0.1","TLSv1.2","271","Application Data","42716","4444"
"2003","3.896496915","127.0.0.1","127.0.0.1","TLSv1.2","271","Application Data","41952","4444"
"2049","3.898846500","127.0.0.1","127.0.0.1","TLSv1.2","141","Application Data","4444","42716"
"2050","3.898864170","127.0.0.1","127.0.0.1","TCP","66","42716  >  4444 [ACK] Seq=616 Ack=226 Win=630 Len=0 TSval=449300297 TSecr=449300297","42716","4444"
"2053","3.899213234","127.0.0.1","127.0.0.1","TLSv1.2","141","Application Data","4444","42314"
"2054","3.899223780","127.0.0.1","127.0.0.1","TCP","66","42314  >  4444 [ACK] Seq=411 Ack=151 Win=630 Len=0 TSval=449300298 TSecr=449300298","42314","4444"
"2066","3.900492369","127.0.0.1","127.0.0.1","TLSv1.2","141","Application Data","4444","41952"
"2067","3.900502845","127.0.0.1","127.0.0.1","TCP","66","41952  >  4444 [ACK] Seq=206 Ack=76 Win=630 Len=0 TSval=449300299 TSecr=449300299","41952","4444"
"2097","3.981485449","127.0.0.1","127.0.0.1","TLSv1.2","271","Application Data","42372","4444"
"2109","3.983939795","127.0.0.1","127.0.0.1","TLSv1.2","271","Application Data","42552","4444"
"2110","3.984232568","127.0.0.1","127.0.0.1","TLSv1.2","271","Application Data","42752","4444"
"2128","3.985681206","127.0.0.1","127.0.0.1","TLSv1.2","141","Application Data","4444","42372"
"2129","3.985697549","127.0.0.1","127.0.0.1","TCP","66","42372  >  4444 [ACK] Seq=206 Ack=76 Win=630 Len=0 TSval=449300384 TSecr=449300384","42372","4444"
"2134","3.986107026","127.0.0.1","127.0.0.1","TLSv1.2","271","Application Data","42334","4444"
"2136","3.986291126","127.0.0.1","127.0.0.1","TLSv1.2","271","Application Data","42606","4444"
"2186","3.988730387","127.0.0.1","127.0.0.1","TLSv1.2","271","Application Data","42568","4444"
"2188","3.988855891","127.0.0.1","127.0.0.1","TLSv1.2","141","Application Data","4444","42552"
"2189","3.988863154","127.0.0.1","127.0.0.1","TLSv1.2","141","Application Data","4444","42752"
"2190","3.988869300","127.0.0.1","127.0.0.1","TCP","66","42552  >  4444 [ACK] Seq=411 Ack=151 Win=630 Len=0 TSval=449300387 TSecr=449300387","42552","4444"
"2191","3.988878799","127.0.0.1","127.0.0.1","TCP","66","42752  >  4444 [ACK] Seq=206 Ack=76 Win=630 Len=0 TSval=449300387 TSecr=449300387","42752","4444"
"2224","3.990579982","127.0.0.1","127.0.0.1","TLSv1.2","141","Application Data","4444","42334"
"2225","3.990591994","127.0.0.1","127.0.0.1","TCP","66","42334  >  4444 [ACK] Seq=206 Ack=76 Win=630 Len=0 TSval=449300389 TSecr=449300389","42334","4444"
"2226","3.990630337","127.0.0.1","127.0.0.1","TLSv1.2","271","Application Data","42094","4444"
"2228","3.990737403","127.0.0.1","127.0.0.1","TLSv1.2","271","Application Data","42640","4444"
"2231","3.991026544","127.0.0.1","127.0.0.1","TLSv1.2","141","Application Data","4444","42606"
"2232","3.991048963","127.0.0.1","127.0.0.1","TCP","66","42606  >  4444 [ACK] Seq=411 Ack=151 Win=630 Len=0 TSval=449300390 TSecr=449300390","42606","4444"
"2256","3.992206435","127.0.0.1","127.0.0.1","TLSv1.2","141","Application Data","4444","42568"
"2257","3.992223127","127.0.0.1","127.0.0.1","TCP","66","42568  >  4444 [ACK] Seq=411 Ack=151 Win=630 Len=0 TSval=449300391 TSecr=449300391","42568","4444"
"2260","3.992475182","127.0.0.1","127.0.0.1","TLSv1.2","271","Application Data","42720","4444"
"2295","3.994231190","127.0.0.1","127.0.0.1","TLSv1.2","141","Application Data","4444","42094"
"2296","3.994238035","127.0.0.1","127.0.0.1","TLSv1.2","141","Application Data","4444","42640"
"2297","3.994242784","127.0.0.1","127.0.0.1","TCP","66","42094  >  4444 [ACK] Seq=206 Ack=76 Win=630 Len=0 TSval=449300393 TSecr=449300393","42094","4444"
"2298","3.994253609","127.0.0.1","127.0.0.1","TCP","66","42640  >  4444 [ACK] Seq=411 Ack=151 Win=630 Len=0 TSval=449300393 TSecr=449300393","42640","4444"
"2311","3.995336840","127.0.0.1","127.0.0.1","TLSv1.2","141","Application Data","4444","42720"
"2312","3.995348713","127.0.0.1","127.0.0.1","TCP","66","42720  >  4444 [ACK] Seq=411 Ack=151 Win=630 Len=0 TSval=449300394 TSecr=449300394","42720","4444"
"2315","3.995704902","127.0.0.1","127.0.0.1","TLSv1.2","271","Application Data","42376","4444"
"2316","3.995837599","127.0.0.1","127.0.0.1","TLSv1.2","271","Application Data","42428","4444"
"2356","3.998377081","127.0.0.1","127.0.0.1","TLSv1.2","141","Application Data","4444","42376"
"2358","3.998389373","127.0.0.1","127.0.0.1","TCP","66","42376  >  4444 [ACK] Seq=206 Ack=76 Win=630 Len=0 TSval=449300397 TSecr=449300397","42376","4444"
"2361","3.998597290","127.0.0.1","127.0.0.1","TLSv1.2","141","Application Data","4444","42428"
"2362","3.998606788","127.0.0.1","127.0.0.1","TCP","66","42428  >  4444 [ACK] Seq=411 Ack=151 Win=630 Len=0 TSval=449300397 TSecr=449300397","42428","4444"
"2404","4.085758292","127.0.0.1","127.0.0.1","TLSv1.2","271","Application Data","42188","4444"
"2405","4.086006297","127.0.0.1","127.0.0.1","TLSv1.2","271","Application Data","42696","4444"
"2410","4.086825250","127.0.0.1","127.0.0.1","TLSv1.2","271","Application Data","42078","4444"
"2465","4.089769879","127.0.0.1","127.0.0.1","TLSv1.2","141","Application Data","4444","42078"
"2466","4.089780844","127.0.0.1","127.0.0.1","TCP","66","42078  >  4444 [ACK] Seq=411 Ack=151 Win=630 Len=0 TSval=449300488 TSecr=449300488","42078","4444"
"2467","4.089780844","127.0.0.1","127.0.0.1","TLSv1.2","141","Application Data","4444","42188"
"2468","4.089799492","127.0.0.1","127.0.0.1","TCP","66","42188  >  4444 [ACK] Seq=206 Ack=76 Win=630 Len=0 TSval=449300488 TSecr=449300488","42188","4444"
"2474","4.090432389","127.0.0.1","127.0.0.1","TLSv1.2","141","Application Data","4444","42696"
"2475","4.090452853","127.0.0.1","127.0.0.1","TCP","66","42696  >  4444 [ACK] Seq=206 Ack=76 Win=630 Len=0 TSval=449300489 TSecr=449300489","42696","4444"
"2478","4.090861142","127.0.0.1","127.0.0.1","TLSv1.2","271","Application Data","42650","4444"
"2498","4.093821765","127.0.0.1","127.0.0.1","TLSv1.2","141","Application Data","4444","42650"
"2499","4.093833498","127.0.0.1","127.0.0.1","TCP","66","42650  >  4444 [ACK] Seq=206 Ack=76 Win=630 Len=0 TSval=449300492 TSecr=449300492","42650","4444"
"2502","4.095538871","127.0.0.1","127.0.0.1","TLSv1.2","271","Application Data","41930","4444"
"2524","4.099951554","127.0.0.1","127.0.0.1","TLSv1.2","271","Application Data","42428","4444"
"2525","4.100206822","127.0.0.1","127.0.0.1","TLSv1.2","141","Application Data","4444","41930"
"2526","4.100224492","127.0.0.1","127.0.0.1","TCP","66","41930  >  4444 [ACK] Seq=411 Ack=151 Win=630 Len=0 TSval=449300499 TSecr=449300499","41930","4444"
"2548","4.103080563","127.0.0.1","127.0.0.1","TLSv1.2","141","Application Data","4444","42428"
"2549","4.103091388","127.0.0.1","127.0.0.1","TCP","66","42428  >  4444 [ACK] Seq=616 Ack=226 Win=630 Len=0 TSval=449300502 TSecr=449300502","42428","4444"
"2582","4.299730261","127.0.0.1","127.0.0.1","TLSv1.2","103","Application Data","44414","4444"
"2583","4.299825314","127.0.0.1","127.0.0.1","TLSv1.2","103","[TCP Previous segment not captured] , Application Data","44438","4444"
"2584","4.299882584","127.0.0.1","127.0.0.1","TLSv1.2","103","Application Data","42388","4444"
"2585","4.300044824","127.0.0.1","127.0.0.1","TLSv1.2","103","Application Data","42040","4444"
"2586","4.300115782","127.0.0.1","127.0.0.1","TLSv1.2","103","Application Data","42440","4444"
"2587","4.300175427","127.0.0.1","127.0.0.1","TLSv1.2","103","Application Data","42084","4444"
"2588","4.300199731","127.0.0.1","127.0.0.1","TLSv1.2","99","Application Data","4444","44414"
"2589","4.300224664","127.0.0.1","127.0.0.1","TCP","66","44414  >  4444 [ACK] Seq=244 Ack=109 Win=630 Len=0 TSval=449300699 TSecr=449300699","44414","4444"
"2590","4.300231718","127.0.0.1","127.0.0.1","TLSv1.2","103","Application Data","42606","4444"
"2591","4.300288359","127.0.0.1","127.0.0.1","TLSv1.2","103","Application Data","42322","4444"
"2592","4.300305749","127.0.0.1","127.0.0.1","TCP","66","4444  >  44414 [FIN, ACK] Seq=109 Ack=244 Win=512 Len=0 TSval=449300699 TSecr=449300699","4444","44414"
"2593","4.300346257","127.0.0.1","127.0.0.1","TLSv1.2","103","Application Data","42014","4444"
"2594","4.300402479","127.0.0.1","127.0.0.1","TLSv1.2","103","Application Data","42246","4444"
"2595","4.300459260","127.0.0.1","127.0.0.1","TLSv1.2","103","Application Data","42592","4444"
"2596","4.300506612","127.0.0.1","127.0.0.1","TCP","66","44414  >  4444 [FIN, ACK] Seq=244 Ack=110 Win=630 Len=0 TSval=449300699 TSecr=449300699","44414","4444"
"2597","4.300514713","127.0.0.1","127.0.0.1","TLSv1.2","103","Application Data","42316","4444"
"2598","4.300544326","127.0.0.1","127.0.0.1","TCP","66","4444  >  44414 [ACK] Seq=110 Ack=245 Win=512 Len=0 TSval=449300699 TSecr=449300699","4444","44414"
"2599","4.300571214","127.0.0.1","127.0.0.1","TLSv1.2","103","Application Data","41940","4444"
"2600","4.300630300","127.0.0.1","127.0.0.1","TLSv1.2","103","Application Data","41930","4444"
"2601","4.300713341","127.0.0.1","127.0.0.1","TLSv1.2","103","Application Data","42714","4444"
"2602","4.300723328","127.0.0.1","127.0.0.1","TLSv1.2","99","Application Data","4444","42246"
"2603","4.300750077","127.0.0.1","127.0.0.1","TCP","66","42246  >  4444 [ACK] Seq=243 Ack=109 Win=630 Len=0 TSval=449300699 TSecr=449300699","42246","4444"
"2604","4.300819987","127.0.0.1","127.0.0.1","TLSv1.2","103","Application Data","42700","4444"
"2605","4.300826203","127.0.0.1","127.0.0.1","TLSv1.2","99","Application Data","4444","42440"
"2606","4.300831511","127.0.0.1","127.0.0.1","TCP","66","4444  >  42246 [FIN, ACK] Seq=109 Ack=243 Win=512 Len=0 TSval=449300699 TSecr=449300699","4444","42246"
"2607","4.300850298","127.0.0.1","127.0.0.1","TCP","66","42440  >  4444 [ACK] Seq=243 Ack=109 Win=630 Len=0 TSval=449300699 TSecr=449300699","42440","4444"
"2608","4.300930476","127.0.0.1","127.0.0.1","TLSv1.2","103","Application Data","42334","4444"
"2609","4.300933339","127.0.0.1","127.0.0.1","TLSv1.2","99","Application Data","4444","42606"
"2610","4.300944234","127.0.0.1","127.0.0.1","TCP","66","4444  >  42440 [FIN, ACK] Seq=109 Ack=243 Win=512 Len=0 TSval=449300700 TSecr=449300699","4444","42440"
"2611","4.300957225","127.0.0.1","127.0.0.1","TCP","66","42606  >  4444 [ACK] Seq=448 Ack=184 Win=630 Len=0 TSval=449300700 TSecr=449300699","42606","4444"
"2612","4.300960577","127.0.0.1","127.0.0.1","TCP","66","42246  >  4444 [FIN, ACK] Seq=243 Ack=110 Win=630 Len=0 TSval=449300700 TSecr=449300699","42246","4444"
"2613","4.301000945","127.0.0.1","127.0.0.1","TLSv1.2","99","Application Data","4444","42084"
"2614","4.301000945","127.0.0.1","127.0.0.1","TCP","66","4444  >  42246 [ACK] Seq=110 Ack=244 Win=512 Len=0 TSval=449300700 TSecr=449300700","4444","42246"
"2615","4.301025878","127.0.0.1","127.0.0.1","TCP","66","42084  >  4444 [ACK] Seq=38 Ack=34 Win=630 Len=0 TSval=449300700 TSecr=449300700","42084","4444"
"2616","4.301037123","127.0.0.1","127.0.0.1","TLSv1.2","103","Application Data","42490","4444"
"2617","4.301040056","127.0.0.1","127.0.0.1","TCP","66","4444  >  42606 [FIN, ACK] Seq=184 Ack=448 Win=512 Len=0 TSval=449300700 TSecr=449300700","4444","42606"
"2618","4.301103611","127.0.0.1","127.0.0.1","TLSv1.2","99","Application Data","4444","42322"
"2619","4.301104589","127.0.0.1","127.0.0.1","TCP","66","4444  >  42084 [FIN, ACK] Seq=34 Ack=38 Win=512 Len=0 TSval=449300700 TSecr=449300700","4444","42084"
"2620","4.301108849","127.0.0.1","127.0.0.1","TLSv1.2","99","Application Data","4444","42014"
"2621","4.301129033","127.0.0.1","127.0.0.1","TCP","66","42322  >  4444 [ACK] Seq=243 Ack=109 Win=630 Len=0 TSval=449300700 TSecr=449300700","42322","4444"
"2622","4.301133643","127.0.0.1","127.0.0.1","TCP","66","42014  >  4444 [ACK] Seq=38 Ack=34 Win=630 Len=0 TSval=449300700 TSecr=449300700","42014","4444"
"2623","4.301148030","127.0.0.1","127.0.0.1","TLSv1.2","103","Application Data","42012","4444"
"2624","4.301224785","127.0.0.1","127.0.0.1","TCP","66","4444  >  42322 [FIN, ACK] Seq=109 Ack=243 Win=512 Len=0 TSval=449300700 TSecr=449300700","4444","42322"
"2625","4.301236169","127.0.0.1","127.0.0.1","TLSv1.2","99","Application Data","4444","42040"
"2626","4.301259496","127.0.0.1","127.0.0.1","TCP","66","42040  >  4444 [ACK] Seq=243 Ack=109 Win=630 Len=0 TSval=449300700 TSecr=449300700","42040","4444"
"2627","4.301269064","127.0.0.1","127.0.0.1","TLSv1.2","99","Application Data","4444","44438"
"2628","4.301271020","127.0.0.1","127.0.0.1","TLSv1.2","99","Application Data","4444","42388"
"2629","4.301290505","127.0.0.1","127.0.0.1","TCP","66","44438  >  4444 [ACK] Seq=39 Ack=34 Win=630 Len=0 TSval=449300700 TSecr=449300700","44438","4444"
"2630","4.301305381","127.0.0.1","127.0.0.1","TCP","66","42388  >  4444 [ACK] Seq=243 Ack=109 Win=630 Len=0 TSval=449300700 TSecr=449300700","42388","4444"
"2631","4.301331432","127.0.0.1","127.0.0.1","TLSv1.2","103","Application Data","42524","4444"
"2632","4.301353711","127.0.0.1","127.0.0.1","TCP","66","4444  >  42014 [FIN, ACK] Seq=34 Ack=38 Win=512 Len=0 TSval=449300700 TSecr=449300700","4444","42014"
"2633","4.301449463","127.0.0.1","127.0.0.1","TLSv1.2","103","Application Data","42204","4444"
"2634","4.301458961","127.0.0.1","127.0.0.1","TLSv1.2","99","Application Data","4444","41930"
"2635","4.301472440","127.0.0.1","127.0.0.1","TLSv1.2","99","Application Data","4444","42316"
"2636","4.301475723","127.0.0.1","127.0.0.1","TCP","66","4444  >  42040 [FIN, ACK] Seq=109 Ack=243 Win=512 Len=0 TSval=449300700 TSecr=449300700","4444","42040"
"2637","4.301482358","127.0.0.1","127.0.0.1","TCP","66","41930  >  4444 [ACK] Seq=448 Ack=184 Win=630 Len=0 TSval=449300700 TSecr=449300700","41930","4444"
"2638","4.301493323","127.0.0.1","127.0.0.1","TCP","66","42316  >  4444 [ACK] Seq=38 Ack=34 Win=630 Len=0 TSval=449300700 TSecr=449300700","42316","4444"
"2639","4.301526218","127.0.0.1","127.0.0.1","TCP","66","42014  >  4444 [FIN, ACK] Seq=38 Ack=35 Win=630 Len=0 TSval=449300700 TSecr=449300700","42014","4444"
"2640","4.301528173","127.0.0.1","127.0.0.1","TLSv1.2","99","Application Data","4444","42012"
"2641","4.301551989","127.0.0.1","127.0.0.1","TCP","66","42012  >  4444 [ACK] Seq=38 Ack=34 Win=630 Len=0 TSval=449300700 TSecr=449300700","42012","4444"
"2642","4.301567843","127.0.0.1","127.0.0.1","TLSv1.2","103","Application Data","41904","4444"
"2643","4.301567843","127.0.0.1","127.0.0.1","TCP","66","4444  >  42014 [ACK] Seq=35 Ack=39 Win=512 Len=0 TSval=449300700 TSecr=449300700","4444","42014"
"2644","4.301585303","127.0.0.1","127.0.0.1","TLSv1.2","99","Application Data","4444","42700"
"2645","4.301592567","127.0.0.1","127.0.0.1","TCP","66","4444  >  44438 [FIN, ACK] Seq=34 Ack=39 Win=512 Len=0 TSval=449300700 TSecr=449300700","4444","44438"
"2646","4.301610586","127.0.0.1","127.0.0.1","TCP","66","42700  >  4444 [ACK] Seq=38 Ack=34 Win=630 Len=0 TSval=449300700 TSecr=449300700","42700","4444"
"2647","4.301627208","127.0.0.1","127.0.0.1","TLSv1.2","99","Application Data","4444","42524"
"2648","4.301633982","127.0.0.1","127.0.0.1","TCP","66","42606  >  4444 [FIN, ACK] Seq=448 Ack=185 Win=630 Len=0 TSval=449300700 TSecr=449300700","42606","4444"
"2649","4.301641595","127.0.0.1","127.0.0.1","TLSv1.2","99","Application Data","4444","42592"
"2650","4.301643970","127.0.0.1","127.0.0.1","TLSv1.2","99","Application Data","4444","42714"
"2651","4.301650116","127.0.0.1","127.0.0.1","TCP","66","42524  >  4444 [ACK] Seq=38 Ack=34 Win=630 Len=0 TSval=449300700 TSecr=449300700","42524","4444"
"2652","4.301663525","127.0.0.1","127.0.0.1","TCP","66","42714  >  4444 [ACK] Seq=243 Ack=109 Win=630 Len=0 TSval=449300700 TSecr=449300700","42714","4444"
"2653","4.301663525","127.0.0.1","127.0.0.1","TCP","66","42592  >  4444 [ACK] Seq=38 Ack=34 Win=630 Len=0 TSval=449300700 TSecr=449300700","42592","4444"
"2654","4.301676865","127.0.0.1","127.0.0.1","TCP","66","4444  >  42606 [ACK] Seq=185 Ack=449 Win=512 Len=0 TSval=449300700 TSecr=449300700","4444","42606"
"2655","4.301681544","127.0.0.1","127.0.0.1","TLSv1.2","103","Application Data","42208","4444"
"2656","4.301695023","127.0.0.1","127.0.0.1","TLSv1.2","99","Application Data","4444","41940"
"2657","4.301695023","127.0.0.1","127.0.0.1","TCP","66","4444  >  42388 [FIN, ACK] Seq=109 Ack=243 Win=512 Len=0 TSval=449300700 TSecr=449300700","4444","42388"
"2658","4.301717791","127.0.0.1","127.0.0.1","TCP","66","41940  >  4444 [ACK] Seq=243 Ack=109 Win=630 Len=0 TSval=449300700 TSecr=449300700","41940","4444"
"2659","4.301780718","127.0.0.1","127.0.0.1","TLSv1.2","99","Application Data","4444","42334"
"2660","4.301802648","127.0.0.1","127.0.0.1","TLSv1.2","103","Application Data","41920","4444"
"2661","4.301804603","127.0.0.1","127.0.0.1","TCP","66","4444  >  41930 [FIN, ACK] Seq=184 Ack=448 Win=512 Len=0 TSval=449300700 TSecr=449300700","4444","41930"
"2662","4.301804603","127.0.0.1","127.0.0.1","TCP","66","42334  >  4444 [ACK] Seq=243 Ack=109 Win=630 Len=0 TSval=449300700 TSecr=449300700","42334","4444"
"2663","4.301837918","127.0.0.1","127.0.0.1","TLSv1.2","99","Application Data","4444","42490"
"2664","4.301856705","127.0.0.1","127.0.0.1","TCP","66","42490  >  4444 [ACK] Seq=243 Ack=109 Win=630 Len=0 TSval=449300700 TSecr=449300700","42490","4444"
"2665","4.301864178","127.0.0.1","127.0.0.1","TCP","66","42084  >  4444 [FIN, ACK] Seq=38 Ack=35 Win=630 Len=0 TSval=449300700 TSecr=449300700","42084","4444"
"2666","4.301902939","127.0.0.1","127.0.0.1","TCP","66","4444  >  42084 [ACK] Seq=35 Ack=39 Win=512 Len=0 TSval=449300700 TSecr=449300700","4444","42084"
"2667","4.301912438","127.0.0.1","127.0.0.1","TLSv1.2","103","Application Data","42630","4444"
"2668","4.301928780","127.0.0.1","127.0.0.1","TCP","66","4444  >  42316 [FIN, ACK] Seq=34 Ack=38 Win=512 Len=0 TSval=449300700 TSecr=449300700","4444","42316"
"2669","4.301935834","127.0.0.1","127.0.0.1","TLSv1.2","99","Application Data","4444","42208"
"2670","4.301946869","127.0.0.1","127.0.0.1","TLSv1.2","99","Application Data","4444","42204"
"2671","4.301955949","127.0.0.1","127.0.0.1","TCP","66","42208  >  4444 [ACK] Seq=38 Ack=34 Win=630 Len=0 TSval=449300701 TSecr=449300701","42208","4444"
"2672","4.301971104","127.0.0.1","127.0.0.1","TCP","66","42204  >  4444 [ACK] Seq=448 Ack=184 Win=630 Len=0 TSval=449300701 TSecr=449300701","42204","4444"
"2673","4.302032634","127.0.0.1","127.0.0.1","TLSv1.2","103","Application Data","42588","4444"
"2674","4.302041294","127.0.0.1","127.0.0.1","TCP","66","42440  >  4444 [FIN, ACK] Seq=243 Ack=110 Win=630 Len=0 TSval=449300701 TSecr=449300700","42440","4444"
"2675","4.302046113","127.0.0.1","127.0.0.1","TLSv1.2","99","Application Data","4444","41904"
"2676","4.302052259","127.0.0.1","127.0.0.1","TCP","66","4444  >  42012 [FIN, ACK] Seq=34 Ack=38 Win=512 Len=0 TSval=449300701 TSecr=449300700","4444","42012"
"2677","4.302069859","127.0.0.1","127.0.0.1","TCP","66","41904  >  4444 [ACK] Seq=38 Ack=34 Win=630 Len=0 TSval=449300701 TSecr=449300701","41904","4444"
"2678","4.302078589","127.0.0.1","127.0.0.1","TCP","66","4444  >  42440 [ACK] Seq=110 Ack=244 Win=512 Len=0 TSval=449300701 TSecr=449300701","4444","42440"
"2679","4.302094583","127.0.0.1","127.0.0.1","TCP","66","4444  >  42700 [FIN, ACK] Seq=34 Ack=38 Win=512 Len=0 TSval=449300701 TSecr=449300700","4444","42700"
"2680","4.302103243","127.0.0.1","127.0.0.1","TLSv1.2","99","Application Data","4444","41920"
"2681","4.302123636","127.0.0.1","127.0.0.1","TCP","66","41920  >  4444 [ACK] Seq=38 Ack=34 Win=630 Len=0 TSval=449300701 TSecr=449300701","41920","4444"
