"No.","Time","Source","Destination","Protocol","Length","Info"
"53","0.083839723","127.0.0.1","127.0.0.1","TCP","110","53150  >  8080 [PSH, ACK] Seq=1 Ack=1 Win=605 Len=44 TSval=2706769004 TSecr=2706759273"
"54","0.083863539","127.0.0.1","127.0.0.1","TCP","66","8080  >  53150 [ACK] Seq=1 Ack=45 Win=512 Len=0 TSval=2706769004 TSecr=2706769004"
"63","0.101186762","127.0.0.1","127.0.0.1","TCP","66","51768  >  8080 [ACK] Seq=1 Ack=1 Win=65536 Len=0 TSval=2706769021 TSecr=2706769021"
"65","0.101198076","127.0.0.1","127.0.0.1","TCP","66","51776  >  8080 [ACK] Seq=1 Ack=1 Win=65536 Len=0 TSval=2706769021 TSecr=2706769021"
"68","0.101404735","127.0.0.1","127.0.0.1","TCP","66","51780  >  8080 [ACK] Seq=1 Ack=1 Win=65536 Len=0 TSval=2706769021 TSecr=2706769021"
"69","0.101479186","127.0.0.1","127.0.0.1","TCP","415","51776  >  8080 [PSH, ACK] Seq=1 Ack=1 Win=65536 Len=349 TSval=2706769021 TSecr=2706769021"
"70","0.101479186","127.0.0.1","127.0.0.1","TCP","415","51768  >  8080 [PSH, ACK] Seq=1 Ack=1 Win=65536 Len=349 TSval=2706769021 TSecr=2706769021"
"71","0.101489592","127.0.0.1","127.0.0.1","TCP","66","8080  >  51776 [ACK] Seq=1 Ack=350 Win=65152 Len=0 TSval=2706769021 TSecr=2706769021"
"72","0.101489592","127.0.0.1","127.0.0.1","TCP","66","8080  >  51768 [ACK] Seq=1 Ack=350 Win=65152 Len=0 TSval=2706769021 TSecr=2706769021"
"75","0.101527795","127.0.0.1","127.0.0.1","TCP","66","51794  >  8080 [ACK] Seq=1 Ack=1 Win=65536 Len=0 TSval=2706769021 TSecr=2706769021"
"78","0.101623198","127.0.0.1","127.0.0.1","TCP","66","51798  >  8080 [ACK] Seq=1 Ack=1 Win=65536 Len=0 TSval=2706769022 TSecr=2706769022"
"79","0.101680677","127.0.0.1","127.0.0.1","TCP","415","51780  >  8080 [PSH, ACK] Seq=1 Ack=1 Win=65536 Len=349 TSval=2706769022 TSecr=2706769021"
"80","0.101688849","127.0.0.1","127.0.0.1","TCP","66","8080  >  51780 [ACK] Seq=1 Ack=350 Win=65152 Len=0 TSval=2706769022 TSecr=2706769022"
"81","0.101771051","127.0.0.1","127.0.0.1","TCP","415","51794  >  8080 [PSH, ACK] Seq=1 Ack=1 Win=65536 Len=349 TSval=2706769022 TSecr=2706769021"
"82","0.101779642","127.0.0.1","127.0.0.1","TCP","66","8080  >  51794 [ACK] Seq=1 Ack=350 Win=65152 Len=0 TSval=2706769022 TSecr=2706769022"
"83","0.101858422","127.0.0.1","127.0.0.1","TCP","415","51798  >  8080 [PSH, ACK] Seq=1 Ack=1 Win=65536 Len=349 TSval=2706769022 TSecr=2706769022"
"84","0.101866454","127.0.0.1","127.0.0.1","TCP","66","8080  >  51798 [ACK] Seq=1 Ack=350 Win=65152 Len=0 TSval=2706769022 TSecr=2706769022"
"85","0.102682616","127.0.0.1","127.0.0.1","TCP","1411","8080  >  51768 [PSH, ACK] Seq=1 Ack=350 Win=65536 Len=1345 TSval=2706769023 TSecr=2706769021"
"86","0.102698610","127.0.0.1","127.0.0.1","TCP","66","51768  >  8080 [ACK] Seq=350 Ack=1346 Win=77056 Len=0 TSval=2706769023 TSecr=2706769023"
"87","0.103230728","127.0.0.1","127.0.0.1","TCP","361","51768  >  8080 [PSH, ACK] Seq=350 Ack=1346 Win=77056 Len=295 TSval=2706769023 TSecr=2706769023"
"88","0.103856783","127.0.0.1","127.0.0.1","TCP","1411","8080  >  51776 [PSH, ACK] Seq=1 Ack=350 Win=65536 Len=1345 TSval=2706769024 TSecr=2706769021"
"89","0.103868866","127.0.0.1","127.0.0.1","TCP","66","51776  >  8080 [ACK] Seq=350 Ack=1346 Win=77056 Len=0 TSval=2706769024 TSecr=2706769024"
"90","0.104384781","127.0.0.1","127.0.0.1","TCP","361","51776  >  8080 [PSH, ACK] Seq=350 Ack=1346 Win=77056 Len=295 TSval=2706769024 TSecr=2706769024"
"91","0.104883236","127.0.0.1","127.0.0.1","TCP","831","8080  >  51768 [PSH, ACK] Seq=1346 Ack=645 Win=65536 Len=765 TSval=2706769025 TSecr=2706769023"
"92","0.105525634","127.0.0.1","127.0.0.1","TCP","119","51768  >  8080 [PSH, ACK] Seq=645 Ack=2111 Win=77440 Len=53 TSval=2706769025 TSecr=2706769025"
"93","0.105788096","127.0.0.1","127.0.0.1","TCP","1411","8080  >  51780 [PSH, ACK] Seq=1 Ack=350 Win=65536 Len=1345 TSval=2706769026 TSecr=2706769022"
"94","0.105801855","127.0.0.1","127.0.0.1","TCP","66","51780  >  8080 [ACK] Seq=350 Ack=1346 Win=77056 Len=0 TSval=2706769026 TSecr=2706769026"
"95","0.107050123","127.0.0.1","127.0.0.1","TCP","361","51780  >  8080 [PSH, ACK] Seq=350 Ack=1346 Win=77056 Len=295 TSval=2706769027 TSecr=2706769026"
"96","0.107106415","127.0.0.1","127.0.0.1","TCP","831","8080  >  51776 [PSH, ACK] Seq=1346 Ack=645 Win=65536 Len=765 TSval=2706769027 TSecr=2706769024"
"97","0.107829898","127.0.0.1","127.0.0.1","TCP","119","51776  >  8080 [PSH, ACK] Seq=645 Ack=2111 Win=77440 Len=53 TSval=2706769028 TSecr=2706769027"
"98","0.107994513","127.0.0.1","127.0.0.1","TCP","1411","8080  >  51794 [PSH, ACK] Seq=1 Ack=350 Win=65536 Len=1345 TSval=2706769028 TSecr=2706769022"
"99","0.108009110","127.0.0.1","127.0.0.1","TCP","66","51794  >  8080 [ACK] Seq=350 Ack=1346 Win=77056 Len=0 TSval=2706769028 TSecr=2706769028"
"101","0.108839659","127.0.0.1","127.0.0.1","TCP","361","51794  >  8080 [PSH, ACK] Seq=350 Ack=1346 Win=77056 Len=295 TSval=2706769029 TSecr=2706769028"
"103","0.108953221","127.0.0.1","127.0.0.1","TCP","1904","51768  >  8080 [PSH, ACK] Seq=698 Ack=2111 Win=77440 Len=1838 TSval=2706769029 TSecr=2706769025"
"104","0.108963627","127.0.0.1","127.0.0.1","TCP","66","8080  >  51768 [ACK] Seq=2111 Ack=2536 Win=86272 Len=0 TSval=2706769029 TSecr=2706769025"
"105","0.109111550","127.0.0.1","127.0.0.1","TCP","831","8080  >  51780 [PSH, ACK] Seq=1346 Ack=645 Win=65536 Len=765 TSval=2706769029 TSecr=2706769027"
"106","0.109781046","127.0.0.1","127.0.0.1","TCP","119","51780  >  8080 [PSH, ACK] Seq=645 Ack=2111 Win=77440 Len=53 TSval=2706769030 TSecr=2706769029"
"107","0.110123477","127.0.0.1","127.0.0.1","TCP","1411","8080  >  51798 [PSH, ACK] Seq=1 Ack=350 Win=65536 Len=1345 TSval=2706769030 TSecr=2706769022"
"108","0.110143451","127.0.0.1","127.0.0.1","TCP","66","51798  >  8080 [ACK] Seq=350 Ack=1346 Win=77056 Len=0 TSval=2706769030 TSecr=2706769030"
"111","0.110882369","127.0.0.1","127.0.0.1","TCP","1904","51776  >  8080 [PSH, ACK] Seq=698 Ack=2111 Win=77440 Len=1838 TSval=2706769031 TSecr=2706769027"
"112","0.110892845","127.0.0.1","127.0.0.1","TCP","66","8080  >  51776 [ACK] Seq=2111 Ack=2536 Win=86272 Len=0 TSval=2706769031 TSecr=2706769028"
"113","0.111142806","127.0.0.1","127.0.0.1","TCP","361","51798  >  8080 [PSH, ACK] Seq=350 Ack=1346 Win=77056 Len=295 TSval=2706769031 TSecr=2706769030"
"114","0.111160615","127.0.0.1","127.0.0.1","TCP","831","8080  >  51794 [PSH, ACK] Seq=1346 Ack=645 Win=65536 Len=765 TSval=2706769031 TSecr=2706769029"
"115","0.112287710","127.0.0.1","127.0.0.1","TCP","119","51794  >  8080 [PSH, ACK] Seq=645 Ack=2111 Win=77440 Len=53 TSval=2706769032 TSecr=2706769031"
"117","0.113251027","127.0.0.1","127.0.0.1","TCP","1901","51780  >  8080 [PSH, ACK] Seq=698 Ack=2111 Win=77440 Len=1835 TSval=2706769033 TSecr=2706769029"
"118","0.113261992","127.0.0.1","127.0.0.1","TCP","66","8080  >  51780 [ACK] Seq=2111 Ack=2533 Win=86272 Len=0 TSval=2706769033 TSecr=2706769030"
"120","0.115439844","127.0.0.1","127.0.0.1","TCP","1903","51794  >  8080 [PSH, ACK] Seq=698 Ack=2111 Win=77440 Len=1837 TSval=2706769035 TSecr=2706769031"
"121","0.115452345","127.0.0.1","127.0.0.1","TCP","66","8080  >  51794 [ACK] Seq=2111 Ack=2535 Win=85632 Len=0 TSval=2706769035 TSecr=2706769032"
"123","0.130178949","127.0.0.1","127.0.0.1","TCP","831","8080  >  51798 [PSH, ACK] Seq=1346 Ack=645 Win=65536 Len=765 TSval=2706769050 TSecr=2706769031"
"124","0.131340335","127.0.0.1","127.0.0.1","TCP","119","51798  >  8080 [PSH, ACK] Seq=645 Ack=2111 Win=77440 Len=53 TSval=2706769051 TSecr=2706769050"
"126","0.135478275","127.0.0.1","127.0.0.1","TCP","1902","51798  >  8080 [PSH, ACK] Seq=698 Ack=2111 Win=77440 Len=1836 TSval=2706769055 TSecr=2706769050"
"127","0.135491125","127.0.0.1","127.0.0.1","TCP","66","8080  >  51798 [ACK] Seq=2111 Ack=2534 Win=86272 Len=0 TSval=2706769055 TSecr=2706769051"
"134","0.137749364","127.0.0.1","127.0.0.1","TCP","114","51798  >  8080 [PSH, ACK] Seq=2534 Ack=2111 Win=77440 Len=48 TSval=2706769058 TSecr=2706769055"
"135","0.138333096","127.0.0.1","127.0.0.1","TCP","114","51768  >  8080 [PSH, ACK] Seq=2536 Ack=2111 Win=77440 Len=48 TSval=2706769058 TSecr=2706769029"
"136","0.138672243","127.0.0.1","127.0.0.1","TCP","114","51794  >  8080 [PSH, ACK] Seq=2535 Ack=2111 Win=77440 Len=48 TSval=2706769059 TSecr=2706769035"
"137","0.138672243","127.0.0.1","127.0.0.1","TCP","114","51776  >  8080 [PSH, ACK] Seq=2536 Ack=2111 Win=77440 Len=48 TSval=2706769059 TSecr=2706769031"
"138","0.138738523","127.0.0.1","127.0.0.1","TCP","114","51780  >  8080 [PSH, ACK] Seq=2533 Ack=2111 Win=77440 Len=48 TSval=2706769059 TSecr=2706769033"
"139","0.141818581","127.0.0.1","127.0.0.1","TCP","504","8080  >  51798 [PSH, ACK] Seq=2111 Ack=2582 Win=86272 Len=438 TSval=2706769062 TSecr=2706769058"
"140","0.142549397","127.0.0.1","127.0.0.1","TCP","504","8080  >  51768 [PSH, ACK] Seq=2111 Ack=2584 Win=86272 Len=438 TSval=2706769062 TSecr=2706769058"
"141","0.142997357","127.0.0.1","127.0.0.1","TCP","504","8080  >  51794 [PSH, ACK] Seq=2111 Ack=2583 Win=85632 Len=438 TSval=2706769063 TSecr=2706769059"
"142","0.143707989","127.0.0.1","127.0.0.1","TCP","504","8080  >  51776 [PSH, ACK] Seq=2111 Ack=2584 Win=86272 Len=438 TSval=2706769064 TSecr=2706769059"
"143","0.144576043","127.0.0.1","127.0.0.1","TCP","504","8080  >  51780 [PSH, ACK] Seq=2111 Ack=2581 Win=86272 Len=438 TSval=2706769064 TSecr=2706769059"
"144","0.147159392","127.0.0.1","127.0.0.1","TCP","551","51798  >  8080 [PSH, ACK] Seq=2582 Ack=2549 Win=77568 Len=485 TSval=2706769067 TSecr=2706769062"
"145","0.148043579","127.0.0.1","127.0.0.1","TCP","615","51768  >  8080 [PSH, ACK] Seq=2584 Ack=2549 Win=77568 Len=549 TSval=2706769068 TSecr=2706769062"
"146","0.148308835","127.0.0.1","127.0.0.1","TCP","558","8080  >  51780 [PSH, ACK] Seq=2549 Ack=2581 Win=86272 Len=492 TSval=2706769068 TSecr=2706769059"
"147","0.148640440","127.0.0.1","127.0.0.1","TCP","649","51794  >  8080 [PSH, ACK] Seq=2583 Ack=2549 Win=77568 Len=583 TSval=2706769068 TSecr=2706769063"
"148","0.149076667","127.0.0.1","127.0.0.1","TCP","622","8080  >  51780 [PSH, ACK] Seq=3041 Ack=2581 Win=86272 Len=556 TSval=2706769069 TSecr=2706769059"
"149","0.149300438","127.0.0.1","127.0.0.1","TCP","615","51776  >  8080 [PSH, ACK] Seq=2584 Ack=2549 Win=77568 Len=549 TSval=2706769069 TSecr=2706769064"
"150","0.149526094","127.0.0.1","127.0.0.1","TCP","656","8080  >  51776 [PSH, ACK] Seq=2549 Ack=3133 Win=87168 Len=590 TSval=2706769069 TSecr=2706769069"
"151","0.150636007","127.0.0.1","127.0.0.1","TCP","622","8080  >  51798 [PSH, ACK] Seq=2549 Ack=3067 Win=87168 Len=556 TSval=2706769071 TSecr=2706769067"
"152","0.150900984","127.0.0.1","127.0.0.1","TCP","583","51780  >  8080 [PSH, ACK] Seq=2581 Ack=3597 Win=76672 Len=517 TSval=2706769071 TSecr=2706769064"
"153","0.151626213","127.0.0.1","127.0.0.1","TCP","590","8080  >  51794 [PSH, ACK] Seq=2549 Ack=3166 Win=87168 Len=524 TSval=2706769071 TSecr=2706769068"
"158","0.189141587","127.0.0.1","127.0.0.1","TCP","66","8080  >  51768 [ACK] Seq=2549 Ack=3133 Win=87168 Len=0 TSval=2706769109 TSecr=2706769068"
"159","0.192995064","127.0.0.1","127.0.0.1","TCP","66","8080  >  51780 [ACK] Seq=3597 Ack=3098 Win=87168 Len=0 TSval=2706769113 TSecr=2706769071"
"160","0.193001140","127.0.0.1","127.0.0.1","TCP","66","51794  >  8080 [ACK] Seq=3166 Ack=3073 Win=77568 Len=0 TSval=2706769113 TSecr=2706769071"
"161","0.193018531","127.0.0.1","127.0.0.1","TCP","66","51798  >  8080 [ACK] Seq=3067 Ack=3105 Win=77568 Len=0 TSval=2706769113 TSecr=2706769071"
"162","0.193029845","127.0.0.1","127.0.0.1","TCP","66","51776  >  8080 [ACK] Seq=3133 Ack=3139 Win=77568 Len=0 TSval=2706769113 TSecr=2706769069"
"163","1.141769648","127.0.0.1","127.0.0.1","TCP","114","51794  >  8080 [PSH, ACK] Seq=3166 Ack=3073 Win=77568 Len=48 TSval=2706770062 TSecr=2706769071"
"164","1.141821190","127.0.0.1","127.0.0.1","TCP","114","51768  >  8080 [PSH, ACK] Seq=3133 Ack=2549 Win=77568 Len=48 TSval=2706770062 TSecr=2706769109"
"165","1.141853387","127.0.0.1","127.0.0.1","TCP","66","8080  >  51768 [ACK] Seq=2549 Ack=3181 Win=87168 Len=0 TSval=2706770062 TSecr=2706770062"
"166","1.142599917","127.0.0.1","127.0.0.1","TCP","615","51798  >  8080 [PSH, ACK] Seq=3067 Ack=3105 Win=77568 Len=549 TSval=2706770062 TSecr=2706769071"
"167","1.142608578","127.0.0.1","127.0.0.1","TCP","114","51780  >  8080 [PSH, ACK] Seq=3098 Ack=3597 Win=77568 Len=48 TSval=2706770062 TSecr=2706769113"
"168","1.142641263","127.0.0.1","127.0.0.1","TCP","66","8080  >  51780 [ACK] Seq=3597 Ack=3146 Win=87168 Len=0 TSval=2706770063 TSecr=2706770062"
"169","1.143168353","127.0.0.1","127.0.0.1","TCP","504","8080  >  51794 [PSH, ACK] Seq=3073 Ack=3214 Win=87168 Len=438 TSval=2706770063 TSecr=2706770062"
"170","1.143194963","127.0.0.1","127.0.0.1","TCP","66","51794  >  8080 [ACK] Seq=3214 Ack=3511 Win=77568 Len=0 TSval=2706770063 TSecr=2706770063"
"171","1.143283661","127.0.0.1","127.0.0.1","TCP","583","51776  >  8080 [PSH, ACK] Seq=3133 Ack=3139 Win=77568 Len=517 TSval=2706770063 TSecr=2706769069"
"172","1.144574183","127.0.0.1","127.0.0.1","TCP","504","8080  >  51768 [PSH, ACK] Seq=2549 Ack=3181 Win=87168 Len=438 TSval=2706770064 TSecr=2706770062"
"173","1.145588204","127.0.0.1","127.0.0.1","TCP","622","8080  >  51780 [PSH, ACK] Seq=3597 Ack=3146 Win=87168 Len=556 TSval=2706770065 TSecr=2706770062"
"174","1.146793870","127.0.0.1","127.0.0.1","TCP","590","8080  >  51798 [PSH, ACK] Seq=3105 Ack=3616 Win=87168 Len=524 TSval=2706770067 TSecr=2706770062"
"175","1.146814892","127.0.0.1","127.0.0.1","TCP","66","51798  >  8080 [ACK] Seq=3616 Ack=3629 Win=77568 Len=0 TSval=2706770067 TSecr=2706770067"
"176","1.147129106","127.0.0.1","127.0.0.1","TCP","649","51794  >  8080 [PSH, ACK] Seq=3214 Ack=3511 Win=77568 Len=583 TSval=2706770067 TSecr=2706770063"
"177","1.147166611","127.0.0.1","127.0.0.1","TCP","504","8080  >  51780 [PSH, ACK] Seq=4153 Ack=3146 Win=87168 Len=438 TSval=2706770067 TSecr=2706770062"
"178","1.147181767","127.0.0.1","127.0.0.1","TCP","66","51780  >  8080 [ACK] Seq=3146 Ack=4591 Win=77568 Len=0 TSval=2706770067 TSecr=2706770065"
"179","1.148157655","127.0.0.1","127.0.0.1","TCP","656","8080  >  51798 [PSH, ACK] Seq=3629 Ack=3616 Win=87168 Len=590 TSval=2706770068 TSecr=2706770067"
"180","1.148174068","127.0.0.1","127.0.0.1","TCP","66","51798  >  8080 [ACK] Seq=3616 Ack=4219 Win=77568 Len=0 TSval=2706770068 TSecr=2706770068"
"181","1.149089124","127.0.0.1","127.0.0.1","TCP","615","51768  >  8080 [PSH, ACK] Seq=3181 Ack=2987 Win=77568 Len=549 TSval=2706770069 TSecr=2706770064"
"182","1.149704005","127.0.0.1","127.0.0.1","TCP","622","8080  >  51776 [PSH, ACK] Seq=3139 Ack=3650 Win=87168 Len=556 TSval=2706770070 TSecr=2706770063"
"183","1.149721744","127.0.0.1","127.0.0.1","TCP","66","51776  >  8080 [ACK] Seq=3650 Ack=3695 Win=77568 Len=0 TSval=2706770070 TSecr=2706770070"
"184","1.151342055","127.0.0.1","127.0.0.1","TCP","551","51780  >  8080 [PSH, ACK] Seq=3146 Ack=4591 Win=77568 Len=485 TSval=2706770071 TSecr=2706770065"
"185","1.152166040","127.0.0.1","127.0.0.1","TCP","558","8080  >  51768 [PSH, ACK] Seq=2987 Ack=3730 Win=87168 Len=492 TSval=2706770072 TSecr=2706770069"
"186","1.188692954","127.0.0.1","127.0.0.1","TCP","66","8080  >  51794 [ACK] Seq=3511 Ack=3797 Win=87168 Len=0 TSval=2706770109 TSecr=2706770067"
"187","1.192929230","127.0.0.1","127.0.0.1","TCP","66","8080  >  51780 [ACK] Seq=4591 Ack=3631 Win=87168 Len=0 TSval=2706770113 TSecr=2706770071"
"188","1.192929230","127.0.0.1","127.0.0.1","TCP","66","51768  >  8080 [ACK] Seq=3730 Ack=3479 Win=77568 Len=0 TSval=2706770113 TSecr=2706770072"
"189","2.145634463","127.0.0.1","127.0.0.1","TCP","713","51768  >  8080 [PSH, ACK] Seq=3730 Ack=3479 Win=77568 Len=647 TSval=2706771065 TSecr=2706770072"
"190","2.146011744","127.0.0.1","127.0.0.1","TCP","114","51776  >  8080 [PSH, ACK] Seq=3650 Ack=3695 Win=77568 Len=48 TSval=2706771066 TSecr=2706770070"
"191","2.146103655","127.0.0.1","127.0.0.1","TCP","114","51798  >  8080 [PSH, ACK] Seq=3616 Ack=4219 Win=77568 Len=48 TSval=2706771066 TSecr=2706770068"
"192","2.146773011","127.0.0.1","127.0.0.1","TCP","615","51780  >  8080 [PSH, ACK] Seq=3631 Ack=4591 Win=77568 Len=549 TSval=2706771067 TSecr=2706770113"
"193","2.146804998","127.0.0.1","127.0.0.1","TCP","66","8080  >  51780 [ACK] Seq=4591 Ack=4180 Win=87168 Len=0 TSval=2706771067 TSecr=2706771067"
"194","2.146949010","127.0.0.1","127.0.0.1","TCP","720","8080  >  51776 [PSH, ACK] Seq=3695 Ack=3698 Win=87168 Len=654 TSval=2706771067 TSecr=2706771066"
"195","2.146974852","127.0.0.1","127.0.0.1","TCP","66","51776  >  8080 [ACK] Seq=3698 Ack=4349 Win=77440 Len=0 TSval=2706771067 TSecr=2706771067"
"196","2.147793737","127.0.0.1","127.0.0.1","TCP","615","51794  >  8080 [PSH, ACK] Seq=3797 Ack=3511 Win=77568 Len=549 TSval=2706771068 TSecr=2706770109"
"197","2.147827121","127.0.0.1","127.0.0.1","TCP","66","8080  >  51794 [ACK] Seq=3511 Ack=4346 Win=87168 Len=0 TSval=2706771068 TSecr=2706771068"
"198","2.148400027","127.0.0.1","127.0.0.1","TCP","504","8080  >  51776 [PSH, ACK] Seq=4349 Ack=3698 Win=87168 Len=438 TSval=2706771068 TSecr=2706771067"
"199","2.148429570","127.0.0.1","127.0.0.1","TCP","66","51776  >  8080 [ACK] Seq=3698 Ack=4787 Win=77568 Len=0 TSval=2706771068 TSecr=2706771068"
"200","2.149455534","127.0.0.1","127.0.0.1","TCP","504","8080  >  51798 [PSH, ACK] Seq=4219 Ack=3664 Win=87168 Len=438 TSval=2706771069 TSecr=2706771066"
"201","2.149486055","127.0.0.1","127.0.0.1","TCP","66","51798  >  8080 [ACK] Seq=3664 Ack=4657 Win=77568 Len=0 TSval=2706771069 TSecr=2706771069"
"202","2.150233423","127.0.0.1","127.0.0.1","TCP","622","8080  >  51794 [PSH, ACK] Seq=3511 Ack=4346 Win=87168 Len=556 TSval=2706771070 TSecr=2706771068"
"203","2.151355698","127.0.0.1","127.0.0.1","TCP","622","8080  >  51798 [PSH, ACK] Seq=4657 Ack=3664 Win=87168 Len=556 TSval=2706771071 TSecr=2706771069"
"204","2.151386917","127.0.0.1","127.0.0.1","TCP","66","51798  >  8080 [ACK] Seq=3664 Ack=5213 Win=77568 Len=0 TSval=2706771071 TSecr=2706771071"
"205","2.154175389","127.0.0.1","127.0.0.1","TCP","615","51776  >  8080 [PSH, ACK] Seq=3698 Ack=4787 Win=77568 Len=549 TSval=2706771074 TSecr=2706771068"
"206","2.154304315","127.0.0.1","127.0.0.1","TCP","713","51798  >  8080 [PSH, ACK] Seq=3664 Ack=5213 Win=77568 Len=647 TSval=2706771074 TSecr=2706771071"
"207","2.155275245","127.0.0.1","127.0.0.1","TCP","622","8080  >  51768 [PSH, ACK] Seq=3479 Ack=4377 Win=87168 Len=556 TSval=2706771075 TSecr=2706771065"
"208","2.155304788","127.0.0.1","127.0.0.1","TCP","66","51768  >  8080 [ACK] Seq=4377 Ack=4035 Win=77568 Len=0 TSval=2706771075 TSecr=2706771075"
"209","2.156694414","127.0.0.1","127.0.0.1","TCP","720","8080  >  51768 [PSH, ACK] Seq=4035 Ack=4377 Win=87168 Len=654 TSval=2706771077 TSecr=2706771075"
"210","2.156722071","127.0.0.1","127.0.0.1","TCP","66","51768  >  8080 [ACK] Seq=4377 Ack=4689 Win=77440 Len=0 TSval=2706771077 TSecr=2706771077"
"211","2.192886930","127.0.0.1","127.0.0.1","TCP","66","51794  >  8080 [ACK] Seq=4346 Ack=4067 Win=77568 Len=0 TSval=2706771113 TSecr=2706771070"
"212","2.197044355","127.0.0.1","127.0.0.1","TCP","66","8080  >  51798 [ACK] Seq=5213 Ack=4311 Win=87168 Len=0 TSval=2706771117 TSecr=2706771074"
"213","2.197082767","127.0.0.1","127.0.0.1","TCP","66","8080  >  51776 [ACK] Seq=4787 Ack=4247 Win=87168 Len=0 TSval=2706771117 TSecr=2706771074"
"214","3.148664746","127.0.0.1","127.0.0.1","TCP","114","51768  >  8080 [PSH, ACK] Seq=4377 Ack=4689 Win=77568 Len=48 TSval=2706772068 TSecr=2706771077"
"215","3.148841095","127.0.0.1","127.0.0.1","TCP","114","51798  >  8080 [PSH, ACK] Seq=4311 Ack=5213 Win=77568 Len=48 TSval=2706772069 TSecr=2706771117"
"216","3.148867285","127.0.0.1","127.0.0.1","TCP","66","8080  >  51798 [ACK] Seq=5213 Ack=4359 Win=87168 Len=0 TSval=2706772069 TSecr=2706772069"
"217","3.149929497","127.0.0.1","127.0.0.1","TCP","114","51780  >  8080 [PSH, ACK] Seq=4180 Ack=4591 Win=77568 Len=48 TSval=2706772070 TSecr=2706771067"
"218","3.149964418","127.0.0.1","127.0.0.1","TCP","66","8080  >  51780 [ACK] Seq=4591 Ack=4228 Win=87168 Len=0 TSval=2706772070 TSecr=2706772070"
"219","3.150011490","127.0.0.1","127.0.0.1","TCP","504","8080  >  51768 [PSH, ACK] Seq=4689 Ack=4425 Win=87168 Len=438 TSval=2706772070 TSecr=2706772068"
"220","3.150043408","127.0.0.1","127.0.0.1","TCP","66","51768  >  8080 [ACK] Seq=4425 Ack=5127 Win=77568 Len=0 TSval=2706772070 TSecr=2706772070"
"221","3.151037036","127.0.0.1","127.0.0.1","TCP","114","51794  >  8080 [PSH, ACK] Seq=4346 Ack=4067 Win=77568 Len=48 TSval=2706772071 TSecr=2706771070"
"222","3.151157931","127.0.0.1","127.0.0.1","TCP","551","51776  >  8080 [PSH, ACK] Seq=4247 Ack=4787 Win=77568 Len=485 TSval=2706772071 TSecr=2706771117"
"223","3.151181676","127.0.0.1","127.0.0.1","TCP","66","8080  >  51776 [ACK] Seq=4787 Ack=4732 Win=87168 Len=0 TSval=2706772071 TSecr=2706772071"
"224","3.151594716","127.0.0.1","127.0.0.1","TCP","504","8080  >  51798 [PSH, ACK] Seq=5213 Ack=4359 Win=87168 Len=438 TSval=2706772071 TSecr=2706772069"
"225","3.152491405","127.0.0.1","127.0.0.1","TCP","504","8080  >  51780 [PSH, ACK] Seq=4591 Ack=4228 Win=87168 Len=438 TSval=2706772072 TSecr=2706772070"
"226","3.153453953","127.0.0.1","127.0.0.1","TCP","504","8080  >  51794 [PSH, ACK] Seq=4067 Ack=4394 Win=87168 Len=438 TSval=2706772073 TSecr=2706772071"
"227","3.153484474","127.0.0.1","127.0.0.1","TCP","66","51794  >  8080 [ACK] Seq=4394 Ack=4505 Win=77568 Len=0 TSval=2706772073 TSecr=2706772073"
"228","3.154666393","127.0.0.1","127.0.0.1","TCP","558","8080  >  51768 [PSH, ACK] Seq=5127 Ack=4425 Win=87168 Len=492 TSval=2706772075 TSecr=2706772070"
"229","3.154698311","127.0.0.1","127.0.0.1","TCP","66","51768  >  8080 [ACK] Seq=4425 Ack=5619 Win=77568 Len=0 TSval=2706772075 TSecr=2706772075"
"230","3.155963830","127.0.0.1","127.0.0.1","TCP","681","51768  >  8080 [PSH, ACK] Seq=4425 Ack=5619 Win=77568 Len=615 TSval=2706772076 TSecr=2706772075"
"231","3.157225158","127.0.0.1","127.0.0.1","TCP","688","8080  >  51798 [PSH, ACK] Seq=5651 Ack=4359 Win=87168 Len=622 TSval=2706772077 TSecr=2706772069"
"232","3.157269088","127.0.0.1","127.0.0.1","TCP","649","51780  >  8080 [PSH, ACK] Seq=4228 Ack=5029 Win=77568 Len=583 TSval=2706772077 TSecr=2706772072"
"233","3.158257548","127.0.0.1","127.0.0.1","TCP","615","51798  >  8080 [PSH, ACK] Seq=4359 Ack=6273 Win=77440 Len=549 TSval=2706772078 TSecr=2706772071"
"234","3.158848403","127.0.0.1","127.0.0.1","TCP","656","8080  >  51776 [PSH, ACK] Seq=4787 Ack=4732 Win=87168 Len=590 TSval=2706772079 TSecr=2706772071"
"235","3.160088430","127.0.0.1","127.0.0.1","TCP","622","8080  >  51794 [PSH, ACK] Seq=4505 Ack=4394 Win=87168 Len=556 TSval=2706772080 TSecr=2706772073"
"236","3.160124398","127.0.0.1","127.0.0.1","TCP","649","51794  >  8080 [PSH, ACK] Seq=4394 Ack=4505 Win=77568 Len=583 TSval=2706772080 TSecr=2706772073"
"237","3.161297727","127.0.0.1","127.0.0.1","TCP","656","8080  >  51768 [PSH, ACK] Seq=5619 Ack=5040 Win=87168 Len=590 TSval=2706772081 TSecr=2706772076"
"238","3.200983200","127.0.0.1","127.0.0.1","TCP","66","8080  >  51798 [ACK] Seq=6273 Ack=4908 Win=87168 Len=0 TSval=2706772121 TSecr=2706772078"
"239","3.200993676","127.0.0.1","127.0.0.1","TCP","66","8080  >  51780 [ACK] Seq=5029 Ack=4811 Win=87168 Len=0 TSval=2706772121 TSecr=2706772077"
"240","3.201017911","127.0.0.1","127.0.0.1","TCP","66","51794  >  8080 [ACK] Seq=4977 Ack=5061 Win=77568 Len=0 TSval=2706772121 TSecr=2706772080"
"241","3.201017911","127.0.0.1","127.0.0.1","TCP","66","51776  >  8080 [ACK] Seq=4732 Ack=5377 Win=77568 Len=0 TSval=2706772121 TSecr=2706772079"
"242","3.201034044","127.0.0.1","127.0.0.1","TCP","66","8080  >  51794 [ACK] Seq=5061 Ack=4977 Win=87168 Len=0 TSval=2706772121 TSecr=2706772080"
"243","3.204750284","127.0.0.1","127.0.0.1","TCP","66","51768  >  8080 [ACK] Seq=5040 Ack=6209 Win=77568 Len=0 TSval=2706772125 TSecr=2706772081"
"244","4.153529123","127.0.0.1","127.0.0.1","TCP","421","51768  >  8080 [PSH, ACK] Seq=5040 Ack=6209 Win=77568 Len=355 TSval=2706773073 TSecr=2706772081"
"245","4.153529123","127.0.0.1","127.0.0.1","TCP","615","51798  >  8080 [PSH, ACK] Seq=4908 Ack=6273 Win=77568 Len=549 TSval=2706773073 TSecr=2706772121"
"246","4.153564602","127.0.0.1","127.0.0.1","TCP","66","8080  >  51798 [ACK] Seq=6273 Ack=5457 Win=87168 Len=0 TSval=2706773073 TSecr=2706773073"
"247","4.153567465","127.0.0.1","127.0.0.1","TCP","114","51794  >  8080 [PSH, ACK] Seq=4977 Ack=5061 Win=77568 Len=48 TSval=2706773073 TSecr=2706772121"
"248","4.153594633","127.0.0.1","127.0.0.1","TCP","66","8080  >  51794 [ACK] Seq=5061 Ack=5025 Win=87168 Len=0 TSval=2706773073 TSecr=2706773073"
"249","4.154506128","127.0.0.1","127.0.0.1","TCP","428","8080  >  51776 [PSH, ACK] Seq=5377 Ack=4732 Win=87168 Len=362 TSval=2706773074 TSecr=2706772121"
"250","4.154533227","127.0.0.1","127.0.0.1","TCP","66","51776  >  8080 [ACK] Seq=4732 Ack=5739 Win=77696 Len=0 TSval=2706773074 TSecr=2706773074"
"251","4.154978323","127.0.0.1","127.0.0.1","TCP","583","51780  >  8080 [PSH, ACK] Seq=4811 Ack=5029 Win=77568 Len=517 TSval=2706773075 TSecr=2706772121"
"252","4.155007936","127.0.0.1","127.0.0.1","TCP","66","8080  >  51780 [ACK] Seq=5029 Ack=5328 Win=87168 Len=0 TSval=2706773075 TSecr=2706773075"
"253","4.155142240","127.0.0.1","127.0.0.1","TCP","713","51776  >  8080 [PSH, ACK] Seq=4732 Ack=5739 Win=77696 Len=647 TSval=2706773075 TSecr=2706773074"
"254","4.155222907","127.0.0.1","127.0.0.1","TCP","622","8080  >  51794 [PSH, ACK] Seq=5061 Ack=5025 Win=87168 Len=556 TSval=2706773075 TSecr=2706773073"
"255","4.155250075","127.0.0.1","127.0.0.1","TCP","66","51794  >  8080 [ACK] Seq=5025 Ack=5617 Win=77568 Len=0 TSval=2706773075 TSecr=2706773075"
"256","4.156648641","127.0.0.1","127.0.0.1","TCP","504","8080  >  51794 [PSH, ACK] Seq=5617 Ack=5025 Win=87168 Len=438 TSval=2706773076 TSecr=2706773075"
"257","4.156679650","127.0.0.1","127.0.0.1","TCP","66","51794  >  8080 [ACK] Seq=5025 Ack=6055 Win=77568 Len=0 TSval=2706773077 TSecr=2706773076"
"258","4.157813519","127.0.0.1","127.0.0.1","TCP","590","8080  >  51776 [PSH, ACK] Seq=5739 Ack=5379 Win=87040 Len=524 TSval=2706773078 TSecr=2706773075"
"259","4.159466027","127.0.0.1","127.0.0.1","TCP","720","8080  >  51768 [PSH, ACK] Seq=6209 Ack=5395 Win=87296 Len=654 TSval=2706773079 TSecr=2706773073"
"260","4.159507862","127.0.0.1","127.0.0.1","TCP","66","51768  >  8080 [ACK] Seq=5395 Ack=6863 Win=77440 Len=0 TSval=2706773079 TSecr=2706773079"
"261","4.163419167","127.0.0.1","127.0.0.1","TCP","583","51794  >  8080 [PSH, ACK] Seq=5025 Ack=6055 Win=77568 Len=517 TSval=2706773083 TSecr=2706773076"
"262","4.164396033","127.0.0.1","127.0.0.1","TCP","590","8080  >  51780 [PSH, ACK] Seq=5029 Ack=5328 Win=87168 Len=524 TSval=2706773084 TSecr=2706773075"
"263","4.200949836","127.0.0.1","127.0.0.1","TCP","66","51776  >  8080 [ACK] Seq=5379 Ack=6263 Win=77696 Len=0 TSval=2706773121 TSecr=2706773078"
"264","4.204948583","127.0.0.1","127.0.0.1","TCP","66","51780  >  8080 [ACK] Seq=5328 Ack=5553 Win=77568 Len=0 TSval=2706773125 TSecr=2706773084"
"265","4.204948583","127.0.0.1","127.0.0.1","TCP","66","8080  >  51794 [ACK] Seq=6055 Ack=5542 Win=87168 Len=0 TSval=2706773125 TSecr=2706773083"
"266","5.155865951","127.0.0.1","127.0.0.1","TCP","551","51798  >  8080 [PSH, ACK] Seq=5457 Ack=6273 Win=77568 Len=485 TSval=2706774076 TSecr=2706773073"
"267","5.155885996","127.0.0.1","127.0.0.1","TCP","66","8080  >  51798 [ACK] Seq=6273 Ack=5942 Win=87168 Len=0 TSval=2706774076 TSecr=2706774076"
"268","5.156218788","127.0.0.1","127.0.0.1","TCP","583","51768  >  8080 [PSH, ACK] Seq=5395 Ack=6863 Win=77568 Len=517 TSval=2706774076 TSecr=2706773079"
"269","5.156870055","127.0.0.1","127.0.0.1","TCP","558","8080  >  51794 [PSH, ACK] Seq=6055 Ack=5542 Win=87168 Len=492 TSval=2706774077 TSecr=2706773083"
"270","5.157433602","127.0.0.1","127.0.0.1","TCP","615","51794  >  8080 [PSH, ACK] Seq=5542 Ack=6547 Win=77568 Len=549 TSval=2706774077 TSecr=2706774077"
"271","5.157459793","127.0.0.1","127.0.0.1","TCP","66","8080  >  51794 [ACK] Seq=6547 Ack=6091 Win=87168 Len=0 TSval=2706774077 TSecr=2706774077"
"272","5.157776592","127.0.0.1","127.0.0.1","TCP","590","8080  >  51798 [PSH, ACK] Seq=6273 Ack=5942 Win=87168 Len=524 TSval=2706774078 TSecr=2706774076"
"273","5.158447205","127.0.0.1","127.0.0.1","TCP","551","51780  >  8080 [PSH, ACK] Seq=5328 Ack=5553 Win=77568 Len=485 TSval=2706774078 TSecr=2706773084"
"274","5.158521585","127.0.0.1","127.0.0.1","TCP","649","51776  >  8080 [PSH, ACK] Seq=5379 Ack=6263 Win=77696 Len=583 TSval=2706774078 TSecr=2706773078"
"275","5.158719026","127.0.0.1","127.0.0.1","TCP","622","8080  >  51780 [PSH, ACK] Seq=5553 Ack=5813 Win=87168 Len=556 TSval=2706774079 TSecr=2706774078"
"276","5.158738651","127.0.0.1","127.0.0.1","TCP","66","51780  >  8080 [ACK] Seq=5813 Ack=6109 Win=77568 Len=0 TSval=2706774079 TSecr=2706774079"
"277","5.159597626","127.0.0.1","127.0.0.1","TCP","558","8080  >  51776 [PSH, ACK] Seq=6263 Ack=5962 Win=87168 Len=492 TSval=2706774079 TSecr=2706774078"
"278","5.159627238","127.0.0.1","127.0.0.1","TCP","66","51776  >  8080 [ACK] Seq=5962 Ack=6755 Win=77568 Len=0 TSval=2706774079 TSecr=2706774079"
"279","5.160168995","127.0.0.1","127.0.0.1","TCP","656","8080  >  51798 [PSH, ACK] Seq=6797 Ack=5942 Win=87168 Len=590 TSval=2706774080 TSecr=2706774076"
"280","5.160214531","127.0.0.1","127.0.0.1","TCP","66","51798  >  8080 [ACK] Seq=5942 Ack=7387 Win=77568 Len=0 TSval=2706774080 TSecr=2706774078"
"281","5.196862549","127.0.0.1","127.0.0.1","TCP","66","8080  >  51768 [ACK] Seq=6863 Ack=5912 Win=87296 Len=0 TSval=2706774117 TSecr=2706774076"
"282","6.159012584","127.0.0.1","127.0.0.1","TCP","114","51768  >  8080 [PSH, ACK] Seq=5912 Ack=6863 Win=77568 Len=48 TSval=2706775079 TSecr=2706774117"
"283","6.159051626","127.0.0.1","127.0.0.1","TCP","66","8080  >  51768 [ACK] Seq=6863 Ack=5960 Win=87296 Len=0 TSval=2706775079 TSecr=2706775079"
"284","6.159531852","127.0.0.1","127.0.0.1","TCP","615","51798  >  8080 [PSH, ACK] Seq=5942 Ack=7387 Win=77568 Len=549 TSval=2706775079 TSecr=2706774078"
"285","6.160639321","127.0.0.1","127.0.0.1","TCP","504","8080  >  51768 [PSH, ACK] Seq=6863 Ack=5960 Win=87296 Len=438 TSval=2706775080 TSecr=2706775079"
"286","6.160678502","127.0.0.1","127.0.0.1","TCP","66","51768  >  8080 [ACK] Seq=5960 Ack=7301 Win=77568 Len=0 TSval=2706775081 TSecr=2706775080"
"287","6.160755327","127.0.0.1","127.0.0.1","TCP","551","51794  >  8080 [PSH, ACK] Seq=6091 Ack=6547 Win=77568 Len=485 TSval=2706775081 TSecr=2706774077"
"288","6.160783054","127.0.0.1","127.0.0.1","TCP","66","8080  >  51794 [ACK] Seq=6547 Ack=6576 Win=87168 Len=0 TSval=2706775081 TSecr=2706775081"
"289","6.161557451","127.0.0.1","127.0.0.1","TCP","583","51776  >  8080 [PSH, ACK] Seq=5962 Ack=6755 Win=77696 Len=517 TSval=2706775081 TSecr=2706774079"
"290","6.161729749","127.0.0.1","127.0.0.1","TCP","622","8080  >  51794 [PSH, ACK] Seq=6547 Ack=6576 Win=87168 Len=556 TSval=2706775082 TSecr=2706775081"
"291","6.162806138","127.0.0.1","127.0.0.1","TCP","558","8080  >  51776 [PSH, ACK] Seq=6755 Ack=6479 Win=87168 Len=492 TSval=2706775083 TSecr=2706775081"
"292","6.162843154","127.0.0.1","127.0.0.1","TCP","66","51776  >  8080 [ACK] Seq=6479 Ack=7247 Win=77568 Len=0 TSval=2706775083 TSecr=2706775083"
"293","6.164037365","127.0.0.1","127.0.0.1","TCP","590","8080  >  51798 [PSH, ACK] Seq=7387 Ack=6491 Win=87168 Len=524 TSval=2706775084 TSecr=2706775079"
"294","6.164090654","127.0.0.1","127.0.0.1","TCP","421","51780  >  8080 [PSH, ACK] Seq=5813 Ack=6109 Win=77568 Len=355 TSval=2706775084 TSecr=2706774079"
"295","6.164932098","127.0.0.1","127.0.0.1","TCP","428","8080  >  51794 [PSH, ACK] Seq=7103 Ack=6576 Win=87168 Len=362 TSval=2706775085 TSecr=2706775081"
"296","6.164966670","127.0.0.1","127.0.0.1","TCP","66","51794  >  8080 [ACK] Seq=6576 Ack=7465 Win=77696 Len=0 TSval=2706775085 TSecr=2706775082"
"297","6.164992650","127.0.0.1","127.0.0.1","TCP","649","51768  >  8080 [PSH, ACK] Seq=5960 Ack=7301 Win=77568 Len=583 TSval=2706775085 TSecr=2706775080"
"298","6.166561489","127.0.0.1","127.0.0.1","TCP","656","8080  >  51794 [PSH, ACK] Seq=7465 Ack=6576 Win=87168 Len=590 TSval=2706775086 TSecr=2706775085"
"299","6.204910065","127.0.0.1","127.0.0.1","TCP","66","51798  >  8080 [ACK] Seq=6491 Ack=7911 Win=77568 Len=0 TSval=2706775125 TSecr=2706775084"
"300","6.204910065","127.0.0.1","127.0.0.1","TCP","66","8080  >  51780 [ACK] Seq=6109 Ack=6168 Win=87296 Len=0 TSval=2706775125 TSecr=2706775084"
"301","6.208922431","127.0.0.1","127.0.0.1","TCP","66","51794  >  8080 [ACK] Seq=6576 Ack=8055 Win=77184 Len=0 TSval=2706775129 TSecr=2706775086"
"302","6.212740778","127.0.0.1","127.0.0.1","TCP","66","8080  >  51768 [ACK] Seq=7301 Ack=6543 Win=87296 Len=0 TSval=2706775133 TSecr=2706775085"
"303","7.161732627","127.0.0.1","127.0.0.1","TCP","583","51798  >  8080 [PSH, ACK] Seq=6491 Ack=7911 Win=77568 Len=517 TSval=2706776082 TSecr=2706775084"
"304","7.161904715","127.0.0.1","127.0.0.1","TCP","681","51768  >  8080 [PSH, ACK] Seq=6543 Ack=7301 Win=77568 Len=615 TSval=2706776082 TSecr=2706775133"
"305","7.161925807","127.0.0.1","127.0.0.1","TCP","66","8080  >  51768 [ACK] Seq=7301 Ack=7158 Win=87168 Len=0 TSval=2706776082 TSecr=2706776082"
"306","7.162562687","127.0.0.1","127.0.0.1","TCP","590","8080  >  51794 [PSH, ACK] Seq=8055 Ack=6576 Win=87168 Len=524 TSval=2706776082 TSecr=2706775129"
"307","7.162588459","127.0.0.1","127.0.0.1","TCP","66","51794  >  8080 [ACK] Seq=6576 Ack=8579 Win=76672 Len=0 TSval=2706776082 TSecr=2706776082"
"308","7.163550030","127.0.0.1","127.0.0.1","TCP","688","8080  >  51794 [PSH, ACK] Seq=8579 Ack=6576 Win=87168 Len=622 TSval=2706776083 TSecr=2706776082"
"309","7.163582925","127.0.0.1","127.0.0.1","TCP","66","51794  >  8080 [ACK] Seq=6576 Ack=9201 Win=76160 Len=0 TSval=2706776083 TSecr=2706776083"
"310","7.164020549","127.0.0.1","127.0.0.1","TCP","615","51776  >  8080 [PSH, ACK] Seq=6479 Ack=7247 Win=77696 Len=549 TSval=2706776084 TSecr=2706775083"
"311","7.164500985","127.0.0.1","127.0.0.1","TCP","615","51794  >  8080 [PSH, ACK] Seq=6576 Ack=9201 Win=76160 Len=549 TSval=2706776084 TSecr=2706776083"
"312","7.164838037","127.0.0.1","127.0.0.1","TCP","622","8080  >  51798 [PSH, ACK] Seq=7911 Ack=7008 Win=87168 Len=556 TSval=2706776085 TSecr=2706776082"
"313","7.164862971","127.0.0.1","127.0.0.1","TCP","66","51798  >  8080 [ACK] Seq=7008 Ack=8467 Win=77568 Len=0 TSval=2706776085 TSecr=2706776085"
"314","7.165450543","127.0.0.1","127.0.0.1","TCP","615","51780  >  8080 [PSH, ACK] Seq=6168 Ack=6109 Win=77568 Len=549 TSval=2706776085 TSecr=2706775125"
"315","7.165465838","127.0.0.1","127.0.0.1","TCP","66","8080  >  51780 [ACK] Seq=6109 Ack=6717 Win=87168 Len=0 TSval=2706776085 TSecr=2706776085"
"316","7.166416444","127.0.0.1","127.0.0.1","TCP","622","8080  >  51776 [PSH, ACK] Seq=7247 Ack=7028 Win=87168 Len=556 TSval=2706776086 TSecr=2706776084"
"317","7.166444101","127.0.0.1","127.0.0.1","TCP","66","51776  >  8080 [ACK] Seq=7028 Ack=7803 Win=77568 Len=0 TSval=2706776086 TSecr=2706776086"
"318","7.167418523","127.0.0.1","127.0.0.1","TCP","622","8080  >  51768 [PSH, ACK] Seq=7301 Ack=7158 Win=87296 Len=556 TSval=2706776087 TSecr=2706776082"
"319","7.204673738","127.0.0.1","127.0.0.1","TCP","66","8080  >  51794 [ACK] Seq=9201 Ack=7125 Win=87168 Len=0 TSval=2706776125 TSecr=2706776084"
"320","7.208676815","127.0.0.1","127.0.0.1","TCP","66","51768  >  8080 [ACK] Seq=7158 Ack=7857 Win=77568 Len=0 TSval=2706776129 TSecr=2706776087"
"321","8.164905308","127.0.0.1","127.0.0.1","TCP","421","51768  >  8080 [PSH, ACK] Seq=7158 Ack=7857 Win=77568 Len=355 TSval=2706777085 TSecr=2706776087"
"322","8.165022501","127.0.0.1","127.0.0.1","TCP","421","51798  >  8080 [PSH, ACK] Seq=7008 Ack=8467 Win=77568 Len=355 TSval=2706777085 TSecr=2706776085"
"323","8.166147430","127.0.0.1","127.0.0.1","TCP","583","51776  >  8080 [PSH, ACK] Seq=7028 Ack=7803 Win=77696 Len=517 TSval=2706777086 TSecr=2706776086"
"324","8.166749529","127.0.0.1","127.0.0.1","TCP","428","8080  >  51780 [PSH, ACK] Seq=6109 Ack=6717 Win=87296 Len=362 TSval=2706777087 TSecr=2706776085"
"325","8.166782424","127.0.0.1","127.0.0.1","TCP","66","51780  >  8080 [ACK] Seq=6717 Ack=6471 Win=77696 Len=0 TSval=2706777087 TSecr=2706777087"
"326","8.166792272","127.0.0.1","127.0.0.1","TCP","487","51794  >  8080 [PSH, ACK] Seq=7125 Ack=9201 Win=76160 Len=421 TSval=2706777087 TSecr=2706776125"
"327","8.166816786","127.0.0.1","127.0.0.1","TCP","66","8080  >  51794 [ACK] Seq=9201 Ack=7546 Win=87296 Len=0 TSval=2706777087 TSecr=2706777087"
"328","8.167382498","127.0.0.1","127.0.0.1","TCP","681","51780  >  8080 [PSH, ACK] Seq=6717 Ack=6471 Win=77696 Len=615 TSval=2706777087 TSecr=2706777087"
"329","8.167408479","127.0.0.1","127.0.0.1","TCP","66","8080  >  51780 [ACK] Seq=6471 Ack=7332 Win=87168 Len=0 TSval=2706777087 TSecr=2706777087"
"330","8.167781081","127.0.0.1","127.0.0.1","TCP","428","8080  >  51768 [PSH, ACK] Seq=7857 Ack=7513 Win=87296 Len=362 TSval=2706777088 TSecr=2706777085"
"331","8.167807900","127.0.0.1","127.0.0.1","TCP","66","51768  >  8080 [ACK] Seq=7513 Ack=8219 Win=77696 Len=0 TSval=2706777088 TSecr=2706777088"
"332","8.168497370","127.0.0.1","127.0.0.1","TCP","590","8080  >  51798 [PSH, ACK] Seq=8467 Ack=7363 Win=87296 Len=524 TSval=2706777088 TSecr=2706777085"
"333","8.168530265","127.0.0.1","127.0.0.1","TCP","66","51798  >  8080 [ACK] Seq=7363 Ack=8991 Win=77568 Len=0 TSval=2706777088 TSecr=2706777088"
"334","8.169477519","127.0.0.1","127.0.0.1","TCP","494","8080  >  51780 [PSH, ACK] Seq=6471 Ack=7332 Win=87168 Len=428 TSval=2706777089 TSecr=2706777087"
"335","8.170248144","127.0.0.1","127.0.0.1","TCP","688","8080  >  51776 [PSH, ACK] Seq=7803 Ack=7545 Win=87168 Len=622 TSval=2706777090 TSecr=2706777086"
"336","8.170279643","127.0.0.1","127.0.0.1","TCP","66","51776  >  8080 [ACK] Seq=7545 Ack=8425 Win=77440 Len=0 TSval=2706777090 TSecr=2706777090"
"337","8.212887403","127.0.0.1","127.0.0.1","TCP","66","51780  >  8080 [ACK] Seq=7332 Ack=6899 Win=77696 Len=0 TSval=2706777133 TSecr=2706777089"
"338","9.169039627","127.0.0.1","127.0.0.1","TCP","114","51776  >  8080 [PSH, ACK] Seq=7545 Ack=8425 Win=77696 Len=48 TSval=2706778089 TSecr=2706777090"
"339","9.169130211","127.0.0.1","127.0.0.1","TCP","421","51768  >  8080 [PSH, ACK] Seq=7513 Ack=8219 Win=77696 Len=355 TSval=2706778089 TSecr=2706777088"
"340","9.169156471","127.0.0.1","127.0.0.1","TCP","649","51798  >  8080 [PSH, ACK] Seq=7363 Ack=8991 Win=77568 Len=583 TSval=2706778089 TSecr=2706777088"
"341","9.170581577","127.0.0.1","127.0.0.1","TCP","504","8080  >  51776 [PSH, ACK] Seq=8425 Ack=7593 Win=87168 Len=438 TSval=2706778090 TSecr=2706778089"
"342","9.170581577","127.0.0.1","127.0.0.1","TCP","583","51780  >  8080 [PSH, ACK] Seq=7332 Ack=6899 Win=77696 Len=517 TSval=2706778090 TSecr=2706777089"
"343","9.170618523","127.0.0.1","127.0.0.1","TCP","66","51776  >  8080 [ACK] Seq=7593 Ack=8863 Win=77568 Len=0 TSval=2706778090 TSecr=2706778090"
"344","9.171055937","127.0.0.1","127.0.0.1","TCP","487","51794  >  8080 [PSH, ACK] Seq=7546 Ack=9201 Win=76160 Len=421 TSval=2706778091 TSecr=2706777087"
"345","9.171084991","127.0.0.1","127.0.0.1","TCP","66","8080  >  51794 [ACK] Seq=9201 Ack=7967 Win=87296 Len=0 TSval=2706778091 TSecr=2706778091"
"346","9.171834385","127.0.0.1","127.0.0.1","TCP","428","8080  >  51780 [PSH, ACK] Seq=6899 Ack=7849 Win=87168 Len=362 TSval=2706778092 TSecr=2706778090"
"347","9.171860086","127.0.0.1","127.0.0.1","TCP","66","51780  >  8080 [ACK] Seq=7849 Ack=7261 Win=77696 Len=0 TSval=2706778092 TSecr=2706778092"
"348","9.173201802","127.0.0.1","127.0.0.1","TCP","590","8080  >  51776 [PSH, ACK] Seq=8863 Ack=7593 Win=87168 Len=524 TSval=2706778093 TSecr=2706778090"
"349","9.173229319","127.0.0.1","127.0.0.1","TCP","66","51776  >  8080 [ACK] Seq=7593 Ack=9387 Win=77568 Len=0 TSval=2706778093 TSecr=2706778093"
"350","9.173405318","127.0.0.1","127.0.0.1","TCP","656","8080  >  51780 [PSH, ACK] Seq=7261 Ack=7849 Win=87296 Len=590 TSval=2706778093 TSecr=2706778092"
