"No.","Time","Source","Destination","Protocol","Length","Info"
"119","1.932929129","127.0.0.1","127.0.0.1","TCP","66","43006  >  4444 [ACK] Seq=1 Ack=1 Win=65536 Len=0 TSval=440682289 TSecr=440682289"
"121","1.934313389","127.0.0.1","127.0.0.1","TCP","66","4444  >  43006 [ACK] Seq=1 Ack=237 Win=65280 Len=0 TSval=440682290 TSecr=440682290"
"123","1.937497045","127.0.0.1","127.0.0.1","TCP","66","43006  >  4444 [ACK] Seq=237 Ack=1490 Win=80000 Len=0 TSval=440682294 TSecr=440682294"
"147","1.980490313","127.0.0.1","127.0.0.1","TCP","66","4444  >  43006 [ACK] Seq=1836 Ack=763 Win=65536 Len=0 TSval=440682337 TSecr=440682296"
"203","2.088042868","127.0.0.1","127.0.0.1","TCP","66","43022  >  4444 [ACK] Seq=1 Ack=1 Win=65536 Len=0 TSval=440682444 TSecr=440682444"
"205","2.089878863","127.0.0.1","127.0.0.1","TCP","66","4444  >  43022 [ACK] Seq=1 Ack=237 Win=65280 Len=0 TSval=440682446 TSecr=440682446"
"207","2.096871119","127.0.0.1","127.0.0.1","TCP","66","43022  >  4444 [ACK] Seq=237 Ack=1490 Win=80000 Len=0 TSval=440682453 TSecr=440682453"
"236","2.112476304","127.0.0.1","127.0.0.1","TCP","66","43006  >  4444 [ACK] Seq=763 Ack=2195 Win=80640 Len=0 TSval=440682469 TSecr=440682428"
"249","2.152574639","127.0.0.1","127.0.0.1","TCP","66","43022  >  4444 [ACK] Seq=763 Ack=2195 Win=80640 Len=0 TSval=440682509 TSecr=440682466"
"297","2.584996535","127.0.0.1","127.0.0.1","TCP","66","43032  >  4444 [ACK] Seq=1 Ack=1 Win=65536 Len=0 TSval=440682941 TSecr=440682941"
"300","2.585152072","127.0.0.1","127.0.0.1","TCP","66","43042  >  4444 [ACK] Seq=1 Ack=1 Win=65536 Len=0 TSval=440682941 TSecr=440682941"
"303","2.590601318","127.0.0.1","127.0.0.1","TCP","66","43054  >  4444 [ACK] Seq=1 Ack=1 Win=65536 Len=0 TSval=440682947 TSecr=440682947"
"306","2.594706535","127.0.0.1","127.0.0.1","TCP","66","43068  >  4444 [ACK] Seq=1 Ack=1 Win=65536 Len=0 TSval=440682951 TSecr=440682951"
"309","2.594934847","127.0.0.1","127.0.0.1","TCP","66","43072  >  4444 [ACK] Seq=1 Ack=1 Win=65536 Len=0 TSval=440682951 TSecr=440682951"
"314","2.597757283","127.0.0.1","127.0.0.1","TCP","66","43088  >  4444 [ACK] Seq=1 Ack=1 Win=65536 Len=0 TSval=440682954 TSecr=440682954"
"316","2.599733729","127.0.0.1","127.0.0.1","TCP","66","4444  >  43032 [ACK] Seq=1 Ack=237 Win=65280 Len=0 TSval=440682956 TSecr=440682956"
"318","2.600778279","127.0.0.1","127.0.0.1","TCP","66","4444  >  43042 [ACK] Seq=1 Ack=237 Win=65280 Len=0 TSval=440682957 TSecr=440682957"
"320","2.604238229","127.0.0.1","127.0.0.1","TCP","66","43032  >  4444 [ACK] Seq=237 Ack=1490 Win=80000 Len=0 TSval=440682960 TSecr=440682960"
"322","2.605059216","127.0.0.1","127.0.0.1","TCP","66","4444  >  43054 [ACK] Seq=1 Ack=237 Win=65280 Len=0 TSval=440682961 TSecr=440682961"
"332","2.608532297","127.0.0.1","127.0.0.1","TCP","66","43042  >  4444 [ACK] Seq=237 Ack=1490 Win=80000 Len=0 TSval=440682965 TSecr=440682965"
"334","2.612086114","127.0.0.1","127.0.0.1","TCP","66","4444  >  43068 [ACK] Seq=1 Ack=237 Win=65280 Len=0 TSval=440682968 TSecr=440682968"
"336","2.612140940","127.0.0.1","127.0.0.1","TCP","66","43054  >  4444 [ACK] Seq=237 Ack=1490 Win=80000 Len=0 TSval=440682968 TSecr=440682968"
"338","2.613211331","127.0.0.1","127.0.0.1","TCP","66","4444  >  43072 [ACK] Seq=1 Ack=237 Win=65280 Len=0 TSval=440682969 TSecr=440682969"
"347","2.615695036","127.0.0.1","127.0.0.1","TCP","66","43092  >  4444 [ACK] Seq=1 Ack=1 Win=65536 Len=0 TSval=440682972 TSecr=440682972"
"349","2.615730306","127.0.0.1","127.0.0.1","TCP","66","43068  >  4444 [ACK] Seq=237 Ack=1490 Win=80000 Len=0 TSval=440682972 TSecr=440682972"
"352","2.617823806","127.0.0.1","127.0.0.1","TCP","66","4444  >  43088 [ACK] Seq=1 Ack=237 Win=65280 Len=0 TSval=440682974 TSecr=440682974"
"356","2.619645693","127.0.0.1","127.0.0.1","TCP","66","43072  >  4444 [ACK] Seq=237 Ack=1490 Win=80000 Len=0 TSval=440682976 TSecr=440682976"
"358","2.621593504","127.0.0.1","127.0.0.1","TCP","66","43088  >  4444 [ACK] Seq=237 Ack=1490 Win=80000 Len=0 TSval=440682978 TSecr=440682978"
"377","2.633535500","127.0.0.1","127.0.0.1","TCP","66","43108  >  4444 [ACK] Seq=1 Ack=1 Win=65536 Len=0 TSval=440682990 TSecr=440682990"
"386","2.635613635","127.0.0.1","127.0.0.1","TCP","66","43122  >  4444 [ACK] Seq=1 Ack=1 Win=65536 Len=0 TSval=440682992 TSecr=440682992"
"391","2.635906550","127.0.0.1","127.0.0.1","TCP","66","43126  >  4444 [ACK] Seq=1 Ack=1 Win=65536 Len=0 TSval=440682992 TSecr=440682992"
"394","2.636038970","127.0.0.1","127.0.0.1","TCP","66","43138  >  4444 [ACK] Seq=1 Ack=1 Win=65536 Len=0 TSval=440682992 TSecr=440682992"
"449","2.647730724","127.0.0.1","127.0.0.1","TCP","66","43146  >  4444 [ACK] Seq=1 Ack=1 Win=65536 Len=0 TSval=440683004 TSecr=440683004"
"452","2.647927817","127.0.0.1","127.0.0.1","TCP","66","43152  >  4444 [ACK] Seq=1 Ack=1 Win=65536 Len=0 TSval=440683004 TSecr=440683004"
"456","2.648093900","127.0.0.1","127.0.0.1","TCP","66","43162  >  4444 [ACK] Seq=1 Ack=1 Win=65536 Len=0 TSval=440683004 TSecr=440683004"
"479","2.652642330","127.0.0.1","127.0.0.1","TCP","66","4444  >  43092 [ACK] Seq=1 Ack=237 Win=65280 Len=0 TSval=440683009 TSecr=440683009"
"488","2.654340737","127.0.0.1","127.0.0.1","TCP","66","43170  >  4444 [ACK] Seq=1 Ack=1 Win=65536 Len=0 TSval=440683010 TSecr=440683010"
"492","2.656310269","127.0.0.1","127.0.0.1","TCP","66","43092  >  4444 [ACK] Seq=237 Ack=1490 Win=80000 Len=0 TSval=440683012 TSecr=440683012"
"555","2.669683318","127.0.0.1","127.0.0.1","TCP","66","43174  >  4444 [ACK] Seq=1 Ack=1 Win=65536 Len=0 TSval=440683026 TSecr=440683026"
"566","2.671687212","127.0.0.1","127.0.0.1","TCP","66","4444  >  43108 [ACK] Seq=1 Ack=237 Win=65280 Len=0 TSval=440683028 TSecr=440683028"
"581","2.673761505","127.0.0.1","127.0.0.1","TCP","66","4444  >  43122 [ACK] Seq=1 Ack=237 Win=65280 Len=0 TSval=440683030 TSecr=440683030"
"585","2.674175317","127.0.0.1","127.0.0.1","TCP","66","43188  >  4444 [ACK] Seq=1 Ack=1 Win=65536 Len=0 TSval=440683030 TSecr=440683030"
"593","2.675849768","127.0.0.1","127.0.0.1","TCP","66","4444  >  43126 [ACK] Seq=1 Ack=237 Win=65280 Len=0 TSval=440683032 TSecr=440683032"
"597","2.677409190","127.0.0.1","127.0.0.1","TCP","66","4444  >  43138 [ACK] Seq=1 Ack=237 Win=65280 Len=0 TSval=440683034 TSecr=440683033"
"599","2.677892004","127.0.0.1","127.0.0.1","TCP","66","43108  >  4444 [ACK] Seq=237 Ack=1490 Win=80000 Len=0 TSval=440683034 TSecr=440683034"
"608","2.678447384","127.0.0.1","127.0.0.1","TCP","66","43192  >  4444 [ACK] Seq=1 Ack=1 Win=65536 Len=0 TSval=440683035 TSecr=440683035"
"614","2.678712642","127.0.0.1","127.0.0.1","TCP","66","43206  >  4444 [ACK] Seq=1 Ack=1 Win=65536 Len=0 TSval=440683035 TSecr=440683035"
"617","2.678880751","127.0.0.1","127.0.0.1","TCP","66","43214  >  4444 [ACK] Seq=1 Ack=1 Win=65536 Len=0 TSval=440683035 TSecr=440683035"
"620","2.679040548","127.0.0.1","127.0.0.1","TCP","66","43230  >  4444 [ACK] Seq=1 Ack=1 Win=65536 Len=0 TSval=440683035 TSecr=440683035"
"624","2.679758589","127.0.0.1","127.0.0.1","TCP","66","43244  >  4444 [ACK] Seq=1 Ack=1 Win=65536 Len=0 TSval=440683036 TSecr=440683036"
"626","2.680215213","127.0.0.1","127.0.0.1","TCP","66","43122  >  4444 [ACK] Seq=237 Ack=1490 Win=80000 Len=0 TSval=440683036 TSecr=440683036"
"628","2.680241055","127.0.0.1","127.0.0.1","TCP","66","43126  >  4444 [ACK] Seq=237 Ack=1490 Win=80000 Len=0 TSval=440683036 TSecr=440683036"
"629","2.680443036","127.0.0.1","127.0.0.1","TCP","66","4444  >  43042 [ACK] Seq=1836 Ack=763 Win=65536 Len=0 TSval=440683037 TSecr=440682995"
"630","2.680463151","127.0.0.1","127.0.0.1","TCP","66","43032  >  4444 [ACK] Seq=763 Ack=2195 Win=80640 Len=0 TSval=440683037 TSecr=440682994"
"644","2.684002860","127.0.0.1","127.0.0.1","TCP","66","43138  >  4444 [ACK] Seq=237 Ack=1490 Win=80000 Len=0 TSval=440683040 TSecr=440683040"
"647","2.684569275","127.0.0.1","127.0.0.1","TCP","66","4444  >  43146 [ACK] Seq=1 Ack=237 Win=65280 Len=0 TSval=440683041 TSecr=440683041"
"650","2.686093217","127.0.0.1","127.0.0.1","TCP","66","4444  >  43152 [ACK] Seq=1 Ack=237 Win=65280 Len=0 TSval=440683042 TSecr=440683042"
"652","2.687380187","127.0.0.1","127.0.0.1","TCP","66","4444  >  43162 [ACK] Seq=1 Ack=237 Win=65280 Len=0 TSval=440683043 TSecr=440683043"
"655","2.687713262","127.0.0.1","127.0.0.1","TCP","66","43252  >  4444 [ACK] Seq=1 Ack=1 Win=65536 Len=0 TSval=440683044 TSecr=440683044"
"657","2.688103257","127.0.0.1","127.0.0.1","TCP","66","43146  >  4444 [ACK] Seq=237 Ack=1490 Win=80000 Len=0 TSval=440683044 TSecr=440683044"
"658","2.688443385","127.0.0.1","127.0.0.1","TCP","66","4444  >  43054 [ACK] Seq=1836 Ack=763 Win=65536 Len=0 TSval=440683045 TSecr=440683003"
"662","2.689198861","127.0.0.1","127.0.0.1","TCP","66","43258  >  4444 [ACK] Seq=1 Ack=1 Win=65536 Len=0 TSval=440683045 TSecr=440683045"
"667","2.690898665","127.0.0.1","127.0.0.1","TCP","66","4444  >  43170 [ACK] Seq=1 Ack=237 Win=65280 Len=0 TSval=440683047 TSecr=440683047"
"670","2.691259326","127.0.0.1","127.0.0.1","TCP","66","43266  >  4444 [ACK] Seq=1 Ack=1 Win=65536 Len=0 TSval=440683047 TSecr=440683047"
"672","2.692780545","127.0.0.1","127.0.0.1","TCP","66","43152  >  4444 [ACK] Seq=237 Ack=1490 Win=80000 Len=0 TSval=440683049 TSecr=440683049"
"674","2.693940893","127.0.0.1","127.0.0.1","TCP","66","43162  >  4444 [ACK] Seq=237 Ack=1490 Win=80000 Len=0 TSval=440683050 TSecr=440683050"
"677","2.695672683","127.0.0.1","127.0.0.1","TCP","66","43170  >  4444 [ACK] Seq=237 Ack=1490 Win=80000 Len=0 TSval=440683052 TSecr=440683052"
"680","2.696117784","127.0.0.1","127.0.0.1","TCP","66","43272  >  4444 [ACK] Seq=1 Ack=1 Win=65536 Len=0 TSval=440683052 TSecr=440683052"
"685","2.697365293","127.0.0.1","127.0.0.1","TCP","66","43280  >  4444 [ACK] Seq=1 Ack=1 Win=65536 Len=0 TSval=440683053 TSecr=440683053"
"688","2.700534772","127.0.0.1","127.0.0.1","TCP","66","4444  >  43072 [ACK] Seq=1836 Ack=763 Win=65536 Len=0 TSval=440683057 TSecr=440683014"
"694","2.704491924","127.0.0.1","127.0.0.1","TCP","66","4444  >  43088 [ACK] Seq=1836 Ack=763 Win=65536 Len=0 TSval=440683061 TSecr=440683019"
"695","2.704496185","127.0.0.1","127.0.0.1","TCP","66","43292  >  4444 [ACK] Seq=1 Ack=1 Win=65536 Len=0 TSval=440683061 TSecr=440683061"
"702","2.705683212","127.0.0.1","127.0.0.1","TCP","66","43302  >  4444 [ACK] Seq=1 Ack=1 Win=65536 Len=0 TSval=440683062 TSecr=440683062"
"712","2.712493321","127.0.0.1","127.0.0.1","TCP","66","43068  >  4444 [ACK] Seq=763 Ack=2195 Win=80640 Len=0 TSval=440683069 TSecr=440683028"
"739","2.742715852","127.0.0.1","127.0.0.1","TCP","66","43318  >  4444 [ACK] Seq=1 Ack=1 Win=65536 Len=0 TSval=440683099 TSecr=440683099"
"742","2.742912177","127.0.0.1","127.0.0.1","TCP","66","43328  >  4444 [ACK] Seq=1 Ack=1 Win=65536 Len=0 TSval=440683099 TSecr=440683099"
"745","2.743069879","127.0.0.1","127.0.0.1","TCP","66","43338  >  4444 [ACK] Seq=1 Ack=1 Win=65536 Len=0 TSval=440683099 TSecr=440683099"
"748","2.743221505","127.0.0.1","127.0.0.1","TCP","66","43354  >  4444 [ACK] Seq=1 Ack=1 Win=65536 Len=0 TSval=440683099 TSecr=440683099"
"751","2.743382699","127.0.0.1","127.0.0.1","TCP","66","43366  >  4444 [ACK] Seq=1 Ack=1 Win=65536 Len=0 TSval=440683099 TSecr=440683099"
"753","2.744931436","127.0.0.1","127.0.0.1","TCP","66","4444  >  43174 [ACK] Seq=1 Ack=237 Win=65280 Len=0 TSval=440683101 TSecr=440683101"
"756","2.745213805","127.0.0.1","127.0.0.1","TCP","66","43374  >  4444 [ACK] Seq=1 Ack=1 Win=65536 Len=0 TSval=440683101 TSecr=440683101"
"759","2.745391272","127.0.0.1","127.0.0.1","TCP","66","43388  >  4444 [ACK] Seq=1 Ack=1 Win=65536 Len=0 TSval=440683101 TSecr=440683101"
"762","2.745552606","127.0.0.1","127.0.0.1","TCP","66","43390  >  4444 [ACK] Seq=1 Ack=1 Win=65536 Len=0 TSval=440683102 TSecr=440683102"
"764","2.746876453","127.0.0.1","127.0.0.1","TCP","66","4444  >  43188 [ACK] Seq=1 Ack=237 Win=65280 Len=0 TSval=440683103 TSecr=440683103"
"766","2.749336132","127.0.0.1","127.0.0.1","TCP","66","43174  >  4444 [ACK] Seq=237 Ack=1490 Win=80000 Len=0 TSval=440683105 TSecr=440683105"
"770","2.750129812","127.0.0.1","127.0.0.1","TCP","66","43406  >  4444 [ACK] Seq=1 Ack=1 Win=65536 Len=0 TSval=440683106 TSecr=440683106"
"774","2.750330676","127.0.0.1","127.0.0.1","TCP","66","43416  >  4444 [ACK] Seq=1 Ack=1 Win=65536 Len=0 TSval=440683106 TSecr=440683106"
"778","2.750487540","127.0.0.1","127.0.0.1","TCP","66","43426  >  4444 [ACK] Seq=1 Ack=1 Win=65536 Len=0 TSval=440683107 TSecr=440683107"
"780","2.752353985","127.0.0.1","127.0.0.1","TCP","66","4444  >  43192 [ACK] Seq=1 Ack=237 Win=65280 Len=0 TSval=440683108 TSecr=440683108"
"783","2.752795663","127.0.0.1","127.0.0.1","TCP","66","43432  >  4444 [ACK] Seq=1 Ack=1 Win=65536 Len=0 TSval=440683109 TSecr=440683109"
"786","2.754801373","127.0.0.1","127.0.0.1","TCP","66","4444  >  43206 [ACK] Seq=1 Ack=237 Win=65280 Len=0 TSval=440683111 TSecr=440683111"
"788","2.756481202","127.0.0.1","127.0.0.1","TCP","66","43092  >  4444 [ACK] Seq=763 Ack=2195 Win=80512 Len=0 TSval=440683113 TSecr=440683069"
"790","2.757562838","127.0.0.1","127.0.0.1","TCP","66","4444  >  43214 [ACK] Seq=1 Ack=237 Win=65280 Len=0 TSval=440683114 TSecr=440683114"
"792","2.757899614","127.0.0.1","127.0.0.1","TCP","66","43188  >  4444 [ACK] Seq=237 Ack=1490 Win=80000 Len=0 TSval=440683114 TSecr=440683114"
"794","2.759777513","127.0.0.1","127.0.0.1","TCP","66","4444  >  43230 [ACK] Seq=1 Ack=237 Win=65280 Len=0 TSval=440683116 TSecr=440683116"
"797","2.761294192","127.0.0.1","127.0.0.1","TCP","66","43192  >  4444 [ACK] Seq=237 Ack=1490 Win=80000 Len=0 TSval=440683117 TSecr=440683117"
"800","2.761933871","127.0.0.1","127.0.0.1","TCP","66","4444  >  43244 [ACK] Seq=1 Ack=237 Win=65280 Len=0 TSval=440683118 TSecr=440683118"
"805","2.763737389","127.0.0.1","127.0.0.1","TCP","66","43214  >  4444 [ACK] Seq=237 Ack=1490 Win=80000 Len=0 TSval=440683120 TSecr=440683120"
"807","2.764092114","127.0.0.1","127.0.0.1","TCP","66","43206  >  4444 [ACK] Seq=237 Ack=1490 Win=80000 Len=0 TSval=440683120 TSecr=440683120"
"812","2.767365587","127.0.0.1","127.0.0.1","TCP","66","43244  >  4444 [ACK] Seq=237 Ack=1490 Win=80000 Len=0 TSval=440683123 TSecr=440683123"
"817","2.768149559","127.0.0.1","127.0.0.1","TCP","66","43230  >  4444 [ACK] Seq=237 Ack=1490 Win=80000 Len=0 TSval=440683124 TSecr=440683124"
"838","2.777695710","127.0.0.1","127.0.0.1","TCP","66","43138  >  4444 [ACK] Seq=317 Ack=1836 Win=80640 Len=0 TSval=440683134 TSecr=440683134"
"857","2.789907574","127.0.0.1","127.0.0.1","TCP","66","4444  >  43252 [ACK] Seq=1 Ack=237 Win=65280 Len=0 TSval=440683146 TSecr=440683146"
"867","2.792549121","127.0.0.1","127.0.0.1","TCP","66","4444  >  43108 [ACK] Seq=1836 Ack=763 Win=65536 Len=0 TSval=440683149 TSecr=440683106"
"879","2.795769794","127.0.0.1","127.0.0.1","TCP","66","4444  >  43258 [ACK] Seq=1 Ack=237 Win=65280 Len=0 TSval=440683152 TSecr=440683152"
"882","2.796501035","127.0.0.1","127.0.0.1","TCP","66","43444  >  4444 [ACK] Seq=1 Ack=1 Win=65536 Len=0 TSval=440683153 TSecr=440683153"
"893","2.800108770","127.0.0.1","127.0.0.1","TCP","66","43252  >  4444 [ACK] Seq=237 Ack=1490 Win=80000 Len=0 TSval=440683156 TSecr=440683156"
"902","2.802455516","127.0.0.1","127.0.0.1","TCP","66","4444  >  43266 [ACK] Seq=1 Ack=237 Win=65280 Len=0 TSval=440683159 TSecr=440683159"
"917","2.811559570","127.0.0.1","127.0.0.1","TCP","66","43266  >  4444 [ACK] Seq=237 Ack=1490 Win=80000 Len=0 TSval=440683168 TSecr=440683168"
"933","2.814735545","127.0.0.1","127.0.0.1","TCP","66","43258  >  4444 [ACK] Seq=237 Ack=1490 Win=80000 Len=0 TSval=440683171 TSecr=440683171"
"940","2.816482352","127.0.0.1","127.0.0.1","TCP","66","4444  >  43126 [ACK] Seq=1836 Ack=763 Win=65536 Len=0 TSval=440683173 TSecr=440683125"
"941","2.816557990","127.0.0.1","127.0.0.1","TCP","66","4444  >  43122 [ACK] Seq=1836 Ack=763 Win=65536 Len=0 TSval=440683173 TSecr=440683131"
"957","2.823901549","127.0.0.1","127.0.0.1","TCP","66","4444  >  43272 [ACK] Seq=1 Ack=237 Win=65280 Len=0 TSval=440683180 TSecr=440683180"
"962","2.827541970","127.0.0.1","127.0.0.1","TCP","66","4444  >  43280 [ACK] Seq=1 Ack=237 Win=65280 Len=0 TSval=440683184 TSecr=440683184"
"974","2.829288707","127.0.0.1","127.0.0.1","TCP","66","43272  >  4444 [ACK] Seq=237 Ack=1490 Win=80000 Len=0 TSval=440683185 TSecr=440683185"
"976","2.830162564","127.0.0.1","127.0.0.1","TCP","66","4444  >  43292 [ACK] Seq=1 Ack=237 Win=65280 Len=0 TSval=440683186 TSecr=440683186"
"985","2.832348116","127.0.0.1","127.0.0.1","TCP","66","4444  >  43302 [ACK] Seq=1 Ack=237 Win=65280 Len=0 TSval=440683188 TSecr=440683188"
"986","2.832469989","127.0.0.1","127.0.0.1","TCP","66","4444  >  43138 [ACK] Seq=1836 Ack=763 Win=65536 Len=0 TSval=440683189 TSecr=440683141"
"1002","2.833744527","127.0.0.1","127.0.0.1","TCP","66","43280  >  4444 [ACK] Seq=237 Ack=1490 Win=80000 Len=0 TSval=440683190 TSecr=440683190"
"1096","2.840002330","127.0.0.1","127.0.0.1","TCP","66","43292  >  4444 [ACK] Seq=237 Ack=1490 Win=80000 Len=0 TSval=440683196 TSecr=440683196"
"1098","2.842721191","127.0.0.1","127.0.0.1","TCP","66","43302  >  4444 [ACK] Seq=237 Ack=1490 Win=80000 Len=0 TSval=440683199 TSecr=440683199"
"1100","2.842816106","127.0.0.1","127.0.0.1","TCP","66","4444  >  43318 [ACK] Seq=1 Ack=237 Win=65280 Len=0 TSval=440683199 TSecr=440683199"
"1105","2.844473865","127.0.0.1","127.0.0.1","TCP","66","4444  >  43146 [ACK] Seq=1836 Ack=763 Win=65536 Len=0 TSval=440683201 TSecr=440683157"
"1112","2.846003115","127.0.0.1","127.0.0.1","TCP","66","4444  >  43338 [ACK] Seq=1 Ack=237 Win=65280 Len=0 TSval=440683202 TSecr=440683202"
"1130","2.851696598","127.0.0.1","127.0.0.1","TCP","66","4444  >  43354 [ACK] Seq=1 Ack=237 Win=65280 Len=0 TSval=440683208 TSecr=440683208"
"1132","2.852508296","127.0.0.1","127.0.0.1","TCP","66","4444  >  43152 [ACK] Seq=1836 Ack=763 Win=65536 Len=0 TSval=440683209 TSecr=440683168"
"1134","2.853096572","127.0.0.1","127.0.0.1","TCP","66","43318  >  4444 [ACK] Seq=237 Ack=1490 Win=80000 Len=0 TSval=440683209 TSecr=440683209"
"1138","2.854233103","127.0.0.1","127.0.0.1","TCP","66","4444  >  43366 [ACK] Seq=1 Ack=237 Win=65280 Len=0 TSval=440683210 TSecr=440683210"
"1143","2.856772472","127.0.0.1","127.0.0.1","TCP","66","4444  >  43374 [ACK] Seq=1 Ack=237 Win=65280 Len=0 TSval=440683213 TSecr=440683213"
"1147","2.859319244","127.0.0.1","127.0.0.1","TCP","66","4444  >  43388 [ACK] Seq=1 Ack=237 Win=65280 Len=0 TSval=440683215 TSecr=440683215"
"1149","2.860457591","127.0.0.1","127.0.0.1","TCP","66","4444  >  43162 [ACK] Seq=1836 Ack=763 Win=65536 Len=0 TSval=440683217 TSecr=440683176"
"1160","2.861828022","127.0.0.1","127.0.0.1","TCP","66","4444  >  43390 [ACK] Seq=1 Ack=237 Win=65280 Len=0 TSval=440683218 TSecr=440683218"
"1161","2.861841292","127.0.0.1","127.0.0.1","TCP","66","43354  >  4444 [ACK] Seq=237 Ack=1490 Win=80000 Len=0 TSval=440683218 TSecr=440683218"
"1163","2.862237782","127.0.0.1","127.0.0.1","TCP","66","43366  >  4444 [ACK] Seq=237 Ack=1490 Win=80000 Len=0 TSval=440683218 TSecr=440683218"
"1168","2.864556452","127.0.0.1","127.0.0.1","TCP","66","4444  >  43170 [ACK] Seq=1836 Ack=763 Win=65536 Len=0 TSval=440683221 TSecr=440683180"
"1174","2.867352418","127.0.0.1","127.0.0.1","TCP","66","43374  >  4444 [ACK] Seq=237 Ack=1490 Win=80000 Len=0 TSval=440683223 TSecr=440683223"
"1179","2.868534835","127.0.0.1","127.0.0.1","TCP","66","43388  >  4444 [ACK] Seq=237 Ack=1490 Win=80000 Len=0 TSval=440683225 TSecr=440683225"
"1181","2.869299111","127.0.0.1","127.0.0.1","TCP","66","4444  >  43406 [ACK] Seq=1 Ack=237 Win=65280 Len=0 TSval=440683225 TSecr=440683225"
"1191","2.873750462","127.0.0.1","127.0.0.1","TCP","66","4444  >  43416 [ACK] Seq=1 Ack=237 Win=65280 Len=0 TSval=440683230 TSecr=440683230"
"1195","2.874850467","127.0.0.1","127.0.0.1","TCP","66","43390  >  4444 [ACK] Seq=237 Ack=1490 Win=80000 Len=0 TSval=440683231 TSecr=440683231"
"1198","2.876752112","127.0.0.1","127.0.0.1","TCP","66","4444  >  43426 [ACK] Seq=1 Ack=237 Win=65280 Len=0 TSval=440683233 TSecr=440683233"
"1201","2.877444312","127.0.0.1","127.0.0.1","TCP","66","43338  >  4444 [ACK] Seq=237 Ack=1490 Win=80000 Len=0 TSval=440683234 TSecr=440683233"
"1205","2.879198033","127.0.0.1","127.0.0.1","TCP","66","4444  >  43432 [ACK] Seq=1 Ack=237 Win=65280 Len=0 TSval=440683235 TSecr=440683235"
"1220","2.888013293","127.0.0.1","127.0.0.1","TCP","66","43416  >  4444 [ACK] Seq=237 Ack=1490 Win=80000 Len=0 TSval=440683244 TSecr=440683244"
"1221","2.888447777","127.0.0.1","127.0.0.1","TCP","66","43054  >  4444 [ACK] Seq=763 Ack=2195 Win=80640 Len=0 TSval=440683245 TSecr=440683203"
"1222","2.888536406","127.0.0.1","127.0.0.1","TCP","66","43042  >  4444 [ACK] Seq=763 Ack=2195 Win=80640 Len=0 TSval=440683245 TSecr=440683201"
"1230","2.894048929","127.0.0.1","127.0.0.1","TCP","66","43406  >  4444 [ACK] Seq=237 Ack=1490 Win=80000 Len=0 TSval=440683250 TSecr=440683250"
"1238","2.899345502","127.0.0.1","127.0.0.1","TCP","66","43432  >  4444 [ACK] Seq=237 Ack=1490 Win=80000 Len=0 TSval=440683255 TSecr=440683255"
"1242","2.901279694","127.0.0.1","127.0.0.1","TCP","66","43446  >  4444 [ACK] Seq=1 Ack=1 Win=65536 Len=0 TSval=440683257 TSecr=440683257"
"1246","2.901619753","127.0.0.1","127.0.0.1","TCP","66","43462  >  4444 [ACK] Seq=1 Ack=1 Win=65536 Len=0 TSval=440683258 TSecr=440683258"
"1254","2.904868502","127.0.0.1","127.0.0.1","TCP","66","4444  >  43444 [ACK] Seq=1 Ack=237 Win=65280 Len=0 TSval=440683261 TSecr=440683261"
"1258","2.905849007","127.0.0.1","127.0.0.1","TCP","66","43426  >  4444 [ACK] Seq=237 Ack=1490 Win=80000 Len=0 TSval=440683262 TSecr=440683262"
"1266","2.910561845","127.0.0.1","127.0.0.1","TCP","66","43468  >  4444 [ACK] Seq=1 Ack=1 Win=65536 Len=0 TSval=440683267 TSecr=440683267"
"1268","2.912462303","127.0.0.1","127.0.0.1","TCP","66","4444  >  43174 [ACK] Seq=1836 Ack=763 Win=65536 Len=0 TSval=440683269 TSecr=440683224"
"1280","2.920836584","127.0.0.1","127.0.0.1","TCP","66","43484  >  4444 [ACK] Seq=1 Ack=1 Win=65536 Len=0 TSval=440683277 TSecr=440683277"
"1283","2.921156807","127.0.0.1","127.0.0.1","TCP","66","43486  >  4444 [ACK] Seq=1 Ack=1 Win=65536 Len=0 TSval=440683277 TSecr=440683277"
"1287","2.921343773","127.0.0.1","127.0.0.1","TCP","66","43492  >  4444 [ACK] Seq=1 Ack=1 Win=65536 Len=0 TSval=440683277 TSecr=440683277"
"1290","2.921527805","127.0.0.1","127.0.0.1","TCP","66","43502  >  4444 [ACK] Seq=1 Ack=1 Win=65536 Len=0 TSval=440683278 TSecr=440683278"
"1295","2.925383198","127.0.0.1","127.0.0.1","TCP","66","43514  >  4444 [ACK] Seq=1 Ack=1 Win=65536 Len=0 TSval=440683281 TSecr=440683281"
"1298","2.925674647","127.0.0.1","127.0.0.1","TCP","66","43520  >  4444 [ACK] Seq=1 Ack=1 Win=65536 Len=0 TSval=440683282 TSecr=440683282"
"1301","2.925853721","127.0.0.1","127.0.0.1","TCP","66","43524  >  4444 [ACK] Seq=1 Ack=1 Win=65536 Len=0 TSval=440683282 TSecr=440683282"
"1304","2.926027068","127.0.0.1","127.0.0.1","TCP","66","43532  >  4444 [ACK] Seq=1 Ack=1 Win=65536 Len=0 TSval=440683282 TSecr=440683282"
"1307","2.926215151","127.0.0.1","127.0.0.1","TCP","66","43536  >  4444 [ACK] Seq=1 Ack=1 Win=65536 Len=0 TSval=440683282 TSecr=440683282"
"1310","2.926389964","127.0.0.1","127.0.0.1","TCP","66","43548  >  4444 [ACK] Seq=1 Ack=1 Win=65536 Len=0 TSval=440683282 TSecr=440683282"
"1313","2.926563660","127.0.0.1","127.0.0.1","TCP","66","43556  >  4444 [ACK] Seq=1 Ack=1 Win=65536 Len=0 TSval=440683283 TSecr=440683283"
"1315","2.928498201","127.0.0.1","127.0.0.1","TCP","66","4444  >  43192 [ACK] Seq=1490 Ack=317 Win=65536 Len=0 TSval=440683285 TSecr=440683242"
"1318","2.928582220","127.0.0.1","127.0.0.1","TCP","66","4444  >  43192 [ACK] Seq=1490 Ack=763 Win=65152 Len=0 TSval=440683285 TSecr=440683285"
"1322","2.930671251","127.0.0.1","127.0.0.1","TCP","66","43570  >  4444 [ACK] Seq=1 Ack=1 Win=65536 Len=0 TSval=440683287 TSecr=440683287"
"1325","2.930963188","127.0.0.1","127.0.0.1","TCP","66","43580  >  4444 [ACK] Seq=1 Ack=1 Win=65536 Len=0 TSval=440683287 TSecr=440683287"
"1328","2.931139538","127.0.0.1","127.0.0.1","TCP","66","43590  >  4444 [ACK] Seq=1 Ack=1 Win=65536 Len=0 TSval=440683287 TSecr=440683287"
"1331","2.931313793","127.0.0.1","127.0.0.1","TCP","66","43596  >  4444 [ACK] Seq=1 Ack=1 Win=65536 Len=0 TSval=440683287 TSecr=440683287"
"1334","2.931489514","127.0.0.1","127.0.0.1","TCP","66","43598  >  4444 [ACK] Seq=1 Ack=1 Win=65536 Len=0 TSval=440683288 TSecr=440683288"
"1337","2.931673337","127.0.0.1","127.0.0.1","TCP","66","43600  >  4444 [ACK] Seq=1 Ack=1 Win=65536 Len=0 TSval=440683288 TSecr=440683288"
"1340","2.931843681","127.0.0.1","127.0.0.1","TCP","66","43608  >  4444 [ACK] Seq=1 Ack=1 Win=65536 Len=0 TSval=440683288 TSecr=440683288"
"1343","2.932023453","127.0.0.1","127.0.0.1","TCP","66","43624  >  4444 [ACK] Seq=1 Ack=1 Win=65536 Len=0 TSval=440683288 TSecr=440683288"
"1346","2.932201619","127.0.0.1","127.0.0.1","TCP","66","43632  >  4444 [ACK] Seq=1 Ack=1 Win=65536 Len=0 TSval=440683288 TSecr=440683288"
"1349","2.932369308","127.0.0.1","127.0.0.1","TCP","66","43644  >  4444 [ACK] Seq=1 Ack=1 Win=65536 Len=0 TSval=440683288 TSecr=440683288"
"1353","2.932628839","127.0.0.1","127.0.0.1","TCP","66","43656  >  4444 [ACK] Seq=1 Ack=1 Win=65536 Len=0 TSval=440683289 TSecr=440683289"
"1356","2.932811405","127.0.0.1","127.0.0.1","TCP","66","43670  >  4444 [ACK] Seq=1 Ack=1 Win=65536 Len=0 TSval=440683289 TSecr=440683289"
"1359","2.932992016","127.0.0.1","127.0.0.1","TCP","66","43672  >  4444 [ACK] Seq=1 Ack=1 Win=65536 Len=0 TSval=440683289 TSecr=440683289"
"1362","2.933166200","127.0.0.1","127.0.0.1","TCP","66","43676  >  4444 [ACK] Seq=1 Ack=1 Win=65536 Len=0 TSval=440683289 TSecr=440683289"
"1365","2.933337522","127.0.0.1","127.0.0.1","TCP","66","43680  >  4444 [ACK] Seq=1 Ack=1 Win=65536 Len=0 TSval=440683289 TSecr=440683289"
"1368","2.933559897","127.0.0.1","127.0.0.1","TCP","66","43688  >  4444 [ACK] Seq=1 Ack=1 Win=65536 Len=0 TSval=440683290 TSecr=440683290"
"1371","2.933731218","127.0.0.1","127.0.0.1","TCP","66","43692  >  4444 [ACK] Seq=1 Ack=1 Win=65536 Len=0 TSval=440683290 TSecr=440683290"
"1374","2.933897930","127.0.0.1","127.0.0.1","TCP","66","43706  >  4444 [ACK] Seq=1 Ack=1 Win=65536 Len=0 TSval=440683290 TSecr=440683290"
"1377","2.934066388","127.0.0.1","127.0.0.1","TCP","66","43708  >  4444 [ACK] Seq=1 Ack=1 Win=65536 Len=0 TSval=440683290 TSecr=440683290"
"1380","2.934223182","127.0.0.1","127.0.0.1","TCP","66","43720  >  4444 [ACK] Seq=1 Ack=1 Win=65536 Len=0 TSval=440683290 TSecr=440683290"
"1383","2.934391640","127.0.0.1","127.0.0.1","TCP","66","43736  >  4444 [ACK] Seq=1 Ack=1 Win=65536 Len=0 TSval=440683290 TSecr=440683290"
"1386","2.934576860","127.0.0.1","127.0.0.1","TCP","66","43742  >  4444 [ACK] Seq=1 Ack=1 Win=65536 Len=0 TSval=440683291 TSecr=440683291"
"1389","2.934747064","127.0.0.1","127.0.0.1","TCP","66","43752  >  4444 [ACK] Seq=1 Ack=1 Win=65536 Len=0 TSval=440683291 TSecr=440683291"
"1392","2.934905674","127.0.0.1","127.0.0.1","TCP","66","43758  >  4444 [ACK] Seq=1 Ack=1 Win=65536 Len=0 TSval=440683291 TSecr=440683291"
"1395","2.935074690","127.0.0.1","127.0.0.1","TCP","66","43770  >  4444 [ACK] Seq=1 Ack=1 Win=65536 Len=0 TSval=440683291 TSecr=440683291"
"1398","2.935233091","127.0.0.1","127.0.0.1","TCP","66","43786  >  4444 [ACK] Seq=1 Ack=1 Win=65536 Len=0 TSval=440683291 TSecr=440683291"
"1401","2.935418101","127.0.0.1","127.0.0.1","TCP","66","43790  >  4444 [ACK] Seq=1 Ack=1 Win=65536 Len=0 TSval=440683292 TSecr=440683291"
"1404","2.935592286","127.0.0.1","127.0.0.1","TCP","66","43804  >  4444 [ACK] Seq=1 Ack=1 Win=65536 Len=0 TSval=440683292 TSecr=440683292"
"1408","2.935758230","127.0.0.1","127.0.0.1","TCP","66","43806  >  4444 [ACK] Seq=1 Ack=1 Win=65536 Len=0 TSval=440683292 TSecr=440683292"
"1411","2.935917468","127.0.0.1","127.0.0.1","TCP","66","43822  >  4444 [ACK] Seq=1 Ack=1 Win=65536 Len=0 TSval=440683292 TSecr=440683292"
"1414","2.936084739","127.0.0.1","127.0.0.1","TCP","66","43836  >  4444 [ACK] Seq=1 Ack=1 Win=65536 Len=0 TSval=440683292 TSecr=440683292"
"1417","2.936249844","127.0.0.1","127.0.0.1","TCP","66","43842  >  4444 [ACK] Seq=1 Ack=1 Win=65536 Len=0 TSval=440683292 TSecr=440683292"
"1420","2.936501763","127.0.0.1","127.0.0.1","TCP","66","4444  >  43214 [ACK] Seq=1490 Ack=317 Win=65536 Len=0 TSval=440683293 TSecr=440683246"
"1422","2.936512867","127.0.0.1","127.0.0.1","TCP","66","4444  >  43188 [ACK] Seq=1836 Ack=763 Win=65152 Len=0 TSval=440683293 TSecr=440683251"
"1423","2.936530398","127.0.0.1","127.0.0.1","TCP","66","4444  >  43206 [ACK] Seq=1490 Ack=317 Win=65536 Len=0 TSval=440683293 TSecr=440683250"
"1427","2.936617700","127.0.0.1","127.0.0.1","TCP","66","4444  >  43214 [ACK] Seq=1490 Ack=763 Win=65152 Len=0 TSval=440683293 TSecr=440683293"
"1428","2.936629084","127.0.0.1","127.0.0.1","TCP","66","4444  >  43206 [ACK] Seq=1490 Ack=763 Win=65152 Len=0 TSval=440683293 TSecr=440683293"
"1429","2.936655274","127.0.0.1","127.0.0.1","TCP","66","43850  >  4444 [ACK] Seq=1 Ack=1 Win=65536 Len=0 TSval=440683293 TSecr=440683293"
"1432","2.936856208","127.0.0.1","127.0.0.1","TCP","66","43856  >  4444 [ACK] Seq=1 Ack=1 Win=65536 Len=0 TSval=440683293 TSecr=440683293"
"1435","2.937055955","127.0.0.1","127.0.0.1","TCP","66","43872  >  4444 [ACK] Seq=1 Ack=1 Win=65536 Len=0 TSval=440683293 TSecr=440683293"
"1438","2.937225042","127.0.0.1","127.0.0.1","TCP","66","43880  >  4444 [ACK] Seq=1 Ack=1 Win=65536 Len=0 TSval=440683293 TSecr=440683293"
"1441","2.937410890","127.0.0.1","127.0.0.1","TCP","66","43888  >  4444 [ACK] Seq=1 Ack=1 Win=65536 Len=0 TSval=440683294 TSecr=440683293"
"1443","2.937623558","127.0.0.1","127.0.0.1","TCP","66","43192  >  4444 [ACK] Seq=763 Ack=1836 Win=80640 Len=0 TSval=440683294 TSecr=440683294"
"1446","2.938058531","127.0.0.1","127.0.0.1","TCP","66","43900  >  4444 [ACK] Seq=1 Ack=1 Win=65536 Len=0 TSval=440683294 TSecr=440683294"
"1449","2.938279649","127.0.0.1","127.0.0.1","TCP","66","43904  >  4444 [ACK] Seq=1 Ack=1 Win=65536 Len=0 TSval=440683294 TSecr=440683294"
"1452","2.938461586","127.0.0.1","127.0.0.1","TCP","66","43920  >  4444 [ACK] Seq=1 Ack=1 Win=65536 Len=0 TSval=440683295 TSecr=440683295"
"1455","2.938669574","127.0.0.1","127.0.0.1","TCP","66","43928  >  4444 [ACK] Seq=1 Ack=1 Win=65536 Len=0 TSval=440683295 TSecr=440683295"
"1458","2.938846134","127.0.0.1","127.0.0.1","TCP","66","43944  >  4444 [ACK] Seq=1 Ack=1 Win=65536 Len=0 TSval=440683295 TSecr=440683295"
"1459","2.940607049","127.0.0.1","127.0.0.1","TCP","66","4444  >  43230 [ACK] Seq=1490 Ack=317 Win=65536 Len=0 TSval=440683297 TSecr=440683256"
"1460","2.940661385","127.0.0.1","127.0.0.1","TCP","66","4444  >  43244 [ACK] Seq=1490 Ack=317 Win=65536 Len=0 TSval=440683297 TSecr=440683253"
"1463","2.940731017","127.0.0.1","127.0.0.1","TCP","66","4444  >  43230 [ACK] Seq=1490 Ack=763 Win=65152 Len=0 TSval=440683297 TSecr=440683297"
"1464","2.940745405","127.0.0.1","127.0.0.1","TCP","66","4444  >  43244 [ACK] Seq=1490 Ack=763 Win=65152 Len=0 TSval=440683297 TSecr=440683297"
"1479","2.947815953","127.0.0.1","127.0.0.1","TCP","66","43214  >  4444 [ACK] Seq=763 Ack=1836 Win=80640 Len=0 TSval=440683304 TSecr=440683304"
"1484","2.952462930","127.0.0.1","127.0.0.1","TCP","66","4444  >  43252 [ACK] Seq=1490 Ack=317 Win=65536 Len=0 TSval=440683309 TSecr=440683265"
"1486","2.952527464","127.0.0.1","127.0.0.1","TCP","66","4444  >  43252 [ACK] Seq=1490 Ack=763 Win=65152 Len=0 TSval=440683309 TSecr=440683309"
"1489","2.954099667","127.0.0.1","127.0.0.1","TCP","66","43206  >  4444 [ACK] Seq=763 Ack=1836 Win=80640 Len=0 TSval=440683310 TSecr=440683310"
"1495","2.956541048","127.0.0.1","127.0.0.1","TCP","66","4444  >  43266 [ACK] Seq=1490 Ack=317 Win=65536 Len=0 TSval=440683313 TSecr=440683269"
"1498","2.956603556","127.0.0.1","127.0.0.1","TCP","66","4444  >  43266 [ACK] Seq=1490 Ack=763 Win=65152 Len=0 TSval=440683313 TSecr=440683313"
"1502","2.960465514","127.0.0.1","127.0.0.1","TCP","66","4444  >  43258 [ACK] Seq=1490 Ack=317 Win=65536 Len=0 TSval=440683317 TSecr=440683275"
"1504","2.960513774","127.0.0.1","127.0.0.1","TCP","66","4444  >  43258 [ACK] Seq=1490 Ack=763 Win=65152 Len=0 TSval=440683317 TSecr=440683317"
"1511","2.964482520","127.0.0.1","127.0.0.1","TCP","66","4444  >  43272 [ACK] Seq=1490 Ack=317 Win=65536 Len=0 TSval=440683321 TSecr=440683280"
"1514","2.964538184","127.0.0.1","127.0.0.1","TCP","66","4444  >  43272 [ACK] Seq=1490 Ack=763 Win=65152 Len=0 TSval=440683321 TSecr=440683321"
"1516","2.965134491","127.0.0.1","127.0.0.1","TCP","66","43244  >  4444 [ACK] Seq=763 Ack=1836 Win=80640 Len=0 TSval=440683321 TSecr=440683321"
"1524","2.971241575","127.0.0.1","127.0.0.1","TCP","66","43230  >  4444 [ACK] Seq=763 Ack=1836 Win=80640 Len=0 TSval=440683327 TSecr=440683327"
"1526","2.972661594","127.0.0.1","127.0.0.1","TCP","66","4444  >  43280 [ACK] Seq=1490 Ack=317 Win=65536 Len=0 TSval=440683329 TSecr=440683286"
"1528","2.972820413","127.0.0.1","127.0.0.1","TCP","66","4444  >  43280 [ACK] Seq=1490 Ack=763 Win=65152 Len=0 TSval=440683329 TSecr=440683329"
"1542","2.982404070","127.0.0.1","127.0.0.1","TCP","66","43444  >  4444 [ACK] Seq=237 Ack=1490 Win=80000 Len=0 TSval=440683338 TSecr=440683338"
"1560","2.986942862","127.0.0.1","127.0.0.1","TCP","66","43252  >  4444 [ACK] Seq=763 Ack=1836 Win=80640 Len=0 TSval=440683343 TSecr=440683343"
"1571","2.990166189","127.0.0.1","127.0.0.1","TCP","66","43266  >  4444 [ACK] Seq=763 Ack=1836 Win=80640 Len=0 TSval=440683346 TSecr=440683346"
"1573","2.991050872","127.0.0.1","127.0.0.1","TCP","66","43272  >  4444 [ACK] Seq=763 Ack=1836 Win=80640 Len=0 TSval=440683347 TSecr=440683347"
"1589","2.994829230","127.0.0.1","127.0.0.1","TCP","66","43280  >  4444 [ACK] Seq=763 Ack=1836 Win=80640 Len=0 TSval=440683351 TSecr=440683351"
"1594","2.997889407","127.0.0.1","127.0.0.1","TCP","66","43258  >  4444 [ACK] Seq=763 Ack=1836 Win=80640 Len=0 TSval=440683354 TSecr=440683354"
"1599","2.999036903","127.0.0.1","127.0.0.1","TCP","66","4444  >  43446 [ACK] Seq=1 Ack=237 Win=65280 Len=0 TSval=440683355 TSecr=440683355"
"1608","3.002136052","127.0.0.1","127.0.0.1","TCP","66","4444  >  43462 [ACK] Seq=1 Ack=237 Win=65280 Len=0 TSval=440683358 TSecr=440683358"
"1612","3.004456747","127.0.0.1","127.0.0.1","TCP","66","4444  >  43366 [ACK] Seq=1490 Ack=317 Win=65536 Len=0 TSval=440683361 TSecr=440683319"
"1614","3.004524354","127.0.0.1","127.0.0.1","TCP","66","4444  >  43366 [ACK] Seq=1490 Ack=763 Win=65152 Len=0 TSval=440683361 TSecr=440683361"
"1617","3.005704815","127.0.0.1","127.0.0.1","TCP","66","43446  >  4444 [ACK] Seq=237 Ack=1490 Win=80000 Len=0 TSval=440683362 TSecr=440683362"
"1620","3.006107661","127.0.0.1","127.0.0.1","TCP","66","43366  >  4444 [ACK] Seq=763 Ack=1836 Win=80640 Len=0 TSval=440683362 TSecr=440683362"
"1624","3.008482134","127.0.0.1","127.0.0.1","TCP","66","4444  >  43374 [ACK] Seq=1490 Ack=317 Win=65536 Len=0 TSval=440683365 TSecr=440683324"
"1626","3.008549671","127.0.0.1","127.0.0.1","TCP","66","4444  >  43374 [ACK] Seq=1490 Ack=763 Win=65152 Len=0 TSval=440683365 TSecr=440683365"
"1629","3.008754516","127.0.0.1","127.0.0.1","TCP","66","4444  >  43468 [ACK] Seq=1 Ack=237 Win=65280 Len=0 TSval=440683365 TSecr=440683365"
"1643","3.012713694","127.0.0.1","127.0.0.1","TCP","66","4444  >  43484 [ACK] Seq=1 Ack=237 Win=65280 Len=0 TSval=440683369 TSecr=440683369"
"1650","3.015264656","127.0.0.1","127.0.0.1","TCP","66","4444  >  43486 [ACK] Seq=1 Ack=237 Win=65280 Len=0 TSval=440683371 TSecr=440683371"
"1652","3.015571819","127.0.0.1","127.0.0.1","TCP","66","43374  >  4444 [ACK] Seq=763 Ack=1836 Win=80640 Len=0 TSval=440683372 TSecr=440683372"
"1653","3.016490515","127.0.0.1","127.0.0.1","TCP","66","4444  >  43388 [ACK] Seq=1490 Ack=317 Win=65536 Len=0 TSval=440683373 TSecr=440683329"
"1654","3.016490515","127.0.0.1","127.0.0.1","TCP","66","43108  >  4444 [ACK] Seq=763 Ack=2195 Win=80640 Len=0 TSval=440683373 TSecr=440683332"
"1656","3.016568668","127.0.0.1","127.0.0.1","TCP","66","4444  >  43388 [ACK] Seq=1490 Ack=763 Win=65152 Len=0 TSval=440683373 TSecr=440683373"
"1659","3.018072635","127.0.0.1","127.0.0.1","TCP","66","4444  >  43492 [ACK] Seq=1 Ack=237 Win=65280 Len=0 TSval=440683374 TSecr=440683374"
"1672","3.020472042","127.0.0.1","127.0.0.1","TCP","66","43388  >  4444 [ACK] Seq=763 Ack=1836 Win=80640 Len=0 TSval=440683376 TSecr=440683376"
"1673","3.020484124","127.0.0.1","127.0.0.1","TCP","66","4444  >  43390 [ACK] Seq=1490 Ack=317 Win=65536 Len=0 TSval=440683377 TSecr=440683334"
"1675","3.020542791","127.0.0.1","127.0.0.1","TCP","66","4444  >  43390 [ACK] Seq=1490 Ack=763 Win=65152 Len=0 TSval=440683377 TSecr=440683377"
"1677","3.020628906","127.0.0.1","127.0.0.1","TCP","66","4444  >  43502 [ACK] Seq=1 Ack=237 Win=65280 Len=0 TSval=440683377 TSecr=440683377"
"1682","3.023268986","127.0.0.1","127.0.0.1","TCP","66","4444  >  43514 [ACK] Seq=1 Ack=237 Win=65280 Len=0 TSval=440683379 TSecr=440683379"
"1690","3.024482762","127.0.0.1","127.0.0.1","TCP","66","4444  >  43338 [ACK] Seq=1490 Ack=317 Win=65536 Len=0 TSval=440683381 TSecr=440683339"
"1693","3.024527391","127.0.0.1","127.0.0.1","TCP","66","4444  >  43292 [ACK] Seq=1836 Ack=763 Win=65152 Len=0 TSval=440683381 TSecr=440683337"
"1694","3.024538426","127.0.0.1","127.0.0.1","TCP","66","4444  >  43338 [ACK] Seq=1490 Ack=763 Win=65152 Len=0 TSval=440683381 TSecr=440683381"
"1697","3.026464935","127.0.0.1","127.0.0.1","TCP","66","4444  >  43520 [ACK] Seq=1 Ack=237 Win=65280 Len=0 TSval=440683383 TSecr=440683382"
"1701","3.028509197","127.0.0.1","127.0.0.1","TCP","66","4444  >  43302 [ACK] Seq=1836 Ack=763 Win=65536 Len=0 TSval=440683385 TSecr=440683342"
"1705","3.029080221","127.0.0.1","127.0.0.1","TCP","66","4444  >  43524 [ACK] Seq=1 Ack=237 Win=65280 Len=0 TSval=440683385 TSecr=440683385"
"1714","3.032217364","127.0.0.1","127.0.0.1","TCP","66","4444  >  43532 [ACK] Seq=1 Ack=237 Win=65280 Len=0 TSval=440683388 TSecr=440683388"
"1715","3.032478920","127.0.0.1","127.0.0.1","TCP","66","4444  >  43354 [ACK] Seq=1836 Ack=763 Win=65536 Len=0 TSval=440683389 TSecr=440683346"
"1725","3.034836073","127.0.0.1","127.0.0.1","TCP","66","4444  >  43536 [ACK] Seq=1 Ack=237 Win=65280 Len=0 TSval=440683391 TSecr=440683391"
"1731","3.037625753","127.0.0.1","127.0.0.1","TCP","66","4444  >  43548 [ACK] Seq=1 Ack=237 Win=65280 Len=0 TSval=440683394 TSecr=440683394"
"1737","3.041916608","127.0.0.1","127.0.0.1","TCP","66","4444  >  43556 [ACK] Seq=1 Ack=237 Win=65280 Len=0 TSval=440683398 TSecr=440683398"
"1739","3.041978558","127.0.0.1","127.0.0.1","TCP","66","43390  >  4444 [ACK] Seq=763 Ack=1836 Win=80640 Len=0 TSval=440683398 TSecr=440683398"
"1747","3.044363926","127.0.0.1","127.0.0.1","TCP","66","4444  >  43570 [ACK] Seq=1 Ack=237 Win=65280 Len=0 TSval=440683400 TSecr=440683400"
"1752","3.047181823","127.0.0.1","127.0.0.1","TCP","66","4444  >  43580 [ACK] Seq=1 Ack=237 Win=65280 Len=0 TSval=440683403 TSecr=440683403"
"1759","3.049723706","127.0.0.1","127.0.0.1","TCP","66","4444  >  43590 [ACK] Seq=1 Ack=237 Win=65280 Len=0 TSval=440683406 TSecr=440683406"
"1761","3.052528542","127.0.0.1","127.0.0.1","TCP","66","4444  >  43426 [ACK] Seq=1490 Ack=317 Win=65536 Len=0 TSval=440683409 TSecr=440683362"
"1762","3.052533361","127.0.0.1","127.0.0.1","TCP","66","4444  >  43416 [ACK] Seq=1836 Ack=763 Win=65152 Len=0 TSval=440683409 TSecr=440683368"
"1764","3.052618009","127.0.0.1","127.0.0.1","TCP","66","4444  >  43426 [ACK] Seq=1490 Ack=763 Win=65152 Len=0 TSval=440683409 TSecr=440683409"
"1766","3.052780461","127.0.0.1","127.0.0.1","TCP","66","43462  >  4444 [ACK] Seq=237 Ack=1490 Win=80000 Len=0 TSval=440683409 TSecr=440683409"
"1768","3.052865528","127.0.0.1","127.0.0.1","TCP","66","4444  >  43596 [ACK] Seq=1 Ack=237 Win=65280 Len=0 TSval=440683409 TSecr=440683409"
"1775","3.055249708","127.0.0.1","127.0.0.1","TCP","66","4444  >  43598 [ACK] Seq=1 Ack=237 Win=65280 Len=0 TSval=440683411 TSecr=440683411"
"1782","3.058177536","127.0.0.1","127.0.0.1","TCP","66","4444  >  43600 [ACK] Seq=1 Ack=237 Win=65280 Len=0 TSval=440683414 TSecr=440683414"
