"No.","Time","Source","Destination","Protocol","Length","Info","src_port","dst_port"
"24","0.349993784","127.0.0.1","127.0.0.1","TCP","66","42920  >  4444 [ACK] Seq=1 Ack=1 Win=614 Len=0 TSval=2700025859 TSecr=2700015619","42920","4444"
"25","0.350033314","127.0.0.1","127.0.0.1","TCP","66","[TCP ACKed unseen segment] 4444  >  42920 [ACK] Seq=1 Ack=2 Win=512 Len=0 TSval=2700025859 TSecr=2699995115","4444","42920"
"105","1.712095671","127.0.0.1","127.0.0.1","TLSv1.2","271","Application Data","42862","4444"
"106","1.712372731","127.0.0.1","127.0.0.1","TLSv1.2","271","[TCP Previous segment not captured] , Application Data","42920","4444"
"107","1.712622344","127.0.0.1","127.0.0.1","TLSv1.2","271","Application Data","42894","4444"
"169","1.719484320","127.0.0.1","127.0.0.1","TLSv1.2","207","Application Data","4444","42920"
"170","1.719515329","127.0.0.1","127.0.0.1","TCP","66","42920  >  4444 [ACK] Seq=207 Ack=142 Win=615 Len=0 TSval=2700027228 TSecr=2700027228","42920","4444"
"173","1.720251177","127.0.0.1","127.0.0.1","TLSv1.2","207","Application Data","4444","42862"
"174","1.720253621","127.0.0.1","127.0.0.1","TLSv1.2","207","Application Data","4444","42894"
"175","1.720281488","127.0.0.1","127.0.0.1","TCP","66","42862  >  4444 [ACK] Seq=206 Ack=142 Win=615 Len=0 TSval=2700027229 TSecr=2700027229","42862","4444"
"176","1.720282955","127.0.0.1","127.0.0.1","TCP","66","42894  >  4444 [ACK] Seq=206 Ack=142 Win=615 Len=0 TSval=2700027229 TSecr=2700027229","42894","4444"
"181","1.721058612","::1","::1","TCP","94","49282  >  4444 [SYN] Seq=0 Win=65476 Len=0 MSS=65476 SACK_PERM TSval=373966319 TSecr=0 WS=128","49282","4444"
"182","1.721078377","::1","::1","TCP","74","4444  >  49282 [RST, ACK] Seq=1 Ack=1 Win=0 Len=0","4444","49282"
"183","1.721790967","::1","::1","TCP","94","49294  >  4444 [SYN] Seq=0 Win=65476 Len=0 MSS=65476 SACK_PERM TSval=373966319 TSecr=0 WS=128","49294","4444"
"184","1.721808498","::1","::1","TCP","74","4444  >  49294 [RST, ACK] Seq=1 Ack=1 Win=0 Len=0","4444","49294"
"185","1.722424987","::1","::1","TCP","94","49304  >  4444 [SYN] Seq=0 Win=65476 Len=0 MSS=65476 SACK_PERM TSval=373966320 TSecr=0 WS=128","49304","4444"
"186","1.722440282","::1","::1","TCP","74","4444  >  49304 [RST, ACK] Seq=1 Ack=1 Win=0 Len=0","4444","49304"
"187","1.722965698","127.0.0.1","127.0.0.1","TLSv1.2","401","Application Data","42918","4444"
"188","1.723329711","127.0.0.1","127.0.0.1","TLSv1.2","401","Application Data","49422","4444"
"189","1.723354574","127.0.0.1","127.0.0.1","TCP","66","4444  >  49422 [ACK] Seq=1 Ack=336 Win=6673 Len=0 TSval=2700027232 TSecr=2700027232","4444","49422"
"190","1.723698682","127.0.0.1","127.0.0.1","TLSv1.2","401","Application Data","49448","4444"
"437","1.762201411","127.0.0.1","127.0.0.1","TLSv1.2","2397","Application Data","4444","42918"
"438","1.762235493","127.0.0.1","127.0.0.1","TCP","66","42918  >  4444 [ACK] Seq=336 Ack=2332 Win=706 Len=0 TSval=2700027271 TSecr=2700027271","42918","4444"
"441","1.764559462","127.0.0.1","127.0.0.1","TLSv1.2","2397","Application Data","4444","49422"
"442","1.764587538","127.0.0.1","127.0.0.1","TCP","66","49422  >  4444 [ACK] Seq=336 Ack=2332 Win=706 Len=0 TSval=2700027273 TSecr=2700027273","49422","4444"
"444","1.764909017","127.0.0.1","127.0.0.1","TCP","66","4444  >  49448 [ACK] Seq=1 Ack=336 Win=7696 Len=0 TSval=2700027274 TSecr=2700027232","4444","49448"
"446","1.767573881","127.0.0.1","127.0.0.1","TLSv1.2","2396","Application Data","4444","49448"
"447","1.767609221","127.0.0.1","127.0.0.1","TCP","66","49448  >  4444 [ACK] Seq=336 Ack=2331 Win=706 Len=0 TSval=2700027276 TSecr=2700027276","49448","4444"
"466","1.862306941","127.0.0.1","127.0.0.1","TLSv1.2","2841","Application Data","42920","4444"
"470","1.863485862","127.0.0.1","127.0.0.1","TLSv1.2","2840","Application Data","42894","4444"
"473","1.864229322","127.0.0.1","127.0.0.1","TLSv1.2","2840","Application Data","42862","4444"
"644","1.879608651","127.0.0.1","127.0.0.1","TLSv1.2","2193","Application Data","4444","42878"
"646","1.879627648","127.0.0.1","127.0.0.1","TCP","66","42878  >  4444 [ACK] Seq=1 Ack=2128 Win=688 Len=0 TSval=2700027388 TSecr=2700027388","42878","4444"
"652","1.880285902","127.0.0.1","127.0.0.1","TLSv1.2","2193","Application Data","4444","42934"
"653","1.880300219","127.0.0.1","127.0.0.1","TCP","66","42934  >  4444 [ACK] Seq=1 Ack=2128 Win=688 Len=0 TSval=2700027389 TSecr=2700027389","42934","4444"
"661","1.881312988","127.0.0.1","127.0.0.1","TLSv1.2","2194","Application Data","4444","42836"
"663","1.881340924","127.0.0.1","127.0.0.1","TCP","66","42836  >  4444 [ACK] Seq=1 Ack=2129 Win=688 Len=0 TSval=2700027390 TSecr=2700027390","42836","4444"
"722","1.887791814","127.0.0.1","127.0.0.1","TLSv1.2","165","Application Data","4444","42878"
"723","1.887818493","127.0.0.1","127.0.0.1","TCP","66","42878  >  4444 [ACK] Seq=1 Ack=2227 Win=688 Len=0 TSval=2700027396 TSecr=2700027396","42878","4444"
"724","1.888019427","127.0.0.1","127.0.0.1","TLSv1.2","144","Application Data","4444","42862"
"725","1.888044709","127.0.0.1","127.0.0.1","TCP","66","42862  >  4444 [ACK] Seq=2980 Ack=220 Win=615 Len=0 TSval=2700027397 TSecr=2700027397","42862","4444"
"732","1.889383567","127.0.0.1","127.0.0.1","TLSv1.2","165","Application Data","4444","42836"
"733","1.889396487","127.0.0.1","127.0.0.1","TCP","66","42836  >  4444 [ACK] Seq=1 Ack=2228 Win=688 Len=0 TSval=2700027398 TSecr=2700027398","42836","4444"
"734","1.889485535","127.0.0.1","127.0.0.1","TLSv1.2","144","Application Data","4444","42894"
"735","1.889496500","127.0.0.1","127.0.0.1","TCP","66","42894  >  4444 [ACK] Seq=2980 Ack=220 Win=615 Len=0 TSval=2700027398 TSecr=2700027398","42894","4444"
"738","1.889857160","127.0.0.1","127.0.0.1","TLSv1.2","166","Application Data","4444","42934"
"739","1.889872805","127.0.0.1","127.0.0.1","TCP","66","42934  >  4444 [ACK] Seq=1 Ack=2228 Win=688 Len=0 TSval=2700027399 TSecr=2700027398","42934","4444"
"740","1.889959617","127.0.0.1","127.0.0.1","TLSv1.2","144","Application Data","4444","42920"
"741","1.889972049","127.0.0.1","127.0.0.1","TCP","66","42920  >  4444 [ACK] Seq=2982 Ack=220 Win=615 Len=0 TSval=2700027399 TSecr=2700027399","42920","4444"
"744","1.902940667","127.0.0.1","127.0.0.1","TLSv1.2","134","Application Data","42934","4444"
"776","1.943885396","127.0.0.1","127.0.0.1","TCP","66","4444  >  42934 [ACK] Seq=2228 Ack=69 Win=512 Len=0 TSval=2700027453 TSecr=2700027412","4444","42934"
"784","1.992736227","127.0.0.1","127.0.0.1","TLSv1.2","271","Application Data","42848","4444"
"796","1.996512755","127.0.0.1","127.0.0.1","TLSv1.2","2840","Application Data","42862","4444"
"813","1.999644996","127.0.0.1","127.0.0.1","TLSv1.2","207","Application Data","4444","42848"
"814","1.999683060","127.0.0.1","127.0.0.1","TCP","66","42848  >  4444 [ACK] Seq=206 Ack=142 Win=615 Len=0 TSval=2700027508 TSecr=2700027508","42848","4444"
"822","2.001076254","::1","::1","TCP","94","49308  >  4444 [SYN] Seq=0 Win=65476 Len=0 MSS=65476 SACK_PERM TSval=373966599 TSecr=0 WS=128","49308","4444"
"823","2.001094412","::1","::1","TCP","74","4444  >  49308 [RST, ACK] Seq=1 Ack=1 Win=0 Len=0","4444","49308"
"828","2.001695606","127.0.0.1","127.0.0.1","TLSv1.2","401","Application Data","49456","4444"
"829","2.001721168","127.0.0.1","127.0.0.1","TCP","66","4444  >  49456 [ACK] Seq=1 Ack=336 Win=6697 Len=0 TSval=2700027510 TSecr=2700027510","4444","49456"
"850","2.004822819","127.0.0.1","127.0.0.1","TLSv1.2","271","Application Data","42934","4444"
"851","2.004865492","127.0.0.1","127.0.0.1","TCP","66","4444  >  42934 [ACK] Seq=2228 Ack=274 Win=511 Len=0 TSval=2700027513 TSecr=2700027513","4444","42934"
"902","2.010108128","127.0.0.1","127.0.0.1","TLSv1.2","207","Application Data","4444","42934"
"909","2.011256598","::1","::1","TCP","94","49322  >  4444 [SYN] Seq=0 Win=65476 Len=0 MSS=65476 SACK_PERM TSval=373966609 TSecr=0 WS=128","49322","4444"
"910","2.011272382","::1","::1","TCP","74","4444  >  49322 [RST, ACK] Seq=1 Ack=1 Win=0 Len=0","4444","49322"
"916","2.011919671","127.0.0.1","127.0.0.1","TLSv1.2","401","Application Data","42930","4444"
"964","2.018244707","127.0.0.1","127.0.0.1","TLSv1.2","2194","Application Data","4444","42878"
"965","2.018280396","127.0.0.1","127.0.0.1","TCP","66","42878  >  4444 [ACK] Seq=1 Ack=4355 Win=688 Len=0 TSval=2700027527 TSecr=2700027527","42878","4444"
"1047","2.029540626","127.0.0.1","127.0.0.1","TLSv1.2","166","Application Data","4444","42878"
"1048","2.029572613","127.0.0.1","127.0.0.1","TCP","66","42878  >  4444 [ACK] Seq=1 Ack=4455 Win=688 Len=0 TSval=2700027538 TSecr=2700027538","42878","4444"
"1049","2.029764886","127.0.0.1","127.0.0.1","TLSv1.2","144","Application Data","4444","42862"
"1050","2.029793032","127.0.0.1","127.0.0.1","TCP","66","42862  >  4444 [ACK] Seq=5754 Ack=298 Win=615 Len=0 TSval=2700027538 TSecr=2700027538","42862","4444"
"1083","2.039677040","127.0.0.1","127.0.0.1","TLSv1.2","2397","Application Data","4444","49456"
"1084","2.039707840","127.0.0.1","127.0.0.1","TCP","66","49456  >  4444 [ACK] Seq=336 Ack=2332 Win=706 Len=0 TSval=2700027548 TSecr=2700027548","49456","4444"
"1094","2.047728272","127.0.0.1","127.0.0.1","TLSv1.2","2396","Application Data","4444","42930"
"1095","2.047765498","127.0.0.1","127.0.0.1","TCP","66","42930  >  4444 [ACK] Seq=336 Ack=2331 Win=706 Len=0 TSval=2700027556 TSecr=2700027556","42930","4444"
"1098","2.050870990","127.0.0.1","127.0.0.1","TCP","66","42934  >  4444 [ACK] Seq=274 Ack=2369 Win=699 Len=0 TSval=2700027560 TSecr=2700027519","42934","4444"
"1118","2.112510528","127.0.0.1","127.0.0.1","TLSv1.2","2841","Application Data","42934","4444"
"1123","2.114001500","127.0.0.1","127.0.0.1","TLSv1.2","2840","Application Data","42848","4444"
"1231","2.130195038","127.0.0.1","127.0.0.1","TLSv1.2","2194","Application Data","4444","42920"
"1232","2.130223184","127.0.0.1","127.0.0.1","TCP","66","42920  >  4444 [ACK] Seq=2982 Ack=2348 Win=688 Len=0 TSval=2700027639 TSecr=2700027639","42920","4444"
"1245","2.132126289","127.0.0.1","127.0.0.1","TLSv1.2","271","Application Data","42862","4444"
"1252","2.133547978","127.0.0.1","127.0.0.1","TLSv1.2","2194","Application Data","4444","42836"
"1253","2.133573680","127.0.0.1","127.0.0.1","TCP","66","42836  >  4444 [ACK] Seq=1 Ack=4356 Win=688 Len=0 TSval=2700027642 TSecr=2700027642","42836","4444"
"1294","2.137665192","127.0.0.1","127.0.0.1","TLSv1.2","207","Application Data","4444","42862"
"1295","2.137715128","127.0.0.1","127.0.0.1","TCP","66","42862  >  4444 [ACK] Seq=5959 Ack=439 Win=615 Len=0 TSval=2700027646 TSecr=2700027646","42862","4444"
"1303","2.139203376","::1","::1","TCP","94","49336  >  4444 [SYN] Seq=0 Win=65476 Len=0 MSS=65476 SACK_PERM TSval=373966737 TSecr=0 WS=128","49336","4444"
"1304","2.139219859","::1","::1","TCP","74","4444  >  49336 [RST, ACK] Seq=1 Ack=1 Win=0 Len=0","4444","49336"
"1306","2.139494125","127.0.0.1","127.0.0.1","TLSv1.2","165","Application Data","4444","42920"
"1307","2.139525065","127.0.0.1","127.0.0.1","TCP","66","42920  >  4444 [ACK] Seq=2982 Ack=2447 Win=688 Len=0 TSval=2700027648 TSecr=2700027648","42920","4444"
"1308","2.139716709","127.0.0.1","127.0.0.1","TLSv1.2","144","Application Data","4444","42934"
"1309","2.139744436","127.0.0.1","127.0.0.1","TCP","66","42934  >  4444 [ACK] Seq=3049 Ack=2447 Win=699 Len=0 TSval=2700027648 TSecr=2700027648","42934","4444"
"1310","2.139782919","127.0.0.1","127.0.0.1","TLSv1.2","401","Application Data","49422","4444"
"1311","2.139807224","127.0.0.1","127.0.0.1","TCP","66","4444  >  49422 [ACK] Seq=2332 Ack=671 Win=7696 Len=0 TSval=2700027648 TSecr=2700027648","4444","49422"
"1336","2.145291650","127.0.0.1","127.0.0.1","TLSv1.2","166","Application Data","4444","42836"
"1337","2.145310228","127.0.0.1","127.0.0.1","TCP","66","42836  >  4444 [ACK] Seq=1 Ack=4456 Win=688 Len=0 TSval=2700027654 TSecr=2700027654","42836","4444"
"1338","2.145427701","127.0.0.1","127.0.0.1","TLSv1.2","144","Application Data","4444","42848"
"1339","2.145445370","127.0.0.1","127.0.0.1","TCP","66","42848  >  4444 [ACK] Seq=2980 Ack=220 Win=615 Len=0 TSval=2700027654 TSecr=2700027654","42848","4444"
"1404","2.167208402","127.0.0.1","127.0.0.1","TLSv1.2","135","Application Data","42920","4444"
"1421","2.174178352","127.0.0.1","127.0.0.1","TLSv1.2","2394","Application Data","4444","49422"
"1422","2.174206568","127.0.0.1","127.0.0.1","TCP","66","49422  >  4444 [ACK] Seq=671 Ack=4660 Win=706 Len=0 TSval=2700027683 TSecr=2700027683","49422","4444"
"1437","2.195571155","127.0.0.1","127.0.0.1","TLSv1.2","135","Application Data","42836","4444"
"1466","2.207895905","127.0.0.1","127.0.0.1","TCP","66","4444  >  42920 [ACK] Seq=2447 Ack=3051 Win=739 Len=0 TSval=2700027717 TSecr=2700027676","4444","42920"
"1467","2.207915950","127.0.0.1","127.0.0.1","TLSv1.2","637","Application Data","42920","4444"
"1468","2.207932223","127.0.0.1","127.0.0.1","TCP","66","4444  >  42920 [ACK] Seq=2447 Ack=3622 Win=752 Len=0 TSval=2700027717 TSecr=2700027717","4444","42920"
"1473","2.209579499","127.0.0.1","127.0.0.1","TLSv1.2","2840","Application Data","42862","4444"
"1585","2.225020708","127.0.0.1","127.0.0.1","TLSv1.2","539","Application Data","4444","42934"
"1586","2.225036212","127.0.0.1","127.0.0.1","TCP","66","42934  >  4444 [ACK] Seq=3049 Ack=2920 Win=697 Len=0 TSval=2700027734 TSecr=2700027734","42934","4444"
"1593","2.226428847","127.0.0.1","127.0.0.1","TLSv1.2","2193","Application Data","4444","42864"
"1594","2.226443514","127.0.0.1","127.0.0.1","TCP","66","42864  >  4444 [ACK] Seq=1 Ack=2128 Win=688 Len=0 TSval=2700027735 TSecr=2700027735","42864","4444"
"1636","2.230548435","127.0.0.1","127.0.0.1","TLSv1.2","166","Application Data","4444","42934"
"1637","2.230560937","127.0.0.1","127.0.0.1","TCP","66","42934  >  4444 [ACK] Seq=3049 Ack=3020 Win=699 Len=0 TSval=2700027739 TSecr=2700027739","42934","4444"
"1639","2.230657597","127.0.0.1","127.0.0.1","TLSv1.2","144","Application Data","4444","42920"
"1642","2.230979077","127.0.0.1","127.0.0.1","TLSv1.2","165","Application Data","4444","42864"
"1643","2.230991369","127.0.0.1","127.0.0.1","TCP","66","42864  >  4444 [ACK] Seq=1 Ack=2227 Win=688 Len=0 TSval=2700027740 TSecr=2700027740","42864","4444"
"1644","2.231064981","127.0.0.1","127.0.0.1","TLSv1.2","144","Application Data","4444","42862"
"1645","2.231075388","127.0.0.1","127.0.0.1","TCP","66","42862  >  4444 [ACK] Seq=8733 Ack=517 Win=615 Len=0 TSval=2700027740 TSecr=2700027740","42862","4444"
"1648","2.235876557","127.0.0.1","127.0.0.1","TCP","66","4444  >  42836 [ACK] Seq=4456 Ack=70 Win=512 Len=0 TSval=2700027745 TSecr=2700027704","4444","42836"
"1649","2.235897439","127.0.0.1","127.0.0.1","TLSv1.2","271","Application Data","42836","4444"
"1650","2.235912315","127.0.0.1","127.0.0.1","TCP","66","4444  >  42836 [ACK] Seq=4456 Ack=275 Win=511 Len=0 TSval=2700027745 TSecr=2700027745","4444","42836"
"1668","2.239618932","127.0.0.1","127.0.0.1","TLSv1.2","207","Application Data","4444","42836"
"1669","2.239650360","127.0.0.1","127.0.0.1","TCP","66","42836  >  4444 [ACK] Seq=275 Ack=4597 Win=699 Len=0 TSval=2700027748 TSecr=2700027748","42836","4444"
"1672","2.240783046","::1","::1","TCP","94","49346  >  4444 [SYN] Seq=0 Win=65476 Len=0 MSS=65476 SACK_PERM TSval=373966838 TSecr=0 WS=128","49346","4444"
"1673","2.240798970","::1","::1","TCP","74","4444  >  49346 [RST, ACK] Seq=1 Ack=1 Win=0 Len=0","4444","49346"
"1674","2.241341637","127.0.0.1","127.0.0.1","TLSv1.2","401","Application Data","49410","4444"
"1751","2.262154547","127.0.0.1","127.0.0.1","TLSv1.2","2396","Application Data","4444","49410"
"1752","2.262187373","127.0.0.1","127.0.0.1","TCP","66","49410  >  4444 [ACK] Seq=336 Ack=2331 Win=706 Len=0 TSval=2700027771 TSecr=2700027771","49410","4444"
"1761","2.270867526","127.0.0.1","127.0.0.1","TCP","66","42920  >  4444 [ACK] Seq=3622 Ack=2525 Win=688 Len=0 TSval=2700027780 TSecr=2700027739","42920","4444"
"1768","2.293782519","127.0.0.1","127.0.0.1","TLSv1.2","2840","Application Data","42836","4444"
"1832","2.309073359","127.0.0.1","127.0.0.1","TLSv1.2","2193","Application Data","4444","42894"
"1833","2.309108699","127.0.0.1","127.0.0.1","TCP","66","42894  >  4444 [ACK] Seq=2980 Ack=2347 Win=688 Len=0 TSval=2700027818 TSecr=2700027818","42894","4444"
"1857","2.318321672","127.0.0.1","127.0.0.1","TLSv1.2","166","Application Data","4444","42894"
"1858","2.318351215","127.0.0.1","127.0.0.1","TCP","66","42894  >  4444 [ACK] Seq=2980 Ack=2447 Win=688 Len=0 TSval=2700027827 TSecr=2700027827","42894","4444"
"1859","2.318543069","127.0.0.1","127.0.0.1","TLSv1.2","144","Application Data","4444","42836"
"1860","2.318579316","127.0.0.1","127.0.0.1","TCP","66","42836  >  4444 [ACK] Seq=3049 Ack=4675 Win=699 Len=0 TSval=2700027827 TSecr=2700027827","42836","4444"
"1865","2.339015363","127.0.0.1","127.0.0.1","TLSv1.2","135","Application Data","42836","4444"
"1869","2.339986995","127.0.0.1","127.0.0.1","TLSv1.2","135","Application Data","42934","4444"
"1875","2.341162144","127.0.0.1","127.0.0.1","TLSv1.2","2840","Application Data","42862","4444"
"1968","2.358770248","127.0.0.1","127.0.0.1","TLSv1.2","2193","Application Data","4444","42878"
"1969","2.358803632","127.0.0.1","127.0.0.1","TCP","66","42878  >  4444 [ACK] Seq=1 Ack=6582 Win=688 Len=0 TSval=2700027867 TSecr=2700027867","42878","4444"
"1995","2.367131576","127.0.0.1","127.0.0.1","TLSv1.2","165","Application Data","4444","42878"
"1996","2.367166846","127.0.0.1","127.0.0.1","TCP","66","42878  >  4444 [ACK] Seq=1 Ack=6681 Win=688 Len=0 TSval=2700027876 TSecr=2700027876","42878","4444"
"1998","2.367385799","127.0.0.1","127.0.0.1","TLSv1.2","144","Application Data","4444","42862"
"1999","2.367412478","127.0.0.1","127.0.0.1","TCP","66","42862  >  4444 [ACK] Seq=11507 Ack=595 Win=615 Len=0 TSval=2700027876 TSecr=2700027876","42862","4444"
"2004","2.379898981","127.0.0.1","127.0.0.1","TCP","66","4444  >  42836 [ACK] Seq=4675 Ack=3118 Win=739 Len=0 TSval=2700027889 TSecr=2700027848","4444","42836"
"2005","2.379929502","127.0.0.1","127.0.0.1","TLSv1.2","271","Application Data","42836","4444"
"2006","2.379969591","127.0.0.1","127.0.0.1","TCP","66","4444  >  42836 [ACK] Seq=4675 Ack=3323 Win=754 Len=0 TSval=2700027889 TSecr=2700027889","4444","42836"
"2008","2.380914334","127.0.0.1","127.0.0.1","TCP","66","4444  >  42934 [ACK] Seq=3020 Ack=3118 Win=739 Len=0 TSval=2700027890 TSecr=2700027849","4444","42934"
"2009","2.380945762","127.0.0.1","127.0.0.1","TLSv1.2","637","Application Data","42934","4444"
"2011","2.380972023","127.0.0.1","127.0.0.1","TCP","66","4444  >  42934 [ACK] Seq=3020 Ack=3689 Win=752 Len=0 TSval=2700027890 TSecr=2700027890","4444","42934"
"2042","2.385544461","127.0.0.1","127.0.0.1","TLSv1.2","207","Application Data","4444","42836"
"2052","2.387128531","::1","::1","TCP","94","49348  >  4444 [SYN] Seq=0 Win=65476 Len=0 MSS=65476 SACK_PERM TSval=373966985 TSecr=0 WS=128","49348","4444"
"2053","2.387152068","::1","::1","TCP","74","4444  >  49348 [RST, ACK] Seq=1 Ack=1 Win=0 Len=0","4444","49348"
"2058","2.387930030","127.0.0.1","127.0.0.1","TLSv1.2","401","Application Data","49410","4444"
"2145","2.404237899","127.0.0.1","127.0.0.1","TLSv1.2","538","Application Data","4444","42920"
"2146","2.404270235","127.0.0.1","127.0.0.1","TCP","66","42920  >  4444 [ACK] Seq=3622 Ack=2997 Win=697 Len=0 TSval=2700027913 TSecr=2700027913","42920","4444"
"2196","2.414548916","127.0.0.1","127.0.0.1","TLSv1.2","165","Application Data","4444","42920"
"2197","2.414582579","127.0.0.1","127.0.0.1","TCP","66","42920  >  4444 [ACK] Seq=3622 Ack=3096 Win=697 Len=0 TSval=2700027923 TSecr=2700027923","42920","4444"
"2198","2.414810401","127.0.0.1","127.0.0.1","TLSv1.2","144","Application Data","4444","42934"
"2199","2.414863341","127.0.0.1","127.0.0.1","TCP","66","42934  >  4444 [ACK] Seq=3689 Ack=3098 Win=699 Len=0 TSval=2700027923 TSecr=2700027923","42934","4444"
"2208","2.421349082","127.0.0.1","127.0.0.1","TLSv1.2","2394","Application Data","4444","49410"
"2209","2.421388123","127.0.0.1","127.0.0.1","TCP","66","49410  >  4444 [ACK] Seq=671 Ack=4659 Win=706 Len=0 TSval=2700027930 TSecr=2700027930","49410","4444"
"2212","2.425873609","127.0.0.1","127.0.0.1","TCP","66","42836  >  4444 [ACK] Seq=3323 Ack=4816 Win=699 Len=0 TSval=2700027935 TSecr=2700027894","42836","4444"
"2231","2.473525126","127.0.0.1","127.0.0.1","TLSv1.2","2841","Application Data","42836","4444"
"2232","2.473745057","127.0.0.1","127.0.0.1","TLSv1.2","2840","Application Data","42862","4444"
"2349","2.496413720","127.0.0.1","127.0.0.1","TLSv1.2","2194","Application Data","4444","42878"
"2350","2.496448780","127.0.0.1","127.0.0.1","TCP","66","42878  >  4444 [ACK] Seq=1 Ack=8809 Win=688 Len=0 TSval=2700028005 TSecr=2700028005","42878","4444"
"2353","2.498214298","127.0.0.1","127.0.0.1","TLSv1.2","2194","Application Data","4444","42848"
"2354","2.498248101","127.0.0.1","127.0.0.1","TCP","66","42848  >  4444 [ACK] Seq=2980 Ack=2348 Win=688 Len=0 TSval=2700028007 TSecr=2700028007","42848","4444"
"2399","2.506632686","127.0.0.1","127.0.0.1","TLSv1.2","166","Application Data","4444","42878"
"2400","2.506664115","127.0.0.1","127.0.0.1","TCP","66","42878  >  4444 [ACK] Seq=1 Ack=8909 Win=688 Len=0 TSval=2700028015 TSecr=2700028015","42878","4444"
"2401","2.506926089","127.0.0.1","127.0.0.1","TLSv1.2","144","Application Data","4444","42862"
"2402","2.506957448","127.0.0.1","127.0.0.1","TCP","66","42862  >  4444 [ACK] Seq=14281 Ack=673 Win=615 Len=0 TSval=2700028016 TSecr=2700028016","42862","4444"
"2405","2.507880121","127.0.0.1","127.0.0.1","TLSv1.2","165","Application Data","4444","42848"
"2406","2.507911969","127.0.0.1","127.0.0.1","TCP","66","42848  >  4444 [ACK] Seq=2980 Ack=2447 Win=688 Len=0 TSval=2700028017 TSecr=2700028016","42848","4444"
"2407","2.508152991","127.0.0.1","127.0.0.1","TLSv1.2","144","Application Data","4444","42836"
"2408","2.508183512","127.0.0.1","127.0.0.1","TCP","66","42836  >  4444 [ACK] Seq=6098 Ack=4894 Win=699 Len=0 TSval=2700028017 TSecr=2700028017","42836","4444"
"2417","2.525201387","127.0.0.1","127.0.0.1","TLSv1.2","134","Application Data","42920","4444"
"2441","2.565878973","127.0.0.1","127.0.0.1","TCP","66","4444  >  42920 [ACK] Seq=3096 Ack=3690 Win=752 Len=0 TSval=2700028075 TSecr=2700028034","4444","42920"
"2442","2.565908027","127.0.0.1","127.0.0.1","TLSv1.2","637","Application Data","42920","4444"
"2443","2.565939036","127.0.0.1","127.0.0.1","TCP","66","4444  >  42920 [ACK] Seq=3096 Ack=4261 Win=752 Len=0 TSval=2700028075 TSecr=2700028075","4444","42920"
"2510","2.582272746","127.0.0.1","127.0.0.1","TLSv1.2","539","Application Data","4444","42934"
"2511","2.582302778","127.0.0.1","127.0.0.1","TCP","66","42934  >  4444 [ACK] Seq=3689 Ack=3571 Win=697 Len=0 TSval=2700028091 TSecr=2700028091","42934","4444"
"2535","2.589015573","127.0.0.1","127.0.0.1","TLSv1.2","165","Application Data","4444","42934"
"2536","2.589043160","127.0.0.1","127.0.0.1","TCP","66","42934  >  4444 [ACK] Seq=3689 Ack=3670 Win=699 Len=0 TSval=2700028098 TSecr=2700028098","42934","4444"
"2537","2.589230195","127.0.0.1","127.0.0.1","TLSv1.2","144","Application Data","4444","42920"
"2538","2.589251706","127.0.0.1","127.0.0.1","TCP","66","42920  >  4444 [ACK] Seq=4261 Ack=3174 Win=697 Len=0 TSval=2700028098 TSecr=2700028098","42920","4444"
"2544","2.614681893","127.0.0.1","127.0.0.1","TLSv1.2","2840","Application Data","42862","4444"
"2603","2.633233483","127.0.0.1","127.0.0.1","TLSv1.2","2193","Application Data","4444","42878"
"2604","2.633264004","127.0.0.1","127.0.0.1","TCP","66","42878  >  4444 [ACK] Seq=1 Ack=11036 Win=688 Len=0 TSval=2700028142 TSecr=2700028142","42878","4444"
"2607","2.634065223","127.0.0.1","127.0.0.1","TLSv1.2","134","Application Data","42894","4444"
"2648","2.643392107","127.0.0.1","127.0.0.1","TLSv1.2","166","Application Data","4444","42878"
"2649","2.643421719","127.0.0.1","127.0.0.1","TCP","66","42878  >  4444 [ACK] Seq=1 Ack=11136 Win=688 Len=0 TSval=2700028152 TSecr=2700028152","42878","4444"
"2650","2.643601700","127.0.0.1","127.0.0.1","TLSv1.2","144","Application Data","4444","42862"
"2651","2.643629357","127.0.0.1","127.0.0.1","TCP","66","42862  >  4444 [ACK] Seq=17055 Ack=751 Win=615 Len=0 TSval=2700028152 TSecr=2700028152","42862","4444"
"2657","2.666871418","127.0.0.1","127.0.0.1","TLSv1.2","134","Application Data","42864","4444"
"2678","2.674880536","127.0.0.1","127.0.0.1","TCP","66","4444  >  42894 [ACK] Seq=2447 Ack=3048 Win=739 Len=0 TSval=2700028184 TSecr=2700028143","4444","42894"
"2679","2.674914269","127.0.0.1","127.0.0.1","TLSv1.2","636","Application Data","42894","4444"
"2680","2.674949050","127.0.0.1","127.0.0.1","TCP","66","4444  >  42894 [ACK] Seq=2447 Ack=3618 Win=752 Len=0 TSval=2700028184 TSecr=2700028184","4444","42894"
"2743","2.690659706","127.0.0.1","127.0.0.1","TLSv1.2","539","Application Data","4444","42836"
"2744","2.690688341","127.0.0.1","127.0.0.1","TCP","66","42836  >  4444 [ACK] Seq=6098 Ack=5367 Win=697 Len=0 TSval=2700028199 TSecr=2700028199","42836","4444"
"2768","2.698584387","127.0.0.1","127.0.0.1","TLSv1.2","165","Application Data","4444","42836"
"2769","2.698616304","127.0.0.1","127.0.0.1","TCP","66","42836  >  4444 [ACK] Seq=6098 Ack=5466 Win=699 Len=0 TSval=2700028207 TSecr=2700028207","42836","4444"
"2770","2.698903282","127.0.0.1","127.0.0.1","TLSv1.2","144","Application Data","4444","42894"
"2771","2.698932615","127.0.0.1","127.0.0.1","TCP","66","42894  >  4444 [ACK] Seq=3618 Ack=2525 Win=688 Len=0 TSval=2700028208 TSecr=2700028208","42894","4444"
"2774","2.700604825","127.0.0.1","127.0.0.1","TLSv1.2","135","Application Data","42934","4444"
"2794","2.707889899","127.0.0.1","127.0.0.1","TCP","66","4444  >  42864 [ACK] Seq=2227 Ack=69 Win=512 Len=0 TSval=2700028217 TSecr=2700028175","4444","42864"
"2795","2.707915670","127.0.0.1","127.0.0.1","TLSv1.2","271","Application Data","42864","4444"
"2796","2.707940045","127.0.0.1","127.0.0.1","TCP","66","4444  >  42864 [ACK] Seq=2227 Ack=274 Win=511 Len=0 TSval=2700028217 TSecr=2700028217","4444","42864"
"2816","2.712637080","127.0.0.1","127.0.0.1","TLSv1.2","207","Application Data","4444","42864"
"2817","2.712665436","127.0.0.1","127.0.0.1","TCP","66","42864  >  4444 [ACK] Seq=274 Ack=2368 Win=699 Len=0 TSval=2700028221 TSecr=2700028221","42864","4444"
"2821","2.713990116","::1","::1","TCP","94","49358  >  4444 [SYN] Seq=0 Win=65476 Len=0 MSS=65476 SACK_PERM TSval=373967312 TSecr=0 WS=128","49358","4444"
"2822","2.714010998","::1","::1","TCP","74","4444  >  49358 [RST, ACK] Seq=1 Ack=1 Win=0 Len=0","4444","49358"
"2823","2.714605627","127.0.0.1","127.0.0.1","TLSv1.2","401","Application Data","49436","4444"
"2910","2.738785585","127.0.0.1","127.0.0.1","TLSv1.2","2396","Application Data","4444","49436"
"2911","2.738812125","127.0.0.1","127.0.0.1","TCP","66","49436  >  4444 [ACK] Seq=336 Ack=2331 Win=706 Len=0 TSval=2700028247 TSecr=2700028247","49436","4444"
"2914","2.740918817","127.0.0.1","127.0.0.1","TCP","66","4444  >  42934 [ACK] Seq=3670 Ack=3758 Win=752 Len=0 TSval=2700028250 TSecr=2700028209","4444","42934"
"2915","2.740967008","127.0.0.1","127.0.0.1","TLSv1.2","637","Application Data","42934","4444"
"2916","2.740995643","127.0.0.1","127.0.0.1","TCP","66","4444  >  42934 [ACK] Seq=3670 Ack=4329 Win=752 Len=0 TSval=2700028250 TSecr=2700028250","4444","42934"
"2975","2.755767702","127.0.0.1","127.0.0.1","TLSv1.2","539","Application Data","4444","42920"
"2976","2.755798711","127.0.0.1","127.0.0.1","TCP","66","42920  >  4444 [ACK] Seq=4261 Ack=3647 Win=697 Len=0 TSval=2700028264 TSecr=2700028264","42920","4444"
"2999","2.766550008","127.0.0.1","127.0.0.1","TLSv1.2","165","Application Data","4444","42920"
"3000","2.766579062","127.0.0.1","127.0.0.1","TCP","66","42920  >  4444 [ACK] Seq=4261 Ack=3746 Win=697 Len=0 TSval=2700028275 TSecr=2700028275","42920","4444"
"3001","2.766750662","127.0.0.1","127.0.0.1","TLSv1.2","144","Application Data","4444","42934"
"3002","2.766773710","127.0.0.1","127.0.0.1","TCP","66","42934  >  4444 [ACK] Seq=4329 Ack=3748 Win=699 Len=0 TSval=2700028275 TSecr=2700028275","42934","4444"
"3019","2.796777453","127.0.0.1","127.0.0.1","TLSv1.2","2840","Application Data","42864","4444"
"3079","2.810929671","127.0.0.1","127.0.0.1","TLSv1.2","2193","Application Data","4444","42862"
"3080","2.810946922","127.0.0.1","127.0.0.1","TCP","66","42862  >  4444 [ACK] Seq=17055 Ack=2878 Win=688 Len=0 TSval=2700028320 TSecr=2700028320","42862","4444"
"3104","2.815658694","127.0.0.1","127.0.0.1","TLSv1.2","166","Application Data","4444","42862"
"3105","2.815671544","127.0.0.1","127.0.0.1","TCP","66","42862  >  4444 [ACK] Seq=17055 Ack=2978 Win=688 Len=0 TSval=2700028324 TSecr=2700028324","42862","4444"
"3106","2.815767436","127.0.0.1","127.0.0.1","TLSv1.2","144","Application Data","4444","42864"
"3107","2.815780776","127.0.0.1","127.0.0.1","TCP","66","42864  >  4444 [ACK] Seq=3048 Ack=2446 Win=699 Len=0 TSval=2700028324 TSecr=2700028324","42864","4444"
"3122","2.887012734","127.0.0.1","127.0.0.1","TLSv1.2","135","Application Data","42920","4444"
"3143","2.901556762","127.0.0.1","127.0.0.1","TLSv1.2","271","Application Data","42894","4444"
"3163","2.906286902","127.0.0.1","127.0.0.1","TLSv1.2","207","Application Data","4444","42894"
"3164","2.906320775","127.0.0.1","127.0.0.1","TCP","66","42894  >  4444 [ACK] Seq=3823 Ack=2666 Win=699 Len=0 TSval=2700028415 TSecr=2700028415","42894","4444"
"3167","2.907601734","::1","::1","TCP","94","49362  >  4444 [SYN] Seq=0 Win=65476 Len=0 MSS=65476 SACK_PERM TSval=373967505 TSecr=0 WS=128","49362","4444"
"3168","2.907622267","::1","::1","TCP","74","4444  >  49362 [RST, ACK] Seq=1 Ack=1 Win=0 Len=0","4444","49362"
"3169","2.908251328","127.0.0.1","127.0.0.1","TLSv1.2","401","Application Data","49448","4444"
"3170","2.908285480","127.0.0.1","127.0.0.1","TCP","66","4444  >  49448 [ACK] Seq=2331 Ack=671 Win=8720 Len=0 TSval=2700028417 TSecr=2700028417","4444","49448"
"3249","2.927883781","127.0.0.1","127.0.0.1","TCP","66","4444  >  42920 [ACK] Seq=3746 Ack=4330 Win=752 Len=0 TSval=2700028437 TSecr=2700028396","4444","42920"
"3250","2.927909063","127.0.0.1","127.0.0.1","TLSv1.2","637","Application Data","42920","4444"
"3251","2.927937768","127.0.0.1","127.0.0.1","TCP","66","4444  >  42920 [ACK] Seq=3746 Ack=4901 Win=752 Len=0 TSval=2700028437 TSecr=2700028437","4444","42920"
"3280","2.936758512","127.0.0.1","127.0.0.1","TLSv1.2","2392","Application Data","4444","49448"
"3281","2.936791198","127.0.0.1","127.0.0.1","TCP","66","49448  >  4444 [ACK] Seq=671 Ack=4657 Win=706 Len=0 TSval=2700028445 TSecr=2700028445","49448","4444"
"3321","2.949246272","127.0.0.1","127.0.0.1","TLSv1.2","538","Application Data","4444","42934"
"3322","2.949279168","127.0.0.1","127.0.0.1","TCP","66","42934  >  4444 [ACK] Seq=4329 Ack=4220 Win=697 Len=0 TSval=2700028458 TSecr=2700028458","42934","4444"
"3345","2.957019397","127.0.0.1","127.0.0.1","TLSv1.2","165","Application Data","4444","42934"
"3346","2.957050407","127.0.0.1","127.0.0.1","TCP","66","42934  >  4444 [ACK] Seq=4329 Ack=4319 Win=699 Len=0 TSval=2700028466 TSecr=2700028466","42934","4444"
"3347","2.957236115","127.0.0.1","127.0.0.1","TLSv1.2","144","Application Data","4444","42920"
"3348","2.957260000","127.0.0.1","127.0.0.1","TCP","66","42920  >  4444 [ACK] Seq=4901 Ack=3824 Win=697 Len=0 TSval=2700028466 TSecr=2700028466","42920","4444"
"3367","2.999110152","127.0.0.1","127.0.0.1","TLSv1.2","2841","Application Data","42894","4444"
"3427","3.013241906","127.0.0.1","127.0.0.1","TLSv1.2","2193","Application Data","4444","42902"
"3428","3.013258458","127.0.0.1","127.0.0.1","TCP","66","42902  >  4444 [ACK] Seq=1 Ack=2128 Win=688 Len=0 TSval=2700028522 TSecr=2700028522","42902","4444"
"3452","3.017984967","127.0.0.1","127.0.0.1","TLSv1.2","166","Application Data","4444","42902"
"3453","3.017997259","127.0.0.1","127.0.0.1","TCP","66","42902  >  4444 [ACK] Seq=1 Ack=2228 Win=688 Len=0 TSval=2700028527 TSecr=2700028527","42902","4444"
"3454","3.018108027","127.0.0.1","127.0.0.1","TLSv1.2","144","Application Data","4444","42894"
"3455","3.018125208","127.0.0.1","127.0.0.1","TCP","66","42894  >  4444 [ACK] Seq=6598 Ack=2744 Win=699 Len=0 TSval=2700028527 TSecr=2700028527","42894","4444"
"3458","3.025549615","127.0.0.1","127.0.0.1","TLSv1.2","135","Application Data","42836","4444"
"3484","3.065888821","127.0.0.1","127.0.0.1","TCP","66","4444  >  42836 [ACK] Seq=5466 Ack=6167 Win=754 Len=0 TSval=2700028575 TSecr=2700028534","4444","42836"
"3485","3.065920319","127.0.0.1","127.0.0.1","TLSv1.2","636","Application Data","42836","4444"
"3486","3.065949862","127.0.0.1","127.0.0.1","TCP","66","4444  >  42836 [ACK] Seq=5466 Ack=6737 Win=752 Len=0 TSval=2700028575 TSecr=2700028575","4444","42836"
"3549","3.081738810","127.0.0.1","127.0.0.1","TLSv1.2","538","Application Data","4444","42894"
"3550","3.081767445","127.0.0.1","127.0.0.1","TCP","66","42894  >  4444 [ACK] Seq=6598 Ack=3216 Win=697 Len=0 TSval=2700028590 TSecr=2700028590","42894","4444"
"3578","3.089016481","127.0.0.1","127.0.0.1","TLSv1.2","166","Application Data","4444","42894"
"3579","3.089044068","127.0.0.1","127.0.0.1","TCP","66","42894  >  4444 [ACK] Seq=6598 Ack=3316 Win=699 Len=0 TSval=2700028598 TSecr=2700028598","42894","4444"
"3580","3.089231801","127.0.0.1","127.0.0.1","TLSv1.2","144","Application Data","4444","42836"
"3581","3.089255687","127.0.0.1","127.0.0.1","TCP","66","42836  >  4444 [ACK] Seq=6737 Ack=5544 Win=699 Len=0 TSval=2700028598 TSecr=2700028598","42836","4444"
"3584","3.095108666","127.0.0.1","127.0.0.1","TLSv1.2","134","Application Data","42934","4444"
"3610","3.135907775","127.0.0.1","127.0.0.1","TCP","66","4444  >  42934 [ACK] Seq=4319 Ack=4397 Win=752 Len=0 TSval=2700028645 TSecr=2700028604","4444","42934"
"3613","3.141946043","127.0.0.1","127.0.0.1","TLSv1.2","134","Application Data","42878","4444"
"3634","3.182887489","127.0.0.1","127.0.0.1","TCP","66","4444  >  42878 [ACK] Seq=11136 Ack=69 Win=512 Len=0 TSval=2700028692 TSecr=2700028651","4444","42878"
"3635","3.182915635","127.0.0.1","127.0.0.1","TLSv1.2","271","Application Data","42878","4444"
"3636","3.182947064","127.0.0.1","127.0.0.1","TCP","66","4444  >  42878 [ACK] Seq=11136 Ack=274 Win=511 Len=0 TSval=2700028692 TSecr=2700028692","4444","42878"
"3657","3.187379261","127.0.0.1","127.0.0.1","TLSv1.2","207","Application Data","4444","42878"
"3658","3.187407896","127.0.0.1","127.0.0.1","TCP","66","42878  >  4444 [ACK] Seq=274 Ack=11277 Win=699 Len=0 TSval=2700028696 TSecr=2700028696","42878","4444"
"3664","3.188620201","::1","::1","TCP","94","49368  >  4444 [SYN] Seq=0 Win=65476 Len=0 MSS=65476 SACK_PERM TSval=373967786 TSecr=0 WS=128","49368","4444"
"3665","3.188642131","::1","::1","TCP","74","4444  >  49368 [RST, ACK] Seq=1 Ack=1 Win=0 Len=0","4444","49368"
"3669","3.189308906","127.0.0.1","127.0.0.1","TLSv1.2","401","Application Data","49454","4444"
"3670","3.189348366","127.0.0.1","127.0.0.1","TCP","66","4444  >  49454 [ACK] Seq=1 Ack=336 Win=6697 Len=0 TSval=2700028698 TSecr=2700028698","4444","49454"
"3724","3.203419498","127.0.0.1","127.0.0.1","TLSv1.2","134","Application Data","42894","4444"
"3731","3.204607429","127.0.0.1","127.0.0.1","TLSv1.2","637","Application Data","42934","4444"
"3732","3.204640813","127.0.0.1","127.0.0.1","TCP","66","4444  >  42934 [ACK] Seq=4319 Ack=4968 Win=752 Len=0 TSval=2700028713 TSecr=2700028713","4444","42934"
"3815","3.221342167","127.0.0.1","127.0.0.1","TLSv1.2","2400","Application Data","4444","49454"
"3816","3.221370523","127.0.0.1","127.0.0.1","TCP","66","49454  >  4444 [ACK] Seq=336 Ack=2335 Win=706 Len=0 TSval=2700028730 TSecr=2700028730","49454","4444"
"3835","3.225726034","127.0.0.1","127.0.0.1","TLSv1.2","538","Application Data","4444","42920"
"3836","3.225746358","127.0.0.1","127.0.0.1","TCP","66","42920  >  4444 [ACK] Seq=4901 Ack=4296 Win=697 Len=0 TSval=2700028734 TSecr=2700028734","42920","4444"
"3859","3.230268651","127.0.0.1","127.0.0.1","TLSv1.2","165","Application Data","4444","42920"
"3860","3.230294841","127.0.0.1","127.0.0.1","TCP","66","42920  >  4444 [ACK] Seq=4901 Ack=4395 Win=697 Len=0 TSval=2700028739 TSecr=2700028739","42920","4444"
"3861","3.230459527","127.0.0.1","127.0.0.1","TLSv1.2","144","Application Data","4444","42934"
"3862","3.230482784","127.0.0.1","127.0.0.1","TCP","66","42934  >  4444 [ACK] Seq=4968 Ack=4397 Win=699 Len=0 TSval=2700028739 TSecr=2700028739","42934","4444"
"3865","3.243898386","127.0.0.1","127.0.0.1","TCP","66","4444  >  42894 [ACK] Seq=3316 Ack=6666 Win=754 Len=0 TSval=2700028753 TSecr=2700028712","4444","42894"
"3866","3.243930862","127.0.0.1","127.0.0.1","TLSv1.2","636","Application Data","42894","4444"
"3867","3.243957961","127.0.0.1","127.0.0.1","TCP","66","4444  >  42894 [ACK] Seq=3316 Ack=7236 Win=752 Len=0 TSval=2700028753 TSecr=2700028753","4444","42894"
"3927","3.259228896","127.0.0.1","127.0.0.1","TLSv1.2","538","Application Data","4444","42836"
"3928","3.259246915","127.0.0.1","127.0.0.1","TCP","66","42836  >  4444 [ACK] Seq=6737 Ack=6016 Win=697 Len=0 TSval=2700028768 TSecr=2700028768","42836","4444"
"3953","3.265521874","127.0.0.1","127.0.0.1","TLSv1.2","166","Application Data","4444","42836"
"3954","3.265544852","127.0.0.1","127.0.0.1","TCP","66","42836  >  4444 [ACK] Seq=6737 Ack=6116 Win=699 Len=0 TSval=2700028774 TSecr=2700028774","42836","4444"
"3955","3.265656947","127.0.0.1","127.0.0.1","TLSv1.2","144","Application Data","4444","42894"
"3956","3.265673011","127.0.0.1","127.0.0.1","TCP","66","42894  >  4444 [ACK] Seq=7236 Ack=3394 Win=699 Len=0 TSval=2700028774 TSecr=2700028774","42894","4444"
"3959","3.269637761","127.0.0.1","127.0.0.1","TLSv1.2","2840","Application Data","42878","4444"
"4018","3.283137102","127.0.0.1","127.0.0.1","TLSv1.2","2193","Application Data","4444","42862"
"4019","3.283155889","127.0.0.1","127.0.0.1","TCP","66","42862  >  4444 [ACK] Seq=17055 Ack=5105 Win=688 Len=0 TSval=2700028792 TSecr=2700028792","42862","4444"
"4044","3.287823312","127.0.0.1","127.0.0.1","TLSv1.2","166","Application Data","4444","42862"
"4045","3.287851388","127.0.0.1","127.0.0.1","TCP","66","42862  >  4444 [ACK] Seq=17055 Ack=5205 Win=688 Len=0 TSval=2700028796 TSecr=2700028796","42862","4444"
"4046","3.287982201","127.0.0.1","127.0.0.1","TLSv1.2","144","Application Data","4444","42878"
"4047","3.287997077","127.0.0.1","127.0.0.1","TCP","66","42878  >  4444 [ACK] Seq=3048 Ack=11355 Win=699 Len=0 TSval=2700028797 TSecr=2700028797","42878","4444"
"4056","3.294253878","127.0.0.1","127.0.0.1","TLSv1.2","135","Application Data","42878","4444"
"4083","3.334878734","127.0.0.1","127.0.0.1","TCP","66","4444  >  42878 [ACK] Seq=11355 Ack=3117 Win=739 Len=0 TSval=2700028844 TSecr=2700028803","4444","42878"
"4084","3.334907159","127.0.0.1","127.0.0.1","TLSv1.2","636","Application Data","42878","4444"
"4085","3.334933769","127.0.0.1","127.0.0.1","TCP","66","4444  >  42878 [ACK] Seq=11355 Ack=3687 Win=752 Len=0 TSval=2700028844 TSecr=2700028844","4444","42878"
"4148","3.348217650","127.0.0.1","127.0.0.1","TLSv1.2","539","Application Data","4444","42862"
"4149","3.348249637","127.0.0.1","127.0.0.1","TCP","66","42862  >  4444 [ACK] Seq=17055 Ack=5678 Win=697 Len=0 TSval=2700028857 TSecr=2700028857","42862","4444"
"4173","3.354888889","127.0.0.1","127.0.0.1","TLSv1.2","165","Application Data","4444","42862"
"4174","3.354914311","127.0.0.1","127.0.0.1","TCP","66","42862  >  4444 [ACK] Seq=17055 Ack=5777 Win=697 Len=0 TSval=2700028864 TSecr=2700028864","42862","4444"
"4175","3.355099460","127.0.0.1","127.0.0.1","TLSv1.2","144","Application Data","4444","42878"
"4178","3.362028553","127.0.0.1","127.0.0.1","TLSv1.2","134","Application Data","42878","4444"
"4179","3.362684992","127.0.0.1","127.0.0.1","TLSv1.2","637","Application Data","42934","4444"
"4259","3.380116118","127.0.0.1","127.0.0.1","TLSv1.2","539","Application Data","4444","42920"
"4260","3.380148524","127.0.0.1","127.0.0.1","TCP","66","42920  >  4444 [ACK] Seq=4901 Ack=4868 Win=697 Len=0 TSval=2700028889 TSecr=2700028889","42920","4444"
