"No.","Time","Source","Destination","Protocol","Length","Info"
"967","16.297963077","127.0.0.1","127.0.0.1","TCP","66","49594  >  4444 [ACK] Seq=1 Ack=1 Win=65536 Len=0 TSval=2509908286 TSecr=2509908286"
"969","16.299066709","127.0.0.1","127.0.0.1","TCP","66","4444  >  49594 [ACK] Seq=1 Ack=237 Win=65280 Len=0 TSval=2509908288 TSecr=2509908288"
"971","16.302884024","127.0.0.1","127.0.0.1","TCP","66","49594  >  4444 [ACK] Seq=237 Ack=1490 Win=80000 Len=0 TSval=2509908291 TSecr=2509908291"
"1020","16.319677918","127.0.0.1","127.0.0.1","TCP","66","49606  >  4444 [ACK] Seq=1 Ack=1 Win=65536 Len=0 TSval=2509908308 TSecr=2509908308"
"1022","16.320714432","127.0.0.1","127.0.0.1","TCP","66","4444  >  49606 [ACK] Seq=1 Ack=237 Win=65280 Len=0 TSval=2509908309 TSecr=2509908309"
"1024","16.326742433","127.0.0.1","127.0.0.1","TCP","66","49606  >  4444 [ACK] Seq=237 Ack=1490 Win=80000 Len=0 TSval=2509908315 TSecr=2509908315"
"1071","16.344116080","127.0.0.1","127.0.0.1","TCP","66","49618  >  4444 [ACK] Seq=1 Ack=1 Win=65536 Len=0 TSval=2509908333 TSecr=2509908333"
"1073","16.345277680","127.0.0.1","127.0.0.1","TCP","66","4444  >  49618 [ACK] Seq=1 Ack=237 Win=65280 Len=0 TSval=2509908334 TSecr=2509908334"
"1075","16.348628245","127.0.0.1","127.0.0.1","TCP","66","49618  >  4444 [ACK] Seq=237 Ack=1490 Win=80000 Len=0 TSval=2509908337 TSecr=2509908337"
"1077","16.350971490","127.0.0.1","127.0.0.1","TCP","66","49594  >  4444 [ACK] Seq=763 Ack=2195 Win=80640 Len=0 TSval=2509908340 TSecr=2509908298"
"1123","16.364488362","127.0.0.1","127.0.0.1","TCP","66","49624  >  4444 [ACK] Seq=1 Ack=1 Win=65536 Len=0 TSval=2509908353 TSecr=2509908353"
"1125","16.365437574","127.0.0.1","127.0.0.1","TCP","66","4444  >  49624 [ACK] Seq=1 Ack=237 Win=65280 Len=0 TSval=2509908354 TSecr=2509908354"
"1127","16.367870425","127.0.0.1","127.0.0.1","TCP","66","49624  >  4444 [ACK] Seq=237 Ack=1490 Win=80000 Len=0 TSval=2509908356 TSecr=2509908356"
"1151","16.373967918","127.0.0.1","127.0.0.1","TCP","66","49606  >  4444 [ACK] Seq=763 Ack=2195 Win=80640 Len=0 TSval=2509908363 TSecr=2509908322"
"1175","16.381740065","127.0.0.1","127.0.0.1","TCP","66","49630  >  4444 [ACK] Seq=1 Ack=1 Win=65536 Len=0 TSval=2509908370 TSecr=2509908370"
"1177","16.382591919","127.0.0.1","127.0.0.1","TCP","66","4444  >  49630 [ACK] Seq=1 Ack=237 Win=65280 Len=0 TSval=2509908371 TSecr=2509908371"
"1179","16.385251126","127.0.0.1","127.0.0.1","TCP","66","49630  >  4444 [ACK] Seq=237 Ack=1490 Win=80000 Len=0 TSval=2509908374 TSecr=2509908374"
"1219","16.394973102","127.0.0.1","127.0.0.1","TCP","66","49618  >  4444 [ACK] Seq=763 Ack=2195 Win=80640 Len=0 TSval=2509908384 TSecr=2509908343"
"1230","16.401139668","127.0.0.1","127.0.0.1","TCP","66","49644  >  4444 [ACK] Seq=1 Ack=1 Win=65536 Len=0 TSval=2509908390 TSecr=2509908390"
"1232","16.402234570","127.0.0.1","127.0.0.1","TCP","66","4444  >  49644 [ACK] Seq=1 Ack=237 Win=65280 Len=0 TSval=2509908391 TSecr=2509908391"
"1234","16.405297389","127.0.0.1","127.0.0.1","TCP","66","49644  >  4444 [ACK] Seq=237 Ack=1490 Win=80000 Len=0 TSval=2509908394 TSecr=2509908394"
"1262","16.413978171","127.0.0.1","127.0.0.1","TCP","66","49624  >  4444 [ACK] Seq=763 Ack=2195 Win=80640 Len=0 TSval=2509908403 TSecr=2509908362"
"1280","16.423180248","127.0.0.1","127.0.0.1","TCP","66","49652  >  4444 [ACK] Seq=1 Ack=1 Win=65536 Len=0 TSval=2509908412 TSecr=2509908412"
"1282","16.424005353","127.0.0.1","127.0.0.1","TCP","66","4444  >  49652 [ACK] Seq=1 Ack=237 Win=65280 Len=0 TSval=2509908413 TSecr=2509908413"
"1284","16.426872268","127.0.0.1","127.0.0.1","TCP","66","49652  >  4444 [ACK] Seq=237 Ack=1490 Win=80000 Len=0 TSval=2509908415 TSecr=2509908415"
"1304","16.431960205","127.0.0.1","127.0.0.1","TCP","66","49630  >  4444 [ACK] Seq=763 Ack=2195 Win=80640 Len=0 TSval=2509908421 TSecr=2509908380"
"1333","16.441681063","127.0.0.1","127.0.0.1","TCP","66","49654  >  4444 [ACK] Seq=1 Ack=1 Win=65536 Len=0 TSval=2509908430 TSecr=2509908430"
"1335","16.442563298","127.0.0.1","127.0.0.1","TCP","66","4444  >  49654 [ACK] Seq=1 Ack=237 Win=65280 Len=0 TSval=2509908431 TSecr=2509908431"
"1337","16.445366658","127.0.0.1","127.0.0.1","TCP","66","49654  >  4444 [ACK] Seq=237 Ack=1490 Win=80000 Len=0 TSval=2509908434 TSecr=2509908434"
"1364","16.452985782","127.0.0.1","127.0.0.1","TCP","66","49644  >  4444 [ACK] Seq=763 Ack=2195 Win=80640 Len=0 TSval=2509908442 TSecr=2509908401"
"1385","16.460414101","127.0.0.1","127.0.0.1","TCP","66","49658  >  4444 [ACK] Seq=1 Ack=1 Win=65536 Len=0 TSval=2509908449 TSecr=2509908449"
"1387","16.461339847","127.0.0.1","127.0.0.1","TCP","66","4444  >  49658 [ACK] Seq=1 Ack=237 Win=65280 Len=0 TSval=2509908450 TSecr=2509908450"
"1389","16.465117352","127.0.0.1","127.0.0.1","TCP","66","49658  >  4444 [ACK] Seq=237 Ack=1490 Win=80000 Len=0 TSval=2509908454 TSecr=2509908454"
"1417","16.472979944","127.0.0.1","127.0.0.1","TCP","66","49652  >  4444 [ACK] Seq=763 Ack=2195 Win=80640 Len=0 TSval=2509908462 TSecr=2509908421"
"1437","16.481143760","127.0.0.1","127.0.0.1","TCP","66","49670  >  4444 [ACK] Seq=1 Ack=1 Win=65536 Len=0 TSval=2509908470 TSecr=2509908470"
"1439","16.482109735","127.0.0.1","127.0.0.1","TCP","66","4444  >  49670 [ACK] Seq=1 Ack=237 Win=65280 Len=0 TSval=2509908471 TSecr=2509908471"
"1441","16.485146224","127.0.0.1","127.0.0.1","TCP","66","49670  >  4444 [ACK] Seq=237 Ack=1490 Win=80000 Len=0 TSval=2509908474 TSecr=2509908474"
"1467","16.491965806","127.0.0.1","127.0.0.1","TCP","66","49654  >  4444 [ACK] Seq=763 Ack=2195 Win=80640 Len=0 TSval=2509908481 TSecr=2509908440"
"1492","16.501032322","127.0.0.1","127.0.0.1","TCP","66","49682  >  4444 [ACK] Seq=1 Ack=1 Win=65536 Len=0 TSval=2509908490 TSecr=2509908490"
"1494","16.501984817","127.0.0.1","127.0.0.1","TCP","66","4444  >  49682 [ACK] Seq=1 Ack=237 Win=65280 Len=0 TSval=2509908491 TSecr=2509908490"
"1496","16.504402373","127.0.0.1","127.0.0.1","TCP","66","49682  >  4444 [ACK] Seq=237 Ack=1490 Win=80000 Len=0 TSval=2509908493 TSecr=2509908493"
"1525","16.511977707","127.0.0.1","127.0.0.1","TCP","66","49658  >  4444 [ACK] Seq=763 Ack=2195 Win=80640 Len=0 TSval=2509908501 TSecr=2509908460"
"1542","16.519380184","127.0.0.1","127.0.0.1","TCP","66","49696  >  4444 [ACK] Seq=1 Ack=1 Win=65536 Len=0 TSval=2509908508 TSecr=2509908508"
"1544","16.520530750","127.0.0.1","127.0.0.1","TCP","66","4444  >  49696 [ACK] Seq=1 Ack=237 Win=65280 Len=0 TSval=2509908509 TSecr=2509908509"
"1546","16.526061480","127.0.0.1","127.0.0.1","TCP","66","49696  >  4444 [ACK] Seq=237 Ack=1490 Win=80000 Len=0 TSval=2509908515 TSecr=2509908515"
"1566","16.532965710","127.0.0.1","127.0.0.1","TCP","66","49670  >  4444 [ACK] Seq=763 Ack=2195 Win=80640 Len=0 TSval=2509908522 TSecr=2509908480"
"1595","16.543861438","127.0.0.1","127.0.0.1","TCP","66","49712  >  4444 [ACK] Seq=1 Ack=1 Win=65536 Len=0 TSval=2509908532 TSecr=2509908532"
"1597","16.544873648","127.0.0.1","127.0.0.1","TCP","66","4444  >  49712 [ACK] Seq=1 Ack=237 Win=65280 Len=0 TSval=2509908533 TSecr=2509908533"
"1599","16.548537940","127.0.0.1","127.0.0.1","TCP","66","49712  >  4444 [ACK] Seq=237 Ack=1490 Win=80000 Len=0 TSval=2509908537 TSecr=2509908537"
"1600","16.549974157","127.0.0.1","127.0.0.1","TCP","66","49682  >  4444 [ACK] Seq=763 Ack=2195 Win=80640 Len=0 TSval=2509908539 TSecr=2509908498"
"1647","16.567624235","127.0.0.1","127.0.0.1","TCP","66","49720  >  4444 [ACK] Seq=1 Ack=1 Win=65536 Len=0 TSval=2509908556 TSecr=2509908556"
"1649","16.569666184","127.0.0.1","127.0.0.1","TCP","66","4444  >  49720 [ACK] Seq=1 Ack=237 Win=65280 Len=0 TSval=2509908558 TSecr=2509908558"
"1651","16.573270064","127.0.0.1","127.0.0.1","TCP","66","49720  >  4444 [ACK] Seq=237 Ack=1490 Win=80000 Len=0 TSval=2509908562 TSecr=2509908562"
"1652","16.573983214","127.0.0.1","127.0.0.1","TCP","66","49696  >  4444 [ACK] Seq=763 Ack=2195 Win=80640 Len=0 TSval=2509908563 TSecr=2509908522"
"1699","16.592591375","127.0.0.1","127.0.0.1","TCP","66","49736  >  4444 [ACK] Seq=1 Ack=1 Win=65536 Len=0 TSval=2509908581 TSecr=2509908581"
"1704","16.593613572","127.0.0.1","127.0.0.1","TCP","66","4444  >  49736 [ACK] Seq=1 Ack=237 Win=65280 Len=0 TSval=2509908582 TSecr=2509908582"
"1707","16.595971693","127.0.0.1","127.0.0.1","TCP","66","49712  >  4444 [ACK] Seq=763 Ack=2195 Win=80640 Len=0 TSval=2509908585 TSecr=2509908544"
"1709","16.596464842","127.0.0.1","127.0.0.1","TCP","66","49736  >  4444 [ACK] Seq=237 Ack=1490 Win=80000 Len=0 TSval=2509908585 TSecr=2509908585"
"1756","16.614594450","127.0.0.1","127.0.0.1","TCP","66","49742  >  4444 [ACK] Seq=1 Ack=1 Win=65536 Len=0 TSval=2509908603 TSecr=2509908603"
"1758","16.615990228","127.0.0.1","127.0.0.1","TCP","66","4444  >  49742 [ACK] Seq=1 Ack=237 Win=65280 Len=0 TSval=2509908605 TSecr=2509908604"
"1760","16.619107803","127.0.0.1","127.0.0.1","TCP","66","49742  >  4444 [ACK] Seq=237 Ack=1490 Win=80000 Len=0 TSval=2509908608 TSecr=2509908608"
"1764","16.621972483","127.0.0.1","127.0.0.1","TCP","66","49720  >  4444 [ACK] Seq=763 Ack=2195 Win=80640 Len=0 TSval=2509908611 TSecr=2509908570"
"1809","16.635499621","127.0.0.1","127.0.0.1","TCP","66","49752  >  4444 [ACK] Seq=1 Ack=1 Win=65536 Len=0 TSval=2509908624 TSecr=2509908624"
"1811","16.636631050","127.0.0.1","127.0.0.1","TCP","66","4444  >  49752 [ACK] Seq=1 Ack=237 Win=65280 Len=0 TSval=2509908625 TSecr=2509908625"
"1813","16.638850955","127.0.0.1","127.0.0.1","TCP","66","49752  >  4444 [ACK] Seq=237 Ack=1490 Win=80000 Len=0 TSval=2509908627 TSecr=2509908627"
"1834","16.643981007","127.0.0.1","127.0.0.1","TCP","66","49736  >  4444 [ACK] Seq=763 Ack=2195 Win=80640 Len=0 TSval=2509908633 TSecr=2509908592"
"1861","16.653179801","127.0.0.1","127.0.0.1","TCP","66","49754  >  4444 [ACK] Seq=1 Ack=1 Win=65536 Len=0 TSval=2509908642 TSecr=2509908642"
"1863","16.654317725","127.0.0.1","127.0.0.1","TCP","66","4444  >  49754 [ACK] Seq=1 Ack=237 Win=65280 Len=0 TSval=2509908643 TSecr=2509908643"
"1865","16.656914983","127.0.0.1","127.0.0.1","TCP","66","49754  >  4444 [ACK] Seq=237 Ack=1490 Win=80000 Len=0 TSval=2509908645 TSecr=2509908645"
"1899","16.665988482","127.0.0.1","127.0.0.1","TCP","66","49742  >  4444 [ACK] Seq=763 Ack=2195 Win=80640 Len=0 TSval=2509908655 TSecr=2509908614"
"1913","16.673268528","127.0.0.1","127.0.0.1","TCP","66","49764  >  4444 [ACK] Seq=1 Ack=1 Win=65536 Len=0 TSval=2509908662 TSecr=2509908662"
"1915","16.674256363","127.0.0.1","127.0.0.1","TCP","66","4444  >  49764 [ACK] Seq=1 Ack=237 Win=65280 Len=0 TSval=2509908663 TSecr=2509908663"
"1917","16.677156801","127.0.0.1","127.0.0.1","TCP","66","49764  >  4444 [ACK] Seq=237 Ack=1490 Win=80000 Len=0 TSval=2509908666 TSecr=2509908666"
"1949","16.684982656","127.0.0.1","127.0.0.1","TCP","66","49752  >  4444 [ACK] Seq=763 Ack=2195 Win=80640 Len=0 TSval=2509908674 TSecr=2509908633"
"1965","16.693233845","127.0.0.1","127.0.0.1","TCP","66","49780  >  4444 [ACK] Seq=1 Ack=1 Win=65536 Len=0 TSval=2509908682 TSecr=2509908682"
"1967","16.694159940","127.0.0.1","127.0.0.1","TCP","66","4444  >  49780 [ACK] Seq=1 Ack=237 Win=65280 Len=0 TSval=2509908683 TSecr=2509908683"
"1969","16.696995356","127.0.0.1","127.0.0.1","TCP","66","49780  >  4444 [ACK] Seq=237 Ack=1490 Win=80000 Len=0 TSval=2509908686 TSecr=2509908686"
"1997","16.702979357","127.0.0.1","127.0.0.1","TCP","66","49754  >  4444 [ACK] Seq=763 Ack=2195 Win=80640 Len=0 TSval=2509908692 TSecr=2509908651"
"2020","16.713266838","127.0.0.1","127.0.0.1","TCP","66","49796  >  4444 [ACK] Seq=1 Ack=1 Win=65536 Len=0 TSval=2509908702 TSecr=2509908702"
"2022","16.714212628","127.0.0.1","127.0.0.1","TCP","66","4444  >  49796 [ACK] Seq=1 Ack=237 Win=65280 Len=0 TSval=2509908703 TSecr=2509908703"
"2024","16.718380337","127.0.0.1","127.0.0.1","TCP","66","49796  >  4444 [ACK] Seq=237 Ack=1490 Win=80000 Len=0 TSval=2509908707 TSecr=2509908707"
"2033","16.722984483","127.0.0.1","127.0.0.1","TCP","66","49764  >  4444 [ACK] Seq=763 Ack=2195 Win=80640 Len=0 TSval=2509908712 TSecr=2509908671"
"2072","16.734561513","127.0.0.1","127.0.0.1","TCP","66","49808  >  4444 [ACK] Seq=1 Ack=1 Win=65536 Len=0 TSval=2509908723 TSecr=2509908723"
"2074","16.735612205","127.0.0.1","127.0.0.1","TCP","66","4444  >  49808 [ACK] Seq=1 Ack=237 Win=65280 Len=0 TSval=2509908724 TSecr=2509908724"
"2076","16.738440009","127.0.0.1","127.0.0.1","TCP","66","49808  >  4444 [ACK] Seq=237 Ack=1490 Win=80000 Len=0 TSval=2509908727 TSecr=2509908727"
"2089","16.742973686","127.0.0.1","127.0.0.1","TCP","66","49780  >  4444 [ACK] Seq=763 Ack=2195 Win=80640 Len=0 TSval=2509908732 TSecr=2509908691"
"2125","16.756989853","127.0.0.1","127.0.0.1","TCP","66","49816  >  4444 [ACK] Seq=1 Ack=1 Win=65536 Len=0 TSval=2509908746 TSecr=2509908745"
"2127","16.758415313","127.0.0.1","127.0.0.1","TCP","66","4444  >  49816 [ACK] Seq=1 Ack=237 Win=65280 Len=0 TSval=2509908747 TSecr=2509908747"
"2129","16.760912767","127.0.0.1","127.0.0.1","TCP","66","49816  >  4444 [ACK] Seq=237 Ack=1490 Win=80000 Len=0 TSval=2509908749 TSecr=2509908749"
"2137","16.764976762","127.0.0.1","127.0.0.1","TCP","66","49796  >  4444 [ACK] Seq=763 Ack=2195 Win=80640 Len=0 TSval=2509908754 TSecr=2509908713"
"2177","16.778328249","127.0.0.1","127.0.0.1","TCP","66","49826  >  4444 [ACK] Seq=1 Ack=1 Win=65536 Len=0 TSval=2509908767 TSecr=2509908767"
"2179","16.779274249","127.0.0.1","127.0.0.1","TCP","66","4444  >  49826 [ACK] Seq=1 Ack=237 Win=65280 Len=0 TSval=2509908768 TSecr=2509908768"
"2181","16.781968865","127.0.0.1","127.0.0.1","TCP","66","49826  >  4444 [ACK] Seq=237 Ack=1490 Win=80000 Len=0 TSval=2509908771 TSecr=2509908770"
"2195","16.786993596","127.0.0.1","127.0.0.1","TCP","66","49808  >  4444 [ACK] Seq=763 Ack=2195 Win=80640 Len=0 TSval=2509908776 TSecr=2509908734"
"2229","16.797976975","127.0.0.1","127.0.0.1","TCP","66","49840  >  4444 [ACK] Seq=1 Ack=1 Win=65536 Len=0 TSval=2509908787 TSecr=2509908786"
"2231","16.799115318","127.0.0.1","127.0.0.1","TCP","66","4444  >  49840 [ACK] Seq=1 Ack=237 Win=65280 Len=0 TSval=2509908788 TSecr=2509908788"
"2238","16.802323827","127.0.0.1","127.0.0.1","TCP","66","49840  >  4444 [ACK] Seq=237 Ack=1490 Win=80000 Len=0 TSval=2509908791 TSecr=2509908791"
"2262","16.808970831","127.0.0.1","127.0.0.1","TCP","66","49816  >  4444 [ACK] Seq=763 Ack=2195 Win=80640 Len=0 TSval=2509908798 TSecr=2509908756"
"2284","16.818824387","127.0.0.1","127.0.0.1","TCP","66","49850  >  4444 [ACK] Seq=1 Ack=1 Win=65536 Len=0 TSval=2509908807 TSecr=2509908807"
"2286","16.819921454","127.0.0.1","127.0.0.1","TCP","66","4444  >  49850 [ACK] Seq=1 Ack=237 Win=65280 Len=0 TSval=2509908808 TSecr=2509908808"
"2288","16.822355353","127.0.0.1","127.0.0.1","TCP","66","49850  >  4444 [ACK] Seq=237 Ack=1490 Win=80000 Len=0 TSval=2509908811 TSecr=2509908811"
"2313","16.828980008","127.0.0.1","127.0.0.1","TCP","66","49826  >  4444 [ACK] Seq=763 Ack=2195 Win=80640 Len=0 TSval=2509908818 TSecr=2509908777"
"2334","16.837608269","127.0.0.1","127.0.0.1","TCP","66","49864  >  4444 [ACK] Seq=1 Ack=1 Win=65536 Len=0 TSval=2509908826 TSecr=2509908826"
"2336","16.838613774","127.0.0.1","127.0.0.1","TCP","66","4444  >  49864 [ACK] Seq=1 Ack=237 Win=65280 Len=0 TSval=2509908827 TSecr=2509908827"
"2338","16.841032098","127.0.0.1","127.0.0.1","TCP","66","49864  >  4444 [ACK] Seq=237 Ack=1490 Win=80000 Len=0 TSval=2509908830 TSecr=2509908830"
"2375","16.849995249","127.0.0.1","127.0.0.1","TCP","66","49840  >  4444 [ACK] Seq=763 Ack=2195 Win=80640 Len=0 TSval=2509908839 TSecr=2509908797"
"2387","16.856403116","127.0.0.1","127.0.0.1","TCP","66","49874  >  4444 [ACK] Seq=1 Ack=1 Win=65536 Len=0 TSval=2509908845 TSecr=2509908845"
"2389","16.857515897","127.0.0.1","127.0.0.1","TCP","66","4444  >  49874 [ACK] Seq=1 Ack=237 Win=65280 Len=0 TSval=2509908846 TSecr=2509908846"
"2391","16.859874437","127.0.0.1","127.0.0.1","TCP","66","49874  >  4444 [ACK] Seq=237 Ack=1490 Win=80000 Len=0 TSval=2509908848 TSecr=2509908848"
"2427","16.868969657","127.0.0.1","127.0.0.1","TCP","66","49850  >  4444 [ACK] Seq=763 Ack=2195 Win=80640 Len=0 TSval=2509908858 TSecr=2509908817"
"2439","16.876468027","127.0.0.1","127.0.0.1","TCP","66","49886  >  4444 [ACK] Seq=1 Ack=1 Win=65536 Len=0 TSval=2509908865 TSecr=2509908865"
"2441","16.877302700","127.0.0.1","127.0.0.1","TCP","66","4444  >  49886 [ACK] Seq=1 Ack=237 Win=65280 Len=0 TSval=2509908866 TSecr=2509908866"
"2443","16.880183513","127.0.0.1","127.0.0.1","TCP","66","49886  >  4444 [ACK] Seq=237 Ack=1490 Win=80000 Len=0 TSval=2509908869 TSecr=2509908869"
"2469","16.886974739","127.0.0.1","127.0.0.1","TCP","66","49864  >  4444 [ACK] Seq=763 Ack=2195 Win=80640 Len=0 TSval=2509908876 TSecr=2509908835"
"2491","16.895475610","127.0.0.1","127.0.0.1","TCP","66","49894  >  4444 [ACK] Seq=1 Ack=1 Win=65536 Len=0 TSval=2509908884 TSecr=2509908884"
"2493","16.896482093","127.0.0.1","127.0.0.1","TCP","66","4444  >  49894 [ACK] Seq=1 Ack=237 Win=65280 Len=0 TSval=2509908885 TSecr=2509908885"
"2495","16.900566690","127.0.0.1","127.0.0.1","TCP","66","49894  >  4444 [ACK] Seq=237 Ack=1490 Win=80000 Len=0 TSval=2509908889 TSecr=2509908889"
"2513","16.905979319","127.0.0.1","127.0.0.1","TCP","66","49874  >  4444 [ACK] Seq=763 Ack=2195 Win=80640 Len=0 TSval=2509908895 TSecr=2509908854"
"2548","16.917750298","127.0.0.1","127.0.0.1","TCP","66","49908  >  4444 [ACK] Seq=1 Ack=1 Win=65536 Len=0 TSval=2509908906 TSecr=2509908906"
"2550","16.919159416","127.0.0.1","127.0.0.1","TCP","66","4444  >  49908 [ACK] Seq=1 Ack=237 Win=65280 Len=0 TSval=2509908908 TSecr=2509908908"
"2552","16.922164966","127.0.0.1","127.0.0.1","TCP","66","49908  >  4444 [ACK] Seq=237 Ack=1490 Win=80000 Len=0 TSval=2509908911 TSecr=2509908911"
"2566","16.926962852","127.0.0.1","127.0.0.1","TCP","66","49886  >  4444 [ACK] Seq=763 Ack=2195 Win=80640 Len=0 TSval=2509908916 TSecr=2509908875"
"2598","16.938061190","127.0.0.1","127.0.0.1","TCP","66","49922  >  4444 [ACK] Seq=1 Ack=1 Win=65536 Len=0 TSval=2509908927 TSecr=2509908927"
"2600","16.939289977","127.0.0.1","127.0.0.1","TCP","66","4444  >  49922 [ACK] Seq=1 Ack=237 Win=65280 Len=0 TSval=2509908928 TSecr=2509908928"
"2602","16.942319482","127.0.0.1","127.0.0.1","TCP","66","49922  >  4444 [ACK] Seq=237 Ack=1490 Win=80000 Len=0 TSval=2509908931 TSecr=2509908931"
"2633","16.949974925","127.0.0.1","127.0.0.1","TCP","66","49894  >  4444 [ACK] Seq=763 Ack=2195 Win=80640 Len=0 TSval=2509908939 TSecr=2509908897"
"2651","16.958348545","127.0.0.1","127.0.0.1","TCP","66","49926  >  4444 [ACK] Seq=1 Ack=1 Win=65536 Len=0 TSval=2509908947 TSecr=2509908947"
"2653","16.959377307","127.0.0.1","127.0.0.1","TCP","66","4444  >  49926 [ACK] Seq=1 Ack=237 Win=65280 Len=0 TSval=2509908948 TSecr=2509908948"
"2655","16.962078628","127.0.0.1","127.0.0.1","TCP","66","49926  >  4444 [ACK] Seq=237 Ack=1490 Win=80000 Len=0 TSval=2509908951 TSecr=2509908951"
"2678","16.968992076","127.0.0.1","127.0.0.1","TCP","66","49908  >  4444 [ACK] Seq=763 Ack=2195 Win=80640 Len=0 TSval=2509908958 TSecr=2509908917"
"2703","16.977517392","127.0.0.1","127.0.0.1","TCP","66","49940  >  4444 [ACK] Seq=1 Ack=1 Win=65536 Len=0 TSval=2509908966 TSecr=2509908966"
"2705","16.978548319","127.0.0.1","127.0.0.1","TCP","66","4444  >  49940 [ACK] Seq=1 Ack=237 Win=65280 Len=0 TSval=2509908967 TSecr=2509908967"
"2707","16.984014027","127.0.0.1","127.0.0.1","TCP","66","49940  >  4444 [ACK] Seq=237 Ack=1490 Win=80000 Len=0 TSval=2509908973 TSecr=2509908972"
"2715","16.988978695","127.0.0.1","127.0.0.1","TCP","66","49922  >  4444 [ACK] Seq=763 Ack=2195 Win=80640 Len=0 TSval=2509908978 TSecr=2509908937"
"2755","17.001332499","127.0.0.1","127.0.0.1","TCP","66","49950  >  4444 [ACK] Seq=1 Ack=1 Win=65536 Len=0 TSval=2509908990 TSecr=2509908990"
"2757","17.002559890","127.0.0.1","127.0.0.1","TCP","66","4444  >  49950 [ACK] Seq=1 Ack=237 Win=65280 Len=0 TSval=2509908991 TSecr=2509908991"
"2759","17.005115033","127.0.0.1","127.0.0.1","TCP","66","49950  >  4444 [ACK] Seq=237 Ack=1490 Win=80000 Len=0 TSval=2509908994 TSecr=2509908994"
"2784","17.010987218","127.0.0.1","127.0.0.1","TCP","66","49926  >  4444 [ACK] Seq=763 Ack=2195 Win=80640 Len=0 TSval=2509909000 TSecr=2509908958"
"2812","17.021899918","127.0.0.1","127.0.0.1","TCP","66","49962  >  4444 [ACK] Seq=1 Ack=1 Win=65536 Len=0 TSval=2509909010 TSecr=2509909010"
"2814","17.023071855","127.0.0.1","127.0.0.1","TCP","66","4444  >  49962 [ACK] Seq=1 Ack=237 Win=65280 Len=0 TSval=2509909012 TSecr=2509909012"
"2816","17.026221626","127.0.0.1","127.0.0.1","TCP","66","49962  >  4444 [ACK] Seq=237 Ack=1490 Win=80000 Len=0 TSval=2509909015 TSecr=2509909015"
"2836","17.032982472","127.0.0.1","127.0.0.1","TCP","66","49940  >  4444 [ACK] Seq=763 Ack=2195 Win=80640 Len=0 TSval=2509909022 TSecr=2509908981"
"2862","17.043780841","127.0.0.1","127.0.0.1","TCP","66","49968  >  4444 [ACK] Seq=1 Ack=1 Win=65536 Len=0 TSval=2509909032 TSecr=2509909032"
"2864","17.044834956","127.0.0.1","127.0.0.1","TCP","66","4444  >  49968 [ACK] Seq=1 Ack=237 Win=65280 Len=0 TSval=2509909033 TSecr=2509909033"
"2867","17.047207813","127.0.0.1","127.0.0.1","TCP","66","49968  >  4444 [ACK] Seq=237 Ack=1490 Win=80000 Len=0 TSval=2509909036 TSecr=2509909036"
"2875","17.051968125","127.0.0.1","127.0.0.1","TCP","66","49950  >  4444 [ACK] Seq=763 Ack=2195 Win=80640 Len=0 TSval=2509909041 TSecr=2509909000"
"2915","17.063338285","127.0.0.1","127.0.0.1","TCP","66","49976  >  4444 [ACK] Seq=1 Ack=1 Win=65536 Len=0 TSval=2509909052 TSecr=2509909052"
"2917","17.064322209","127.0.0.1","127.0.0.1","TCP","66","4444  >  49976 [ACK] Seq=1 Ack=237 Win=65280 Len=0 TSval=2509909053 TSecr=2509909053"
"2919","17.068310705","127.0.0.1","127.0.0.1","TCP","66","49976  >  4444 [ACK] Seq=237 Ack=1490 Win=80000 Len=0 TSval=2509909057 TSecr=2509909057"
"2938","17.073973506","127.0.0.1","127.0.0.1","TCP","66","49962  >  4444 [ACK] Seq=763 Ack=2195 Win=80640 Len=0 TSval=2509909063 TSecr=2509909022"
"2967","17.084388516","127.0.0.1","127.0.0.1","TCP","66","49990  >  4444 [ACK] Seq=1 Ack=1 Win=65536 Len=0 TSval=2509909073 TSecr=2509909073"
"2969","17.085410713","127.0.0.1","127.0.0.1","TCP","66","4444  >  49990 [ACK] Seq=1 Ack=237 Win=65280 Len=0 TSval=2509909074 TSecr=2509909074"
"2971","17.088846136","127.0.0.1","127.0.0.1","TCP","66","49990  >  4444 [ACK] Seq=237 Ack=1490 Win=80000 Len=0 TSval=2509909077 TSecr=2509909077"
"2991","17.095970715","127.0.0.1","127.0.0.1","TCP","66","49968  >  4444 [ACK] Seq=763 Ack=2195 Win=80640 Len=0 TSval=2509909085 TSecr=2509909043"
"3019","17.107888011","127.0.0.1","127.0.0.1","TCP","66","50004  >  4444 [ACK] Seq=1 Ack=1 Win=65536 Len=0 TSval=2509909096 TSecr=2509909096"
"3026","17.109741878","127.0.0.1","127.0.0.1","TCP","66","4444  >  50004 [ACK] Seq=1 Ack=237 Win=65280 Len=0 TSval=2509909098 TSecr=2509909098"
"3028","17.114668482","127.0.0.1","127.0.0.1","TCP","66","50004  >  4444 [ACK] Seq=237 Ack=1490 Win=80000 Len=0 TSval=2509909103 TSecr=2509909103"
"3029","17.114967612","127.0.0.1","127.0.0.1","TCP","66","49976  >  4444 [ACK] Seq=763 Ack=2195 Win=80640 Len=0 TSval=2509909104 TSecr=2509909063"
"3076","17.132721964","127.0.0.1","127.0.0.1","TCP","66","50006  >  4444 [ACK] Seq=1 Ack=1 Win=65536 Len=0 TSval=2509909121 TSecr=2509909121"
"3078","17.133785507","127.0.0.1","127.0.0.1","TCP","66","4444  >  50006 [ACK] Seq=1 Ack=237 Win=65280 Len=0 TSval=2509909122 TSecr=2509909122"
"3080","17.136275139","127.0.0.1","127.0.0.1","TCP","66","50006  >  4444 [ACK] Seq=237 Ack=1490 Win=80000 Len=0 TSval=2509909125 TSecr=2509909125"
"3081","17.136971596","127.0.0.1","127.0.0.1","TCP","66","49990  >  4444 [ACK] Seq=763 Ack=2195 Win=80640 Len=0 TSval=2509909126 TSecr=2509909085"
"3125","17.162988730","127.0.0.1","127.0.0.1","TCP","66","50004  >  4444 [ACK] Seq=763 Ack=2195 Win=80640 Len=0 TSval=2509909152 TSecr=2509909111"
"3131","17.167751416","127.0.0.1","127.0.0.1","TCP","66","50012  >  4444 [ACK] Seq=1 Ack=1 Win=65536 Len=0 TSval=2509909156 TSecr=2509909156"
"3133","17.168816006","127.0.0.1","127.0.0.1","TCP","66","4444  >  50012 [ACK] Seq=1 Ack=237 Win=65280 Len=0 TSval=2509909157 TSecr=2509909157"
"3135","17.172588553","127.0.0.1","127.0.0.1","TCP","66","50012  >  4444 [ACK] Seq=237 Ack=1490 Win=80000 Len=0 TSval=2509909161 TSecr=2509909161"
"3171","17.181970053","127.0.0.1","127.0.0.1","TCP","66","50006  >  4444 [ACK] Seq=763 Ack=2195 Win=80640 Len=0 TSval=2509909171 TSecr=2509909130"
"3183","17.189432663","127.0.0.1","127.0.0.1","TCP","66","50014  >  4444 [ACK] Seq=1 Ack=1 Win=65536 Len=0 TSval=2509909178 TSecr=2509909178"
"3185","17.190678562","127.0.0.1","127.0.0.1","TCP","66","4444  >  50014 [ACK] Seq=1 Ack=237 Win=65280 Len=0 TSval=2509909179 TSecr=2509909179"
"3187","17.193009584","127.0.0.1","127.0.0.1","TCP","66","50014  >  4444 [ACK] Seq=237 Ack=1490 Win=80000 Len=0 TSval=2509909182 TSecr=2509909182"
"3233","17.210165536","127.0.0.1","127.0.0.1","TCP","66","50016  >  4444 [ACK] Seq=1 Ack=1 Win=65536 Len=0 TSval=2509909199 TSecr=2509909199"
"3239","17.211115098","127.0.0.1","127.0.0.1","TCP","66","4444  >  50016 [ACK] Seq=1 Ack=237 Win=65280 Len=0 TSval=2509909200 TSecr=2509909200"
"3242","17.213476291","127.0.0.1","127.0.0.1","TCP","66","50016  >  4444 [ACK] Seq=237 Ack=1490 Win=80000 Len=0 TSval=2509909202 TSecr=2509909202"
"3260","17.218966794","127.0.0.1","127.0.0.1","TCP","66","50012  >  4444 [ACK] Seq=763 Ack=2195 Win=80640 Len=0 TSval=2509909208 TSecr=2509909167"
"3290","17.229871601","127.0.0.1","127.0.0.1","TCP","66","50028  >  4444 [ACK] Seq=1 Ack=1 Win=65536 Len=0 TSval=2509909218 TSecr=2509909218"
"3292","17.230767944","127.0.0.1","127.0.0.1","TCP","66","4444  >  50028 [ACK] Seq=1 Ack=237 Win=65280 Len=0 TSval=2509909219 TSecr=2509909219"
"3294","17.233538897","127.0.0.1","127.0.0.1","TCP","66","50028  >  4444 [ACK] Seq=237 Ack=1490 Win=80000 Len=0 TSval=2509909222 TSecr=2509909222"
"3320","17.240984466","127.0.0.1","127.0.0.1","TCP","66","50014  >  4444 [ACK] Seq=763 Ack=2195 Win=80640 Len=0 TSval=2509909230 TSecr=2509909189"
"3340","17.249062029","127.0.0.1","127.0.0.1","TCP","66","50032  >  4444 [ACK] Seq=1 Ack=1 Win=65536 Len=0 TSval=2509909238 TSecr=2509909238"
"3342","17.250184798","127.0.0.1","127.0.0.1","TCP","66","4444  >  50032 [ACK] Seq=1 Ack=237 Win=65280 Len=0 TSval=2509909239 TSecr=2509909239"
"3345","17.253071687","127.0.0.1","127.0.0.1","TCP","66","50032  >  4444 [ACK] Seq=237 Ack=1490 Win=80000 Len=0 TSval=2509909242 TSecr=2509909242"
"3377","17.261991675","127.0.0.1","127.0.0.1","TCP","66","50016  >  4444 [ACK] Seq=763 Ack=2195 Win=80640 Len=0 TSval=2509909251 TSecr=2509909209"
"3393","17.269318794","127.0.0.1","127.0.0.1","TCP","66","50034  >  4444 [ACK] Seq=1 Ack=1 Win=65536 Len=0 TSval=2509909258 TSecr=2509909258"
"3395","17.270261022","127.0.0.1","127.0.0.1","TCP","66","4444  >  50034 [ACK] Seq=1 Ack=237 Win=65280 Len=0 TSval=2509909259 TSecr=2509909259"
"3397","17.273014585","127.0.0.1","127.0.0.1","TCP","66","50034  >  4444 [ACK] Seq=237 Ack=1490 Win=80000 Len=0 TSval=2509909262 TSecr=2509909262"
"3424","17.279983557","127.0.0.1","127.0.0.1","TCP","66","50028  >  4444 [ACK] Seq=763 Ack=2195 Win=80640 Len=0 TSval=2509909269 TSecr=2509909228"
"3445","17.288234815","127.0.0.1","127.0.0.1","TCP","66","50042  >  4444 [ACK] Seq=1 Ack=1 Win=65536 Len=0 TSval=2509909277 TSecr=2509909277"
"3447","17.289383285","127.0.0.1","127.0.0.1","TCP","66","4444  >  50042 [ACK] Seq=1 Ack=237 Win=65280 Len=0 TSval=2509909278 TSecr=2509909278"
"3449","17.294736200","127.0.0.1","127.0.0.1","TCP","66","50042  >  4444 [ACK] Seq=237 Ack=1490 Win=80000 Len=0 TSval=2509909283 TSecr=2509909283"
"3463","17.299986099","127.0.0.1","127.0.0.1","TCP","66","50032  >  4444 [ACK] Seq=763 Ack=2195 Win=80640 Len=0 TSval=2509909289 TSecr=2509909248"
"3497","17.311166640","127.0.0.1","127.0.0.1","TCP","66","50046  >  4444 [ACK] Seq=1 Ack=1 Win=65536 Len=0 TSval=2509909300 TSecr=2509909300"
"3499","17.312253929","127.0.0.1","127.0.0.1","TCP","66","4444  >  50046 [ACK] Seq=1 Ack=237 Win=65280 Len=0 TSval=2509909301 TSecr=2509909301"
"3501","17.314890787","127.0.0.1","127.0.0.1","TCP","66","50046  >  4444 [ACK] Seq=237 Ack=1490 Win=80000 Len=0 TSval=2509909303 TSecr=2509909303"
"3517","17.319970134","127.0.0.1","127.0.0.1","TCP","66","50034  >  4444 [ACK] Seq=763 Ack=2195 Win=80640 Len=0 TSval=2509909309 TSecr=2509909268"
"3554","17.330238617","127.0.0.1","127.0.0.1","TCP","66","50052  >  4444 [ACK] Seq=1 Ack=1 Win=65536 Len=0 TSval=2509909319 TSecr=2509909319"
"3556","17.331166249","127.0.0.1","127.0.0.1","TCP","66","4444  >  50052 [ACK] Seq=1 Ack=237 Win=65280 Len=0 TSval=2509909320 TSecr=2509909320"
"3558","17.336583698","127.0.0.1","127.0.0.1","TCP","66","50052  >  4444 [ACK] Seq=237 Ack=1490 Win=80000 Len=0 TSval=2509909325 TSecr=2509909325"
"3578","17.342984511","127.0.0.1","127.0.0.1","TCP","66","50042  >  4444 [ACK] Seq=763 Ack=2195 Win=80640 Len=0 TSval=2509909332 TSecr=2509909290"
"3604","17.352559541","127.0.0.1","127.0.0.1","TCP","66","50058  >  4444 [ACK] Seq=1 Ack=1 Win=65536 Len=0 TSval=2509909341 TSecr=2509909341"
"3606","17.353669528","127.0.0.1","127.0.0.1","TCP","66","4444  >  50058 [ACK] Seq=1 Ack=237 Win=65280 Len=0 TSval=2509909342 TSecr=2509909342"
"3609","17.358622742","127.0.0.1","127.0.0.1","TCP","66","50058  >  4444 [ACK] Seq=237 Ack=1490 Win=80000 Len=0 TSval=2509909347 TSecr=2509909347"
"3617","17.362978463","127.0.0.1","127.0.0.1","TCP","66","50046  >  4444 [ACK] Seq=763 Ack=2195 Win=80640 Len=0 TSval=2509909352 TSecr=2509909311"
"3657","17.377596382","127.0.0.1","127.0.0.1","TCP","66","50066  >  4444 [ACK] Seq=1 Ack=1 Win=65536 Len=0 TSval=2509909366 TSecr=2509909366"
"3659","17.378546922","127.0.0.1","127.0.0.1","TCP","66","4444  >  50066 [ACK] Seq=1 Ack=237 Win=65280 Len=0 TSval=2509909367 TSecr=2509909367"
"3661","17.382443716","127.0.0.1","127.0.0.1","TCP","66","50066  >  4444 [ACK] Seq=237 Ack=1490 Win=80000 Len=0 TSval=2509909371 TSecr=2509909371"
"3662","17.383970586","127.0.0.1","127.0.0.1","TCP","66","50052  >  4444 [ACK] Seq=763 Ack=2195 Win=80640 Len=0 TSval=2509909373 TSecr=2509909332"
"3709","17.399586817","127.0.0.1","127.0.0.1","TCP","66","50076  >  4444 [ACK] Seq=1 Ack=1 Win=65536 Len=0 TSval=2509909388 TSecr=2509909388"
"3711","17.400678576","127.0.0.1","127.0.0.1","TCP","66","4444  >  50076 [ACK] Seq=1 Ack=237 Win=65280 Len=0 TSval=2509909389 TSecr=2509909389"
"3713","17.405543719","127.0.0.1","127.0.0.1","TCP","66","50076  >  4444 [ACK] Seq=237 Ack=1490 Win=80000 Len=0 TSval=2509909394 TSecr=2509909394"
"3714","17.406978329","127.0.0.1","127.0.0.1","TCP","66","50058  >  4444 [ACK] Seq=763 Ack=2195 Win=80640 Len=0 TSval=2509909396 TSecr=2509909355"
"3766","17.424047956","127.0.0.1","127.0.0.1","TCP","66","50090  >  4444 [ACK] Seq=1 Ack=1 Win=65536 Len=0 TSval=2509909413 TSecr=2509909413"
"3768","17.425471322","127.0.0.1","127.0.0.1","TCP","66","4444  >  50090 [ACK] Seq=1 Ack=237 Win=65280 Len=0 TSval=2509909414 TSecr=2509909414"
"3770","17.428383633","127.0.0.1","127.0.0.1","TCP","66","50090  >  4444 [ACK] Seq=237 Ack=1490 Win=80000 Len=0 TSval=2509909417 TSecr=2509909417"
"3774","17.430970275","127.0.0.1","127.0.0.1","TCP","66","50066  >  4444 [ACK] Seq=763 Ack=2195 Win=80640 Len=0 TSval=2509909420 TSecr=2509909378"
"3818","17.445427419","127.0.0.1","127.0.0.1","TCP","66","50100  >  4444 [ACK] Seq=1 Ack=1 Win=65536 Len=0 TSval=2509909434 TSecr=2509909434"
"3820","17.446355400","127.0.0.1","127.0.0.1","TCP","66","4444  >  50100 [ACK] Seq=1 Ack=237 Win=65280 Len=0 TSval=2509909435 TSecr=2509909435"
"3822","17.451385858","127.0.0.1","127.0.0.1","TCP","66","50100  >  4444 [ACK] Seq=237 Ack=1490 Win=80000 Len=0 TSval=2509909440 TSecr=2509909440"
"3823","17.451993896","127.0.0.1","127.0.0.1","TCP","66","50076  >  4444 [ACK] Seq=763 Ack=2195 Win=80640 Len=0 TSval=2509909441 TSecr=2509909400"
"3871","17.468916089","127.0.0.1","127.0.0.1","TCP","66","50104  >  4444 [ACK] Seq=1 Ack=1 Win=65536 Len=0 TSval=2509909457 TSecr=2509909457"
"3873","17.470024610","127.0.0.1","127.0.0.1","TCP","66","4444  >  50104 [ACK] Seq=1 Ack=237 Win=65280 Len=0 TSval=2509909459 TSecr=2509909459"
"3875","17.476206122","127.0.0.1","127.0.0.1","TCP","66","50104  >  4444 [ACK] Seq=237 Ack=1490 Win=80000 Len=0 TSval=2509909465 TSecr=2509909465"
"3876","17.476973747","127.0.0.1","127.0.0.1","TCP","66","50090  >  4444 [ACK] Seq=763 Ack=2195 Win=80640 Len=0 TSval=2509909466 TSecr=2509909424"
"3923","17.493537444","127.0.0.1","127.0.0.1","TCP","66","50116  >  4444 [ACK] Seq=1 Ack=1 Win=65536 Len=0 TSval=2509909482 TSecr=2509909482"
"3925","17.494564810","127.0.0.1","127.0.0.1","TCP","66","4444  >  50116 [ACK] Seq=1 Ack=237 Win=65280 Len=0 TSval=2509909483 TSecr=2509909483"
"3927","17.497412937","127.0.0.1","127.0.0.1","TCP","66","50116  >  4444 [ACK] Seq=237 Ack=1490 Win=80000 Len=0 TSval=2509909486 TSecr=2509909486"
"3928","17.498983458","127.0.0.1","127.0.0.1","TCP","66","50100  >  4444 [ACK] Seq=763 Ack=2195 Win=80640 Len=0 TSval=2509909488 TSecr=2509909447"
"3975","17.515567898","127.0.0.1","127.0.0.1","TCP","66","50130  >  4444 [ACK] Seq=1 Ack=1 Win=65536 Len=0 TSval=2509909504 TSecr=2509909504"
"3977","17.516593378","127.0.0.1","127.0.0.1","TCP","66","4444  >  50130 [ACK] Seq=1 Ack=237 Win=65280 Len=0 TSval=2509909505 TSecr=2509909505"
"3979","17.519253981","127.0.0.1","127.0.0.1","TCP","66","50130  >  4444 [ACK] Seq=237 Ack=1490 Win=80000 Len=0 TSval=2509909508 TSecr=2509909508"
"3991","17.522969397","127.0.0.1","127.0.0.1","TCP","66","50104  >  4444 [ACK] Seq=763 Ack=2195 Win=80640 Len=0 TSval=2509909512 TSecr=2509909471"
"4032","17.536914745","127.0.0.1","127.0.0.1","TCP","66","50132  >  4444 [ACK] Seq=1 Ack=1 Win=65536 Len=0 TSval=2509909525 TSecr=2509909525"
"4034","17.537879323","127.0.0.1","127.0.0.1","TCP","66","4444  >  50132 [ACK] Seq=1 Ack=237 Win=65280 Len=0 TSval=2509909526 TSecr=2509909526"
"4036","17.541325431","127.0.0.1","127.0.0.1","TCP","66","50132  >  4444 [ACK] Seq=237 Ack=1490 Win=80000 Len=0 TSval=2509909530 TSecr=2509909530"
"4049","17.545970715","127.0.0.1","127.0.0.1","TCP","66","50116  >  4444 [ACK] Seq=763 Ack=2195 Win=80640 Len=0 TSval=2509909535 TSecr=2509909494"
"4082","17.558156621","127.0.0.1","127.0.0.1","TCP","66","50148  >  4444 [ACK] Seq=1 Ack=1 Win=65536 Len=0 TSval=2509909547 TSecr=2509909547"
"4084","17.559298526","127.0.0.1","127.0.0.1","TCP","66","4444  >  50148 [ACK] Seq=1 Ack=237 Win=65280 Len=0 TSval=2509909548 TSecr=2509909548"
"4087","17.564731619","127.0.0.1","127.0.0.1","TCP","66","50148  >  4444 [ACK] Seq=237 Ack=1490 Win=80000 Len=0 TSval=2509909553 TSecr=2509909553"
"4088","17.565979892","127.0.0.1","127.0.0.1","TCP","66","50130  >  4444 [ACK] Seq=763 Ack=2195 Win=80640 Len=0 TSval=2509909555 TSecr=2509909514"
"4135","17.580312090","127.0.0.1","127.0.0.1","TCP","66","50164  >  4444 [ACK] Seq=1 Ack=1 Win=65536 Len=0 TSval=2509909569 TSecr=2509909569"
"4137","17.581189716","127.0.0.1","127.0.0.1","TCP","66","4444  >  50164 [ACK] Seq=1 Ack=237 Win=65280 Len=0 TSval=2509909570 TSecr=2509909570"
"4139","17.585056199","127.0.0.1","127.0.0.1","TCP","66","50164  >  4444 [ACK] Seq=237 Ack=1490 Win=80000 Len=0 TSval=2509909574 TSecr=2509909574"
"4143","17.587985063","127.0.0.1","127.0.0.1","TCP","66","50132  >  4444 [ACK] Seq=763 Ack=2195 Win=80640 Len=0 TSval=2509909577 TSecr=2509909536"
"4187","17.600378468","127.0.0.1","127.0.0.1","TCP","66","50174  >  4444 [ACK] Seq=1 Ack=1 Win=65536 Len=0 TSval=2509909589 TSecr=2509909589"
"4189","17.601696512","127.0.0.1","127.0.0.1","TCP","66","4444  >  50174 [ACK] Seq=1 Ack=237 Win=65280 Len=0 TSval=2509909590 TSecr=2509909590"
"4191","17.607102437","127.0.0.1","127.0.0.1","TCP","66","50174  >  4444 [ACK] Seq=237 Ack=1490 Win=80000 Len=0 TSval=2509909596 TSecr=2509909596"
"4200","17.611972609","127.0.0.1","127.0.0.1","TCP","66","50148  >  4444 [ACK] Seq=763 Ack=2195 Win=80640 Len=0 TSval=2509909601 TSecr=2509909560"
"4244","17.626172877","127.0.0.1","127.0.0.1","TCP","66","50180  >  4444 [ACK] Seq=1 Ack=1 Win=65536 Len=0 TSval=2509909615 TSecr=2509909615"
"4246","17.627096179","127.0.0.1","127.0.0.1","TCP","66","4444  >  50180 [ACK] Seq=1 Ack=237 Win=65280 Len=0 TSval=2509909616 TSecr=2509909616"
"4248","17.630876617","127.0.0.1","127.0.0.1","TCP","66","50180  >  4444 [ACK] Seq=237 Ack=1490 Win=80000 Len=0 TSval=2509909619 TSecr=2509909619"
"4250","17.632986173","127.0.0.1","127.0.0.1","TCP","66","50164  >  4444 [ACK] Seq=763 Ack=2195 Win=80640 Len=0 TSval=2509909622 TSecr=2509909580"
"4296","17.648140404","127.0.0.1","127.0.0.1","TCP","66","50194  >  4444 [ACK] Seq=1 Ack=1 Win=65536 Len=0 TSval=2509909637 TSecr=2509909637"
"4298","17.649151566","127.0.0.1","127.0.0.1","TCP","66","4444  >  50194 [ACK] Seq=1 Ack=237 Win=65280 Len=0 TSval=2509909638 TSecr=2509909638"
"4300","17.652150620","127.0.0.1","127.0.0.1","TCP","66","50194  >  4444 [ACK] Seq=237 Ack=1490 Win=80000 Len=0 TSval=2509909641 TSecr=2509909641"
"4304","17.655986373","127.0.0.1","127.0.0.1","TCP","66","50174  >  4444 [ACK] Seq=763 Ack=2195 Win=80640 Len=0 TSval=2509909645 TSecr=2509909604"
"4349","17.671452585","127.0.0.1","127.0.0.1","TCP","66","50202  >  4444 [ACK] Seq=1 Ack=1 Win=65536 Len=0 TSval=2509909660 TSecr=2509909660"
"4351","17.672654064","127.0.0.1","127.0.0.1","TCP","66","4444  >  50202 [ACK] Seq=1 Ack=237 Win=65280 Len=0 TSval=2509909661 TSecr=2509909661"
"4353","17.675564001","127.0.0.1","127.0.0.1","TCP","66","50202  >  4444 [ACK] Seq=237 Ack=1490 Win=80000 Len=0 TSval=2509909664 TSecr=2509909664"
"4358","17.678972884","127.0.0.1","127.0.0.1","TCP","66","50180  >  4444 [ACK] Seq=763 Ack=2195 Win=80640 Len=0 TSval=2509909668 TSecr=2509909627"
"4401","17.693842721","127.0.0.1","127.0.0.1","TCP","66","50212  >  4444 [ACK] Seq=1 Ack=1 Win=65536 Len=0 TSval=2509909682 TSecr=2509909682"
"4403","17.695133737","127.0.0.1","127.0.0.1","TCP","66","4444  >  50212 [ACK] Seq=1 Ack=237 Win=65280 Len=0 TSval=2509909684 TSecr=2509909684"
"4405","17.698877090","127.0.0.1","127.0.0.1","TCP","66","50212  >  4444 [ACK] Seq=237 Ack=1490 Win=80000 Len=0 TSval=2509909687 TSecr=2509909687"
"4406","17.699996994","127.0.0.1","127.0.0.1","TCP","66","50194  >  4444 [ACK] Seq=763 Ack=2195 Win=80640 Len=0 TSval=2509909689 TSecr=2509909648"
"4453","17.719685600","127.0.0.1","127.0.0.1","TCP","66","50216  >  4444 [ACK] Seq=1 Ack=1 Win=65536 Len=0 TSval=2509909708 TSecr=2509909708"
"4455","17.721795715","127.0.0.1","127.0.0.1","TCP","66","4444  >  50216 [ACK] Seq=1 Ack=237 Win=65280 Len=0 TSval=2509909710 TSecr=2509909710"
"4456","17.722976172","127.0.0.1","127.0.0.1","TCP","66","50202  >  4444 [ACK] Seq=763 Ack=2195 Win=80640 Len=0 TSval=2509909712 TSecr=2509909671"
"4459","17.725065194","127.0.0.1","127.0.0.1","TCP","66","50216  >  4444 [ACK] Seq=237 Ack=1490 Win=80000 Len=0 TSval=2509909714 TSecr=2509909714"
"4510","17.745674029","127.0.0.1","127.0.0.1","TCP","66","50222  >  4444 [ACK] Seq=1 Ack=1 Win=65536 Len=0 TSval=2509909734 TSecr=2509909734"
"4512","17.746710892","127.0.0.1","127.0.0.1","TCP","66","4444  >  50222 [ACK] Seq=1 Ack=237 Win=65280 Len=0 TSval=2509909735 TSecr=2509909735"
"4513","17.746980340","127.0.0.1","127.0.0.1","TCP","66","50212  >  4444 [ACK] Seq=763 Ack=2195 Win=80640 Len=0 TSval=2509909736 TSecr=2509909695"
"4516","17.749341325","127.0.0.1","127.0.0.1","TCP","66","50222  >  4444 [ACK] Seq=237 Ack=1490 Win=80000 Len=0 TSval=2509909738 TSecr=2509909738"
"4562","17.764473834","127.0.0.1","127.0.0.1","TCP","66","50228  >  4444 [ACK] Seq=1 Ack=1 Win=65536 Len=0 TSval=2509909753 TSecr=2509909753"
"4564","17.765349784","127.0.0.1","127.0.0.1","TCP","66","4444  >  50228 [ACK] Seq=1 Ack=237 Win=65280 Len=0 TSval=2509909754 TSecr=2509909754"
"4567","17.767722292","127.0.0.1","127.0.0.1","TCP","66","50228  >  4444 [ACK] Seq=237 Ack=1490 Win=80000 Len=0 TSval=2509909756 TSecr=2509909756"
"4587","17.772967931","127.0.0.1","127.0.0.1","TCP","66","50216  >  4444 [ACK] Seq=763 Ack=2195 Win=80640 Len=0 TSval=2509909762 TSecr=2509909721"
"4615","17.782021037","127.0.0.1","127.0.0.1","TCP","66","50236  >  4444 [ACK] Seq=1 Ack=1 Win=65536 Len=0 TSval=2509909771 TSecr=2509909771"
