"No.","Time","Source","Destination","Protocol","Length","Info","src_port","dst_port"
"43","0.716006348","127.0.0.1","127.0.0.1","TCP","66","55376  >  4444 [ACK] Seq=1 Ack=1 Win=630 Len=0 TSval=449438879 TSecr=449428643","55376","4444"
"44","0.716025625","127.0.0.1","127.0.0.1","TCP","66","[TCP ACKed unseen segment] 4444  >  55376 [ACK] Seq=1 Ack=2 Win=512 Len=0 TSval=449438879 TSecr=449408223","4444","55376"
"148","2.508274945","127.0.0.1","127.0.0.1","TCP","66","47384  >  4444 [ACK] Seq=1 Ack=1 Win=630 Len=0 TSval=449440671 TSecr=449430431","47384","4444"
"149","2.508304767","127.0.0.1","127.0.0.1","TCP","66","[TCP ACKed unseen segment] 4444  >  47384 [ACK] Seq=1 Ack=2 Win=512 Len=0 TSval=449440671 TSecr=449410087","4444","47384"
"156","2.589325483","127.0.0.1","127.0.0.1","TLSv1.2","271","Application Data","40572","4444"
"157","2.589519920","127.0.0.1","127.0.0.1","TLSv1.2","271","Application Data","40020","4444"
"158","2.589672034","127.0.0.1","127.0.0.1","TLSv1.2","271","Application Data","40300","4444"
"209","2.594693452","127.0.0.1","127.0.0.1","TLSv1.2","141","Application Data","4444","40572"
"210","2.594719713","127.0.0.1","127.0.0.1","TCP","66","40572  >  4444 [ACK] Seq=206 Ack=76 Win=630 Len=0 TSval=449440757 TSecr=449440757","40572","4444"
"215","2.595300020","127.0.0.1","127.0.0.1","TLSv1.2","141","Application Data","4444","40300"
"216","2.595323487","127.0.0.1","127.0.0.1","TCP","66","40300  >  4444 [ACK] Seq=206 Ack=76 Win=630 Len=0 TSval=449440758 TSecr=449440758","40300","4444"
"226","2.597215616","127.0.0.1","127.0.0.1","TLSv1.2","141","Application Data","4444","40020"
"227","2.597233914","127.0.0.1","127.0.0.1","TCP","66","40020  >  4444 [ACK] Seq=206 Ack=76 Win=630 Len=0 TSval=449440760 TSecr=449440760","40020","4444"
"245","2.689948645","127.0.0.1","127.0.0.1","TLSv1.2","271","Application Data","40490","4444"
"246","2.690660952","127.0.0.1","127.0.0.1","TLSv1.2","271","Application Data","40510","4444"
"254","2.691570141","127.0.0.1","127.0.0.1","TLSv1.2","271","Application Data","40118","4444"
"256","2.691731892","127.0.0.1","127.0.0.1","TLSv1.2","271","Application Data","39994","4444"
"257","2.691974100","127.0.0.1","127.0.0.1","TLSv1.2","271","Application Data","40066","4444"
"258","2.692075300","127.0.0.1","127.0.0.1","TLSv1.2","271","Application Data","40534","4444"
"264","2.692459075","127.0.0.1","127.0.0.1","TLSv1.2","271","Application Data","40394","4444"
"355","2.696116223","127.0.0.1","127.0.0.1","TLSv1.2","141","Application Data","4444","40490"
"357","2.696134661","127.0.0.1","127.0.0.1","TCP","66","40490  >  4444 [ACK] Seq=206 Ack=76 Win=630 Len=0 TSval=449440859 TSecr=449440859","40490","4444"
"383","2.696737387","127.0.0.1","127.0.0.1","TLSv1.2","141","Application Data","4444","40510"
"384","2.696754708","127.0.0.1","127.0.0.1","TCP","66","40510  >  4444 [ACK] Seq=206 Ack=76 Win=630 Len=0 TSval=449440859 TSecr=449440859","40510","4444"
"397","2.697462685","127.0.0.1","127.0.0.1","TLSv1.2","141","Application Data","4444","40118"
"398","2.697465059","127.0.0.1","127.0.0.1","TLSv1.2","141","Application Data","4444","40394"
"399","2.697482659","127.0.0.1","127.0.0.1","TCP","66","40118  >  4444 [ACK] Seq=206 Ack=76 Win=630 Len=0 TSval=449440860 TSecr=449440860","40118","4444"
"400","2.697482659","127.0.0.1","127.0.0.1","TCP","66","40394  >  4444 [ACK] Seq=206 Ack=76 Win=630 Len=0 TSval=449440860 TSecr=449440860","40394","4444"
"401","2.697494183","127.0.0.1","127.0.0.1","TLSv1.2","141","Application Data","4444","39994"
"402","2.697513599","127.0.0.1","127.0.0.1","TCP","66","39994  >  4444 [ACK] Seq=206 Ack=76 Win=630 Len=0 TSval=449440860 TSecr=449440860","39994","4444"
"407","2.697627090","127.0.0.1","127.0.0.1","TLSv1.2","141","Application Data","4444","40534"
"408","2.697645598","127.0.0.1","127.0.0.1","TCP","66","40534  >  4444 [ACK] Seq=206 Ack=76 Win=630 Len=0 TSval=449440860 TSecr=449440860","40534","4444"
"415","2.698427117","127.0.0.1","127.0.0.1","TLSv1.2","141","Application Data","4444","40066"
"416","2.698453378","127.0.0.1","127.0.0.1","TCP","66","40066  >  4444 [ACK] Seq=206 Ack=76 Win=630 Len=0 TSval=449440861 TSecr=449440861","40066","4444"
"446","2.792711243","127.0.0.1","127.0.0.1","TLSv1.2","271","Application Data","40216","4444"
"448","2.793438496","127.0.0.1","127.0.0.1","TLSv1.2","271","Application Data","40572","4444"
"449","2.793723447","127.0.0.1","127.0.0.1","TLSv1.2","271","[TCP Previous segment not captured] , Application Data","55376","4444"
"453","2.794001064","127.0.0.1","127.0.0.1","TLSv1.2","271","Application Data","40748","4444"
"468","2.795201978","127.0.0.1","127.0.0.1","TLSv1.2","271","Application Data","39976","4444"
"472","2.795639182","127.0.0.1","127.0.0.1","TLSv1.2","271","Application Data","40114","4444"
"497","2.796564154","127.0.0.1","127.0.0.1","TLSv1.2","271","Application Data","40604","4444"
"511","2.796926209","127.0.0.1","127.0.0.1","TLSv1.2","271","Application Data","39938","4444"
"513","2.797021123","127.0.0.1","127.0.0.1","TLSv1.2","271","Application Data","40388","4444"
"576","2.798368982","127.0.0.1","127.0.0.1","TLSv1.2","141","Application Data","4444","40572"
"577","2.798376664","127.0.0.1","127.0.0.1","TLSv1.2","141","Application Data","4444","55376"
"578","2.798383928","127.0.0.1","127.0.0.1","TCP","66","40572  >  4444 [ACK] Seq=411 Ack=151 Win=630 Len=0 TSval=449440961 TSecr=449440961","40572","4444"
"581","2.798394404","127.0.0.1","127.0.0.1","TCP","66","55376  >  4444 [ACK] Seq=207 Ack=76 Win=630 Len=0 TSval=449440961 TSecr=449440961","55376","4444"
"589","2.798624739","127.0.0.1","127.0.0.1","TLSv1.2","141","Application Data","4444","40216"
"590","2.798636682","127.0.0.1","127.0.0.1","TCP","66","40216  >  4444 [ACK] Seq=206 Ack=76 Win=630 Len=0 TSval=449440961 TSecr=449440961","40216","4444"
"618","2.799385516","127.0.0.1","127.0.0.1","TLSv1.2","141","Application Data","4444","40748"
"620","2.799398786","127.0.0.1","127.0.0.1","TCP","66","40748  >  4444 [ACK] Seq=206 Ack=76 Win=630 Len=0 TSval=449440962 TSecr=449440962","40748","4444"
"628","2.799753368","127.0.0.1","127.0.0.1","TLSv1.2","271","Application Data","40418","4444"
"630","2.799818180","127.0.0.1","127.0.0.1","TLSv1.2","141","Application Data","4444","40114"
"631","2.799821043","127.0.0.1","127.0.0.1","TLSv1.2","141","Application Data","4444","39976"
"632","2.799837805","127.0.0.1","127.0.0.1","TCP","66","39976  >  4444 [ACK] Seq=206 Ack=76 Win=630 Len=0 TSval=449440962 TSecr=449440962","39976","4444"
"633","2.799838713","127.0.0.1","127.0.0.1","TCP","66","40114  >  4444 [ACK] Seq=206 Ack=76 Win=630 Len=0 TSval=449440962 TSecr=449440962","40114","4444"
"661","2.800787222","127.0.0.1","127.0.0.1","TLSv1.2","141","Application Data","4444","39938"
"662","2.800798466","127.0.0.1","127.0.0.1","TCP","66","39938  >  4444 [ACK] Seq=206 Ack=76 Win=630 Len=0 TSval=449440963 TSecr=449440963","39938","4444"
"664","2.800897571","127.0.0.1","127.0.0.1","TLSv1.2","141","Application Data","4444","40604"
"665","2.800915799","127.0.0.1","127.0.0.1","TCP","66","40604  >  4444 [ACK] Seq=206 Ack=76 Win=630 Len=0 TSval=449440963 TSecr=449440963","40604","4444"
"668","2.801044097","127.0.0.1","127.0.0.1","TLSv1.2","141","Application Data","4444","40388"
"669","2.801063373","127.0.0.1","127.0.0.1","TCP","66","40388  >  4444 [ACK] Seq=206 Ack=76 Win=630 Len=0 TSval=449440964 TSecr=449440964","40388","4444"
"688","2.803011025","127.0.0.1","127.0.0.1","TLSv1.2","141","Application Data","4444","40418"
"689","2.803023876","127.0.0.1","127.0.0.1","TCP","66","40418  >  4444 [ACK] Seq=206 Ack=76 Win=630 Len=0 TSval=449440966 TSecr=449440966","40418","4444"
"728","2.896370248","127.0.0.1","127.0.0.1","TLSv1.2","271","Application Data","40692","4444"
"730","2.897228453","127.0.0.1","127.0.0.1","TLSv1.2","271","Application Data","39958","4444"
"767","2.900041503","127.0.0.1","127.0.0.1","TLSv1.2","141","Application Data","4444","40692"
"768","2.900060081","127.0.0.1","127.0.0.1","TCP","66","40692  >  4444 [ACK] Seq=206 Ack=76 Win=630 Len=0 TSval=449441063 TSecr=449441063","40692","4444"
"772","2.900577602","127.0.0.1","127.0.0.1","TLSv1.2","141","Application Data","4444","39958"
"773","2.900594713","127.0.0.1","127.0.0.1","TCP","66","39958  >  4444 [ACK] Seq=206 Ack=76 Win=630 Len=0 TSval=449441063 TSecr=449441063","39958","4444"
"788","2.995540930","127.0.0.1","127.0.0.1","TLSv1.2","271","Application Data","40176","4444"
"789","2.995618942","127.0.0.1","127.0.0.1","TLSv1.2","271","Application Data","40008","4444"
"798","2.997192038","127.0.0.1","127.0.0.1","TLSv1.2","271","Application Data","40186","4444"
"825","2.999646595","127.0.0.1","127.0.0.1","TLSv1.2","271","Application Data","40588","4444"
"845","3.000786538","127.0.0.1","127.0.0.1","TLSv1.2","141","Application Data","4444","40176"
"846","3.000806023","127.0.0.1","127.0.0.1","TCP","66","40176  >  4444 [ACK] Seq=206 Ack=76 Win=630 Len=0 TSval=449441163 TSecr=449441163","40176","4444"
"849","3.001047044","127.0.0.1","127.0.0.1","TLSv1.2","141","Application Data","4444","40008"
"850","3.001065971","127.0.0.1","127.0.0.1","TCP","66","40008  >  4444 [ACK] Seq=206 Ack=76 Win=630 Len=0 TSval=449441164 TSecr=449441164","40008","4444"
"863","3.001905039","127.0.0.1","127.0.0.1","TLSv1.2","271","Application Data","40086","4444"
"872","3.002665327","127.0.0.1","127.0.0.1","TLSv1.2","141","Application Data","4444","40186"
"873","3.002684882","127.0.0.1","127.0.0.1","TCP","66","40186  >  4444 [ACK] Seq=206 Ack=76 Win=630 Len=0 TSval=449441165 TSecr=449441165","40186","4444"
"893","3.005047669","127.0.0.1","127.0.0.1","TLSv1.2","141","Application Data","4444","40588"
"894","3.005073021","127.0.0.1","127.0.0.1","TCP","66","40588  >  4444 [ACK] Seq=206 Ack=76 Win=630 Len=0 TSval=449441168 TSecr=449441168","40588","4444"
"904","3.006609450","127.0.0.1","127.0.0.1","TLSv1.2","141","Application Data","4444","40086"
"905","3.006630263","127.0.0.1","127.0.0.1","TCP","66","40086  >  4444 [ACK] Seq=206 Ack=76 Win=630 Len=0 TSval=449441169 TSecr=449441169","40086","4444"
"929","3.097880222","127.0.0.1","127.0.0.1","TLSv1.2","271","Application Data","40510","4444"
"930","3.098100221","127.0.0.1","127.0.0.1","TLSv1.2","271","Application Data","40646","4444"
"931","3.098292423","127.0.0.1","127.0.0.1","TLSv1.2","271","Application Data","40378","4444"
"933","3.098878108","127.0.0.1","127.0.0.1","TLSv1.2","271","Application Data","40016","4444"
"987","3.103041462","127.0.0.1","127.0.0.1","TLSv1.2","271","Application Data","40180","4444"
"1009","3.104096478","127.0.0.1","127.0.0.1","TLSv1.2","141","Application Data","4444","40510"
"1011","3.104108561","127.0.0.1","127.0.0.1","TCP","66","40510  >  4444 [ACK] Seq=411 Ack=151 Win=630 Len=0 TSval=449441267 TSecr=449441267","40510","4444"
"1016","3.104503371","127.0.0.1","127.0.0.1","TLSv1.2","141","Application Data","4444","40646"
"1017","3.104533962","127.0.0.1","127.0.0.1","TCP","66","40646  >  4444 [ACK] Seq=206 Ack=76 Win=630 Len=0 TSval=449441267 TSecr=449441267","40646","4444"
"1023","3.105141717","127.0.0.1","127.0.0.1","TLSv1.2","141","Application Data","4444","40016"
"1024","3.105144999","127.0.0.1","127.0.0.1","TLSv1.2","141","Application Data","4444","40378"
"1025","3.105166510","127.0.0.1","127.0.0.1","TCP","66","40016  >  4444 [ACK] Seq=206 Ack=76 Win=630 Len=0 TSval=449441268 TSecr=449441268","40016","4444"
"1026","3.105166510","127.0.0.1","127.0.0.1","TCP","66","40378  >  4444 [ACK] Seq=206 Ack=76 Win=630 Len=0 TSval=449441268 TSecr=449441268","40378","4444"
"1047","3.108517405","127.0.0.1","127.0.0.1","TLSv1.2","141","Application Data","4444","40180"
"1048","3.108541221","127.0.0.1","127.0.0.1","TCP","66","40180  >  4444 [ACK] Seq=206 Ack=76 Win=630 Len=0 TSval=449441271 TSecr=449441271","40180","4444"
"1072","3.199109324","127.0.0.1","127.0.0.1","TLSv1.2","271","Application Data","40634","4444"
"1073","3.199318148","127.0.0.1","127.0.0.1","TLSv1.2","271","Application Data","40588","4444"
"1074","3.199480388","127.0.0.1","127.0.0.1","TLSv1.2","271","Application Data","40512","4444"
"1075","3.199857250","127.0.0.1","127.0.0.1","TLSv1.2","271","Application Data","40008","4444"
"1153","3.205057042","127.0.0.1","127.0.0.1","TLSv1.2","141","Application Data","4444","40588"
"1155","3.205075690","127.0.0.1","127.0.0.1","TCP","66","40588  >  4444 [ACK] Seq=411 Ack=151 Win=630 Len=0 TSval=449441368 TSecr=449441368","40588","4444"
"1157","3.205288844","127.0.0.1","127.0.0.1","TLSv1.2","141","Application Data","4444","40008"
"1159","3.205309028","127.0.0.1","127.0.0.1","TCP","66","40008  >  4444 [ACK] Seq=411 Ack=151 Win=630 Len=0 TSval=449441368 TSecr=449441368","40008","4444"
"1161","3.205466310","127.0.0.1","127.0.0.1","TLSv1.2","141","Application Data","4444","40634"
"1162","3.205481535","127.0.0.1","127.0.0.1","TCP","66","40634  >  4444 [ACK] Seq=206 Ack=76 Win=630 Len=0 TSval=449441368 TSecr=449441368","40634","4444"
"1165","3.205574353","127.0.0.1","127.0.0.1","TLSv1.2","271","Application Data","40252","4444"
"1169","3.205856371","127.0.0.1","127.0.0.1","TLSv1.2","271","Application Data","40678","4444"
"1182","3.207494279","127.0.0.1","127.0.0.1","TLSv1.2","141","Application Data","4444","40512"
"1183","3.207520120","127.0.0.1","127.0.0.1","TCP","66","40512  >  4444 [ACK] Seq=206 Ack=76 Win=630 Len=0 TSval=449441370 TSecr=449441370","40512","4444"
"1214","3.210882050","127.0.0.1","127.0.0.1","TLSv1.2","141","Application Data","4444","40252"
"1215","3.210905447","127.0.0.1","127.0.0.1","TCP","66","40252  >  4444 [ACK] Seq=206 Ack=76 Win=630 Len=0 TSval=449441373 TSecr=449441373","40252","4444"
"1218","3.211420174","127.0.0.1","127.0.0.1","TLSv1.2","141","Application Data","4444","40678"
"1219","3.211441266","127.0.0.1","127.0.0.1","TCP","66","40678  >  4444 [ACK] Seq=206 Ack=76 Win=630 Len=0 TSval=449441374 TSecr=449441374","40678","4444"
"1246","3.300823052","127.0.0.1","127.0.0.1","TLSv1.2","271","Application Data","40012","4444"
"1247","3.301067285","127.0.0.1","127.0.0.1","TLSv1.2","271","Application Data","40158","4444"
"1248","3.301307887","127.0.0.1","127.0.0.1","TLSv1.2","271","Application Data","39986","4444"
"1284","3.305328835","127.0.0.1","127.0.0.1","TLSv1.2","271","Application Data","40520","4444"
"1307","3.306451108","127.0.0.1","127.0.0.1","TLSv1.2","271","Application Data","40658","4444"
"1314","3.307015632","127.0.0.1","127.0.0.1","TLSv1.2","141","Application Data","4444","39986"
"1315","3.307039448","127.0.0.1","127.0.0.1","TCP","66","39986  >  4444 [ACK] Seq=206 Ack=76 Win=630 Len=0 TSval=449441470 TSecr=449441470","39986","4444"
"1320","3.307397592","127.0.0.1","127.0.0.1","TLSv1.2","141","Application Data","4444","40158"
"1321","3.307425039","127.0.0.1","127.0.0.1","TCP","66","40158  >  4444 [ACK] Seq=206 Ack=76 Win=630 Len=0 TSval=449441470 TSecr=449441470","40158","4444"
"1323","3.307443687","127.0.0.1","127.0.0.1","TLSv1.2","141","Application Data","4444","40012"
"1324","3.307466455","127.0.0.1","127.0.0.1","TCP","66","40012  >  4444 [ACK] Seq=206 Ack=76 Win=630 Len=0 TSval=449441470 TSecr=449441470","40012","4444"
"1353","3.310292496","127.0.0.1","127.0.0.1","TLSv1.2","141","Application Data","4444","40520"
"1354","3.310314146","127.0.0.1","127.0.0.1","TCP","66","40520  >  4444 [ACK] Seq=206 Ack=76 Win=630 Len=0 TSval=449441473 TSecr=449441473","40520","4444"
"1364","3.312076441","127.0.0.1","127.0.0.1","TLSv1.2","141","Application Data","4444","40658"
"1365","3.312104028","127.0.0.1","127.0.0.1","TCP","66","40658  >  4444 [ACK] Seq=206 Ack=76 Win=630 Len=0 TSval=449441475 TSecr=449441475","40658","4444"
"1367","3.312346655","127.0.0.1","127.0.0.1","TLSv1.2","271","Application Data","40604","4444"
"1369","3.312811307","127.0.0.1","127.0.0.1","TLSv1.2","271","Application Data","40104","4444"
"1412","3.318225161","127.0.0.1","127.0.0.1","TLSv1.2","141","Application Data","4444","40604"
"1413","3.318248768","127.0.0.1","127.0.0.1","TCP","66","40604  >  4444 [ACK] Seq=411 Ack=151 Win=630 Len=0 TSval=449441481 TSecr=449441481","40604","4444"
"1416","3.318765450","127.0.0.1","127.0.0.1","TLSv1.2","141","Application Data","4444","40104"
"1417","3.318806726","127.0.0.1","127.0.0.1","TCP","66","40104  >  4444 [ACK] Seq=206 Ack=76 Win=630 Len=0 TSval=449441481 TSecr=449441481","40104","4444"
"1447","3.403474253","127.0.0.1","127.0.0.1","TLSv1.2","271","Application Data","40692","4444"
"1448","3.403711154","127.0.0.1","127.0.0.1","TLSv1.2","271","Application Data","40490","4444"
"1452","3.404760094","127.0.0.1","127.0.0.1","TLSv1.2","271","Application Data","39958","4444"
"1456","3.405108250","127.0.0.1","127.0.0.1","TLSv1.2","271","Application Data","40646","4444"
"1462","3.405631079","127.0.0.1","127.0.0.1","TLSv1.2","271","Application Data","40696","4444"
"1538","3.409588053","127.0.0.1","127.0.0.1","TLSv1.2","271","Application Data","40460","4444"
"1544","3.409728014","127.0.0.1","127.0.0.1","TLSv1.2","141","Application Data","4444","40490"
"1545","3.409759024","127.0.0.1","127.0.0.1","TCP","66","40490  >  4444 [ACK] Seq=411 Ack=151 Win=630 Len=0 TSval=449441572 TSecr=449441572","40490","4444"
"1546","3.409804909","127.0.0.1","127.0.0.1","TLSv1.2","271","Application Data","40112","4444"
"1551","3.410181701","127.0.0.1","127.0.0.1","TLSv1.2","141","Application Data","4444","40692"
"1553","3.410205656","127.0.0.1","127.0.0.1","TCP","66","40692  >  4444 [ACK] Seq=411 Ack=151 Win=630 Len=0 TSval=449441573 TSecr=449441573","40692","4444"
"1565","3.410879341","127.0.0.1","127.0.0.1","TLSv1.2","141","Application Data","4444","40646"
"1566","3.410905392","127.0.0.1","127.0.0.1","TCP","66","40646  >  4444 [ACK] Seq=411 Ack=151 Win=630 Len=0 TSval=449441573 TSecr=449441573","40646","4444"
"1567","3.410929696","127.0.0.1","127.0.0.1","TLSv1.2","141","Application Data","4444","39958"
"1568","3.410950998","127.0.0.1","127.0.0.1","TCP","66","39958  >  4444 [ACK] Seq=411 Ack=151 Win=630 Len=0 TSval=449441573 TSecr=449441573","39958","4444"
"1573","3.411148298","127.0.0.1","127.0.0.1","TLSv1.2","141","Application Data","4444","40696"
"1574","3.411173860","127.0.0.1","127.0.0.1","TCP","66","40696  >  4444 [ACK] Seq=206 Ack=76 Win=630 Len=0 TSval=449441574 TSecr=449441574","40696","4444"
"1593","3.413069760","127.0.0.1","127.0.0.1","TLSv1.2","271","Application Data","40272","4444"
"1620","3.415552813","127.0.0.1","127.0.0.1","TLSv1.2","141","Application Data","4444","40460"
"1621","3.415552813","127.0.0.1","127.0.0.1","TLSv1.2","141","Application Data","4444","40112"
"1622","3.415579003","127.0.0.1","127.0.0.1","TCP","66","40460  >  4444 [ACK] Seq=206 Ack=76 Win=630 Len=0 TSval=449441578 TSecr=449441578","40460","4444"
"1623","3.415579003","127.0.0.1","127.0.0.1","TCP","66","40112  >  4444 [ACK] Seq=206 Ack=76 Win=630 Len=0 TSval=449441578 TSecr=449441578","40112","4444"
"1637","3.418114436","127.0.0.1","127.0.0.1","TLSv1.2","141","Application Data","4444","40272"
"1638","3.418138322","127.0.0.1","127.0.0.1","TCP","66","40272  >  4444 [ACK] Seq=206 Ack=76 Win=630 Len=0 TSval=449441581 TSecr=449441581","40272","4444"
"1671","3.508808252","127.0.0.1","127.0.0.1","TLSv1.2","271","Application Data","40732","4444"
"1691","3.513986604","127.0.0.1","127.0.0.1","TLSv1.2","141","Application Data","4444","40732"
"1692","3.514007626","127.0.0.1","127.0.0.1","TCP","66","40732  >  4444 [ACK] Seq=206 Ack=76 Win=630 Len=0 TSval=449441677 TSecr=449441677","40732","4444"
"1695","3.515872237","127.0.0.1","127.0.0.1","TLSv1.2","271","Application Data","39938","4444"
"1717","3.521982475","127.0.0.1","127.0.0.1","TLSv1.2","141","Application Data","4444","39938"
"1718","3.522009713","127.0.0.1","127.0.0.1","TCP","66","39938  >  4444 [ACK] Seq=411 Ack=151 Win=630 Len=0 TSval=449441685 TSecr=449441685","39938","4444"
"1733","3.606295211","127.0.0.1","127.0.0.1","TLSv1.2","271","Application Data","40114","4444"
"1734","3.606489229","127.0.0.1","127.0.0.1","TLSv1.2","271","Application Data","40330","4444"
"1736","3.607106343","127.0.0.1","127.0.0.1","TLSv1.2","271","Application Data","40196","4444"
"1738","3.607276266","127.0.0.1","127.0.0.1","TLSv1.2","271","Application Data","40036","4444"
"1741","3.607431242","127.0.0.1","127.0.0.1","TLSv1.2","271","Application Data","40646","4444"
"1774","3.609588138","127.0.0.1","127.0.0.1","TLSv1.2","271","Application Data","40044","4444"
"1841","3.612869122","127.0.0.1","127.0.0.1","TLSv1.2","141","Application Data","4444","40646"
"1842","3.612894894","127.0.0.1","127.0.0.1","TCP","66","40646  >  4444 [ACK] Seq=616 Ack=226 Win=630 Len=0 TSval=449441775 TSecr=449441775","40646","4444"
"1845","3.613040931","127.0.0.1","127.0.0.1","TLSv1.2","141","Application Data","4444","40114"
"1846","3.613067191","127.0.0.1","127.0.0.1","TCP","66","40114  >  4444 [ACK] Seq=411 Ack=151 Win=630 Len=0 TSval=449441776 TSecr=449441776","40114","4444"
"1853","3.613622216","127.0.0.1","127.0.0.1","TLSv1.2","141","Application Data","4444","40330"
"1854","3.613647778","127.0.0.1","127.0.0.1","TCP","66","40330  >  4444 [ACK] Seq=206 Ack=76 Win=630 Len=0 TSval=449441776 TSecr=449441776","40330","4444"
"1855","3.613711543","127.0.0.1","127.0.0.1","TLSv1.2","141","Application Data","4444","40196"
"1856","3.613731867","127.0.0.1","127.0.0.1","TCP","66","40196  >  4444 [ACK] Seq=206 Ack=76 Win=630 Len=0 TSval=449441776 TSecr=449441776","40196","4444"
"1857","3.613772514","127.0.0.1","127.0.0.1","TLSv1.2","271","Application Data","40666","4444"
"1863","3.614051039","127.0.0.1","127.0.0.1","TLSv1.2","271","Application Data","40132","4444"
"1870","3.614452345","127.0.0.1","127.0.0.1","TLSv1.2","141","Application Data","4444","40036"
"1871","3.614478326","127.0.0.1","127.0.0.1","TCP","66","40036  >  4444 [ACK] Seq=206 Ack=76 Win=630 Len=0 TSval=449441777 TSecr=449441777","40036","4444"
"1892","3.616589406","127.0.0.1","127.0.0.1","TLSv1.2","141","Application Data","4444","40044"
"1893","3.616616015","127.0.0.1","127.0.0.1","TCP","66","40044  >  4444 [ACK] Seq=206 Ack=76 Win=630 Len=0 TSval=449441779 TSecr=449441779","40044","4444"
"1897","3.617204774","127.0.0.1","127.0.0.1","TLSv1.2","271","Application Data","40764","4444"
"1929","3.619689572","127.0.0.1","127.0.0.1","TLSv1.2","141","Application Data","4444","40666"
"1930","3.619717997","127.0.0.1","127.0.0.1","TCP","66","40666  >  4444 [ACK] Seq=206 Ack=76 Win=630 Len=0 TSval=449441782 TSecr=449441782","40666","4444"
"1936","3.620439942","127.0.0.1","127.0.0.1","TLSv1.2","141","Application Data","4444","40132"
"1937","3.620464387","127.0.0.1","127.0.0.1","TCP","66","40132  >  4444 [ACK] Seq=206 Ack=76 Win=630 Len=0 TSval=449441783 TSecr=449441783","40132","4444"
"1949","3.622685815","127.0.0.1","127.0.0.1","TLSv1.2","141","Application Data","4444","40764"
"1950","3.622710190","127.0.0.1","127.0.0.1","TCP","66","40764  >  4444 [ACK] Seq=206 Ack=76 Win=630 Len=0 TSval=449441785 TSecr=449441785","40764","4444"
"1985","3.708257991","127.0.0.1","127.0.0.1","TLSv1.2","271","Application Data","40722","4444"
"1986","3.708455082","127.0.0.1","127.0.0.1","TLSv1.2","271","Application Data","40100","4444"
"1987","3.708612434","127.0.0.1","127.0.0.1","TLSv1.2","271","Application Data","40388","4444"
"1991","3.709314474","127.0.0.1","127.0.0.1","TLSv1.2","271","Application Data","40154","4444"
"1994","3.709601171","127.0.0.1","127.0.0.1","TLSv1.2","271","Application Data","40058","4444"
"2023","3.711484150","127.0.0.1","127.0.0.1","TLSv1.2","271","Application Data","40572","4444"
"2086","3.714307468","127.0.0.1","127.0.0.1","TLSv1.2","271","Application Data","40490","4444"
"2102","3.715403131","127.0.0.1","127.0.0.1","TLSv1.2","141","Application Data","4444","40154"
"2104","3.715432674","127.0.0.1","127.0.0.1","TCP","66","40154  >  4444 [ACK] Seq=206 Ack=76 Win=630 Len=0 TSval=449441878 TSecr=449441878","40154","4444"
"2106","3.715643873","127.0.0.1","127.0.0.1","TLSv1.2","141","Application Data","4444","40722"
"2107","3.715651415","127.0.0.1","127.0.0.1","TLSv1.2","141","Application Data","4444","40100"
"2108","3.715669155","127.0.0.1","127.0.0.1","TCP","66","40722  >  4444 [ACK] Seq=206 Ack=76 Win=630 Len=0 TSval=449441878 TSecr=449441878","40722","4444"
"2109","3.715673834","127.0.0.1","127.0.0.1","TCP","66","40100  >  4444 [ACK] Seq=206 Ack=76 Win=630 Len=0 TSval=449441878 TSecr=449441878","40100","4444"
"2111","3.715738647","127.0.0.1","127.0.0.1","TLSv1.2","141","Application Data","4444","40058"
"2112","3.715763091","127.0.0.1","127.0.0.1","TCP","66","40058  >  4444 [ACK] Seq=206 Ack=76 Win=630 Len=0 TSval=449441878 TSecr=449441878","40058","4444"
"2125","3.716697422","127.0.0.1","127.0.0.1","TLSv1.2","141","Application Data","4444","40388"
"2126","3.716719422","127.0.0.1","127.0.0.1","TCP","66","40388  >  4444 [ACK] Seq=411 Ack=151 Win=630 Len=0 TSval=449441879 TSecr=449441879","40388","4444"
"2140","3.717832616","127.0.0.1","127.0.0.1","TLSv1.2","141","Application Data","4444","40572"
"2141","3.717851123","127.0.0.1","127.0.0.1","TCP","66","40572  >  4444 [ACK] Seq=616 Ack=226 Win=630 Len=0 TSval=449441880 TSecr=449441880","40572","4444"
"2152","3.719147230","127.0.0.1","127.0.0.1","TLSv1.2","141","Application Data","4444","40490"
"2153","3.719164760","127.0.0.1","127.0.0.1","TCP","66","40490  >  4444 [ACK] Seq=616 Ack=226 Win=630 Len=0 TSval=449441882 TSecr=449441882","40490","4444"
"2182","3.809692565","127.0.0.1","127.0.0.1","TLSv1.2","271","Application Data","40588","4444"
"2183","3.809827148","127.0.0.1","127.0.0.1","TLSv1.2","271","Application Data","40012","4444"
"2192","3.810971910","127.0.0.1","127.0.0.1","TLSv1.2","271","Application Data","40394","4444"
"2206","3.812254468","127.0.0.1","127.0.0.1","TLSv1.2","271","[TCP Previous segment not captured] , Application Data","47384","4444"
"2213","3.812607932","127.0.0.1","127.0.0.1","TLSv1.2","271","Application Data","39968","4444"
"2267","3.814966878","127.0.0.1","127.0.0.1","TLSv1.2","141","Application Data","4444","40012"
"2268","3.814983570","127.0.0.1","127.0.0.1","TCP","66","40012  >  4444 [ACK] Seq=411 Ack=151 Win=630 Len=0 TSval=449441978 TSecr=449441978","40012","4444"
"2271","3.815388158","127.0.0.1","127.0.0.1","TLSv1.2","141","Application Data","4444","40588"
"2272","3.815399542","127.0.0.1","127.0.0.1","TCP","66","40588  >  4444 [ACK] Seq=616 Ack=226 Win=630 Len=0 TSval=449441978 TSecr=449441978","40588","4444"
"2273","3.815421961","127.0.0.1","127.0.0.1","TLSv1.2","271","Application Data","40260","4444"
"2285","3.815860911","127.0.0.1","127.0.0.1","TLSv1.2","271","Application Data","39986","4444"
"2292","3.816320952","127.0.0.1","127.0.0.1","TLSv1.2","141","Application Data","4444","40394"
"2294","3.816356781","127.0.0.1","127.0.0.1","TCP","66","40394  >  4444 [ACK] Seq=411 Ack=151 Win=630 Len=0 TSval=449441979 TSecr=449441979","40394","4444"
"2304","3.816715623","127.0.0.1","127.0.0.1","TLSv1.2","141","Application Data","4444","47384"
"2305","3.816737483","127.0.0.1","127.0.0.1","TCP","66","47384  >  4444 [ACK] Seq=207 Ack=76 Win=630 Len=0 TSval=449441979 TSecr=449441979","47384","4444"
"2321","3.817851724","127.0.0.1","127.0.0.1","TLSv1.2","141","Application Data","4444","39968"
"2322","3.817863597","127.0.0.1","127.0.0.1","TCP","66","39968  >  4444 [ACK] Seq=206 Ack=76 Win=630 Len=0 TSval=449441980 TSecr=449441980","39968","4444"
"2344","3.819218091","127.0.0.1","127.0.0.1","TLSv1.2","141","Application Data","4444","40260"
"2346","3.819241907","127.0.0.1","127.0.0.1","TCP","66","40260  >  4444 [ACK] Seq=206 Ack=76 Win=630 Len=0 TSval=449441982 TSecr=449441982","40260","4444"
"2349","3.819485652","127.0.0.1","127.0.0.1","TLSv1.2","141","Application Data","4444","39986"
"2350","3.819501506","127.0.0.1","127.0.0.1","TCP","66","39986  >  4444 [ACK] Seq=411 Ack=151 Win=630 Len=0 TSval=449441982 TSecr=449441982","39986","4444"
"2353","3.819802799","127.0.0.1","127.0.0.1","TLSv1.2","271","Application Data","40512","4444"
"2373","3.822554459","127.0.0.1","127.0.0.1","TLSv1.2","141","Application Data","4444","40512"
"2374","3.822575482","127.0.0.1","127.0.0.1","TCP","66","40512  >  4444 [ACK] Seq=411 Ack=151 Win=630 Len=0 TSval=449441985 TSecr=449441985","40512","4444"
"2406","3.912258072","127.0.0.1","127.0.0.1","TLSv1.2","271","Application Data","40426","4444"
"2410","3.913538604","127.0.0.1","127.0.0.1","TLSv1.2","271","Application Data","40490","4444"
"2436","3.916582688","127.0.0.1","127.0.0.1","TLSv1.2","271","Application Data","40154","4444"
"2444","3.917361624","127.0.0.1","127.0.0.1","TLSv1.2","141","Application Data","4444","40426"
"2446","3.917380620","127.0.0.1","127.0.0.1","TCP","66","40426  >  4444 [ACK] Seq=206 Ack=76 Win=630 Len=0 TSval=449442080 TSecr=449442080","40426","4444"
"2464","3.918752854","127.0.0.1","127.0.0.1","TLSv1.2","141","Application Data","4444","40490"
"2465","3.918771082","127.0.0.1","127.0.0.1","TCP","66","40490  >  4444 [ACK] Seq=821 Ack=301 Win=630 Len=0 TSval=449442081 TSecr=449442081","40490","4444"
"2468","3.918976135","127.0.0.1","127.0.0.1","TLSv1.2","271","Application Data","40560","4444"
"2469","3.919061131","127.0.0.1","127.0.0.1","TLSv1.2","271","Application Data","40242","4444"
"2472","3.919212407","127.0.0.1","127.0.0.1","TLSv1.2","271","Application Data","40460","4444"
"2489","3.920138357","127.0.0.1","127.0.0.1","TLSv1.2","141","Application Data","4444","40154"
"2490","3.920159100","127.0.0.1","127.0.0.1","TCP","66","40154  >  4444 [ACK] Seq=411 Ack=151 Win=630 Len=0 TSval=449442083 TSecr=449442083","40154","4444"
"2532","3.922150822","127.0.0.1","127.0.0.1","TLSv1.2","141","Application Data","4444","40560"
"2533","3.922172263","127.0.0.1","127.0.0.1","TCP","66","40560  >  4444 [ACK] Seq=206 Ack=76 Win=630 Len=0 TSval=449442085 TSecr=449442085","40560","4444"
"2536","3.922528940","127.0.0.1","127.0.0.1","TLSv1.2","141","Application Data","4444","40242"
"2537","3.922543816","127.0.0.1","127.0.0.1","TCP","66","40242  >  4444 [ACK] Seq=206 Ack=76 Win=630 Len=0 TSval=449442085 TSecr=449442085","40242","4444"
"2547","3.923443506","127.0.0.1","127.0.0.1","TLSv1.2","141","Application Data","4444","40460"
"2548","3.923461106","127.0.0.1","127.0.0.1","TCP","66","40460  >  4444 [ACK] Seq=411 Ack=151 Win=630 Len=0 TSval=449442086 TSecr=449442086","40460","4444"
"2551","3.923691860","127.0.0.1","127.0.0.1","TLSv1.2","271","Application Data","40236","4444"
"2552","3.923759117","127.0.0.1","127.0.0.1","TLSv1.2","271","Application Data","40016","4444"
"2591","3.927372684","127.0.0.1","127.0.0.1","TLSv1.2","141","Application Data","4444","40016"
"2592","3.927390703","127.0.0.1","127.0.0.1","TCP","66","40016  >  4444 [ACK] Seq=411 Ack=151 Win=630 Len=0 TSval=449442090 TSecr=449442090","40016","4444"
"2595","3.927713228","127.0.0.1","127.0.0.1","TLSv1.2","141","Application Data","4444","40236"
"2596","3.927729501","127.0.0.1","127.0.0.1","TCP","66","40236  >  4444 [ACK] Seq=206 Ack=76 Win=630 Len=0 TSval=449442090 TSecr=449442090","40236","4444"
"2628","4.012494595","127.0.0.1","127.0.0.1","TLSv1.2","271","Application Data","40514","4444"
"2633","4.013871857","127.0.0.1","127.0.0.1","TLSv1.2","271","Application Data","40060","4444"
"2660","4.016692730","127.0.0.1","127.0.0.1","TLSv1.2","141","Application Data","4444","40514"
"2661","4.016713263","127.0.0.1","127.0.0.1","TCP","66","40514  >  4444 [ACK] Seq=206 Ack=76 Win=630 Len=0 TSval=449442179 TSecr=449442179","40514","4444"
"2672","4.018101001","127.0.0.1","127.0.0.1","TLSv1.2","141","Application Data","4444","40060"
"2673","4.018117973","127.0.0.1","127.0.0.1","TCP","66","40060  >  4444 [ACK] Seq=206 Ack=76 Win=630 Len=0 TSval=449442181 TSecr=449442181","40060","4444"
"2675","4.018319813","127.0.0.1","127.0.0.1","TLSv1.2","271","Application Data","40114","4444"
"2687","4.019806306","127.0.0.1","127.0.0.1","TLSv1.2","271","Application Data","55376","4444"
"2700","4.020880039","127.0.0.1","127.0.0.1","TLSv1.2","271","Application Data","40470","4444"
"2711","4.021621400","127.0.0.1","127.0.0.1","TLSv1.2","141","Application Data","4444","40114"
"2712","4.021640397","127.0.0.1","127.0.0.1","TCP","66","40114  >  4444 [ACK] Seq=616 Ack=226 Win=630 Len=0 TSval=449442184 TSecr=449442184","40114","4444"
"2734","4.023170331","127.0.0.1","127.0.0.1","TLSv1.2","141","Application Data","4444","55376"
"2735","4.023188560","127.0.0.1","127.0.0.1","TCP","66","55376  >  4444 [ACK] Seq=412 Ack=151 Win=630 Len=0 TSval=449442186 TSecr=449442186","55376","4444"
"2745","4.024347499","127.0.0.1","127.0.0.1","TLSv1.2","141","Application Data","4444","40470"
"2746","4.024364819","127.0.0.1","127.0.0.1","TCP","66","40470  >  4444 [ACK] Seq=206 Ack=76 Win=630 Len=0 TSval=449442187 TSecr=449442187","40470","4444"
"2749","4.025996582","127.0.0.1","127.0.0.1","TLSv1.2","271","Application Data","40272","4444"
"2764","4.029536326","127.0.0.1","127.0.0.1","TLSv1.2","271","Application Data","40736","4444"
"2775","4.031187295","127.0.0.1","127.0.0.1","TLSv1.2","141","Application Data","4444","40272"
"2776","4.031210761","127.0.0.1","127.0.0.1","TCP","66","40272  >  4444 [ACK] Seq=411 Ack=151 Win=630 Len=0 TSval=449442194 TSecr=449442194","40272","4444"
"2784","4.031943671","127.0.0.1","127.0.0.1","TLSv1.2","271","Application Data","39938","4444"
"2804","4.033635287","127.0.0.1","127.0.0.1","TLSv1.2","141","Application Data","4444","40736"
"2805","4.033646392","127.0.0.1","127.0.0.1","TCP","66","40736  >  4444 [ACK] Seq=206 Ack=76 Win=630 Len=0 TSval=449442196 TSecr=449442196","40736","4444"
"2817","4.034975044","127.0.0.1","127.0.0.1","TLSv1.2","141","Application Data","4444","39938"
"2818","4.034986498","127.0.0.1","127.0.0.1","TCP","66","39938  >  4444 [ACK] Seq=616 Ack=226 Win=630 Len=0 TSval=449442198 TSecr=449442198","39938","4444"
"2850","4.114193657","127.0.0.1","127.0.0.1","TLSv1.2","271","Application Data","40252","4444"
"2871","4.119844970","127.0.0.1","127.0.0.1","TLSv1.2","271","Application Data","40158","4444"
"2877","4.120974507","127.0.0.1","127.0.0.1","TLSv1.2","141","Application Data","4444","40252"
"2878","4.121003631","127.0.0.1","127.0.0.1","TCP","66","40252  >  4444 [ACK] Seq=411 Ack=151 Win=630 Len=0 TSval=449442284 TSecr=449442284","40252","4444"
"2880","4.121381609","127.0.0.1","127.0.0.1","TLSv1.2","271","Application Data","40764","4444"
"2893","4.123247059","127.0.0.1","127.0.0.1","TLSv1.2","271","Application Data","40176","4444"
"2917","4.125799044","127.0.0.1","127.0.0.1","TLSv1.2","141","Application Data","4444","40158"
"2918","4.125825514","127.0.0.1","127.0.0.1","TCP","66","40158  >  4444 [ACK] Seq=411 Ack=151 Win=630 Len=0 TSval=449442288 TSecr=449442288","40158","4444"
"2943","4.128651974","127.0.0.1","127.0.0.1","TLSv1.2","141","Application Data","4444","40176"
"2944","4.128651974","127.0.0.1","127.0.0.1","TLSv1.2","141","Application Data","4444","40764"
"2945","4.128676209","127.0.0.1","127.0.0.1","TCP","66","40764  >  4444 [ACK] Seq=411 Ack=151 Win=630 Len=0 TSval=449442291 TSecr=449442291","40764","4444"
"2946","4.128676209","127.0.0.1","127.0.0.1","TCP","66","40176  >  4444 [ACK] Seq=411 Ack=151 Win=630 Len=0 TSval=449442291 TSecr=449442291","40176","4444"
"2968","4.215294252","127.0.0.1","127.0.0.1","TLSv1.2","271","Application Data","40212","4444"
"2988","4.220790030","127.0.0.1","127.0.0.1","TLSv1.2","141","Application Data","4444","40212"
"2989","4.220818735","127.0.0.1","127.0.0.1","TCP","66","40212  >  4444 [ACK] Seq=206 Ack=76 Win=630 Len=0 TSval=449442383 TSecr=449442383","40212","4444"
"2990","4.220925102","127.0.0.1","127.0.0.1","TLSv1.2","271","Application Data","40736","4444"
"3013","4.225489273","127.0.0.1","127.0.0.1","TLSv1.2","141","Application Data","4444","40736"
"3014","4.225512670","127.0.0.1","127.0.0.1","TCP","66","40736  >  4444 [ACK] Seq=411 Ack=151 Win=630 Len=0 TSval=449442388 TSecr=449442388","40736","4444"
"3028","4.317392245","127.0.0.1","127.0.0.1","TLSv1.2","271","Application Data","40604","4444"
"3029","4.317587101","127.0.0.1","127.0.0.1","TLSv1.2","271","Application Data","39994","4444"
"3030","4.317929181","127.0.0.1","127.0.0.1","TLSv1.2","271","Application Data","40706","4444"
"3066","4.321792429","127.0.0.1","127.0.0.1","TLSv1.2","271","Application Data","40158","4444"
"3090","4.323123247","127.0.0.1","127.0.0.1","TLSv1.2","271","Application Data","40722","4444"
"3100","4.324291754","127.0.0.1","127.0.0.1","TLSv1.2","141","Application Data","4444","40604"
"3101","4.324311729","127.0.0.1","127.0.0.1","TLSv1.2","141","Application Data","4444","40706"
"3102","4.324319760","127.0.0.1","127.0.0.1","TCP","66","40604  >  4444 [ACK] Seq=616 Ack=226 Win=630 Len=0 TSval=449442487 TSecr=449442487","40604","4444"
"3103","4.324327862","127.0.0.1","127.0.0.1","TLSv1.2","141","Application Data","4444","39994"
"3104","4.324337360","127.0.0.1","127.0.0.1","TCP","66","40706  >  4444 [ACK] Seq=206 Ack=76 Win=630 Len=0 TSval=449442487 TSecr=449442487","40706","4444"
"3105","4.324351957","127.0.0.1","127.0.0.1","TCP","66","39994  >  4444 [ACK] Seq=411 Ack=151 Win=630 Len=0 TSval=449442487 TSecr=449442487","39994","4444"
"3115","4.324940995","127.0.0.1","127.0.0.1","TLSv1.2","271","Application Data","40066","4444"
"3155","4.328750535","127.0.0.1","127.0.0.1","TLSv1.2","141","Application Data","4444","40158"
"3157","4.328776306","127.0.0.1","127.0.0.1","TCP","66","40158  >  4444 [ACK] Seq=616 Ack=226 Win=630 Len=0 TSval=449442491 TSecr=449442491","40158","4444"
"3165","4.329370932","127.0.0.1","127.0.0.1","TLSv1.2","141","Application Data","4444","40722"
"3166","4.329395795","127.0.0.1","127.0.0.1","TCP","66","40722  >  4444 [ACK] Seq=411 Ack=151 Win=630 Len=0 TSval=449442492 TSecr=449442492","40722","4444"
"3171","4.330278095","127.0.0.1","127.0.0.1","TLSv1.2","141","Application Data","4444","40066"
"3172","4.330301910","127.0.0.1","127.0.0.1","TCP","66","40066  >  4444 [ACK] Seq=411 Ack=151 Win=630 Len=0 TSval=449442493 TSecr=449442493","40066","4444"
"3198","4.418901549","127.0.0.1","127.0.0.1","TLSv1.2","271","Application Data","40180","4444"
"3218","4.424655877","127.0.0.1","127.0.0.1","TLSv1.2","141","Application Data","4444","40180"
"3219","4.424678995","127.0.0.1","127.0.0.1","TCP","66","40180  >  4444 [ACK] Seq=411 Ack=151 Win=630 Len=0 TSval=449442587 TSecr=449442587","40180","4444"
"3222","4.430163109","127.0.0.1","127.0.0.1","TLSv1.2","271","Application Data","40362","4444"
"3243","4.435112592","127.0.0.1","127.0.0.1","TLSv1.2","141","Application Data","4444","40362"
"3244","4.435136268","127.0.0.1","127.0.0.1","TCP","66","40362  >  4444 [ACK] Seq=206 Ack=76 Win=630 Len=0 TSval=449442598 TSecr=449442598","40362","4444"
"3258","4.519468071","127.0.0.1","127.0.0.1","TLSv1.2","271","Application Data","40666","4444"
"3263","4.520977192","127.0.0.1","127.0.0.1","TLSv1.2","271","Application Data","39976","4444"
"3264","4.521254390","127.0.0.1","127.0.0.1","TLSv1.2","271","Application Data","47384","4444"
"3313","4.525605966","127.0.0.1","127.0.0.1","TLSv1.2","141","Application Data","4444","40666"
"3315","4.525628315","127.0.0.1","127.0.0.1","TCP","66","40666  >  4444 [ACK] Seq=411 Ack=151 Win=630 Len=0 TSval=449442688 TSecr=449442688","40666","4444"
"3322","4.526559852","127.0.0.1","127.0.0.1","TLSv1.2","141","Application Data","4444","47384"
"3323","4.526583738","127.0.0.1","127.0.0.1","TCP","66","47384  >  4444 [ACK] Seq=412 Ack=151 Win=630 Len=0 TSval=449442689 TSecr=449442689","47384","4444"
"3326","4.527044059","127.0.0.1","127.0.0.1","TLSv1.2","141","Application Data","4444","39976"
"3327","4.527064941","127.0.0.1","127.0.0.1","TCP","66","39976  >  4444 [ACK] Seq=411 Ack=151 Win=630 Len=0 TSval=449442690 TSecr=449442690","39976","4444"
"3345","4.620622094","127.0.0.1","127.0.0.1","TLSv1.2","271","Application Data","40008","4444"
"3346","4.620815483","127.0.0.1","127.0.0.1","TLSv1.2","271","Application Data","40426","4444"
"3347","4.621151069","127.0.0.1","127.0.0.1","TLSv1.2","271","Application Data","40322","4444"
"3405","4.626601241","127.0.0.1","127.0.0.1","TLSv1.2","141","Application Data","4444","40008"
"3406","4.626625685","127.0.0.1","127.0.0.1","TCP","66","40008  >  4444 [ACK] Seq=616 Ack=226 Win=630 Len=0 TSval=449442789 TSecr=449442789","40008","4444"
