"No.","Time","Source","Destination","Protocol","Length","Info","src_port","dst_port"
"43","0.714229462","127.0.0.1","127.0.0.1","TLSv1.2","271","Application Data","60776","4444"
"64","0.726875832","127.0.0.1","127.0.0.1","TLSv1.2","207","Application Data","4444","60776"
"65","0.726910194","127.0.0.1","127.0.0.1","TCP","66","60776  >  4444 [ACK] Seq=206 Ack=142 Win=615 Len=0 TSval=2785092576 TSecr=2785092576","60776","4444"
"68","0.728021787","::1","::1","TCP","94","33948  >  4444 [SYN] Seq=0 Win=65476 Len=0 MSS=65476 SACK_PERM TSval=2469307864 TSecr=0 WS=128","33948","4444"
"69","0.728035686","::1","::1","TCP","74","4444  >  33948 [RST, ACK] Seq=1 Ack=1 Win=0 Len=0","4444","33948"
"70","0.728455502","127.0.0.1","127.0.0.1","TLSv1.2","401","Application Data","60766","4444"
"71","0.728476873","127.0.0.1","127.0.0.1","TCP","66","4444  >  60766 [ACK] Seq=1 Ack=336 Win=995 Len=0 TSval=2785092578 TSecr=2785092578","4444","60766"
"152","0.759619099","127.0.0.1","127.0.0.1","TLSv1.2","2395","Application Data","4444","60766"
"153","0.759654369","127.0.0.1","127.0.0.1","TCP","66","60766  >  4444 [ACK] Seq=336 Ack=2330 Win=706 Len=0 TSval=2785092609 TSecr=2785092609","60766","4444"
"165","0.825830797","127.0.0.1","127.0.0.1","TLSv1.2","2841","Application Data","60776","4444"
"225","0.843441624","127.0.0.1","127.0.0.1","TLSv1.2","2193","Application Data","4444","60790"
"226","0.843472215","127.0.0.1","127.0.0.1","TCP","66","60790  >  4444 [ACK] Seq=1 Ack=2128 Win=688 Len=0 TSval=2785092693 TSecr=2785092693","60790","4444"
"251","0.852196019","127.0.0.1","127.0.0.1","TLSv1.2","166","Application Data","4444","60790"
"252","0.852224584","127.0.0.1","127.0.0.1","TCP","66","60790  >  4444 [ACK] Seq=1 Ack=2228 Win=688 Len=0 TSval=2785092702 TSecr=2785092702","60790","4444"
"253","0.852411060","127.0.0.1","127.0.0.1","TLSv1.2","144","Application Data","4444","60776"
"254","0.852438229","127.0.0.1","127.0.0.1","TCP","66","60776  >  4444 [ACK] Seq=2981 Ack=220 Win=615 Len=0 TSval=2785092702 TSecr=2785092702","60776","4444"
"259","0.875763260","127.0.0.1","127.0.0.1","TLSv1.2","134","Application Data","60790","4444"
"286","0.916003221","127.0.0.1","127.0.0.1","TCP","66","4444  >  60790 [ACK] Seq=2228 Ack=69 Win=512 Len=0 TSval=2785092766 TSecr=2785092725","4444","60790"
"287","0.916084237","127.0.0.1","127.0.0.1","TLSv1.2","271","Application Data","60790","4444"
"288","0.916114268","127.0.0.1","127.0.0.1","TCP","66","4444  >  60790 [ACK] Seq=2228 Ack=274 Win=511 Len=0 TSval=2785092766 TSecr=2785092766","4444","60790"
"308","0.920518739","127.0.0.1","127.0.0.1","TLSv1.2","207","Application Data","4444","60790"
"311","0.921833291","::1","::1","TCP","94","33950  >  4444 [SYN] Seq=0 Win=65476 Len=0 MSS=65476 SACK_PERM TSval=2469308057 TSecr=0 WS=128","33950","4444"
"312","0.921851310","::1","::1","TCP","74","4444  >  33950 [RST, ACK] Seq=1 Ack=1 Win=0 Len=0","4444","33950"
"313","0.922444123","127.0.0.1","127.0.0.1","TLSv1.2","401","Application Data","60788","4444"
"314","0.922477926","127.0.0.1","127.0.0.1","TCP","66","4444  >  60788 [ACK] Seq=1 Ack=336 Win=995 Len=0 TSval=2785092772 TSecr=2785092772","4444","60788"
"392","0.949201784","127.0.0.1","127.0.0.1","TLSv1.2","2394","Application Data","4444","60788"
"393","0.949233981","127.0.0.1","127.0.0.1","TCP","66","60788  >  4444 [ACK] Seq=336 Ack=2329 Win=706 Len=0 TSval=2785092799 TSecr=2785092799","60788","4444"
"396","0.960997906","127.0.0.1","127.0.0.1","TCP","66","60790  >  4444 [ACK] Seq=274 Ack=2369 Win=699 Len=0 TSval=2785092811 TSecr=2785092770","60790","4444"
"405","1.009399937","127.0.0.1","127.0.0.1","TLSv1.2","2841","Application Data","60790","4444"
"464","1.021694307","127.0.0.1","127.0.0.1","TLSv1.2","2193","Application Data","4444","60776"
"465","1.021714771","127.0.0.1","127.0.0.1","TCP","66","60776  >  4444 [ACK] Seq=2981 Ack=2347 Win=688 Len=0 TSval=2785092871 TSecr=2785092871","60776","4444"
"488","1.027703241","127.0.0.1","127.0.0.1","TLSv1.2","165","Application Data","4444","60776"
"489","1.027720003","127.0.0.1","127.0.0.1","TCP","66","60776  >  4444 [ACK] Seq=2981 Ack=2446 Win=688 Len=0 TSval=2785092877 TSecr=2785092877","60776","4444"
"490","1.027846975","127.0.0.1","127.0.0.1","TLSv1.2","144","Application Data","4444","60790"
"491","1.027864924","127.0.0.1","127.0.0.1","TCP","66","60790  >  4444 [ACK] Seq=3049 Ack=2447 Win=699 Len=0 TSval=2785092877 TSecr=2785092877","60790","4444"
"494","1.042872907","127.0.0.1","127.0.0.1","TLSv1.2","134","Application Data","60776","4444"
"495","1.043261294","127.0.0.1","127.0.0.1","TLSv1.2","271","Application Data","60744","4444"
"528","1.048592419","127.0.0.1","127.0.0.1","TLSv1.2","207","Application Data","4444","60744"
"529","1.048613930","127.0.0.1","127.0.0.1","TCP","66","60744  >  4444 [ACK] Seq=206 Ack=142 Win=615 Len=0 TSval=2785092898 TSecr=2785092898","60744","4444"
"534","1.049637035","::1","::1","TCP","94","33952  >  4444 [SYN] Seq=0 Win=65476 Len=0 MSS=65476 SACK_PERM TSval=2469308185 TSecr=0 WS=128","33952","4444"
"535","1.049654076","::1","::1","TCP","74","4444  >  33952 [RST, ACK] Seq=1 Ack=1 Win=0 Len=0","4444","33952"
"536","1.050182076","127.0.0.1","127.0.0.1","TLSv1.2","401","Application Data","60722","4444"
"537","1.050210711","127.0.0.1","127.0.0.1","TCP","66","4444  >  60722 [ACK] Seq=1 Ack=336 Win=907 Len=0 TSval=2785092900 TSecr=2785092900","4444","60722"
"615","1.070615609","127.0.0.1","127.0.0.1","TLSv1.2","2394","Application Data","4444","60722"
"616","1.070643685","127.0.0.1","127.0.0.1","TCP","66","60722  >  4444 [ACK] Seq=336 Ack=2329 Win=706 Len=0 TSval=2785092920 TSecr=2785092920","60722","4444"
"619","1.084015915","127.0.0.1","127.0.0.1","TCP","66","4444  >  60776 [ACK] Seq=2446 Ack=3049 Win=739 Len=0 TSval=2785092934 TSecr=2785092892","4444","60776"
"629","1.115772256","127.0.0.1","127.0.0.1","TLSv1.2","2841","Application Data","60744","4444"
"688","1.126537451","127.0.0.1","127.0.0.1","TLSv1.2","2193","Application Data","4444","60752"
"689","1.126552187","127.0.0.1","127.0.0.1","TCP","66","60752  >  4444 [ACK] Seq=1 Ack=2128 Win=688 Len=0 TSval=2785092976 TSecr=2785092976","60752","4444"
"712","1.130707534","127.0.0.1","127.0.0.1","TLSv1.2","166","Application Data","4444","60752"
"713","1.130722410","127.0.0.1","127.0.0.1","TCP","66","60752  >  4444 [ACK] Seq=1 Ack=2228 Win=688 Len=0 TSval=2785092980 TSecr=2785092980","60752","4444"
"714","1.130815369","127.0.0.1","127.0.0.1","TLSv1.2","144","Application Data","4444","60744"
"715","1.130829127","127.0.0.1","127.0.0.1","TCP","66","60744  >  4444 [ACK] Seq=2981 Ack=220 Win=615 Len=0 TSval=2785092980 TSecr=2785092980","60744","4444"
"718","1.150766787","127.0.0.1","127.0.0.1","TLSv1.2","134","Application Data","60752","4444"
"740","1.191028678","127.0.0.1","127.0.0.1","TCP","66","4444  >  60752 [ACK] Seq=2228 Ack=69 Win=512 Len=0 TSval=2785093041 TSecr=2785093000","4444","60752"
"741","1.191056545","127.0.0.1","127.0.0.1","TLSv1.2","271","Application Data","60752","4444"
"742","1.191079034","127.0.0.1","127.0.0.1","TCP","66","4444  >  60752 [ACK] Seq=2228 Ack=274 Win=511 Len=0 TSval=2785093041 TSecr=2785093041","4444","60752"
"767","1.196191974","127.0.0.1","127.0.0.1","TLSv1.2","207","Application Data","4444","60752"
"770","1.197497866","::1","::1","TCP","94","33962  >  4444 [SYN] Seq=0 Win=65476 Len=0 MSS=65476 SACK_PERM TSval=2469308333 TSecr=0 WS=128","33962","4444"
"771","1.197516514","::1","::1","TCP","74","4444  >  33962 [RST, ACK] Seq=1 Ack=1 Win=0 Len=0","4444","33962"
"772","1.198117009","127.0.0.1","127.0.0.1","TLSv1.2","401","Application Data","60738","4444"
"773","1.198147041","127.0.0.1","127.0.0.1","TCP","66","4444  >  60738 [ACK] Seq=1 Ack=336 Win=907 Len=0 TSval=2785093048 TSecr=2785093048","4444","60738"
"850","1.220915507","127.0.0.1","127.0.0.1","TLSv1.2","2392","Application Data","4444","60738"
"851","1.220968517","127.0.0.1","127.0.0.1","TCP","66","60738  >  4444 [ACK] Seq=336 Ack=2327 Win=706 Len=0 TSval=2785093070 TSecr=2785093070","60738","4444"
"855","1.236994366","127.0.0.1","127.0.0.1","TCP","66","60752  >  4444 [ACK] Seq=274 Ack=2369 Win=699 Len=0 TSval=2785093087 TSecr=2785093046","60752","4444"
"859","1.283474575","127.0.0.1","127.0.0.1","TLSv1.2","2840","Application Data","60752","4444"
"923","1.299398108","127.0.0.1","127.0.0.1","TLSv1.2","2193","Application Data","4444","60744"
"924","1.299425765","127.0.0.1","127.0.0.1","TCP","66","60744  >  4444 [ACK] Seq=2981 Ack=2347 Win=688 Len=0 TSval=2785093149 TSecr=2785093149","60744","4444"
"947","1.306086597","127.0.0.1","127.0.0.1","TLSv1.2","166","Application Data","4444","60744"
"948","1.306119562","127.0.0.1","127.0.0.1","TCP","66","60744  >  4444 [ACK] Seq=2981 Ack=2447 Win=688 Len=0 TSval=2785093156 TSecr=2785093156","60744","4444"
"949","1.306320286","127.0.0.1","127.0.0.1","TLSv1.2","144","Application Data","4444","60752"
"950","1.306349410","127.0.0.1","127.0.0.1","TCP","66","60752  >  4444 [ACK] Seq=3048 Ack=2447 Win=699 Len=0 TSval=2785093156 TSecr=2785093156","60752","4444"
"953","1.323219152","127.0.0.1","127.0.0.1","TLSv1.2","134","Application Data","60744","4444"
"969","1.328216226","127.0.0.1","127.0.0.1","TLSv1.2","637","Application Data","60776","4444"
"970","1.328247235","127.0.0.1","127.0.0.1","TCP","66","4444  >  60776 [ACK] Seq=2446 Ack=3620 Win=752 Len=0 TSval=2785093178 TSecr=2785093178","4444","60776"
"1028","1.342399942","127.0.0.1","127.0.0.1","TLSv1.2","539","Application Data","4444","60790"
"1029","1.342428018","127.0.0.1","127.0.0.1","TCP","66","60790  >  4444 [ACK] Seq=3049 Ack=2920 Win=697 Len=0 TSval=2785093192 TSecr=2785093192","60790","4444"
"1054","1.348732520","127.0.0.1","127.0.0.1","TLSv1.2","165","Application Data","4444","60790"
"1055","1.348758292","127.0.0.1","127.0.0.1","TCP","66","60790  >  4444 [ACK] Seq=3049 Ack=3019 Win=699 Len=0 TSval=2785093198 TSecr=2785093198","60790","4444"
"1056","1.348921231","127.0.0.1","127.0.0.1","TLSv1.2","144","Application Data","4444","60776"
"1059","1.356016127","127.0.0.1","127.0.0.1","TLSv1.2","135","Application Data","60790","4444"
"1078","1.363991024","127.0.0.1","127.0.0.1","TCP","66","4444  >  60744 [ACK] Seq=2447 Ack=3049 Win=739 Len=0 TSval=2785093214 TSecr=2785093173","4444","60744"
"1081","1.388974506","127.0.0.1","127.0.0.1","TCP","66","60776  >  4444 [ACK] Seq=3620 Ack=2524 Win=688 Len=0 TSval=2785093239 TSecr=2785093198","60776","4444"
"1083","1.396996196","127.0.0.1","127.0.0.1","TCP","66","4444  >  60790 [ACK] Seq=3019 Ack=3118 Win=739 Len=0 TSval=2785093247 TSecr=2785093206","4444","60790"
"1084","1.397022317","127.0.0.1","127.0.0.1","TLSv1.2","637","Application Data","60790","4444"
"1085","1.397037682","127.0.0.1","127.0.0.1","TCP","66","4444  >  60790 [ACK] Seq=3019 Ack=3689 Win=752 Len=0 TSval=2785093247 TSecr=2785093247","4444","60790"
"1149","1.409391068","127.0.0.1","127.0.0.1","TLSv1.2","538","Application Data","4444","60776"
"1150","1.409413906","127.0.0.1","127.0.0.1","TCP","66","60776  >  4444 [ACK] Seq=3620 Ack=2996 Win=697 Len=0 TSval=2785093259 TSecr=2785093259","60776","4444"
"1173","1.415284903","127.0.0.1","127.0.0.1","TLSv1.2","166","Application Data","4444","60776"
"1174","1.415316821","127.0.0.1","127.0.0.1","TCP","66","60776  >  4444 [ACK] Seq=3620 Ack=3096 Win=697 Len=0 TSval=2785093265 TSecr=2785093265","60776","4444"
"1175","1.415517964","127.0.0.1","127.0.0.1","TLSv1.2","144","Application Data","4444","60790"
"1178","1.423293952","127.0.0.1","127.0.0.1","TLSv1.2","134","Application Data","60776","4444"
"1194","1.428257781","127.0.0.1","127.0.0.1","TLSv1.2","637","Application Data","60744","4444"
"1195","1.428281038","127.0.0.1","127.0.0.1","TCP","66","4444  >  60744 [ACK] Seq=2447 Ack=3620 Win=752 Len=0 TSval=2785093278 TSecr=2785093278","4444","60744"
"1253","1.440942075","127.0.0.1","127.0.0.1","TLSv1.2","538","Application Data","4444","60752"
"1254","1.441004583","127.0.0.1","127.0.0.1","TCP","66","60752  >  4444 [ACK] Seq=3048 Ack=2919 Win=697 Len=0 TSval=2785093291 TSecr=2785093290","60752","4444"
"1277","1.446736806","127.0.0.1","127.0.0.1","TLSv1.2","166","Application Data","4444","60752"
"1278","1.446764044","127.0.0.1","127.0.0.1","TCP","66","60752  >  4444 [ACK] Seq=3048 Ack=3019 Win=699 Len=0 TSval=2785093296 TSecr=2785093296","60752","4444"
"1279","1.446913923","127.0.0.1","127.0.0.1","TLSv1.2","144","Application Data","4444","60744"
"1282","1.455184318","127.0.0.1","127.0.0.1","TLSv1.2","134","Application Data","60752","4444"
"1284","1.455981347","127.0.0.1","127.0.0.1","TCP","66","60790  >  4444 [ACK] Seq=3689 Ack=3097 Win=699 Len=0 TSval=2785093306 TSecr=2785093265","60790","4444"
"1302","1.463990535","127.0.0.1","127.0.0.1","TCP","66","4444  >  60776 [ACK] Seq=3096 Ack=3688 Win=752 Len=0 TSval=2785093314 TSecr=2785093273","4444","60776"
"1305","1.486989058","127.0.0.1","127.0.0.1","TCP","66","60744  >  4444 [ACK] Seq=3620 Ack=2525 Win=688 Len=0 TSval=2785093337 TSecr=2785093296","60744","4444"
"1307","1.495977491","127.0.0.1","127.0.0.1","TCP","66","4444  >  60752 [ACK] Seq=3019 Ack=3116 Win=739 Len=0 TSval=2785093346 TSecr=2785093305","4444","60752"
"1308","1.495995790","127.0.0.1","127.0.0.1","TLSv1.2","636","Application Data","60752","4444"
"1309","1.496011155","127.0.0.1","127.0.0.1","TCP","66","4444  >  60752 [ACK] Seq=3019 Ack=3686 Win=752 Len=0 TSval=2785093346 TSecr=2785093346","4444","60752"
"1373","1.513563455","127.0.0.1","127.0.0.1","TLSv1.2","539","Application Data","4444","60744"
"1374","1.513594954","127.0.0.1","127.0.0.1","TCP","66","60744  >  4444 [ACK] Seq=3620 Ack=2998 Win=697 Len=0 TSval=2785093363 TSecr=2785093363","60744","4444"
"1397","1.520507774","127.0.0.1","127.0.0.1","TLSv1.2","165","Application Data","4444","60744"
"1398","1.520540948","127.0.0.1","127.0.0.1","TCP","66","60744  >  4444 [ACK] Seq=3620 Ack=3097 Win=697 Len=0 TSval=2785093370 TSecr=2785093370","60744","4444"
"1399","1.520736574","127.0.0.1","127.0.0.1","TLSv1.2","144","Application Data","4444","60752"
"1402","1.529363438","127.0.0.1","127.0.0.1","TLSv1.2","135","Application Data","60744","4444"
"1418","1.534862182","127.0.0.1","127.0.0.1","TLSv1.2","637","Application Data","60776","4444"
"1420","1.534886626","127.0.0.1","127.0.0.1","TCP","66","4444  >  60776 [ACK] Seq=3096 Ack=4259 Win=752 Len=0 TSval=2785093384 TSecr=2785093384","4444","60776"
"1477","1.545441320","127.0.0.1","127.0.0.1","TLSv1.2","538","Application Data","4444","60790"
"1478","1.545458012","127.0.0.1","127.0.0.1","TCP","66","60790  >  4444 [ACK] Seq=3689 Ack=3569 Win=697 Len=0 TSval=2785093395 TSecr=2785093395","60790","4444"
"1501","1.549868558","127.0.0.1","127.0.0.1","TLSv1.2","165","Application Data","4444","60790"
"1502","1.549896704","127.0.0.1","127.0.0.1","TCP","66","60790  >  4444 [ACK] Seq=3689 Ack=3668 Win=699 Len=0 TSval=2785093399 TSecr=2785093399","60790","4444"
"1503","1.550105600","127.0.0.1","127.0.0.1","TLSv1.2","144","Application Data","4444","60776"
"1506","1.559118337","127.0.0.1","127.0.0.1","TLSv1.2","134","Application Data","60790","4444"
"1512","1.561002446","127.0.0.1","127.0.0.1","TCP","66","60752  >  4444 [ACK] Seq=3686 Ack=3097 Win=699 Len=0 TSval=2785093411 TSecr=2785093370","60752","4444"
"1526","1.569999818","127.0.0.1","127.0.0.1","TCP","66","4444  >  60744 [ACK] Seq=3097 Ack=3689 Win=752 Len=0 TSval=2785093420 TSecr=2785093379","4444","60744"
"1530","1.591008424","127.0.0.1","127.0.0.1","TCP","66","60776  >  4444 [ACK] Seq=4259 Ack=3174 Win=697 Len=0 TSval=2785093441 TSecr=2785093400","60776","4444"
"1531","1.600001955","127.0.0.1","127.0.0.1","TCP","66","4444  >  60790 [ACK] Seq=3668 Ack=3757 Win=752 Len=0 TSval=2785093450 TSecr=2785093409","4444","60790"
"1532","1.600031498","127.0.0.1","127.0.0.1","TLSv1.2","637","Application Data","60790","4444"
"1533","1.600050635","127.0.0.1","127.0.0.1","TCP","66","4444  >  60790 [ACK] Seq=3668 Ack=4328 Win=752 Len=0 TSval=2785093450 TSecr=2785093450","4444","60790"
"1597","1.616004199","127.0.0.1","127.0.0.1","TLSv1.2","539","Application Data","4444","60776"
"1598","1.616054065","127.0.0.1","127.0.0.1","TCP","66","60776  >  4444 [ACK] Seq=4259 Ack=3647 Win=697 Len=0 TSval=2785093466 TSecr=2785093465","60776","4444"
"1621","1.623476517","127.0.0.1","127.0.0.1","TLSv1.2","165","Application Data","4444","60776"
"1622","1.623507526","127.0.0.1","127.0.0.1","TCP","66","60776  >  4444 [ACK] Seq=4259 Ack=3746 Win=697 Len=0 TSval=2785093473 TSecr=2785093473","60776","4444"
"1623","1.623707342","127.0.0.1","127.0.0.1","TLSv1.2","144","Application Data","4444","60790"
"1626","1.631539762","127.0.0.1","127.0.0.1","TLSv1.2","135","Application Data","60776","4444"
"1639","1.636891700","127.0.0.1","127.0.0.1","TLSv1.2","637","Application Data","60744","4444"
"1640","1.636918798","127.0.0.1","127.0.0.1","TCP","66","4444  >  60744 [ACK] Seq=3097 Ack=4260 Win=752 Len=0 TSval=2785093486 TSecr=2785093486","4444","60744"
"1701","1.653743841","127.0.0.1","127.0.0.1","TLSv1.2","538","Application Data","4444","60752"
"1702","1.653777645","127.0.0.1","127.0.0.1","TCP","66","60752  >  4444 [ACK] Seq=3686 Ack=3569 Win=697 Len=0 TSval=2785093503 TSecr=2785093503","60752","4444"
"1725","1.661362477","127.0.0.1","127.0.0.1","TLSv1.2","166","Application Data","4444","60752"
"1726","1.661392509","127.0.0.1","127.0.0.1","TCP","66","60752  >  4444 [ACK] Seq=3686 Ack=3669 Win=699 Len=0 TSval=2785093511 TSecr=2785093511","60752","4444"
"1727","1.661591696","127.0.0.1","127.0.0.1","TLSv1.2","144","Application Data","4444","60744"
"1730","1.664998344","127.0.0.1","127.0.0.1","TCP","66","60790  >  4444 [ACK] Seq=4328 Ack=3746 Win=699 Len=0 TSval=2785093515 TSecr=2785093473","60790","4444"
"1731","1.667540916","127.0.0.1","127.0.0.1","TLSv1.2","134","Application Data","60752","4444"
"1744","1.671993018","127.0.0.1","127.0.0.1","TCP","66","4444  >  60776 [ACK] Seq=3746 Ack=4328 Win=752 Len=0 TSval=2785093522 TSecr=2785093481","4444","60776"
"1753","1.701989848","127.0.0.1","127.0.0.1","TCP","66","60744  >  4444 [ACK] Seq=4260 Ack=3175 Win=697 Len=0 TSval=2785093552 TSecr=2785093511","60744","4444"
"1760","1.707989423","127.0.0.1","127.0.0.1","TCP","66","4444  >  60752 [ACK] Seq=3669 Ack=3754 Win=752 Len=0 TSval=2785093558 TSecr=2785093517","4444","60752"
"1761","1.708015753","127.0.0.1","127.0.0.1","TLSv1.2","636","Application Data","60752","4444"
"1762","1.708040547","127.0.0.1","127.0.0.1","TCP","66","4444  >  60752 [ACK] Seq=3669 Ack=4324 Win=752 Len=0 TSval=2785093558 TSecr=2785093558","4444","60752"
"1821","1.724429152","127.0.0.1","127.0.0.1","TLSv1.2","539","Application Data","4444","60744"
"1822","1.724458695","127.0.0.1","127.0.0.1","TCP","66","60744  >  4444 [ACK] Seq=4260 Ack=3648 Win=697 Len=0 TSval=2785093574 TSecr=2785093574","60744","4444"
"1845","1.731728194","127.0.0.1","127.0.0.1","TLSv1.2","165","Application Data","4444","60744"
"1846","1.731756340","127.0.0.1","127.0.0.1","TCP","66","60744  >  4444 [ACK] Seq=4260 Ack=3747 Win=697 Len=0 TSval=2785093581 TSecr=2785093581","60744","4444"
"1847","1.731940931","127.0.0.1","127.0.0.1","TLSv1.2","144","Application Data","4444","60752"
"1850","1.740623040","127.0.0.1","127.0.0.1","TLSv1.2","135","Application Data","60744","4444"
"1866","1.747094812","127.0.0.1","127.0.0.1","TLSv1.2","637","Application Data","60776","4444"
"1867","1.747114926","127.0.0.1","127.0.0.1","TCP","66","4444  >  60776 [ACK] Seq=3746 Ack=4899 Win=752 Len=0 TSval=2785093597 TSecr=2785093597","4444","60776"
"1925","1.764747544","127.0.0.1","127.0.0.1","TLSv1.2","539","Application Data","4444","60790"
"1926","1.764785678","127.0.0.1","127.0.0.1","TCP","66","60790  >  4444 [ACK] Seq=4328 Ack=4219 Win=697 Len=0 TSval=2785093614 TSecr=2785093614","60790","4444"
"1949","1.772842428","127.0.0.1","127.0.0.1","TLSv1.2","166","Application Data","4444","60790"
"1950","1.772884263","127.0.0.1","127.0.0.1","TCP","66","60790  >  4444 [ACK] Seq=4328 Ack=4319 Win=699 Len=0 TSval=2785093622 TSecr=2785093622","60790","4444"
"1951","1.772993704","127.0.0.1","127.0.0.1","TCP","66","60752  >  4444 [ACK] Seq=4324 Ack=3747 Win=699 Len=0 TSval=2785093623 TSecr=2785093581","60752","4444"
"1952","1.773201761","127.0.0.1","127.0.0.1","TLSv1.2","144","Application Data","4444","60776"
"1955","1.781019864","127.0.0.1","127.0.0.1","TCP","66","4444  >  60744 [ACK] Seq=3747 Ack=4329 Win=752 Len=0 TSval=2785093631 TSecr=2785093590","4444","60744"
"1956","1.782171337","127.0.0.1","127.0.0.1","TLSv1.2","135","Application Data","60790","4444"
"1980","1.814036351","127.0.0.1","127.0.0.1","TCP","66","60776  >  4444 [ACK] Seq=4899 Ack=3824 Win=697 Len=0 TSval=2785093664 TSecr=2785093623","60776","4444"
"1982","1.822972961","127.0.0.1","127.0.0.1","TCP","66","4444  >  60790 [ACK] Seq=4319 Ack=4397 Win=752 Len=0 TSval=2785093673 TSecr=2785093632","4444","60790"
"1983","1.822991539","127.0.0.1","127.0.0.1","TLSv1.2","637","Application Data","60790","4444"
"1984","1.823004460","127.0.0.1","127.0.0.1","TCP","66","4444  >  60790 [ACK] Seq=4319 Ack=4968 Win=752 Len=0 TSval=2785093673 TSecr=2785093673","4444","60790"
"2043","1.839206938","127.0.0.1","127.0.0.1","TLSv1.2","538","Application Data","4444","60776"
"2044","1.839240252","127.0.0.1","127.0.0.1","TCP","66","60776  >  4444 [ACK] Seq=4899 Ack=4296 Win=697 Len=0 TSval=2785093689 TSecr=2785093689","60776","4444"
"2067","1.845903879","127.0.0.1","127.0.0.1","TLSv1.2","166","Application Data","4444","60776"
"2068","1.845933980","127.0.0.1","127.0.0.1","TCP","66","60776  >  4444 [ACK] Seq=4899 Ack=4396 Win=697 Len=0 TSval=2785093695 TSecr=2785093695","60776","4444"
"2069","1.846155866","127.0.0.1","127.0.0.1","TLSv1.2","144","Application Data","4444","60790"
"2072","1.853098927","127.0.0.1","127.0.0.1","TLSv1.2","134","Application Data","60776","4444"
"2089","1.859380521","127.0.0.1","127.0.0.1","TLSv1.2","637","Application Data","60744","4444"
"2090","1.859405315","127.0.0.1","127.0.0.1","TCP","66","4444  >  60744 [ACK] Seq=3747 Ack=4900 Win=752 Len=0 TSval=2785093709 TSecr=2785093709","4444","60744"
"2147","1.874930962","127.0.0.1","127.0.0.1","TLSv1.2","538","Application Data","4444","60752"
"2148","1.874984879","127.0.0.1","127.0.0.1","TCP","66","60752  >  4444 [ACK] Seq=4324 Ack=4219 Win=697 Len=0 TSval=2785093724 TSecr=2785093724","60752","4444"
"2171","1.881655070","127.0.0.1","127.0.0.1","TLSv1.2","165","Application Data","4444","60752"
"2172","1.881688245","127.0.0.1","127.0.0.1","TCP","66","60752  >  4444 [ACK] Seq=4324 Ack=4318 Win=699 Len=0 TSval=2785093731 TSecr=2785093731","60752","4444"
"2173","1.881892950","127.0.0.1","127.0.0.1","TLSv1.2","144","Application Data","4444","60744"
"2176","1.886997300","127.0.0.1","127.0.0.1","TCP","66","60790  >  4444 [ACK] Seq=4968 Ack=4397 Win=699 Len=0 TSval=2785093737 TSecr=2785093696","60790","4444"
"2177","1.890847300","127.0.0.1","127.0.0.1","TLSv1.2","134","Application Data","60752","4444"
"2185","1.893999447","127.0.0.1","127.0.0.1","TCP","66","4444  >  60776 [ACK] Seq=4396 Ack=4967 Win=752 Len=0 TSval=2785093744 TSecr=2785093703","4444","60776"
"2202","1.922002168","127.0.0.1","127.0.0.1","TCP","66","60744  >  4444 [ACK] Seq=4900 Ack=3825 Win=697 Len=0 TSval=2785093772 TSecr=2785093731","60744","4444"
"2204","1.931003381","127.0.0.1","127.0.0.1","TCP","66","4444  >  60752 [ACK] Seq=4318 Ack=4392 Win=752 Len=0 TSval=2785093781 TSecr=2785093740","4444","60752"
"2205","1.931032366","127.0.0.1","127.0.0.1","TLSv1.2","636","Application Data","60752","4444"
"2206","1.931061210","127.0.0.1","127.0.0.1","TCP","66","4444  >  60752 [ACK] Seq=4318 Ack=4962 Win=752 Len=0 TSval=2785093781 TSecr=2785093781","4444","60752"
"2263","1.946515479","127.0.0.1","127.0.0.1","TLSv1.2","538","Application Data","4444","60744"
"2264","1.946547396","127.0.0.1","127.0.0.1","TCP","66","60744  >  4444 [ACK] Seq=4900 Ack=4297 Win=697 Len=0 TSval=2785093796 TSecr=2785093796","60744","4444"
"2287","1.953121765","127.0.0.1","127.0.0.1","TLSv1.2","166","Application Data","4444","60744"
"2288","1.953154730","127.0.0.1","127.0.0.1","TCP","66","60744  >  4444 [ACK] Seq=4900 Ack=4397 Win=697 Len=0 TSval=2785093803 TSecr=2785093803","60744","4444"
"2289","1.953340648","127.0.0.1","127.0.0.1","TLSv1.2","144","Application Data","4444","60752"
"2292","1.962463036","127.0.0.1","127.0.0.1","TLSv1.2","134","Application Data","60744","4444"
"2309","1.968592307","127.0.0.1","127.0.0.1","TLSv1.2","637","Application Data","60776","4444"
"2310","1.968618497","127.0.0.1","127.0.0.1","TCP","66","4444  >  60776 [ACK] Seq=4396 Ack=5538 Win=752 Len=0 TSval=2785093818 TSecr=2785093818","4444","60776"
"2367","1.980832550","127.0.0.1","127.0.0.1","TLSv1.2","538","Application Data","4444","60790"
"2368","1.980848124","127.0.0.1","127.0.0.1","TCP","66","60790  >  4444 [ACK] Seq=4968 Ack=4869 Win=697 Len=0 TSval=2785093830 TSecr=2785093830","60790","4444"
"2391","1.987134119","127.0.0.1","127.0.0.1","TLSv1.2","165","Application Data","4444","60790"
"2392","1.987160798","127.0.0.1","127.0.0.1","TCP","66","60790  >  4444 [ACK] Seq=4968 Ack=4968 Win=699 Len=0 TSval=2785093837 TSecr=2785093837","60790","4444"
"2393","1.987349789","127.0.0.1","127.0.0.1","TLSv1.2","144","Application Data","4444","60776"
"2396","1.994060767","127.0.0.1","127.0.0.1","TCP","66","60752  >  4444 [ACK] Seq=4962 Ack=4396 Win=699 Len=0 TSval=2785093844 TSecr=2785093803","60752","4444"
"2397","1.996360501","127.0.0.1","127.0.0.1","TLSv1.2","134","Application Data","60790","4444"
"2416","2.003006108","127.0.0.1","127.0.0.1","TCP","66","4444  >  60744 [ACK] Seq=4397 Ack=4968 Win=752 Len=0 TSval=2785093853 TSecr=2785093812","4444","60744"
"2423","2.028050073","127.0.0.1","127.0.0.1","TCP","66","60776  >  4444 [ACK] Seq=5538 Ack=4474 Win=697 Len=0 TSval=2785093878 TSecr=2785093837","60776","4444"
"2424","2.037026214","127.0.0.1","127.0.0.1","TCP","66","4444  >  60790 [ACK] Seq=4968 Ack=5036 Win=752 Len=0 TSval=2785093887 TSecr=2785093846","4444","60790"
"2425","2.037060576","127.0.0.1","127.0.0.1","TLSv1.2","637","Application Data","60790","4444"
"2426","2.037090608","127.0.0.1","127.0.0.1","TCP","66","4444  >  60790 [ACK] Seq=4968 Ack=5607 Win=752 Len=0 TSval=2785093887 TSecr=2785093887","4444","60790"
"2485","2.053499886","127.0.0.1","127.0.0.1","TLSv1.2","539","Application Data","4444","60776"
"2486","2.053529289","127.0.0.1","127.0.0.1","TCP","66","60776  >  4444 [ACK] Seq=5538 Ack=4947 Win=697 Len=0 TSval=2785093903 TSecr=2785093903","60776","4444"
"2509","2.059875347","127.0.0.1","127.0.0.1","TLSv1.2","166","Application Data","4444","60776"
"2510","2.059904680","127.0.0.1","127.0.0.1","TCP","66","60776  >  4444 [ACK] Seq=5538 Ack=5047 Win=697 Len=0 TSval=2785093909 TSecr=2785093909","60776","4444"
"2511","2.060138649","127.0.0.1","127.0.0.1","TLSv1.2","144","Application Data","4444","60790"
"2514","2.069260758","127.0.0.1","127.0.0.1","TLSv1.2","135","Application Data","60776","4444"
"2531","2.075456028","127.0.0.1","127.0.0.1","TLSv1.2","637","Application Data","60744","4444"
"2532","2.075483197","127.0.0.1","127.0.0.1","TCP","66","4444  >  60744 [ACK] Seq=4397 Ack=5539 Win=752 Len=0 TSval=2785093925 TSecr=2785093925","4444","60744"
"2589","2.091269630","127.0.0.1","127.0.0.1","TLSv1.2","538","Application Data","4444","60752"
"2590","2.091301338","127.0.0.1","127.0.0.1","TCP","66","60752  >  4444 [ACK] Seq=4962 Ack=4868 Win=697 Len=0 TSval=2785093941 TSecr=2785093941","60752","4444"
"2613","2.098001771","127.0.0.1","127.0.0.1","TLSv1.2","165","Application Data","4444","60752"
"2614","2.098035155","127.0.0.1","127.0.0.1","TCP","66","60752  >  4444 [ACK] Seq=4962 Ack=4967 Win=699 Len=0 TSval=2785093948 TSecr=2785093948","60752","4444"
"2615","2.098220304","127.0.0.1","127.0.0.1","TLSv1.2","144","Application Data","4444","60744"
"2618","2.101017517","127.0.0.1","127.0.0.1","TCP","66","60790  >  4444 [ACK] Seq=5607 Ack=5046 Win=699 Len=0 TSval=2785093951 TSecr=2785093910","60790","4444"
"2619","2.107465753","127.0.0.1","127.0.0.1","TLSv1.2","134","Application Data","60752","4444"
"2625","2.110017334","127.0.0.1","127.0.0.1","TCP","66","4444  >  60776 [ACK] Seq=5047 Ack=5607 Win=752 Len=0 TSval=2785093960 TSecr=2785093919","4444","60776"
"2645","2.139063414","127.0.0.1","127.0.0.1","TCP","66","60744  >  4444 [ACK] Seq=5539 Ack=4475 Win=697 Len=0 TSval=2785093989 TSecr=2785093948","60744","4444"
"2646","2.148009244","127.0.0.1","127.0.0.1","TCP","66","4444  >  60752 [ACK] Seq=4967 Ack=5030 Win=752 Len=0 TSval=2785093998 TSecr=2785093957","4444","60752"
"2647","2.148038577","127.0.0.1","127.0.0.1","TLSv1.2","636","Application Data","60752","4444"
"2648","2.148067003","127.0.0.1","127.0.0.1","TCP","66","4444  >  60752 [ACK] Seq=4967 Ack=5600 Win=752 Len=0 TSval=2785093998 TSecr=2785093998","4444","60752"
"2705","2.164142509","127.0.0.1","127.0.0.1","TLSv1.2","538","Application Data","4444","60744"
"2706","2.164174497","127.0.0.1","127.0.0.1","TCP","66","60744  >  4444 [ACK] Seq=5539 Ack=4947 Win=697 Len=0 TSval=2785094014 TSecr=2785094014","60744","4444"
"2729","2.170621964","127.0.0.1","127.0.0.1","TLSv1.2","165","Application Data","4444","60744"
"2730","2.170654929","127.0.0.1","127.0.0.1","TCP","66","60744  >  4444 [ACK] Seq=5539 Ack=5046 Win=697 Len=0 TSval=2785094020 TSecr=2785094020","60744","4444"
"2731","2.170885405","127.0.0.1","127.0.0.1","TLSv1.2","144","Application Data","4444","60752"
"2734","2.179838499","127.0.0.1","127.0.0.1","TLSv1.2","134","Application Data","60744","4444"
"2751","2.186255585","127.0.0.1","127.0.0.1","TLSv1.2","637","Application Data","60776","4444"
"2752","2.186280030","127.0.0.1","127.0.0.1","TCP","66","4444  >  60776 [ACK] Seq=5047 Ack=6178 Win=752 Len=0 TSval=2785094036 TSecr=2785094036","4444","60776"
"2809","2.204163378","127.0.0.1","127.0.0.1","TLSv1.2","538","Application Data","4444","60790"
"2810","2.204195295","127.0.0.1","127.0.0.1","TCP","66","60790  >  4444 [ACK] Seq=5607 Ack=5518 Win=697 Len=0 TSval=2785094054 TSecr=2785094054","60790","4444"
"2833","2.210998465","127.0.0.1","127.0.0.1","TCP","66","60752  >  4444 [ACK] Seq=5600 Ack=5045 Win=699 Len=0 TSval=2785094061 TSecr=2785094020","60752","4444"
"2834","2.211022839","127.0.0.1","127.0.0.1","TLSv1.2","165","Application Data","4444","60790"
"2835","2.211056642","127.0.0.1","127.0.0.1","TCP","66","60790  >  4444 [ACK] Seq=5607 Ack=5617 Win=699 Len=0 TSval=2785094061 TSecr=2785094060","60790","4444"
"2836","2.211262814","127.0.0.1","127.0.0.1","TLSv1.2","144","Application Data","4444","60776"
"2843","2.220042421","127.0.0.1","127.0.0.1","TCP","66","4444  >  60744 [ACK] Seq=5046 Ack=5607 Win=752 Len=0 TSval=2785094070 TSecr=2785094029","4444","60744"
"2844","2.220515037","127.0.0.1","127.0.0.1","TLSv1.2","134","Application Data","60790","4444"
"2865","2.252047397","127.0.0.1","127.0.0.1","TCP","66","60776  >  4444 [ACK] Seq=6178 Ack=5125 Win=697 Len=0 TSval=2785094102 TSecr=2785094061","60776","4444"
"2867","2.261003633","127.0.0.1","127.0.0.1","TCP","66","4444  >  60790 [ACK] Seq=5617 Ack=5675 Win=752 Len=0 TSval=2785094111 TSecr=2785094070","4444","60790"
"2868","2.261035341","127.0.0.1","127.0.0.1","TLSv1.2","637","Application Data","60790","4444"
"2869","2.261062928","127.0.0.1","127.0.0.1","TCP","66","4444  >  60790 [ACK] Seq=5617 Ack=6246 Win=752 Len=0 TSval=2785094111 TSecr=2785094111","4444","60790"
"2929","2.278658949","127.0.0.1","127.0.0.1","TLSv1.2","538","Application Data","4444","60776"
"2930","2.278697083","127.0.0.1","127.0.0.1","TCP","66","60776  >  4444 [ACK] Seq=6178 Ack=5597 Win=697 Len=0 TSval=2785094128 TSecr=2785094128","60776","4444"
"2953","2.286569452","127.0.0.1","127.0.0.1","TLSv1.2","166","Application Data","4444","60776"
"2954","2.286607515","127.0.0.1","127.0.0.1","TCP","66","60776  >  4444 [ACK] Seq=6178 Ack=5697 Win=697 Len=0 TSval=2785094136 TSecr=2785094136","60776","4444"
"2955","2.286848817","127.0.0.1","127.0.0.1","TLSv1.2","144","Application Data","4444","60790"
"2958","2.295915123","127.0.0.1","127.0.0.1","TLSv1.2","134","Application Data","60776","4444"
"2976","2.302185263","127.0.0.1","127.0.0.1","TLSv1.2","637","Application Data","60744","4444"
"2977","2.302212222","127.0.0.1","127.0.0.1","TCP","66","4444  >  60744 [ACK] Seq=5046 Ack=6178 Win=752 Len=0 TSval=2785094152 TSecr=2785094152","4444","60744"
"3033","2.317638415","127.0.0.1","127.0.0.1","TLSv1.2","538","Application Data","4444","60752"
"3034","2.317671310","127.0.0.1","127.0.0.1","TCP","66","60752  >  4444 [ACK] Seq=5600 Ack=5517 Win=697 Len=0 TSval=2785094167 TSecr=2785094167","60752","4444"
"3061","2.324507165","127.0.0.1","127.0.0.1","TLSv1.2","166","Application Data","4444","60752"
"3062","2.324702581","127.0.0.1","127.0.0.1","TLSv1.2","144","Application Data","4444","60744"
"3063","2.324787508","127.0.0.1","127.0.0.1","TCP","66","60752  >  4444 [ACK] Seq=5600 Ack=5617 Win=699 Len=0 TSval=2785094174 TSecr=2785094174","60752","4444"
"3066","2.326997635","127.0.0.1","127.0.0.1","TCP","66","60790  >  4444 [ACK] Seq=6246 Ack=5695 Win=699 Len=0 TSval=2785094177 TSecr=2785094136","60790","4444"
"3067","2.332643324","127.0.0.1","127.0.0.1","TLSv1.2","134","Application Data","60752","4444"
"3078","2.336999884","127.0.0.1","127.0.0.1","TCP","66","4444  >  60776 [ACK] Seq=5697 Ack=6246 Win=752 Len=0 TSval=2785094187 TSecr=2785094145","4444","60776"
"3089","2.365003303","127.0.0.1","127.0.0.1","TCP","66","60744  >  4444 [ACK] Seq=6178 Ack=5124 Win=697 Len=0 TSval=2785094215 TSecr=2785094174","60744","4444"
"3091","2.373006066","127.0.0.1","127.0.0.1","TCP","66","4444  >  60752 [ACK] Seq=5617 Ack=5668 Win=752 Len=0 TSval=2785094223 TSecr=2785094182","4444","60752"
"3092","2.373038961","127.0.0.1","127.0.0.1","TLSv1.2","636","Application Data","60752","4444"
"3093","2.373072764","127.0.0.1","127.0.0.1","TCP","66","4444  >  60752 [ACK] Seq=5617 Ack=6238 Win=752 Len=0 TSval=2785094223 TSecr=2785094223","4444","60752"
"3153","2.388520608","127.0.0.1","127.0.0.1","TLSv1.2","538","Application Data","4444","60744"
"3154","2.388554201","127.0.0.1","127.0.0.1","TCP","66","60744  >  4444 [ACK] Seq=6178 Ack=5596 Win=697 Len=0 TSval=2785094238 TSecr=2785094238","60744","4444"
"3177","2.394838310","127.0.0.1","127.0.0.1","TLSv1.2","166","Application Data","4444","60744"
"3178","2.395064037","127.0.0.1","127.0.0.1","TLSv1.2","144","Application Data","4444","60752"
"3179","2.395119770","127.0.0.1","127.0.0.1","TCP","66","60744  >  4444 [ACK] Seq=6178 Ack=5696 Win=697 Len=0 TSval=2785094245 TSecr=2785094244","60744","4444"
"3182","2.404221276","127.0.0.1","127.0.0.1","TLSv1.2","134","Application Data","60744","4444"
"3199","2.410508179","127.0.0.1","127.0.0.1","TLSv1.2","637","Application Data","60776","4444"
"3200","2.410539677","127.0.0.1","127.0.0.1","TCP","66","4444  >  60776 [ACK] Seq=5697 Ack=6817 Win=752 Len=0 TSval=2785094260 TSecr=2785094260","4444","60776"
"3261","2.426509793","127.0.0.1","127.0.0.1","TLSv1.2","539","Application Data","4444","60790"
"3262","2.426542200","127.0.0.1","127.0.0.1","TCP","66","60790  >  4444 [ACK] Seq=6246 Ack=6168 Win=697 Len=0 TSval=2785094276 TSecr=2785094276","60790","4444"
"3285","2.433098270","127.0.0.1","127.0.0.1","TLSv1.2","166","Application Data","4444","60790"
"3286","2.433293826","127.0.0.1","127.0.0.1","TLSv1.2","144","Application Data","4444","60776"
"3287","2.433372048","127.0.0.1","127.0.0.1","TCP","66","60790  >  4444 [ACK] Seq=6246 Ack=6268 Win=699 Len=0 TSval=2785094283 TSecr=2785094283","60790","4444"
"3290","2.436017566","127.0.0.1","127.0.0.1","TCP","66","60752  >  4444 [ACK] Seq=6238 Ack=5695 Win=699 Len=0 TSval=2785094286 TSecr=2785094245","60752","4444"
"3291","2.442763954","127.0.0.1","127.0.0.1","TLSv1.2","135","Application Data","60790","4444"
"3300","2.446007313","127.0.0.1","127.0.0.1","TCP","66","4444  >  60744 [ACK] Seq=5696 Ack=6246 Win=752 Len=0 TSval=2785094296 TSecr=2785094254","4444","60744"
"3313","2.473982168","127.0.0.1","127.0.0.1","TCP","66","60776  >  4444 [ACK] Seq=6817 Ack=5775 Win=697 Len=0 TSval=2785094324 TSecr=2785094283","60776","4444"
"3315","2.483006988","127.0.0.1","127.0.0.1","TCP","66","4444  >  60790 [ACK] Seq=6268 Ack=6315 Win=752 Len=0 TSval=2785094333 TSecr=2785094292","4444","60790"
"3316","2.483038416","127.0.0.1","127.0.0.1","TLSv1.2","637","Application Data","60790","4444"
"3317","2.483067331","127.0.0.1","127.0.0.1","TCP","66","4444  >  60790 [ACK] Seq=6268 Ack=6886 Win=752 Len=0 TSval=2785094333 TSecr=2785094333","4444","60790"
"3377","2.498753472","127.0.0.1","127.0.0.1","TLSv1.2","539","Application Data","4444","60776"
"3379","2.499050438","127.0.0.1","127.0.0.1","TCP","66","60776  >  4444 [ACK] Seq=6817 Ack=6248 Win=697 Len=0 TSval=2785094349 TSecr=2785094348","60776","4444"
"3401","2.505499232","127.0.0.1","127.0.0.1","TLSv1.2","166","Application Data","4444","60776"
"3402","2.505690248","127.0.0.1","127.0.0.1","TLSv1.2","144","Application Data","4444","60790"
"3403","2.505786210","127.0.0.1","127.0.0.1","TCP","66","60776  >  4444 [ACK] Seq=6817 Ack=6348 Win=697 Len=0 TSval=2785094355 TSecr=2785094355","60776","4444"
"3406","2.515085087","127.0.0.1","127.0.0.1","TLSv1.2","135","Application Data","60776","4444"
"3424","2.521323729","127.0.0.1","127.0.0.1","TLSv1.2","637","Application Data","60744","4444"
"3425","2.521354529","127.0.0.1","127.0.0.1","TCP","66","4444  >  60744 [ACK] Seq=5696 Ack=6817 Win=752 Len=0 TSval=2785094371 TSecr=2785094371","4444","60744"
"3485","2.537142150","127.0.0.1","127.0.0.1","TLSv1.2","538","Application Data","4444","60752"
"3487","2.537446938","127.0.0.1","127.0.0.1","TCP","66","60752  >  4444 [ACK] Seq=6238 Ack=6167 Win=699 Len=0 TSval=2785094387 TSecr=2785094387","60752","4444"
"3509","2.543781542","127.0.0.1","127.0.0.1","TLSv1.2","165","Application Data","4444","60752"
"3510","2.544060767","127.0.0.1","127.0.0.1","TLSv1.2","144","Application Data","4444","60744"
"3511","2.544115662","127.0.0.1","127.0.0.1","TCP","66","60752  >  4444 [ACK] Seq=6238 Ack=6266 Win=699 Len=0 TSval=2785094394 TSecr=2785094393","60752","4444"
"3514","2.547000247","127.0.0.1","127.0.0.1","TCP","66","60790  >  4444 [ACK] Seq=6886 Ack=6346 Win=699 Len=0 TSval=2785094397 TSecr=2785094355","60790","4444"
"3515","2.553580133","127.0.0.1","127.0.0.1","TLSv1.2","134","Application Data","60752","4444"
"3525","2.556989226","127.0.0.1","127.0.0.1","TCP","66","4444  >  60776 [ACK] Seq=6348 Ack=6886 Win=752 Len=0 TSval=2785094407 TSecr=2785094365","4444","60776"
"3538","2.585009198","127.0.0.1","127.0.0.1","TCP","66","60744  >  4444 [ACK] Seq=6817 Ack=5774 Win=697 Len=0 TSval=2785094435 TSecr=2785094394","60744","4444"
"3539","2.593992742","127.0.0.1","127.0.0.1","TCP","66","4444  >  60752 [ACK] Seq=6266 Ack=6306 Win=752 Len=0 TSval=2785094444 TSecr=2785094403","4444","60752"
"3540","2.594021307","127.0.0.1","127.0.0.1","TLSv1.2","636","Application Data","60752","4444"
"3541","2.594048964","127.0.0.1","127.0.0.1","TCP","66","4444  >  60752 [ACK] Seq=6266 Ack=6876 Win=752 Len=0 TSval=2785094444 TSecr=2785094444","4444","60752"
"3601","2.609423963","127.0.0.1","127.0.0.1","TLSv1.2","538","Application Data","4444","60744"
"3603","2.609674483","127.0.0.1","127.0.0.1","TCP","66","60744  >  4444 [ACK] Seq=6817 Ack=6246 Win=697 Len=0 TSval=2785094459 TSecr=2785094459","60744","4444"
"3625","2.616151005","127.0.0.1","127.0.0.1","TLSv1.2","166","Application Data","4444","60744"
"3626","2.616349913","127.0.0.1","127.0.0.1","TLSv1.2","144","Application Data","4444","60752"
"3627","2.616434351","127.0.0.1","127.0.0.1","TCP","66","60744  >  4444 [ACK] Seq=6817 Ack=6346 Win=697 Len=0 TSval=2785094466 TSecr=2785094466","60744","4444"
"3630","2.625796295","127.0.0.1","127.0.0.1","TLSv1.2","134","Application Data","60744","4444"
"3651","2.632060639","127.0.0.1","127.0.0.1","TLSv1.2","637","Application Data","60776","4444"
"3652","2.632089693","127.0.0.1","127.0.0.1","TCP","66","4444  >  60776 [ACK] Seq=6348 Ack=7457 Win=752 Len=0 TSval=2785094482 TSecr=2785094482","4444","60776"
"3709","2.644810932","127.0.0.1","127.0.0.1","TLSv1.2","539","Application Data","4444","60790"
