"No.","Time","Source","Destination","Protocol","Length","Info","src_port","dst_port"
"67","1.110751367","127.0.0.1","127.0.0.1","TLSv1.2","271","Application Data","37894","4444"
"68","1.110791246","127.0.0.1","127.0.0.1","TCP","66","4444  >  37894 [ACK] Seq=1 Ack=206 Win=511 Len=0 TSval=3000168166 TSecr=3000168166","4444","37894"
"69","1.111086674","127.0.0.1","127.0.0.1","TLSv1.2","271","Application Data","37714","4444"
"70","1.111110909","127.0.0.1","127.0.0.1","TCP","66","4444  >  37714 [ACK] Seq=1 Ack=206 Win=511 Len=0 TSval=3000168167 TSecr=3000168167","4444","37714"
"71","1.111358916","127.0.0.1","127.0.0.1","TLSv1.2","271","Application Data","38180","4444"
"73","1.111670408","127.0.0.1","127.0.0.1","TLSv1.2","271","Application Data","37984","4444"
"74","1.111953405","127.0.0.1","127.0.0.1","TLSv1.2","271","Application Data","37700","4444"
"77","1.112251208","127.0.0.1","127.0.0.1","TLSv1.2","271","Application Data","38372","4444"
"83","1.112663062","127.0.0.1","127.0.0.1","TLSv1.2","271","Application Data","37844","4444"
"84","1.112694072","127.0.0.1","127.0.0.1","TCP","66","4444  >  37844 [ACK] Seq=1 Ack=206 Win=511 Len=0 TSval=3000168168 TSecr=3000168168","4444","37844"
"94","1.113150065","127.0.0.1","127.0.0.1","TLSv1.2","271","Application Data","38410","4444"
"102","1.113632180","127.0.0.1","127.0.0.1","TLSv1.2","271","Application Data","38164","4444"
"106","1.114148935","127.0.0.1","127.0.0.1","TLSv1.2","271","Application Data","38098","4444"
"113","1.114588865","127.0.0.1","127.0.0.1","TLSv1.2","271","Application Data","38508","4444"
"118","1.115073215","127.0.0.1","127.0.0.1","TLSv1.2","271","Application Data","38074","4444"
"127","1.115589691","127.0.0.1","127.0.0.1","TLSv1.2","271","Application Data","37824","4444"
"129","1.115649754","127.0.0.1","127.0.0.1","TCP","66","4444  >  37824 [ACK] Seq=1 Ack=206 Win=511 Len=0 TSval=3000168171 TSecr=3000168171","4444","37824"
"150","1.116372262","127.0.0.1","127.0.0.1","TLSv1.2","271","Application Data","38434","4444"
"162","1.116740605","127.0.0.1","127.0.0.1","TLSv1.2","271","Application Data","38290","4444"
"167","1.117080663","127.0.0.1","127.0.0.1","TLSv1.2","271","Application Data","38150","4444"
"184","1.118245545","127.0.0.1","127.0.0.1","TLSv1.2","271","Application Data","38010","4444"
"192","1.118722841","127.0.0.1","127.0.0.1","TLSv1.2","271","Application Data","38034","4444"
"202","1.119206142","127.0.0.1","127.0.0.1","TLSv1.2","271","Application Data","37956","4444"
"223","1.119775907","127.0.0.1","127.0.0.1","TLSv1.2","271","Application Data","37912","4444"
"231","1.120326536","127.0.0.1","127.0.0.1","TLSv1.2","271","Application Data","37586","4444"
"245","1.121339793","127.0.0.1","127.0.0.1","TLSv1.2","271","Application Data","37808","4444"
"247","1.121384911","127.0.0.1","127.0.0.1","TCP","66","4444  >  37808 [ACK] Seq=1 Ack=206 Win=511 Len=0 TSval=3000168177 TSecr=3000168177","4444","37808"
"271","1.122398657","127.0.0.1","127.0.0.1","TLSv1.2","271","Application Data","37684","4444"
"273","1.122426524","127.0.0.1","127.0.0.1","TCP","66","4444  >  37684 [ACK] Seq=1 Ack=206 Win=511 Len=0 TSval=3000168178 TSecr=3000168178","4444","37684"
"283","1.122872739","127.0.0.1","127.0.0.1","TLSv1.2","271","Application Data","37830","4444"
"284","1.122924632","127.0.0.1","127.0.0.1","TCP","66","4444  >  37830 [ACK] Seq=1 Ack=206 Win=511 Len=0 TSval=3000168178 TSecr=3000168178","4444","37830"
"337","1.125495279","127.0.0.1","127.0.0.1","TLSv1.2","207","Application Data","4444","37700"
"338","1.125530549","127.0.0.1","127.0.0.1","TCP","66","37700  >  4444 [ACK] Seq=206 Ack=142 Win=615 Len=0 TSval=3000168181 TSecr=3000168181","37700","4444"
"339","1.125552479","127.0.0.1","127.0.0.1","TLSv1.2","271","Application Data","37878","4444"
"340","1.125573362","127.0.0.1","127.0.0.1","TCP","66","4444  >  37878 [ACK] Seq=1 Ack=206 Win=511 Len=0 TSval=3000168181 TSecr=3000168181","4444","37878"
"349","1.126066022","127.0.0.1","127.0.0.1","TLSv1.2","271","Application Data","38418","4444"
"352","1.126352721","127.0.0.1","127.0.0.1","TLSv1.2","271","Application Data","38120","4444"
"354","1.126560848","127.0.0.1","127.0.0.1","TLSv1.2","271","Application Data","37986","4444"
"357","1.126688238","127.0.0.1","127.0.0.1","TLSv1.2","207","Application Data","4444","37714"
"358","1.126708772","127.0.0.1","127.0.0.1","TCP","66","37714  >  4444 [ACK] Seq=206 Ack=142 Win=615 Len=0 TSval=3000168182 TSecr=3000168182","37714","4444"
"359","1.126721622","127.0.0.1","127.0.0.1","TLSv1.2","271","Application Data","37988","4444"
"387","1.128251077","::1","::1","TCP","94","45346  >  4444 [SYN] Seq=0 Win=65476 Len=0 MSS=65476 SACK_PERM TSval=3600239207 TSecr=0 WS=128","45346","4444"
"389","1.128269794","::1","::1","TCP","74","4444  >  45346 [RST, ACK] Seq=1 Ack=1 Win=0 Len=0","4444","45346"
"436","1.129581972","::1","::1","TCP","94","45360  >  4444 [SYN] Seq=0 Win=65476 Len=0 MSS=65476 SACK_PERM TSval=3600239208 TSecr=0 WS=128","45360","4444"
"438","1.129601458","::1","::1","TCP","74","4444  >  45360 [RST, ACK] Seq=1 Ack=1 Win=0 Len=0","4444","45360"
"449","1.130054239","127.0.0.1","127.0.0.1","TLSv1.2","207","Application Data","4444","37894"
"452","1.130106410","127.0.0.1","127.0.0.1","TCP","66","37894  >  4444 [ACK] Seq=206 Ack=142 Win=615 Len=0 TSval=3000168186 TSecr=3000168186","37894","4444"
"456","1.130233801","127.0.0.1","127.0.0.1","TLSv1.2","401","Application Data","51104","4444"
"457","1.130254823","127.0.0.1","127.0.0.1","TCP","66","4444  >  51104 [ACK] Seq=1 Ack=336 Win=995 Len=0 TSval=3000168186 TSecr=3000168186","4444","51104"
"483","1.131177356","127.0.0.1","127.0.0.1","TLSv1.2","401","Application Data","50842","4444"
"485","1.131197261","127.0.0.1","127.0.0.1","TCP","66","4444  >  50842 [ACK] Seq=1 Ack=336 Win=995 Len=0 TSval=3000168187 TSecr=3000168187","4444","50842"
"501","1.132189357","::1","::1","TCP","94","45372  >  4444 [SYN] Seq=0 Win=65476 Len=0 MSS=65476 SACK_PERM TSval=3600239211 TSecr=0 WS=128","45372","4444"
"503","1.132207166","::1","::1","TCP","74","4444  >  45372 [RST, ACK] Seq=1 Ack=1 Win=0 Len=0","4444","45372"
"515","1.132715820","127.0.0.1","127.0.0.1","TLSv1.2","207","Application Data","4444","38410"
"517","1.132752417","127.0.0.1","127.0.0.1","TCP","66","38410  >  4444 [ACK] Seq=206 Ack=142 Win=615 Len=0 TSval=3000168188 TSecr=3000168188","38410","4444"
"526","1.133279230","127.0.0.1","127.0.0.1","TLSv1.2","401","Application Data","50612","4444"
"527","1.133298366","127.0.0.1","127.0.0.1","TCP","66","4444  >  50612 [ACK] Seq=1 Ack=336 Win=995 Len=0 TSval=3000168189 TSecr=3000168189","4444","50612"
"540","1.133869388","127.0.0.1","127.0.0.1","TLSv1.2","207","Application Data","4444","38098"
"541","1.133870785","127.0.0.1","127.0.0.1","TLSv1.2","207","Application Data","4444","37984"
"542","1.133929033","127.0.0.1","127.0.0.1","TCP","66","37984  >  4444 [ACK] Seq=206 Ack=142 Win=615 Len=0 TSval=3000168189 TSecr=3000168189","37984","4444"
"543","1.133931408","127.0.0.1","127.0.0.1","TCP","66","38098  >  4444 [ACK] Seq=206 Ack=142 Win=615 Len=0 TSval=3000168189 TSecr=3000168189","38098","4444"
"551","1.134322868","::1","::1","TCP","94","45384  >  4444 [SYN] Seq=0 Win=65476 Len=0 MSS=65476 SACK_PERM TSval=3600239213 TSecr=0 WS=128","45384","4444"
"552","1.134344868","::1","::1","TCP","74","4444  >  45384 [RST, ACK] Seq=1 Ack=1 Win=0 Len=0","4444","45384"
"555","1.134430633","127.0.0.1","127.0.0.1","TLSv1.2","207","Application Data","4444","37844"
"556","1.134454030","127.0.0.1","127.0.0.1","TCP","66","37844  >  4444 [ACK] Seq=206 Ack=142 Win=615 Len=0 TSval=3000168190 TSecr=3000168190","37844","4444"
"558","1.134551389","127.0.0.1","127.0.0.1","TLSv1.2","207","Application Data","4444","38372"
"559","1.134572411","127.0.0.1","127.0.0.1","TCP","66","38372  >  4444 [ACK] Seq=206 Ack=142 Win=615 Len=0 TSval=3000168190 TSecr=3000168190","38372","4444"
"583","1.135614932","::1","::1","TCP","94","45388  >  4444 [SYN] Seq=0 Win=65476 Len=0 MSS=65476 SACK_PERM TSval=3600239214 TSecr=0 WS=128","45388","4444"
"585","1.135631344","::1","::1","TCP","74","4444  >  45388 [RST, ACK] Seq=1 Ack=1 Win=0 Len=0","4444","45388"
"592","1.135833395","127.0.0.1","127.0.0.1","TLSv1.2","207","Application Data","4444","38180"
"594","1.135860493","127.0.0.1","127.0.0.1","TCP","66","38180  >  4444 [ACK] Seq=206 Ack=142 Win=615 Len=0 TSval=3000168191 TSecr=3000168191","38180","4444"
"608","1.136764868","::1","::1","TCP","94","45398  >  4444 [SYN] Seq=0 Win=65476 Len=0 MSS=65476 SACK_PERM TSval=3600239215 TSecr=0 WS=128","45398","4444"
"609","1.136785052","::1","::1","TCP","74","4444  >  45398 [RST, ACK] Seq=1 Ack=1 Win=0 Len=0","4444","45398"
"610","1.136824094","127.0.0.1","127.0.0.1","TLSv1.2","207","Application Data","4444","38508"
"611","1.136833173","127.0.0.1","127.0.0.1","TLSv1.2","207","Application Data","4444","38290"
"612","1.136864183","127.0.0.1","127.0.0.1","TCP","66","38508  >  4444 [ACK] Seq=206 Ack=142 Win=615 Len=0 TSval=3000168192 TSecr=3000168192","38508","4444"
"613","1.136864183","127.0.0.1","127.0.0.1","TCP","66","38290  >  4444 [ACK] Seq=206 Ack=142 Win=615 Len=0 TSval=3000168192 TSecr=3000168192","38290","4444"
"630","1.137764716","::1","::1","TCP","94","45402  >  4444 [SYN] Seq=0 Win=65476 Len=0 MSS=65476 SACK_PERM TSval=3600239216 TSecr=0 WS=128","45402","4444"
"632","1.137785179","::1","::1","TCP","74","4444  >  45402 [RST, ACK] Seq=1 Ack=1 Win=0 Len=0","4444","45402"
"644","1.138336646","127.0.0.1","127.0.0.1","TLSv1.2","207","Application Data","4444","38164"
"647","1.138388678","127.0.0.1","127.0.0.1","TCP","66","38164  >  4444 [ACK] Seq=206 Ack=142 Win=615 Len=0 TSval=3000168194 TSecr=3000168194","38164","4444"
"658","1.138819249","::1","::1","TCP","94","45412  >  4444 [SYN] Seq=0 Win=65476 Len=0 MSS=65476 SACK_PERM TSval=3600239217 TSecr=0 WS=128","45412","4444"
"659","1.138839713","::1","::1","TCP","74","4444  >  45412 [RST, ACK] Seq=1 Ack=1 Win=0 Len=0","4444","45412"
"660","1.138847815","127.0.0.1","127.0.0.1","TLSv1.2","207","Application Data","4444","37824"
"661","1.138867929","127.0.0.1","127.0.0.1","TCP","66","37824  >  4444 [ACK] Seq=206 Ack=142 Win=615 Len=0 TSval=3000168194 TSecr=3000168194","37824","4444"
"673","1.139377980","127.0.0.1","127.0.0.1","TLSv1.2","401","Application Data","51174","4444"
"675","1.139396557","127.0.0.1","127.0.0.1","TCP","66","4444  >  51174 [ACK] Seq=1 Ack=336 Win=995 Len=0 TSval=3000168195 TSecr=3000168195","4444","51174"
"676","1.139396557","127.0.0.1","127.0.0.1","TLSv1.2","207","Application Data","4444","37586"
"677","1.139445656","127.0.0.1","127.0.0.1","TCP","66","37586  >  4444 [ACK] Seq=206 Ack=142 Win=615 Len=0 TSval=3000168195 TSecr=3000168195","37586","4444"
"692","1.140542094","::1","::1","TCP","94","45418  >  4444 [SYN] Seq=0 Win=65476 Len=0 MSS=65476 SACK_PERM TSval=3600239219 TSecr=0 WS=128","45418","4444"
"693","1.140561650","::1","::1","TCP","74","4444  >  45418 [RST, ACK] Seq=1 Ack=1 Win=0 Len=0","4444","45418"
"699","1.140757554","127.0.0.1","127.0.0.1","TLSv1.2","207","Application Data","4444","38150"
"700","1.140759440","127.0.0.1","127.0.0.1","TLSv1.2","207","Application Data","4444","37956"
"701","1.140788564","127.0.0.1","127.0.0.1","TCP","66","37956  >  4444 [ACK] Seq=206 Ack=142 Win=615 Len=0 TSval=3000168196 TSecr=3000168196","37956","4444"
"702","1.140788564","127.0.0.1","127.0.0.1","TCP","66","38150  >  4444 [ACK] Seq=206 Ack=142 Win=615 Len=0 TSval=3000168196 TSecr=3000168196","38150","4444"
"709","1.141306158","127.0.0.1","127.0.0.1","TLSv1.2","207","Application Data","4444","37808"
"710","1.141344361","127.0.0.1","127.0.0.1","TCP","66","37808  >  4444 [ACK] Seq=206 Ack=142 Win=615 Len=0 TSval=3000168197 TSecr=3000168197","37808","4444"
"717","1.141618139","::1","::1","TCP","94","45428  >  4444 [SYN] Seq=0 Win=65476 Len=0 MSS=65476 SACK_PERM TSval=3600239220 TSecr=0 WS=128","45428","4444"
"718","1.141634970","::1","::1","TCP","74","4444  >  45428 [RST, ACK] Seq=1 Ack=1 Win=0 Len=0","4444","45428"
"719","1.141690075","127.0.0.1","127.0.0.1","TLSv1.2","207","Application Data","4444","38074"
"720","1.141707326","127.0.0.1","127.0.0.1","TCP","66","38074  >  4444 [ACK] Seq=206 Ack=142 Win=615 Len=0 TSval=3000168197 TSecr=3000168197","38074","4444"
"732","1.142586837","::1","::1","TCP","94","45444  >  4444 [SYN] Seq=0 Win=65476 Len=0 MSS=65476 SACK_PERM TSval=3600239221 TSecr=0 WS=128","45444","4444"
"734","1.142604088","::1","::1","TCP","74","4444  >  45444 [RST, ACK] Seq=1 Ack=1 Win=0 Len=0","4444","45444"
"740","1.142947847","127.0.0.1","127.0.0.1","TLSv1.2","207","Application Data","4444","37878"
"741","1.142968171","127.0.0.1","127.0.0.1","TCP","66","37878  >  4444 [ACK] Seq=206 Ack=142 Win=615 Len=0 TSval=3000168199 TSecr=3000168199","37878","4444"
"743","1.143141098","127.0.0.1","127.0.0.1","TLSv1.2","401","Application Data","51062","4444"
"744","1.143159606","127.0.0.1","127.0.0.1","TCP","66","4444  >  51062 [ACK] Seq=1 Ack=336 Win=995 Len=0 TSval=3000168199 TSecr=3000168199","4444","51062"
"786","1.144675091","::1","::1","TCP","94","45456  >  4444 [SYN] Seq=0 Win=65476 Len=0 MSS=65476 SACK_PERM TSval=3600239223 TSecr=0 WS=128","45456","4444"
"787","1.144699326","::1","::1","TCP","74","4444  >  45456 [RST, ACK] Seq=1 Ack=1 Win=0 Len=0","4444","45456"
"790","1.144825250","127.0.0.1","127.0.0.1","TLSv1.2","207","Application Data","4444","37912"
"791","1.144825250","127.0.0.1","127.0.0.1","TLSv1.2","207","Application Data","4444","38010"
"792","1.144864222","127.0.0.1","127.0.0.1","TCP","66","38010  >  4444 [ACK] Seq=206 Ack=142 Win=615 Len=0 TSval=3000168200 TSecr=3000168200","38010","4444"
"793","1.144864222","127.0.0.1","127.0.0.1","TCP","66","37912  >  4444 [ACK] Seq=206 Ack=142 Win=615 Len=0 TSval=3000168200 TSecr=3000168200","37912","4444"
"803","1.145440971","127.0.0.1","127.0.0.1","TLSv1.2","401","Application Data","51386","4444"
"806","1.145459619","127.0.0.1","127.0.0.1","TCP","66","4444  >  51386 [ACK] Seq=1 Ack=336 Win=995 Len=0 TSval=3000168201 TSecr=3000168201","4444","51386"
"816","1.146036647","127.0.0.1","127.0.0.1","TLSv1.2","401","Application Data","50822","4444"
"817","1.146057181","127.0.0.1","127.0.0.1","TCP","66","4444  >  50822 [ACK] Seq=1 Ack=336 Win=995 Len=0 TSval=3000168202 TSecr=3000168202","4444","50822"
"818","1.146064234","127.0.0.1","127.0.0.1","TLSv1.2","207","Application Data","4444","38434"
"819","1.146088190","127.0.0.1","127.0.0.1","TCP","66","38434  >  4444 [ACK] Seq=206 Ack=142 Win=615 Len=0 TSval=3000168202 TSecr=3000168202","38434","4444"
"826","1.146793308","127.0.0.1","127.0.0.1","TLSv1.2","207","Application Data","4444","37830"
"827","1.146819079","127.0.0.1","127.0.0.1","TCP","66","37830  >  4444 [ACK] Seq=206 Ack=142 Win=615 Len=0 TSval=3000168202 TSecr=3000168202","37830","4444"
"833","1.147030139","::1","::1","TCP","94","45468  >  4444 [SYN] Seq=0 Win=65476 Len=0 MSS=65476 SACK_PERM TSval=3600239226 TSecr=0 WS=128","45468","4444"
"834","1.147048368","::1","::1","TCP","74","4444  >  45468 [RST, ACK] Seq=1 Ack=1 Win=0 Len=0","4444","45468"
"841","1.147675054","127.0.0.1","127.0.0.1","TLSv1.2","207","Application Data","4444","38034"
"843","1.147699358","127.0.0.1","127.0.0.1","TCP","66","38034  >  4444 [ACK] Seq=206 Ack=142 Win=615 Len=0 TSval=3000168203 TSecr=3000168203","38034","4444"
"855","1.148086139","::1","::1","TCP","94","45480  >  4444 [SYN] Seq=0 Win=65476 Len=0 MSS=65476 SACK_PERM TSval=3600239227 TSecr=0 WS=128","45480","4444"
"856","1.148106743","::1","::1","TCP","74","4444  >  45480 [RST, ACK] Seq=1 Ack=1 Win=0 Len=0","4444","45480"
"869","1.148548698","127.0.0.1","127.0.0.1","TLSv1.2","401","Application Data","50770","4444"
"871","1.148572724","127.0.0.1","127.0.0.1","TCP","66","4444  >  50770 [ACK] Seq=1 Ack=336 Win=995 Len=0 TSval=3000168204 TSecr=3000168204","4444","50770"
"873","1.149108267","127.0.0.1","127.0.0.1","TLSv1.2","207","Application Data","4444","38120"
"874","1.149157505","127.0.0.1","127.0.0.1","TCP","66","38120  >  4444 [ACK] Seq=206 Ack=142 Win=615 Len=0 TSval=3000168205 TSecr=3000168205","38120","4444"
"877","1.149261429","127.0.0.1","127.0.0.1","TLSv1.2","207","Application Data","4444","37684"
"878","1.149282381","127.0.0.1","127.0.0.1","TCP","66","37684  >  4444 [ACK] Seq=206 Ack=142 Win=615 Len=0 TSval=3000168205 TSecr=3000168205","37684","4444"
"883","1.149546241","::1","::1","TCP","94","45488  >  4444 [SYN] Seq=0 Win=65476 Len=0 MSS=65476 SACK_PERM TSval=3600239228 TSecr=0 WS=128","45488","4444"
"884","1.149570616","::1","::1","TCP","74","4444  >  45488 [RST, ACK] Seq=1 Ack=1 Win=0 Len=0","4444","45488"
"888","1.150206172","127.0.0.1","127.0.0.1","TLSv1.2","207","Application Data","4444","37986"
"889","1.150233829","127.0.0.1","127.0.0.1","TCP","66","37986  >  4444 [ACK] Seq=206 Ack=142 Win=615 Len=0 TSval=3000168206 TSecr=3000168206","37986","4444"
"897","1.150634229","::1","::1","TCP","94","45498  >  4444 [SYN] Seq=0 Win=65476 Len=0 MSS=65476 SACK_PERM TSval=3600239229 TSecr=0 WS=128","45498","4444"
"900","1.150651619","::1","::1","TCP","74","4444  >  45498 [RST, ACK] Seq=1 Ack=1 Win=0 Len=0","4444","45498"
"930","1.152068070","::1","::1","TCP","94","45514  >  4444 [SYN] Seq=0 Win=65476 Len=0 MSS=65476 SACK_PERM TSval=3600239231 TSecr=0 WS=128","45514","4444"
"931","1.152094191","::1","::1","TCP","74","4444  >  45514 [RST, ACK] Seq=1 Ack=1 Win=0 Len=0","4444","45514"
"942","1.152703207","127.0.0.1","127.0.0.1","TLSv1.2","207","Application Data","4444","37988"
"943","1.152732750","127.0.0.1","127.0.0.1","TCP","66","37988  >  4444 [ACK] Seq=206 Ack=142 Win=615 Len=0 TSval=3000168208 TSecr=3000168208","37988","4444"
"944","1.152799099","127.0.0.1","127.0.0.1","TLSv1.2","207","Application Data","4444","38418"
"945","1.152822496","127.0.0.1","127.0.0.1","TCP","66","38418  >  4444 [ACK] Seq=206 Ack=142 Win=615 Len=0 TSval=3000168208 TSecr=3000168208","38418","4444"
"950","1.153230788","::1","::1","TCP","94","45526  >  4444 [SYN] Seq=0 Win=65476 Len=0 MSS=65476 SACK_PERM TSval=3600239232 TSecr=0 WS=128","45526","4444"
"951","1.153253835","::1","::1","TCP","74","4444  >  45526 [RST, ACK] Seq=1 Ack=1 Win=0 Len=0","4444","45526"
"971","1.154301594","::1","::1","TCP","94","45534  >  4444 [SYN] Seq=0 Win=65476 Len=0 MSS=65476 SACK_PERM TSval=3600239233 TSecr=0 WS=128","45534","4444"
"972","1.154319264","::1","::1","TCP","74","4444  >  45534 [RST, ACK] Seq=1 Ack=1 Win=0 Len=0","4444","45534"
"990","1.154986598","127.0.0.1","127.0.0.1","TLSv1.2","401","Application Data","51402","4444"
"994","1.155010413","127.0.0.1","127.0.0.1","TCP","66","4444  >  51402 [ACK] Seq=1 Ack=336 Win=995 Len=0 TSval=3000168211 TSecr=3000168211","4444","51402"
"1015","1.156655245","::1","::1","TCP","94","45550  >  4444 [SYN] Seq=0 Win=65476 Len=0 MSS=65476 SACK_PERM TSval=3600239235 TSecr=0 WS=128","45550","4444"
"1017","1.156679690","::1","::1","TCP","74","4444  >  45550 [RST, ACK] Seq=1 Ack=1 Win=0 Len=0","4444","45550"
"1048","1.157955620","::1","::1","TCP","94","45554  >  4444 [SYN] Seq=0 Win=65476 Len=0 MSS=65476 SACK_PERM TSval=3600239237 TSecr=0 WS=128","45554","4444"
"1049","1.157976992","::1","::1","TCP","74","4444  >  45554 [RST, ACK] Seq=1 Ack=1 Win=0 Len=0","4444","45554"
"1064","1.158952465","::1","::1","TCP","94","45568  >  4444 [SYN] Seq=0 Win=65476 Len=0 MSS=65476 SACK_PERM TSval=3600239238 TSecr=0 WS=128","45568","4444"
"1065","1.158973347","::1","::1","TCP","74","4444  >  45568 [RST, ACK] Seq=1 Ack=1 Win=0 Len=0","4444","45568"
"1088","1.159926890","127.0.0.1","127.0.0.1","TLSv1.2","401","Application Data","51424","4444"
"1089","1.159952173","127.0.0.1","127.0.0.1","TCP","66","4444  >  51424 [ACK] Seq=1 Ack=336 Win=995 Len=0 TSval=3000168216 TSecr=3000168215","4444","51424"
"1120","1.161675576","::1","::1","TCP","94","45582  >  4444 [SYN] Seq=0 Win=65476 Len=0 MSS=65476 SACK_PERM TSval=3600239240 TSecr=0 WS=128","45582","4444"
"1121","1.161696529","::1","::1","TCP","74","4444  >  45582 [RST, ACK] Seq=1 Ack=1 Win=0 Len=0","4444","45582"
"1158","1.163411621","::1","::1","TCP","94","45590  >  4444 [SYN] Seq=0 Win=65476 Len=0 MSS=65476 SACK_PERM TSval=3600239242 TSecr=0 WS=128","45590","4444"
"1161","1.163431735","::1","::1","TCP","74","4444  >  45590 [RST, ACK] Seq=1 Ack=1 Win=0 Len=0","4444","45590"
"1212","1.165623704","::1","::1","TCP","94","45606  >  4444 [SYN] Seq=0 Win=65476 Len=0 MSS=65476 SACK_PERM TSval=3600239244 TSecr=0 WS=128","45606","4444"
"1214","1.165642910","::1","::1","TCP","74","4444  >  45606 [RST, ACK] Seq=1 Ack=1 Win=0 Len=0","4444","45606"
"1228","1.166361507","127.0.0.1","127.0.0.1","TLSv1.2","401","Application Data","51482","4444"
"1231","1.166383996","127.0.0.1","127.0.0.1","TCP","66","4444  >  51482 [ACK] Seq=1 Ack=336 Win=995 Len=0 TSval=3000168222 TSecr=3000168222","4444","51482"
"1296","1.169060453","::1","::1","TCP","94","45616  >  4444 [SYN] Seq=0 Win=65476 Len=0 MSS=65476 SACK_PERM TSval=3600239248 TSecr=0 WS=128","45616","4444"
"1297","1.169076028","::1","::1","TCP","74","4444  >  45616 [RST, ACK] Seq=1 Ack=1 Win=0 Len=0","4444","45616"
"1345","1.170855653","::1","::1","TCP","94","45622  >  4444 [SYN] Seq=0 Win=65476 Len=0 MSS=65476 SACK_PERM TSval=3600239249 TSecr=0 WS=128","45622","4444"
"1346","1.170876047","::1","::1","TCP","74","4444  >  45622 [RST, ACK] Seq=1 Ack=1 Win=0 Len=0","4444","45622"
"1359","1.171424511","127.0.0.1","127.0.0.1","TLSv1.2","401","Application Data","51544","4444"
"1360","1.171443508","127.0.0.1","127.0.0.1","TCP","66","4444  >  51544 [ACK] Seq=1 Ack=336 Win=995 Len=0 TSval=3000168227 TSecr=3000168227","4444","51544"
"1372","1.171920663","127.0.0.1","127.0.0.1","TLSv1.2","401","Application Data","38494","4444"
"1374","1.171942663","127.0.0.1","127.0.0.1","TCP","66","4444  >  38494 [ACK] Seq=1 Ack=336 Win=995 Len=0 TSval=3000168228 TSecr=3000168227","4444","38494"
"1387","1.172779222","::1","::1","TCP","94","45638  >  4444 [SYN] Seq=0 Win=65476 Len=0 MSS=65476 SACK_PERM TSval=3600239251 TSecr=0 WS=128","45638","4444"
"1388","1.172794378","::1","::1","TCP","74","4444  >  45638 [RST, ACK] Seq=1 Ack=1 Win=0 Len=0","4444","45638"
"1407","1.173664879","::1","::1","TCP","94","45654  >  4444 [SYN] Seq=0 Win=65476 Len=0 MSS=65476 SACK_PERM TSval=3600239252 TSecr=0 WS=128","45654","4444"
"1409","1.173680174","::1","::1","TCP","74","4444  >  45654 [RST, ACK] Seq=1 Ack=1 Win=0 Len=0","4444","45654"
"1417","1.174143082","127.0.0.1","127.0.0.1","TLSv1.2","401","Application Data","50934","4444"
"1419","1.174160682","127.0.0.1","127.0.0.1","TCP","66","4444  >  50934 [ACK] Seq=1 Ack=336 Win=995 Len=0 TSval=3000168230 TSecr=3000168230","4444","50934"
"1429","1.174625406","127.0.0.1","127.0.0.1","TLSv1.2","401","Application Data","51090","4444"
"1431","1.174643914","127.0.0.1","127.0.0.1","TCP","66","4444  >  51090 [ACK] Seq=1 Ack=336 Win=995 Len=0 TSval=3000168230 TSecr=3000168230","4444","51090"
"1441","1.175121559","127.0.0.1","127.0.0.1","TLSv1.2","401","Application Data","50812","4444"
"1442","1.175142162","127.0.0.1","127.0.0.1","TCP","66","4444  >  50812 [ACK] Seq=1 Ack=336 Win=995 Len=0 TSval=3000168231 TSecr=3000168231","4444","50812"
"1464","1.176242791","127.0.0.1","127.0.0.1","TLSv1.2","401","Application Data","51352","4444"
"1465","1.176269889","127.0.0.1","127.0.0.1","TCP","66","4444  >  51352 [ACK] Seq=1 Ack=336 Win=995 Len=0 TSval=3000168232 TSecr=3000168232","4444","51352"
"1481","1.177071038","127.0.0.1","127.0.0.1","TLSv1.2","401","Application Data","51080","4444"
"1482","1.177095762","127.0.0.1","127.0.0.1","TCP","66","4444  >  51080 [ACK] Seq=1 Ack=336 Win=995 Len=0 TSval=3000168233 TSecr=3000168233","4444","51080"
"1494","1.177681870","127.0.0.1","127.0.0.1","TLSv1.2","401","Application Data","51140","4444"
"1497","1.177702404","127.0.0.1","127.0.0.1","TCP","66","4444  >  51140 [ACK] Seq=1 Ack=336 Win=995 Len=0 TSval=3000168233 TSecr=3000168233","4444","51140"
"1512","1.178174112","127.0.0.1","127.0.0.1","TLSv1.2","401","Application Data","51148","4444"
"1515","1.178195623","127.0.0.1","127.0.0.1","TCP","66","4444  >  51148 [ACK] Seq=1 Ack=336 Win=995 Len=0 TSval=3000168234 TSecr=3000168234","4444","51148"
"1526","1.178737870","127.0.0.1","127.0.0.1","TLSv1.2","401","Application Data","50592","4444"
"1527","1.178764550","127.0.0.1","127.0.0.1","TCP","66","4444  >  50592 [ACK] Seq=1 Ack=336 Win=995 Len=0 TSval=3000168234 TSecr=3000168234","4444","50592"
"1544","1.179355058","127.0.0.1","127.0.0.1","TLSv1.2","401","Application Data","50656","4444"
"1545","1.179375102","127.0.0.1","127.0.0.1","TCP","66","4444  >  50656 [ACK] Seq=1 Ack=336 Win=907 Len=0 TSval=3000168235 TSecr=3000168235","4444","50656"
"1555","1.179882080","127.0.0.1","127.0.0.1","TLSv1.2","401","Application Data","50688","4444"
"1556","1.179944099","127.0.0.1","127.0.0.1","TCP","66","4444  >  50688 [ACK] Seq=1 Ack=336 Win=907 Len=0 TSval=3000168235 TSecr=3000168235","4444","50688"
"1571","1.180492493","127.0.0.1","127.0.0.1","TLSv1.2","401","Application Data","51322","4444"
"1572","1.180517077","127.0.0.1","127.0.0.1","TCP","66","4444  >  51322 [ACK] Seq=1 Ack=336 Win=995 Len=0 TSval=3000168236 TSecr=3000168236","4444","51322"
"1586","1.181122741","127.0.0.1","127.0.0.1","TLSv1.2","401","Application Data","51338","4444"
"1587","1.181146487","127.0.0.1","127.0.0.1","TCP","66","4444  >  51338 [ACK] Seq=1 Ack=336 Win=995 Len=0 TSval=3000168237 TSecr=3000168237","4444","51338"
"1594","1.181682728","127.0.0.1","127.0.0.1","TLSv1.2","401","Application Data","50896","4444"
"1595","1.181704798","127.0.0.1","127.0.0.1","TCP","66","4444  >  50896 [ACK] Seq=1 Ack=336 Win=995 Len=0 TSval=3000168237 TSecr=3000168237","4444","50896"
"1607","1.182290207","127.0.0.1","127.0.0.1","TLSv1.2","401","Application Data","50808","4444"
"1608","1.182309484","127.0.0.1","127.0.0.1","TCP","66","4444  >  50808 [ACK] Seq=1 Ack=336 Win=995 Len=0 TSval=3000168238 TSecr=3000168238","4444","50808"
"1616","1.182820372","127.0.0.1","127.0.0.1","TLSv1.2","401","Application Data","50576","4444"
"1617","1.182839858","127.0.0.1","127.0.0.1","TCP","66","4444  >  50576 [ACK] Seq=1 Ack=336 Win=995 Len=0 TSval=3000168238 TSecr=3000168238","4444","50576"
"1630","1.183450760","127.0.0.1","127.0.0.1","TLSv1.2","401","Application Data","51220","4444"
"1631","1.183474227","127.0.0.1","127.0.0.1","TCP","66","4444  >  51220 [ACK] Seq=1 Ack=336 Win=995 Len=0 TSval=3000168239 TSecr=3000168239","4444","51220"
"2171","1.206891518","127.0.0.1","127.0.0.1","TLSv1.2","2396","Application Data","4444","50842"
"2172","1.206944737","127.0.0.1","127.0.0.1","TCP","66","50842  >  4444 [ACK] Seq=336 Ack=2331 Win=706 Len=0 TSval=3000168263 TSecr=3000168262","50842","4444"
"2258","1.211102179","127.0.0.1","127.0.0.1","TLSv1.2","2394","Application Data","4444","51174"
"2259","1.211137728","127.0.0.1","127.0.0.1","TCP","66","51174  >  4444 [ACK] Seq=336 Ack=2329 Win=706 Len=0 TSval=3000168267 TSecr=3000168267","51174","4444"
"2266","1.211586878","127.0.0.1","127.0.0.1","TLSv1.2","2399","Application Data","4444","51062"
"2269","1.211612090","127.0.0.1","127.0.0.1","TCP","66","51062  >  4444 [ACK] Seq=336 Ack=2334 Win=706 Len=0 TSval=3000168267 TSecr=3000168267","51062","4444"
"2281","1.212576529","127.0.0.1","127.0.0.1","TLSv1.2","2394","Application Data","4444","50822"
"2282","1.212610960","127.0.0.1","127.0.0.1","TCP","66","50822  >  4444 [ACK] Seq=336 Ack=2329 Win=706 Len=0 TSval=3000168268 TSecr=3000168268","50822","4444"
"2327","1.215059596","127.0.0.1","127.0.0.1","TLSv1.2","2396","Application Data","4444","50770"
"2329","1.215091723","127.0.0.1","127.0.0.1","TLSv1.2","2397","Application Data","4444","51104"
"2330","1.215091723","127.0.0.1","127.0.0.1","TCP","66","50770  >  4444 [ACK] Seq=336 Ack=2331 Win=706 Len=0 TSval=3000168271 TSecr=3000168271","50770","4444"
"2331","1.215107926","127.0.0.1","127.0.0.1","TCP","66","51104  >  4444 [ACK] Seq=336 Ack=2332 Win=706 Len=0 TSval=3000168271 TSecr=3000168271","51104","4444"
"2376","1.216749056","127.0.0.1","127.0.0.1","TLSv1.2","2398","Application Data","4444","50612"
"2377","1.216780066","127.0.0.1","127.0.0.1","TCP","66","50612  >  4444 [ACK] Seq=336 Ack=2333 Win=706 Len=0 TSval=3000168272 TSecr=3000168272","50612","4444"
"2514","1.222804295","127.0.0.1","127.0.0.1","TLSv1.2","2392","Application Data","4444","51386"
"2515","1.222846200","127.0.0.1","127.0.0.1","TCP","66","51386  >  4444 [ACK] Seq=336 Ack=2327 Win=706 Len=0 TSval=3000168278 TSecr=3000168278","51386","4444"
"2862","1.237097452","127.0.0.1","127.0.0.1","TLSv1.2","2396","Application Data","4444","51424"
"2863","1.237123643","127.0.0.1","127.0.0.1","TCP","66","51424  >  4444 [ACK] Seq=336 Ack=2331 Win=706 Len=0 TSval=3000168293 TSecr=3000168293","51424","4444"
"2950","1.241398139","127.0.0.1","127.0.0.1","TLSv1.2","2394","Application Data","4444","51402"
"2953","1.241423421","127.0.0.1","127.0.0.1","TCP","66","51402  >  4444 [ACK] Seq=336 Ack=2329 Win=706 Len=0 TSval=3000168297 TSecr=3000168297","51402","4444"
"3170","1.254887213","127.0.0.1","127.0.0.1","TLSv1.2","2393","Application Data","4444","51544"
"3171","1.254930934","127.0.0.1","127.0.0.1","TCP","66","51544  >  4444 [ACK] Seq=336 Ack=2328 Win=706 Len=0 TSval=3000168311 TSecr=3000168310","51544","4444"
"3236","1.262476656","127.0.0.1","127.0.0.1","TLSv1.2","2394","Application Data","4444","50688"
"3237","1.262505360","127.0.0.1","127.0.0.1","TCP","66","50688  >  4444 [ACK] Seq=336 Ack=2329 Win=706 Len=0 TSval=3000168318 TSecr=3000168318","50688","4444"
"3247","1.264473697","127.0.0.1","127.0.0.1","TLSv1.2","2392","Application Data","4444","51352"
"3248","1.264501843","127.0.0.1","127.0.0.1","TCP","66","51352  >  4444 [ACK] Seq=336 Ack=2327 Win=706 Len=0 TSval=3000168320 TSecr=3000168320","51352","4444"
"3254","1.265094446","127.0.0.1","127.0.0.1","TLSv1.2","2397","Application Data","4444","50592"
"3255","1.265121545","127.0.0.1","127.0.0.1","TCP","66","50592  >  4444 [ACK] Seq=336 Ack=2332 Win=706 Len=0 TSval=3000168321 TSecr=3000168321","50592","4444"
"3256","1.265181119","127.0.0.1","127.0.0.1","TLSv1.2","2395","Application Data","4444","51482"
"3258","1.265206402","127.0.0.1","127.0.0.1","TCP","66","51482  >  4444 [ACK] Seq=336 Ack=2330 Win=706 Len=0 TSval=3000168321 TSecr=3000168321","51482","4444"
"3261","1.265517964","127.0.0.1","127.0.0.1","TLSv1.2","2390","Application Data","4444","38494"
"3262","1.265536891","127.0.0.1","127.0.0.1","TCP","66","38494  >  4444 [ACK] Seq=336 Ack=2325 Win=706 Len=0 TSval=3000168321 TSecr=3000168321","38494","4444"
"3282","1.267306110","127.0.0.1","127.0.0.1","TLSv1.2","2394","Application Data","4444","51148"
"3283","1.267336212","127.0.0.1","127.0.0.1","TCP","66","51148  >  4444 [ACK] Seq=336 Ack=2329 Win=706 Len=0 TSval=3000168323 TSecr=3000168323","51148","4444"
"3289","1.267778167","127.0.0.1","127.0.0.1","TLSv1.2","2396","Application Data","4444","51090"
"3290","1.267802402","127.0.0.1","127.0.0.1","TCP","66","51090  >  4444 [ACK] Seq=336 Ack=2331 Win=706 Len=0 TSval=3000168323 TSecr=3000168323","51090","4444"
"3295","1.268409113","127.0.0.1","127.0.0.1","TLSv1.2","2397","Application Data","4444","50576"
"3296","1.268439145","127.0.0.1","127.0.0.1","TCP","66","50576  >  4444 [ACK] Seq=336 Ack=2332 Win=706 Len=0 TSval=3000168324 TSecr=3000168324","50576","4444"
"3299","1.268518904","127.0.0.1","127.0.0.1","TLSv1.2","2395","Application Data","4444","50812"
"3300","1.268541183","127.0.0.1","127.0.0.1","TCP","66","50812  >  4444 [ACK] Seq=336 Ack=2330 Win=706 Len=0 TSval=3000168324 TSecr=3000168324","50812","4444"
"3312","1.269589152","127.0.0.1","127.0.0.1","TLSv1.2","2396","Application Data","4444","50934"
"3313","1.269618625","127.0.0.1","127.0.0.1","TCP","66","50934  >  4444 [ACK] Seq=336 Ack=2331 Win=706 Len=0 TSval=3000168325 TSecr=3000168325","50934","4444"
"3333","1.272761831","127.0.0.1","127.0.0.1","TLSv1.2","2396","Application Data","4444","51080"
"3334","1.272786625","127.0.0.1","127.0.0.1","TCP","66","51080  >  4444 [ACK] Seq=336 Ack=2331 Win=706 Len=0 TSval=3000168328 TSecr=3000168328","51080","4444"
"3369","1.276381146","127.0.0.1","127.0.0.1","TLSv1.2","2394","Application Data","4444","51322"
"3370","1.276412156","127.0.0.1","127.0.0.1","TCP","66","51322  >  4444 [ACK] Seq=336 Ack=2329 Win=706 Len=0 TSval=3000168332 TSecr=3000168332","51322","4444"
"3372","1.276467540","127.0.0.1","127.0.0.1","TLSv1.2","2397","Application Data","4444","51140"
"3373","1.276486676","127.0.0.1","127.0.0.1","TCP","66","51140  >  4444 [ACK] Seq=336 Ack=2332 Win=706 Len=0 TSval=3000168332 TSecr=3000168332","51140","4444"
"3390","1.277823089","127.0.0.1","127.0.0.1","TLSv1.2","2393","Application Data","4444","51338"
"3391","1.277858499","127.0.0.1","127.0.0.1","TCP","66","51338  >  4444 [ACK] Seq=336 Ack=2328 Win=706 Len=0 TSval=3000168333 TSecr=3000168333","51338","4444"
"3424","1.282069020","127.0.0.1","127.0.0.1","TLSv1.2","2392","Application Data","4444","51220"
"3425","1.282083966","127.0.0.1","127.0.0.1","TCP","66","51220  >  4444 [ACK] Seq=336 Ack=2327 Win=706 Len=0 TSval=3000168338 TSecr=3000168338","51220","4444"
"3435","1.284566823","127.0.0.1","127.0.0.1","TLSv1.2","2396","Application Data","4444","50808"
"3436","1.284566823","127.0.0.1","127.0.0.1","TLSv1.2","2394","Application Data","4444","50656"
"3437","1.284599230","127.0.0.1","127.0.0.1","TCP","66","50808  >  4444 [ACK] Seq=336 Ack=2331 Win=706 Len=0 TSval=3000168340 TSecr=3000168340","50808","4444"
"3438","1.284599230","127.0.0.1","127.0.0.1","TCP","66","50656  >  4444 [ACK] Seq=336 Ack=2329 Win=706 Len=0 TSval=3000168340 TSecr=3000168340","50656","4444"
"3439","1.284626049","127.0.0.1","127.0.0.1","TLSv1.2","2396","Application Data","4444","50896"
"3440","1.284649376","127.0.0.1","127.0.0.1","TCP","66","50896  >  4444 [ACK] Seq=336 Ack=2331 Win=706 Len=0 TSval=3000168340 TSecr=3000168340","50896","4444"
"3547","1.853924102","127.0.0.1","127.0.0.1","TCP","66","37544  >  4444 [ACK] Seq=1 Ack=1 Win=614 Len=0 TSval=3000168910 TSecr=3000158878","37544","4444"
"3548","1.853938699","127.0.0.1","127.0.0.1","TCP","66","[TCP ACKed unseen segment] 4444  >  37544 [ACK] Seq=1 Ack=2 Win=512 Len=0 TSval=3000168910 TSecr=3000158878","4444","37544"
"3554","1.954024185","127.0.0.1","127.0.0.1","TLSv1.2","2840","Application Data","38034","4444"
"3555","1.954265347","127.0.0.1","127.0.0.1","TLSv1.2","2841","Application Data","37986","4444"
"3565","1.956807010","127.0.0.1","127.0.0.1","TLSv1.2","2840","Application Data","37984","4444"
"3568","1.957663474","127.0.0.1","127.0.0.1","TLSv1.2","2840","Application Data","37714","4444"
"3572","1.957987258","127.0.0.1","127.0.0.1","TLSv1.2","2841","Application Data","38150","4444"
"3573","1.958300077","127.0.0.1","127.0.0.1","TLSv1.2","2840","Application Data","37956","4444"
"3642","1.963713265","127.0.0.1","127.0.0.1","TLSv1.2","2840","Application Data","37988","4444"
"3684","1.967059221","127.0.0.1","127.0.0.1","TLSv1.2","2840","Application Data","37824","4444"
"3723","1.969427399","127.0.0.1","127.0.0.1","TLSv1.2","2840","Application Data","37700","4444"
"3741","1.970348396","127.0.0.1","127.0.0.1","TLSv1.2","2840","Application Data","38434","4444"
"3746","1.971016568","127.0.0.1","127.0.0.1","TLSv1.2","2841","Application Data","38418","4444"
"3762","1.971843558","127.0.0.1","127.0.0.1","TLSv1.2","2841","Application Data","37844","4444"
"3774","1.972725025","127.0.0.1","127.0.0.1","TLSv1.2","2841","Application Data","38290","4444"
"3784","1.973534276","127.0.0.1","127.0.0.1","TLSv1.2","2841","Application Data","38508","4444"
"3823","1.975175686","127.0.0.1","127.0.0.1","TLSv1.2","2840","Application Data","37894","4444"
"3878","1.977729432","127.0.0.1","127.0.0.1","TLSv1.2","2840","Application Data","37912","4444"
"3899","1.978534981","127.0.0.1","127.0.0.1","TLSv1.2","2840","Application Data","37586","4444"
"3922","1.979381527","127.0.0.1","127.0.0.1","TLSv1.2","2840","Application Data","38180","4444"
"3936","1.980094188","127.0.0.1","127.0.0.1","TLSv1.2","2841","Application Data","37808","4444"
"3951","1.980848194","127.0.0.1","127.0.0.1","TLSv1.2","2840","Application Data","37878","4444"
"3965","1.981647528","127.0.0.1","127.0.0.1","TLSv1.2","2841","Application Data","37684","4444"
"3985","1.982533325","127.0.0.1","127.0.0.1","TLSv1.2","2841","Application Data","38098","4444"
"4004","1.983790119","127.0.0.1","127.0.0.1","TLSv1.2","2841","Application Data","38010","4444"
"4024","1.984626328","127.0.0.1","127.0.0.1","TLSv1.2","2840","Application Data","38164","4444"
"4042","1.985389973","127.0.0.1","127.0.0.1","TLSv1.2","2840","Application Data","38372","4444"
"4052","1.986223808","127.0.0.1","127.0.0.1","TLSv1.2","2840","Application Data","38074","4444"
"4095","1.987845802","127.0.0.1","127.0.0.1","TLSv1.2","2841","Application Data","38120","4444"
"4110","1.988748640","127.0.0.1","127.0.0.1","TLSv1.2","2841","Application Data","37830","4444"
"4148","1.989699180","127.0.0.1","127.0.0.1","TLSv1.2","2840","Application Data","38410","4444"
"4298","1.995296399","127.0.0.1","127.0.0.1","TCP","66","4444  >  37986 [ACK] Seq=142 Ack=2981 Win=739 Len=0 TSval=3000169051 TSecr=3000169010","4444","37986"
"4299","1.995309809","127.0.0.1","127.0.0.1","TCP","66","4444  >  38034 [ACK] Seq=142 Ack=2980 Win=739 Len=0 TSval=3000169051 TSecr=3000169010","4444","38034"
"4368","1.996934527","127.0.0.1","127.0.0.1","TCP","66","4444  >  37984 [ACK] Seq=142 Ack=2980 Win=739 Len=0 TSval=3000169053 TSecr=3000169012","4444","37984"
"4406","1.997936050","127.0.0.1","127.0.0.1","TCP","66","4444  >  37714 [ACK] Seq=142 Ack=2980 Win=739 Len=0 TSval=3000169054 TSecr=3000169013","4444","37714"
"4456","1.999940984","127.0.0.1","127.0.0.1","TCP","66","4444  >  37956 [ACK] Seq=142 Ack=2980 Win=739 Len=0 TSval=3000169056 TSecr=3000169014","4444","37956"
"4457","1.999954184","127.0.0.1","127.0.0.1","TCP","66","4444  >  38150 [ACK] Seq=142 Ack=2981 Win=739 Len=0 TSval=3000169056 TSecr=3000169014","4444","38150"
"4577","2.003921937","127.0.0.1","127.0.0.1","TCP","66","4444  >  37988 [ACK] Seq=142 Ack=2980 Win=739 Len=0 TSval=3000169060 TSecr=3000169019","4444","37988"
"4692","2.007420426","127.0.0.1","127.0.0.1","TLSv1.2","2193","Application Data","4444","38194"
"4693","2.007439144","127.0.0.1","127.0.0.1","TCP","66","38194  >  4444 [ACK] Seq=1 Ack=2128 Win=688 Len=0 TSval=3000169063 TSecr=3000169063","38194","4444"
"4695","2.007526934","127.0.0.1","127.0.0.1","TLSv1.2","2194","Application Data","4444","38056"
"4698","2.007543068","127.0.0.1","127.0.0.1","TCP","66","38056  >  4444 [ACK] Seq=1 Ack=2129 Win=688 Len=0 TSval=3000169063 TSecr=3000169063","38056","4444"
"4712","2.007935436","127.0.0.1","127.0.0.1","TCP","66","4444  >  37824 [ACK] Seq=142 Ack=2980 Win=739 Len=0 TSval=3000169064 TSecr=3000169023","4444","37824"
"4724","2.008342820","127.0.0.1","127.0.0.1","TLSv1.2","2193","Application Data","4444","37730"
"4726","2.008362515","127.0.0.1","127.0.0.1","TCP","66","37730  >  4444 [ACK] Seq=1 Ack=2128 Win=688 Len=0 TSval=3000169064 TSecr=3000169064","37730","4444"
"4746","2.008990528","127.0.0.1","127.0.0.1","TLSv1.2","2193","Application Data","4444","37686"
"4748","2.009014414","127.0.0.1","127.0.0.1","TCP","66","37686  >  4444 [ACK] Seq=1 Ack=2128 Win=688 Len=0 TSval=3000169065 TSecr=3000169065","37686","4444"
"4759","2.009346439","127.0.0.1","127.0.0.1","TLSv1.2","2194","Application Data","4444","38208"
"4761","2.009365436","127.0.0.1","127.0.0.1","TCP","66","38208  >  4444 [ACK] Seq=1 Ack=2129 Win=688 Len=0 TSval=3000169065 TSecr=3000169065","38208","4444"
"4774","2.009948052","127.0.0.1","127.0.0.1","TCP","66","4444  >  37700 [ACK] Seq=142 Ack=2980 Win=739 Len=0 TSval=3000169066 TSecr=3000169025","4444","37700"
"4813","2.010933652","127.0.0.1","127.0.0.1","TCP","66","4444  >  38434 [ACK] Seq=142 Ack=2980 Win=739 Len=0 TSval=3000169067 TSecr=3000169026","4444","38434"
"4844","2.011930427","127.0.0.1","127.0.0.1","TCP","66","4444  >  37844 [ACK] Seq=142 Ack=2981 Win=739 Len=0 TSval=3000169068 TSecr=3000169027","4444","37844"
"4846","2.011943906","127.0.0.1","127.0.0.1","TCP","66","4444  >  38418 [ACK] Seq=142 Ack=2981 Win=739 Len=0 TSval=3000169068 TSecr=3000169027","4444","38418"
