"No.","Time","Source","Destination","Protocol","Length","Info","src_port","dst_port"
"96","1.552503600","127.0.0.1","127.0.0.1","TLSv1.2","271","Application Data","41468","4444"
"97","1.552778216","127.0.0.1","127.0.0.1","TLSv1.2","271","Application Data","41808","4444"
"98","1.553391842","127.0.0.1","127.0.0.1","TLSv1.2","271","Application Data","41648","4444"
"101","1.553789029","127.0.0.1","127.0.0.1","TLSv1.2","271","Application Data","41620","4444"
"108","1.554257245","127.0.0.1","127.0.0.1","TLSv1.2","271","Application Data","41662","4444"
"115","1.554753467","127.0.0.1","127.0.0.1","TLSv1.2","271","Application Data","41542","4444"
"118","1.555269874","127.0.0.1","127.0.0.1","TLSv1.2","271","Application Data","41232","4444"
"124","1.555777969","127.0.0.1","127.0.0.1","TLSv1.2","271","Application Data","41582","4444"
"136","1.556316376","127.0.0.1","127.0.0.1","TLSv1.2","271","Application Data","41586","4444"
"144","1.556763360","127.0.0.1","127.0.0.1","TLSv1.2","271","Application Data","41096","4444"
"145","1.556789131","127.0.0.1","127.0.0.1","TCP","66","4444  >  41096 [ACK] Seq=1 Ack=206 Win=511 Len=0 TSval=3000042651 TSecr=3000042651","4444","41096"
"156","1.557441030","127.0.0.1","127.0.0.1","TLSv1.2","271","Application Data","41482","4444"
"160","1.557846109","127.0.0.1","127.0.0.1","TLSv1.2","271","Application Data","41436","4444"
"163","1.558165982","127.0.0.1","127.0.0.1","TLSv1.2","271","Application Data","41676","4444"
"168","1.558399322","127.0.0.1","127.0.0.1","TLSv1.2","271","Application Data","41500","4444"
"174","1.558582446","127.0.0.1","127.0.0.1","TLSv1.2","271","Application Data","41320","4444"
"182","1.559210458","127.0.0.1","127.0.0.1","TLSv1.2","271","Application Data","40906","4444"
"183","1.559246217","127.0.0.1","127.0.0.1","TCP","66","4444  >  40906 [ACK] Seq=1 Ack=206 Win=511 Len=0 TSval=3000042654 TSecr=3000042654","4444","40906"
"192","1.559838262","127.0.0.1","127.0.0.1","TLSv1.2","271","Application Data","41270","4444"
"199","1.560406770","127.0.0.1","127.0.0.1","TLSv1.2","271","Application Data","41388","4444"
"217","1.560880922","127.0.0.1","127.0.0.1","TLSv1.2","271","Application Data","41278","4444"
"223","1.561341665","127.0.0.1","127.0.0.1","TLSv1.2","271","Application Data","41300","4444"
"229","1.561749957","127.0.0.1","127.0.0.1","TLSv1.2","271","Application Data","41000","4444"
"230","1.561775170","127.0.0.1","127.0.0.1","TCP","66","4444  >  41000 [ACK] Seq=1 Ack=206 Win=511 Len=0 TSval=3000042656 TSecr=3000042656","4444","41000"
"232","1.562214541","127.0.0.1","127.0.0.1","TLSv1.2","271","Application Data","40964","4444"
"235","1.562250789","127.0.0.1","127.0.0.1","TCP","66","4444  >  40964 [ACK] Seq=1 Ack=206 Win=511 Len=0 TSval=3000042657 TSecr=3000042657","4444","40964"
"251","1.562846884","127.0.0.1","127.0.0.1","TLSv1.2","271","Application Data","41210","4444"
"261","1.563355049","127.0.0.1","127.0.0.1","TLSv1.2","271","Application Data","41774","4444"
"302","1.564861596","127.0.0.1","127.0.0.1","TLSv1.2","271","Application Data","41738","4444"
"310","1.565354885","127.0.0.1","127.0.0.1","TLSv1.2","271","Application Data","41218","4444"
"319","1.565768554","127.0.0.1","127.0.0.1","TLSv1.2","271","Application Data","41386","4444"
"331","1.566200104","127.0.0.1","127.0.0.1","TLSv1.2","271","Application Data","41246","4444"
"349","1.567177323","127.0.0.1","127.0.0.1","TLSv1.2","271","Application Data","41608","4444"
"362","1.567594206","127.0.0.1","127.0.0.1","TLSv1.2","271","Application Data","41744","4444"
"374","1.567919875","127.0.0.1","127.0.0.1","TLSv1.2","271","Application Data","41550","4444"
"386","1.568408485","127.0.0.1","127.0.0.1","TLSv1.2","207","Application Data","4444","41808"
"387","1.568442568","127.0.0.1","127.0.0.1","TCP","66","41808  >  4444 [ACK] Seq=206 Ack=142 Win=615 Len=0 TSval=3000042663 TSecr=3000042663","41808","4444"
"419","1.569800492","::1","::1","TCP","94","42752  >  4444 [SYN] Seq=0 Win=65476 Len=0 MSS=65476 SACK_PERM TSval=3600113687 TSecr=0 WS=128","42752","4444"
"421","1.569820117","::1","::1","TCP","74","4444  >  42752 [RST, ACK] Seq=1 Ack=1 Win=0 Len=0","4444","42752"
"475","1.571282593","127.0.0.1","127.0.0.1","TLSv1.2","401","Application Data","41802","4444"
"476","1.571304384","127.0.0.1","127.0.0.1","TCP","66","4444  >  41802 [ACK] Seq=1 Ack=336 Win=995 Len=0 TSval=3000042666 TSecr=3000042666","4444","41802"
"485","1.571792993","127.0.0.1","127.0.0.1","TLSv1.2","207","Application Data","4444","41542"
"489","1.571828822","127.0.0.1","127.0.0.1","TCP","66","41542  >  4444 [ACK] Seq=206 Ack=142 Win=615 Len=0 TSval=3000042666 TSecr=3000042666","41542","4444"
"529","1.573385863","::1","::1","TCP","94","42756  >  4444 [SYN] Seq=0 Win=65476 Len=0 MSS=65476 SACK_PERM TSval=3600113691 TSecr=0 WS=128","42756","4444"
"531","1.573405908","::1","::1","TCP","74","4444  >  42756 [RST, ACK] Seq=1 Ack=1 Win=0 Len=0","4444","42756"
"533","1.573457311","127.0.0.1","127.0.0.1","TLSv1.2","207","Application Data","4444","41620"
"534","1.573477565","127.0.0.1","127.0.0.1","TCP","66","41620  >  4444 [ACK] Seq=206 Ack=142 Win=615 Len=0 TSval=3000042668 TSecr=3000042668","41620","4444"
"550","1.574330886","127.0.0.1","127.0.0.1","TLSv1.2","401","Application Data","35642","4444"
"551","1.574346460","127.0.0.1","127.0.0.1","TCP","66","4444  >  35642 [ACK] Seq=1 Ack=336 Win=995 Len=0 TSval=3000042669 TSecr=3000042669","4444","35642"
"563","1.575300003","127.0.0.1","127.0.0.1","TLSv1.2","207","Application Data","4444","41468"
"564","1.575337159","127.0.0.1","127.0.0.1","TCP","66","41468  >  4444 [ACK] Seq=206 Ack=142 Win=615 Len=0 TSval=3000042670 TSecr=3000042670","41468","4444"
"573","1.575624346","127.0.0.1","127.0.0.1","TLSv1.2","207","Application Data","4444","41096"
"574","1.575643064","127.0.0.1","127.0.0.1","TCP","66","41096  >  4444 [ACK] Seq=206 Ack=142 Win=615 Len=0 TSval=3000042670 TSecr=3000042670","41096","4444"
"611","1.576645077","127.0.0.1","127.0.0.1","TLSv1.2","207","Application Data","4444","41320"
"612","1.576683210","127.0.0.1","127.0.0.1","TLSv1.2","207","Application Data","4444","41582"
"613","1.576685096","127.0.0.1","127.0.0.1","TCP","66","41320  >  4444 [ACK] Seq=206 Ack=142 Win=615 Len=0 TSval=3000042671 TSecr=3000042671","41320","4444"
"614","1.576701369","127.0.0.1","127.0.0.1","TCP","66","41582  >  4444 [ACK] Seq=206 Ack=142 Win=615 Len=0 TSval=3000042671 TSecr=3000042671","41582","4444"
"625","1.577165743","127.0.0.1","127.0.0.1","TLSv1.2","207","Application Data","4444","41662"
"627","1.577181178","127.0.0.1","127.0.0.1","TCP","66","41662  >  4444 [ACK] Seq=206 Ack=142 Win=615 Len=0 TSval=3000042672 TSecr=3000042672","41662","4444"
"631","1.577295997","127.0.0.1","127.0.0.1","TLSv1.2","207","Application Data","4444","41586"
"632","1.577317019","127.0.0.1","127.0.0.1","TCP","66","41586  >  4444 [ACK] Seq=206 Ack=142 Win=615 Len=0 TSval=3000042672 TSecr=3000042672","41586","4444"
"658","1.578157070","::1","::1","TCP","94","42764  >  4444 [SYN] Seq=0 Win=65476 Len=0 MSS=65476 SACK_PERM TSval=3600113696 TSecr=0 WS=128","42764","4444"
"659","1.578178931","::1","::1","TCP","74","4444  >  42764 [RST, ACK] Seq=1 Ack=1 Win=0 Len=0","4444","42764"
"676","1.578643096","127.0.0.1","127.0.0.1","TLSv1.2","207","Application Data","4444","41648"
"677","1.578672639","127.0.0.1","127.0.0.1","TCP","66","41648  >  4444 [ACK] Seq=206 Ack=142 Win=615 Len=0 TSval=3000042673 TSecr=3000042673","41648","4444"
"682","1.578805337","127.0.0.1","127.0.0.1","TLSv1.2","207","Application Data","4444","41270"
"683","1.578826220","127.0.0.1","127.0.0.1","TCP","66","41270  >  4444 [ACK] Seq=206 Ack=142 Win=615 Len=0 TSval=3000042673 TSecr=3000042673","41270","4444"
"689","1.579124931","::1","::1","TCP","94","42780  >  4444 [SYN] Seq=0 Win=65476 Len=0 MSS=65476 SACK_PERM TSval=3600113697 TSecr=0 WS=128","42780","4444"
"690","1.579144417","::1","::1","TCP","74","4444  >  42780 [RST, ACK] Seq=1 Ack=1 Win=0 Len=0","4444","42780"
"696","1.579376569","127.0.0.1","127.0.0.1","TLSv1.2","207","Application Data","4444","41436"
"698","1.579399826","127.0.0.1","127.0.0.1","TCP","66","41436  >  4444 [ACK] Seq=206 Ack=142 Win=615 Len=0 TSval=3000042674 TSecr=3000042674","41436","4444"
"702","1.579547890","127.0.0.1","127.0.0.1","TLSv1.2","207","Application Data","4444","41232"
"703","1.579554036","127.0.0.1","127.0.0.1","TLSv1.2","207","Application Data","4444","41676"
"704","1.579565420","127.0.0.1","127.0.0.1","TCP","66","41232  >  4444 [ACK] Seq=206 Ack=142 Win=615 Len=0 TSval=3000042674 TSecr=3000042674","41232","4444"
"705","1.579574569","127.0.0.1","127.0.0.1","TCP","66","41676  >  4444 [ACK] Seq=206 Ack=142 Win=615 Len=0 TSval=3000042674 TSecr=3000042674","41676","4444"
"728","1.580602982","::1","::1","TCP","94","42786  >  4444 [SYN] Seq=0 Win=65476 Len=0 MSS=65476 SACK_PERM TSval=3600113698 TSecr=0 WS=128","42786","4444"
"730","1.580624353","::1","::1","TCP","74","4444  >  42786 [RST, ACK] Seq=1 Ack=1 Win=0 Len=0","4444","42786"
"734","1.580697826","127.0.0.1","127.0.0.1","TLSv1.2","207","Application Data","4444","40906"
"737","1.580734004","127.0.0.1","127.0.0.1","TCP","66","40906  >  4444 [ACK] Seq=206 Ack=142 Win=615 Len=0 TSval=3000042675 TSecr=3000042675","40906","4444"
"740","1.580836950","127.0.0.1","127.0.0.1","TLSv1.2","207","Application Data","4444","41500"
"741","1.580853153","127.0.0.1","127.0.0.1","TCP","66","41500  >  4444 [ACK] Seq=206 Ack=142 Win=615 Len=0 TSval=3000042675 TSecr=3000042675","41500","4444"
"757","1.581877445","::1","::1","TCP","94","42802  >  4444 [SYN] Seq=0 Win=65476 Len=0 MSS=65476 SACK_PERM TSval=3600113699 TSecr=0 WS=128","42802","4444"
"758","1.581898607","::1","::1","TCP","74","4444  >  42802 [RST, ACK] Seq=1 Ack=1 Win=0 Len=0","4444","42802"
"795","1.583257858","::1","::1","TCP","94","42816  >  4444 [SYN] Seq=0 Win=65476 Len=0 MSS=65476 SACK_PERM TSval=3600113701 TSecr=0 WS=128","42816","4444"
"796","1.583262677","127.0.0.1","127.0.0.1","TLSv1.2","207","Application Data","4444","41608"
"798","1.583275877","::1","::1","TCP","74","4444  >  42816 [RST, ACK] Seq=1 Ack=1 Win=0 Len=0","4444","42816"
"799","1.583302138","127.0.0.1","127.0.0.1","TCP","66","41608  >  4444 [ACK] Seq=206 Ack=142 Win=615 Len=0 TSval=3000042678 TSecr=3000042678","41608","4444"
"801","1.583317503","127.0.0.1","127.0.0.1","TLSv1.2","207","Application Data","4444","41000"
"802","1.583317503","127.0.0.1","127.0.0.1","TLSv1.2","207","Application Data","4444","41388"
"803","1.583336430","127.0.0.1","127.0.0.1","TCP","66","41000  >  4444 [ACK] Seq=206 Ack=142 Win=615 Len=0 TSval=3000042678 TSecr=3000042678","41000","4444"
"804","1.583336430","127.0.0.1","127.0.0.1","TCP","66","41388  >  4444 [ACK] Seq=206 Ack=142 Win=615 Len=0 TSval=3000042678 TSecr=3000042678","41388","4444"
"814","1.583986093","127.0.0.1","127.0.0.1","TLSv1.2","207","Application Data","4444","41210"
"815","1.583986093","127.0.0.1","127.0.0.1","TLSv1.2","207","Application Data","4444","41482"
"818","1.584003973","127.0.0.1","127.0.0.1","TCP","66","41210  >  4444 [ACK] Seq=206 Ack=142 Win=615 Len=0 TSval=3000042678 TSecr=3000042678","41210","4444"
"819","1.584007744","127.0.0.1","127.0.0.1","TCP","66","41482  >  4444 [ACK] Seq=206 Ack=142 Win=615 Len=0 TSval=3000042678 TSecr=3000042678","41482","4444"
"833","1.584568849","::1","::1","TCP","94","42820  >  4444 [SYN] Seq=0 Win=65476 Len=0 MSS=65476 SACK_PERM TSval=3600113702 TSecr=0 WS=128","42820","4444"
"835","1.584582608","::1","::1","TCP","74","4444  >  42820 [RST, ACK] Seq=1 Ack=1 Win=0 Len=0","4444","42820"
"849","1.584903179","127.0.0.1","127.0.0.1","TLSv1.2","207","Application Data","4444","41300"
"850","1.584922805","127.0.0.1","127.0.0.1","TCP","66","41300  >  4444 [ACK] Seq=206 Ack=142 Win=615 Len=0 TSval=3000042679 TSecr=3000042679","41300","4444"
"859","1.585425103","::1","::1","TCP","94","42824  >  4444 [SYN] Seq=0 Win=65476 Len=0 MSS=65476 SACK_PERM TSval=3600113703 TSecr=0 WS=128","42824","4444"
"861","1.585441376","::1","::1","TCP","74","4444  >  42824 [RST, ACK] Seq=1 Ack=1 Win=0 Len=0","4444","42824"
"867","1.585802665","127.0.0.1","127.0.0.1","TLSv1.2","207","Application Data","4444","40964"
"868","1.585828786","127.0.0.1","127.0.0.1","TCP","66","40964  >  4444 [ACK] Seq=206 Ack=142 Win=615 Len=0 TSval=3000042680 TSecr=3000042680","40964","4444"
"869","1.585841148","127.0.0.1","127.0.0.1","TLSv1.2","207","Application Data","4444","41774"
"870","1.585867128","127.0.0.1","127.0.0.1","TCP","66","41774  >  4444 [ACK] Seq=206 Ack=142 Win=615 Len=0 TSval=3000042680 TSecr=3000042680","41774","4444"
"871","1.585930055","127.0.0.1","127.0.0.1","TLSv1.2","207","Application Data","4444","41218"
"872","1.585949192","127.0.0.1","127.0.0.1","TCP","66","41218  >  4444 [ACK] Seq=206 Ack=142 Win=615 Len=0 TSval=3000042680 TSecr=3000042680","41218","4444"
"881","1.586375503","::1","::1","TCP","94","42834  >  4444 [SYN] Seq=0 Win=65476 Len=0 MSS=65476 SACK_PERM TSval=3600113704 TSecr=0 WS=128","42834","4444"
"882","1.586388843","::1","::1","TCP","74","4444  >  42834 [RST, ACK] Seq=1 Ack=1 Win=0 Len=0","4444","42834"
"895","1.586980887","127.0.0.1","127.0.0.1","TLSv1.2","207","Application Data","4444","41744"
"896","1.586980887","127.0.0.1","127.0.0.1","TLSv1.2","207","Application Data","4444","41278"
"897","1.587001421","127.0.0.1","127.0.0.1","TCP","66","41278  >  4444 [ACK] Seq=206 Ack=142 Win=615 Len=0 TSval=3000042681 TSecr=3000042681","41278","4444"
"898","1.587001421","127.0.0.1","127.0.0.1","TCP","66","41744  >  4444 [ACK] Seq=206 Ack=142 Win=615 Len=0 TSval=3000042681 TSecr=3000042681","41744","4444"
"900","1.587108138","::1","::1","TCP","94","42846  >  4444 [SYN] Seq=0 Win=65476 Len=0 MSS=65476 SACK_PERM TSval=3600113705 TSecr=0 WS=128","42846","4444"
"901","1.587127833","::1","::1","TCP","74","4444  >  42846 [RST, ACK] Seq=1 Ack=1 Win=0 Len=0","4444","42846"
"907","1.587502741","127.0.0.1","127.0.0.1","TLSv1.2","207","Application Data","4444","41738"
"908","1.587507560","127.0.0.1","127.0.0.1","TLSv1.2","207","Application Data","4444","41246"
"909","1.587527046","127.0.0.1","127.0.0.1","TCP","66","41738  >  4444 [ACK] Seq=206 Ack=142 Win=615 Len=0 TSval=3000042682 TSecr=3000042682","41738","4444"
"910","1.587533751","127.0.0.1","127.0.0.1","TCP","66","41246  >  4444 [ACK] Seq=206 Ack=142 Win=615 Len=0 TSval=3000042682 TSecr=3000042682","41246","4444"
"918","1.588090316","::1","::1","TCP","94","42856  >  4444 [SYN] Seq=0 Win=65476 Len=0 MSS=65476 SACK_PERM TSval=3600113706 TSecr=0 WS=128","42856","4444"
"920","1.588104494","::1","::1","TCP","74","4444  >  42856 [RST, ACK] Seq=1 Ack=1 Win=0 Len=0","4444","42856"
"921","1.588114621","127.0.0.1","127.0.0.1","TLSv1.2","207","Application Data","4444","41386"
"922","1.588130824","127.0.0.1","127.0.0.1","TCP","66","41386  >  4444 [ACK] Seq=206 Ack=142 Win=615 Len=0 TSval=3000042683 TSecr=3000042683","41386","4444"
"932","1.588838037","::1","::1","TCP","94","42864  >  4444 [SYN] Seq=0 Win=65476 Len=0 MSS=65476 SACK_PERM TSval=3600113706 TSecr=0 WS=128","42864","4444"
"933","1.588852005","::1","::1","TCP","74","4444  >  42864 [RST, ACK] Seq=1 Ack=1 Win=0 Len=0","4444","42864"
"938","1.589020532","127.0.0.1","127.0.0.1","TLSv1.2","207","Application Data","4444","41550"
"940","1.589038900","127.0.0.1","127.0.0.1","TCP","66","41550  >  4444 [ACK] Seq=206 Ack=142 Win=615 Len=0 TSval=3000042683 TSecr=3000042683","41550","4444"
"945","1.589609015","::1","::1","TCP","94","42872  >  4444 [SYN] Seq=0 Win=65476 Len=0 MSS=65476 SACK_PERM TSval=3600113707 TSecr=0 WS=128","42872","4444"
"946","1.589623891","::1","::1","TCP","74","4444  >  42872 [RST, ACK] Seq=1 Ack=1 Win=0 Len=0","4444","42872"
"948","1.590081212","::1","::1","TCP","94","42878  >  4444 [SYN] Seq=0 Win=65476 Len=0 MSS=65476 SACK_PERM TSval=3600113708 TSecr=0 WS=128","42878","4444"
"949","1.590091618","::1","::1","TCP","74","4444  >  42878 [RST, ACK] Seq=1 Ack=1 Win=0 Len=0","4444","42878"
"954","1.590493275","::1","::1","TCP","94","42886  >  4444 [SYN] Seq=0 Win=65476 Len=0 MSS=65476 SACK_PERM TSval=3600113708 TSecr=0 WS=128","42886","4444"
"955","1.590505148","::1","::1","TCP","74","4444  >  42886 [RST, ACK] Seq=1 Ack=1 Win=0 Len=0","4444","42886"
"962","1.591030774","::1","::1","TCP","94","42900  >  4444 [SYN] Seq=0 Win=65476 Len=0 MSS=65476 SACK_PERM TSval=3600113708 TSecr=0 WS=128","42900","4444"
"963","1.591069815","::1","::1","TCP","74","4444  >  42900 [RST, ACK] Seq=1 Ack=1 Win=0 Len=0","4444","42900"
"964","1.591471053","127.0.0.1","127.0.0.1","TLSv1.2","401","Application Data","36078","4444"
"965","1.591494869","127.0.0.1","127.0.0.1","TCP","66","4444  >  36078 [ACK] Seq=1 Ack=336 Win=907 Len=0 TSval=3000042686 TSecr=3000042686","4444","36078"
"968","1.592067637","::1","::1","TCP","94","42910  >  4444 [SYN] Seq=0 Win=65476 Len=0 MSS=65476 SACK_PERM TSval=3600113709 TSecr=0 WS=128","42910","4444"
"969","1.592081955","::1","::1","TCP","74","4444  >  42910 [RST, ACK] Seq=1 Ack=1 Win=0 Len=0","4444","42910"
"972","1.592651510","::1","::1","TCP","94","42918  >  4444 [SYN] Seq=0 Win=65476 Len=0 MSS=65476 SACK_PERM TSval=3600113710 TSecr=0 WS=128","42918","4444"
"973","1.592666875","::1","::1","TCP","74","4444  >  42918 [RST, ACK] Seq=1 Ack=1 Win=0 Len=0","4444","42918"
"983","1.593365568","::1","::1","TCP","94","42932  >  4444 [SYN] Seq=0 Win=65476 Len=0 MSS=65476 SACK_PERM TSval=3600113711 TSecr=0 WS=128","42932","4444"
"984","1.593384495","::1","::1","TCP","74","4444  >  42932 [RST, ACK] Seq=1 Ack=1 Win=0 Len=0","4444","42932"
"990","1.593991834","::1","::1","TCP","94","42944  >  4444 [SYN] Seq=0 Win=65476 Len=0 MSS=65476 SACK_PERM TSval=3600113711 TSecr=0 WS=128","42944","4444"
"992","1.594003428","::1","::1","TCP","74","4444  >  42944 [RST, ACK] Seq=1 Ack=1 Win=0 Len=0","4444","42944"
"998","1.594580177","::1","::1","TCP","94","42954  >  4444 [SYN] Seq=0 Win=65476 Len=0 MSS=65476 SACK_PERM TSval=3600113712 TSecr=0 WS=128","42954","4444"
"1000","1.594597568","::1","::1","TCP","74","4444  >  42954 [RST, ACK] Seq=1 Ack=1 Win=0 Len=0","4444","42954"
"1008","1.594997898","127.0.0.1","127.0.0.1","TLSv1.2","401","Application Data","35486","4444"
"1009","1.595020177","127.0.0.1","127.0.0.1","TCP","66","4444  >  35486 [ACK] Seq=1 Ack=336 Win=995 Len=0 TSval=3000042689 TSecr=3000042689","4444","35486"
"1016","1.595799606","::1","::1","TCP","94","42968  >  4444 [SYN] Seq=0 Win=65476 Len=0 MSS=65476 SACK_PERM TSval=3600113713 TSecr=0 WS=128","42968","4444"
"1019","1.595815669","::1","::1","TCP","74","4444  >  42968 [RST, ACK] Seq=1 Ack=1 Win=0 Len=0","4444","42968"
"1033","1.596651739","::1","::1","TCP","94","42970  >  4444 [SYN] Seq=0 Win=65476 Len=0 MSS=65476 SACK_PERM TSval=3600113714 TSecr=0 WS=128","42970","4444"
"1034","1.596669409","::1","::1","TCP","74","4444  >  42970 [RST, ACK] Seq=1 Ack=1 Win=0 Len=0","4444","42970"
"1047","1.597569035","::1","::1","TCP","94","42984  >  4444 [SYN] Seq=0 Win=65476 Len=0 MSS=65476 SACK_PERM TSval=3600113715 TSecr=0 WS=128","42984","4444"
"1050","1.597580838","::1","::1","TCP","74","4444  >  42984 [RST, ACK] Seq=1 Ack=1 Win=0 Len=0","4444","42984"
"1063","1.598408317","::1","::1","TCP","94","43000  >  4444 [SYN] Seq=0 Win=65476 Len=0 MSS=65476 SACK_PERM TSval=3600113716 TSecr=0 WS=128","43000","4444"
"1064","1.598425149","::1","::1","TCP","74","4444  >  43000 [RST, ACK] Seq=1 Ack=1 Win=0 Len=0","4444","43000"
"1072","1.598956990","::1","::1","TCP","94","43010  >  4444 [SYN] Seq=0 Win=65476 Len=0 MSS=65476 SACK_PERM TSval=3600113716 TSecr=0 WS=128","43010","4444"
"1073","1.598969981","::1","::1","TCP","74","4444  >  43010 [RST, ACK] Seq=1 Ack=1 Win=0 Len=0","4444","43010"
"1082","1.599499657","127.0.0.1","127.0.0.1","TLSv1.2","401","Application Data","35432","4444"
"1083","1.599521098","127.0.0.1","127.0.0.1","TCP","66","4444  >  35432 [ACK] Seq=1 Ack=336 Win=995 Len=0 TSval=3000042694 TSecr=3000042694","4444","35432"
"1099","1.600499435","::1","::1","TCP","94","43016  >  4444 [SYN] Seq=0 Win=65476 Len=0 MSS=65476 SACK_PERM TSval=3600113718 TSecr=0 WS=128","43016","4444"
"1100","1.600516616","::1","::1","TCP","74","4444  >  43016 [RST, ACK] Seq=1 Ack=1 Win=0 Len=0","4444","43016"
"1116","1.601405765","::1","::1","TCP","94","43026  >  4444 [SYN] Seq=0 Win=65476 Len=0 MSS=65476 SACK_PERM TSval=3600113719 TSecr=0 WS=128","43026","4444"
"1118","1.601424972","::1","::1","TCP","74","4444  >  43026 [RST, ACK] Seq=1 Ack=1 Win=0 Len=0","4444","43026"
"1129","1.602278223","::1","::1","TCP","94","43040  >  4444 [SYN] Seq=0 Win=65476 Len=0 MSS=65476 SACK_PERM TSval=3600113720 TSecr=0 WS=128","43040","4444"
"1130","1.602293518","::1","::1","TCP","74","4444  >  43040 [RST, ACK] Seq=1 Ack=1 Win=0 Len=0","4444","43040"
"1138","1.602625683","127.0.0.1","127.0.0.1","TLSv1.2","401","Application Data","36062","4444"
"1139","1.602643423","127.0.0.1","127.0.0.1","TCP","66","4444  >  36062 [ACK] Seq=1 Ack=336 Win=907 Len=0 TSval=3000042697 TSecr=3000042697","4444","36062"
"1146","1.603260261","::1","::1","TCP","94","43056  >  4444 [SYN] Seq=0 Win=65476 Len=0 MSS=65476 SACK_PERM TSval=3600113721 TSecr=0 WS=128","43056","4444"
"1147","1.603280515","::1","::1","TCP","74","4444  >  43056 [RST, ACK] Seq=1 Ack=1 Win=0 Len=0","4444","43056"
"1151","1.603792661","127.0.0.1","127.0.0.1","TLSv1.2","401","Application Data","35338","4444"
"1153","1.603815848","127.0.0.1","127.0.0.1","TCP","66","4444  >  35338 [ACK] Seq=1 Ack=336 Win=907 Len=0 TSval=3000042698 TSecr=3000042698","4444","35338"
"1160","1.604354953","127.0.0.1","127.0.0.1","TLSv1.2","401","Application Data","35808","4444"
"1161","1.604373042","127.0.0.1","127.0.0.1","TCP","66","4444  >  35808 [ACK] Seq=1 Ack=336 Win=995 Len=0 TSval=3000042699 TSecr=3000042699","4444","35808"
"1166","1.604819328","127.0.0.1","127.0.0.1","TLSv1.2","401","Application Data","36012","4444"
"1168","1.604844890","127.0.0.1","127.0.0.1","TCP","66","4444  >  36012 [ACK] Seq=1 Ack=336 Win=907 Len=0 TSval=3000042699 TSecr=3000042699","4444","36012"
"1176","1.605523537","127.0.0.1","127.0.0.1","TLSv1.2","401","Application Data","35742","4444"
"1177","1.605552521","127.0.0.1","127.0.0.1","TCP","66","4444  >  35742 [ACK] Seq=1 Ack=336 Win=995 Len=0 TSval=3000042700 TSecr=3000042700","4444","35742"
"1190","1.606136744","127.0.0.1","127.0.0.1","TLSv1.2","401","Application Data","35618","4444"
"1193","1.606159163","127.0.0.1","127.0.0.1","TCP","66","4444  >  35618 [ACK] Seq=1 Ack=336 Win=995 Len=0 TSval=3000042701 TSecr=3000042701","4444","35618"
"1201","1.606793391","127.0.0.1","127.0.0.1","TLSv1.2","401","Application Data","35540","4444"
"1202","1.606826287","127.0.0.1","127.0.0.1","TCP","66","4444  >  35540 [ACK] Seq=1 Ack=336 Win=995 Len=0 TSval=3000042701 TSecr=3000042701","4444","35540"
"1210","1.607498369","127.0.0.1","127.0.0.1","TLSv1.2","401","Application Data","35588","4444"
"1211","1.607523861","127.0.0.1","127.0.0.1","TCP","66","4444  >  35588 [ACK] Seq=1 Ack=336 Win=995 Len=0 TSval=3000042702 TSecr=3000042702","4444","35588"
"1221","1.608032306","127.0.0.1","127.0.0.1","TLSv1.2","401","Application Data","35522","4444"
"1223","1.608076027","127.0.0.1","127.0.0.1","TCP","66","4444  >  35522 [ACK] Seq=1 Ack=336 Win=995 Len=0 TSval=3000042702 TSecr=3000042702","4444","35522"
"1230","1.608624700","127.0.0.1","127.0.0.1","TLSv1.2","401","Application Data","35790","4444"
"1232","1.608649912","127.0.0.1","127.0.0.1","TCP","66","4444  >  35790 [ACK] Seq=1 Ack=336 Win=995 Len=0 TSval=3000042703 TSecr=3000042703","4444","35790"
"1240","1.609418725","127.0.0.1","127.0.0.1","TLSv1.2","401","Application Data","36100","4444"
"1243","1.609445893","127.0.0.1","127.0.0.1","TCP","66","4444  >  36100 [ACK] Seq=1 Ack=336 Win=907 Len=0 TSval=3000042704 TSecr=3000042704","4444","36100"
"1252","1.610200528","127.0.0.1","127.0.0.1","TLSv1.2","401","Application Data","35560","4444"
"1253","1.610231538","127.0.0.1","127.0.0.1","TCP","66","4444  >  35560 [ACK] Seq=1 Ack=336 Win=995 Len=0 TSval=3000042705 TSecr=3000042705","4444","35560"
"1274","1.611173767","127.0.0.1","127.0.0.1","TLSv1.2","401","Application Data","35524","4444"
"1275","1.611193741","127.0.0.1","127.0.0.1","TCP","66","4444  >  35524 [ACK] Seq=1 Ack=336 Win=995 Len=0 TSval=3000042706 TSecr=3000042706","4444","35524"
"1285","1.611858560","127.0.0.1","127.0.0.1","TLSv1.2","401","Application Data","35988","4444"
"1287","1.611905214","127.0.0.1","127.0.0.1","TCP","66","4444  >  35988 [ACK] Seq=1 Ack=336 Win=907 Len=0 TSval=3000042706 TSecr=3000042706","4444","35988"
"1310","1.612969316","127.0.0.1","127.0.0.1","TLSv1.2","401","Application Data","35710","4444"
"1311","1.612992643","127.0.0.1","127.0.0.1","TCP","66","4444  >  35710 [ACK] Seq=1 Ack=336 Win=995 Len=0 TSval=3000042707 TSecr=3000042707","4444","35710"
"1320","1.613627081","127.0.0.1","127.0.0.1","TLSv1.2","401","Application Data","35664","4444"
"1323","1.613647056","127.0.0.1","127.0.0.1","TCP","66","4444  >  35664 [ACK] Seq=1 Ack=336 Win=995 Len=0 TSval=3000042708 TSecr=3000042708","4444","35664"
"1371","1.616354663","127.0.0.1","127.0.0.1","TLSv1.2","401","Application Data","35762","4444"
"1372","1.616378548","127.0.0.1","127.0.0.1","TCP","66","4444  >  35762 [ACK] Seq=1 Ack=336 Win=995 Len=0 TSval=3000042711 TSecr=3000042711","4444","35762"
"1383","1.616914790","127.0.0.1","127.0.0.1","TLSv1.2","401","Application Data","35950","4444"
"1384","1.616939024","127.0.0.1","127.0.0.1","TCP","66","4444  >  35950 [ACK] Seq=1 Ack=336 Win=907 Len=0 TSval=3000042711 TSecr=3000042711","4444","35950"
"1496","1.622983997","127.0.0.1","127.0.0.1","TLSv1.2","401","Application Data","35574","4444"
"1497","1.623003203","127.0.0.1","127.0.0.1","TCP","66","4444  >  35574 [ACK] Seq=1 Ack=336 Win=995 Len=0 TSval=3000042717 TSecr=3000042717","4444","35574"
"1507","1.623617038","127.0.0.1","127.0.0.1","TLSv1.2","401","Application Data","35676","4444"
"1508","1.623638409","127.0.0.1","127.0.0.1","TCP","66","4444  >  35676 [ACK] Seq=1 Ack=336 Win=995 Len=0 TSval=3000042718 TSecr=3000042718","4444","35676"
"1525","1.624333400","127.0.0.1","127.0.0.1","TLSv1.2","401","Application Data","36116","4444"
"1526","1.624351978","127.0.0.1","127.0.0.1","TCP","66","4444  >  36116 [ACK] Seq=1 Ack=336 Win=995 Len=0 TSval=3000042719 TSecr=3000042719","4444","36116"
"1535","1.624897019","127.0.0.1","127.0.0.1","TLSv1.2","401","Application Data","35916","4444"
"1536","1.624920067","127.0.0.1","127.0.0.1","TCP","66","4444  >  35916 [ACK] Seq=1 Ack=336 Win=907 Len=0 TSval=3000042719 TSecr=3000042719","4444","35916"
"1553","1.625633216","127.0.0.1","127.0.0.1","TLSv1.2","401","Application Data","35380","4444"
"1554","1.625654797","127.0.0.1","127.0.0.1","TCP","66","4444  >  35380 [ACK] Seq=1 Ack=336 Win=995 Len=0 TSval=3000042720 TSecr=3000042720","4444","35380"
"1567","1.626280854","127.0.0.1","127.0.0.1","TLSv1.2","401","Application Data","35422","4444"
"1568","1.626299572","127.0.0.1","127.0.0.1","TCP","66","4444  >  35422 [ACK] Seq=1 Ack=336 Win=907 Len=0 TSval=3000042721 TSecr=3000042721","4444","35422"
"1579","1.626907540","127.0.0.1","127.0.0.1","TLSv1.2","401","Application Data","36166","4444"
"1580","1.626927515","127.0.0.1","127.0.0.1","TCP","66","4444  >  36166 [ACK] Seq=1 Ack=336 Win=907 Len=0 TSval=3000042721 TSecr=3000042721","4444","36166"
"1584","1.627364092","127.0.0.1","127.0.0.1","TLSv1.2","2396","Application Data","4444","41802"
"1586","1.627383718","127.0.0.1","127.0.0.1","TCP","66","41802  >  4444 [ACK] Seq=336 Ack=2331 Win=706 Len=0 TSval=3000042722 TSecr=3000042722","41802","4444"
"1592","1.627544492","127.0.0.1","127.0.0.1","TLSv1.2","401","Application Data","35934","4444"
"1593","1.627561883","127.0.0.1","127.0.0.1","TCP","66","4444  >  35934 [ACK] Seq=1 Ack=336 Win=907 Len=0 TSval=3000042722 TSecr=3000042722","4444","35934"
"1919","1.642491574","127.0.0.1","127.0.0.1","TLSv1.2","2393","Application Data","4444","35642"
"1922","1.642520767","127.0.0.1","127.0.0.1","TCP","66","35642  >  4444 [ACK] Seq=336 Ack=2328 Win=706 Len=0 TSval=3000042737 TSecr=3000042737","35642","4444"
"2301","1.657415188","127.0.0.1","127.0.0.1","TLSv1.2","2394","Application Data","4444","36078"
"2303","1.657447106","127.0.0.1","127.0.0.1","TCP","66","36078  >  4444 [ACK] Seq=336 Ack=2329 Win=706 Len=0 TSval=3000042752 TSecr=3000042752","36078","4444"
"2768","1.675354968","127.0.0.1","127.0.0.1","TLSv1.2","2396","Application Data","4444","35486"
"2771","1.675395756","127.0.0.1","127.0.0.1","TCP","66","35486  >  4444 [ACK] Seq=336 Ack=2331 Win=706 Len=0 TSval=3000042770 TSecr=3000042770","35486","4444"
"3098","1.690620107","127.0.0.1","127.0.0.1","TLSv1.2","2394","Application Data","4444","35432"
"3099","1.690651116","127.0.0.1","127.0.0.1","TCP","66","35432  >  4444 [ACK] Seq=336 Ack=2329 Win=706 Len=0 TSval=3000042785 TSecr=3000042785","35432","4444"
"3379","1.707568839","127.0.0.1","127.0.0.1","TLSv1.2","2396","Application Data","4444","36062"
"3381","1.707607252","127.0.0.1","127.0.0.1","TCP","66","36062  >  4444 [ACK] Seq=336 Ack=2331 Win=706 Len=0 TSval=3000042802 TSecr=3000042802","36062","4444"
"3409","1.710114693","127.0.0.1","127.0.0.1","TLSv1.2","2394","Application Data","4444","35742"
"3410","1.710151360","127.0.0.1","127.0.0.1","TCP","66","35742  >  4444 [ACK] Seq=336 Ack=2329 Win=706 Len=0 TSval=3000042805 TSecr=3000042805","35742","4444"
"3437","1.713271310","127.0.0.1","127.0.0.1","TLSv1.2","2395","Application Data","4444","36100"
"3438","1.713307487","127.0.0.1","127.0.0.1","TCP","66","36100  >  4444 [ACK] Seq=336 Ack=2330 Win=706 Len=0 TSval=3000042808 TSecr=3000042808","36100","4444"
"3439","1.713373767","127.0.0.1","127.0.0.1","TLSv1.2","2392","Application Data","4444","35540"
"3440","1.713394580","127.0.0.1","127.0.0.1","TCP","66","35540  >  4444 [ACK] Seq=336 Ack=2327 Win=706 Len=0 TSval=3000042808 TSecr=3000042808","35540","4444"
"3443","1.713504300","127.0.0.1","127.0.0.1","TLSv1.2","2395","Application Data","4444","35338"
"3445","1.713530561","127.0.0.1","127.0.0.1","TCP","66","35338  >  4444 [ACK] Seq=336 Ack=2330 Win=706 Len=0 TSval=3000042808 TSecr=3000042808","35338","4444"
"3456","1.714365373","127.0.0.1","127.0.0.1","TLSv1.2","2397","Application Data","4444","35522"
"3457","1.714396872","127.0.0.1","127.0.0.1","TCP","66","35522  >  4444 [ACK] Seq=336 Ack=2332 Win=706 Len=0 TSval=3000042809 TSecr=3000042809","35522","4444"
"3459","1.714558415","127.0.0.1","127.0.0.1","TLSv1.2","2398","Application Data","4444","35790"
"3460","1.714579926","127.0.0.1","127.0.0.1","TCP","66","35790  >  4444 [ACK] Seq=336 Ack=2333 Win=706 Len=0 TSval=3000042809 TSecr=3000042809","35790","4444"
"3463","1.714679589","127.0.0.1","127.0.0.1","TLSv1.2","2394","Application Data","4444","35808"
"3464","1.714698865","127.0.0.1","127.0.0.1","TCP","66","35808  >  4444 [ACK] Seq=336 Ack=2329 Win=706 Len=0 TSval=3000042809 TSecr=3000042809","35808","4444"
"3473","1.715963132","127.0.0.1","127.0.0.1","TLSv1.2","2394","Application Data","4444","35664"
"3474","1.716025920","127.0.0.1","127.0.0.1","TCP","66","35664  >  4444 [ACK] Seq=336 Ack=2329 Win=706 Len=0 TSval=3000042810 TSecr=3000042810","35664","4444"
"3481","1.716937977","127.0.0.1","127.0.0.1","TLSv1.2","2393","Application Data","4444","35618"
"3482","1.716976669","127.0.0.1","127.0.0.1","TCP","66","35618  >  4444 [ACK] Seq=336 Ack=2328 Win=706 Len=0 TSval=3000042811 TSecr=3000042811","35618","4444"
"3483","1.717718802","127.0.0.1","127.0.0.1","TLSv1.2","2395","Application Data","4444","35560"
"3484","1.717760707","127.0.0.1","127.0.0.1","TCP","66","35560  >  4444 [ACK] Seq=336 Ack=2330 Win=706 Len=0 TSval=3000042812 TSecr=3000042812","35560","4444"
"3498","1.720002542","127.0.0.1","127.0.0.1","TLSv1.2","2389","Application Data","4444","35710"
"3499","1.720004009","127.0.0.1","127.0.0.1","TLSv1.2","2392","Application Data","4444","36012"
"3500","1.720040676","127.0.0.1","127.0.0.1","TCP","66","35710  >  4444 [ACK] Seq=336 Ack=2324 Win=706 Len=0 TSval=3000042814 TSecr=3000042814","35710","4444"
"3501","1.720040676","127.0.0.1","127.0.0.1","TCP","66","36012  >  4444 [ACK] Seq=336 Ack=2327 Win=706 Len=0 TSval=3000042814 TSecr=3000042814","36012","4444"
"3520","1.721871216","127.0.0.1","127.0.0.1","TLSv1.2","2397","Application Data","4444","35588"
"3521","1.721909489","127.0.0.1","127.0.0.1","TCP","66","35588  >  4444 [ACK] Seq=336 Ack=2332 Win=706 Len=0 TSval=3000042816 TSecr=3000042816","35588","4444"
"3522","1.721965641","127.0.0.1","127.0.0.1","TLSv1.2","2394","Application Data","4444","35574"
"3524","1.721989038","127.0.0.1","127.0.0.1","TCP","66","35574  >  4444 [ACK] Seq=336 Ack=2329 Win=706 Len=0 TSval=3000042816 TSecr=3000042816","35574","4444"
"3533","1.722752822","127.0.0.1","127.0.0.1","TLSv1.2","2394","Application Data","4444","35988"
"3534","1.722779990","127.0.0.1","127.0.0.1","TCP","66","35988  >  4444 [ACK] Seq=336 Ack=2329 Win=706 Len=0 TSval=3000042817 TSecr=3000042817","35988","4444"
"3545","1.723446276","127.0.0.1","127.0.0.1","TLSv1.2","2394","Application Data","4444","35916"
"3546","1.723469603","127.0.0.1","127.0.0.1","TCP","66","35916  >  4444 [ACK] Seq=336 Ack=2329 Win=706 Len=0 TSval=3000042818 TSecr=3000042818","35916","4444"
"3618","1.729269921","127.0.0.1","127.0.0.1","TLSv1.2","2394","Application Data","4444","35950"
"3619","1.729288918","127.0.0.1","127.0.0.1","TCP","66","35950  >  4444 [ACK] Seq=336 Ack=2329 Win=706 Len=0 TSval=3000042824 TSecr=3000042824","35950","4444"
"3631","1.731893858","127.0.0.1","127.0.0.1","TLSv1.2","2395","Application Data","4444","35762"
"3632","1.731933388","127.0.0.1","127.0.0.1","TCP","66","35762  >  4444 [ACK] Seq=336 Ack=2330 Win=706 Len=0 TSval=3000042826 TSecr=3000042826","35762","4444"
"3643","1.732935471","127.0.0.1","127.0.0.1","TLSv1.2","2393","Application Data","4444","35380"
"3644","1.732965573","127.0.0.1","127.0.0.1","TCP","66","35380  >  4444 [ACK] Seq=336 Ack=2328 Win=706 Len=0 TSval=3000042827 TSecr=3000042827","35380","4444"
"3649","1.733442449","127.0.0.1","127.0.0.1","TLSv1.2","2400","Application Data","4444","36116"
"3650","1.733475763","127.0.0.1","127.0.0.1","TCP","66","36116  >  4444 [ACK] Seq=336 Ack=2335 Win=706 Len=0 TSval=3000042828 TSecr=3000042828","36116","4444"
"3661","1.735388157","127.0.0.1","127.0.0.1","TLSv1.2","2392","Application Data","4444","36166"
"3662","1.735390043","127.0.0.1","127.0.0.1","TLSv1.2","2391","Application Data","4444","35422"
"3663","1.735410087","127.0.0.1","127.0.0.1","TCP","66","36166  >  4444 [ACK] Seq=336 Ack=2327 Win=706 Len=0 TSval=3000042830 TSecr=3000042830","36166","4444"
"3664","1.735411554","127.0.0.1","127.0.0.1","TCP","66","35422  >  4444 [ACK] Seq=336 Ack=2326 Win=706 Len=0 TSval=3000042830 TSecr=3000042830","35422","4444"
"3668","1.735725071","127.0.0.1","127.0.0.1","TLSv1.2","2397","Application Data","4444","35524"
"3669","1.735752728","127.0.0.1","127.0.0.1","TCP","66","35524  >  4444 [ACK] Seq=336 Ack=2332 Win=706 Len=0 TSval=3000042830 TSecr=3000042830","35524","4444"
"3678","1.736234633","127.0.0.1","127.0.0.1","TLSv1.2","2397","Application Data","4444","35934"
"3679","1.736262779","127.0.0.1","127.0.0.1","TCP","66","35934  >  4444 [ACK] Seq=336 Ack=2332 Win=706 Len=0 TSval=3000042831 TSecr=3000042831","35934","4444"
"3682","1.737738386","127.0.0.1","127.0.0.1","TLSv1.2","2397","Application Data","4444","35676"
"3683","1.737763249","127.0.0.1","127.0.0.1","TCP","66","35676  >  4444 [ACK] Seq=336 Ack=2332 Win=706 Len=0 TSval=3000042832 TSecr=3000042832","35676","4444"
"3795","2.396384177","127.0.0.1","127.0.0.1","TLSv1.2","2840","Application Data","41808","4444"
"3797","2.397259219","127.0.0.1","127.0.0.1","TLSv1.2","2840","Application Data","41662","4444"
"3916","2.418775780","127.0.0.1","127.0.0.1","TLSv1.2","2194","Application Data","4444","41790"
"3917","2.418803647","127.0.0.1","127.0.0.1","TCP","66","41790  >  4444 [ACK] Seq=1 Ack=2129 Win=688 Len=0 TSval=3000043513 TSecr=3000043513","41790","4444"
"3920","2.420026637","127.0.0.1","127.0.0.1","TLSv1.2","2193","Application Data","4444","41086"
"3921","2.420074130","127.0.0.1","127.0.0.1","TCP","66","41086  >  4444 [ACK] Seq=1 Ack=2128 Win=688 Len=0 TSval=3000043514 TSecr=3000043514","41086","4444"
"3925","2.421306828","127.0.0.1","127.0.0.1","TLSv1.2","2840","Application Data","41620","4444"
"3928","2.421634942","127.0.0.1","127.0.0.1","TLSv1.2","2840","Application Data","41096","4444"
"3930","2.421929812","127.0.0.1","127.0.0.1","TLSv1.2","2841","Application Data","40964","4444"
"3961","2.425410632","127.0.0.1","127.0.0.1","TLSv1.2","2840","Application Data","41542","4444"
"3969","2.425865159","127.0.0.1","127.0.0.1","TLSv1.2","2841","Application Data","41232","4444"
"3976","2.426358378","127.0.0.1","127.0.0.1","TLSv1.2","2840","Application Data","40906","4444"
"3990","2.427381972","127.0.0.1","127.0.0.1","TLSv1.2","2841","Application Data","41550","4444"
"4000","2.427945242","127.0.0.1","127.0.0.1","TLSv1.2","2840","Application Data","41468","4444"
"4037","2.429547261","127.0.0.1","127.0.0.1","TLSv1.2","2840","Application Data","41482","4444"
"4077","2.432103871","127.0.0.1","127.0.0.1","TLSv1.2","2840","Application Data","41586","4444"
"4103","2.433804506","127.0.0.1","127.0.0.1","TLSv1.2","2840","Application Data","41300","4444"
"4121","2.434616201","127.0.0.1","127.0.0.1","TLSv1.2","2840","Application Data","41000","4444"
"4137","2.435544392","127.0.0.1","127.0.0.1","TLSv1.2","2840","Application Data","41744","4444"
"4147","2.436125611","127.0.0.1","127.0.0.1","TLSv1.2","2841","Application Data","41246","4444"
"4159","2.436869630","127.0.0.1","127.0.0.1","TLSv1.2","2840","Application Data","41608","4444"
"4168","2.437911871","127.0.0.1","127.0.0.1","TLSv1.2","2841","Application Data","41436","4444"
"4173","2.438110291","127.0.0.1","127.0.0.1","TCP","66","4444  >  41808 [ACK] Seq=142 Ack=2980 Win=739 Len=0 TSval=3000043533 TSecr=3000043491","4444","41808"
"4174","2.438122164","127.0.0.1","127.0.0.1","TCP","66","4444  >  41662 [ACK] Seq=142 Ack=2980 Win=739 Len=0 TSval=3000043533 TSecr=3000043492","4444","41662"
"4176","2.438201433","127.0.0.1","127.0.0.1","TLSv1.2","166","Application Data","4444","41086"
"4178","2.438233421","127.0.0.1","127.0.0.1","TCP","66","41086  >  4444 [ACK] Seq=1 Ack=2228 Win=688 Len=0 TSval=3000043533 TSecr=3000043533","41086","4444"
"4183","2.438420456","127.0.0.1","127.0.0.1","TLSv1.2","144","Application Data","4444","41662"
"4184","2.438433795","127.0.0.1","127.0.0.1","TCP","66","41662  >  4444 [ACK] Seq=2980 Ack=220 Win=615 Len=0 TSval=3000043533 TSecr=3000043533","41662","4444"
"4198","2.438794805","127.0.0.1","127.0.0.1","TLSv1.2","2841","Application Data","41648","4444"
"4208","2.439562640","127.0.0.1","127.0.0.1","TLSv1.2","165","Application Data","4444","41790"
"4209","2.439597980","127.0.0.1","127.0.0.1","TCP","66","41790  >  4444 [ACK] Seq=1 Ack=2228 Win=688 Len=0 TSval=3000043534 TSecr=3000043534","41790","4444"
"4211","2.439689123","127.0.0.1","127.0.0.1","TLSv1.2","2841","Application Data","41320","4444"
"4215","2.439788297","127.0.0.1","127.0.0.1","TLSv1.2","144","Application Data","4444","41808"
"4216","2.439805059","127.0.0.1","127.0.0.1","TCP","66","41808  >  4444 [ACK] Seq=2980 Ack=220 Win=615 Len=0 TSval=3000043534 TSecr=3000043534","41808","4444"
"4229","2.440403110","127.0.0.1","127.0.0.1","TLSv1.2","2840","Application Data","41278","4444"
"4231","2.440851561","127.0.0.1","127.0.0.1","TLSv1.2","2840","Application Data","41676","4444"
"4239","2.441494240","127.0.0.1","127.0.0.1","TLSv1.2","2840","Application Data","41738","4444"
"4246","2.442015745","127.0.0.1","127.0.0.1","TLSv1.2","2841","Application Data","41386","4444"
"4262","2.442753967","127.0.0.1","127.0.0.1","TLSv1.2","2840","Application Data","41210","4444"
"4267","2.443488488","127.0.0.1","127.0.0.1","TLSv1.2","2840","Application Data","41774","4444"
"4355","2.446799663","127.0.0.1","127.0.0.1","TLSv1.2","2838","Application Data","41500","4444"
"4360","2.447452539","127.0.0.1","127.0.0.1","TLSv1.2","2841","Application Data","41270","4444"
"4392","2.448004425","127.0.0.1","127.0.0.1","TLSv1.2","2840","Application Data","41582","4444"
