"No.","Time","Source","Destination","Protocol","Length","Info","src_port","dst_port"
"49","0.777386022","127.0.0.1","127.0.0.1","TLSv1.2","271","Application Data","43532","4444"
"69","0.784336556","127.0.0.1","127.0.0.1","TLSv1.2","207","Application Data","4444","43532"
"70","0.784368544","127.0.0.1","127.0.0.1","TCP","66","43532  >  4444 [ACK] Seq=206 Ack=142 Win=615 Len=0 TSval=2785238575 TSecr=2785238575","43532","4444"
"73","0.786044245","::1","::1","TCP","94","60284  >  4444 [SYN] Seq=0 Win=65476 Len=0 MSS=65476 SACK_PERM TSval=2469453862 TSecr=0 WS=128","60284","4444"
"74","0.786075465","::1","::1","TCP","74","4444  >  60284 [RST, ACK] Seq=1 Ack=1 Win=0 Len=0","4444","60284"
"75","0.786826119","127.0.0.1","127.0.0.1","TLSv1.2","401","Application Data","43528","4444"
"76","0.786864531","127.0.0.1","127.0.0.1","TCP","66","4444  >  43528 [ACK] Seq=1 Ack=336 Win=995 Len=0 TSval=2785238577 TSecr=2785238577","4444","43528"
"157","0.825587749","127.0.0.1","127.0.0.1","TLSv1.2","2393","Application Data","4444","43528"
"158","0.825619247","127.0.0.1","127.0.0.1","TCP","66","43528  >  4444 [ACK] Seq=336 Ack=2328 Win=706 Len=0 TSval=2785238616 TSecr=2785238616","43528","4444"
"170","0.890903383","127.0.0.1","127.0.0.1","TLSv1.2","2840","Application Data","43532","4444"
"229","0.907181988","127.0.0.1","127.0.0.1","TLSv1.2","2193","Application Data","4444","43544"
"230","0.907211112","127.0.0.1","127.0.0.1","TCP","66","43544  >  4444 [ACK] Seq=1 Ack=2128 Win=688 Len=0 TSval=2785238698 TSecr=2785238697","43544","4444"
"255","0.915291887","127.0.0.1","127.0.0.1","TLSv1.2","166","Application Data","4444","43544"
"256","0.915325830","127.0.0.1","127.0.0.1","TCP","66","43544  >  4444 [ACK] Seq=1 Ack=2228 Win=688 Len=0 TSval=2785238706 TSecr=2785238706","43544","4444"
"257","0.915532700","127.0.0.1","127.0.0.1","TLSv1.2","144","Application Data","4444","43532"
"258","0.915560287","127.0.0.1","127.0.0.1","TCP","66","43532  >  4444 [ACK] Seq=2980 Ack=220 Win=615 Len=0 TSval=2785238706 TSecr=2785238706","43532","4444"
"267","0.939471776","127.0.0.1","127.0.0.1","TLSv1.2","134","Application Data","43544","4444"
"290","0.980180092","127.0.0.1","127.0.0.1","TCP","66","4444  >  43544 [ACK] Seq=2228 Ack=69 Win=512 Len=0 TSval=2785238771 TSecr=2785238730","4444","43544"
"291","0.980200975","127.0.0.1","127.0.0.1","TLSv1.2","271","Application Data","43544","4444"
"292","0.980221508","127.0.0.1","127.0.0.1","TCP","66","4444  >  43544 [ACK] Seq=2228 Ack=274 Win=511 Len=0 TSval=2785238771 TSecr=2785238771","4444","43544"
"311","0.985005636","127.0.0.1","127.0.0.1","TLSv1.2","207","Application Data","4444","43544"
"315","0.986322353","::1","::1","TCP","94","60294  >  4444 [SYN] Seq=0 Win=65476 Len=0 MSS=65476 SACK_PERM TSval=2469454063 TSecr=0 WS=128","60294","4444"
"316","0.986342817","::1","::1","TCP","74","4444  >  60294 [RST, ACK] Seq=1 Ack=1 Win=0 Len=0","4444","60294"
"317","0.986934373","127.0.0.1","127.0.0.1","TLSv1.2","401","Application Data","43540","4444"
"318","0.986965173","127.0.0.1","127.0.0.1","TCP","66","4444  >  43540 [ACK] Seq=1 Ack=336 Win=995 Len=0 TSval=2785238777 TSecr=2785238777","4444","43540"
"395","1.011188572","127.0.0.1","127.0.0.1","TLSv1.2","2400","Application Data","4444","43540"
"396","1.011218604","127.0.0.1","127.0.0.1","TCP","66","43540  >  4444 [ACK] Seq=336 Ack=2335 Win=706 Len=0 TSval=2785238802 TSecr=2785238801","43540","4444"
"399","1.025194682","127.0.0.1","127.0.0.1","TCP","66","43544  >  4444 [ACK] Seq=274 Ack=2369 Win=699 Len=0 TSval=2785238816 TSecr=2785238775","43544","4444"
"409","1.078882232","127.0.0.1","127.0.0.1","TLSv1.2","2840","Application Data","43544","4444"
"468","1.095866932","127.0.0.1","127.0.0.1","TLSv1.2","2194","Application Data","4444","43532"
"469","1.095893263","127.0.0.1","127.0.0.1","TCP","66","43532  >  4444 [ACK] Seq=2980 Ack=2348 Win=688 Len=0 TSval=2785238886 TSecr=2785238886","43532","4444"
"492","1.103399524","127.0.0.1","127.0.0.1","TLSv1.2","166","Application Data","4444","43532"
"493","1.103432419","127.0.0.1","127.0.0.1","TCP","66","43532  >  4444 [ACK] Seq=2980 Ack=2448 Win=688 Len=0 TSval=2785238894 TSecr=2785238894","43532","4444"
"494","1.103644527","127.0.0.1","127.0.0.1","TLSv1.2","144","Application Data","4444","43544"
"495","1.103674838","127.0.0.1","127.0.0.1","TCP","66","43544  >  4444 [ACK] Seq=3048 Ack=2447 Win=699 Len=0 TSval=2785238894 TSecr=2785238894","43544","4444"
"498","1.123879990","127.0.0.1","127.0.0.1","TLSv1.2","135","Application Data","43532","4444"
"500","1.124246098","127.0.0.1","127.0.0.1","TLSv1.2","271","Application Data","43514","4444"
"536","1.131066727","127.0.0.1","127.0.0.1","TLSv1.2","207","Application Data","4444","43514"
"537","1.131098645","127.0.0.1","127.0.0.1","TCP","66","43514  >  4444 [ACK] Seq=206 Ack=142 Win=615 Len=0 TSval=2785238921 TSecr=2785238921","43514","4444"
"542","1.132459223","::1","::1","TCP","94","60296  >  4444 [SYN] Seq=0 Win=65476 Len=0 MSS=65476 SACK_PERM TSval=2469454209 TSecr=0 WS=128","60296","4444"
"543","1.132480664","::1","::1","TCP","74","4444  >  60296 [RST, ACK] Seq=1 Ack=1 Win=0 Len=0","4444","60296"
"544","1.133083953","127.0.0.1","127.0.0.1","TLSv1.2","401","Application Data","43486","4444"
"545","1.133112029","127.0.0.1","127.0.0.1","TCP","66","4444  >  43486 [ACK] Seq=1 Ack=336 Win=907 Len=0 TSval=2785238923 TSecr=2785238923","4444","43486"
"628","1.161091842","127.0.0.1","127.0.0.1","TLSv1.2","2394","Application Data","4444","43486"
"629","1.161124738","127.0.0.1","127.0.0.1","TCP","66","43486  >  4444 [ACK] Seq=336 Ack=2329 Win=706 Len=0 TSval=2785238951 TSecr=2785238951","43486","4444"
"632","1.164188814","127.0.0.1","127.0.0.1","TCP","66","4444  >  43532 [ACK] Seq=2448 Ack=3049 Win=739 Len=0 TSval=2785238955 TSecr=2785238914","4444","43532"
"637","1.215629430","127.0.0.1","127.0.0.1","TLSv1.2","2841","Application Data","43514","4444"
"696","1.230009470","127.0.0.1","127.0.0.1","TLSv1.2","2193","Application Data","4444","43516"
"697","1.230038664","127.0.0.1","127.0.0.1","TCP","66","43516  >  4444 [ACK] Seq=1 Ack=2128 Win=688 Len=0 TSval=2785239020 TSecr=2785239020","43516","4444"
"720","1.237297617","127.0.0.1","127.0.0.1","TLSv1.2","165","Application Data","4444","43516"
"721","1.237327230","127.0.0.1","127.0.0.1","TCP","66","43516  >  4444 [ACK] Seq=1 Ack=2227 Win=688 Len=0 TSval=2785239028 TSecr=2785239028","43516","4444"
"722","1.237519223","127.0.0.1","127.0.0.1","TLSv1.2","144","Application Data","4444","43514"
"723","1.237546881","127.0.0.1","127.0.0.1","TCP","66","43514  >  4444 [ACK] Seq=2981 Ack=220 Win=615 Len=0 TSval=2785239028 TSecr=2785239028","43514","4444"
"731","1.261006217","127.0.0.1","127.0.0.1","TLSv1.2","134","Application Data","43516","4444"
"753","1.301193587","127.0.0.1","127.0.0.1","TCP","66","4444  >  43516 [ACK] Seq=2227 Ack=69 Win=512 Len=0 TSval=2785239092 TSecr=2785239051","4444","43516"
"754","1.301222152","127.0.0.1","127.0.0.1","TLSv1.2","271","Application Data","43516","4444"
"755","1.301242266","127.0.0.1","127.0.0.1","TCP","66","4444  >  43516 [ACK] Seq=2227 Ack=274 Win=511 Len=0 TSval=2785239092 TSecr=2785239092","4444","43516"
"774","1.305477651","127.0.0.1","127.0.0.1","TLSv1.2","207","Application Data","4444","43516"
"778","1.306648051","::1","::1","TCP","94","60302  >  4444 [SYN] Seq=0 Win=65476 Len=0 MSS=65476 SACK_PERM TSval=2469454383 TSecr=0 WS=128","60302","4444"
"779","1.306665581","::1","::1","TCP","74","4444  >  60302 [RST, ACK] Seq=1 Ack=1 Win=0 Len=0","4444","60302"
"780","1.307133797","127.0.0.1","127.0.0.1","TLSv1.2","401","Application Data","43498","4444"
"781","1.307178216","127.0.0.1","127.0.0.1","TCP","66","4444  >  43498 [ACK] Seq=1 Ack=336 Win=995 Len=0 TSval=2785239098 TSecr=2785239097","4444","43498"
"858","1.327536600","127.0.0.1","127.0.0.1","TLSv1.2","2397","Application Data","4444","43498"
"859","1.327557273","127.0.0.1","127.0.0.1","TCP","66","43498  >  4444 [ACK] Seq=336 Ack=2332 Win=706 Len=0 TSval=2785239118 TSecr=2785239118","43498","4444"
"867","1.346181917","127.0.0.1","127.0.0.1","TCP","66","43516  >  4444 [ACK] Seq=274 Ack=2368 Win=699 Len=0 TSval=2785239137 TSecr=2785239096","43516","4444"
"872","1.389961503","127.0.0.1","127.0.0.1","TLSv1.2","2841","Application Data","43516","4444"
"931","1.406467232","127.0.0.1","127.0.0.1","TLSv1.2","2193","Application Data","4444","43514"
"932","1.406493004","127.0.0.1","127.0.0.1","TCP","66","43514  >  4444 [ACK] Seq=2981 Ack=2347 Win=688 Len=0 TSval=2785239197 TSecr=2785239197","43514","4444"
"955","1.412022268","127.0.0.1","127.0.0.1","TLSv1.2","165","Application Data","4444","43514"
"956","1.412054534","127.0.0.1","127.0.0.1","TCP","66","43514  >  4444 [ACK] Seq=2981 Ack=2446 Win=688 Len=0 TSval=2785239202 TSecr=2785239202","43514","4444"
"957","1.412279353","127.0.0.1","127.0.0.1","TLSv1.2","144","Application Data","4444","43516"
"958","1.412307919","127.0.0.1","127.0.0.1","TCP","66","43516  >  4444 [ACK] Seq=3049 Ack=2446 Win=699 Len=0 TSval=2785239203 TSecr=2785239203","43516","4444"
"961","1.433579128","127.0.0.1","127.0.0.1","TLSv1.2","134","Application Data","43514","4444"
"983","1.439726906","127.0.0.1","127.0.0.1","TLSv1.2","636","Application Data","43532","4444"
"984","1.439751909","127.0.0.1","127.0.0.1","TCP","66","4444  >  43532 [ACK] Seq=2448 Ack=3619 Win=752 Len=0 TSval=2785239230 TSecr=2785239230","4444","43532"
"1049","1.452276965","127.0.0.1","127.0.0.1","TLSv1.2","538","Application Data","4444","43544"
"1050","1.452293098","127.0.0.1","127.0.0.1","TCP","66","43544  >  4444 [ACK] Seq=3048 Ack=2919 Win=697 Len=0 TSval=2785239243 TSecr=2785239243","43544","4444"
"1075","1.457516458","127.0.0.1","127.0.0.1","TLSv1.2","165","Application Data","4444","43544"
"1076","1.457535943","127.0.0.1","127.0.0.1","TCP","66","43544  >  4444 [ACK] Seq=3048 Ack=3018 Win=699 Len=0 TSval=2785239248 TSecr=2785239248","43544","4444"
"1077","1.457659353","127.0.0.1","127.0.0.1","TLSv1.2","144","Application Data","4444","43532"
"1080","1.463662630","127.0.0.1","127.0.0.1","TLSv1.2","134","Application Data","43544","4444"
"1099","1.474181425","127.0.0.1","127.0.0.1","TCP","66","4444  >  43514 [ACK] Seq=2446 Ack=3049 Win=739 Len=0 TSval=2785239265 TSecr=2785239224","4444","43514"
"1103","1.498181053","127.0.0.1","127.0.0.1","TCP","66","43532  >  4444 [ACK] Seq=3619 Ack=2526 Win=688 Len=0 TSval=2785239289 TSecr=2785239248","43532","4444"
"1104","1.504185168","127.0.0.1","127.0.0.1","TCP","66","4444  >  43544 [ACK] Seq=3018 Ack=3116 Win=739 Len=0 TSval=2785239295 TSecr=2785239254","4444","43544"
"1105","1.504209473","127.0.0.1","127.0.0.1","TLSv1.2","636","Application Data","43544","4444"
"1106","1.504224629","127.0.0.1","127.0.0.1","TCP","66","4444  >  43544 [ACK] Seq=3018 Ack=3686 Win=752 Len=0 TSval=2785239295 TSecr=2785239295","4444","43544"
"1166","1.519746923","127.0.0.1","127.0.0.1","TLSv1.2","538","Application Data","4444","43532"
"1167","1.519776954","127.0.0.1","127.0.0.1","TCP","66","43532  >  4444 [ACK] Seq=3619 Ack=2998 Win=697 Len=0 TSval=2785239310 TSecr=2785239310","43532","4444"
"1190","1.526296079","127.0.0.1","127.0.0.1","TLSv1.2","165","Application Data","4444","43532"
"1191","1.526324085","127.0.0.1","127.0.0.1","TCP","66","43532  >  4444 [ACK] Seq=3619 Ack=3097 Win=697 Len=0 TSval=2785239317 TSecr=2785239317","43532","4444"
"1192","1.526497920","127.0.0.1","127.0.0.1","TLSv1.2","144","Application Data","4444","43544"
"1195","1.532108689","127.0.0.1","127.0.0.1","TLSv1.2","134","Application Data","43532","4444"
"1210","1.536412518","127.0.0.1","127.0.0.1","TLSv1.2","637","Application Data","43514","4444"
"1211","1.536434030","127.0.0.1","127.0.0.1","TCP","66","4444  >  43514 [ACK] Seq=2446 Ack=3620 Win=752 Len=0 TSval=2785239327 TSecr=2785239327","4444","43514"
"1274","1.552262508","127.0.0.1","127.0.0.1","TLSv1.2","539","Application Data","4444","43516"
"1275","1.552295403","127.0.0.1","127.0.0.1","TCP","66","43516  >  4444 [ACK] Seq=3049 Ack=2919 Win=697 Len=0 TSval=2785239343 TSecr=2785239343","43516","4444"
"1298","1.558400229","127.0.0.1","127.0.0.1","TLSv1.2","166","Application Data","4444","43516"
"1299","1.558418039","127.0.0.1","127.0.0.1","TCP","66","43516  >  4444 [ACK] Seq=3049 Ack=3019 Win=699 Len=0 TSval=2785239349 TSecr=2785239349","43516","4444"
"1300","1.558510090","127.0.0.1","127.0.0.1","TLSv1.2","144","Application Data","4444","43514"
"1303","1.566215678","127.0.0.1","127.0.0.1","TLSv1.2","135","Application Data","43516","4444"
"1305","1.567204351","127.0.0.1","127.0.0.1","TCP","66","43544  >  4444 [ACK] Seq=3686 Ack=3096 Win=699 Len=0 TSval=2785239358 TSecr=2785239317","43544","4444"
"1321","1.572203729","127.0.0.1","127.0.0.1","TCP","66","4444  >  43532 [ACK] Seq=3097 Ack=3687 Win=752 Len=0 TSval=2785239363 TSecr=2785239322","4444","43532"
"1327","1.599213726","127.0.0.1","127.0.0.1","TCP","66","43514  >  4444 [ACK] Seq=3620 Ack=2524 Win=688 Len=0 TSval=2785239390 TSecr=2785239349","43514","4444"
"1328","1.607183175","127.0.0.1","127.0.0.1","TCP","66","4444  >  43516 [ACK] Seq=3019 Ack=3118 Win=739 Len=0 TSval=2785239398 TSecr=2785239357","4444","43516"
"1329","1.607211810","127.0.0.1","127.0.0.1","TLSv1.2","637","Application Data","43516","4444"
"1330","1.607237442","127.0.0.1","127.0.0.1","TCP","66","4444  >  43516 [ACK] Seq=3019 Ack=3689 Win=752 Len=0 TSval=2785239398 TSecr=2785239398","4444","43516"
"1390","1.623401926","127.0.0.1","127.0.0.1","TLSv1.2","539","Application Data","4444","43514"
"1391","1.623431958","127.0.0.1","127.0.0.1","TCP","66","43514  >  4444 [ACK] Seq=3620 Ack=2997 Win=697 Len=0 TSval=2785239414 TSecr=2785239414","43514","4444"
"1414","1.630573089","127.0.0.1","127.0.0.1","TLSv1.2","165","Application Data","4444","43514"
"1415","1.630606264","127.0.0.1","127.0.0.1","TCP","66","43514  >  4444 [ACK] Seq=3620 Ack=3096 Win=697 Len=0 TSval=2785239421 TSecr=2785239421","43514","4444"
"1416","1.630805800","127.0.0.1","127.0.0.1","TLSv1.2","144","Application Data","4444","43516"
"1419","1.639881954","127.0.0.1","127.0.0.1","TLSv1.2","135","Application Data","43514","4444"
"1435","1.646063675","127.0.0.1","127.0.0.1","TLSv1.2","636","Application Data","43532","4444"
"1436","1.646094685","127.0.0.1","127.0.0.1","TCP","66","4444  >  43532 [ACK] Seq=3097 Ack=4257 Win=752 Len=0 TSval=2785239436 TSecr=2785239436","4444","43532"
"1498","1.661474503","127.0.0.1","127.0.0.1","TLSv1.2","539","Application Data","4444","43544"
"1499","1.661507607","127.0.0.1","127.0.0.1","TCP","66","43544  >  4444 [ACK] Seq=3686 Ack=3569 Win=697 Len=0 TSval=2785239452 TSecr=2785239452","43544","4444"
"1522","1.668477907","127.0.0.1","127.0.0.1","TLSv1.2","166","Application Data","4444","43544"
"1523","1.668508357","127.0.0.1","127.0.0.1","TCP","66","43544  >  4444 [ACK] Seq=3686 Ack=3669 Win=699 Len=0 TSval=2785239459 TSecr=2785239459","43544","4444"
"1524","1.668711665","127.0.0.1","127.0.0.1","TLSv1.2","144","Application Data","4444","43532"
"1527","1.671248510","127.0.0.1","127.0.0.1","TCP","66","43516  >  4444 [ACK] Seq=3689 Ack=3097 Win=699 Len=0 TSval=2785239462 TSecr=2785239421","43516","4444"
"1528","1.677409140","127.0.0.1","127.0.0.1","TLSv1.2","135","Application Data","43544","4444"
"1539","1.681197191","127.0.0.1","127.0.0.1","TCP","66","4444  >  43514 [ACK] Seq=3096 Ack=3689 Win=752 Len=0 TSval=2785239472 TSecr=2785239430","4444","43514"
"1551","1.710213798","127.0.0.1","127.0.0.1","TCP","66","43532  >  4444 [ACK] Seq=4257 Ack=3175 Win=697 Len=0 TSval=2785239501 TSecr=2785239459","43532","4444"
"1552","1.718176122","127.0.0.1","127.0.0.1","TCP","66","4444  >  43544 [ACK] Seq=3669 Ack=3755 Win=752 Len=0 TSval=2785239509 TSecr=2785239468","4444","43544"
"1553","1.718197215","127.0.0.1","127.0.0.1","TLSv1.2","636","Application Data","43544","4444"
"1554","1.718221589","127.0.0.1","127.0.0.1","TCP","66","4444  >  43544 [ACK] Seq=3669 Ack=4325 Win=752 Len=0 TSval=2785239509 TSecr=2785239509","4444","43544"
"1614","1.728919387","127.0.0.1","127.0.0.1","TLSv1.2","538","Application Data","4444","43532"
"1615","1.728939013","127.0.0.1","127.0.0.1","TCP","66","43532  >  4444 [ACK] Seq=4257 Ack=3647 Win=697 Len=0 TSval=2785239519 TSecr=2785239519","43532","4444"
"1638","1.732833712","127.0.0.1","127.0.0.1","TLSv1.2","166","Application Data","4444","43532"
"1639","1.732849566","127.0.0.1","127.0.0.1","TCP","66","43532  >  4444 [ACK] Seq=4257 Ack=3747 Win=697 Len=0 TSval=2785239523 TSecr=2785239523","43532","4444"
"1640","1.732955794","127.0.0.1","127.0.0.1","TLSv1.2","144","Application Data","4444","43544"
"1643","1.738733065","127.0.0.1","127.0.0.1","TLSv1.2","134","Application Data","43532","4444"
"1658","1.742931294","127.0.0.1","127.0.0.1","TLSv1.2","637","Application Data","43514","4444"
"1659","1.742955668","127.0.0.1","127.0.0.1","TCP","66","4444  >  43514 [ACK] Seq=3096 Ack=4260 Win=752 Len=0 TSval=2785239533 TSecr=2785239533","4444","43514"
"1722","1.757193861","127.0.0.1","127.0.0.1","TLSv1.2","538","Application Data","4444","43516"
"1723","1.757231086","127.0.0.1","127.0.0.1","TCP","66","43516  >  4444 [ACK] Seq=3689 Ack=3569 Win=697 Len=0 TSval=2785239548 TSecr=2785239547","43516","4444"
"1746","1.765417881","127.0.0.1","127.0.0.1","TLSv1.2","166","Application Data","4444","43516"
"1747","1.765455106","127.0.0.1","127.0.0.1","TCP","66","43516  >  4444 [ACK] Seq=3689 Ack=3669 Win=699 Len=0 TSval=2785239556 TSecr=2785239556","43516","4444"
"1748","1.765721411","127.0.0.1","127.0.0.1","TLSv1.2","144","Application Data","4444","43514"
"1751","1.773223691","127.0.0.1","127.0.0.1","TCP","66","43544  >  4444 [ACK] Seq=4325 Ack=3747 Win=699 Len=0 TSval=2785239564 TSecr=2785239523","43544","4444"
"1752","1.775388631","127.0.0.1","127.0.0.1","TLSv1.2","134","Application Data","43516","4444"
"1760","1.779196238","127.0.0.1","127.0.0.1","TCP","66","4444  >  43532 [ACK] Seq=3747 Ack=4325 Win=752 Len=0 TSval=2785239570 TSecr=2785239529","4444","43532"
"1774","1.806158953","127.0.0.1","127.0.0.1","TCP","66","43514  >  4444 [ACK] Seq=4260 Ack=3174 Win=697 Len=0 TSval=2785239597 TSecr=2785239556","43514","4444"
"1776","1.816173633","127.0.0.1","127.0.0.1","TCP","66","4444  >  43516 [ACK] Seq=3669 Ack=3757 Win=752 Len=0 TSval=2785239607 TSecr=2785239566","4444","43516"
"1777","1.816199614","127.0.0.1","127.0.0.1","TLSv1.2","637","Application Data","43516","4444"
"1778","1.816220636","127.0.0.1","127.0.0.1","TCP","66","4444  >  43516 [ACK] Seq=3669 Ack=4328 Win=752 Len=0 TSval=2785239607 TSecr=2785239607","4444","43516"
"1836","1.828929305","127.0.0.1","127.0.0.1","TLSv1.2","539","Application Data","4444","43514"
"1837","1.828947952","127.0.0.1","127.0.0.1","TCP","66","43514  >  4444 [ACK] Seq=4260 Ack=3647 Win=697 Len=0 TSval=2785239619 TSecr=2785239619","43514","4444"
"1860","1.833714410","127.0.0.1","127.0.0.1","TLSv1.2","165","Application Data","4444","43514"
"1861","1.833734385","127.0.0.1","127.0.0.1","TCP","66","43514  >  4444 [ACK] Seq=4260 Ack=3746 Win=697 Len=0 TSval=2785239624 TSecr=2785239624","43514","4444"
"1862","1.833840823","127.0.0.1","127.0.0.1","TLSv1.2","144","Application Data","4444","43516"
"1865","1.843427307","127.0.0.1","127.0.0.1","TLSv1.2","135","Application Data","43514","4444"
"1881","1.849471371","127.0.0.1","127.0.0.1","TLSv1.2","636","Application Data","43532","4444"
"1882","1.849500006","127.0.0.1","127.0.0.1","TCP","66","4444  >  43532 [ACK] Seq=3747 Ack=4895 Win=752 Len=0 TSval=2785239640 TSecr=2785239640","4444","43532"
"1944","1.864882478","127.0.0.1","127.0.0.1","TLSv1.2","539","Application Data","4444","43544"
"1945","1.864913976","127.0.0.1","127.0.0.1","TCP","66","43544  >  4444 [ACK] Seq=4325 Ack=4220 Win=697 Len=0 TSval=2785239655 TSecr=2785239655","43544","4444"
"1968","1.871871425","127.0.0.1","127.0.0.1","TLSv1.2","165","Application Data","4444","43544"
"1969","1.871890910","127.0.0.1","127.0.0.1","TCP","66","43544  >  4444 [ACK] Seq=4325 Ack=4319 Win=699 Len=0 TSval=2785239662 TSecr=2785239662","43544","4444"
"1970","1.872017183","127.0.0.1","127.0.0.1","TLSv1.2","144","Application Data","4444","43532"
"1973","1.874192111","127.0.0.1","127.0.0.1","TCP","66","43516  >  4444 [ACK] Seq=4328 Ack=3747 Win=699 Len=0 TSval=2785239665 TSecr=2785239624","43516","4444"
"1974","1.881300696","127.0.0.1","127.0.0.1","TLSv1.2","135","Application Data","43544","4444"
"1981","1.884191496","127.0.0.1","127.0.0.1","TCP","66","4444  >  43514 [ACK] Seq=3746 Ack=4329 Win=752 Len=0 TSval=2785239675 TSecr=2785239634","4444","43514"
"1996","1.912175220","127.0.0.1","127.0.0.1","TCP","66","43532  >  4444 [ACK] Seq=4895 Ack=3825 Win=697 Len=0 TSval=2785239703 TSecr=2785239662","43532","4444"
"1998","1.922208898","127.0.0.1","127.0.0.1","TCP","66","4444  >  43544 [ACK] Seq=4319 Ack=4394 Win=752 Len=0 TSval=2785239713 TSecr=2785239672","4444","43544"
"1999","1.922241793","127.0.0.1","127.0.0.1","TLSv1.2","636","Application Data","43544","4444"
"2000","1.922274199","127.0.0.1","127.0.0.1","TCP","66","4444  >  43544 [ACK] Seq=4319 Ack=4964 Win=752 Len=0 TSval=2785239713 TSecr=2785239713","4444","43544"
"2060","1.938935954","127.0.0.1","127.0.0.1","TLSv1.2","538","Application Data","4444","43532"
"2061","1.938966754","127.0.0.1","127.0.0.1","TCP","66","43532  >  4444 [ACK] Seq=4895 Ack=4297 Win=697 Len=0 TSval=2785239729 TSecr=2785239729","43532","4444"
"2084","1.945630799","127.0.0.1","127.0.0.1","TLSv1.2","166","Application Data","4444","43532"
"2085","1.945659923","127.0.0.1","127.0.0.1","TCP","66","43532  >  4444 [ACK] Seq=4895 Ack=4397 Win=697 Len=0 TSval=2785239736 TSecr=2785239736","43532","4444"
"2086","1.945851777","127.0.0.1","127.0.0.1","TLSv1.2","144","Application Data","4444","43544"
"2089","1.954805359","127.0.0.1","127.0.0.1","TLSv1.2","134","Application Data","43532","4444"
"2110","1.961087582","127.0.0.1","127.0.0.1","TLSv1.2","637","Application Data","43514","4444"
"2111","1.961116217","127.0.0.1","127.0.0.1","TCP","66","4444  >  43514 [ACK] Seq=3746 Ack=4900 Win=752 Len=0 TSval=2785239751 TSecr=2785239751","4444","43514"
"2168","1.976467260","127.0.0.1","127.0.0.1","TLSv1.2","539","Application Data","4444","43516"
"2169","1.976500574","127.0.0.1","127.0.0.1","TCP","66","43516  >  4444 [ACK] Seq=4328 Ack=4220 Win=697 Len=0 TSval=2785239767 TSecr=2785239767","43516","4444"
"2192","1.983242283","127.0.0.1","127.0.0.1","TLSv1.2","165","Application Data","4444","43516"
"2193","1.983275248","127.0.0.1","127.0.0.1","TCP","66","43516  >  4444 [ACK] Seq=4328 Ack=4319 Win=699 Len=0 TSval=2785239774 TSecr=2785239774","43516","4444"
"2194","1.983459769","127.0.0.1","127.0.0.1","TLSv1.2","144","Application Data","4444","43514"
"2197","1.986187280","127.0.0.1","127.0.0.1","TCP","66","43544  >  4444 [ACK] Seq=4964 Ack=4397 Win=699 Len=0 TSval=2785239777 TSecr=2785239736","43544","4444"
"2198","1.992523770","127.0.0.1","127.0.0.1","TLSv1.2","135","Application Data","43516","4444"
"2205","1.995192824","127.0.0.1","127.0.0.1","TCP","66","4444  >  43532 [ACK] Seq=4397 Ack=4963 Win=752 Len=0 TSval=2785239786 TSecr=2785239745","4444","43532"
"2221","2.024241279","127.0.0.1","127.0.0.1","TCP","66","43514  >  4444 [ACK] Seq=4900 Ack=3824 Win=697 Len=0 TSval=2785239815 TSecr=2785239774","43514","4444"
"2222","2.033218747","127.0.0.1","127.0.0.1","TCP","66","4444  >  43516 [ACK] Seq=4319 Ack=4397 Win=752 Len=0 TSval=2785239824 TSecr=2785239783","4444","43516"
"2223","2.033267426","127.0.0.1","127.0.0.1","TLSv1.2","637","Application Data","43516","4444"
"2224","2.033295153","127.0.0.1","127.0.0.1","TCP","66","4444  >  43516 [ACK] Seq=4319 Ack=4968 Win=752 Len=0 TSval=2785239824 TSecr=2785239824","4444","43516"
"2284","2.049525707","127.0.0.1","127.0.0.1","TLSv1.2","538","Application Data","4444","43514"
"2285","2.049560488","127.0.0.1","127.0.0.1","TCP","66","43514  >  4444 [ACK] Seq=4900 Ack=4296 Win=697 Len=0 TSval=2785239840 TSecr=2785239840","43514","4444"
"2308","2.056127105","127.0.0.1","127.0.0.1","TLSv1.2","166","Application Data","4444","43514"
"2309","2.056182349","127.0.0.1","127.0.0.1","TCP","66","43514  >  4444 [ACK] Seq=4900 Ack=4396 Win=697 Len=0 TSval=2785239846 TSecr=2785239846","43514","4444"
"2310","2.056422813","127.0.0.1","127.0.0.1","TLSv1.2","144","Application Data","4444","43516"
"2317","2.065640325","127.0.0.1","127.0.0.1","TLSv1.2","134","Application Data","43514","4444"
"2335","2.071955374","127.0.0.1","127.0.0.1","TLSv1.2","636","Application Data","43532","4444"
"2336","2.071983101","127.0.0.1","127.0.0.1","TCP","66","4444  >  43532 [ACK] Seq=4397 Ack=5533 Win=752 Len=0 TSval=2785239862 TSecr=2785239862","4444","43532"
"2392","2.086430887","127.0.0.1","127.0.0.1","TLSv1.2","539","Application Data","4444","43544"
"2393","2.086463293","127.0.0.1","127.0.0.1","TCP","66","43544  >  4444 [ACK] Seq=4964 Ack=4870 Win=697 Len=0 TSval=2785239877 TSecr=2785239877","43544","4444"
"2416","2.094346557","127.0.0.1","127.0.0.1","TLSv1.2","166","Application Data","4444","43544"
"2417","2.094379453","127.0.0.1","127.0.0.1","TCP","66","43544  >  4444 [ACK] Seq=4964 Ack=4970 Win=699 Len=0 TSval=2785239885 TSecr=2785239885","43544","4444"
"2418","2.094582132","127.0.0.1","127.0.0.1","TLSv1.2","144","Application Data","4444","43532"
"2421","2.097188609","127.0.0.1","127.0.0.1","TCP","66","43516  >  4444 [ACK] Seq=4968 Ack=4397 Win=699 Len=0 TSval=2785239888 TSecr=2785239847","43516","4444"
"2422","2.104537797","127.0.0.1","127.0.0.1","TLSv1.2","135","Application Data","43544","4444"
"2429","2.107179334","127.0.0.1","127.0.0.1","TCP","66","4444  >  43514 [ACK] Seq=4396 Ack=4968 Win=752 Len=0 TSval=2785239898 TSecr=2785239856","4444","43514"
"2444","2.135201261","127.0.0.1","127.0.0.1","TCP","66","43532  >  4444 [ACK] Seq=5533 Ack=4475 Win=697 Len=0 TSval=2785239926 TSecr=2785239885","43532","4444"
"2446","2.145242062","127.0.0.1","127.0.0.1","TCP","66","4444  >  43544 [ACK] Seq=4970 Ack=5033 Win=752 Len=0 TSval=2785239936 TSecr=2785239895","4444","43544"
"2447","2.145291720","127.0.0.1","127.0.0.1","TLSv1.2","636","Application Data","43544","4444"
"2448","2.145318818","127.0.0.1","127.0.0.1","TCP","66","4444  >  43544 [ACK] Seq=4970 Ack=5603 Win=752 Len=0 TSval=2785239936 TSecr=2785239936","4444","43544"
"2508","2.161230687","127.0.0.1","127.0.0.1","TLSv1.2","539","Application Data","4444","43532"
"2509","2.161263442","127.0.0.1","127.0.0.1","TCP","66","43532  >  4444 [ACK] Seq=5533 Ack=4948 Win=697 Len=0 TSval=2785239952 TSecr=2785239952","43532","4444"
"2536","2.168077157","127.0.0.1","127.0.0.1","TLSv1.2","166","Application Data","4444","43532"
"2537","2.168106980","127.0.0.1","127.0.0.1","TCP","66","43532  >  4444 [ACK] Seq=5533 Ack=5048 Win=697 Len=0 TSval=2785239958 TSecr=2785239958","43532","4444"
"2538","2.168327538","127.0.0.1","127.0.0.1","TLSv1.2","144","Application Data","4444","43544"
"2541","2.177389374","127.0.0.1","127.0.0.1","TLSv1.2","135","Application Data","43532","4444"
"2558","2.183300461","127.0.0.1","127.0.0.1","TLSv1.2","637","Application Data","43514","4444"
"2559","2.183325743","127.0.0.1","127.0.0.1","TCP","66","4444  >  43514 [ACK] Seq=4396 Ack=5539 Win=752 Len=0 TSval=2785239974 TSecr=2785239974","4444","43514"
"2616","2.199957466","127.0.0.1","127.0.0.1","TLSv1.2","539","Application Data","4444","43516"
"2617","2.199990361","127.0.0.1","127.0.0.1","TCP","66","43516  >  4444 [ACK] Seq=4968 Ack=4870 Win=697 Len=0 TSval=2785239990 TSecr=2785239990","43516","4444"
"2640","2.206824959","127.0.0.1","127.0.0.1","TLSv1.2","166","Application Data","4444","43516"
"2641","2.206857924","127.0.0.1","127.0.0.1","TCP","66","43516  >  4444 [ACK] Seq=4968 Ack=4970 Win=699 Len=0 TSval=2785239997 TSecr=2785239997","43516","4444"
"2642","2.207046007","127.0.0.1","127.0.0.1","TLSv1.2","144","Application Data","4444","43514"
"2645","2.209202915","127.0.0.1","127.0.0.1","TCP","66","43544  >  4444 [ACK] Seq=5603 Ack=5048 Win=699 Len=0 TSval=2785240000 TSecr=2785239959","43544","4444"
"2646","2.215911030","127.0.0.1","127.0.0.1","TLSv1.2","135","Application Data","43516","4444"
"2652","2.218189602","127.0.0.1","127.0.0.1","TCP","66","4444  >  43532 [ACK] Seq=5048 Ack=5602 Win=752 Len=0 TSval=2785240009 TSecr=2785239968","4444","43532"
"2668","2.247187980","127.0.0.1","127.0.0.1","TCP","66","43514  >  4444 [ACK] Seq=5539 Ack=4474 Win=697 Len=0 TSval=2785240038 TSecr=2785239997","43514","4444"
"2670","2.256226000","127.0.0.1","127.0.0.1","TCP","66","4444  >  43516 [ACK] Seq=4970 Ack=5037 Win=752 Len=0 TSval=2785240047 TSecr=2785240006","4444","43516"
"2671","2.256273562","127.0.0.1","127.0.0.1","TLSv1.2","637","Application Data","43516","4444"
"2672","2.256304921","127.0.0.1","127.0.0.1","TCP","66","4444  >  43516 [ACK] Seq=4970 Ack=5608 Win=752 Len=0 TSval=2785240047 TSecr=2785240047","4444","43516"
"2736","2.272403196","127.0.0.1","127.0.0.1","TLSv1.2","538","Application Data","4444","43514"
"2737","2.272433298","127.0.0.1","127.0.0.1","TCP","66","43514  >  4444 [ACK] Seq=5539 Ack=4946 Win=697 Len=0 TSval=2785240063 TSecr=2785240063","43514","4444"
"2760","2.279229343","127.0.0.1","127.0.0.1","TLSv1.2","165","Application Data","4444","43514"
"2761","2.279259165","127.0.0.1","127.0.0.1","TCP","66","43514  >  4444 [ACK] Seq=5539 Ack=5045 Win=697 Len=0 TSval=2785240070 TSecr=2785240070","43514","4444"
"2762","2.279451717","127.0.0.1","127.0.0.1","TLSv1.2","144","Application Data","4444","43516"
"2765","2.288394404","127.0.0.1","127.0.0.1","TLSv1.2","134","Application Data","43514","4444"
"2782","2.295451726","127.0.0.1","127.0.0.1","TLSv1.2","636","Application Data","43532","4444"
"2783","2.295485529","127.0.0.1","127.0.0.1","TCP","66","4444  >  43532 [ACK] Seq=5048 Ack=6172 Win=752 Len=0 TSval=2785240086 TSecr=2785240086","4444","43532"
"2840","2.312590357","127.0.0.1","127.0.0.1","TLSv1.2","538","Application Data","4444","43544"
"2841","2.312622763","127.0.0.1","127.0.0.1","TCP","66","43544  >  4444 [ACK] Seq=5603 Ack=5520 Win=697 Len=0 TSval=2785240103 TSecr=2785240103","43544","4444"
"2864","2.319075049","127.0.0.1","127.0.0.1","TLSv1.2","165","Application Data","4444","43544"
"2865","2.319092300","127.0.0.1","127.0.0.1","TCP","66","43544  >  4444 [ACK] Seq=5603 Ack=5619 Win=699 Len=0 TSval=2785240109 TSecr=2785240109","43544","4444"
"2866","2.319210123","127.0.0.1","127.0.0.1","TLSv1.2","144","Application Data","4444","43532"
"2869","2.320176726","127.0.0.1","127.0.0.1","TCP","66","43516  >  4444 [ACK] Seq=5608 Ack=5048 Win=699 Len=0 TSval=2785240111 TSecr=2785240070","43516","4444"
"2870","2.324613603","127.0.0.1","127.0.0.1","TLSv1.2","134","Application Data","43544","4444"
"2886","2.329178848","127.0.0.1","127.0.0.1","TCP","66","4444  >  43514 [ACK] Seq=5045 Ack=5607 Win=752 Len=0 TSval=2785240120 TSecr=2785240079","4444","43514"
"2893","2.361207290","127.0.0.1","127.0.0.1","TCP","66","43532  >  4444 [ACK] Seq=6172 Ack=5126 Win=697 Len=0 TSval=2785240152 TSecr=2785240110","43532","4444"
"2894","2.365185309","127.0.0.1","127.0.0.1","TCP","66","4444  >  43544 [ACK] Seq=5619 Ack=5671 Win=752 Len=0 TSval=2785240156 TSecr=2785240115","4444","43544"
"2895","2.365216808","127.0.0.1","127.0.0.1","TLSv1.2","636","Application Data","43544","4444"
"2896","2.365257944","127.0.0.1","127.0.0.1","TCP","66","4444  >  43544 [ACK] Seq=5619 Ack=6241 Win=752 Len=0 TSval=2785240156 TSecr=2785240156","4444","43544"
"2960","2.382694588","127.0.0.1","127.0.0.1","TLSv1.2","538","Application Data","4444","43532"
"2961","2.382727832","127.0.0.1","127.0.0.1","TCP","66","43532  >  4444 [ACK] Seq=6172 Ack=5598 Win=697 Len=0 TSval=2785240173 TSecr=2785240173","43532","4444"
"2984","2.390306030","127.0.0.1","127.0.0.1","TLSv1.2","165","Application Data","4444","43532"
"2985","2.390338925","127.0.0.1","127.0.0.1","TCP","66","43532  >  4444 [ACK] Seq=6172 Ack=5697 Win=697 Len=0 TSval=2785240181 TSecr=2785240181","43532","4444"
"2986","2.390545167","127.0.0.1","127.0.0.1","TLSv1.2","144","Application Data","4444","43544"
"2989","2.399405580","127.0.0.1","127.0.0.1","TLSv1.2","134","Application Data","43532","4444"
"3008","2.405817429","127.0.0.1","127.0.0.1","TLSv1.2","637","Application Data","43514","4444"
"3009","2.405842711","127.0.0.1","127.0.0.1","TCP","66","4444  >  43514 [ACK] Seq=5045 Ack=6178 Win=752 Len=0 TSval=2785240196 TSecr=2785240196","4444","43514"
"3064","2.420857120","127.0.0.1","127.0.0.1","TLSv1.2","539","Application Data","4444","43516"
"3065","2.420887151","127.0.0.1","127.0.0.1","TCP","66","43516  >  4444 [ACK] Seq=5608 Ack=5521 Win=697 Len=0 TSval=2785240211 TSecr=2785240211","43516","4444"
"3088","2.427478422","127.0.0.1","127.0.0.1","TLSv1.2","165","Application Data","4444","43516"
"3089","2.427684663","127.0.0.1","127.0.0.1","TLSv1.2","144","Application Data","4444","43514"
"3090","2.427736695","127.0.0.1","127.0.0.1","TCP","66","43516  >  4444 [ACK] Seq=5608 Ack=5620 Win=699 Len=0 TSval=2785240218 TSecr=2785240218","43516","4444"
"3093","2.431191883","127.0.0.1","127.0.0.1","TCP","66","43544  >  4444 [ACK] Seq=6241 Ack=5697 Win=699 Len=0 TSval=2785240222 TSecr=2785240181","43544","4444"
"3094","2.436358391","127.0.0.1","127.0.0.1","TLSv1.2","135","Application Data","43516","4444"
"3105","2.440199522","127.0.0.1","127.0.0.1","TCP","66","4444  >  43532 [ACK] Seq=5697 Ack=6240 Win=752 Len=0 TSval=2785240231 TSecr=2785240190","4444","43532"
"3116","2.468182897","127.0.0.1","127.0.0.1","TCP","66","43514  >  4444 [ACK] Seq=6178 Ack=5123 Win=697 Len=0 TSval=2785240259 TSecr=2785240218","43514","4444"
"3123","2.477168187","127.0.0.1","127.0.0.1","TCP","66","4444  >  43516 [ACK] Seq=5620 Ack=5677 Win=752 Len=0 TSval=2785240268 TSecr=2785240227","4444","43516"
"3124","2.477189070","127.0.0.1","127.0.0.1","TLSv1.2","637","Application Data","43516","4444"
"3125","2.477206739","127.0.0.1","127.0.0.1","TCP","66","4444  >  43516 [ACK] Seq=5620 Ack=6248 Win=752 Len=0 TSval=2785240268 TSecr=2785240268","4444","43516"
"3184","2.492311313","127.0.0.1","127.0.0.1","TLSv1.2","539","Application Data","4444","43514"
"3185","2.492340297","127.0.0.1","127.0.0.1","TCP","66","43514  >  4444 [ACK] Seq=6178 Ack=5596 Win=697 Len=0 TSval=2785240283 TSecr=2785240283","43514","4444"
"3208","2.499379460","127.0.0.1","127.0.0.1","TLSv1.2","166","Application Data","4444","43514"
"3209","2.499576203","127.0.0.1","127.0.0.1","TLSv1.2","144","Application Data","4444","43516"
"3210","2.499597784","127.0.0.1","127.0.0.1","TCP","66","43514  >  4444 [ACK] Seq=6178 Ack=5696 Win=697 Len=0 TSval=2785240290 TSecr=2785240290","43514","4444"
"3213","2.508730369","127.0.0.1","127.0.0.1","TLSv1.2","135","Application Data","43514","4444"
"3231","2.515004839","127.0.0.1","127.0.0.1","TLSv1.2","636","Application Data","43532","4444"
"3232","2.515033055","127.0.0.1","127.0.0.1","TCP","66","4444  >  43532 [ACK] Seq=5697 Ack=6810 Win=752 Len=0 TSval=2785240305 TSecr=2785240305","4444","43532"
"3288","2.530281362","127.0.0.1","127.0.0.1","TLSv1.2","538","Application Data","4444","43544"
"3289","2.530313070","127.0.0.1","127.0.0.1","TCP","66","43544  >  4444 [ACK] Seq=6241 Ack=6169 Win=697 Len=0 TSval=2785240321 TSecr=2785240321","43544","4444"
"3312","2.536501426","127.0.0.1","127.0.0.1","TLSv1.2","165","Application Data","4444","43544"
"3313","2.536750550","127.0.0.1","127.0.0.1","TLSv1.2","144","Application Data","4444","43532"
"3314","2.536783445","127.0.0.1","127.0.0.1","TCP","66","43544  >  4444 [ACK] Seq=6241 Ack=6268 Win=699 Len=0 TSval=2785240327 TSecr=2785240327","43544","4444"
"3317","2.540188976","127.0.0.1","127.0.0.1","TCP","66","43516  >  4444 [ACK] Seq=6248 Ack=5698 Win=699 Len=0 TSval=2785240331 TSecr=2785240290","43516","4444"
"3318","2.545826215","127.0.0.1","127.0.0.1","TLSv1.2","134","Application Data","43544","4444"
"3325","2.549193472","127.0.0.1","127.0.0.1","TCP","66","4444  >  43514 [ACK] Seq=5696 Ack=6247 Win=752 Len=0 TSval=2785240340 TSecr=2785240299","4444","43514"
"3343","2.577231044","127.0.0.1","127.0.0.1","TCP","66","43532  >  4444 [ACK] Seq=6810 Ack=5775 Win=697 Len=0 TSval=2785240368 TSecr=2785240327","43532","4444"
"3345","2.586192658","127.0.0.1","127.0.0.1","TCP","66","4444  >  43544 [ACK] Seq=6268 Ack=6309 Win=752 Len=0 TSval=2785240377 TSecr=2785240336","4444","43544"
"3346","2.586222201","127.0.0.1","127.0.0.1","TLSv1.2","636","Application Data","43544","4444"
"3347","2.586261242","127.0.0.1","127.0.0.1","TCP","66","4444  >  43544 [ACK] Seq=6268 Ack=6879 Win=752 Len=0 TSval=2785240377 TSecr=2785240377","4444","43544"
"3406","2.602473917","127.0.0.1","127.0.0.1","TLSv1.2","539","Application Data","4444","43532"
"3408","2.602752933","127.0.0.1","127.0.0.1","TCP","66","43532  >  4444 [ACK] Seq=6810 Ack=6248 Win=697 Len=0 TSval=2785240393 TSecr=2785240393","43532","4444"
"3430","2.609031664","127.0.0.1","127.0.0.1","TLSv1.2","166","Application Data","4444","43532"
"3431","2.609290566","127.0.0.1","127.0.0.1","TLSv1.2","144","Application Data","4444","43544"
"3432","2.609292940","127.0.0.1","127.0.0.1","TCP","66","43532  >  4444 [ACK] Seq=6810 Ack=6348 Win=697 Len=0 TSval=2785240400 TSecr=2785240399","43532","4444"
"3435","2.618229691","127.0.0.1","127.0.0.1","TLSv1.2","135","Application Data","43532","4444"
"3451","2.624951355","127.0.0.1","127.0.0.1","TLSv1.2","637","Application Data","43514","4444"
"3452","2.624980968","127.0.0.1","127.0.0.1","TCP","66","4444  >  43514 [ACK] Seq=5696 Ack=6818 Win=752 Len=0 TSval=2785240415 TSecr=2785240415","4444","43514"
"3510","2.641315865","127.0.0.1","127.0.0.1","TLSv1.2","538","Application Data","4444","43516"
"3512","2.641614646","127.0.0.1","127.0.0.1","TCP","66","43516  >  4444 [ACK] Seq=6248 Ack=6170 Win=699 Len=0 TSval=2785240432 TSecr=2785240432","43516","4444"
"3534","2.648505536","127.0.0.1","127.0.0.1","TLSv1.2","165","Application Data","4444","43516"
"3535","2.648763669","127.0.0.1","127.0.0.1","TLSv1.2","144","Application Data","4444","43514"
"3536","2.648819123","127.0.0.1","127.0.0.1","TCP","66","43516  >  4444 [ACK] Seq=6248 Ack=6269 Win=699 Len=0 TSval=2785240439 TSecr=2785240439","43516","4444"
"3539","2.650183752","127.0.0.1","127.0.0.1","TCP","66","43544  >  4444 [ACK] Seq=6879 Ack=6346 Win=699 Len=0 TSval=2785240441 TSecr=2785240400","43544","4444"
"3540","2.657992007","127.0.0.1","127.0.0.1","TLSv1.2","134","Application Data","43516","4444"
"3543","2.659218839","127.0.0.1","127.0.0.1","TCP","66","4444  >  43532 [ACK] Seq=6348 Ack=6879 Win=752 Len=0 TSval=2785240450 TSecr=2785240409","4444","43532"
"3565","2.689202328","127.0.0.1","127.0.0.1","TCP","66","43514  >  4444 [ACK] Seq=6818 Ack=5774 Win=697 Len=0 TSval=2785240480 TSecr=2785240439","43514","4444"
"3567","2.698189713","127.0.0.1","127.0.0.1","TCP","66","4444  >  43516 [ACK] Seq=6269 Ack=6316 Win=752 Len=0 TSval=2785240489 TSecr=2785240448","4444","43516"
"3568","2.698218069","127.0.0.1","127.0.0.1","TLSv1.2","637","Application Data","43516","4444"
"3569","2.698246913","127.0.0.1","127.0.0.1","TCP","66","4444  >  43516 [ACK] Seq=6269 Ack=6887 Win=752 Len=0 TSval=2785240489 TSecr=2785240489","4444","43516"
"3626","2.714062890","127.0.0.1","127.0.0.1","TLSv1.2","538","Application Data","4444","43514"
"3628","2.714349379","127.0.0.1","127.0.0.1","TCP","66","43514  >  4444 [ACK] Seq=6818 Ack=6246 Win=697 Len=0 TSval=2785240505 TSecr=2785240504","43514","4444"
"3650","2.721375272","127.0.0.1","127.0.0.1","TLSv1.2","165","Application Data","4444","43514"
"3651","2.721560002","127.0.0.1","127.0.0.1","TCP","66","43514  >  4444 [ACK] Seq=6818 Ack=6345 Win=697 Len=0 TSval=2785240512 TSecr=2785240512","43514","4444"
"3652","2.721583958","127.0.0.1","127.0.0.1","TLSv1.2","144","Application Data","4444","43516"
"3655","2.728874759","127.0.0.1","127.0.0.1","TLSv1.2","134","Application Data","43514","4444"
"3670","2.734351851","127.0.0.1","127.0.0.1","TLSv1.2","636","Application Data","43532","4444"
"3671","2.734378251","127.0.0.1","127.0.0.1","TCP","66","4444  >  43532 [ACK] Seq=6348 Ack=7449 Win=752 Len=0 TSval=2785240525 TSecr=2785240525","4444","43532"
"3730","2.750403961","127.0.0.1","127.0.0.1","TLSv1.2","539","Application Data","4444","43544"
