"No.","Time","Source","Destination","Protocol","Length","Info"
"3","0.000036527","127.0.0.1","127.0.0.1","TCP","66","41948  >  8080 [ACK] Seq=1 Ack=1 Win=65536 Len=0 TSval=2302629928 TSecr=2302629928"
"4","0.002152848","127.0.0.1","127.0.0.1","TCP","415","41948  >  8080 [PSH, ACK] Seq=1 Ack=1 Win=65536 Len=349 TSval=2302629931 TSecr=2302629928"
"5","0.002179947","127.0.0.1","127.0.0.1","TCP","66","8080  >  41948 [ACK] Seq=1 Ack=350 Win=65152 Len=0 TSval=2302629931 TSecr=2302629931"
"6","0.004464166","127.0.0.1","127.0.0.1","TCP","1411","8080  >  41948 [PSH, ACK] Seq=1 Ack=350 Win=65536 Len=1345 TSval=2302629933 TSecr=2302629931"
"7","0.004488331","127.0.0.1","127.0.0.1","TCP","66","41948  >  8080 [ACK] Seq=350 Ack=1346 Win=77056 Len=0 TSval=2302629933 TSecr=2302629933"
"8","0.005484473","127.0.0.1","127.0.0.1","TCP","361","41948  >  8080 [PSH, ACK] Seq=350 Ack=1346 Win=77056 Len=295 TSval=2302629934 TSecr=2302629933"
"9","0.009583929","127.0.0.1","127.0.0.1","TCP","831","8080  >  41948 [PSH, ACK] Seq=1346 Ack=645 Win=65536 Len=765 TSval=2302629938 TSecr=2302629934"
"10","0.013530154","127.0.0.1","127.0.0.1","TCP","104","41948  >  8080 [PSH, ACK] Seq=645 Ack=2111 Win=77440 Len=38 TSval=2302629942 TSecr=2302629938"
"11","0.054158537","127.0.0.1","127.0.0.1","TCP","66","8080  >  41948 [ACK] Seq=2111 Ack=683 Win=65536 Len=0 TSval=2302629983 TSecr=2302629942"
"64","8.898324740","127.0.0.1","127.0.0.1","TCP","110","41948  >  8080 [PSH, ACK] Seq=683 Ack=2111 Win=77440 Len=44 TSval=2302638827 TSecr=2302629983"
"65","8.898344225","127.0.0.1","127.0.0.1","TCP","66","8080  >  41948 [ACK] Seq=2111 Ack=727 Win=65536 Len=0 TSval=2302638827 TSecr=2302638827"
"73","8.916431293","127.0.0.1","127.0.0.1","TCP","66","59646  >  8080 [ACK] Seq=1 Ack=1 Win=65536 Len=0 TSval=2302638845 TSecr=2302638845"
"74","8.917414933","127.0.0.1","127.0.0.1","TCP","415","59646  >  8080 [PSH, ACK] Seq=1 Ack=1 Win=65536 Len=349 TSval=2302638846 TSecr=2302638845"
"75","8.917460609","127.0.0.1","127.0.0.1","TCP","66","8080  >  59646 [ACK] Seq=1 Ack=350 Win=65152 Len=0 TSval=2302638846 TSecr=2302638846"
"76","8.918872724","127.0.0.1","127.0.0.1","TCP","1411","8080  >  59646 [PSH, ACK] Seq=1 Ack=350 Win=65536 Len=1345 TSval=2302638847 TSecr=2302638846"
"77","8.918902755","127.0.0.1","127.0.0.1","TCP","66","59646  >  8080 [ACK] Seq=350 Ack=1346 Win=77056 Len=0 TSval=2302638847 TSecr=2302638847"
"82","8.918954088","127.0.0.1","127.0.0.1","TCP","66","59662  >  8080 [ACK] Seq=1 Ack=1 Win=65536 Len=0 TSval=2302638847 TSecr=2302638847"
"83","8.918954088","127.0.0.1","127.0.0.1","TCP","66","59664  >  8080 [ACK] Seq=1 Ack=1 Win=65536 Len=0 TSval=2302638847 TSecr=2302638847"
"86","8.919594111","127.0.0.1","127.0.0.1","TCP","66","59676  >  8080 [ACK] Seq=1 Ack=1 Win=65536 Len=0 TSval=2302638848 TSecr=2302638848"
"87","8.919622327","127.0.0.1","127.0.0.1","TCP","415","59664  >  8080 [PSH, ACK] Seq=1 Ack=1 Win=65536 Len=349 TSval=2302638848 TSecr=2302638847"
"88","8.919622327","127.0.0.1","127.0.0.1","TCP","415","59662  >  8080 [PSH, ACK] Seq=1 Ack=1 Win=65536 Len=349 TSval=2302638848 TSecr=2302638847"
"89","8.919644187","127.0.0.1","127.0.0.1","TCP","66","8080  >  59662 [ACK] Seq=1 Ack=350 Win=65152 Len=0 TSval=2302638848 TSecr=2302638848"
"90","8.919648587","127.0.0.1","127.0.0.1","TCP","66","8080  >  59664 [ACK] Seq=1 Ack=350 Win=65152 Len=0 TSval=2302638848 TSecr=2302638848"
"91","8.919981589","127.0.0.1","127.0.0.1","TCP","415","59676  >  8080 [PSH, ACK] Seq=1 Ack=1 Win=65536 Len=349 TSval=2302638848 TSecr=2302638848"
"92","8.919992484","127.0.0.1","127.0.0.1","TCP","66","8080  >  59676 [ACK] Seq=1 Ack=350 Win=65152 Len=0 TSval=2302638848 TSecr=2302638848"
"93","8.920087118","127.0.0.1","127.0.0.1","TCP","361","59646  >  8080 [PSH, ACK] Seq=350 Ack=1346 Win=77056 Len=295 TSval=2302638848 TSecr=2302638847"
"94","8.921499932","127.0.0.1","127.0.0.1","TCP","1411","8080  >  59664 [PSH, ACK] Seq=1 Ack=350 Win=65536 Len=1345 TSval=2302638850 TSecr=2302638848"
"95","8.921520884","127.0.0.1","127.0.0.1","TCP","66","59664  >  8080 [ACK] Seq=350 Ack=1346 Win=77056 Len=0 TSval=2302638850 TSecr=2302638850"
"96","8.922137580","127.0.0.1","127.0.0.1","TCP","361","59664  >  8080 [PSH, ACK] Seq=350 Ack=1346 Win=77056 Len=295 TSval=2302638851 TSecr=2302638850"
"97","8.922820834","127.0.0.1","127.0.0.1","TCP","831","8080  >  59646 [PSH, ACK] Seq=1346 Ack=645 Win=65536 Len=765 TSval=2302638851 TSecr=2302638848"
"98","8.923854760","127.0.0.1","127.0.0.1","TCP","119","59646  >  8080 [PSH, ACK] Seq=645 Ack=2111 Win=77440 Len=53 TSval=2302638852 TSecr=2302638851"
"99","8.924113591","127.0.0.1","127.0.0.1","TCP","1411","8080  >  59662 [PSH, ACK] Seq=1 Ack=350 Win=65536 Len=1345 TSval=2302638853 TSecr=2302638848"
"100","8.924136079","127.0.0.1","127.0.0.1","TCP","66","59662  >  8080 [ACK] Seq=350 Ack=1346 Win=77056 Len=0 TSval=2302638853 TSecr=2302638853"
"101","8.924820591","127.0.0.1","127.0.0.1","TCP","361","59662  >  8080 [PSH, ACK] Seq=350 Ack=1346 Win=77056 Len=295 TSval=2302638853 TSecr=2302638853"
"102","8.925867158","127.0.0.1","127.0.0.1","TCP","831","8080  >  59664 [PSH, ACK] Seq=1346 Ack=645 Win=65536 Len=765 TSval=2302638854 TSecr=2302638851"
"103","8.926790036","127.0.0.1","127.0.0.1","TCP","119","59664  >  8080 [PSH, ACK] Seq=645 Ack=2111 Win=77440 Len=53 TSval=2302638855 TSecr=2302638854"
"106","8.926890747","127.0.0.1","127.0.0.1","TCP","66","59678  >  8080 [ACK] Seq=1 Ack=1 Win=65536 Len=0 TSval=2302638855 TSecr=2302638855"
"107","8.927295965","127.0.0.1","127.0.0.1","TCP","1411","8080  >  59676 [PSH, ACK] Seq=1 Ack=350 Win=65536 Len=1345 TSval=2302638856 TSecr=2302638848"
"108","8.927321177","127.0.0.1","127.0.0.1","TCP","66","59676  >  8080 [ACK] Seq=350 Ack=1346 Win=77056 Len=0 TSval=2302638856 TSecr=2302638856"
"109","8.928012044","127.0.0.1","127.0.0.1","TCP","361","59676  >  8080 [PSH, ACK] Seq=350 Ack=1346 Win=77056 Len=295 TSval=2302638856 TSecr=2302638856"
"111","8.928351960","127.0.0.1","127.0.0.1","TCP","1901","59646  >  8080 [PSH, ACK] Seq=698 Ack=2111 Win=77440 Len=1835 TSval=2302638857 TSecr=2302638851"
"112","8.928366627","127.0.0.1","127.0.0.1","TCP","66","8080  >  59646 [ACK] Seq=2111 Ack=2533 Win=86272 Len=0 TSval=2302638857 TSecr=2302638852"
"113","8.929000364","127.0.0.1","127.0.0.1","TCP","831","8080  >  59662 [PSH, ACK] Seq=1346 Ack=645 Win=65536 Len=765 TSval=2302638857 TSecr=2302638853"
"114","8.930017947","127.0.0.1","127.0.0.1","TCP","119","59662  >  8080 [PSH, ACK] Seq=645 Ack=2111 Win=77440 Len=53 TSval=2302638858 TSecr=2302638857"
"116","8.930195063","127.0.0.1","127.0.0.1","TCP","831","8080  >  59676 [PSH, ACK] Seq=1346 Ack=645 Win=65536 Len=765 TSval=2302638859 TSecr=2302638856"
"117","8.930332231","127.0.0.1","127.0.0.1","TCP","1903","59664  >  8080 [PSH, ACK] Seq=698 Ack=2111 Win=77440 Len=1837 TSval=2302638859 TSecr=2302638854"
"118","8.930346618","127.0.0.1","127.0.0.1","TCP","66","8080  >  59664 [ACK] Seq=2111 Ack=2535 Win=86272 Len=0 TSval=2302638859 TSecr=2302638855"
"119","8.931459395","127.0.0.1","127.0.0.1","TCP","119","59676  >  8080 [PSH, ACK] Seq=645 Ack=2111 Win=77440 Len=53 TSval=2302638860 TSecr=2302638859"
"122","8.934225237","127.0.0.1","127.0.0.1","TCP","415","59678  >  8080 [PSH, ACK] Seq=1 Ack=1 Win=65536 Len=349 TSval=2302638863 TSecr=2302638855"
"123","8.934241440","127.0.0.1","127.0.0.1","TCP","66","8080  >  59678 [ACK] Seq=1 Ack=350 Win=65152 Len=0 TSval=2302638863 TSecr=2302638863"
"124","8.934264977","127.0.0.1","127.0.0.1","TCP","1904","59662  >  8080 [PSH, ACK] Seq=698 Ack=2111 Win=77440 Len=1838 TSval=2302638863 TSecr=2302638857"
"125","8.934279434","127.0.0.1","127.0.0.1","TCP","66","8080  >  59662 [ACK] Seq=2111 Ack=2536 Win=85632 Len=0 TSval=2302638863 TSecr=2302638858"
"128","8.936831912","127.0.0.1","127.0.0.1","TCP","1903","59676  >  8080 [PSH, ACK] Seq=698 Ack=2111 Win=77440 Len=1837 TSval=2302638865 TSecr=2302638859"
"129","8.936844204","127.0.0.1","127.0.0.1","TCP","66","8080  >  59676 [ACK] Seq=2111 Ack=2535 Win=85632 Len=0 TSval=2302638865 TSecr=2302638860"
"131","8.949425567","127.0.0.1","127.0.0.1","TCP","1411","8080  >  59678 [PSH, ACK] Seq=1 Ack=350 Win=65536 Len=1345 TSval=2302638878 TSecr=2302638863"
"132","8.949445192","127.0.0.1","127.0.0.1","TCP","66","59678  >  8080 [ACK] Seq=350 Ack=1346 Win=77056 Len=0 TSval=2302638878 TSecr=2302638878"
"133","8.950282865","127.0.0.1","127.0.0.1","TCP","361","59678  >  8080 [PSH, ACK] Seq=350 Ack=1346 Win=77056 Len=295 TSval=2302638879 TSecr=2302638878"
"134","8.950993497","127.0.0.1","127.0.0.1","TCP","831","8080  >  59678 [PSH, ACK] Seq=1346 Ack=645 Win=65536 Len=765 TSval=2302638879 TSecr=2302638879"
"135","8.951717050","127.0.0.1","127.0.0.1","TCP","119","59678  >  8080 [PSH, ACK] Seq=645 Ack=2111 Win=77440 Len=53 TSval=2302638880 TSecr=2302638879"
"137","8.954569774","127.0.0.1","127.0.0.1","TCP","1902","59678  >  8080 [PSH, ACK] Seq=698 Ack=2111 Win=77440 Len=1836 TSval=2302638883 TSecr=2302638879"
"138","8.954581088","127.0.0.1","127.0.0.1","TCP","66","8080  >  59678 [ACK] Seq=2111 Ack=2534 Win=86272 Len=0 TSval=2302638883 TSecr=2302638880"
"145","8.957547514","127.0.0.1","127.0.0.1","TCP","114","59662  >  8080 [PSH, ACK] Seq=2536 Ack=2111 Win=77440 Len=48 TSval=2302638886 TSecr=2302638863"
"146","8.957620847","127.0.0.1","127.0.0.1","TCP","114","59646  >  8080 [PSH, ACK] Seq=2533 Ack=2111 Win=77440 Len=48 TSval=2302638886 TSecr=2302638857"
"147","8.957620847","127.0.0.1","127.0.0.1","TCP","114","59678  >  8080 [PSH, ACK] Seq=2534 Ack=2111 Win=77440 Len=48 TSval=2302638886 TSecr=2302638883"
"148","8.958193613","127.0.0.1","127.0.0.1","TCP","114","59664  >  8080 [PSH, ACK] Seq=2535 Ack=2111 Win=77440 Len=48 TSval=2302638887 TSecr=2302638859"
"149","8.958193613","127.0.0.1","127.0.0.1","TCP","114","59676  >  8080 [PSH, ACK] Seq=2535 Ack=2111 Win=77440 Len=48 TSval=2302638887 TSecr=2302638865"
"150","8.960126043","127.0.0.1","127.0.0.1","TCP","504","8080  >  59678 [PSH, ACK] Seq=2111 Ack=2582 Win=86272 Len=438 TSval=2302638889 TSecr=2302638886"
"151","8.960880395","127.0.0.1","127.0.0.1","TCP","504","8080  >  59662 [PSH, ACK] Seq=2111 Ack=2584 Win=85632 Len=438 TSval=2302638889 TSecr=2302638886"
"152","8.961347422","127.0.0.1","127.0.0.1","TCP","504","8080  >  59646 [PSH, ACK] Seq=2111 Ack=2581 Win=86272 Len=438 TSval=2302638890 TSecr=2302638886"
"153","8.961962721","127.0.0.1","127.0.0.1","TCP","504","8080  >  59664 [PSH, ACK] Seq=2111 Ack=2583 Win=86272 Len=438 TSval=2302638890 TSecr=2302638887"
"154","8.962644648","127.0.0.1","127.0.0.1","TCP","504","8080  >  59676 [PSH, ACK] Seq=2111 Ack=2583 Win=85632 Len=438 TSval=2302638891 TSecr=2302638887"
"155","8.965318999","127.0.0.1","127.0.0.1","TCP","713","59662  >  8080 [PSH, ACK] Seq=2584 Ack=2549 Win=77568 Len=647 TSval=2302638894 TSecr=2302638889"
"156","8.966501477","127.0.0.1","127.0.0.1","TCP","720","8080  >  59646 [PSH, ACK] Seq=2549 Ack=2581 Win=86272 Len=654 TSval=2302638895 TSecr=2302638886"
"157","8.966661692","127.0.0.1","127.0.0.1","TCP","713","59678  >  8080 [PSH, ACK] Seq=2582 Ack=2549 Win=77568 Len=647 TSval=2302638895 TSecr=2302638889"
"158","8.967196394","127.0.0.1","127.0.0.1","TCP","720","8080  >  59646 [PSH, ACK] Seq=3203 Ack=2581 Win=86272 Len=654 TSval=2302638896 TSecr=2302638886"
"159","8.967735706","127.0.0.1","127.0.0.1","TCP","615","59646  >  8080 [PSH, ACK] Seq=2581 Ack=3857 Win=76544 Len=549 TSval=2302638896 TSecr=2302638890"
"160","8.968259165","127.0.0.1","127.0.0.1","TCP","622","8080  >  59678 [PSH, ACK] Seq=2549 Ack=3229 Win=87040 Len=556 TSval=2302638897 TSecr=2302638895"
"161","8.969390379","127.0.0.1","127.0.0.1","TCP","713","59664  >  8080 [PSH, ACK] Seq=2583 Ack=2549 Win=77568 Len=647 TSval=2302638898 TSecr=2302638890"
"162","8.969728060","127.0.0.1","127.0.0.1","TCP","649","59676  >  8080 [PSH, ACK] Seq=2583 Ack=2549 Win=77568 Len=583 TSval=2302638898 TSecr=2302638891"
"163","8.970197461","127.0.0.1","127.0.0.1","TCP","720","8080  >  59678 [PSH, ACK] Seq=3105 Ack=3229 Win=87040 Len=654 TSval=2302638899 TSecr=2302638895"
"164","8.970699269","127.0.0.1","127.0.0.1","TCP","656","8080  >  59678 [PSH, ACK] Seq=3759 Ack=3229 Win=87040 Len=590 TSval=2302638899 TSecr=2302638895"
"165","8.971073686","127.0.0.1","127.0.0.1","TCP","66","59678  >  8080 [ACK] Seq=3229 Ack=4349 Win=77568 Len=0 TSval=2302638899 TSecr=2302638897"
"170","9.006138466","127.0.0.1","127.0.0.1","TCP","66","8080  >  59662 [ACK] Seq=2549 Ack=3231 Win=87040 Len=0 TSval=2302638935 TSecr=2302638894"
"171","9.010096774","127.0.0.1","127.0.0.1","TCP","66","8080  >  59676 [ACK] Seq=2549 Ack=3166 Win=87168 Len=0 TSval=2302638939 TSecr=2302638898"
"172","9.010125897","127.0.0.1","127.0.0.1","TCP","66","8080  >  59646 [ACK] Seq=3857 Ack=3130 Win=87168 Len=0 TSval=2302638939 TSecr=2302638896"
"173","9.010183167","127.0.0.1","127.0.0.1","TCP","66","8080  >  59664 [ACK] Seq=2549 Ack=3230 Win=87040 Len=0 TSval=2302638939 TSecr=2302638898"
"174","9.960292912","127.0.0.1","127.0.0.1","TCP","713","59662  >  8080 [PSH, ACK] Seq=3231 Ack=2549 Win=77568 Len=647 TSval=2302639889 TSecr=2302638935"
"175","9.960325807","127.0.0.1","127.0.0.1","TCP","66","8080  >  59662 [ACK] Seq=2549 Ack=3878 Win=87040 Len=0 TSval=2302639889 TSecr=2302639889"
"176","9.960747158","127.0.0.1","127.0.0.1","TCP","453","59678  >  8080 [PSH, ACK] Seq=3229 Ack=4349 Win=77568 Len=387 TSval=2302639889 TSecr=2302638897"
"177","9.960849125","127.0.0.1","127.0.0.1","TCP","421","59646  >  8080 [PSH, ACK] Seq=3130 Ack=3857 Win=77568 Len=355 TSval=2302639889 TSecr=2302638939"
"178","9.960862116","127.0.0.1","127.0.0.1","TCP","66","8080  >  59646 [ACK] Seq=3857 Ack=3485 Win=87296 Len=0 TSval=2302639889 TSecr=2302639889"
"179","9.961206013","127.0.0.1","127.0.0.1","TCP","720","8080  >  59646 [PSH, ACK] Seq=3857 Ack=3485 Win=87296 Len=654 TSval=2302639890 TSecr=2302639889"
"180","9.961377612","127.0.0.1","127.0.0.1","TCP","114","59664  >  8080 [PSH, ACK] Seq=3230 Ack=2549 Win=77568 Len=48 TSval=2302639890 TSecr=2302638939"
"181","9.961397028","127.0.0.1","127.0.0.1","TCP","66","8080  >  59664 [ACK] Seq=2549 Ack=3278 Win=87040 Len=0 TSval=2302639890 TSecr=2302639890"
"182","9.962058143","127.0.0.1","127.0.0.1","TCP","460","8080  >  59646 [PSH, ACK] Seq=4511 Ack=3485 Win=87296 Len=394 TSval=2302639890 TSecr=2302639889"
"183","9.962115831","127.0.0.1","127.0.0.1","TCP","66","59646  >  8080 [ACK] Seq=3485 Ack=4905 Win=77568 Len=0 TSval=2302639891 TSecr=2302639890"
"184","9.962525868","127.0.0.1","127.0.0.1","TCP","649","59676  >  8080 [PSH, ACK] Seq=3166 Ack=2549 Win=77568 Len=583 TSval=2302639891 TSecr=2302638939"
"185","9.962552267","127.0.0.1","127.0.0.1","TCP","66","8080  >  59676 [ACK] Seq=2549 Ack=3749 Win=87168 Len=0 TSval=2302639891 TSecr=2302639891"
"186","9.963733278","127.0.0.1","127.0.0.1","TCP","428","8080  >  59678 [PSH, ACK] Seq=4349 Ack=3616 Win=87296 Len=362 TSval=2302639892 TSecr=2302639889"
"187","9.964570323","127.0.0.1","127.0.0.1","TCP","504","8080  >  59664 [PSH, ACK] Seq=2549 Ack=3278 Win=87040 Len=438 TSval=2302639893 TSecr=2302639890"
"188","9.965118085","127.0.0.1","127.0.0.1","TCP","656","8080  >  59678 [PSH, ACK] Seq=4711 Ack=3616 Win=87296 Len=590 TSval=2302639894 TSecr=2302639889"
"189","9.965893949","127.0.0.1","127.0.0.1","TCP","66","59678  >  8080 [ACK] Seq=3616 Ack=5301 Win=77696 Len=0 TSval=2302639894 TSecr=2302639892"
"190","9.967849566","127.0.0.1","127.0.0.1","TCP","615","59664  >  8080 [PSH, ACK] Seq=3278 Ack=2987 Win=77568 Len=549 TSval=2302639896 TSecr=2302639893"
"191","9.968979383","127.0.0.1","127.0.0.1","TCP","622","8080  >  59676 [PSH, ACK] Seq=2549 Ack=3749 Win=87168 Len=556 TSval=2302639897 TSecr=2302639891"
"192","10.010129338","127.0.0.1","127.0.0.1","TCP","66","59676  >  8080 [ACK] Seq=3749 Ack=3105 Win=77568 Len=0 TSval=2302639939 TSecr=2302639897"
"193","10.010134576","127.0.0.1","127.0.0.1","TCP","66","8080  >  59664 [ACK] Seq=2987 Ack=3827 Win=87168 Len=0 TSval=2302639939 TSecr=2302639896"
"194","10.963381853","127.0.0.1","127.0.0.1","TCP","114","59646  >  8080 [PSH, ACK] Seq=3485 Ack=4905 Win=77568 Len=48 TSval=2302640892 TSecr=2302639890"
"195","10.963487802","127.0.0.1","127.0.0.1","TCP","114","59678  >  8080 [PSH, ACK] Seq=3616 Ack=5301 Win=77696 Len=48 TSval=2302640892 TSecr=2302639892"
"196","10.963611141","127.0.0.1","127.0.0.1","TCP","681","59662  >  8080 [PSH, ACK] Seq=3878 Ack=2549 Win=77568 Len=615 TSval=2302640892 TSecr=2302639889"
"197","10.963632722","127.0.0.1","127.0.0.1","TCP","66","8080  >  59662 [ACK] Seq=2549 Ack=4493 Win=87168 Len=0 TSval=2302640892 TSecr=2302640892"
"198","10.963879051","127.0.0.1","127.0.0.1","TCP","615","59664  >  8080 [PSH, ACK] Seq=3827 Ack=2987 Win=77568 Len=549 TSval=2302640892 TSecr=2302639939"
"199","10.963896162","127.0.0.1","127.0.0.1","TCP","66","8080  >  59664 [ACK] Seq=2987 Ack=4376 Win=87168 Len=0 TSval=2302640892 TSecr=2302640892"
"200","10.964316745","127.0.0.1","127.0.0.1","TCP","504","8080  >  59646 [PSH, ACK] Seq=4905 Ack=3533 Win=87296 Len=438 TSval=2302640893 TSecr=2302640892"
"201","10.965043230","127.0.0.1","127.0.0.1","TCP","504","8080  >  59678 [PSH, ACK] Seq=5301 Ack=3664 Win=87296 Len=438 TSval=2302640893 TSecr=2302640892"
"202","10.965762034","127.0.0.1","127.0.0.1","TCP","688","8080  >  59646 [PSH, ACK] Seq=5343 Ack=3533 Win=87296 Len=622 TSval=2302640894 TSecr=2302640892"
"203","10.966229968","127.0.0.1","127.0.0.1","TCP","615","59676  >  8080 [PSH, ACK] Seq=3749 Ack=3105 Win=77568 Len=549 TSval=2302640895 TSecr=2302639897"
"204","10.966569395","127.0.0.1","127.0.0.1","TCP","622","8080  >  59676 [PSH, ACK] Seq=3105 Ack=4298 Win=87168 Len=556 TSval=2302640895 TSecr=2302640895"
"205","10.966590906","127.0.0.1","127.0.0.1","TCP","66","59676  >  8080 [ACK] Seq=4298 Ack=3661 Win=77568 Len=0 TSval=2302640895 TSecr=2302640895"
"206","10.966886683","127.0.0.1","127.0.0.1","TCP","583","59646  >  8080 [PSH, ACK] Seq=3533 Ack=5965 Win=77440 Len=517 TSval=2302640895 TSecr=2302640893"
"207","10.967010162","127.0.0.1","127.0.0.1","TCP","622","8080  >  59678 [PSH, ACK] Seq=5739 Ack=3664 Win=87296 Len=556 TSval=2302640895 TSecr=2302640892"
"208","10.968039408","127.0.0.1","127.0.0.1","TCP","590","8080  >  59664 [PSH, ACK] Seq=2987 Ack=4376 Win=87168 Len=524 TSval=2302640896 TSecr=2302640892"
"209","10.968059104","127.0.0.1","127.0.0.1","TCP","681","59678  >  8080 [PSH, ACK] Seq=3664 Ack=6295 Win=77568 Len=615 TSval=2302640896 TSecr=2302640893"
"210","10.968472492","127.0.0.1","127.0.0.1","TCP","688","8080  >  59662 [PSH, ACK] Seq=2549 Ack=4493 Win=87168 Len=622 TSval=2302640897 TSecr=2302640892"
"211","11.010121391","127.0.0.1","127.0.0.1","TCP","66","8080  >  59678 [ACK] Seq=6295 Ack=4279 Win=87296 Len=0 TSval=2302640939 TSecr=2302640896"
"212","11.010143391","127.0.0.1","127.0.0.1","TCP","66","8080  >  59646 [ACK] Seq=5965 Ack=4050 Win=87296 Len=0 TSval=2302640939 TSecr=2302640895"
"213","11.010147651","127.0.0.1","127.0.0.1","TCP","66","59662  >  8080 [ACK] Seq=4493 Ack=3171 Win=77568 Len=0 TSval=2302640939 TSecr=2302640897"
"214","11.010173003","127.0.0.1","127.0.0.1","TCP","66","59664  >  8080 [ACK] Seq=4376 Ack=3511 Win=77568 Len=0 TSval=2302640939 TSecr=2302640896"
"215","11.965861288","127.0.0.1","127.0.0.1","TCP","114","59646  >  8080 [PSH, ACK] Seq=4050 Ack=5965 Win=77568 Len=48 TSval=2302641894 TSecr=2302640939"
"216","11.965886082","127.0.0.1","127.0.0.1","TCP","66","8080  >  59646 [ACK] Seq=5965 Ack=4098 Win=87296 Len=0 TSval=2302641894 TSecr=2302641894"
"217","11.966033516","127.0.0.1","127.0.0.1","TCP","114","59662  >  8080 [PSH, ACK] Seq=4493 Ack=3171 Win=77568 Len=48 TSval=2302641894 TSecr=2302640897"
"218","11.966147986","127.0.0.1","127.0.0.1","TCP","615","59664  >  8080 [PSH, ACK] Seq=4376 Ack=3511 Win=77568 Len=549 TSval=2302641895 TSecr=2302640896"
"219","11.966162862","127.0.0.1","127.0.0.1","TCP","114","59678  >  8080 [PSH, ACK] Seq=4279 Ack=6295 Win=77696 Len=48 TSval=2302641895 TSecr=2302640939"
"220","11.966174735","127.0.0.1","127.0.0.1","TCP","66","8080  >  59678 [ACK] Seq=6295 Ack=4327 Win=87296 Len=0 TSval=2302641895 TSecr=2302641895"
"221","11.967106763","127.0.0.1","127.0.0.1","TCP","504","8080  >  59646 [PSH, ACK] Seq=5965 Ack=4098 Win=87296 Len=438 TSval=2302641896 TSecr=2302641894"
"222","11.968108562","127.0.0.1","127.0.0.1","TCP","504","8080  >  59662 [PSH, ACK] Seq=3171 Ack=4541 Win=87168 Len=438 TSval=2302641897 TSecr=2302641894"
"223","11.968137895","127.0.0.1","127.0.0.1","TCP","66","59662  >  8080 [ACK] Seq=4541 Ack=3609 Win=77568 Len=0 TSval=2302641897 TSecr=2302641897"
"224","11.968523068","127.0.0.1","127.0.0.1","TCP","114","59676  >  8080 [PSH, ACK] Seq=4298 Ack=3661 Win=77568 Len=48 TSval=2302641897 TSecr=2302640895"
"225","11.969171262","127.0.0.1","127.0.0.1","TCP","622","8080  >  59678 [PSH, ACK] Seq=6295 Ack=4327 Win=87296 Len=556 TSval=2302641898 TSecr=2302641895"
"226","11.970475961","127.0.0.1","127.0.0.1","TCP","504","8080  >  59678 [PSH, ACK] Seq=6851 Ack=4327 Win=87296 Len=438 TSval=2302641899 TSecr=2302641895"
"227","11.970756163","127.0.0.1","127.0.0.1","TCP","649","59646  >  8080 [PSH, ACK] Seq=4098 Ack=6403 Win=77568 Len=583 TSval=2302641899 TSecr=2302641896"
"228","11.971258669","127.0.0.1","127.0.0.1","TCP","66","59678  >  8080 [ACK] Seq=4327 Ack=7289 Win=77696 Len=0 TSval=2302641900 TSecr=2302641898"
"229","11.971575677","127.0.0.1","127.0.0.1","TCP","504","8080  >  59676 [PSH, ACK] Seq=3661 Ack=4346 Win=87168 Len=438 TSval=2302641900 TSecr=2302641897"
"230","11.971605290","127.0.0.1","127.0.0.1","TCP","66","59676  >  8080 [ACK] Seq=4346 Ack=4099 Win=77568 Len=0 TSval=2302641900 TSecr=2302641900"
"231","11.972211160","127.0.0.1","127.0.0.1","TCP","656","8080  >  59676 [PSH, ACK] Seq=4099 Ack=4346 Win=87168 Len=590 TSval=2302641901 TSecr=2302641900"
"232","11.972228760","127.0.0.1","127.0.0.1","TCP","66","59676  >  8080 [ACK] Seq=4346 Ack=4689 Win=77056 Len=0 TSval=2302641901 TSecr=2302641901"
"233","11.972409159","127.0.0.1","127.0.0.1","TCP","681","59662  >  8080 [PSH, ACK] Seq=4541 Ack=3609 Win=77568 Len=615 TSval=2302641901 TSecr=2302641897"
"234","11.972904053","127.0.0.1","127.0.0.1","TCP","688","8080  >  59678 [PSH, ACK] Seq=7289 Ack=4327 Win=87296 Len=622 TSval=2302641901 TSecr=2302641900"
"235","11.973246622","127.0.0.1","127.0.0.1","TCP","615","59678  >  8080 [PSH, ACK] Seq=4327 Ack=7911 Win=77184 Len=549 TSval=2302641902 TSecr=2302641901"
"236","11.973810309","127.0.0.1","127.0.0.1","TCP","622","8080  >  59664 [PSH, ACK] Seq=3511 Ack=4925 Win=87168 Len=556 TSval=2302641902 TSecr=2302641895"
"237","11.973836430","127.0.0.1","127.0.0.1","TCP","66","59664  >  8080 [ACK] Seq=4925 Ack=4067 Win=77568 Len=0 TSval=2302641902 TSecr=2302641902"
"238","11.984018406","127.0.0.1","127.0.0.1","TCP","453","59676  >  8080 [PSH, ACK] Seq=4346 Ack=4689 Win=77056 Len=387 TSval=2302641912 TSecr=2302641901"
"239","11.985216947","127.0.0.1","127.0.0.1","TCP","460","8080  >  59646 [PSH, ACK] Seq=6403 Ack=4681 Win=87296 Len=394 TSval=2302641914 TSecr=2302641899"
"240","12.014330996","127.0.0.1","127.0.0.1","TCP","66","8080  >  59678 [ACK] Seq=7911 Ack=4876 Win=87296 Len=0 TSval=2302641943 TSecr=2302641902"
"241","12.014341752","127.0.0.1","127.0.0.1","TCP","66","8080  >  59662 [ACK] Seq=3609 Ack=5156 Win=87168 Len=0 TSval=2302641943 TSecr=2302641901"
"242","12.026138521","127.0.0.1","127.0.0.1","TCP","66","8080  >  59676 [ACK] Seq=4689 Ack=4733 Win=87296 Len=0 TSval=2302641955 TSecr=2302641912"
"243","12.030295247","127.0.0.1","127.0.0.1","TCP","66","59646  >  8080 [ACK] Seq=4681 Ack=6797 Win=77568 Len=0 TSval=2302641959 TSecr=2302641914"
"244","12.969081872","127.0.0.1","127.0.0.1","TCP","421","59646  >  8080 [PSH, ACK] Seq=4681 Ack=6797 Win=77568 Len=355 TSval=2302642897 TSecr=2302641914"
"245","12.969920802","127.0.0.1","127.0.0.1","TCP","583","59678  >  8080 [PSH, ACK] Seq=4876 Ack=7911 Win=77184 Len=517 TSval=2302642898 TSecr=2302641943"
"246","12.969920802","127.0.0.1","127.0.0.1","TCP","615","59662  >  8080 [PSH, ACK] Seq=5156 Ack=3609 Win=77568 Len=549 TSval=2302642898 TSecr=2302641943"
"247","12.969946992","127.0.0.1","127.0.0.1","TCP","66","8080  >  59678 [ACK] Seq=7911 Ack=5393 Win=87168 Len=0 TSval=2302642898 TSecr=2302642898"
"248","12.969951252","127.0.0.1","127.0.0.1","TCP","66","8080  >  59662 [ACK] Seq=3609 Ack=5705 Win=87168 Len=0 TSval=2302642898 TSecr=2302642898"
"249","12.969970529","127.0.0.1","127.0.0.1","TCP","428","8080  >  59678 [PSH, ACK] Seq=7911 Ack=5393 Win=87168 Len=362 TSval=2302642898 TSecr=2302642898"
"250","12.970313448","127.0.0.1","127.0.0.1","TCP","583","59664  >  8080 [PSH, ACK] Seq=4925 Ack=4067 Win=77568 Len=517 TSval=2302642899 TSecr=2302641902"
"251","12.970832785","127.0.0.1","127.0.0.1","TCP","590","8080  >  59664 [PSH, ACK] Seq=4067 Ack=5442 Win=87168 Len=524 TSval=2302642899 TSecr=2302642899"
"252","12.970860442","127.0.0.1","127.0.0.1","TCP","66","59664  >  8080 [ACK] Seq=5442 Ack=4591 Win=77568 Len=0 TSval=2302642899 TSecr=2302642899"
"253","12.971633582","127.0.0.1","127.0.0.1","TCP","622","8080  >  59646 [PSH, ACK] Seq=6797 Ack=5036 Win=87296 Len=556 TSval=2302642900 TSecr=2302642897"
"254","12.971653975","127.0.0.1","127.0.0.1","TCP","66","59646  >  8080 [ACK] Seq=5036 Ack=7353 Win=77568 Len=0 TSval=2302642900 TSecr=2302642900"
"255","12.972040894","127.0.0.1","127.0.0.1","TCP","615","59676  >  8080 [PSH, ACK] Seq=4733 Ack=4689 Win=77056 Len=549 TSval=2302642900 TSecr=2302641955"
"256","12.972069948","127.0.0.1","127.0.0.1","TCP","66","8080  >  59676 [ACK] Seq=4689 Ack=5282 Win=87168 Len=0 TSval=2302642900 TSecr=2302642900"
"257","12.972102285","127.0.0.1","127.0.0.1","TCP","590","8080  >  59676 [PSH, ACK] Seq=4689 Ack=5282 Win=87168 Len=524 TSval=2302642901 TSecr=2302642900"
"258","12.972559603","127.0.0.1","127.0.0.1","TCP","622","8080  >  59678 [PSH, ACK] Seq=8273 Ack=5393 Win=87296 Len=556 TSval=2302642901 TSecr=2302642898"
"259","12.972697679","127.0.0.1","127.0.0.1","TCP","66","59678  >  8080 [ACK] Seq=5393 Ack=8829 Win=76288 Len=0 TSval=2302642901 TSecr=2302642898"
"260","13.014196419","127.0.0.1","127.0.0.1","TCP","66","59676  >  8080 [ACK] Seq=5282 Ack=5213 Win=76544 Len=0 TSval=2302642943 TSecr=2302642901"
"261","13.971930967","127.0.0.1","127.0.0.1","TCP","114","59662  >  8080 [PSH, ACK] Seq=5705 Ack=3609 Win=77568 Len=48 TSval=2302643900 TSecr=2302642898"
"262","13.971964281","127.0.0.1","127.0.0.1","TCP","66","8080  >  59662 [ACK] Seq=3609 Ack=5753 Win=87168 Len=0 TSval=2302643900 TSecr=2302643900"
"263","13.971977132","127.0.0.1","127.0.0.1","TCP","114","59678  >  8080 [PSH, ACK] Seq=5393 Ack=8829 Win=76288 Len=48 TSval=2302643900 TSecr=2302642898"
"264","13.972997299","127.0.0.1","127.0.0.1","TCP","504","8080  >  59662 [PSH, ACK] Seq=3609 Ack=5753 Win=87168 Len=438 TSval=2302643901 TSecr=2302643900"
"265","13.973256898","127.0.0.1","127.0.0.1","TCP","421","59646  >  8080 [PSH, ACK] Seq=5036 Ack=7353 Win=77568 Len=355 TSval=2302643902 TSecr=2302642900"
"266","13.973311235","127.0.0.1","127.0.0.1","TCP","114","59664  >  8080 [PSH, ACK] Seq=5442 Ack=4591 Win=77568 Len=48 TSval=2302643902 TSecr=2302642899"
"267","13.974270430","127.0.0.1","127.0.0.1","TCP","504","8080  >  59678 [PSH, ACK] Seq=8829 Ack=5441 Win=87296 Len=438 TSval=2302643903 TSecr=2302643900"
"268","13.975105938","127.0.0.1","127.0.0.1","TCP","428","8080  >  59678 [PSH, ACK] Seq=9267 Ack=5441 Win=87296 Len=362 TSval=2302643904 TSecr=2302643900"
"269","13.975880055","127.0.0.1","127.0.0.1","TCP","504","8080  >  59664 [PSH, ACK] Seq=4591 Ack=5490 Win=87168 Len=438 TSval=2302643904 TSecr=2302643902"
"270","13.975903871","127.0.0.1","127.0.0.1","TCP","66","59664  >  8080 [ACK] Seq=5490 Ack=5029 Win=77568 Len=0 TSval=2302643904 TSecr=2302643904"
"271","13.976675754","127.0.0.1","127.0.0.1","TCP","649","59678  >  8080 [PSH, ACK] Seq=5441 Ack=9629 Win=75520 Len=583 TSval=2302643905 TSecr=2302643903"
"272","13.976743988","127.0.0.1","127.0.0.1","TCP","649","59676  >  8080 [PSH, ACK] Seq=5282 Ack=5213 Win=76544 Len=583 TSval=2302643905 TSecr=2302642901"
"273","13.977335751","127.0.0.1","127.0.0.1","TCP","656","8080  >  59676 [PSH, ACK] Seq=5213 Ack=5865 Win=87168 Len=590 TSval=2302643906 TSecr=2302643905"
"274","13.977358798","127.0.0.1","127.0.0.1","TCP","66","59676  >  8080 [ACK] Seq=5865 Ack=5803 Win=76032 Len=0 TSval=2302643906 TSecr=2302643906"
"275","13.978205131","127.0.0.1","127.0.0.1","TCP","656","8080  >  59678 [PSH, ACK] Seq=9629 Ack=6024 Win=87296 Len=590 TSval=2302643907 TSecr=2302643905"
"276","13.980201885","127.0.0.1","127.0.0.1","TCP","615","59662  >  8080 [PSH, ACK] Seq=5753 Ack=4047 Win=77568 Len=549 TSval=2302643909 TSecr=2302643901"
"277","13.980886047","127.0.0.1","127.0.0.1","TCP","615","59664  >  8080 [PSH, ACK] Seq=5490 Ack=5029 Win=77568 Len=549 TSval=2302643909 TSecr=2302643904"
"278","13.981133843","127.0.0.1","127.0.0.1","TCP","622","8080  >  59664 [PSH, ACK] Seq=5029 Ack=6039 Win=87168 Len=556 TSval=2302643910 TSecr=2302643909"
"279","13.982512853","127.0.0.1","127.0.0.1","TCP","622","8080  >  59662 [PSH, ACK] Seq=4047 Ack=6302 Win=87168 Len=556 TSval=2302643911 TSecr=2302643909"
"280","14.018131402","127.0.0.1","127.0.0.1","TCP","66","8080  >  59646 [ACK] Seq=7353 Ack=5391 Win=87296 Len=0 TSval=2302643947 TSecr=2302643902"
"281","14.022112687","127.0.0.1","127.0.0.1","TCP","66","59664  >  8080 [ACK] Seq=6039 Ack=5585 Win=77568 Len=0 TSval=2302643951 TSecr=2302643910"
"282","14.022128052","127.0.0.1","127.0.0.1","TCP","66","59678  >  8080 [ACK] Seq=6024 Ack=10219 Win=75008 Len=0 TSval=2302643951 TSecr=2302643907"
"283","14.026133920","127.0.0.1","127.0.0.1","TCP","66","59662  >  8080 [ACK] Seq=6302 Ack=4603 Win=77568 Len=0 TSval=2302643955 TSecr=2302643911"
"284","14.974132214","127.0.0.1","127.0.0.1","TCP","713","59662  >  8080 [PSH, ACK] Seq=6302 Ack=4603 Win=77568 Len=647 TSval=2302644903 TSecr=2302643911"
"285","14.975112851","127.0.0.1","127.0.0.1","TCP","720","8080  >  59678 [PSH, ACK] Seq=10219 Ack=6024 Win=87296 Len=654 TSval=2302644904 TSecr=2302643951"
"286","14.975141905","127.0.0.1","127.0.0.1","TCP","66","59678  >  8080 [ACK] Seq=6024 Ack=10873 Win=74368 Len=0 TSval=2302644904 TSecr=2302644904"
"287","14.975758321","127.0.0.1","127.0.0.1","TCP","421","59664  >  8080 [PSH, ACK] Seq=6039 Ack=5585 Win=77568 Len=355 TSval=2302644904 TSecr=2302643910"
"288","14.975785070","127.0.0.1","127.0.0.1","TCP","649","59678  >  8080 [PSH, ACK] Seq=6024 Ack=10873 Win=74368 Len=583 TSval=2302644904 TSecr=2302644904"
"289","14.976269557","127.0.0.1","127.0.0.1","TCP","453","59646  >  8080 [PSH, ACK] Seq=5391 Ack=7353 Win=77568 Len=387 TSval=2302644905 TSecr=2302643947"
"290","14.976297703","127.0.0.1","127.0.0.1","TCP","66","8080  >  59646 [ACK] Seq=7353 Ack=5778 Win=87296 Len=0 TSval=2302644905 TSecr=2302644905"
"291","14.976930881","127.0.0.1","127.0.0.1","TCP","428","8080  >  59662 [PSH, ACK] Seq=4603 Ack=6949 Win=87168 Len=362 TSval=2302644905 TSecr=2302644903"
"292","14.976959027","127.0.0.1","127.0.0.1","TCP","66","59662  >  8080 [ACK] Seq=6949 Ack=4965 Win=77696 Len=0 TSval=2302644905 TSecr=2302644905"
"293","14.977742084","127.0.0.1","127.0.0.1","TCP","656","8080  >  59664 [PSH, ACK] Seq=5585 Ack=6394 Win=87296 Len=590 TSval=2302644906 TSecr=2302644904"
"294","14.977776865","127.0.0.1","127.0.0.1","TCP","66","59664  >  8080 [ACK] Seq=6394 Ack=6175 Win=77568 Len=0 TSval=2302644906 TSecr=2302644906"
"295","14.978736410","127.0.0.1","127.0.0.1","TCP","460","8080  >  59676 [PSH, ACK] Seq=5803 Ack=5865 Win=87296 Len=394 TSval=2302644907 TSecr=2302643906"
"296","14.978771401","127.0.0.1","127.0.0.1","TCP","66","59676  >  8080 [ACK] Seq=5865 Ack=6197 Win=75648 Len=0 TSval=2302644907 TSecr=2302644907"
"297","14.979983281","127.0.0.1","127.0.0.1","TCP","551","59676  >  8080 [PSH, ACK] Seq=5865 Ack=6197 Win=75648 Len=485 TSval=2302644908 TSecr=2302644907"
"298","14.981309911","127.0.0.1","127.0.0.1","TCP","558","8080  >  59678 [PSH, ACK] Seq=10873 Ack=6607 Win=87296 Len=492 TSval=2302644910 TSecr=2302644904"
"299","15.022173866","127.0.0.1","127.0.0.1","TCP","66","8080  >  59676 [ACK] Seq=6197 Ack=6350 Win=87296 Len=0 TSval=2302644951 TSecr=2302644908"
"300","15.026135036","127.0.0.1","127.0.0.1","TCP","66","59678  >  8080 [ACK] Seq=6607 Ack=11365 Win=73984 Len=0 TSval=2302644955 TSecr=2302644910"
"301","15.977554626","127.0.0.1","127.0.0.1","TCP","615","59662  >  8080 [PSH, ACK] Seq=6949 Ack=4965 Win=77696 Len=549 TSval=2302645906 TSecr=2302644905"
"302","15.978136820","127.0.0.1","127.0.0.1","TCP","114","59664  >  8080 [PSH, ACK] Seq=6394 Ack=6175 Win=77568 Len=48 TSval=2302645907 TSecr=2302644906"
"303","15.978817630","127.0.0.1","127.0.0.1","TCP","622","8080  >  59646 [PSH, ACK] Seq=7353 Ack=5778 Win=87296 Len=556 TSval=2302645907 TSecr=2302644905"
"304","15.978844798","127.0.0.1","127.0.0.1","TCP","66","59646  >  8080 [ACK] Seq=5778 Ack=7909 Win=77568 Len=0 TSval=2302645907 TSecr=2302645907"
"305","15.978984201","127.0.0.1","127.0.0.1","TCP","583","59678  >  8080 [PSH, ACK] Seq=6607 Ack=11365 Win=73984 Len=517 TSval=2302645907 TSecr=2302644910"
"306","15.979526376","127.0.0.1","127.0.0.1","TCP","519","59646  >  8080 [PSH, ACK] Seq=5778 Ack=7909 Win=77568 Len=453 TSval=2302645908 TSecr=2302645907"
"307","15.979551589","127.0.0.1","127.0.0.1","TCP","66","8080  >  59646 [ACK] Seq=7909 Ack=6231 Win=87168 Len=0 TSval=2302645908 TSecr=2302645908"
"308","15.979886616","127.0.0.1","127.0.0.1","TCP","504","8080  >  59664 [PSH, ACK] Seq=6175 Ack=6442 Win=87296 Len=438 TSval=2302645908 TSecr=2302645907"
"309","15.979910920","127.0.0.1","127.0.0.1","TCP","66","59664  >  8080 [ACK] Seq=6442 Ack=6613 Win=77568 Len=0 TSval=2302645908 TSecr=2302645908"
"310","15.980506874","127.0.0.1","127.0.0.1","TCP","590","8080  >  59664 [PSH, ACK] Seq=6613 Ack=6442 Win=87296 Len=524 TSval=2302645909 TSecr=2302645908"
"311","15.980525032","127.0.0.1","127.0.0.1","TCP","66","59664  >  8080 [ACK] Seq=6442 Ack=7137 Win=77568 Len=0 TSval=2302645909 TSecr=2302645909"
"312","15.981138445","127.0.0.1","127.0.0.1","TCP","526","8080  >  59678 [PSH, ACK] Seq=11365 Ack=7124 Win=87296 Len=460 TSval=2302645910 TSecr=2302645907"
"313","15.981173645","127.0.0.1","127.0.0.1","TCP","66","59678  >  8080 [ACK] Seq=7124 Ack=11825 Win=73600 Len=0 TSval=2302645910 TSecr=2302645910"
"314","15.983419591","127.0.0.1","127.0.0.1","TCP","389","59676  >  8080 [PSH, ACK] Seq=6350 Ack=6197 Win=75648 Len=323 TSval=2302645912 TSecr=2302644951"
"315","15.983451090","127.0.0.1","127.0.0.1","TCP","66","8080  >  59676 [ACK] Seq=6197 Ack=6673 Win=87296 Len=0 TSval=2302645912 TSecr=2302645912"
"316","15.984257962","127.0.0.1","127.0.0.1","TCP","396","8080  >  59646 [PSH, ACK] Seq=7909 Ack=6231 Win=87296 Len=330 TSval=2302645913 TSecr=2302645908"
"317","15.987257493","127.0.0.1","127.0.0.1","TCP","583","59664  >  8080 [PSH, ACK] Seq=6442 Ack=7137 Win=77568 Len=517 TSval=2302645916 TSecr=2302645909"
"318","15.988202371","127.0.0.1","127.0.0.1","TCP","590","8080  >  59646 [PSH, ACK] Seq=8239 Ack=6231 Win=87296 Len=524 TSval=2302645917 TSecr=2302645908"
"319","15.988232892","127.0.0.1","127.0.0.1","TCP","66","59646  >  8080 [ACK] Seq=6231 Ack=8763 Win=77568 Len=0 TSval=2302645917 TSecr=2302645913"
"320","16.022114914","127.0.0.1","127.0.0.1","TCP","66","8080  >  59662 [ACK] Seq=4965 Ack=7498 Win=87168 Len=0 TSval=2302645951 TSecr=2302645906"
"321","16.030144461","127.0.0.1","127.0.0.1","TCP","66","8080  >  59664 [ACK] Seq=7137 Ack=6959 Win=87296 Len=0 TSval=2302645959 TSecr=2302645916"
"322","16.979665769","127.0.0.1","127.0.0.1","TCP","421","59662  >  8080 [PSH, ACK] Seq=7498 Ack=4965 Win=77696 Len=355 TSval=2302646908 TSecr=2302645951"
"323","16.979702436","127.0.0.1","127.0.0.1","TCP","66","8080  >  59662 [ACK] Seq=4965 Ack=7853 Win=87296 Len=0 TSval=2302646908 TSecr=2302646908"
"324","16.980768069","127.0.0.1","127.0.0.1","TCP","428","8080  >  59664 [PSH, ACK] Seq=7137 Ack=6959 Win=87296 Len=362 TSval=2302646909 TSecr=2302645916"
"325","16.980970888","127.0.0.1","127.0.0.1","TCP","615","59664  >  8080 [PSH, ACK] Seq=6959 Ack=7499 Win=77696 Len=549 TSval=2302646909 TSecr=2302646909"
"326","16.981010767","127.0.0.1","127.0.0.1","TCP","66","8080  >  59664 [ACK] Seq=7499 Ack=7508 Win=87168 Len=0 TSval=2302646909 TSecr=2302646909"
"327","16.981824065","127.0.0.1","127.0.0.1","TCP","622","8080  >  59646 [PSH, ACK] Seq=8763 Ack=6231 Win=87296 Len=556 TSval=2302646910 TSecr=2302645917"
"328","16.982800372","127.0.0.1","127.0.0.1","TCP","421","59646  >  8080 [PSH, ACK] Seq=6231 Ack=9319 Win=77568 Len=355 TSval=2302646911 TSecr=2302646910"
"329","16.982800372","127.0.0.1","127.0.0.1","TCP","681","59678  >  8080 [PSH, ACK] Seq=7124 Ack=11825 Win=73600 Len=615 TSval=2302646911 TSecr=2302645910"
"330","16.983733168","127.0.0.1","127.0.0.1","TCP","428","8080  >  59664 [PSH, ACK] Seq=7499 Ack=7508 Win=87296 Len=362 TSval=2302646912 TSecr=2302646909"
"331","16.984713875","127.0.0.1","127.0.0.1","TCP","688","8080  >  59664 [PSH, ACK] Seq=7861 Ack=7508 Win=87296 Len=622 TSval=2302646913 TSecr=2302646909"
"332","16.984800757","127.0.0.1","127.0.0.1","TCP","66","59664  >  8080 [ACK] Seq=7508 Ack=8483 Win=77696 Len=0 TSval=2302646913 TSecr=2302646912"
"333","16.986481410","127.0.0.1","127.0.0.1","TCP","453","59676  >  8080 [PSH, ACK] Seq=6673 Ack=6197 Win=75648 Len=387 TSval=2302646915 TSecr=2302645912"
"334","16.986513398","127.0.0.1","127.0.0.1","TCP","66","8080  >  59676 [ACK] Seq=6197 Ack=7060 Win=87296 Len=0 TSval=2302646915 TSecr=2302646915"
"335","16.987200423","127.0.0.1","127.0.0.1","TCP","460","8080  >  59646 [PSH, ACK] Seq=9319 Ack=6586 Win=87296 Len=394 TSval=2302646916 TSecr=2302646911"
"336","17.030100661","127.0.0.1","127.0.0.1","TCP","66","8080  >  59678 [ACK] Seq=11825 Ack=7739 Win=86784 Len=0 TSval=2302646959 TSecr=2302646911"
"337","17.030115049","127.0.0.1","127.0.0.1","TCP","66","59646  >  8080 [ACK] Seq=6586 Ack=9713 Win=77696 Len=0 TSval=2302646959 TSecr=2302646916"
"338","17.983842595","127.0.0.1","127.0.0.1","TCP","519","59664  >  8080 [PSH, ACK] Seq=7508 Ack=8483 Win=77696 Len=453 TSval=2302647912 TSecr=2302646912"
"339","17.984778395","127.0.0.1","127.0.0.1","TCP","114","59646  >  8080 [PSH, ACK] Seq=6586 Ack=9713 Win=77696 Len=48 TSval=2302647913 TSecr=2302646916"
"340","17.985316030","127.0.0.1","127.0.0.1","TCP","389","59662  >  8080 [PSH, ACK] Seq=7853 Ack=4965 Win=77696 Len=323 TSval=2302647914 TSecr=2302646908"
"341","17.985346621","127.0.0.1","127.0.0.1","TCP","66","8080  >  59662 [ACK] Seq=4965 Ack=8176 Win=87296 Len=0 TSval=2302647914 TSecr=2302647914"
"342","17.985806174","127.0.0.1","127.0.0.1","TCP","526","8080  >  59662 [PSH, ACK] Seq=4965 Ack=8176 Win=87296 Len=460 TSval=2302647914 TSecr=2302647914"
"343","17.985835298","127.0.0.1","127.0.0.1","TCP","66","59662  >  8080 [ACK] Seq=8176 Ack=5425 Win=77568 Len=0 TSval=2302647914 TSecr=2302647914"
"344","17.986019050","127.0.0.1","127.0.0.1","TCP","583","59678  >  8080 [PSH, ACK] Seq=7739 Ack=11825 Win=73600 Len=517 TSval=2302647914 TSecr=2302646959"
"345","17.986044332","127.0.0.1","127.0.0.1","TCP","66","8080  >  59678 [ACK] Seq=11825 Ack=8256 Win=86272 Len=0 TSval=2302647914 TSecr=2302647914"
"346","17.987008277","127.0.0.1","127.0.0.1","TCP","504","8080  >  59646 [PSH, ACK] Seq=9713 Ack=6634 Win=87296 Len=438 TSval=2302647915 TSecr=2302647913"
"347","17.987038099","127.0.0.1","127.0.0.1","TCP","66","59646  >  8080 [ACK] Seq=6634 Ack=10151 Win=77568 Len=0 TSval=2302647915 TSecr=2302647915"
"348","17.987528523","127.0.0.1","127.0.0.1","TCP","396","8080  >  59664 [PSH, ACK] Seq=8483 Ack=7961 Win=87296 Len=330 TSval=2302647916 TSecr=2302647912"
"349","17.988211079","127.0.0.1","127.0.0.1","TCP","590","8080  >  59664 [PSH, ACK] Seq=8813 Ack=7961 Win=87296 Len=524 TSval=2302647917 TSecr=2302647912"
"350","17.988517890","127.0.0.1","127.0.0.1","TCP","66","59664  >  8080 [ACK] Seq=7961 Ack=9337 Win=77696 Len=0 TSval=2302647917 TSecr=2302647916"
"351","17.989691987","127.0.0.1","127.0.0.1","TCP","421","59676  >  8080 [PSH, ACK] Seq=7060 Ack=6197 Win=75648 Len=355 TSval=2302647918 TSecr=2302646915"
