"No.","Time","Source","Destination","Protocol","Length","Info","src_port","dst_port"
"84","1.357251620","127.0.0.1","127.0.0.1","TLSv1.2","271","Application Data","33380","4444"
"104","1.363195113","127.0.0.1","127.0.0.1","TLSv1.2","207","Application Data","4444","33380"
"105","1.363227519","127.0.0.1","127.0.0.1","TCP","66","33380  >  4444 [ACK] Seq=206 Ack=142 Win=615 Len=0 TSval=2785482350 TSecr=2785482350","33380","4444"
"108","1.364435424","::1","::1","TCP","94","45726  >  4444 [SYN] Seq=0 Win=65476 Len=0 MSS=65476 SACK_PERM TSval=2469697637 TSecr=0 WS=128","45726","4444"
"109","1.364450650","::1","::1","TCP","74","4444  >  45726 [RST, ACK] Seq=1 Ack=1 Win=0 Len=0","4444","45726"
"110","1.365158561","127.0.0.1","127.0.0.1","TLSv1.2","401","Application Data","33366","4444"
"111","1.365192364","127.0.0.1","127.0.0.1","TCP","66","4444  >  33366 [ACK] Seq=1 Ack=336 Win=995 Len=0 TSval=2785482352 TSecr=2785482352","4444","33366"
"194","1.400562851","127.0.0.1","127.0.0.1","TLSv1.2","2395","Application Data","4444","33366"
"195","1.400600915","127.0.0.1","127.0.0.1","TCP","66","33366  >  4444 [ACK] Seq=336 Ack=2330 Win=706 Len=0 TSval=2785482387 TSecr=2785482387","33366","4444"
"206","1.439384056","127.0.0.1","127.0.0.1","TLSv1.2","2841","Application Data","33380","4444"
"265","1.455448737","127.0.0.1","127.0.0.1","TLSv1.2","2193","Application Data","4444","33400"
"266","1.455479747","127.0.0.1","127.0.0.1","TCP","66","33400  >  4444 [ACK] Seq=1 Ack=2128 Win=688 Len=0 TSval=2785482442 TSecr=2785482442","33400","4444"
"292","1.463751678","127.0.0.1","127.0.0.1","TLSv1.2","165","Application Data","4444","33400"
"293","1.463784573","127.0.0.1","127.0.0.1","TCP","66","33400  >  4444 [ACK] Seq=1 Ack=2227 Win=688 Len=0 TSval=2785482450 TSecr=2785482450","33400","4444"
"294","1.463985856","127.0.0.1","127.0.0.1","TLSv1.2","144","Application Data","4444","33380"
"295","1.464013583","127.0.0.1","127.0.0.1","TCP","66","33380  >  4444 [ACK] Seq=2981 Ack=220 Win=615 Len=0 TSval=2785482450 TSecr=2785482450","33380","4444"
"301","1.486642995","127.0.0.1","127.0.0.1","TLSv1.2","134","Application Data","33400","4444"
"324","1.527119229","127.0.0.1","127.0.0.1","TCP","66","4444  >  33400 [ACK] Seq=2227 Ack=69 Win=512 Len=0 TSval=2785482514 TSecr=2785482473","4444","33400"
"325","1.527149331","127.0.0.1","127.0.0.1","TLSv1.2","271","Application Data","33400","4444"
"326","1.527176569","127.0.0.1","127.0.0.1","TCP","66","4444  >  33400 [ACK] Seq=2227 Ack=274 Win=511 Len=0 TSval=2785482514 TSecr=2785482514","4444","33400"
"347","1.532626843","127.0.0.1","127.0.0.1","TLSv1.2","207","Application Data","4444","33400"
"350","1.533920443","::1","::1","TCP","94","45730  >  4444 [SYN] Seq=0 Win=65476 Len=0 MSS=65476 SACK_PERM TSval=2469697806 TSecr=0 WS=128","45730","4444"
"351","1.533940766","::1","::1","TCP","74","4444  >  45730 [RST, ACK] Seq=1 Ack=1 Win=0 Len=0","4444","45730"
"353","1.534492792","127.0.0.1","127.0.0.1","TLSv1.2","401","Application Data","33390","4444"
"354","1.534516049","127.0.0.1","127.0.0.1","TCP","66","4444  >  33390 [ACK] Seq=1 Ack=336 Win=995 Len=0 TSval=2785482521 TSecr=2785482521","4444","33390"
"441","1.567628428","127.0.0.1","127.0.0.1","TLSv1.2","2395","Application Data","4444","33390"
"442","1.567664187","127.0.0.1","127.0.0.1","TCP","66","33390  >  4444 [ACK] Seq=336 Ack=2330 Win=706 Len=0 TSval=2785482554 TSecr=2785482554","33390","4444"
"445","1.573114879","127.0.0.1","127.0.0.1","TCP","66","33400  >  4444 [ACK] Seq=274 Ack=2368 Win=699 Len=0 TSval=2785482560 TSecr=2785482519","33400","4444"
"450","1.602650477","127.0.0.1","127.0.0.1","TLSv1.2","2840","Application Data","33400","4444"
"510","1.614163532","127.0.0.1","127.0.0.1","TLSv1.2","2194","Application Data","4444","33380"
"511","1.614180643","127.0.0.1","127.0.0.1","TCP","66","33380  >  4444 [ACK] Seq=2981 Ack=2348 Win=688 Len=0 TSval=2785482601 TSecr=2785482601","33380","4444"
"535","1.618663406","127.0.0.1","127.0.0.1","TLSv1.2","166","Application Data","4444","33380"
"536","1.618680587","127.0.0.1","127.0.0.1","TCP","66","33380  >  4444 [ACK] Seq=2981 Ack=2448 Win=688 Len=0 TSval=2785482605 TSecr=2785482605","33380","4444"
"537","1.618790028","127.0.0.1","127.0.0.1","TLSv1.2","144","Application Data","4444","33400"
"538","1.618806231","127.0.0.1","127.0.0.1","TCP","66","33400  >  4444 [ACK] Seq=3048 Ack=2446 Win=699 Len=0 TSval=2785482605 TSecr=2785482605","33400","4444"
"541","1.639780126","127.0.0.1","127.0.0.1","TLSv1.2","135","Application Data","33380","4444"
"542","1.640184367","127.0.0.1","127.0.0.1","TLSv1.2","271","Application Data","33338","4444"
"583","1.644615866","127.0.0.1","127.0.0.1","TLSv1.2","207","Application Data","4444","33338"
"584","1.644632139","127.0.0.1","127.0.0.1","TCP","66","33338  >  4444 [ACK] Seq=206 Ack=142 Win=615 Len=0 TSval=2785482631 TSecr=2785482631","33338","4444"
"590","1.645794438","::1","::1","TCP","94","45738  >  4444 [SYN] Seq=0 Win=65476 Len=0 MSS=65476 SACK_PERM TSval=2469697918 TSecr=0 WS=128","45738","4444"
"591","1.645812108","::1","::1","TCP","74","4444  >  45738 [RST, ACK] Seq=1 Ack=1 Win=0 Len=0","4444","45738"
"592","1.646361479","127.0.0.1","127.0.0.1","TLSv1.2","401","Application Data","33328","4444"
"593","1.646389346","127.0.0.1","127.0.0.1","TCP","66","4444  >  33328 [ACK] Seq=1 Ack=336 Win=907 Len=0 TSval=2785482633 TSecr=2785482633","4444","33328"
"674","1.669552346","127.0.0.1","127.0.0.1","TLSv1.2","2398","Application Data","4444","33328"
"675","1.669577558","127.0.0.1","127.0.0.1","TCP","66","33328  >  4444 [ACK] Seq=336 Ack=2333 Win=706 Len=0 TSval=2785482656 TSecr=2785482656","33328","4444"
"678","1.680125826","127.0.0.1","127.0.0.1","TCP","66","4444  >  33380 [ACK] Seq=2448 Ack=3050 Win=739 Len=0 TSval=2785482667 TSecr=2785482626","4444","33380"
"685","1.727531293","127.0.0.1","127.0.0.1","TLSv1.2","2840","Application Data","33338","4444"
"745","1.743505250","127.0.0.1","127.0.0.1","TLSv1.2","2193","Application Data","4444","33354"
"746","1.743529974","127.0.0.1","127.0.0.1","TCP","66","33354  >  4444 [ACK] Seq=1 Ack=2128 Win=688 Len=0 TSval=2785482730 TSecr=2785482730","33354","4444"
"776","1.748764857","127.0.0.1","127.0.0.1","TLSv1.2","166","Application Data","4444","33354"
"777","1.748778965","127.0.0.1","127.0.0.1","TCP","66","33354  >  4444 [ACK] Seq=1 Ack=2228 Win=688 Len=0 TSval=2785482735 TSecr=2785482735","33354","4444"
"778","1.748881213","127.0.0.1","127.0.0.1","TLSv1.2","144","Application Data","4444","33338"
"779","1.748894203","127.0.0.1","127.0.0.1","TCP","66","33338  >  4444 [ACK] Seq=2980 Ack=220 Win=615 Len=0 TSval=2785482735 TSecr=2785482735","33338","4444"
"782","1.762247507","127.0.0.1","127.0.0.1","TLSv1.2","134","Application Data","33354","4444"
"807","1.803098928","127.0.0.1","127.0.0.1","TCP","66","4444  >  33354 [ACK] Seq=2228 Ack=69 Win=512 Len=0 TSval=2785482790 TSecr=2785482749","4444","33354"
"808","1.803179804","127.0.0.1","127.0.0.1","TLSv1.2","271","Application Data","33354","4444"
"809","1.803209347","127.0.0.1","127.0.0.1","TCP","66","4444  >  33354 [ACK] Seq=2228 Ack=274 Win=511 Len=0 TSval=2785482790 TSecr=2785482790","4444","33354"
"831","1.808396458","127.0.0.1","127.0.0.1","TLSv1.2","207","Application Data","4444","33354"
"834","1.809701722","::1","::1","TCP","94","45744  >  4444 [SYN] Seq=0 Win=65476 Len=0 MSS=65476 SACK_PERM TSval=2469698082 TSecr=0 WS=128","45744","4444"
"835","1.809719951","::1","::1","TCP","74","4444  >  45744 [RST, ACK] Seq=1 Ack=1 Win=0 Len=0","4444","45744"
"836","1.810347265","127.0.0.1","127.0.0.1","TLSv1.2","401","Application Data","33322","4444"
"837","1.810376389","127.0.0.1","127.0.0.1","TCP","66","4444  >  33322 [ACK] Seq=1 Ack=336 Win=907 Len=0 TSval=2785482797 TSecr=2785482797","4444","33322"
"919","1.837033268","127.0.0.1","127.0.0.1","TLSv1.2","2396","Application Data","4444","33322"
"920","1.837105764","127.0.0.1","127.0.0.1","TCP","66","33322  >  4444 [ACK] Seq=336 Ack=2331 Win=706 Len=0 TSval=2785482823 TSecr=2785482823","33322","4444"
"927","1.849094299","127.0.0.1","127.0.0.1","TCP","66","33354  >  4444 [ACK] Seq=274 Ack=2369 Win=699 Len=0 TSval=2785482836 TSecr=2785482795","33354","4444"
"933","1.888357180","127.0.0.1","127.0.0.1","TLSv1.2","2841","Application Data","33354","4444"
"994","1.903788610","127.0.0.1","127.0.0.1","TLSv1.2","2194","Application Data","4444","33338"
"995","1.903815150","127.0.0.1","127.0.0.1","TCP","66","33338  >  4444 [ACK] Seq=2980 Ack=2348 Win=688 Len=0 TSval=2785482890 TSecr=2785482890","33338","4444"
"1019","1.911264421","127.0.0.1","127.0.0.1","TLSv1.2","165","Application Data","4444","33338"
"1020","1.911295360","127.0.0.1","127.0.0.1","TCP","66","33338  >  4444 [ACK] Seq=2980 Ack=2447 Win=688 Len=0 TSval=2785482898 TSecr=2785482898","33338","4444"
"1021","1.911475691","127.0.0.1","127.0.0.1","TLSv1.2","144","Application Data","4444","33354"
"1022","1.911504256","127.0.0.1","127.0.0.1","TCP","66","33354  >  4444 [ACK] Seq=3049 Ack=2447 Win=699 Len=0 TSval=2785482898 TSecr=2785482898","33354","4444"
"1025","1.925580975","127.0.0.1","127.0.0.1","TLSv1.2","135","Application Data","33338","4444"
"1041","1.930878296","127.0.0.1","127.0.0.1","TLSv1.2","637","Application Data","33380","4444"
"1042","1.930898690","127.0.0.1","127.0.0.1","TCP","66","4444  >  33380 [ACK] Seq=2448 Ack=3621 Win=752 Len=0 TSval=2785482917 TSecr=2785482917","4444","33380"
"1100","1.944522698","127.0.0.1","127.0.0.1","TLSv1.2","538","Application Data","4444","33400"
"1101","1.944548050","127.0.0.1","127.0.0.1","TCP","66","33400  >  4444 [ACK] Seq=3048 Ack=2918 Win=697 Len=0 TSval=2785482931 TSecr=2785482931","33400","4444"
"1124","1.949728527","127.0.0.1","127.0.0.1","TLSv1.2","165","Application Data","4444","33400"
"1125","1.949749829","127.0.0.1","127.0.0.1","TCP","66","33400  >  4444 [ACK] Seq=3048 Ack=3017 Win=699 Len=0 TSval=2785482936 TSecr=2785482936","33400","4444"
"1126","1.949886718","127.0.0.1","127.0.0.1","TLSv1.2","144","Application Data","4444","33380"
"1133","1.958836319","127.0.0.1","127.0.0.1","TLSv1.2","134","Application Data","33400","4444"
"1152","1.966106028","127.0.0.1","127.0.0.1","TCP","66","4444  >  33338 [ACK] Seq=2447 Ack=3049 Win=739 Len=0 TSval=2785482953 TSecr=2785482912","4444","33338"
"1155","1.990101535","127.0.0.1","127.0.0.1","TCP","66","33380  >  4444 [ACK] Seq=3621 Ack=2526 Win=688 Len=0 TSval=2785482977 TSecr=2785482936","33380","4444"
"1158","1.999106730","127.0.0.1","127.0.0.1","TCP","66","4444  >  33400 [ACK] Seq=3017 Ack=3116 Win=739 Len=0 TSval=2785482986 TSecr=2785482945","4444","33400"
"1159","1.999138578","127.0.0.1","127.0.0.1","TLSv1.2","636","Application Data","33400","4444"
"1160","1.999162952","127.0.0.1","127.0.0.1","TCP","66","4444  >  33400 [ACK] Seq=3017 Ack=3686 Win=752 Len=0 TSval=2785482986 TSecr=2785482986","4444","33400"
"1222","2.013828853","127.0.0.1","127.0.0.1","TLSv1.2","539","Application Data","4444","33380"
"1223","2.013854345","127.0.0.1","127.0.0.1","TCP","66","33380  >  4444 [ACK] Seq=3621 Ack=2999 Win=697 Len=0 TSval=2785483000 TSecr=2785483000","33380","4444"
"1247","2.019924041","127.0.0.1","127.0.0.1","TLSv1.2","165","Application Data","4444","33380"
"1248","2.019950581","127.0.0.1","127.0.0.1","TCP","66","33380  >  4444 [ACK] Seq=3621 Ack=3098 Win=697 Len=0 TSval=2785483006 TSecr=2785483006","33380","4444"
"1249","2.020137755","127.0.0.1","127.0.0.1","TLSv1.2","144","Application Data","4444","33400"
"1252","2.028258969","127.0.0.1","127.0.0.1","TLSv1.2","135","Application Data","33380","4444"
"1268","2.034236125","127.0.0.1","127.0.0.1","TLSv1.2","636","Application Data","33338","4444"
"1269","2.034271395","127.0.0.1","127.0.0.1","TCP","66","4444  >  33338 [ACK] Seq=2447 Ack=3619 Win=752 Len=0 TSval=2785483021 TSecr=2785483021","4444","33338"
"1327","2.048260603","127.0.0.1","127.0.0.1","TLSv1.2","538","Application Data","4444","33354"
"1328","2.048293917","127.0.0.1","127.0.0.1","TCP","66","33354  >  4444 [ACK] Seq=3049 Ack=2919 Win=697 Len=0 TSval=2785483035 TSecr=2785483035","33354","4444"
"1355","2.054813391","127.0.0.1","127.0.0.1","TLSv1.2","166","Application Data","4444","33354"
"1356","2.054835042","127.0.0.1","127.0.0.1","TCP","66","33354  >  4444 [ACK] Seq=3049 Ack=3019 Win=699 Len=0 TSval=2785483041 TSecr=2785483041","33354","4444"
"1357","2.054959988","127.0.0.1","127.0.0.1","TLSv1.2","144","Application Data","4444","33338"
"1360","2.061112376","127.0.0.1","127.0.0.1","TCP","66","33400  >  4444 [ACK] Seq=3686 Ack=3095 Win=699 Len=0 TSval=2785483048 TSecr=2785483007","33400","4444"
"1361","2.064562046","127.0.0.1","127.0.0.1","TLSv1.2","134","Application Data","33354","4444"
"1373","2.069114650","127.0.0.1","127.0.0.1","TCP","66","4444  >  33380 [ACK] Seq=3098 Ack=3690 Win=752 Len=0 TSval=2785483056 TSecr=2785483015","4444","33380"
"1384","2.095077028","127.0.0.1","127.0.0.1","TCP","66","33338  >  4444 [ACK] Seq=3619 Ack=2525 Win=688 Len=0 TSval=2785483082 TSecr=2785483041","33338","4444"
"1386","2.105091499","127.0.0.1","127.0.0.1","TCP","66","4444  >  33354 [ACK] Seq=3019 Ack=3117 Win=739 Len=0 TSval=2785483092 TSecr=2785483051","4444","33354"
"1387","2.105110147","127.0.0.1","127.0.0.1","TLSv1.2","637","Application Data","33354","4444"
"1388","2.105129702","127.0.0.1","127.0.0.1","TCP","66","4444  >  33354 [ACK] Seq=3019 Ack=3688 Win=752 Len=0 TSval=2785483092 TSecr=2785483092","4444","33354"
"1450","2.120820873","127.0.0.1","127.0.0.1","TLSv1.2","538","Application Data","4444","33338"
"1451","2.120853768","127.0.0.1","127.0.0.1","TCP","66","33338  >  4444 [ACK] Seq=3619 Ack=2997 Win=697 Len=0 TSval=2785483107 TSecr=2785483107","33338","4444"
"1475","2.127788658","127.0.0.1","127.0.0.1","TLSv1.2","165","Application Data","4444","33338"
"1476","2.127817362","127.0.0.1","127.0.0.1","TCP","66","33338  >  4444 [ACK] Seq=3619 Ack=3096 Win=697 Len=0 TSval=2785483114 TSecr=2785483114","33338","4444"
"1477","2.128005864","127.0.0.1","127.0.0.1","TLSv1.2","144","Application Data","4444","33354"
"1480","2.136667649","127.0.0.1","127.0.0.1","TLSv1.2","134","Application Data","33338","4444"
"1496","2.142881847","127.0.0.1","127.0.0.1","TLSv1.2","637","Application Data","33380","4444"
"1497","2.142908177","127.0.0.1","127.0.0.1","TCP","66","4444  >  33380 [ACK] Seq=3098 Ack=4261 Win=752 Len=0 TSval=2785483129 TSecr=2785483129","4444","33380"
"1559","2.156345639","127.0.0.1","127.0.0.1","TLSv1.2","538","Application Data","4444","33400"
"1560","2.156374693","127.0.0.1","127.0.0.1","TCP","66","33400  >  4444 [ACK] Seq=3686 Ack=3567 Win=697 Len=0 TSval=2785483143 TSecr=2785483143","33400","4444"
"1583","2.162911138","127.0.0.1","127.0.0.1","TLSv1.2","166","Application Data","4444","33400"
"1584","2.162943545","127.0.0.1","127.0.0.1","TCP","66","33400  >  4444 [ACK] Seq=3686 Ack=3667 Win=699 Len=0 TSval=2785483149 TSecr=2785483149","33400","4444"
"1585","2.163179119","127.0.0.1","127.0.0.1","TLSv1.2","144","Application Data","4444","33380"
"1588","2.168108517","127.0.0.1","127.0.0.1","TCP","66","33354  >  4444 [ACK] Seq=3688 Ack=3097 Win=699 Len=0 TSval=2785483155 TSecr=2785483114","33354","4444"
"1589","2.171994835","127.0.0.1","127.0.0.1","TLSv1.2","134","Application Data","33400","4444"
"1603","2.177105820","127.0.0.1","127.0.0.1","TCP","66","4444  >  33338 [ACK] Seq=3096 Ack=3687 Win=752 Len=0 TSval=2785483164 TSecr=2785483123","4444","33338"
"1612","2.204112185","127.0.0.1","127.0.0.1","TCP","66","33380  >  4444 [ACK] Seq=4261 Ack=3176 Win=697 Len=0 TSval=2785483191 TSecr=2785483150","33380","4444"
"1614","2.212101678","127.0.0.1","127.0.0.1","TCP","66","4444  >  33400 [ACK] Seq=3667 Ack=3754 Win=752 Len=0 TSval=2785483199 TSecr=2785483158","4444","33400"
"1615","2.212125703","127.0.0.1","127.0.0.1","TLSv1.2","636","Application Data","33400","4444"
"1616","2.212138833","127.0.0.1","127.0.0.1","TCP","66","4444  >  33400 [ACK] Seq=3667 Ack=4324 Win=752 Len=0 TSval=2785483199 TSecr=2785483199","4444","33400"
"1676","2.228626823","127.0.0.1","127.0.0.1","TLSv1.2","538","Application Data","4444","33380"
"1677","2.228659229","127.0.0.1","127.0.0.1","TCP","66","33380  >  4444 [ACK] Seq=4261 Ack=3648 Win=697 Len=0 TSval=2785483215 TSecr=2785483215","33380","4444"
"1701","2.236272837","127.0.0.1","127.0.0.1","TLSv1.2","165","Application Data","4444","33380"
"1702","2.236303846","127.0.0.1","127.0.0.1","TCP","66","33380  >  4444 [ACK] Seq=4261 Ack=3747 Win=697 Len=0 TSval=2785483223 TSecr=2785483223","33380","4444"
"1703","2.236524754","127.0.0.1","127.0.0.1","TLSv1.2","144","Application Data","4444","33400"
"1706","2.243701644","127.0.0.1","127.0.0.1","TLSv1.2","134","Application Data","33380","4444"
"1720","2.248473340","127.0.0.1","127.0.0.1","TLSv1.2","636","Application Data","33338","4444"
"1721","2.248501975","127.0.0.1","127.0.0.1","TCP","66","4444  >  33338 [ACK] Seq=3096 Ack=4257 Win=752 Len=0 TSval=2785483235 TSecr=2785483235","4444","33338"
"1785","2.264767799","127.0.0.1","127.0.0.1","TLSv1.2","539","Application Data","4444","33354"
"1786","2.264802091","127.0.0.1","127.0.0.1","TCP","66","33354  >  4444 [ACK] Seq=3688 Ack=3570 Win=697 Len=0 TSval=2785483251 TSecr=2785483251","33354","4444"
"1809","2.271958657","127.0.0.1","127.0.0.1","TLSv1.2","165","Application Data","4444","33354"
"1810","2.271990155","127.0.0.1","127.0.0.1","TCP","66","33354  >  4444 [ACK] Seq=3688 Ack=3669 Win=699 Len=0 TSval=2785483258 TSecr=2785483258","33354","4444"
"1811","2.272214625","127.0.0.1","127.0.0.1","TLSv1.2","144","Application Data","4444","33338"
"1814","2.278128855","127.0.0.1","127.0.0.1","TCP","66","33400  >  4444 [ACK] Seq=4324 Ack=3745 Win=699 Len=0 TSval=2785483265 TSecr=2785483223","33400","4444"
"1815","2.278926302","127.0.0.1","127.0.0.1","TLSv1.2","135","Application Data","33354","4444"
"1834","2.285089865","127.0.0.1","127.0.0.1","TCP","66","4444  >  33380 [ACK] Seq=3747 Ack=4329 Win=752 Len=0 TSval=2785483272 TSecr=2785483230","4444","33380"
"1838","2.313120732","127.0.0.1","127.0.0.1","TCP","66","33338  >  4444 [ACK] Seq=4257 Ack=3174 Win=697 Len=0 TSval=2785483300 TSecr=2785483259","33338","4444"
"1840","2.319119330","127.0.0.1","127.0.0.1","TCP","66","4444  >  33354 [ACK] Seq=3669 Ack=3757 Win=752 Len=0 TSval=2785483306 TSecr=2785483265","4444","33354"
"1841","2.319150828","127.0.0.1","127.0.0.1","TLSv1.2","637","Application Data","33354","4444"
"1842","2.319182326","127.0.0.1","127.0.0.1","TCP","66","4444  >  33354 [ACK] Seq=3669 Ack=4328 Win=752 Len=0 TSval=2785483306 TSecr=2785483306","4444","33354"
"1904","2.335519808","127.0.0.1","127.0.0.1","TLSv1.2","539","Application Data","4444","33338"
"1905","2.335545579","127.0.0.1","127.0.0.1","TCP","66","33338  >  4444 [ACK] Seq=4257 Ack=3647 Win=697 Len=0 TSval=2785483322 TSecr=2785483322","33338","4444"
"1929","2.342732037","127.0.0.1","127.0.0.1","TLSv1.2","165","Application Data","4444","33338"
"1930","2.342764025","127.0.0.1","127.0.0.1","TCP","66","33338  >  4444 [ACK] Seq=4257 Ack=3746 Win=697 Len=0 TSval=2785483329 TSecr=2785483329","33338","4444"
"1931","2.342951339","127.0.0.1","127.0.0.1","TLSv1.2","144","Application Data","4444","33354"
"1934","2.351601111","127.0.0.1","127.0.0.1","TLSv1.2","135","Application Data","33338","4444"
"1950","2.357852744","127.0.0.1","127.0.0.1","TLSv1.2","637","Application Data","33380","4444"
"1951","2.357888223","127.0.0.1","127.0.0.1","TCP","66","4444  >  33380 [ACK] Seq=3747 Ack=4900 Win=752 Len=0 TSval=2785483344 TSecr=2785483344","4444","33380"
"2013","2.373330270","127.0.0.1","127.0.0.1","TLSv1.2","539","Application Data","4444","33400"
"2014","2.373360371","127.0.0.1","127.0.0.1","TCP","66","33400  >  4444 [ACK] Seq=4324 Ack=4218 Win=697 Len=0 TSval=2785483360 TSecr=2785483360","33400","4444"
"2037","2.379559064","127.0.0.1","127.0.0.1","TLSv1.2","166","Application Data","4444","33400"
"2038","2.379586721","127.0.0.1","127.0.0.1","TCP","66","33400  >  4444 [ACK] Seq=4324 Ack=4318 Win=699 Len=0 TSval=2785483366 TSecr=2785483366","33400","4444"
"2039","2.379752525","127.0.0.1","127.0.0.1","TLSv1.2","144","Application Data","4444","33380"
"2042","2.383109306","127.0.0.1","127.0.0.1","TCP","66","33354  >  4444 [ACK] Seq=4328 Ack=3747 Win=699 Len=0 TSval=2785483370 TSecr=2785483329","33354","4444"
"2043","2.384999211","127.0.0.1","127.0.0.1","TLSv1.2","135","Application Data","33400","4444"
"2062","2.392103047","127.0.0.1","127.0.0.1","TCP","66","4444  >  33338 [ACK] Seq=3746 Ack=4326 Win=752 Len=0 TSval=2785483379 TSecr=2785483338","4444","33338"
"2066","2.420098504","127.0.0.1","127.0.0.1","TCP","66","33380  >  4444 [ACK] Seq=4900 Ack=3825 Win=697 Len=0 TSval=2785483407 TSecr=2785483366","33380","4444"
"2068","2.425096765","127.0.0.1","127.0.0.1","TCP","66","4444  >  33400 [ACK] Seq=4318 Ack=4393 Win=752 Len=0 TSval=2785483412 TSecr=2785483371","4444","33400"
"2069","2.425122537","127.0.0.1","127.0.0.1","TLSv1.2","636","Application Data","33400","4444"
"2070","2.425153546","127.0.0.1","127.0.0.1","TCP","66","4444  >  33400 [ACK] Seq=4318 Ack=4963 Win=752 Len=0 TSval=2785483412 TSecr=2785483412","4444","33400"
"2132","2.440972526","127.0.0.1","127.0.0.1","TLSv1.2","539","Application Data","4444","33380"
"2133","2.441008774","127.0.0.1","127.0.0.1","TCP","66","33380  >  4444 [ACK] Seq=4900 Ack=4298 Win=697 Len=0 TSval=2785483427 TSecr=2785483427","33380","4444"
"2157","2.447848260","127.0.0.1","127.0.0.1","TLSv1.2","165","Application Data","4444","33380"
"2158","2.447879689","127.0.0.1","127.0.0.1","TCP","66","33380  >  4444 [ACK] Seq=4900 Ack=4397 Win=697 Len=0 TSval=2785483434 TSecr=2785483434","33380","4444"
"2159","2.448154933","127.0.0.1","127.0.0.1","TLSv1.2","144","Application Data","4444","33400"
"2162","2.458316700","127.0.0.1","127.0.0.1","TLSv1.2","135","Application Data","33380","4444"
"2182","2.464758231","127.0.0.1","127.0.0.1","TLSv1.2","636","Application Data","33338","4444"
"2183","2.464788053","127.0.0.1","127.0.0.1","TCP","66","4444  >  33338 [ACK] Seq=3746 Ack=4896 Win=752 Len=0 TSval=2785483451 TSecr=2785483451","4444","33338"
"2241","2.480292328","127.0.0.1","127.0.0.1","TLSv1.2","538","Application Data","4444","33354"
"2242","2.480322429","127.0.0.1","127.0.0.1","TCP","66","33354  >  4444 [ACK] Seq=4328 Ack=4219 Win=697 Len=0 TSval=2785483467 TSecr=2785483467","33354","4444"
"2265","2.487269681","127.0.0.1","127.0.0.1","TLSv1.2","166","Application Data","4444","33354"
"2266","2.487297338","127.0.0.1","127.0.0.1","TCP","66","33354  >  4444 [ACK] Seq=4328 Ack=4319 Win=699 Len=0 TSval=2785483474 TSecr=2785483474","33354","4444"
"2267","2.487484792","127.0.0.1","127.0.0.1","TLSv1.2","144","Application Data","4444","33338"
"2270","2.489109650","127.0.0.1","127.0.0.1","TCP","66","33400  >  4444 [ACK] Seq=4963 Ack=4396 Win=699 Len=0 TSval=2785483476 TSecr=2785483435","33400","4444"
"2271","2.496760273","127.0.0.1","127.0.0.1","TLSv1.2","134","Application Data","33354","4444"
"2277","2.499125308","127.0.0.1","127.0.0.1","TCP","66","4444  >  33380 [ACK] Seq=4397 Ack=4969 Win=752 Len=0 TSval=2785483486 TSecr=2785483445","4444","33380"
"2295","2.528156162","127.0.0.1","127.0.0.1","TCP","66","33338  >  4444 [ACK] Seq=4896 Ack=3824 Win=697 Len=0 TSval=2785483515 TSecr=2785483474","33338","4444"
"2296","2.537097033","127.0.0.1","127.0.0.1","TCP","66","4444  >  33354 [ACK] Seq=4319 Ack=4396 Win=752 Len=0 TSval=2785483524 TSecr=2785483483","4444","33354"
"2297","2.537128043","127.0.0.1","127.0.0.1","TLSv1.2","637","Application Data","33354","4444"
"2298","2.537155770","127.0.0.1","127.0.0.1","TCP","66","4444  >  33354 [ACK] Seq=4319 Ack=4967 Win=752 Len=0 TSval=2785483524 TSecr=2785483524","4444","33354"
"2360","2.552565061","127.0.0.1","127.0.0.1","TLSv1.2","539","Application Data","4444","33338"
"2361","2.552593626","127.0.0.1","127.0.0.1","TCP","66","33338  >  4444 [ACK] Seq=4896 Ack=4297 Win=697 Len=0 TSval=2785483539 TSecr=2785483539","33338","4444"
"2385","2.559460839","127.0.0.1","127.0.0.1","TLSv1.2","165","Application Data","4444","33338"
"2386","2.559491919","127.0.0.1","127.0.0.1","TCP","66","33338  >  4444 [ACK] Seq=4896 Ack=4396 Win=697 Len=0 TSval=2785483546 TSecr=2785483546","33338","4444"
"2387","2.559667989","127.0.0.1","127.0.0.1","TLSv1.2","144","Application Data","4444","33354"
"2394","2.568830536","127.0.0.1","127.0.0.1","TLSv1.2","135","Application Data","33338","4444"
"2411","2.575182600","127.0.0.1","127.0.0.1","TLSv1.2","637","Application Data","33380","4444"
"2412","2.575208860","127.0.0.1","127.0.0.1","TCP","66","4444  >  33380 [ACK] Seq=4397 Ack=5540 Win=752 Len=0 TSval=2785483562 TSecr=2785483562","4444","33380"
"2469","2.589537497","127.0.0.1","127.0.0.1","TLSv1.2","539","Application Data","4444","33400"
"2470","2.589565713","127.0.0.1","127.0.0.1","TCP","66","33400  >  4444 [ACK] Seq=4963 Ack=4869 Win=697 Len=0 TSval=2785483576 TSecr=2785483576","33400","4444"
"2493","2.595194920","127.0.0.1","127.0.0.1","TLSv1.2","166","Application Data","4444","33400"
"2494","2.595223276","127.0.0.1","127.0.0.1","TCP","66","33400  >  4444 [ACK] Seq=4963 Ack=4969 Win=699 Len=0 TSval=2785483582 TSecr=2785483582","33400","4444"
"2495","2.595408285","127.0.0.1","127.0.0.1","TLSv1.2","144","Application Data","4444","33380"
"2498","2.600107975","127.0.0.1","127.0.0.1","TCP","66","33354  >  4444 [ACK] Seq=4967 Ack=4397 Win=699 Len=0 TSval=2785483587 TSecr=2785483546","33354","4444"
"2499","2.604112953","127.0.0.1","127.0.0.1","TLSv1.2","135","Application Data","33400","4444"
"2512","2.609102903","127.0.0.1","127.0.0.1","TCP","66","4444  >  33338 [ACK] Seq=4396 Ack=4965 Win=752 Len=0 TSval=2785483596 TSecr=2785483555","4444","33338"
"2523","2.636139370","127.0.0.1","127.0.0.1","TCP","66","33380  >  4444 [ACK] Seq=5540 Ack=4475 Win=697 Len=0 TSval=2785483623 TSecr=2785483582","33380","4444"
"2524","2.645116000","127.0.0.1","127.0.0.1","TCP","66","4444  >  33400 [ACK] Seq=4969 Ack=5032 Win=752 Len=0 TSval=2785483632 TSecr=2785483590","4444","33400"
"2525","2.645150222","127.0.0.1","127.0.0.1","TLSv1.2","636","Application Data","33400","4444"
"2526","2.645180673","127.0.0.1","127.0.0.1","TCP","66","4444  >  33400 [ACK] Seq=4969 Ack=5602 Win=752 Len=0 TSval=2785483632 TSecr=2785483632","4444","33400"
"2588","2.660788243","127.0.0.1","127.0.0.1","TLSv1.2","539","Application Data","4444","33380"
"2589","2.660816389","127.0.0.1","127.0.0.1","TCP","66","33380  >  4444 [ACK] Seq=5540 Ack=4948 Win=697 Len=0 TSval=2785483647 TSecr=2785483647","33380","4444"
"2617","2.668048314","127.0.0.1","127.0.0.1","TLSv1.2","166","Application Data","4444","33380"
"2618","2.668107748","127.0.0.1","127.0.0.1","TCP","66","33380  >  4444 [ACK] Seq=5540 Ack=5048 Win=697 Len=0 TSval=2785483655 TSecr=2785483654","33380","4444"
"2619","2.668307634","127.0.0.1","127.0.0.1","TLSv1.2","144","Application Data","4444","33400"
"2622","2.677133477","127.0.0.1","127.0.0.1","TLSv1.2","135","Application Data","33380","4444"
"2639","2.683437560","127.0.0.1","127.0.0.1","TLSv1.2","636","Application Data","33338","4444"
"2640","2.683466125","127.0.0.1","127.0.0.1","TCP","66","4444  >  33338 [ACK] Seq=4396 Ack=5535 Win=752 Len=0 TSval=2785483670 TSecr=2785483670","4444","33338"
"2697","2.698215416","127.0.0.1","127.0.0.1","TLSv1.2","538","Application Data","4444","33354"
"2698","2.698247822","127.0.0.1","127.0.0.1","TCP","66","33354  >  4444 [ACK] Seq=4967 Ack=4869 Win=697 Len=0 TSval=2785483685 TSecr=2785483685","33354","4444"
"2721","2.704750045","127.0.0.1","127.0.0.1","TLSv1.2","165","Application Data","4444","33354"
"2722","2.704783220","127.0.0.1","127.0.0.1","TCP","66","33354  >  4444 [ACK] Seq=4967 Ack=4968 Win=699 Len=0 TSval=2785483691 TSecr=2785483691","33354","4444"
"2723","2.704965855","127.0.0.1","127.0.0.1","TLSv1.2","144","Application Data","4444","33338"
"2726","2.709141735","127.0.0.1","127.0.0.1","TCP","66","33400  >  4444 [ACK] Seq=5602 Ack=5047 Win=699 Len=0 TSval=2785483696 TSecr=2785483655","33400","4444"
"2727","2.713913221","127.0.0.1","127.0.0.1","TLSv1.2","134","Application Data","33354","4444"
"2739","2.718115221","127.0.0.1","127.0.0.1","TCP","66","4444  >  33380 [ACK] Seq=5048 Ack=5609 Win=752 Len=0 TSval=2785483705 TSecr=2785483664","4444","33380"
"2750","2.745101473","127.0.0.1","127.0.0.1","TCP","66","33338  >  4444 [ACK] Seq=5535 Ack=4474 Win=697 Len=0 TSval=2785483732 TSecr=2785483691","33338","4444"
"2752","2.754108972","127.0.0.1","127.0.0.1","TCP","66","4444  >  33354 [ACK] Seq=4968 Ack=5035 Win=752 Len=0 TSval=2785483741 TSecr=2785483700","4444","33354"
"2753","2.754138305","127.0.0.1","127.0.0.1","TLSv1.2","637","Application Data","33354","4444"
"2754","2.754179582","127.0.0.1","127.0.0.1","TCP","66","4444  >  33354 [ACK] Seq=4968 Ack=5606 Win=752 Len=0 TSval=2785483741 TSecr=2785483741","4444","33354"
"2820","2.770638447","127.0.0.1","127.0.0.1","TLSv1.2","538","Application Data","4444","33338"
"2821","2.770662333","127.0.0.1","127.0.0.1","TCP","66","33338  >  4444 [ACK] Seq=5535 Ack=4946 Win=697 Len=0 TSval=2785483757 TSecr=2785483757","33338","4444"
"2845","2.775656334","127.0.0.1","127.0.0.1","TLSv1.2","165","Application Data","4444","33338"
"2846","2.775675540","127.0.0.1","127.0.0.1","TCP","66","33338  >  4444 [ACK] Seq=5535 Ack=5045 Win=697 Len=0 TSval=2785483762 TSecr=2785483762","33338","4444"
"2847","2.775792594","127.0.0.1","127.0.0.1","TLSv1.2","144","Application Data","4444","33354"
"2850","2.784292208","127.0.0.1","127.0.0.1","TLSv1.2","134","Application Data","33338","4444"
"2865","2.789273777","127.0.0.1","127.0.0.1","TLSv1.2","637","Application Data","33380","4444"
"2866","2.789292773","127.0.0.1","127.0.0.1","TCP","66","4444  >  33380 [ACK] Seq=5048 Ack=6180 Win=752 Len=0 TSval=2785483776 TSecr=2785483776","4444","33380"
"2925","2.802087835","127.0.0.1","127.0.0.1","TLSv1.2","539","Application Data","4444","33400"
"2926","2.802105575","127.0.0.1","127.0.0.1","TCP","66","33400  >  4444 [ACK] Seq=5602 Ack=5520 Win=697 Len=0 TSval=2785483789 TSecr=2785483789","33400","4444"
"2949","2.806569201","127.0.0.1","127.0.0.1","TLSv1.2","166","Application Data","4444","33400"
"2950","2.806602026","127.0.0.1","127.0.0.1","TCP","66","33400  >  4444 [ACK] Seq=5602 Ack=5620 Win=699 Len=0 TSval=2785483793 TSecr=2785483793","33400","4444"
"2951","2.806779284","127.0.0.1","127.0.0.1","TLSv1.2","144","Application Data","4444","33380"
"2954","2.813303646","127.0.0.1","127.0.0.1","TLSv1.2","135","Application Data","33400","4444"
"2961","2.816100370","127.0.0.1","127.0.0.1","TCP","66","33354  >  4444 [ACK] Seq=5606 Ack=5046 Win=699 Len=0 TSval=2785483803 TSecr=2785483762","33354","4444"
"2974","2.825098372","127.0.0.1","127.0.0.1","TCP","66","4444  >  33338 [ACK] Seq=5045 Ack=5603 Win=752 Len=0 TSval=2785483812 TSecr=2785483771","4444","33338"
"2978","2.847102914","127.0.0.1","127.0.0.1","TCP","66","33380  >  4444 [ACK] Seq=6180 Ack=5126 Win=697 Len=0 TSval=2785483834 TSecr=2785483793","33380","4444"
"2980","2.854080267","127.0.0.1","127.0.0.1","TCP","66","4444  >  33400 [ACK] Seq=5620 Ack=5671 Win=752 Len=0 TSval=2785483841 TSecr=2785483800","4444","33400"
"2981","2.854097797","127.0.0.1","127.0.0.1","TLSv1.2","636","Application Data","33400","4444"
"2982","2.854114070","127.0.0.1","127.0.0.1","TCP","66","4444  >  33400 [ACK] Seq=5620 Ack=6241 Win=752 Len=0 TSval=2785483841 TSecr=2785483841","4444","33400"
"3048","2.870769819","127.0.0.1","127.0.0.1","TLSv1.2","538","Application Data","4444","33380"
"3049","2.870802714","127.0.0.1","127.0.0.1","TCP","66","33380  >  4444 [ACK] Seq=6180 Ack=5598 Win=697 Len=0 TSval=2785483857 TSecr=2785483857","33380","4444"
"3073","2.877618454","127.0.0.1","127.0.0.1","TLSv1.2","165","Application Data","4444","33380"
"3074","2.877647019","127.0.0.1","127.0.0.1","TCP","66","33380  >  4444 [ACK] Seq=6180 Ack=5697 Win=697 Len=0 TSval=2785483864 TSecr=2785483864","33380","4444"
"3075","2.877847045","127.0.0.1","127.0.0.1","TLSv1.2","144","Application Data","4444","33400"
"3078","2.886780513","127.0.0.1","127.0.0.1","TLSv1.2","134","Application Data","33380","4444"
"3093","2.892131961","127.0.0.1","127.0.0.1","TLSv1.2","636","Application Data","33338","4444"
"3094","2.892156825","127.0.0.1","127.0.0.1","TCP","66","4444  >  33338 [ACK] Seq=5045 Ack=6173 Win=752 Len=0 TSval=2785483879 TSecr=2785483879","4444","33338"
"3153","2.907370141","127.0.0.1","127.0.0.1","TLSv1.2","538","Application Data","4444","33354"
"3154","2.907409252","127.0.0.1","127.0.0.1","TCP","66","33354  >  4444 [ACK] Seq=5606 Ack=5518 Win=697 Len=0 TSval=2785483894 TSecr=2785483894","33354","4444"
"3177","2.914049691","127.0.0.1","127.0.0.1","TLSv1.2","165","Application Data","4444","33354"
"3178","2.914302307","127.0.0.1","127.0.0.1","TLSv1.2","144","Application Data","4444","33338"
"3179","2.914325145","127.0.0.1","127.0.0.1","TCP","66","33354  >  4444 [ACK] Seq=5606 Ack=5617 Win=699 Len=0 TSval=2785483901 TSecr=2785483900","33354","4444"
"3182","2.918119133","127.0.0.1","127.0.0.1","TCP","66","33400  >  4444 [ACK] Seq=6241 Ack=5698 Win=699 Len=0 TSval=2785483905 TSecr=2785483864","33400","4444"
"3183","2.920706473","127.0.0.1","127.0.0.1","TLSv1.2","134","Application Data","33354","4444"
"3202","2.927096880","127.0.0.1","127.0.0.1","TCP","66","4444  >  33380 [ACK] Seq=5697 Ack=6248 Win=752 Len=0 TSval=2785483914 TSecr=2785483873","4444","33380"
"3207","2.955148699","127.0.0.1","127.0.0.1","TCP","66","33338  >  4444 [ACK] Seq=6173 Ack=5123 Win=697 Len=0 TSval=2785483942 TSecr=2785483901","33338","4444"
"3208","2.961102878","127.0.0.1","127.0.0.1","TCP","66","4444  >  33354 [ACK] Seq=5617 Ack=5674 Win=752 Len=0 TSval=2785483948 TSecr=2785483907","4444","33354"
"3209","2.961131722","127.0.0.1","127.0.0.1","TLSv1.2","637","Application Data","33354","4444"
"3210","2.961158471","127.0.0.1","127.0.0.1","TCP","66","4444  >  33354 [ACK] Seq=5617 Ack=6245 Win=752 Len=0 TSval=2785483948 TSecr=2785483948","4444","33354"
"3276","2.977337204","127.0.0.1","127.0.0.1","TLSv1.2","538","Application Data","4444","33338"
"3277","2.977368213","127.0.0.1","127.0.0.1","TCP","66","33338  >  4444 [ACK] Seq=6173 Ack=5595 Win=697 Len=0 TSval=2785483964 TSecr=2785483964","33338","4444"
"3301","2.983991681","127.0.0.1","127.0.0.1","TLSv1.2","165","Application Data","4444","33338"
"3302","2.984217338","127.0.0.1","127.0.0.1","TLSv1.2","144","Application Data","4444","33354"
"3303","2.984246881","127.0.0.1","127.0.0.1","TCP","66","33338  >  4444 [ACK] Seq=6173 Ack=5694 Win=697 Len=0 TSval=2785483971 TSecr=2785483970","33338","4444"
"3306","2.993210590","127.0.0.1","127.0.0.1","TLSv1.2","134","Application Data","33338","4444"
"3323","2.999495537","127.0.0.1","127.0.0.1","TLSv1.2","637","Application Data","33380","4444"
"3324","2.999522216","127.0.0.1","127.0.0.1","TCP","66","4444  >  33380 [ACK] Seq=5697 Ack=6819 Win=752 Len=0 TSval=2785483986 TSecr=2785483986","4444","33380"
"3381","3.015187545","127.0.0.1","127.0.0.1","TLSv1.2","539","Application Data","4444","33400"
"3382","3.015220300","127.0.0.1","127.0.0.1","TCP","66","33400  >  4444 [ACK] Seq=6241 Ack=6171 Win=697 Len=0 TSval=2785484002 TSecr=2785484002","33400","4444"
"3405","3.021726435","127.0.0.1","127.0.0.1","TLSv1.2","166","Application Data","4444","33400"
"3406","3.021952790","127.0.0.1","127.0.0.1","TLSv1.2","144","Application Data","4444","33380"
"3407","3.022001819","127.0.0.1","127.0.0.1","TCP","66","33400  >  4444 [ACK] Seq=6241 Ack=6271 Win=699 Len=0 TSval=2785484008 TSecr=2785484008","33400","4444"
"3410","3.025117438","127.0.0.1","127.0.0.1","TCP","66","33354  >  4444 [ACK] Seq=6245 Ack=5695 Win=699 Len=0 TSval=2785484012 TSecr=2785483971","33354","4444"
"3411","3.031392887","127.0.0.1","127.0.0.1","TLSv1.2","135","Application Data","33400","4444"
"3418","3.034117325","127.0.0.1","127.0.0.1","TCP","66","4444  >  33338 [ACK] Seq=5694 Ack=6241 Win=752 Len=0 TSval=2785484021 TSecr=2785483980","4444","33338"
"3434","3.062099792","127.0.0.1","127.0.0.1","TCP","66","33380  >  4444 [ACK] Seq=6819 Ack=5775 Win=697 Len=0 TSval=2785484049 TSecr=2785484008","33380","4444"
"3436","3.072112308","127.0.0.1","127.0.0.1","TCP","66","4444  >  33400 [ACK] Seq=6271 Ack=6310 Win=752 Len=0 TSval=2785484059 TSecr=2785484018","4444","33400"
"3437","3.072142339","127.0.0.1","127.0.0.1","TLSv1.2","636","Application Data","33400","4444"
"3438","3.072172441","127.0.0.1","127.0.0.1","TCP","66","4444  >  33400 [ACK] Seq=6271 Ack=6880 Win=752 Len=0 TSval=2785484059 TSecr=2785484059","4444","33400"
"3504","3.088497840","127.0.0.1","127.0.0.1","TLSv1.2","539","Application Data","4444","33380"
"3505","3.088526964","127.0.0.1","127.0.0.1","TCP","66","33380  >  4444 [ACK] Seq=6819 Ack=6248 Win=697 Len=0 TSval=2785484075 TSecr=2785484075","33380","4444"
"3529","3.095295771","127.0.0.1","127.0.0.1","TLSv1.2","165","Application Data","4444","33380"
"3530","3.095487765","127.0.0.1","127.0.0.1","TLSv1.2","144","Application Data","4444","33400"
"3531","3.095558653","127.0.0.1","127.0.0.1","TCP","66","33380  >  4444 [ACK] Seq=6819 Ack=6347 Win=697 Len=0 TSval=2785484082 TSecr=2785484082","33380","4444"
"3534","3.104436667","127.0.0.1","127.0.0.1","TLSv1.2","135","Application Data","33380","4444"
"3551","3.110671468","127.0.0.1","127.0.0.1","TLSv1.2","636","Application Data","33338","4444"
"3552","3.110697240","127.0.0.1","127.0.0.1","TCP","66","4444  >  33338 [ACK] Seq=5694 Ack=6811 Win=752 Len=0 TSval=2785484097 TSecr=2785484097","4444","33338"
"3609","3.125532854","127.0.0.1","127.0.0.1","TLSv1.2","539","Application Data","4444","33354"
"3611","3.125790010","127.0.0.1","127.0.0.1","TCP","66","33354  >  4444 [ACK] Seq=6245 Ack=6168 Win=699 Len=0 TSval=2785484112 TSecr=2785484112","33354","4444"
"3633","3.131720023","127.0.0.1","127.0.0.1","TLSv1.2","166","Application Data","4444","33354"
"3634","3.131918233","127.0.0.1","127.0.0.1","TLSv1.2","144","Application Data","4444","33338"
"3635","3.131941909","127.0.0.1","127.0.0.1","TCP","66","33354  >  4444 [ACK] Seq=6245 Ack=6268 Win=699 Len=0 TSval=2785484118 TSecr=2785484118","33354","4444"
"3638","3.136106963","127.0.0.1","127.0.0.1","TCP","66","33400  >  4444 [ACK] Seq=6880 Ack=6349 Win=699 Len=0 TSval=2785484123 TSecr=2785484082","33400","4444"
"3639","3.140895281","127.0.0.1","127.0.0.1","TLSv1.2","135","Application Data","33354","4444"
"3648","3.145113136","127.0.0.1","127.0.0.1","TCP","66","4444  >  33380 [ACK] Seq=6347 Ack=6888 Win=752 Len=0 TSval=2785484132 TSecr=2785484091","4444","33380"
"3662","3.172111260","127.0.0.1","127.0.0.1","TCP","66","33338  >  4444 [ACK] Seq=6811 Ack=5772 Win=697 Len=0 TSval=2785484159 TSecr=2785484118","33338","4444"
"3669","3.181107934","127.0.0.1","127.0.0.1","TCP","66","4444  >  33354 [ACK] Seq=6268 Ack=6314 Win=752 Len=0 TSval=2785484168 TSecr=2785484127","4444","33354"
"3670","3.181136988","127.0.0.1","127.0.0.1","TLSv1.2","637","Application Data","33354","4444"
"3671","3.181168487","127.0.0.1","127.0.0.1","TCP","66","4444  >  33354 [ACK] Seq=6268 Ack=6885 Win=752 Len=0 TSval=2785484168 TSecr=2785484168","4444","33354"
"3730","3.196677092","127.0.0.1","127.0.0.1","TLSv1.2","538","Application Data","4444","33338"
"3732","3.196931314","127.0.0.1","127.0.0.1","TCP","66","33338  >  4444 [ACK] Seq=6811 Ack=6244 Win=697 Len=0 TSval=2785484183 TSecr=2785484183","33338","4444"
"3755","3.203583835","127.0.0.1","127.0.0.1","TLSv1.2","165","Application Data","4444","33338"
"3756","3.203772337","127.0.0.1","127.0.0.1","TLSv1.2","144","Application Data","4444","33354"
"3757","3.203822762","127.0.0.1","127.0.0.1","TCP","66","33338  >  4444 [ACK] Seq=6811 Ack=6343 Win=697 Len=0 TSval=2785484190 TSecr=2785484190","33338","4444"
"3760","3.214729107","127.0.0.1","127.0.0.1","TLSv1.2","134","Application Data","33338","4444"
"3779","3.224797844","127.0.0.1","127.0.0.1","TLSv1.2","637","Application Data","33380","4444"
"3780","3.224826968","127.0.0.1","127.0.0.1","TCP","66","4444  >  33380 [ACK] Seq=6347 Ack=7459 Win=752 Len=0 TSval=2785484211 TSecr=2785484211","4444","33380"
"3839","3.242467967","127.0.0.1","127.0.0.1","TLSv1.2","538","Application Data","4444","33400"
