"No.","Time","Source","Destination","Protocol","Length","Info"
"265","32.791127422","127.0.0.1","127.0.0.1","TCP","66","37668  >  8080 [ACK] Seq=1 Ack=1 Win=65536 Len=0 TSval=2304202454 TSecr=2304202454"
"267","32.791154171","127.0.0.1","127.0.0.1","TCP","66","37670  >  8080 [ACK] Seq=1 Ack=1 Win=65536 Len=0 TSval=2304202454 TSecr=2304202454"
"268","32.791926751","127.0.0.1","127.0.0.1","TCP","415","37670  >  8080 [PSH, ACK] Seq=1 Ack=1 Win=65536 Len=349 TSval=2304202455 TSecr=2304202454"
"269","32.791949659","127.0.0.1","127.0.0.1","TCP","66","8080  >  37670 [ACK] Seq=1 Ack=350 Win=65152 Len=0 TSval=2304202455 TSecr=2304202455"
"272","32.793584775","127.0.0.1","127.0.0.1","TCP","66","37684  >  8080 [ACK] Seq=1 Ack=1 Win=65536 Len=0 TSval=2304202456 TSecr=2304202456"
"273","32.794098385","127.0.0.1","127.0.0.1","TCP","415","37684  >  8080 [PSH, ACK] Seq=1 Ack=1 Win=65536 Len=349 TSval=2304202457 TSecr=2304202456"
"274","32.794124575","127.0.0.1","127.0.0.1","TCP","66","8080  >  37684 [ACK] Seq=1 Ack=350 Win=65152 Len=0 TSval=2304202457 TSecr=2304202457"
"277","32.796816593","127.0.0.1","127.0.0.1","TCP","66","37694  >  8080 [ACK] Seq=1 Ack=1 Win=65536 Len=0 TSval=2304202460 TSecr=2304202460"
"280","32.797229633","127.0.0.1","127.0.0.1","TCP","66","37698  >  8080 [ACK] Seq=1 Ack=1 Win=65536 Len=0 TSval=2304202460 TSecr=2304202460"
"281","32.797389149","127.0.0.1","127.0.0.1","TCP","415","37694  >  8080 [PSH, ACK] Seq=1 Ack=1 Win=65536 Len=349 TSval=2304202460 TSecr=2304202460"
"282","32.797406190","127.0.0.1","127.0.0.1","TCP","66","8080  >  37694 [ACK] Seq=1 Ack=350 Win=65152 Len=0 TSval=2304202460 TSecr=2304202460"
"283","32.797858061","127.0.0.1","127.0.0.1","TCP","415","37698  >  8080 [PSH, ACK] Seq=1 Ack=1 Win=65536 Len=349 TSval=2304202461 TSecr=2304202460"
"284","32.797858061","127.0.0.1","127.0.0.1","TCP","415","37668  >  8080 [PSH, ACK] Seq=1 Ack=1 Win=65536 Len=349 TSval=2304202461 TSecr=2304202454"
"285","32.797882226","127.0.0.1","127.0.0.1","TCP","66","8080  >  37698 [ACK] Seq=1 Ack=350 Win=65152 Len=0 TSval=2304202461 TSecr=2304202461"
"286","32.797882226","127.0.0.1","127.0.0.1","TCP","66","8080  >  37668 [ACK] Seq=1 Ack=350 Win=65152 Len=0 TSval=2304202461 TSecr=2304202461"
"289","32.798139171","127.0.0.1","127.0.0.1","TCP","66","37714  >  8080 [ACK] Seq=1 Ack=1 Win=65536 Len=0 TSval=2304202461 TSecr=2304202461"
"290","32.798828082","127.0.0.1","127.0.0.1","TCP","415","37714  >  8080 [PSH, ACK] Seq=1 Ack=1 Win=65536 Len=349 TSval=2304202462 TSecr=2304202461"
"291","32.798849663","127.0.0.1","127.0.0.1","TCP","66","8080  >  37714 [ACK] Seq=1 Ack=350 Win=65152 Len=0 TSval=2304202462 TSecr=2304202462"
"292","32.799959365","127.0.0.1","127.0.0.1","TCP","1411","8080  >  37670 [PSH, ACK] Seq=1 Ack=350 Win=65536 Len=1345 TSval=2304202463 TSecr=2304202455"
"293","32.800009092","127.0.0.1","127.0.0.1","TCP","66","37670  >  8080 [ACK] Seq=350 Ack=1346 Win=77056 Len=0 TSval=2304202463 TSecr=2304202463"
"296","32.800376106","127.0.0.1","127.0.0.1","TCP","66","37728  >  8080 [ACK] Seq=1 Ack=1 Win=65536 Len=0 TSval=2304202463 TSecr=2304202463"
"297","32.801763845","127.0.0.1","127.0.0.1","TCP","361","37670  >  8080 [PSH, ACK] Seq=350 Ack=1346 Win=77056 Len=295 TSval=2304202465 TSecr=2304202463"
"299","32.802090561","127.0.0.1","127.0.0.1","TCP","1411","8080  >  37668 [PSH, ACK] Seq=1 Ack=350 Win=65536 Len=1345 TSval=2304202465 TSecr=2304202461"
"301","32.802120103","127.0.0.1","127.0.0.1","TCP","66","37740  >  8080 [ACK] Seq=1 Ack=1 Win=65536 Len=0 TSval=2304202465 TSecr=2304202465"
"302","32.802133233","127.0.0.1","127.0.0.1","TCP","66","37668  >  8080 [ACK] Seq=350 Ack=1346 Win=77056 Len=0 TSval=2304202465 TSecr=2304202465"
"314","32.803746489","127.0.0.1","127.0.0.1","TCP","66","37742  >  8080 [ACK] Seq=1 Ack=1 Win=65536 Len=0 TSval=2304202467 TSecr=2304202467"
"320","32.804148563","127.0.0.1","127.0.0.1","TCP","361","37668  >  8080 [PSH, ACK] Seq=350 Ack=1346 Win=77056 Len=295 TSval=2304202467 TSecr=2304202465"
"321","32.804153312","127.0.0.1","127.0.0.1","TCP","415","37728  >  8080 [PSH, ACK] Seq=1 Ack=1 Win=65536 Len=349 TSval=2304202467 TSecr=2304202463"
"322","32.804171960","127.0.0.1","127.0.0.1","TCP","66","8080  >  37728 [ACK] Seq=1 Ack=350 Win=65152 Len=0 TSval=2304202467 TSecr=2304202467"
"323","32.804293064","127.0.0.1","127.0.0.1","TCP","415","37742  >  8080 [PSH, ACK] Seq=1 Ack=1 Win=65536 Len=349 TSval=2304202467 TSecr=2304202467"
"324","32.804304867","127.0.0.1","127.0.0.1","TCP","66","8080  >  37742 [ACK] Seq=1 Ack=350 Win=65152 Len=0 TSval=2304202467 TSecr=2304202467"
"327","32.804718395","127.0.0.1","127.0.0.1","TCP","1411","8080  >  37684 [PSH, ACK] Seq=1 Ack=350 Win=65536 Len=1345 TSval=2304202468 TSecr=2304202457"
"328","32.804724052","127.0.0.1","127.0.0.1","TCP","66","37756  >  8080 [ACK] Seq=1 Ack=1 Win=65536 Len=0 TSval=2304202468 TSecr=2304202468"
"329","32.804750801","127.0.0.1","127.0.0.1","TCP","66","37684  >  8080 [ACK] Seq=350 Ack=1346 Win=77056 Len=0 TSval=2304202468 TSecr=2304202468"
"330","32.805450537","127.0.0.1","127.0.0.1","TCP","415","37756  >  8080 [PSH, ACK] Seq=1 Ack=1 Win=65536 Len=349 TSval=2304202468 TSecr=2304202468"
"331","32.805474004","127.0.0.1","127.0.0.1","TCP","66","8080  >  37756 [ACK] Seq=1 Ack=350 Win=65152 Len=0 TSval=2304202468 TSecr=2304202468"
"332","32.805852681","127.0.0.1","127.0.0.1","TCP","361","37684  >  8080 [PSH, ACK] Seq=350 Ack=1346 Win=77056 Len=295 TSval=2304202469 TSecr=2304202468"
"333","32.806811318","127.0.0.1","127.0.0.1","TCP","831","8080  >  37668 [PSH, ACK] Seq=1346 Ack=645 Win=65536 Len=765 TSval=2304202470 TSecr=2304202467"
"338","32.806965876","127.0.0.1","127.0.0.1","TCP","66","37770  >  8080 [ACK] Seq=1 Ack=1 Win=65536 Len=0 TSval=2304202470 TSecr=2304202470"
"339","32.806967342","127.0.0.1","127.0.0.1","TCP","66","37772  >  8080 [ACK] Seq=1 Ack=1 Win=65536 Len=0 TSval=2304202470 TSecr=2304202470"
"340","32.807505327","127.0.0.1","127.0.0.1","TCP","415","37772  >  8080 [PSH, ACK] Seq=1 Ack=1 Win=65536 Len=349 TSval=2304202470 TSecr=2304202470"
"341","32.807505327","127.0.0.1","127.0.0.1","TCP","415","37770  >  8080 [PSH, ACK] Seq=1 Ack=1 Win=65536 Len=349 TSval=2304202470 TSecr=2304202470"
"342","32.807525371","127.0.0.1","127.0.0.1","TCP","66","8080  >  37770 [ACK] Seq=1 Ack=350 Win=65152 Len=0 TSval=2304202470 TSecr=2304202470"
"343","32.807525371","127.0.0.1","127.0.0.1","TCP","66","8080  >  37772 [ACK] Seq=1 Ack=350 Win=65152 Len=0 TSval=2304202470 TSecr=2304202470"
"346","32.807882119","127.0.0.1","127.0.0.1","TCP","66","37782  >  8080 [ACK] Seq=1 Ack=1 Win=65536 Len=0 TSval=2304202471 TSecr=2304202471"
"347","32.808129356","127.0.0.1","127.0.0.1","TCP","119","37668  >  8080 [PSH, ACK] Seq=645 Ack=2111 Win=77440 Len=53 TSval=2304202471 TSecr=2304202470"
"348","32.808138784","127.0.0.1","127.0.0.1","TCP","415","37740  >  8080 [PSH, ACK] Seq=1 Ack=1 Win=65536 Len=349 TSval=2304202471 TSecr=2304202465"
"349","32.808150657","127.0.0.1","127.0.0.1","TCP","66","8080  >  37740 [ACK] Seq=1 Ack=350 Win=65152 Len=0 TSval=2304202471 TSecr=2304202471"
"350","32.808377291","127.0.0.1","127.0.0.1","TCP","415","37782  >  8080 [PSH, ACK] Seq=1 Ack=1 Win=65536 Len=349 TSval=2304202471 TSecr=2304202471"
"351","32.808394542","127.0.0.1","127.0.0.1","TCP","66","8080  >  37782 [ACK] Seq=1 Ack=350 Win=65152 Len=0 TSval=2304202471 TSecr=2304202471"
"356","32.808984209","127.0.0.1","127.0.0.1","TCP","66","37794  >  8080 [ACK] Seq=1 Ack=1 Win=65536 Len=0 TSval=2304202472 TSecr=2304202472"
"357","32.808984209","127.0.0.1","127.0.0.1","TCP","66","37796  >  8080 [ACK] Seq=1 Ack=1 Win=65536 Len=0 TSval=2304202472 TSecr=2304202472"
"358","32.809004672","127.0.0.1","127.0.0.1","TCP","831","8080  >  37670 [PSH, ACK] Seq=1346 Ack=645 Win=65536 Len=765 TSval=2304202472 TSecr=2304202465"
"359","32.809410029","127.0.0.1","127.0.0.1","TCP","415","37794  >  8080 [PSH, ACK] Seq=1 Ack=1 Win=65536 Len=349 TSval=2304202472 TSecr=2304202472"
"360","32.809425184","127.0.0.1","127.0.0.1","TCP","66","8080  >  37794 [ACK] Seq=1 Ack=350 Win=65152 Len=0 TSval=2304202472 TSecr=2304202472"
"361","32.809429514","127.0.0.1","127.0.0.1","TCP","415","37796  >  8080 [PSH, ACK] Seq=1 Ack=1 Win=65536 Len=349 TSval=2304202472 TSecr=2304202472"
"362","32.809444879","127.0.0.1","127.0.0.1","TCP","66","8080  >  37796 [ACK] Seq=1 Ack=350 Win=65152 Len=0 TSval=2304202472 TSecr=2304202472"
"363","32.810669959","127.0.0.1","127.0.0.1","TCP","120","37670  >  8080 [PSH, ACK] Seq=645 Ack=2111 Win=77440 Len=54 TSval=2304202474 TSecr=2304202472"
"364","32.810746225","127.0.0.1","127.0.0.1","TCP","1411","8080  >  37694 [PSH, ACK] Seq=1 Ack=350 Win=65536 Len=1345 TSval=2304202474 TSecr=2304202460"
"365","32.810761101","127.0.0.1","127.0.0.1","TCP","66","37694  >  8080 [ACK] Seq=350 Ack=1346 Win=77056 Len=0 TSval=2304202474 TSecr=2304202474"
"368","32.810923761","127.0.0.1","127.0.0.1","TCP","66","37804  >  8080 [ACK] Seq=1 Ack=1 Win=65536 Len=0 TSval=2304202474 TSecr=2304202474"
"371","32.811355238","127.0.0.1","127.0.0.1","TCP","66","37806  >  8080 [ACK] Seq=1 Ack=1 Win=65536 Len=0 TSval=2304202474 TSecr=2304202474"
"372","32.811359079","127.0.0.1","127.0.0.1","TCP","415","37804  >  8080 [PSH, ACK] Seq=1 Ack=1 Win=65536 Len=349 TSval=2304202474 TSecr=2304202474"
"373","32.811374165","127.0.0.1","127.0.0.1","TCP","66","8080  >  37804 [ACK] Seq=1 Ack=350 Win=65152 Len=0 TSval=2304202474 TSecr=2304202474"
"374","32.811569580","127.0.0.1","127.0.0.1","TCP","361","37694  >  8080 [PSH, ACK] Seq=350 Ack=1346 Win=77056 Len=295 TSval=2304202474 TSecr=2304202474"
"375","32.811805083","127.0.0.1","127.0.0.1","TCP","415","37806  >  8080 [PSH, ACK] Seq=1 Ack=1 Win=65536 Len=349 TSval=2304202475 TSecr=2304202474"
"376","32.811819401","127.0.0.1","127.0.0.1","TCP","66","8080  >  37806 [ACK] Seq=1 Ack=350 Win=65152 Len=0 TSval=2304202475 TSecr=2304202475"
"379","32.812464940","127.0.0.1","127.0.0.1","TCP","1906","37668  >  8080 [PSH, ACK] Seq=698 Ack=2111 Win=77440 Len=1840 TSval=2304202475 TSecr=2304202470"
"380","32.812478769","127.0.0.1","127.0.0.1","TCP","66","8080  >  37668 [ACK] Seq=2111 Ack=2538 Win=86272 Len=0 TSval=2304202475 TSecr=2304202471"
"381","32.812924563","127.0.0.1","127.0.0.1","TCP","831","8080  >  37684 [PSH, ACK] Seq=1346 Ack=645 Win=65536 Len=765 TSval=2304202476 TSecr=2304202469"
"384","32.814074005","127.0.0.1","127.0.0.1","TCP","119","37684  >  8080 [PSH, ACK] Seq=645 Ack=2111 Win=77440 Len=53 TSval=2304202477 TSecr=2304202476"
"385","32.814129389","127.0.0.1","127.0.0.1","TCP","1906","37670  >  8080 [PSH, ACK] Seq=699 Ack=2111 Win=77440 Len=1840 TSval=2304202477 TSecr=2304202472"
"386","32.814141332","127.0.0.1","127.0.0.1","TCP","66","8080  >  37670 [ACK] Seq=2111 Ack=2539 Win=86272 Len=0 TSval=2304202477 TSecr=2304202474"
"387","32.814337934","127.0.0.1","127.0.0.1","TCP","1411","8080  >  37698 [PSH, ACK] Seq=1 Ack=350 Win=65536 Len=1345 TSval=2304202477 TSecr=2304202461"
"388","32.814359305","127.0.0.1","127.0.0.1","TCP","66","37698  >  8080 [ACK] Seq=350 Ack=1346 Win=77056 Len=0 TSval=2304202477 TSecr=2304202477"
"389","32.815336869","127.0.0.1","127.0.0.1","TCP","361","37698  >  8080 [PSH, ACK] Seq=350 Ack=1346 Win=77056 Len=295 TSval=2304202478 TSecr=2304202477"
"392","32.816270432","127.0.0.1","127.0.0.1","TCP","66","37808  >  8080 [ACK] Seq=1 Ack=1 Win=65536 Len=0 TSval=2304202479 TSecr=2304202479"
"393","32.817022619","127.0.0.1","127.0.0.1","TCP","415","37808  >  8080 [PSH, ACK] Seq=1 Ack=1 Win=65536 Len=349 TSval=2304202480 TSecr=2304202479"
"394","32.817048321","127.0.0.1","127.0.0.1","TCP","66","8080  >  37808 [ACK] Seq=1 Ack=350 Win=65152 Len=0 TSval=2304202480 TSecr=2304202480"
"397","32.817218732","127.0.0.1","127.0.0.1","TCP","66","37818  >  8080 [ACK] Seq=1 Ack=1 Win=65536 Len=0 TSval=2304202480 TSecr=2304202480"
"398","32.817744425","127.0.0.1","127.0.0.1","TCP","415","37818  >  8080 [PSH, ACK] Seq=1 Ack=1 Win=65536 Len=349 TSval=2304202481 TSecr=2304202480"
"399","32.817759231","127.0.0.1","127.0.0.1","TCP","66","8080  >  37818 [ACK] Seq=1 Ack=350 Win=65152 Len=0 TSval=2304202481 TSecr=2304202481"
"402","32.818927251","127.0.0.1","127.0.0.1","TCP","1899","37684  >  8080 [PSH, ACK] Seq=698 Ack=2111 Win=77440 Len=1833 TSval=2304202482 TSecr=2304202476"
"403","32.818941149","127.0.0.1","127.0.0.1","TCP","66","8080  >  37684 [ACK] Seq=2111 Ack=2531 Win=85120 Len=0 TSval=2304202482 TSecr=2304202477"
"406","32.828554682","127.0.0.1","127.0.0.1","TCP","66","37820  >  8080 [ACK] Seq=1 Ack=1 Win=65536 Len=0 TSval=2304202491 TSecr=2304202491"
"407","32.828848014","127.0.0.1","127.0.0.1","TCP","415","37820  >  8080 [PSH, ACK] Seq=1 Ack=1 Win=65536 Len=349 TSval=2304202492 TSecr=2304202491"
"408","32.828857442","127.0.0.1","127.0.0.1","TCP","66","8080  >  37820 [ACK] Seq=1 Ack=350 Win=65152 Len=0 TSval=2304202492 TSecr=2304202492"
"409","32.837033579","127.0.0.1","127.0.0.1","TCP","831","8080  >  37694 [PSH, ACK] Seq=1346 Ack=645 Win=65536 Len=765 TSval=2304202500 TSecr=2304202474"
"410","32.837996615","127.0.0.1","127.0.0.1","TCP","1411","8080  >  37714 [PSH, ACK] Seq=1 Ack=350 Win=65536 Len=1345 TSval=2304202501 TSecr=2304202462"
"411","32.838020152","127.0.0.1","127.0.0.1","TCP","66","37714  >  8080 [ACK] Seq=350 Ack=1346 Win=77056 Len=0 TSval=2304202501 TSecr=2304202501"
"412","32.838170100","127.0.0.1","127.0.0.1","TCP","119","37694  >  8080 [PSH, ACK] Seq=645 Ack=2111 Win=77440 Len=53 TSval=2304202501 TSecr=2304202500"
"413","32.839050375","127.0.0.1","127.0.0.1","TCP","361","37714  >  8080 [PSH, ACK] Seq=350 Ack=1346 Win=77056 Len=295 TSval=2304202502 TSecr=2304202501"
"414","32.839076147","127.0.0.1","127.0.0.1","TCP","66","8080  >  37714 [ACK] Seq=1346 Ack=645 Win=65280 Len=0 TSval=2304202502 TSecr=2304202502"
"415","32.839789502","127.0.0.1","127.0.0.1","TCP","831","8080  >  37698 [PSH, ACK] Seq=1346 Ack=645 Win=65536 Len=765 TSval=2304202503 TSecr=2304202478"
"416","32.840541688","127.0.0.1","127.0.0.1","TCP","119","37698  >  8080 [PSH, ACK] Seq=645 Ack=2111 Win=77440 Len=53 TSval=2304202503 TSecr=2304202503"
"417","32.840744018","127.0.0.1","127.0.0.1","TCP","1411","8080  >  37728 [PSH, ACK] Seq=1 Ack=350 Win=65536 Len=1345 TSval=2304202504 TSecr=2304202467"
"418","32.840763014","127.0.0.1","127.0.0.1","TCP","66","37728  >  8080 [ACK] Seq=350 Ack=1346 Win=77056 Len=0 TSval=2304202504 TSecr=2304202504"
"419","32.841437887","127.0.0.1","127.0.0.1","TCP","361","37728  >  8080 [PSH, ACK] Seq=350 Ack=1346 Win=77056 Len=295 TSval=2304202504 TSecr=2304202504"
"420","32.842125750","127.0.0.1","127.0.0.1","TCP","831","8080  >  37714 [PSH, ACK] Seq=1346 Ack=645 Win=65536 Len=765 TSval=2304202505 TSecr=2304202502"
"423","32.843006724","127.0.0.1","127.0.0.1","TCP","1897","37694  >  8080 [PSH, ACK] Seq=698 Ack=2111 Win=77440 Len=1831 TSval=2304202506 TSecr=2304202500"
"424","32.843020901","127.0.0.1","127.0.0.1","TCP","66","8080  >  37694 [ACK] Seq=2111 Ack=2529 Win=85760 Len=0 TSval=2304202506 TSecr=2304202501"
"425","32.843182234","127.0.0.1","127.0.0.1","TCP","1411","8080  >  37740 [PSH, ACK] Seq=1 Ack=350 Win=65536 Len=1345 TSval=2304202506 TSecr=2304202471"
"426","32.843201859","127.0.0.1","127.0.0.1","TCP","66","37740  >  8080 [ACK] Seq=350 Ack=1346 Win=77056 Len=0 TSval=2304202506 TSecr=2304202506"
"427","32.843217504","127.0.0.1","127.0.0.1","TCP","119","37714  >  8080 [PSH, ACK] Seq=645 Ack=2111 Win=77440 Len=53 TSval=2304202506 TSecr=2304202505"
"428","32.844083042","127.0.0.1","127.0.0.1","TCP","361","37740  >  8080 [PSH, ACK] Seq=350 Ack=1346 Win=77056 Len=295 TSval=2304202507 TSecr=2304202506"
"431","32.844537567","127.0.0.1","127.0.0.1","TCP","1902","37698  >  8080 [PSH, ACK] Seq=698 Ack=2111 Win=77440 Len=1836 TSval=2304202507 TSecr=2304202503"
"432","32.844552443","127.0.0.1","127.0.0.1","TCP","66","8080  >  37698 [ACK] Seq=2111 Ack=2534 Win=86272 Len=0 TSval=2304202507 TSecr=2304202503"
"433","32.844841934","127.0.0.1","127.0.0.1","TCP","831","8080  >  37728 [PSH, ACK] Seq=1346 Ack=645 Win=65536 Len=765 TSval=2304202508 TSecr=2304202504"
"434","32.845640355","127.0.0.1","127.0.0.1","TCP","120","37728  >  8080 [PSH, ACK] Seq=645 Ack=2111 Win=77440 Len=54 TSval=2304202509 TSecr=2304202508"
"437","32.847022297","127.0.0.1","127.0.0.1","TCP","1904","37714  >  8080 [PSH, ACK] Seq=698 Ack=2111 Win=77440 Len=1838 TSval=2304202510 TSecr=2304202505"
"438","32.847052818","127.0.0.1","127.0.0.1","TCP","66","8080  >  37714 [ACK] Seq=2111 Ack=2536 Win=86272 Len=0 TSval=2304202510 TSecr=2304202506"
"439","32.848384474","127.0.0.1","127.0.0.1","TCP","1411","8080  >  37742 [PSH, ACK] Seq=1 Ack=350 Win=65536 Len=1345 TSval=2304202511 TSecr=2304202467"
"440","32.848418417","127.0.0.1","127.0.0.1","TCP","66","37742  >  8080 [ACK] Seq=350 Ack=1346 Win=77056 Len=0 TSval=2304202511 TSecr=2304202511"
"443","32.849337803","127.0.0.1","127.0.0.1","TCP","1901","37728  >  8080 [PSH, ACK] Seq=699 Ack=2111 Win=77440 Len=1835 TSval=2304202512 TSecr=2304202508"
"444","32.849349397","127.0.0.1","127.0.0.1","TCP","66","8080  >  37728 [ACK] Seq=2111 Ack=2534 Win=85632 Len=0 TSval=2304202512 TSecr=2304202509"
"445","32.849386273","127.0.0.1","127.0.0.1","TCP","361","37742  >  8080 [PSH, ACK] Seq=350 Ack=1346 Win=77056 Len=295 TSval=2304202512 TSecr=2304202511"
"446","32.849403244","127.0.0.1","127.0.0.1","TCP","66","8080  >  37742 [ACK] Seq=1346 Ack=645 Win=65280 Len=0 TSval=2304202512 TSecr=2304202512"
"447","32.855220643","127.0.0.1","127.0.0.1","TCP","831","8080  >  37740 [PSH, ACK] Seq=1346 Ack=645 Win=65536 Len=765 TSval=2304202518 TSecr=2304202507"
"448","32.856131648","127.0.0.1","127.0.0.1","TCP","119","37740  >  8080 [PSH, ACK] Seq=645 Ack=2111 Win=77440 Len=53 TSval=2304202519 TSecr=2304202518"
"449","32.858659191","127.0.0.1","127.0.0.1","TCP","1411","8080  >  37756 [PSH, ACK] Seq=1 Ack=350 Win=65536 Len=1345 TSval=2304202522 TSecr=2304202468"
"450","32.858690201","127.0.0.1","127.0.0.1","TCP","66","37756  >  8080 [ACK] Seq=350 Ack=1346 Win=77056 Len=0 TSval=2304202522 TSecr=2304202522"
"453","32.859059380","127.0.0.1","127.0.0.1","TCP","1902","37740  >  8080 [PSH, ACK] Seq=698 Ack=2111 Win=77440 Len=1836 TSval=2304202522 TSecr=2304202518"
"454","32.859067970","127.0.0.1","127.0.0.1","TCP","66","8080  >  37740 [ACK] Seq=2111 Ack=2534 Win=85632 Len=0 TSval=2304202522 TSecr=2304202519"
"455","32.859354877","127.0.0.1","127.0.0.1","TCP","361","37756  >  8080 [PSH, ACK] Seq=350 Ack=1346 Win=77056 Len=295 TSval=2304202522 TSecr=2304202522"
"456","32.859369753","127.0.0.1","127.0.0.1","TCP","66","8080  >  37756 [ACK] Seq=1346 Ack=645 Win=65280 Len=0 TSval=2304202522 TSecr=2304202522"
"457","32.861590903","127.0.0.1","127.0.0.1","TCP","831","8080  >  37742 [PSH, ACK] Seq=1346 Ack=645 Win=65536 Len=765 TSval=2304202524 TSecr=2304202512"
"458","32.862446106","127.0.0.1","127.0.0.1","TCP","1411","8080  >  37772 [PSH, ACK] Seq=1 Ack=350 Win=65536 Len=1345 TSval=2304202525 TSecr=2304202470"
"459","32.862464823","127.0.0.1","127.0.0.1","TCP","66","37772  >  8080 [ACK] Seq=350 Ack=1346 Win=77056 Len=0 TSval=2304202525 TSecr=2304202525"
"460","32.862727634","127.0.0.1","127.0.0.1","TCP","119","37742  >  8080 [PSH, ACK] Seq=645 Ack=2111 Win=77440 Len=53 TSval=2304202526 TSecr=2304202524"
"461","32.863379041","127.0.0.1","127.0.0.1","TCP","831","8080  >  37756 [PSH, ACK] Seq=1346 Ack=645 Win=65536 Len=765 TSval=2304202526 TSecr=2304202522"
"462","32.863682988","127.0.0.1","127.0.0.1","TCP","361","37772  >  8080 [PSH, ACK] Seq=350 Ack=1346 Win=77056 Len=295 TSval=2304202527 TSecr=2304202525"
"463","32.863702893","127.0.0.1","127.0.0.1","TCP","66","8080  >  37772 [ACK] Seq=1346 Ack=645 Win=65280 Len=0 TSval=2304202527 TSecr=2304202527"
"464","32.864606774","127.0.0.1","127.0.0.1","TCP","119","37756  >  8080 [PSH, ACK] Seq=645 Ack=2111 Win=77440 Len=53 TSval=2304202527 TSecr=2304202526"
"465","32.865193997","127.0.0.1","127.0.0.1","TCP","1411","8080  >  37770 [PSH, ACK] Seq=1 Ack=350 Win=65536 Len=1345 TSval=2304202528 TSecr=2304202470"
"466","32.865220536","127.0.0.1","127.0.0.1","TCP","66","37770  >  8080 [ACK] Seq=350 Ack=1346 Win=77056 Len=0 TSval=2304202528 TSecr=2304202528"
"467","32.866050176","127.0.0.1","127.0.0.1","TCP","361","37770  >  8080 [PSH, ACK] Seq=350 Ack=1346 Win=77056 Len=295 TSval=2304202529 TSecr=2304202528"
"468","32.866073014","127.0.0.1","127.0.0.1","TCP","66","8080  >  37770 [ACK] Seq=1346 Ack=645 Win=65280 Len=0 TSval=2304202529 TSecr=2304202529"
"471","32.866780782","127.0.0.1","127.0.0.1","TCP","1903","37742  >  8080 [PSH, ACK] Seq=698 Ack=2111 Win=77440 Len=1837 TSval=2304202530 TSecr=2304202524"
"472","32.866793633","127.0.0.1","127.0.0.1","TCP","66","8080  >  37742 [ACK] Seq=2111 Ack=2535 Win=86272 Len=0 TSval=2304202530 TSecr=2304202526"
"473","32.866838471","127.0.0.1","127.0.0.1","TCP","831","8080  >  37772 [PSH, ACK] Seq=1346 Ack=645 Win=65536 Len=765 TSval=2304202530 TSecr=2304202527"
"474","32.867913672","127.0.0.1","127.0.0.1","TCP","120","37772  >  8080 [PSH, ACK] Seq=645 Ack=2111 Win=77440 Len=54 TSval=2304202531 TSecr=2304202530"
"475","32.867975621","127.0.0.1","127.0.0.1","TCP","1411","8080  >  37782 [PSH, ACK] Seq=1 Ack=350 Win=65536 Len=1345 TSval=2304202531 TSecr=2304202471"
"476","32.867989379","127.0.0.1","127.0.0.1","TCP","66","37782  >  8080 [ACK] Seq=350 Ack=1346 Win=77056 Len=0 TSval=2304202531 TSecr=2304202531"
"479","32.868197016","127.0.0.1","127.0.0.1","TCP","1903","37756  >  8080 [PSH, ACK] Seq=698 Ack=2111 Win=77440 Len=1837 TSval=2304202531 TSecr=2304202526"
"480","32.868205118","127.0.0.1","127.0.0.1","TCP","66","8080  >  37756 [ACK] Seq=2111 Ack=2535 Win=86272 Len=0 TSval=2304202531 TSecr=2304202527"
"481","32.868672424","127.0.0.1","127.0.0.1","TCP","361","37782  >  8080 [PSH, ACK] Seq=350 Ack=1346 Win=77056 Len=295 TSval=2304202532 TSecr=2304202531"
"482","32.868689535","127.0.0.1","127.0.0.1","TCP","66","8080  >  37782 [ACK] Seq=1346 Ack=645 Win=65280 Len=0 TSval=2304202532 TSecr=2304202532"
"485","32.871011047","127.0.0.1","127.0.0.1","TCP","1902","37772  >  8080 [PSH, ACK] Seq=699 Ack=2111 Win=77440 Len=1836 TSval=2304202534 TSecr=2304202530"
"486","32.871022221","127.0.0.1","127.0.0.1","TCP","66","8080  >  37772 [ACK] Seq=2111 Ack=2535 Win=86272 Len=0 TSval=2304202534 TSecr=2304202531"
"487","32.871071599","127.0.0.1","127.0.0.1","TCP","831","8080  >  37770 [PSH, ACK] Seq=1346 Ack=645 Win=65536 Len=765 TSval=2304202534 TSecr=2304202529"
"488","32.872103498","127.0.0.1","127.0.0.1","TCP","119","37770  >  8080 [PSH, ACK] Seq=645 Ack=2111 Win=77440 Len=53 TSval=2304202535 TSecr=2304202534"
"489","32.872211961","127.0.0.1","127.0.0.1","TCP","1411","8080  >  37796 [PSH, ACK] Seq=1 Ack=350 Win=65536 Len=1345 TSval=2304202535 TSecr=2304202472"
"490","32.872225860","127.0.0.1","127.0.0.1","TCP","66","37796  >  8080 [ACK] Seq=350 Ack=1346 Win=77056 Len=0 TSval=2304202535 TSecr=2304202535"
"491","32.872895913","127.0.0.1","127.0.0.1","TCP","361","37796  >  8080 [PSH, ACK] Seq=350 Ack=1346 Win=77056 Len=295 TSval=2304202536 TSecr=2304202535"
"492","32.872916866","127.0.0.1","127.0.0.1","TCP","66","8080  >  37796 [ACK] Seq=1346 Ack=645 Win=65280 Len=0 TSval=2304202536 TSecr=2304202536"
"495","32.875119509","127.0.0.1","127.0.0.1","TCP","1901","37770  >  8080 [PSH, ACK] Seq=698 Ack=2111 Win=77440 Len=1835 TSval=2304202538 TSecr=2304202534"
"496","32.875129915","127.0.0.1","127.0.0.1","TCP","66","8080  >  37770 [ACK] Seq=2111 Ack=2533 Win=86272 Len=0 TSval=2304202538 TSecr=2304202535"
"497","32.877890587","127.0.0.1","127.0.0.1","TCP","831","8080  >  37782 [PSH, ACK] Seq=1346 Ack=645 Win=65536 Len=765 TSval=2304202541 TSecr=2304202532"
"498","32.878753611","127.0.0.1","127.0.0.1","TCP","1411","8080  >  37794 [PSH, ACK] Seq=1 Ack=350 Win=65536 Len=1345 TSval=2304202542 TSecr=2304202472"
"499","32.878771700","127.0.0.1","127.0.0.1","TCP","66","37794  >  8080 [ACK] Seq=350 Ack=1346 Win=77056 Len=0 TSval=2304202542 TSecr=2304202542"
"500","32.878826525","127.0.0.1","127.0.0.1","TCP","119","37782  >  8080 [PSH, ACK] Seq=645 Ack=2111 Win=77440 Len=53 TSval=2304202542 TSecr=2304202541"
"501","32.879669714","127.0.0.1","127.0.0.1","TCP","361","37794  >  8080 [PSH, ACK] Seq=350 Ack=1346 Win=77056 Len=295 TSval=2304202543 TSecr=2304202542"
"502","32.879696813","127.0.0.1","127.0.0.1","TCP","66","8080  >  37794 [ACK] Seq=1346 Ack=645 Win=65280 Len=0 TSval=2304202543 TSecr=2304202543"
"503","32.882064071","127.0.0.1","127.0.0.1","TCP","831","8080  >  37796 [PSH, ACK] Seq=1346 Ack=645 Win=65536 Len=765 TSval=2304202545 TSecr=2304202536"
"506","32.882501973","127.0.0.1","127.0.0.1","TCP","1904","37782  >  8080 [PSH, ACK] Seq=698 Ack=2111 Win=77440 Len=1838 TSval=2304202545 TSecr=2304202541"
"507","32.882514265","127.0.0.1","127.0.0.1","TCP","66","8080  >  37782 [ACK] Seq=2111 Ack=2536 Win=86272 Len=0 TSval=2304202545 TSecr=2304202542"
"508","32.883292852","127.0.0.1","127.0.0.1","TCP","120","37796  >  8080 [PSH, ACK] Seq=645 Ack=2111 Win=77440 Len=54 TSval=2304202546 TSecr=2304202545"
"509","32.883903331","127.0.0.1","127.0.0.1","TCP","1411","8080  >  37804 [PSH, ACK] Seq=1 Ack=350 Win=65536 Len=1345 TSval=2304202547 TSecr=2304202474"
"510","32.883920791","127.0.0.1","127.0.0.1","TCP","66","37804  >  8080 [ACK] Seq=350 Ack=1346 Win=77056 Len=0 TSval=2304202547 TSecr=2304202547"
"511","32.884585328","127.0.0.1","127.0.0.1","TCP","361","37804  >  8080 [PSH, ACK] Seq=350 Ack=1346 Win=77056 Len=295 TSval=2304202547 TSecr=2304202547"
"512","32.884603347","127.0.0.1","127.0.0.1","TCP","66","8080  >  37804 [ACK] Seq=1346 Ack=645 Win=65280 Len=0 TSval=2304202547 TSecr=2304202547"
"515","32.886548067","127.0.0.1","127.0.0.1","TCP","1903","37796  >  8080 [PSH, ACK] Seq=699 Ack=2111 Win=77440 Len=1837 TSval=2304202549 TSecr=2304202545"
"516","32.886558194","127.0.0.1","127.0.0.1","TCP","66","8080  >  37796 [ACK] Seq=2111 Ack=2536 Win=86272 Len=0 TSval=2304202549 TSecr=2304202546"
"517","32.886850967","127.0.0.1","127.0.0.1","TCP","831","8080  >  37794 [PSH, ACK] Seq=1346 Ack=645 Win=65536 Len=765 TSval=2304202550 TSecr=2304202543"
"518","32.887638424","127.0.0.1","127.0.0.1","TCP","120","37794  >  8080 [PSH, ACK] Seq=645 Ack=2111 Win=77440 Len=54 TSval=2304202550 TSecr=2304202550"
"519","32.887766093","127.0.0.1","127.0.0.1","TCP","1411","8080  >  37806 [PSH, ACK] Seq=1 Ack=350 Win=65536 Len=1345 TSval=2304202551 TSecr=2304202475"
"520","32.887780061","127.0.0.1","127.0.0.1","TCP","66","37806  >  8080 [ACK] Seq=350 Ack=1346 Win=77056 Len=0 TSval=2304202551 TSecr=2304202551"
"521","32.888622412","127.0.0.1","127.0.0.1","TCP","361","37806  >  8080 [PSH, ACK] Seq=350 Ack=1346 Win=77056 Len=295 TSval=2304202551 TSecr=2304202551"
"522","32.888643085","127.0.0.1","127.0.0.1","TCP","66","8080  >  37806 [ACK] Seq=1346 Ack=645 Win=65280 Len=0 TSval=2304202552 TSecr=2304202551"
"525","32.890826941","127.0.0.1","127.0.0.1","TCP","1907","37794  >  8080 [PSH, ACK] Seq=699 Ack=2111 Win=77440 Len=1841 TSval=2304202554 TSecr=2304202550"
"526","32.890836789","127.0.0.1","127.0.0.1","TCP","66","8080  >  37794 [ACK] Seq=2111 Ack=2540 Win=86272 Len=0 TSval=2304202554 TSecr=2304202550"
"527","32.891152679","127.0.0.1","127.0.0.1","TCP","831","8080  >  37804 [PSH, ACK] Seq=1346 Ack=645 Win=65536 Len=765 TSval=2304202554 TSecr=2304202547"
"528","32.891910453","127.0.0.1","127.0.0.1","TCP","120","37804  >  8080 [PSH, ACK] Seq=645 Ack=2111 Win=77440 Len=54 TSval=2304202555 TSecr=2304202554"
"529","32.892083030","127.0.0.1","127.0.0.1","TCP","1411","8080  >  37808 [PSH, ACK] Seq=1 Ack=350 Win=65536 Len=1345 TSval=2304202555 TSecr=2304202480"
"530","32.892101328","127.0.0.1","127.0.0.1","TCP","66","37808  >  8080 [ACK] Seq=350 Ack=1346 Win=77056 Len=0 TSval=2304202555 TSecr=2304202555"
"531","32.892745820","127.0.0.1","127.0.0.1","TCP","361","37808  >  8080 [PSH, ACK] Seq=350 Ack=1346 Win=77056 Len=295 TSval=2304202556 TSecr=2304202555"
"532","32.892763420","127.0.0.1","127.0.0.1","TCP","66","8080  >  37808 [ACK] Seq=1346 Ack=645 Win=65280 Len=0 TSval=2304202556 TSecr=2304202556"
"535","32.894910260","127.0.0.1","127.0.0.1","TCP","1904","37804  >  8080 [PSH, ACK] Seq=699 Ack=2111 Win=77440 Len=1838 TSval=2304202558 TSecr=2304202554"
"536","32.894919828","127.0.0.1","127.0.0.1","TCP","66","8080  >  37804 [ACK] Seq=2111 Ack=2537 Win=86272 Len=0 TSval=2304202558 TSecr=2304202555"
"537","32.895257719","127.0.0.1","127.0.0.1","TCP","831","8080  >  37806 [PSH, ACK] Seq=1346 Ack=645 Win=65536 Len=765 TSval=2304202558 TSecr=2304202551"
"538","32.896055372","127.0.0.1","127.0.0.1","TCP","120","37806  >  8080 [PSH, ACK] Seq=645 Ack=2111 Win=77440 Len=54 TSval=2304202559 TSecr=2304202558"
"539","32.896165092","127.0.0.1","127.0.0.1","TCP","1411","8080  >  37818 [PSH, ACK] Seq=1 Ack=350 Win=65536 Len=1345 TSval=2304202559 TSecr=2304202481"
"540","32.896182063","127.0.0.1","127.0.0.1","TCP","66","37818  >  8080 [ACK] Seq=350 Ack=1346 Win=77056 Len=0 TSval=2304202559 TSecr=2304202559"
"541","32.896976015","127.0.0.1","127.0.0.1","TCP","361","37818  >  8080 [PSH, ACK] Seq=350 Ack=1346 Win=77056 Len=295 TSval=2304202560 TSecr=2304202559"
"542","32.896996059","127.0.0.1","127.0.0.1","TCP","66","8080  >  37818 [ACK] Seq=1346 Ack=645 Win=65280 Len=0 TSval=2304202560 TSecr=2304202560"
"543","32.899253877","127.0.0.1","127.0.0.1","TCP","831","8080  >  37808 [PSH, ACK] Seq=1346 Ack=645 Win=65536 Len=765 TSval=2304202562 TSecr=2304202556"
"546","32.899994609","127.0.0.1","127.0.0.1","TCP","1903","37806  >  8080 [PSH, ACK] Seq=699 Ack=2111 Win=77440 Len=1837 TSval=2304202563 TSecr=2304202558"
"547","32.900006622","127.0.0.1","127.0.0.1","TCP","66","8080  >  37806 [ACK] Seq=2111 Ack=2536 Win=86272 Len=0 TSval=2304202563 TSecr=2304202559"
"548","32.900493343","127.0.0.1","127.0.0.1","TCP","120","37808  >  8080 [PSH, ACK] Seq=645 Ack=2111 Win=77440 Len=54 TSval=2304202563 TSecr=2304202562"
"549","32.900573102","127.0.0.1","127.0.0.1","TCP","1411","8080  >  37820 [PSH, ACK] Seq=1 Ack=350 Win=65536 Len=1345 TSval=2304202563 TSecr=2304202492"
"550","32.900597197","127.0.0.1","127.0.0.1","TCP","66","37820  >  8080 [ACK] Seq=350 Ack=1346 Win=77056 Len=0 TSval=2304202563 TSecr=2304202563"
"551","32.901308247","127.0.0.1","127.0.0.1","TCP","361","37820  >  8080 [PSH, ACK] Seq=350 Ack=1346 Win=77056 Len=295 TSval=2304202564 TSecr=2304202563"
"552","32.901328641","127.0.0.1","127.0.0.1","TCP","66","8080  >  37820 [ACK] Seq=1346 Ack=645 Win=65280 Len=0 TSval=2304202564 TSecr=2304202564"
"555","32.903995796","127.0.0.1","127.0.0.1","TCP","1903","37808  >  8080 [PSH, ACK] Seq=699 Ack=2111 Win=77440 Len=1837 TSval=2304202567 TSecr=2304202562"
"556","32.904004945","127.0.0.1","127.0.0.1","TCP","66","8080  >  37808 [ACK] Seq=2111 Ack=2536 Win=86272 Len=0 TSval=2304202567 TSecr=2304202563"
"557","32.904086449","127.0.0.1","127.0.0.1","TCP","831","8080  >  37818 [PSH, ACK] Seq=1346 Ack=645 Win=65536 Len=765 TSval=2304202567 TSecr=2304202560"
"558","32.905161091","127.0.0.1","127.0.0.1","TCP","120","37818  >  8080 [PSH, ACK] Seq=645 Ack=2111 Win=77440 Len=54 TSval=2304202568 TSecr=2304202567"
"559","32.907276433","127.0.0.1","127.0.0.1","TCP","831","8080  >  37820 [PSH, ACK] Seq=1346 Ack=645 Win=65536 Len=765 TSval=2304202570 TSecr=2304202564"
"560","32.908045312","127.0.0.1","127.0.0.1","TCP","120","37820  >  8080 [PSH, ACK] Seq=645 Ack=2111 Win=77440 Len=54 TSval=2304202571 TSecr=2304202570"
"563","32.908542789","127.0.0.1","127.0.0.1","TCP","1903","37818  >  8080 [PSH, ACK] Seq=699 Ack=2111 Win=77440 Len=1837 TSval=2304202571 TSecr=2304202567"
"564","32.908561366","127.0.0.1","127.0.0.1","TCP","66","8080  >  37818 [ACK] Seq=2111 Ack=2536 Win=86272 Len=0 TSval=2304202571 TSecr=2304202568"
"566","32.911311911","127.0.0.1","127.0.0.1","TCP","1903","37820  >  8080 [PSH, ACK] Seq=699 Ack=2111 Win=77440 Len=1837 TSval=2304202574 TSecr=2304202570"
"567","32.911322876","127.0.0.1","127.0.0.1","TCP","66","8080  >  37820 [ACK] Seq=2111 Ack=2536 Win=86272 Len=0 TSval=2304202574 TSecr=2304202571"
"608","32.914531019","127.0.0.1","127.0.0.1","TCP","114","37756  >  8080 [PSH, ACK] Seq=2535 Ack=2111 Win=77440 Len=48 TSval=2304202577 TSecr=2304202531"
"609","32.914531019","127.0.0.1","127.0.0.1","TCP","115","37698  >  8080 [PSH, ACK] Seq=2534 Ack=2111 Win=77440 Len=49 TSval=2304202577 TSecr=2304202507"
"610","32.914531019","127.0.0.1","127.0.0.1","TCP","115","37714  >  8080 [PSH, ACK] Seq=2536 Ack=2111 Win=77440 Len=49 TSval=2304202577 TSecr=2304202510"
"611","32.914531019","127.0.0.1","127.0.0.1","TCP","115","37742  >  8080 [PSH, ACK] Seq=2535 Ack=2111 Win=77440 Len=49 TSval=2304202577 TSecr=2304202530"
"612","32.914531019","127.0.0.1","127.0.0.1","TCP","114","37740  >  8080 [PSH, ACK] Seq=2534 Ack=2111 Win=77440 Len=48 TSval=2304202577 TSecr=2304202522"
"613","32.914610149","127.0.0.1","127.0.0.1","TCP","114","37684  >  8080 [PSH, ACK] Seq=2531 Ack=2111 Win=77440 Len=48 TSval=2304202577 TSecr=2304202482"
"614","32.915071518","127.0.0.1","127.0.0.1","TCP","115","37668  >  8080 [PSH, ACK] Seq=2538 Ack=2111 Win=77440 Len=49 TSval=2304202578 TSecr=2304202475"
"615","32.915473871","127.0.0.1","127.0.0.1","TCP","114","37694  >  8080 [PSH, ACK] Seq=2529 Ack=2111 Win=77440 Len=48 TSval=2304202578 TSecr=2304202506"
"616","32.915767692","127.0.0.1","127.0.0.1","TCP","115","37770  >  8080 [PSH, ACK] Seq=2533 Ack=2111 Win=77440 Len=49 TSval=2304202579 TSecr=2304202538"
"617","32.916757897","127.0.0.1","127.0.0.1","TCP","114","37820  >  8080 [PSH, ACK] Seq=2536 Ack=2111 Win=77440 Len=48 TSval=2304202580 TSecr=2304202574"
"618","32.916816144","127.0.0.1","127.0.0.1","TCP","115","37670  >  8080 [PSH, ACK] Seq=2539 Ack=2111 Win=77440 Len=49 TSval=2304202580 TSecr=2304202477"
"619","32.916897788","127.0.0.1","127.0.0.1","TCP","114","37806  >  8080 [PSH, ACK] Seq=2536 Ack=2111 Win=77440 Len=48 TSval=2304202580 TSecr=2304202563"
"620","32.916933966","127.0.0.1","127.0.0.1","TCP","114","37772  >  8080 [PSH, ACK] Seq=2535 Ack=2111 Win=77440 Len=48 TSval=2304202580 TSecr=2304202534"
"621","32.917093831","127.0.0.1","127.0.0.1","TCP","114","37782  >  8080 [PSH, ACK] Seq=2536 Ack=2111 Win=77440 Len=48 TSval=2304202580 TSecr=2304202545"
"622","32.917789098","127.0.0.1","127.0.0.1","TCP","115","37728  >  8080 [PSH, ACK] Seq=2534 Ack=2111 Win=77440 Len=49 TSval=2304202581 TSecr=2304202512"
"623","32.917789098","127.0.0.1","127.0.0.1","TCP","114","37804  >  8080 [PSH, ACK] Seq=2537 Ack=2111 Win=77440 Len=48 TSval=2304202581 TSecr=2304202558"
"624","32.917789098","127.0.0.1","127.0.0.1","TCP","115","37808  >  8080 [PSH, ACK] Seq=2536 Ack=2111 Win=77440 Len=49 TSval=2304202581 TSecr=2304202567"
"625","32.917789098","127.0.0.1","127.0.0.1","TCP","114","37794  >  8080 [PSH, ACK] Seq=2540 Ack=2111 Win=77440 Len=48 TSval=2304202581 TSecr=2304202554"
"626","32.917898818","127.0.0.1","127.0.0.1","TCP","115","37818  >  8080 [PSH, ACK] Seq=2536 Ack=2111 Win=77440 Len=49 TSval=2304202581 TSecr=2304202571"
"627","32.918639970","127.0.0.1","127.0.0.1","TCP","115","37796  >  8080 [PSH, ACK] Seq=2536 Ack=2111 Win=77440 Len=49 TSval=2304202582 TSecr=2304202549"
"628","32.918928622","127.0.0.1","127.0.0.1","TCP","506","8080  >  37714 [PSH, ACK] Seq=2111 Ack=2585 Win=86272 Len=440 TSval=2304202582 TSecr=2304202577"
"629","32.919776631","127.0.0.1","127.0.0.1","TCP","504","8080  >  37740 [PSH, ACK] Seq=2111 Ack=2582 Win=85632 Len=438 TSval=2304202583 TSecr=2304202577"
"630","32.920275574","127.0.0.1","127.0.0.1","TCP","506","8080  >  37698 [PSH, ACK] Seq=2111 Ack=2583 Win=86272 Len=440 TSval=2304202583 TSecr=2304202577"
"631","32.921317321","127.0.0.1","127.0.0.1","TCP","506","8080  >  37742 [PSH, ACK] Seq=2111 Ack=2584 Win=86272 Len=440 TSval=2304202584 TSecr=2304202577"
"632","32.922322193","127.0.0.1","127.0.0.1","TCP","504","8080  >  37756 [PSH, ACK] Seq=2111 Ack=2583 Win=86272 Len=438 TSval=2304202585 TSecr=2304202577"
"633","32.923332022","127.0.0.1","127.0.0.1","TCP","504","8080  >  37684 [PSH, ACK] Seq=2111 Ack=2579 Win=85120 Len=438 TSval=2304202586 TSecr=2304202577"
"634","32.924128907","127.0.0.1","127.0.0.1","TCP","506","8080  >  37668 [PSH, ACK] Seq=2111 Ack=2587 Win=86272 Len=440 TSval=2304202587 TSecr=2304202578"
"635","32.924357217","127.0.0.1","127.0.0.1","TCP","617","37714  >  8080 [PSH, ACK] Seq=2585 Ack=2551 Win=77568 Len=551 TSval=2304202587 TSecr=2304202582"
"636","32.925043614","127.0.0.1","127.0.0.1","TCP","504","8080  >  37694 [PSH, ACK] Seq=2111 Ack=2577 Win=85760 Len=438 TSval=2304202588 TSecr=2304202578"
"637","32.925986187","127.0.0.1","127.0.0.1","TCP","583","37740  >  8080 [PSH, ACK] Seq=2582 Ack=2549 Win=77568 Len=517 TSval=2304202589 TSecr=2304202583"
"638","32.926467810","127.0.0.1","127.0.0.1","TCP","506","8080  >  37770 [PSH, ACK] Seq=2111 Ack=2582 Win=86272 Len=440 TSval=2304202589 TSecr=2304202579"
"639","32.927104200","127.0.0.1","127.0.0.1","TCP","585","37698  >  8080 [PSH, ACK] Seq=2583 Ack=2551 Win=77568 Len=519 TSval=2304202590 TSecr=2304202583"
"640","32.927921618","127.0.0.1","127.0.0.1","TCP","615","37756  >  8080 [PSH, ACK] Seq=2583 Ack=2549 Win=77568 Len=549 TSval=2304202591 TSecr=2304202585"
"641","32.928385851","127.0.0.1","127.0.0.1","TCP","585","37742  >  8080 [PSH, ACK] Seq=2584 Ack=2551 Win=77568 Len=519 TSval=2304202591 TSecr=2304202584"
"642","32.928745951","127.0.0.1","127.0.0.1","TCP","504","8080  >  37820 [PSH, ACK] Seq=2111 Ack=2584 Win=86272 Len=438 TSval=2304202592 TSecr=2304202580"
"643","32.929778130","127.0.0.1","127.0.0.1","TCP","506","8080  >  37670 [PSH, ACK] Seq=2111 Ack=2588 Win=86272 Len=440 TSval=2304202593 TSecr=2304202580"
"644","32.930395174","127.0.0.1","127.0.0.1","TCP","745","37684  >  8080 [PSH, ACK] Seq=2579 Ack=2549 Win=77568 Len=679 TSval=2304202593 TSecr=2304202586"
"645","32.930646532","127.0.0.1","127.0.0.1","TCP","502","8080  >  37806 [PSH, ACK] Seq=2111 Ack=2584 Win=86272 Len=436 TSval=2304202594 TSecr=2304202580"
"646","32.931470585","127.0.0.1","127.0.0.1","TCP","504","8080  >  37772 [PSH, ACK] Seq=2111 Ack=2583 Win=86272 Len=438 TSval=2304202594 TSecr=2304202580"
"647","32.931948227","127.0.0.1","127.0.0.1","TCP","581","37694  >  8080 [PSH, ACK] Seq=2577 Ack=2549 Win=77568 Len=515 TSval=2304202595 TSecr=2304202588"
"648","32.932346390","127.0.0.1","127.0.0.1","TCP","504","8080  >  37782 [PSH, ACK] Seq=2111 Ack=2584 Win=86272 Len=438 TSval=2304202595 TSecr=2304202580"
"649","32.932388504","127.0.0.1","127.0.0.1","TCP","683","37668  >  8080 [PSH, ACK] Seq=2587 Ack=2551 Win=77568 Len=617 TSval=2304202595 TSecr=2304202587"
"650","32.933120996","127.0.0.1","127.0.0.1","TCP","504","8080  >  37794 [PSH, ACK] Seq=2111 Ack=2588 Win=86272 Len=438 TSval=2304202596 TSecr=2304202581"
"651","32.933124418","127.0.0.1","127.0.0.1","TCP","585","37770  >  8080 [PSH, ACK] Seq=2582 Ack=2551 Win=77568 Len=519 TSval=2304202596 TSecr=2304202589"
"652","32.933958737","127.0.0.1","127.0.0.1","TCP","504","8080  >  37804 [PSH, ACK] Seq=2111 Ack=2585 Win=86272 Len=438 TSval=2304202597 TSecr=2304202581"
"653","32.934791940","127.0.0.1","127.0.0.1","TCP","506","8080  >  37728 [PSH, ACK] Seq=2111 Ack=2583 Win=85632 Len=440 TSval=2304202598 TSecr=2304202581"
"654","32.935935235","127.0.0.1","127.0.0.1","TCP","649","37820  >  8080 [PSH, ACK] Seq=2584 Ack=2549 Win=77568 Len=583 TSval=2304202599 TSecr=2304202592"
"655","32.936422096","127.0.0.1","127.0.0.1","TCP","506","8080  >  37808 [PSH, ACK] Seq=2111 Ack=2585 Win=86272 Len=440 TSval=2304202599 TSecr=2304202581"
"656","32.937049827","127.0.0.1","127.0.0.1","TCP","617","37670  >  8080 [PSH, ACK] Seq=2588 Ack=2551 Win=77568 Len=551 TSval=2304202600 TSecr=2304202593"
"657","32.937283235","127.0.0.1","127.0.0.1","TCP","506","8080  >  37818 [PSH, ACK] Seq=2111 Ack=2585 Win=86272 Len=440 TSval=2304202600 TSecr=2304202581"
"658","32.937788115","127.0.0.1","127.0.0.1","TCP","681","37806  >  8080 [PSH, ACK] Seq=2584 Ack=2547 Win=77568 Len=615 TSval=2304202601 TSecr=2304202594"
"659","32.938075091","127.0.0.1","127.0.0.1","TCP","506","8080  >  37796 [PSH, ACK] Seq=2111 Ack=2585 Win=86272 Len=440 TSval=2304202601 TSecr=2304202582"
